"Status","Start Time","Stop Time","Duration in ms","Parent Suite","Suite","Sub Suite","Test Class","Test Method","Name","Description"
"passed","Fri Nov 24 08:32:03 UTC 2023","Fri Nov 24 08:32:06 UTC 2023","3268","","CR: [FNN-744] CR Subscribe Negative","","CR: [FNN-744] CR Subscribe Negative","should subscribe as CR without data","should subscribe as CR without data",""
"passed","Fri Nov 24 08:31:29 UTC 2023","Fri Nov 24 08:31:42 UTC 2023","12864","","My Transactions: [FNN-710] Milestones project: In advance. Positive","","My Transactions: [FNN-710] Milestones project: In advance. Positive","should accept the project","should accept the project",""
"passed","Fri Nov 24 08:04:03 UTC 2023","Fri Nov 24 08:04:14 UTC 2023","11274","","My Profile: [FNN-690] Add resume Positive","","My Profile: [FNN-690] Add resume Positive","should add Certificate","should add Certificate",""
"passed","Fri Nov 24 08:15:17 UTC 2023","Fri Nov 24 08:15:40 UTC 2023","22717","","My Network: [FNN-620] Invite manually via email and sms Negative","","My Network: [FNN-620] Invite manually via email and sms Negative","should invite manually via sms without data","should invite manually via sms without data",""
"failed","Fri Nov 24 08:38:35 UTC 2023","Fri Nov 24 08:39:47 UTC 2023","72118","","Settings: [FNN-676] Change profile settings","","Settings: [FNN-676] Change profile settings","""before all"" hook for [FNN-676] Change profile settings","""before all"" hook for [FNN-676] Change profile settings",""
"passed","Fri Nov 24 08:36:49 UTC 2023","Fri Nov 24 08:36:58 UTC 2023","8855","","Subscribe: [FNN-577] Subscribe Negative","","Subscribe: [FNN-577] Subscribe Negative","should subscribe without agreeing to the Terms and Conditions","should subscribe without agreeing to the Terms and Conditions",""
"passed","Fri Nov 24 08:09:00 UTC 2023","Fri Nov 24 08:09:08 UTC 2023","8789","","Post Project: [FNN-649] Post project with account Negative","","Post Project: [FNN-649] Post project with account Negative","should post project without Category","should post project without Category",""
"passed","Fri Nov 24 08:33:23 UTC 2023","Fri Nov 24 08:33:41 UTC 2023","18182","","Login: [FNN-574] Log in from the Login page Negative","","Login: [FNN-574] Log in from the Login page Negative","should log in with valid email and invalid password","should log in with valid email and invalid password",""
"passed","Fri Nov 24 08:01:28 UTC 2023","Fri Nov 24 08:01:43 UTC 2023","15509","","Upgrade: [FNN-659] Upgrade account Negative","","Upgrade: [FNN-659] Upgrade account Negative","should upgrade account to Standard 1 month Cancelled","should upgrade account to Standard 1 month Cancelled",""
