"Status","Start Time","Stop Time","Duration in ms","Parent Suite","Suite","Sub Suite","Test Class","Test Method","Name","Description"
"passed","Tue May 14 04:34:35 UTC 2024","Tue May 14 04:34:41 UTC 2024","6223","","Search Project: [FNN-568] Project search","","Search Project: [FNN-568] Project search","should filter projects by Posted since Last 3 days","should filter projects by Posted since Last 3 days",""
"passed","Tue May 14 04:23:00 UTC 2024","Tue May 14 04:23:10 UTC 2024","10336","","My Profile: [FNN-730] Request reference Negative","","My Profile: [FNN-730] Request reference Negative","should pass step 2 with invalid website format","should pass step 2 with invalid website format",""
"failed","Tue May 14 05:04:45 UTC 2024","Tue May 14 05:04:47 UTC 2024","1851","","Subscribe: Subscribe Positive","","Subscribe: Subscribe Positive","[FNN-2373] Professional receives Welcome letter","[FNN-2373] Professional receives Welcome letter",""
"passed","Tue May 14 05:00:48 UTC 2024","Tue May 14 05:01:00 UTC 2024","11954","","CR: [FNN-744] CR Subscribe Negative","","CR: [FNN-744] CR Subscribe Negative","should subscribe as CR with wrong email format","should subscribe as CR with wrong email format",""
"passed","Tue May 14 04:18:28 UTC 2024","Tue May 14 04:21:26 UTC 2024","178104","","Upgrade: Upgrade Positive","","Upgrade: Upgrade Positive","[FNN-658] Upgrade account Positive: Enterprise 1 month","[FNN-658] Upgrade account Positive: Enterprise 1 month",""
"passed","Tue May 14 04:16:59 UTC 2024","Tue May 14 04:17:13 UTC 2024","13346","","My Profile: [FNN-690] Add resume Positive","","My Profile: [FNN-690] Add resume Positive","should add Certificate","should add Certificate",""
"failed","Tue May 14 05:07:57 UTC 2024","Tue May 14 05:08:25 UTC 2024","27715","","My Profile: [FNN-719] Add resume Negative","","My Profile: [FNN-719] Add resume Negative","should add education without period from","should add education without period from",""
"skipped","Tue May 14 05:23:03 UTC 2024","Tue May 14 05:23:03 UTC 2024","1","","My Transactions: [FNN-1431] Hourly project: In retrospect. Positive","","My Transactions: [FNN-1431] Hourly project: In retrospect. Positive","should verify that the money paid","should verify that the money paid",""
"passed","Tue May 14 04:09:13 UTC 2024","Tue May 14 04:09:48 UTC 2024","34182","","Login: [FNN-574] Log in from the Login page Negative","","Login: [FNN-574] Log in from the Login page Negative","should log in without credentials","should log in without credentials",""
"passed","Tue May 14 04:17:13 UTC 2024","Tue May 14 04:17:18 UTC 2024","5545","","My Profile: [FNN-690] Add resume Positive","","My Profile: [FNN-690] Add resume Positive","should add Motivation","should add Motivation",""
"passed","Tue May 14 04:12:42 UTC 2024","Tue May 14 04:12:55 UTC 2024","13142","","Subscribe: [FNN-577] Subscribe Negative","","Subscribe: [FNN-577] Subscribe Negative","should subscribe with taken email","should subscribe with taken email",""
"passed","Tue May 14 05:11:58 UTC 2024","Tue May 14 05:12:19 UTC 2024","20976","","Post Project: [FNN-588] Post project without account Negative","","Post Project: [FNN-588] Post project without account Negative","should post project with wrong phone number","should post project with wrong phone number",""
"broken","Tue May 14 05:23:04 UTC 2024","Tue May 14 05:23:16 UTC 2024","12451","","My Transactions: [FNN-1432] Milestones project: Start project. Negative","","My Transactions: [FNN-1432] Milestones project: Start project. Negative","should start project without Way of paying","should start project without Way of paying",""
"skipped","Tue May 14 05:24:40 UTC 2024","Tue May 14 05:24:40 UTC 2024","3","","My Transactions: [FNN-708] Hourly project: In advance. Positive","","My Transactions: [FNN-708] Hourly project: In advance. Positive","should close the period","should close the period",""
"skipped","Tue May 14 04:50:01 UTC 2024","Tue May 14 04:50:51 UTC 2024","50334","","[FNN-667] Send contact","","[FNN-667] Send contact","should check the contact as the second user","should check the contact as the second user",""
"passed","Tue May 14 04:27:16 UTC 2024","Tue May 14 04:28:10 UTC 2024","53993","","Post Project: [FNN-649] Post project with account Negative","","Post Project: [FNN-649] Post project with account Negative","should post project with short Description","should post project with short Description",""
"passed","Tue May 14 04:48:48 UTC 2024","Tue May 14 04:49:31 UTC 2024","42884","","[FNN-717] Edit email settings","","[FNN-717] Edit email settings","should edit Notification settings and verify that the settings are saved","should edit Notification settings and verify that the settings are saved",""
"passed","Tue May 14 05:02:44 UTC 2024","Tue May 14 05:02:48 UTC 2024","4091","","CR: [FNN-751] Invite to the organization manually Negative","","CR: [FNN-751] Invite to the organization manually Negative","should invite manually to the organization without first name","should invite manually to the organization without first name",""
"passed","Tue May 14 04:18:35 UTC 2024","Tue May 14 04:20:27 UTC 2024","112755","","My Profile: [FNN-713] Confirm phone number Negative","","My Profile: [FNN-713] Confirm phone number Negative","should confirm phone number with invalid code","should confirm phone number with invalid code",""
"passed","Tue May 14 04:46:28 UTC 2024","Tue May 14 04:46:39 UTC 2024","11498","","Create Profile: [FNN-684] Create profile Negative","","Create Profile: [FNN-684] Create profile Negative","should create profile without Profile picture","should create profile without Profile picture",""
"failed","Tue May 14 05:29:02 UTC 2024","Tue May 14 05:29:38 UTC 2024","36341","","CR: Invite Positive","","CR: Invite Positive","[FNN-750][FNN-2401] Accept manual invitation to organization","[FNN-750][FNN-2401] Accept manual invitation to organization",""
"passed","Tue May 14 05:09:40 UTC 2024","Tue May 14 05:10:37 UTC 2024","57338","","My Network: Invite via SMS","","My Network: Invite via SMS","[FNN-619]Invite manually via sms with signup bonus","[FNN-619]Invite manually via sms with signup bonus",""
"passed","Tue May 14 04:13:41 UTC 2024","Tue May 14 04:14:13 UTC 2024","31633","","Upgrade: [FNN-659] Upgrade account Negative","","Upgrade: [FNN-659] Upgrade account Negative","should upgrade account to Standard 1 month: Lost card decline","should upgrade account to Standard 1 month: Lost card decline",""
"passed","Tue May 14 04:50:38 UTC 2024","Tue May 14 04:51:11 UTC 2024","32542","","Freelancer search: [FNN-924] Freelancer search as CR user","","Freelancer search: [FNN-924] Freelancer search as CR user","should filter freelancers by Minimum references","should filter freelancers by Minimum references",""
"passed","Tue May 14 04:17:47 UTC 2024","Tue May 14 04:18:26 UTC 2024","39538","","My Profile: [FNN-690] Add resume Positive","","My Profile: [FNN-690] Add resume Positive","should check the attached part of the resume on the Profile page","should check the attached part of the resume on the Profile page",""
"passed","Tue May 14 04:38:58 UTC 2024","Tue May 14 04:40:40 UTC 2024","101849","","Freelancer search: [FNN-815] Freelancer search as non-CR user","","Freelancer search: [FNN-815] Freelancer search as non-CR user","should filter freelancers by Sector","should filter freelancers by Sector",""
"passed","Tue May 14 05:02:52 UTC 2024","Tue May 14 05:02:54 UTC 2024","1504","","CR: [FNN-751] Invite to the organization manually Negative","","CR: [FNN-751] Invite to the organization manually Negative","should invite manually to the organization without first step","should invite manually to the organization without first step",""
"passed","Tue May 14 04:46:39 UTC 2024","Tue May 14 04:47:31 UTC 2024","51157","","Create Profile: [FNN-684] Create profile Negative","","Create Profile: [FNN-684] Create profile Negative","should create profile without Description of yourself","should create profile without Description of yourself",""
"passed","Tue May 14 04:14:44 UTC 2024","Tue May 14 04:15:23 UTC 2024","39194","","Subscribe: [FNN-577] Subscribe Negative","","Subscribe: [FNN-577] Subscribe Negative","should subscribe without data","should subscribe without data",""
"passed","Tue May 14 04:09:52 UTC 2024","Tue May 14 04:10:51 UTC 2024","59210","","Login: [FNN-648] Log in from the Login page Positive","","Login: [FNN-648] Log in from the Login page Positive","should log in with valid credentials","should log in with valid credentials",""
"passed","Tue May 14 05:28:19 UTC 2024","Tue May 14 05:28:22 UTC 2024","2645","","CR: Invite Positive","","CR: Invite Positive","[FNN-749][FNN-2400] User receives the Invitation to organization letter","[FNN-749][FNN-2400] User receives the Invitation to organization letter",""
"passed","Tue May 14 04:12:55 UTC 2024","Tue May 14 04:13:09 UTC 2024","13608","","Subscribe: [FNN-577] Subscribe Negative","","Subscribe: [FNN-577] Subscribe Negative","should subscribe without phone number","should subscribe without phone number",""
"skipped","Tue May 14 05:22:23 UTC 2024","Tue May 14 05:22:23 UTC 2024","1","","My Transactions: [FNN-1430] Milestones project: In retrospect. Positive","","My Transactions: [FNN-1430] Milestones project: In retrospect. Positive","should verify that the money paid","should verify that the money paid",""
"passed","Tue May 14 05:10:40 UTC 2024","Tue May 14 05:11:27 UTC 2024","46305","","My Network: Invite via SMS","","My Network: Invite via SMS","[FNN-619][FNN-2451] Create a user and accept network invitation","[FNN-619][FNN-2451] Create a user and accept network invitation",""
"skipped","Tue May 14 05:22:23 UTC 2024","Tue May 14 05:22:23 UTC 2024","1","","My Transactions: [FNN-1430] Milestones project: In retrospect. Positive","","My Transactions: [FNN-1430] Milestones project: In retrospect. Positive","should accept the project and request payout","should accept the project and request payout",""
"skipped","Tue May 14 05:23:03 UTC 2024","Tue May 14 05:23:03 UTC 2024","5","","My Transactions: [FNN-1431] Hourly project: In retrospect. Positive","","My Transactions: [FNN-1431] Hourly project: In retrospect. Positive","should verify that the period is closed","should verify that the period is closed",""
"passed","Tue May 14 04:26:15 UTC 2024","Tue May 14 04:26:35 UTC 2024","19313","","Post Project: [FNN-649] Post project with account Negative","","Post Project: [FNN-649] Post project with account Negative","should post project without Start date","should post project without Start date",""
"passed","Tue May 14 04:36:54 UTC 2024","Tue May 14 04:37:28 UTC 2024","34159","","My Network: [FNN-620] Invite manually via email and sms Negative","","My Network: [FNN-620] Invite manually via email and sms Negative","should invite manually via sms without data","should invite manually via sms without data",""
"passed","Tue May 14 04:08:56 UTC 2024","Tue May 14 04:09:02 UTC 2024","6051","","Login: [FNN-574] Log in from the Login page Negative","","Login: [FNN-574] Log in from the Login page Negative","should log in with invalid credentials","should log in with invalid credentials",""
"passed","Tue May 14 04:48:52 UTC 2024","Tue May 14 04:50:38 UTC 2024","105697","","Freelancer search: [FNN-924] Freelancer search as CR user","","Freelancer search: [FNN-924] Freelancer search as CR user","should filter freelancers by Availability","should filter freelancers by Availability",""
"passed","Tue May 14 04:09:31 UTC 2024","Tue May 14 04:09:34 UTC 2024","3222","","Login: [FNN-563] Log in from the header Negative","","Login: [FNN-563] Log in from the header Negative","should log in without email","should log in without email",""
"passed","Tue May 14 04:33:22 UTC 2024","Tue May 14 04:34:26 UTC 2024","64117","","My Network: Invite via Email","","My Network: Invite via Email","[FNN-1233][FNN-2451] Create a user and accept network invitation","[FNN-1233][FNN-2451] Create a user and accept network invitation",""
"passed","Tue May 14 04:33:19 UTC 2024","Tue May 14 04:33:31 UTC 2024","12461","","Search Project: [FNN-568] Project search","","Search Project: [FNN-568] Project search","should filter projects by Location","should filter projects by Location",""
"passed","Tue May 14 04:12:27 UTC 2024","Tue May 14 04:12:42 UTC 2024","15032","","Subscribe: [FNN-577] Subscribe Negative","","Subscribe: [FNN-577] Subscribe Negative","should subscribe with wrong email format","should subscribe with wrong email format",""
"passed","Tue May 14 04:08:29 UTC 2024","Tue May 14 04:09:50 UTC 2024","81067","","Login: [FNN-647] Log in from the header Positive","","Login: [FNN-647] Log in from the header Positive","should log in with valid credentials","should log in with valid credentials",""
"passed","Tue May 14 04:12:57 UTC 2024","Tue May 14 04:13:02 UTC 2024","5227","","Reset password: Reset password Positive","","Reset password: Reset password Positive","[FNN-2397] User receives the Reset password letter","[FNN-2397] User receives the Reset password letter",""
"passed","Tue May 14 05:09:05 UTC 2024","Tue May 14 05:09:13 UTC 2024","7428","","My Profile: [FNN-719] Add resume Negative","","My Profile: [FNN-719] Add resume Negative","should add certificate without achieved annual","should add certificate without achieved annual",""
"broken","Tue May 14 05:18:02 UTC 2024","Tue May 14 05:23:04 UTC 2024","301578","","My Transactions: [FNN-1432] Milestones project: Start project. Negative","","My Transactions: [FNN-1432] Milestones project: Start project. Negative","should start project without milestone","should start project without milestone",""
"passed","Tue May 14 04:39:55 UTC 2024","Tue May 14 04:41:13 UTC 2024","78262","","My Projects: [FNN-1093] Pause project","","My Projects: [FNN-1093] Pause project","should verify status of the project as unregistered user","should verify status of the project as unregistered user",""
"passed","Tue May 14 05:07:00 UTC 2024","Tue May 14 05:07:10 UTC 2024","10278","","My Profile: [FNN-719] Add resume Negative","","My Profile: [FNN-719] Add resume Negative","should add experience without period from  ","should add experience without period from  ",""
"passed","Tue May 14 05:08:44 UTC 2024","Tue May 14 05:08:48 UTC 2024","4070","","Post Project: Post Project Positive","","Post Project: Post Project Positive","[FNN-650][FNN-2387] Professional receives Verify email letter","[FNN-650][FNN-2387] Professional receives Verify email letter",""
"broken","Tue May 14 05:12:46 UTC 2024","Tue May 14 05:16:24 UTC 2024","217334","","My Projects: [FNN-971] Complete project Positive","","My Projects: [FNN-971] Complete project Positive","""before all"" hook for [FNN-971] Complete project Positive","""before all"" hook for [FNN-971] Complete project Positive",""
"skipped","Tue May 14 04:50:01 UTC 2024","Tue May 14 04:50:01 UTC 2024","0","","[FNN-667] Send contact","","[FNN-667] Send contact","should check the contact as the first user","should check the contact as the first user",""
"passed","Tue May 14 05:28:37 UTC 2024","Tue May 14 05:28:45 UTC 2024","7672","","CR: Invite Positive","","CR: Invite Positive","[FNN-749][FNN-2405] Check the invited user is in the organization","[FNN-749][FNN-2405] Check the invited user is in the organization",""
"broken","Tue May 14 05:22:32 UTC 2024","Tue May 14 05:27:23 UTC 2024","291517","","My Transactions: [FNN-710] Milestones project: In advance. Positive","","My Transactions: [FNN-710] Milestones project: In advance. Positive","should start project with milestone","should start project with milestone",""
"passed","Tue May 14 05:09:00 UTC 2024","Tue May 14 05:09:05 UTC 2024","5362","","My Profile: [FNN-719] Add resume Negative","","My Profile: [FNN-719] Add resume Negative","should add certificate without organization","should add certificate without organization",""
"passed","Tue May 14 04:12:15 UTC 2024","Tue May 14 04:12:27 UTC 2024","12181","","Subscribe: [FNN-577] Subscribe Negative","","Subscribe: [FNN-577] Subscribe Negative","should subscribe without email","should subscribe without email",""
"passed","Tue May 14 04:36:41 UTC 2024","Tue May 14 04:36:43 UTC 2024","1989","","My Network: [FNN-620] Invite manually via email and sms Negative","","My Network: [FNN-620] Invite manually via email and sms Negative","should invite manually via email without data","should invite manually via email without data",""
"failed","Tue May 14 04:21:18 UTC 2024","Tue May 14 04:23:06 UTC 2024","107725","","My Profile: [FNN-793] Remove resume","","My Profile: [FNN-793] Remove resume","""before all"" hook for [FNN-793] Remove resume","""before all"" hook for [FNN-793] Remove resume",""
"passed","Tue May 14 05:28:45 UTC 2024","Tue May 14 05:28:59 UTC 2024","14096","","CR: Invite Positive","","CR: Invite Positive","[FNN-750] Invite to the organization through search","[FNN-750] Invite to the organization through search",""
"skipped","Tue May 14 05:23:03 UTC 2024","Tue May 14 05:23:03 UTC 2024","11","","My Transactions: [FNN-1431] Hourly project: In retrospect. Positive","","My Transactions: [FNN-1431] Hourly project: In retrospect. Positive","should close the period","should close the period",""
"passed","Tue May 14 05:07:46 UTC 2024","Tue May 14 05:07:51 UTC 2024","5472","","My Profile: [FNN-719] Add resume Negative","","My Profile: [FNN-719] Add resume Negative","should add education without institute","should add education without institute",""
"skipped","Tue May 14 05:24:40 UTC 2024","Tue May 14 05:24:40 UTC 2024","0","","My Transactions: [FNN-708] Hourly project: In advance. Positive","","My Transactions: [FNN-708] Hourly project: In advance. Positive","should pay deposit","should pay deposit",""
"passed","Tue May 14 05:02:06 UTC 2024","Tue May 14 05:02:17 UTC 2024","10717","","CR: [FNN-744] CR Subscribe Negative","","CR: [FNN-744] CR Subscribe Negative","should subscribe as CR without repeat password","should subscribe as CR without repeat password",""
"passed","Tue May 14 04:20:01 UTC 2024","Tue May 14 04:20:48 UTC 2024","47312","","My Profile: [FNN-699] Request reference Positive","","My Profile: [FNN-699] Request reference Positive","should check the validated reference","should check the validated reference",""
"passed","Tue May 14 04:34:04 UTC 2024","Tue May 14 04:34:22 UTC 2024","17955","","Search Project: [FNN-568] Project search","","Search Project: [FNN-568] Project search","should filter projects by Hourly rate","should filter projects by Hourly rate",""
"passed","Tue May 14 05:01:36 UTC 2024","Tue May 14 05:02:38 UTC 2024","62627","","CR: [FNN-751] Invite to the organization manually Negative","","CR: [FNN-751] Invite to the organization manually Negative","should invite manually to the organization without email","should invite manually to the organization without email",""
"passed","Tue May 14 05:14:28 UTC 2024","Tue May 14 05:16:42 UTC 2024","133610","","Freelancer search: [FNN-816] Create list Functionality","","Freelancer search: [FNN-816] Create list Functionality","should create a list of freelancers","should create a list of freelancers",""
"passed","Tue May 14 04:15:32 UTC 2024","Tue May 14 04:17:30 UTC 2024","118006","","My Profile: [FNN-695] Add portfolio Positive","","My Profile: [FNN-695] Add portfolio Positive","should add portfolio","should add portfolio",""
"passed","Tue May 14 04:34:41 UTC 2024","Tue May 14 04:34:48 UTC 2024","6688","","Search Project: [FNN-568] Project search","","Search Project: [FNN-568] Project search","should filter projects by Posted since Last 7 days","should filter projects by Posted since Last 7 days",""
"passed","Tue May 14 04:13:24 UTC 2024","Tue May 14 04:13:39 UTC 2024","15281","","Subscribe: [FNN-577] Subscribe Negative","","Subscribe: [FNN-577] Subscribe Negative","should subscribe with taken phone number","should subscribe with taken phone number",""
"passed","Tue May 14 05:09:34 UTC 2024","Tue May 14 05:10:34 UTC 2024","60600","","My Network: Invite via Email","","My Network: Invite via Email","[FNN-1232] Invite manually via email with custom message with signup bonus","[FNN-1232] Invite manually via email with custom message with signup bonus",""
"passed","Tue May 14 04:49:46 UTC 2024","Tue May 14 04:51:13 UTC 2024","87151","","[FNN-813] Change language","","[FNN-813] Change language","should change language to Dutch from the footer","should change language to Dutch from the footer",""
"broken","Tue May 14 05:29:01 UTC 2024","Tue May 14 05:29:13 UTC 2024","12258","","My Transactions: [FNN-738] Milestones project: Add milestone. Negative","","My Transactions: [FNN-738] Milestones project: Add milestone. Negative","should add milestone with Amount less than 250","should add milestone with Amount less than 250",""
"passed","Tue May 14 04:36:29 UTC 2024","Tue May 14 04:36:36 UTC 2024","6807","","My Network: [FNN-620] Invite manually via email and sms Negative","","My Network: [FNN-620] Invite manually via email and sms Negative","should invite manually via email without first name","should invite manually via email without first name",""
"passed","Tue May 14 04:20:53 UTC 2024","Tue May 14 04:22:34 UTC 2024","101091","","My Profile: [FNN-730] Request reference Negative","","My Profile: [FNN-730] Request reference Negative","should pass step 2 without data","should pass step 2 without data",""
"passed","Tue May 14 04:29:47 UTC 2024","Tue May 14 04:31:37 UTC 2024","110637","","Settings: [FNN-679] Delete account with subscription","","Settings: [FNN-679] Delete account with subscription","should delete account with subscription","should delete account with subscription",""
"passed","Tue May 14 04:17:34 UTC 2024","Tue May 14 04:17:47 UTC 2024","12527","","My Profile: [FNN-690] Add resume Positive","","My Profile: [FNN-690] Add resume Positive","should add Language","should add Language",""
"passed","Tue May 14 04:46:59 UTC 2024","Tue May 14 04:47:39 UTC 2024","39355","","Freelancer search: [FNN-924] Freelancer search as CR user","","Freelancer search: [FNN-924] Freelancer search as CR user","should filter freelancers by Location","should filter freelancers by Location",""
"passed","Tue May 14 05:11:37 UTC 2024","Tue May 14 05:11:58 UTC 2024","20974","","Post Project: [FNN-588] Post project without account Negative","","Post Project: [FNN-588] Post project without account Negative","should post project with taken phone number","should post project with taken phone number",""
"passed","Tue May 14 04:08:28 UTC 2024","Tue May 14 04:09:22 UTC 2024","53563","","Login: [FNN-563] Log in from the header Negative","","Login: [FNN-563] Log in from the header Negative","should log in with valid email and invalid password","should log in with valid email and invalid password",""
"passed","Tue May 14 04:22:34 UTC 2024","Tue May 14 04:22:41 UTC 2024","7031","","My Profile: [FNN-730] Request reference Negative","","My Profile: [FNN-730] Request reference Negative","should pass step 2 without first name","should pass step 2 without first name",""
"skipped","Tue May 14 05:27:23 UTC 2024","Tue May 14 05:27:23 UTC 2024","0","","My Transactions: [FNN-710] Milestones project: In advance. Positive","","My Transactions: [FNN-710] Milestones project: In advance. Positive","should approve milestone","should approve milestone",""
"passed","Tue May 14 04:11:18 UTC 2024","Tue May 14 04:12:39 UTC 2024","81380","","Upgrade: [FNN-659] Upgrade account Negative","","Upgrade: [FNN-659] Upgrade account Negative","should upgrade account to Standard 1 month without required fields","should upgrade account to Standard 1 month without required fields",""
"passed","Tue May 14 04:16:46 UTC 2024","Tue May 14 04:16:59 UTC 2024","12794","","My Profile: [FNN-690] Add resume Positive","","My Profile: [FNN-690] Add resume Positive","should add Education","should add Education",""
"passed","Tue May 14 05:01:15 UTC 2024","Tue May 14 05:01:26 UTC 2024","11692","","CR: [FNN-744] CR Subscribe Negative","","CR: [FNN-744] CR Subscribe Negative","should subscribe as CR without phone number","should subscribe as CR without phone number",""
"passed","Tue May 14 04:24:16 UTC 2024","Tue May 14 04:24:27 UTC 2024","11504","","My Profile: [FNN-730] Request reference Negative","","My Profile: [FNN-730] Request reference Negative","should pass step 3 without 4 rating","should pass step 3 without 4 rating",""
"passed","Tue May 14 05:09:13 UTC 2024","Tue May 14 05:09:16 UTC 2024","3524","","My Profile: [FNN-719] Add resume Negative","","My Profile: [FNN-719] Add resume Negative","should add language without levels","should add language without levels",""
"passed","Tue May 14 04:36:21 UTC 2024","Tue May 14 04:36:29 UTC 2024","7700","","My Network: [FNN-620] Invite manually via email and sms Negative","","My Network: [FNN-620] Invite manually via email and sms Negative","should invite manually via email with wrong email format","should invite manually via email with wrong email format",""
"skipped","Tue May 14 05:24:40 UTC 2024","Tue May 14 05:24:40 UTC 2024","4","","My Transactions: [FNN-708] Hourly project: In advance. Positive","","My Transactions: [FNN-708] Hourly project: In advance. Positive","should add hours","should add hours",""
"passed","Tue May 14 04:13:53 UTC 2024","Tue May 14 04:14:07 UTC 2024","13675","","Subscribe: [FNN-577] Subscribe Negative","","Subscribe: [FNN-577] Subscribe Negative","should subscribe without repeat password","should subscribe without repeat password",""
"passed","Tue May 14 05:10:37 UTC 2024","Tue May 14 05:10:40 UTC 2024","3432","","My Network: Invite via SMS","","My Network: Invite via SMS","[FNN-2455] Invite manually via sms with signup bonus","[FNN-2455] Invite manually via sms with signup bonus",""
"passed","Tue May 14 04:23:40 UTC 2024","Tue May 14 04:24:25 UTC 2024","44668","","Post Project: [FNN-649] Post project with account Negative","","Post Project: [FNN-649] Post project with account Negative","should post project without step 1","should post project without step 1",""
