"Status","Start Time","Stop Time","Duration in ms","Parent Suite","Suite","Sub Suite","Test Class","Test Method","Name","Description"
"passed","Tue May 14 04:09:57 UTC 2024","Tue May 14 04:11:11 UTC 2024","73639","","Login: [FNN-685] Log out","","Login: [FNN-685] Log out","should log out","should log out",""
"passed","Tue May 14 04:25:36 UTC 2024","Tue May 14 04:25:56 UTC 2024","19546","","Post Project: [FNN-649] Post project with account Negative","","Post Project: [FNN-649] Post project with account Negative","should post project without Work on location","should post project without Work on location",""
"passed","Tue May 14 05:12:19 UTC 2024","Tue May 14 05:12:41 UTC 2024","22729","","Post Project: [FNN-588] Post project without account Negative","","Post Project: [FNN-588] Post project without account Negative","should post project without password","should post project without password",""
"passed","Tue May 14 04:44:13 UTC 2024","Tue May 14 04:44:16 UTC 2024","3417","","Freelancer search: [FNN-822] Send message","","Freelancer search: [FNN-822] Send message","should check the message as the CR user","should check the message as the CR user",""
"failed","Tue May 14 05:29:38 UTC 2024","Tue May 14 05:31:19 UTC 2024","100744","","CR: Invite Positive","","CR: Invite Positive","[FNN-750][FNN-2405] Check the invited user is in the organization","[FNN-750][FNN-2405] Check the invited user is in the organization",""
"broken","Tue May 14 05:19:15 UTC 2024","Tue May 14 05:24:40 UTC 2024","324942","","My Transactions: [FNN-708] Hourly project: In advance. Positive","","My Transactions: [FNN-708] Hourly project: In advance. Positive","should start hourly project","should start hourly project",""
"passed","Tue May 14 05:09:31 UTC 2024","Tue May 14 05:09:52 UTC 2024","21109","","Post Project: [FNN-588] Post project without account Negative","","Post Project: [FNN-588] Post project without account Negative","should post project without last name","should post project without last name",""
"broken","Tue May 14 05:29:01 UTC 2024","Tue May 14 05:29:13 UTC 2024","11841","","My Transactions: [FNN-737] Hourly project: Start project. Negative","","My Transactions: [FNN-737] Hourly project: Start project. Negative","should start project without Way of paying","should start project without Way of paying",""
"passed","Tue May 14 04:09:27 UTC 2024","Tue May 14 04:09:31 UTC 2024","3977","","Login: [FNN-563] Log in from the header Negative","","Login: [FNN-563] Log in from the header Negative","should log in with wrong email format","should log in with wrong email format",""
"passed","Tue May 14 04:36:43 UTC 2024","Tue May 14 04:36:48 UTC 2024","4710","","My Network: [FNN-620] Invite manually via email and sms Negative","","My Network: [FNN-620] Invite manually via email and sms Negative","should invite manually via sms without phone number","should invite manually via sms without phone number",""
"broken","Tue May 14 05:28:24 UTC 2024","Tue May 14 05:28:37 UTC 2024","12166","","My Transactions: [FNN-738] Milestones project: Add milestone. Negative","","My Transactions: [FNN-738] Milestones project: Add milestone. Negative","should add milestone without Amount","should add milestone without Amount",""
"passed","Tue May 14 04:08:24 UTC 2024","Tue May 14 04:08:56 UTC 2024","31805","","Login: [FNN-574] Log in from the Login page Negative","","Login: [FNN-574] Log in from the Login page Negative","should log in with valid email and invalid password","should log in with valid email and invalid password",""
"skipped","Tue May 14 04:37:51 UTC 2024","Tue May 14 04:37:51 UTC 2024","0","","My Network: [FNN-1027] Invite freelancers","","My Network: [FNN-1027] Invite freelancers","should accept an invitation","should accept an invitation",""
"skipped","Tue May 14 04:47:27 UTC 2024","Tue May 14 04:50:01 UTC 2024","153425","","[FNN-667] Send contact","","[FNN-667] Send contact","should send a contact","should send a contact",""
"failed","Tue May 14 05:08:39 UTC 2024","Tue May 14 05:08:44 UTC 2024","5086","","Post Project: Post Project Positive","","Post Project: Post Project Positive","[FNN-2426] User receives the Employer welcome letter","[FNN-2426] User receives the Employer welcome letter",""
"passed","Tue May 14 05:04:25 UTC 2024","Tue May 14 05:04:45 UTC 2024","20577","","Subscribe: Subscribe Positive","","Subscribe: Subscribe Positive","[FNN-578] Subscribe with valid credentials","[FNN-578] Subscribe with valid credentials",""
"skipped","Tue May 14 05:22:23 UTC 2024","Tue May 14 05:22:23 UTC 2024","0","","My Transactions: [FNN-1430] Milestones project: In retrospect. Positive","","My Transactions: [FNN-1430] Milestones project: In retrospect. Positive","should approve milestone and pay for it","should approve milestone and pay for it",""
"passed","Tue May 14 05:00:25 UTC 2024","Tue May 14 05:00:37 UTC 2024","12250","","CR: [FNN-744] CR Subscribe Negative","","CR: [FNN-744] CR Subscribe Negative","should subscribe as CR without last name","should subscribe as CR without last name",""
"passed","Tue May 14 04:40:40 UTC 2024","Tue May 14 04:41:00 UTC 2024","20000","","Freelancer search: [FNN-815] Freelancer search as non-CR user","","Freelancer search: [FNN-815] Freelancer search as non-CR user","should filter freelancers by Location","should filter freelancers by Location",""
"failed","Tue May 14 05:02:45 UTC 2024","Tue May 14 05:04:41 UTC 2024","115548","","CR: [FNN-1888] My Dashboard page integrity as Freelancer","","CR: [FNN-1888] My Dashboard page integrity as Freelancer","should verify the integrity of the My Dashboard page as freelancer","should verify the integrity of the My Dashboard page as freelancer",""
"passed","Tue May 14 04:13:09 UTC 2024","Tue May 14 04:13:24 UTC 2024","14777","","Subscribe: [FNN-577] Subscribe Negative","","Subscribe: [FNN-577] Subscribe Negative","should subscribe with wrong phone number","should subscribe with wrong phone number",""
"passed","Tue May 14 04:26:55 UTC 2024","Tue May 14 04:27:16 UTC 2024","21063","","Post Project: [FNN-649] Post project with account Negative","","Post Project: [FNN-649] Post project with account Negative","should post project without Description","should post project without Description",""
"passed","Tue May 14 05:02:48 UTC 2024","Tue May 14 05:02:52 UTC 2024","4263","","CR: [FNN-751] Invite to the organization manually Negative","","CR: [FNN-751] Invite to the organization manually Negative","should invite manually to the organization without last name","should invite manually to the organization without last name",""
"broken","Tue May 14 05:28:49 UTC 2024","Tue May 14 05:29:01 UTC 2024","11998","","My Transactions: [FNN-737] Hourly project: Start project. Negative","","My Transactions: [FNN-737] Hourly project: Start project. Negative","should start project with Hourly rate rate than 25","should start project with Hourly rate rate than 25",""
"passed","Tue May 14 04:20:34 UTC 2024","Tue May 14 04:21:11 UTC 2024","36972","","My Profile: [FNN-718] Add portfolio Negative","","My Profile: [FNN-718] Add portfolio Negative","should add portfolio without Type","should add portfolio without Type",""
"passed","Tue May 14 04:15:43 UTC 2024","Tue May 14 04:16:12 UTC 2024","28313","","Upgrade: [FNN-659] Upgrade account Negative","","Upgrade: [FNN-659] Upgrade account Negative","should upgrade account to Standard 1 month: Processing error decline","should upgrade account to Standard 1 month: Processing error decline",""
"passed","Tue May 14 04:34:48 UTC 2024","Tue May 14 04:34:54 UTC 2024","6412","","Search Project: [FNN-568] Project search","","Search Project: [FNN-568] Project search","should filter projects by Posted since Last 30 days","should filter projects by Posted since Last 30 days",""
"failed","Tue May 14 05:08:25 UTC 2024","Tue May 14 05:08:50 UTC 2024","25592","","My Profile: [FNN-719] Add resume Negative","","My Profile: [FNN-719] Add resume Negative","should add education without period to","should add education without period to",""
"passed","Tue May 14 05:05:56 UTC 2024","Tue May 14 05:06:00 UTC 2024","4029","","My Profile: [FNN-668] Edit account details Negative","","My Profile: [FNN-668] Edit account details Negative","should edit account details with invalid phone number","should edit account details with invalid phone number",""
"passed","Tue May 14 04:09:02 UTC 2024","Tue May 14 04:09:07 UTC 2024","5222","","Login: [FNN-574] Log in from the Login page Negative","","Login: [FNN-574] Log in from the Login page Negative","should log in with wrong email format","should log in with wrong email format",""
"broken","Tue May 14 04:23:26 UTC 2024","Tue May 14 04:23:55 UTC 2024","28435","","My Profile: [FNN-730] Request reference Negative","","My Profile: [FNN-730] Request reference Negative","should pass step 3 without 1 rating","should pass step 3 without 1 rating",""
"skipped","Tue May 14 05:24:40 UTC 2024","Tue May 14 05:24:40 UTC 2024","4","","My Transactions: [FNN-708] Hourly project: In advance. Positive","","My Transactions: [FNN-708] Hourly project: In advance. Positive","should verify that the money paid","should verify that the money paid",""
"broken","Tue May 14 05:23:24 UTC 2024","Tue May 14 05:28:24 UTC 2024","300078","","My Transactions: [FNN-738] Milestones project: Add milestone. Negative","","My Transactions: [FNN-738] Milestones project: Add milestone. Negative","should add milestone without Amount, Delivery date, and Description","should add milestone without Amount, Delivery date, and Description",""
"failed","Tue May 14 05:11:27 UTC 2024","Tue May 14 05:12:37 UTC 2024","69863","","My Network: Invite via SMS","","My Network: Invite via SMS","[FNN-619][FNN-2452] Checks earnings from the invitation bonus for registration","[FNN-619][FNN-2452] Checks earnings from the invitation bonus for registration",""
"passed","Tue May 14 04:14:07 UTC 2024","Tue May 14 04:14:20 UTC 2024","13472","","Subscribe: [FNN-577] Subscribe Negative","","Subscribe: [FNN-577] Subscribe Negative","should subscribe with short password","should subscribe with short password",""
"passed","Tue May 14 05:14:09 UTC 2024","Tue May 14 05:14:41 UTC 2024","31345","","My Network: [FNN-664] Invite freelancer","","My Network: [FNN-664] Invite freelancer","should accept an invitation","should accept an invitation",""
"passed","Tue May 14 04:13:09 UTC 2024","Tue May 14 04:13:41 UTC 2024","31948","","Upgrade: [FNN-659] Upgrade account Negative","","Upgrade: [FNN-659] Upgrade account Negative","should upgrade account to Standard 1 month: Insufficient funds decline","should upgrade account to Standard 1 month: Insufficient funds decline",""
"passed","Tue May 14 04:33:31 UTC 2024","Tue May 14 04:34:04 UTC 2024","33015","","Search Project: [FNN-568] Project search","","Search Project: [FNN-568] Project search","should filter projects by Fixed price","should filter projects by Fixed price",""
"broken","Tue May 14 05:18:49 UTC 2024","Tue May 14 05:24:30 UTC 2024","341319","","My Transactions: [FNN-1439] Hourly project: Add time. Negative","","My Transactions: [FNN-1439] Hourly project: Add time. Negative","""before all"" hook for [FNN-1439] Hourly project: Add time. Negative","""before all"" hook for [FNN-1439] Hourly project: Add time. Negative",""
"passed","Tue May 14 04:44:13 UTC 2024","Tue May 14 04:44:30 UTC 2024","17148","","Freelancer search: [FNN-817] Add note","","Freelancer search: [FNN-817] Add note","should add a note via the action ""Add note""","should add a note via the action ""Add note""",""
"passed","Tue May 14 04:28:21 UTC 2024","Tue May 14 04:29:59 UTC 2024","98142","","Settings: [FNN-677] Downgrade to ""Stand-by Standaard""","","Settings: [FNN-677] Downgrade to ""Stand-by Standaard""","should downgrade to ""Stand-by Standaard""","should downgrade to ""Stand-by Standaard""",""
