"Status","Start Time","Stop Time","Duration in ms","Parent Suite","Suite","Sub Suite","Test Class","Test Method","Name","Description"
"passed","Sun Mar 31 04:34:21 UTC 2024","Sun Mar 31 04:34:52 UTC 2024","30961","","My Network: [FNN-620] Invite manually via email and sms Negative","","My Network: [FNN-620] Invite manually via email and sms Negative","should invite manually via sms without data","should invite manually via sms without data",""
"passed","Sun Mar 31 04:56:16 UTC 2024","Sun Mar 31 04:57:18 UTC 2024","62379","","CR: [FNN-751] Invite to the organization manually Negative","","CR: [FNN-751] Invite to the organization manually Negative","should invite manually to the organization without email","should invite manually to the organization without email",""
"passed","Sun Mar 31 05:15:01 UTC 2024","Sun Mar 31 05:15:48 UTC 2024","47286","","[FNN-743] Archive and restore message","","[FNN-743] Archive and restore message","should restore the message","should restore the message",""
"passed","Sun Mar 31 04:15:28 UTC 2024","Sun Mar 31 04:15:41 UTC 2024","13258","","My Profile: [FNN-690] Add resume Positive","","My Profile: [FNN-690] Add resume Positive","should add Certificate","should add Certificate",""
"passed","Sun Mar 31 04:28:38 UTC 2024","Sun Mar 31 04:29:53 UTC 2024","74909","","Settings: [FNN-676] Change profile settings","","Settings: [FNN-676] Change profile settings","i don't want to display my profile in the database","i don't want to display my profile in the database",""
"passed","Sun Mar 31 05:03:06 UTC 2024","Sun Mar 31 05:03:12 UTC 2024","6724","","My Profile: [FNN-730] Request reference Negative","","My Profile: [FNN-730] Request reference Negative","should pass step 2 without phone","should pass step 2 without phone",""
"passed","Sun Mar 31 05:01:07 UTC 2024","Sun Mar 31 05:03:51 UTC 2024","163693","","My Profile: [FNN-669] Edit account details Positive","","My Profile: [FNN-669] Edit account details Positive","should edit employer account details with valid information","should edit employer account details with valid information",""
"passed","Sun Mar 31 04:16:00 UTC 2024","Sun Mar 31 04:16:29 UTC 2024","29188","","Upgrade: [FNN-659] Upgrade account Negative","","Upgrade: [FNN-659] Upgrade account Negative","should upgrade account to Standard 1 month: Processing error decline","should upgrade account to Standard 1 month: Processing error decline",""
"passed","Sun Mar 31 05:02:32 UTC 2024","Sun Mar 31 05:02:39 UTC 2024","6892","","My Profile: [FNN-719] Add resume Negative","","My Profile: [FNN-719] Add resume Negative","should add education without institute","should add education without institute",""
"passed","Sun Mar 31 05:04:33 UTC 2024","Sun Mar 31 05:04:57 UTC 2024","23858","","Post Project: [FNN-588] Post project without account Negative","","Post Project: [FNN-588] Post project without account Negative","should post project with short password and repeat password","should post project with short password and repeat password",""
"failed","Sun Mar 31 04:58:10 UTC 2024","Sun Mar 31 05:00:14 UTC 2024","124200","","CR: [FNN-1888] My Dashboard page integrity as Freelancer","","CR: [FNN-1888] My Dashboard page integrity as Freelancer","should verify the integrity of the My Dashboard page as freelancer","should verify the integrity of the My Dashboard page as freelancer",""
"broken","Sun Mar 31 05:12:33 UTC 2024","Sun Mar 31 05:15:01 UTC 2024","148271","","[FNN-743] Archive and restore message","","[FNN-743] Archive and restore message","""before all"" hook for [FNN-743] Archive and restore message","""before all"" hook for [FNN-743] Archive and restore message",""
"skipped","Sun Mar 31 05:21:43 UTC 2024","Sun Mar 31 05:21:43 UTC 2024","1","","My Transactions: [FNN-710] Milestones project: In advance. Positive","","My Transactions: [FNN-710] Milestones project: In advance. Positive","should request payout","should request payout",""
"skipped","Sun Mar 31 05:21:43 UTC 2024","Sun Mar 31 05:21:43 UTC 2024","4","","My Transactions: [FNN-710] Milestones project: In advance. Positive","","My Transactions: [FNN-710] Milestones project: In advance. Positive","should pay deposit","should pay deposit",""
"broken","Sun Mar 31 05:15:34 UTC 2024","Sun Mar 31 05:20:18 UTC 2024","284428","","My Transactions: [FNN-1439] Hourly project: Add time. Negative","","My Transactions: [FNN-1439] Hourly project: Add time. Negative","""before all"" hook for [FNN-1439] Hourly project: Add time. Negative","""before all"" hook for [FNN-1439] Hourly project: Add time. Negative",""
"passed","Sun Mar 31 04:57:31 UTC 2024","Sun Mar 31 04:57:33 UTC 2024","1355","","CR: [FNN-751] Invite to the organization manually Negative","","CR: [FNN-751] Invite to the organization manually Negative","should invite manually to the organization without first step","should invite manually to the organization without first step",""
"broken","Sun Mar 31 05:24:11 UTC 2024","Sun Mar 31 05:24:13 UTC 2024","1767","","My Transactions: [FNN-737] Hourly project: Start project. Negative","","My Transactions: [FNN-737] Hourly project: Start project. Negative","should start project without Hours per period","should start project without Hours per period",""
"passed","Sun Mar 31 04:46:47 UTC 2024","Sun Mar 31 04:47:18 UTC 2024","30918","","Freelancer search: [FNN-924] Freelancer search as CR user","","Freelancer search: [FNN-924] Freelancer search as CR user","should filter freelancers by Minimum references","should filter freelancers by Minimum references",""
"passed","Sun Mar 31 04:30:04 UTC 2024","Sun Mar 31 04:31:06 UTC 2024","61803","","My Network: [FNN-1233] Invite manually via email without custom message with signup bonus","","My Network: [FNN-1233] Invite manually via email without custom message with signup bonus","should invite manually via email with valid recipient data and without message","should invite manually via email with valid recipient data and without message",""
"passed","Sun Mar 31 05:11:42 UTC 2024","Sun Mar 31 05:13:46 UTC 2024","124763","","Freelancer search: [FNN-822] Send message","","Freelancer search: [FNN-822] Send message","should send a message via the ""Send message"" action","should send a message via the ""Send message"" action",""
"passed","Sun Mar 31 04:24:57 UTC 2024","Sun Mar 31 04:25:55 UTC 2024","58162","","Settings: [FNN-673] Confirm email address","","Settings: [FNN-673] Confirm email address","should confirm email address","should confirm email address",""
"passed","Sun Mar 31 04:11:47 UTC 2024","Sun Mar 31 04:11:53 UTC 2024","5945","","Reset password: [FNN-655] Reset password Negative","","Reset password: [FNN-655] Reset password Negative","should reset password without data","should reset password without data",""
"passed","Sun Mar 31 04:32:18 UTC 2024","Sun Mar 31 04:32:24 UTC 2024","6527","","Search Project: [FNN-568] Project search","","Search Project: [FNN-568] Project search","should filter projects by Posted since Last 7 days","should filter projects by Posted since Last 7 days",""
"passed","Sun Mar 31 04:57:43 UTC 2024","Sun Mar 31 04:58:33 UTC 2024","50475","","CR: [FNN-749] Invite to the organization manually Positive","","CR: [FNN-749] Invite to the organization manually Positive","should check organization page as the inviting user","should check organization page as the inviting user",""
"passed","Sun Mar 31 04:11:08 UTC 2024","Sun Mar 31 04:11:40 UTC 2024","32136","","Login: [FNN-574] Log in from the Login page Negative","","Login: [FNN-574] Log in from the Login page Negative","should log in without credentials","should log in without credentials",""
"skipped","Sun Mar 31 04:08:08 UTC 2024","Sun Mar 31 04:08:08 UTC 2024","0","","Subscribe","","Subscribe","[FNN-2373] Professional receives Welcome letter","[FNN-2373] Professional receives Welcome letter",""
"skipped","Sun Mar 31 04:45:11 UTC 2024","Sun Mar 31 04:45:58 UTC 2024","47368","","[FNN-667] Send contact","","[FNN-667] Send contact","should check the contact as the second user","should check the contact as the second user",""
"passed","Sun Mar 31 05:02:04 UTC 2024","Sun Mar 31 05:02:50 UTC 2024","46355","","Post Project: [FNN-650] Post project without account Positive","","Post Project: [FNN-650] Post project without account Positive","should post a project as an unregistered user with valid project data","should post a project as an unregistered user with valid project data",""
"passed","Sun Mar 31 05:04:23 UTC 2024","Sun Mar 31 05:04:33 UTC 2024","9810","","My Profile: [FNN-730] Request reference Negative","","My Profile: [FNN-730] Request reference Negative","should pass step 3 without 3 rating","should pass step 3 without 3 rating",""
"passed","Sun Mar 31 05:04:08 UTC 2024","Sun Mar 31 05:04:14 UTC 2024","5175","","My Profile: [FNN-719] Add resume Negative","","My Profile: [FNN-719] Add resume Negative","should add language without speaking level","should add language without speaking level",""
