"Status","Start Time","Stop Time","Duration in ms","Parent Suite","Suite","Sub Suite","Test Class","Test Method","Name","Description"
"passed","Sun Jun 09 04:17:36 UTC 2024","Sun Jun 09 04:18:20 UTC 2024","44377","","My Profile: [FNN-690] Add resume Positive","","My Profile: [FNN-690] Add resume Positive","should add Education","should add Education",""
"passed","Sun Jun 09 05:01:50 UTC 2024","Sun Jun 09 05:02:01 UTC 2024","11095","","My Transactions: [FNN-708] Hourly project: In advance. Positive","","My Transactions: [FNN-708] Hourly project: In advance. Positive","should verify that the period is closed","should verify that the period is closed",""
"failed","Sun Jun 09 05:08:27 UTC 2024","Sun Jun 09 05:08:56 UTC 2024","29287","","My Profile: [FNN-719] Add resume Negative","","My Profile: [FNN-719] Add resume Negative","should add education without period to","should add education without period to",""
"passed","Sun Jun 09 04:13:01 UTC 2024","Sun Jun 09 04:13:15 UTC 2024","13294","","Subscribe: [FNN-577] Subscribe Negative","","Subscribe: [FNN-577] Subscribe Negative","should subscribe with taken email","should subscribe with taken email",""
"passed","Sun Jun 09 05:13:06 UTC 2024","Sun Jun 09 05:14:03 UTC 2024","56787","","My Network: Invite via Email with message","","My Network: Invite via Email with message","[FNN-1232][FNN-2452] Checks earnings from the invitation bonus for registration","[FNN-1232][FNN-2452] Checks earnings from the invitation bonus for registration",""
"failed","Sun Jun 09 04:24:13 UTC 2024","Sun Jun 09 04:25:52 UTC 2024","98879","","My Profile: [FNN-793] Remove resume","","My Profile: [FNN-793] Remove resume","""before all"" hook for [FNN-793] Remove resume","""before all"" hook for [FNN-793] Remove resume",""
"passed","Sun Jun 09 04:41:59 UTC 2024","Sun Jun 09 04:45:54 UTC 2024","235361","","Freelancer search: [FNN-846] Invite to project","","Freelancer search: [FNN-846] Invite to project","should invite to a project via the ""Invite to project"" action","should invite to a project via the ""Invite to project"" action",""
"passed","Sun Jun 09 05:03:23 UTC 2024","Sun Jun 09 05:03:26 UTC 2024","3076","","My Profile: [FNN-668] Edit account details Negative","","My Profile: [FNN-668] Edit account details Negative","should edit account details without sector","should edit account details without sector",""
"passed","Sun Jun 09 04:12:25 UTC 2024","Sun Jun 09 04:12:39 UTC 2024","13950","","Subscribe: [FNN-577] Subscribe Negative","","Subscribe: [FNN-577] Subscribe Negative","should subscribe without last name","should subscribe without last name",""
"passed","Sun Jun 09 04:36:19 UTC 2024","Sun Jun 09 04:37:04 UTC 2024","45580","","My Network: [FNN-620] Invite manually via email and sms Negative","","My Network: [FNN-620] Invite manually via email and sms Negative","should invite manually via email without email","should invite manually via email without email",""
"passed","Sun Jun 09 04:58:45 UTC 2024","Sun Jun 09 04:58:55 UTC 2024","9503","","CR: [FNN-744] CR Subscribe Negative","","CR: [FNN-744] CR Subscribe Negative","should subscribe as CR without first name","should subscribe as CR without first name",""
"passed","Sun Jun 09 05:05:22 UTC 2024","Sun Jun 09 05:05:50 UTC 2024","27636","","Upgrade: [FNN-659] Upgrade account Negative","","Upgrade: [FNN-659] Upgrade account Negative","should upgrade account to Standard 1 month: Lost card decline","should upgrade account to Standard 1 month: Lost card decline",""
"passed","Sun Jun 09 04:42:27 UTC 2024","Sun Jun 09 04:46:45 UTC 2024","257472","","Freelancer search: [FNN-924] Freelancer search as CR user","","Freelancer search: [FNN-924] Freelancer search as CR user","should filter freelancers by Terms","should filter freelancers by Terms",""
"passed","Sun Jun 09 04:20:19 UTC 2024","Sun Jun 09 04:20:58 UTC 2024","38322","","My Profile: [FNN-690] Add resume Positive","","My Profile: [FNN-690] Add resume Positive","should add Expertise","should add Expertise",""
"passed","Sun Jun 09 04:37:19 UTC 2024","Sun Jun 09 04:37:22 UTC 2024","2953","","My Network: [FNN-620] Invite manually via email and sms Negative","","My Network: [FNN-620] Invite manually via email and sms Negative","should invite manually via email without data","should invite manually via email without data",""
"passed","Sun Jun 09 04:59:51 UTC 2024","Sun Jun 09 05:00:03 UTC 2024","11773","","CR: [FNN-744] CR Subscribe Negative","","CR: [FNN-744] CR Subscribe Negative","should subscribe as CR with wrong phone number","should subscribe as CR with wrong phone number",""
"passed","Sun Jun 09 04:37:01 UTC 2024","Sun Jun 09 04:37:33 UTC 2024","31724","","Search Project: [FNN-568] Project search","","Search Project: [FNN-568] Project search","should filter projects by Fixed price","should filter projects by Fixed price",""
"passed","Sun Jun 09 04:36:34 UTC 2024","Sun Jun 09 04:36:48 UTC 2024","13279","","Search Project: [FNN-568] Project search","","Search Project: [FNN-568] Project search","should filter projects by Search terms","should filter projects by Search terms",""
"passed","Sun Jun 09 04:44:14 UTC 2024","Sun Jun 09 04:44:55 UTC 2024","40991","","Create Profile: [FNN-684] Create profile Negative","","Create Profile: [FNN-684] Create profile Negative","should create profile without required fields","should create profile without required fields",""
"passed","Sun Jun 09 04:44:55 UTC 2024","Sun Jun 09 04:45:39 UTC 2024","44330","","Create Profile: [FNN-684] Create profile Negative","","Create Profile: [FNN-684] Create profile Negative","should create profile without City","should create profile without City",""
"passed","Sun Jun 09 05:07:44 UTC 2024","Sun Jun 09 05:08:10 UTC 2024","26170","","Upgrade: [FNN-659] Upgrade account Negative","","Upgrade: [FNN-659] Upgrade account Negative","should upgrade account to Standard 1 month: Incorrect number decline","should upgrade account to Standard 1 month: Incorrect number decline",""
"skipped","Sun Jun 09 05:24:04 UTC 2024","Sun Jun 09 05:24:04 UTC 2024","3","","CR: Invite Positive","","CR: Invite Positive","[FNN-750][FNN-2401] Accept manual invitation to organization","[FNN-750][FNN-2401] Accept manual invitation to organization",""
"passed","Sun Jun 09 04:50:22 UTC 2024","Sun Jun 09 04:56:30 UTC 2024","368731","","My Transactions: [FNN-1439] Hourly project: Add time. Negative","","My Transactions: [FNN-1439] Hourly project: Add time. Negative","should add hours without Date and Hours","should add hours without Date and Hours",""
"passed","Sun Jun 09 04:56:42 UTC 2024","Sun Jun 09 04:57:33 UTC 2024","50962","","CR: [FNN-742] CR subscribe Positive","","CR: [FNN-742] CR subscribe Positive","should subscribe as CR with valid credentials","should subscribe as CR with valid credentials",""
"passed","Sun Jun 09 04:09:48 UTC 2024","Sun Jun 09 04:09:51 UTC 2024","3517","","Login: [FNN-574] Log in from the Login page Negative","","Login: [FNN-574] Log in from the Login page Negative","should log in without password","should log in without password",""
"passed","Sun Jun 09 05:13:56 UTC 2024","Sun Jun 09 05:17:46 UTC 2024","229935","","My Network: [FNN-664] Invite freelancer","","My Network: [FNN-664] Invite freelancer","should invite freelancer","should invite freelancer",""
"passed","Sun Jun 09 04:28:36 UTC 2024","Sun Jun 09 04:28:48 UTC 2024","12586","","Settings: [FNN-672] Change email address Negative","","Settings: [FNN-672] Change email address Negative","should change email address with invalid email format","should change email address with invalid email format",""
"passed","Sun Jun 09 04:46:45 UTC 2024","Sun Jun 09 04:47:05 UTC 2024","20324","","Freelancer search: [FNN-924] Freelancer search as CR user","","Freelancer search: [FNN-924] Freelancer search as CR user","should filter freelancers by Category","should filter freelancers by Category",""
"passed","Sun Jun 09 04:46:54 UTC 2024","Sun Jun 09 04:48:47 UTC 2024","113198","","Create Profile: [FNN-684] Create profile Negative","","Create Profile: [FNN-684] Create profile Negative","should create profile without Description of yourself","should create profile without Description of yourself",""
"passed","Sun Jun 09 04:58:55 UTC 2024","Sun Jun 09 04:59:05 UTC 2024","9964","","CR: [FNN-744] CR Subscribe Negative","","CR: [FNN-744] CR Subscribe Negative","should subscribe as CR without last name","should subscribe as CR without last name",""
"passed","Sun Jun 09 04:27:49 UTC 2024","Sun Jun 09 04:28:36 UTC 2024","46478","","Settings: [FNN-672] Change email address Negative","","Settings: [FNN-672] Change email address Negative","should change email address without password","should change email address without password",""
"passed","Sun Jun 09 04:27:09 UTC 2024","Sun Jun 09 04:27:19 UTC 2024","10364","","Post Project: [FNN-649] Post project with account Negative","","Post Project: [FNN-649] Post project with account Negative","should post project without Title","should post project without Title",""
"failed","Sun Jun 09 04:48:28 UTC 2024","Sun Jun 09 04:51:15 UTC 2024","167576","","My Transactions: [FNN-1430] Milestones project: In retrospect. Positive","","My Transactions: [FNN-1430] Milestones project: In retrospect. Positive","""before all"" hook for [FNN-1430] Milestones project: In retrospect. Positive","""before all"" hook for [FNN-1430] Milestones project: In retrospect. Positive",""
"passed","Sun Jun 09 04:10:32 UTC 2024","Sun Jun 09 04:11:49 UTC 2024","77753","","Login: [FNN-685] Log out","","Login: [FNN-685] Log out","should log out","should log out",""
"passed","Sun Jun 09 04:10:07 UTC 2024","Sun Jun 09 04:10:10 UTC 2024","2278","","Login: [FNN-563] Log in from the header Negative","","Login: [FNN-563] Log in from the header Negative","should log in without email","should log in without email",""
"passed","Sun Jun 09 05:05:09 UTC 2024","Sun Jun 09 05:07:31 UTC 2024","141674","","My Profile: [FNN-793] Remove resume","","My Profile: [FNN-793] Remove resume","should remove resume","should remove resume",""
"passed","Sun Jun 09 04:56:48 UTC 2024","Sun Jun 09 04:56:56 UTC 2024","8335","","My Transactions: [FNN-1431] Hourly project: In retrospect. Positive","","My Transactions: [FNN-1431] Hourly project: In retrospect. Positive","should verify that the period is closed","should verify that the period is closed",""
"passed","Sun Jun 09 04:36:47 UTC 2024","Sun Jun 09 04:37:46 UTC 2024","58373","","My Network: Invite via Email without message","","My Network: Invite via Email without message","[FNN-1233][FNN-2452] Checks earnings from the invitation bonus for registration","[FNN-1233][FNN-2452] Checks earnings from the invitation bonus for registration",""
"skipped","Sun Jun 09 04:37:57 UTC 2024","Sun Jun 09 04:37:57 UTC 2024","2","","My Projects: [FNN-1058] Complete project Negative","","My Projects: [FNN-1058] Complete project Negative","should complete project without data","should complete project without data",""
"passed","Sun Jun 09 04:18:20 UTC 2024","Sun Jun 09 04:19:03 UTC 2024","43002","","My Profile: [FNN-690] Add resume Positive","","My Profile: [FNN-690] Add resume Positive","should add Certificate","should add Certificate",""
"passed","Sun Jun 09 04:13:35 UTC 2024","Sun Jun 09 04:13:46 UTC 2024","11397","","Subscribe: [FNN-577] Subscribe Negative","","Subscribe: [FNN-577] Subscribe Negative","should subscribe with taken phone number","should subscribe with taken phone number",""
"passed","Sun Jun 09 05:09:56 UTC 2024","Sun Jun 09 05:11:13 UTC 2024","76691","","Post Project: Post Project without account Positive ","","Post Project: Post Project without account Positive ","[FNN-650] Post project without account Positive","[FNN-650] Post project without account Positive",""
"passed","Sun Jun 09 04:30:24 UTC 2024","Sun Jun 09 04:31:04 UTC 2024","39946","","Settings: [FNN-675] Change password Negative","","Settings: [FNN-675] Change password Negative","should change password without new and repeat password","should change password without new and repeat password",""
"passed","Sun Jun 09 04:10:10 UTC 2024","Sun Jun 09 04:10:12 UTC 2024","2266","","Login: [FNN-563] Log in from the header Negative","","Login: [FNN-563] Log in from the header Negative","should log in without password","should log in without password",""
"passed","Sun Jun 09 04:32:42 UTC 2024","Sun Jun 09 04:34:21 UTC 2024","98873","","Settings: [FNN-808] Cancel downgrade","","Settings: [FNN-808] Cancel downgrade","should cancel downgrade","should cancel downgrade",""
"passed","Sun Jun 09 04:12:39 UTC 2024","Sun Jun 09 04:12:51 UTC 2024","11403","","Subscribe: [FNN-577] Subscribe Negative","","Subscribe: [FNN-577] Subscribe Negative","should subscribe without email","should subscribe without email",""
"passed","Sun Jun 09 05:09:06 UTC 2024","Sun Jun 09 05:09:13 UTC 2024","6553","","My Profile: [FNN-719] Add resume Negative","","My Profile: [FNN-719] Add resume Negative","should add certificate without organization","should add certificate without organization",""
"passed","Sun Jun 09 05:23:27 UTC 2024","Sun Jun 09 05:23:35 UTC 2024","7719","","CR: Invite Positive","","CR: Invite Positive","[FNN-749][FNN-2405] Check the invited user is in the organization","[FNN-749][FNN-2405] Check the invited user is in the organization",""
"passed","Sun Jun 09 05:09:00 UTC 2024","Sun Jun 09 05:09:06 UTC 2024","6829","","My Profile: [FNN-719] Add resume Negative","","My Profile: [FNN-719] Add resume Negative","should add certificate without certificate","should add certificate without certificate",""
"broken","Sun Jun 09 04:37:54 UTC 2024","Sun Jun 09 04:39:31 UTC 2024","96969","","My Network: [FNN-664] Invite freelancer","","My Network: [FNN-664] Invite freelancer","""before all"" hook for [FNN-664] Invite freelancer","""before all"" hook for [FNN-664] Invite freelancer",""
"passed","Sun Jun 09 04:27:52 UTC 2024","Sun Jun 09 04:28:06 UTC 2024","14232","","Post Project: [FNN-649] Post project with account Negative","","Post Project: [FNN-649] Post project with account Negative","should post project without Budget","should post project without Budget",""
"passed","Sun Jun 09 05:10:10 UTC 2024","Sun Jun 09 05:11:17 UTC 2024","66923","","Post Project: [FNN-588] Post project without account Negative","","Post Project: [FNN-588] Post project without account Negative","should post project without account details","should post project without account details",""
"passed","Sun Jun 09 05:04:32 UTC 2024","Sun Jun 09 05:04:57 UTC 2024","25438","","Upgrade: [FNN-659] Upgrade account Negative","","Upgrade: [FNN-659] Upgrade account Negative","should upgrade account to Standard 1 month: Generic decline","should upgrade account to Standard 1 month: Generic decline",""
"skipped","Sun Jun 09 04:37:57 UTC 2024","Sun Jun 09 04:37:57 UTC 2024","0","","My Projects: [FNN-1058] Complete project Negative","","My Projects: [FNN-1058] Complete project Negative","should complete project without Professionalism","should complete project without Professionalism",""
"passed","Sun Jun 09 04:29:13 UTC 2024","Sun Jun 09 04:29:29 UTC 2024","16256","","Post Project: [FNN-649] Post project with account Negative","","Post Project: [FNN-649] Post project with account Negative","should post project without Description","should post project without Description",""
"passed","Sun Jun 09 05:12:03 UTC 2024","Sun Jun 09 05:12:13 UTC 2024","9877","","My Profile: [FNN-730] Request reference Negative","","My Profile: [FNN-730] Request reference Negative","should pass step 3 without 2 rating","should pass step 3 without 2 rating",""
"passed","Sun Jun 09 05:11:17 UTC 2024","Sun Jun 09 05:11:32 UTC 2024","15284","","Post Project: [FNN-588] Post project without account Negative","","Post Project: [FNN-588] Post project without account Negative","should post project without first name","should post project without first name",""
"passed","Sun Jun 09 04:35:37 UTC 2024","Sun Jun 09 04:35:43 UTC 2024","5160","","My Network: Invite via Email without message","","My Network: Invite via Email without message","[FNN-1233][FNN-2450] User receives the Network invitation letter","[FNN-1233][FNN-2450] User receives the Network invitation letter",""
"passed","Sun Jun 09 04:47:54 UTC 2024","Sun Jun 09 04:48:42 UTC 2024","48189","","Freelancer search: [FNN-924] Freelancer search as CR user","","Freelancer search: [FNN-924] Freelancer search as CR user","should filter freelancers by Years of experience","should filter freelancers by Years of experience",""
"passed","Sun Jun 09 05:06:21 UTC 2024","Sun Jun 09 05:06:49 UTC 2024","28715","","Upgrade: [FNN-659] Upgrade account Negative","","Upgrade: [FNN-659] Upgrade account Negative","should upgrade account to Standard 1 month: Expired card decline","should upgrade account to Standard 1 month: Expired card decline",""
"passed","Sun Jun 09 05:24:34 UTC 2024","Sun Jun 09 05:24:39 UTC 2024","4441","","My Transactions: [FNN-738] Milestones project: Add milestone. Negative","","My Transactions: [FNN-738] Milestones project: Add milestone. Negative","should add milestone without Description","should add milestone without Description",""
"passed","Sun Jun 09 05:01:33 UTC 2024","Sun Jun 09 05:02:08 UTC 2024","35359","","Subscribe: Subscribe Positive","","Subscribe: Subscribe Positive","[FNN-2387] Professional receives Verify email letter","[FNN-2387] Professional receives Verify email letter",""
"passed","Sun Jun 09 04:10:12 UTC 2024","Sun Jun 09 04:10:44 UTC 2024","31714","","Login: [FNN-563] Log in from the header Negative","","Login: [FNN-563] Log in from the header Negative","should log in without credentials","should log in without credentials",""
"passed","Sun Jun 09 05:30:10 UTC 2024","Sun Jun 09 05:32:20 UTC 2024","130008","","My Transactions: [FNN-1430] Milestones project: In retrospect. Positive","","My Transactions: [FNN-1430] Milestones project: In retrospect. Positive","should approve milestone and pay for it","should approve milestone and pay for it",""
"skipped","Sun Jun 09 04:34:29 UTC 2024","Sun Jun 09 04:34:29 UTC 2024","2","","My Network: [FNN-1027] Invite freelancers","","My Network: [FNN-1027] Invite freelancers","should invite multiple freelancers","should invite multiple freelancers",""
"passed","Sun Jun 09 04:40:17 UTC 2024","Sun Jun 09 04:42:37 UTC 2024","140566","","Freelancer search: [FNN-817] Add note","","Freelancer search: [FNN-817] Add note","should add a note via the note button","should add a note via the note button",""
"passed","Sun Jun 09 04:22:22 UTC 2024","Sun Jun 09 04:23:25 UTC 2024","63601","","My Profile: [FNN-718] Add portfolio Negative","","My Profile: [FNN-718] Add portfolio Negative","should add portfolio without data","should add portfolio without data",""
"passed","Sun Jun 09 05:10:55 UTC 2024","Sun Jun 09 05:11:58 UTC 2024","63163","","My Network: Invite via Email with message","","My Network: Invite via Email with message","[FNN-1232] Invite manually via email with custom message with signup bonus","[FNN-1232] Invite manually via email with custom message with signup bonus",""
"failed","Sun Jun 09 05:12:45 UTC 2024","Sun Jun 09 05:13:51 UTC 2024","65722","","My Profile: [FNN-730] Request reference Negative","","My Profile: [FNN-730] Request reference Negative","should pass step 3 with comments less then 200 chars","should pass step 3 with comments less then 200 chars",""
"passed","Sun Jun 09 05:06:43 UTC 2024","Sun Jun 09 05:06:47 UTC 2024","3309","","My Profile: [FNN-719] Add resume Negative","","My Profile: [FNN-719] Add resume Negative","should add experience without data","should add experience without data",""
"broken","Sun Jun 09 05:16:45 UTC 2024","Sun Jun 09 05:17:16 UTC 2024","31235","","[FNN-661] Send interest","","[FNN-661] Send interest","""after all"" hook for [FNN-661] Send interest","""after all"" hook for [FNN-661] Send interest",""
"passed","Sun Jun 09 04:21:06 UTC 2024","Sun Jun 09 04:22:15 UTC 2024","69506","","My Profile: [FNN-699] Request reference Positive","","My Profile: [FNN-699] Request reference Positive","should check the validated reference","should check the validated reference",""
"passed","Sun Jun 09 05:07:54 UTC 2024","Sun Jun 09 05:08:00 UTC 2024","5537","","My Profile: [FNN-719] Add resume Negative","","My Profile: [FNN-719] Add resume Negative","should add education without education","should add education without education",""
"passed","Sun Jun 09 04:59:22 UTC 2024","Sun Jun 09 05:00:07 UTC 2024","45572","","CR: [FNN-751] Invite to the organization manually Negative","","CR: [FNN-751] Invite to the organization manually Negative","should invite manually to the organization without role","should invite manually to the organization without role",""
"passed","Sun Jun 09 04:30:46 UTC 2024","Sun Jun 09 04:33:11 UTC 2024","145190","","Settings: [FNN-676] Change profile settings","","Settings: [FNN-676] Change profile settings","it's not possible to contact me through the contact button on my profile","it's not possible to contact me through the contact button on my profile",""
"passed","Sun Jun 09 04:31:04 UTC 2024","Sun Jun 09 04:31:21 UTC 2024","17085","","Settings: [FNN-675] Change password Negative","","Settings: [FNN-675] Change password Negative","should change password with short new password","should change password with short new password",""
"passed","Sun Jun 09 05:12:54 UTC 2024","Sun Jun 09 05:13:09 UTC 2024","15063","","Post Project: [FNN-588] Post project without account Negative","","Post Project: [FNN-588] Post project without account Negative","should post project with taken phone number","should post project with taken phone number",""
"passed","Sun Jun 09 04:19:03 UTC 2024","Sun Jun 09 04:19:40 UTC 2024","36528","","My Profile: [FNN-690] Add resume Positive","","My Profile: [FNN-690] Add resume Positive","should add Motivation","should add Motivation",""
"passed","Sun Jun 09 05:14:12 UTC 2024","Sun Jun 09 05:15:01 UTC 2024","48389","","Post Project: [FNN-588] Post project without account Negative","","Post Project: [FNN-588] Post project without account Negative","should post project without repeat password","should post project without repeat password",""
"passed","Sun Jun 09 04:56:21 UTC 2024","Sun Jun 09 04:56:45 UTC 2024","23797","","My Transactions: [FNN-1431] Hourly project: In retrospect. Positive","","My Transactions: [FNN-1431] Hourly project: In retrospect. Positive","should accept the project and add hours","should accept the project and add hours",""
"failed","Sun Jun 09 05:14:21 UTC 2024","Sun Jun 09 05:15:32 UTC 2024","71178","","My Network: Invite via SMS","","My Network: Invite via SMS","[FNN-619][FNN-2452] Checks earnings from the invitation bonus for registration","[FNN-619][FNN-2452] Checks earnings from the invitation bonus for registration",""
"passed","Sun Jun 09 05:01:27 UTC 2024","Sun Jun 09 05:01:47 UTC 2024","19245","","My Transactions: [FNN-708] Hourly project: In advance. Positive","","My Transactions: [FNN-708] Hourly project: In advance. Positive","should add hours","should add hours",""
"skipped","Sun Jun 09 04:34:29 UTC 2024","Sun Jun 09 04:34:58 UTC 2024","28546","","My Network: [FNN-1027] Invite freelancers","","My Network: [FNN-1027] Invite freelancers","should check network as sender user","should check network as sender user",""
"passed","Sun Jun 09 04:12:22 UTC 2024","Sun Jun 09 04:13:07 UTC 2024","45510","","Reset password: Reset password Positive","","Reset password: Reset password Positive","[FNN-656] Forgot password button functionality","[FNN-656] Forgot password button functionality",""
"passed","Sun Jun 09 05:12:03 UTC 2024","Sun Jun 09 05:12:18 UTC 2024","14321","","Post Project: [FNN-588] Post project without account Negative","","Post Project: [FNN-588] Post project without account Negative","should post project with wrong email","should post project with wrong email",""
"skipped","Sun Jun 09 04:47:52 UTC 2024","Sun Jun 09 04:47:52 UTC 2024","20","","[FNN-743] Archive and restore message","","[FNN-743] Archive and restore message","should archive the message","should archive the message",""
"passed","Sun Jun 09 04:13:56 UTC 2024","Sun Jun 09 04:14:05 UTC 2024","9388","","Subscribe: [FNN-577] Subscribe Negative","","Subscribe: [FNN-577] Subscribe Negative","should subscribe without repeat password","should subscribe without repeat password",""
"passed","Sun Jun 09 04:22:21 UTC 2024","Sun Jun 09 04:24:08 UTC 2024","107560","","My Profile: [FNN-713] Confirm phone number Negative","","My Profile: [FNN-713] Confirm phone number Negative","should confirm phone number with invalid code","should confirm phone number with invalid code",""
"passed","Sun Jun 09 04:47:57 UTC 2024","Sun Jun 09 04:49:15 UTC 2024","77703","","[FNN-813] Change language","","[FNN-813] Change language","should change language to Dutch from the footer","should change language to Dutch from the footer",""
"passed","Sun Jun 09 04:09:10 UTC 2024","Sun Jun 09 04:10:26 UTC 2024","76389","","Login: [FNN-647] Log in from the header Positive","","Login: [FNN-647] Log in from the header Positive","should log in with valid credentials","should log in with valid credentials",""
"passed","Sun Jun 09 05:12:13 UTC 2024","Sun Jun 09 05:12:24 UTC 2024","10771","","My Profile: [FNN-730] Request reference Negative","","My Profile: [FNN-730] Request reference Negative","should pass step 3 without 3 rating","should pass step 3 without 3 rating",""
"passed","Sun Jun 09 05:00:44 UTC 2024","Sun Jun 09 05:00:55 UTC 2024","11137","","CR: [FNN-744] CR Subscribe Negative","","CR: [FNN-744] CR Subscribe Negative","should subscribe as CR with invalid repeat password","should subscribe as CR with invalid repeat password",""
"passed","Sun Jun 09 04:09:51 UTC 2024","Sun Jun 09 04:10:24 UTC 2024","32846","","Login: [FNN-574] Log in from the Login page Negative","","Login: [FNN-574] Log in from the Login page Negative","should log in without credentials","should log in without credentials",""
