"Status","Start Time","Stop Time","Duration in ms","Parent Suite","Suite","Sub Suite","Test Class","Test Method","Name","Description"
"failed","Sun Apr 21 05:19:24 UTC 2024","Sun Apr 21 05:20:18 UTC 2024","53930","","My Network: [FNN-664] Invite freelancer","","My Network: [FNN-664] Invite freelancer","should check network as sender user","should check network as sender user",""
"passed","Sun Apr 21 05:13:09 UTC 2024","Sun Apr 21 05:13:33 UTC 2024","23361","","Post Project: [FNN-588] Post project without account Negative","","Post Project: [FNN-588] Post project without account Negative","should post project without first name","should post project without first name",""
"passed","Sun Apr 21 04:19:54 UTC 2024","Sun Apr 21 04:20:30 UTC 2024","35697","","My Profile: [FNN-718] Add portfolio Negative","","My Profile: [FNN-718] Add portfolio Negative","should add portfolio without Type","should add portfolio without Type",""
"failed","Sun Apr 21 04:08:26 UTC 2024","Sun Apr 21 04:09:44 UTC 2024","78489","","CR: [FNN-1779] My Dashboard page integrity as Employer","","CR: [FNN-1779] My Dashboard page integrity as Employer","""before all"" hook for [FNN-1779] My Dashboard page integrity as Employer","""before all"" hook for [FNN-1779] My Dashboard page integrity as Employer",""
"passed","Sun Apr 21 04:43:41 UTC 2024","Sun Apr 21 04:45:10 UTC 2024","89389","","Create Profile: [FNN-683] Create profile Positive","","Create Profile: [FNN-683] Create profile Positive","should create profile with valid data","should create profile with valid data",""
"passed","Sun Apr 21 04:54:26 UTC 2024","Sun Apr 21 04:54:46 UTC 2024","19407","","My Transactions: [FNN-1430] Milestones project: In retrospect. Positive","","My Transactions: [FNN-1430] Milestones project: In retrospect. Positive","should accept the project and request payout","should accept the project and request payout",""
"passed","Sun Apr 21 05:08:58 UTC 2024","Sun Apr 21 05:09:09 UTC 2024","11084","","My Profile: [FNN-719] Add resume Negative","","My Profile: [FNN-719] Add resume Negative","should add experience without period until","should add experience without period until",""
"passed","Sun Apr 21 04:26:07 UTC 2024","Sun Apr 21 04:26:57 UTC 2024","50323","","Settings: [FNN-672] Change email address Negative","","Settings: [FNN-672] Change email address Negative","should change email address without password","should change email address without password",""
"passed","Sun Apr 21 05:00:29 UTC 2024","Sun Apr 21 05:00:41 UTC 2024","12236","","CR: [FNN-744] CR Subscribe Negative","","CR: [FNN-744] CR Subscribe Negative","should subscribe as CR without password","should subscribe as CR without password",""
"passed","Sun Apr 21 05:00:52 UTC 2024","Sun Apr 21 05:01:05 UTC 2024","12653","","CR: [FNN-744] CR Subscribe Negative","","CR: [FNN-744] CR Subscribe Negative","should subscribe as CR with short password","should subscribe as CR with short password",""
"passed","Sun Apr 21 04:08:25 UTC 2024","Sun Apr 21 04:09:11 UTC 2024","45526","","Login: [FNN-563] Log in from the header Negative","","Login: [FNN-563] Log in from the header Negative","should log in with valid email and invalid password","should log in with valid email and invalid password",""
"passed","Sun Apr 21 04:08:21 UTC 2024","Sun Apr 21 04:09:20 UTC 2024","59034","","Login: [FNN-648] Log in from the Login page Positive","","Login: [FNN-648] Log in from the Login page Positive","should log in with valid credentials","should log in with valid credentials",""
"passed","Sun Apr 21 05:25:29 UTC 2024","Sun Apr 21 05:25:44 UTC 2024","14473","","My Transactions: [FNN-708] Hourly project: In advance. Positive","","My Transactions: [FNN-708] Hourly project: In advance. Positive","should accept the project","should accept the project",""
"passed","Sun Apr 21 05:11:47 UTC 2024","Sun Apr 21 05:11:58 UTC 2024","10971","","My Profile: [FNN-730] Request reference Negative","","My Profile: [FNN-730] Request reference Negative","should pass step 3 without 3 rating","should pass step 3 without 3 rating",""
"broken","Sun Apr 21 05:18:16 UTC 2024","Sun Apr 21 05:20:51 UTC 2024","155423","","[FNN-743] Archive and restore message","","[FNN-743] Archive and restore message","""before all"" hook for [FNN-743] Archive and restore message","""before all"" hook for [FNN-743] Archive and restore message",""
"passed","Sun Apr 21 04:28:47 UTC 2024","Sun Apr 21 04:29:44 UTC 2024","57544","","Settings: [FNN-678] Delete account without subscription","","Settings: [FNN-678] Delete account without subscription","should delete account without subscription","should delete account without subscription",""
"passed","Sun Apr 21 04:24:46 UTC 2024","Sun Apr 21 04:25:03 UTC 2024","16485","","Post Project: [FNN-649] Post project with account Negative","","Post Project: [FNN-649] Post project with account Negative","should post project without Start date","should post project without Start date",""
"passed","Sun Apr 21 04:47:22 UTC 2024","Sun Apr 21 04:48:03 UTC 2024","41093","","[FNN-717] Edit email settings","","[FNN-717] Edit email settings","should edit Notification settings and verify that the settings are saved","should edit Notification settings and verify that the settings are saved",""
"passed","Sun Apr 21 04:47:51 UTC 2024","Sun Apr 21 04:48:53 UTC 2024","62144","","Freelancer search: [FNN-924] Freelancer search as CR user","","Freelancer search: [FNN-924] Freelancer search as CR user","should filter freelancers by Years of experience","should filter freelancers by Years of experience",""
"passed","Sun Apr 21 05:10:21 UTC 2024","Sun Apr 21 05:10:28 UTC 2024","7720","","My Profile: [FNN-730] Request reference Negative","","My Profile: [FNN-730] Request reference Negative","should pass step 2 without first name","should pass step 2 without first name",""
"passed","Sun Apr 21 05:02:51 UTC 2024","Sun Apr 21 05:02:56 UTC 2024","5477","","CR: [FNN-751] Invite to the organization manually Negative","","CR: [FNN-751] Invite to the organization manually Negative","should invite manually via email with wrong email format","should invite manually via email with wrong email format",""
"passed","Sun Apr 21 05:11:36 UTC 2024","Sun Apr 21 05:11:47 UTC 2024","10897","","My Profile: [FNN-730] Request reference Negative","","My Profile: [FNN-730] Request reference Negative","should pass step 3 without 2 rating","should pass step 3 without 2 rating",""
"passed","Sun Apr 21 04:32:50 UTC 2024","Sun Apr 21 04:33:19 UTC 2024","28406","","Search Project: [FNN-568] Project search","","Search Project: [FNN-568] Project search","should filter projects by Fixed price","should filter projects by Fixed price",""
"passed","Sun Apr 21 04:25:37 UTC 2024","Sun Apr 21 04:26:23 UTC 2024","45402","","Post Project: [FNN-649] Post project with account Negative","","Post Project: [FNN-649] Post project with account Negative","should post project with short Description","should post project with short Description",""
"passed","Sun Apr 21 04:42:34 UTC 2024","Sun Apr 21 04:43:30 UTC 2024","56448","","Freelancer search: [FNN-816] Create list Functionality","","Freelancer search: [FNN-816] Create list Functionality","should remove created list","should remove created list",""
"skipped","Sun Apr 21 04:07:27 UTC 2024","Sun Apr 21 04:07:27 UTC 2024","1","","Subscribe","","Subscribe","[FNN-2373] Professional receives Welcome letter","[FNN-2373] Professional receives Welcome letter",""
"passed","Sun Apr 21 05:09:53 UTC 2024","Sun Apr 21 05:11:48 UTC 2024","114682","","My Profile: [FNN-669] Edit account details Positive","","My Profile: [FNN-669] Edit account details Positive","should edit cr account details with valid information","should edit cr account details with valid information",""
"passed","Sun Apr 21 04:13:45 UTC 2024","Sun Apr 21 04:13:57 UTC 2024","11655","","Subscribe: [FNN-577] Subscribe Negative","","Subscribe: [FNN-577] Subscribe Negative","should subscribe without agreeing to the Terms and Conditions","should subscribe without agreeing to the Terms and Conditions",""
"passed","Sun Apr 21 04:29:19 UTC 2024","Sun Apr 21 04:31:10 UTC 2024","111009","","Settings: [FNN-679] Delete account with subscription","","Settings: [FNN-679] Delete account with subscription","should delete account with subscription","should delete account with subscription",""
"failed","Sun Apr 21 05:02:19 UTC 2024","Sun Apr 21 05:04:21 UTC 2024","122530","","CR: [FNN-1888] My Dashboard page integrity as Freelancer","","CR: [FNN-1888] My Dashboard page integrity as Freelancer","should verify the integrity of the My Dashboard page as freelancer","should verify the integrity of the My Dashboard page as freelancer",""
"passed","Sun Apr 21 05:11:58 UTC 2024","Sun Apr 21 05:12:09 UTC 2024","11143","","My Profile: [FNN-730] Request reference Negative","","My Profile: [FNN-730] Request reference Negative","should pass step 3 without 4 rating","should pass step 3 without 4 rating",""
"passed","Sun Apr 21 04:09:11 UTC 2024","Sun Apr 21 04:09:17 UTC 2024","6681","","Login: [FNN-563] Log in from the header Negative","","Login: [FNN-563] Log in from the header Negative","should log in with invalid credentials","should log in with invalid credentials",""
"passed","Sun Apr 21 05:13:33 UTC 2024","Sun Apr 21 05:13:54 UTC 2024","21367","","Post Project: [FNN-588] Post project without account Negative","","Post Project: [FNN-588] Post project without account Negative","should post project without last name","should post project without last name",""
"passed","Sun Apr 21 04:46:25 UTC 2024","Sun Apr 21 04:46:52 UTC 2024","26292","","Freelancer search: [FNN-924] Freelancer search as CR user","","Freelancer search: [FNN-924] Freelancer search as CR user","should filter freelancers by Category","should filter freelancers by Category",""
"passed","Sun Apr 21 05:08:17 UTC 2024","Sun Apr 21 05:08:21 UTC 2024","3803","","My Profile: [FNN-719] Add resume Negative","","My Profile: [FNN-719] Add resume Negative","should add experience without data","should add experience without data",""
"passed","Sun Apr 21 05:07:10 UTC 2024","Sun Apr 21 05:08:17 UTC 2024","66372","","My Profile: [FNN-719] Add resume Negative","","My Profile: [FNN-719] Add resume Negative","should add CV without CV","should add CV without CV",""
"passed","Sun Apr 21 04:27:55 UTC 2024","Sun Apr 21 04:30:36 UTC 2024","160481","","Settings: [FNN-676] Change profile settings","","Settings: [FNN-676] Change profile settings","it's not possible to contact me through the contact button on my profile","it's not possible to contact me through the contact button on my profile",""
"passed","Sun Apr 21 04:35:38 UTC 2024","Sun Apr 21 04:35:40 UTC 2024","2125","","My Network: [FNN-620] Invite manually via email and sms Negative","","My Network: [FNN-620] Invite manually via email and sms Negative","should invite manually via email without data","should invite manually via email without data",""
"failed","Sun Apr 21 05:13:59 UTC 2024","Sun Apr 21 05:14:39 UTC 2024","40557","","Post Project","","Post Project","[FNN-2423] User receives the Project posted letter","[FNN-2423] User receives the Project posted letter",""
"skipped","Sun Apr 21 04:31:18 UTC 2024","Sun Apr 21 04:37:15 UTC 2024","357365","","My Network: [FNN-1027] Invite freelancers","","My Network: [FNN-1027] Invite freelancers","should invite multiple freelancers","should invite multiple freelancers",""
"passed","Sun Apr 21 05:06:58 UTC 2024","Sun Apr 21 05:09:53 UTC 2024","174954","","My Profile: [FNN-669] Edit account details Positive","","My Profile: [FNN-669] Edit account details Positive","should edit employer account details with valid information","should edit employer account details with valid information",""
"passed","Sun Apr 21 04:11:49 UTC 2024","Sun Apr 21 04:11:54 UTC 2024","4708","","Reset password","","Reset password","[FNN-2397] User receives the Reset password letter","[FNN-2397] User receives the Reset password letter",""
"passed","Sun Apr 21 05:10:42 UTC 2024","Sun Apr 21 05:10:48 UTC 2024","5851","","My Profile: [FNN-730] Request reference Negative","","My Profile: [FNN-730] Request reference Negative","should pass step 2 without picture","should pass step 2 without picture",""
"passed","Sun Apr 21 04:10:47 UTC 2024","Sun Apr 21 04:10:51 UTC 2024","4079","","Reset password: [FNN-655] Reset password Negative","","Reset password: [FNN-655] Reset password Negative","should reset password with wrong email","should reset password with wrong email",""
"passed","Sun Apr 21 04:48:49 UTC 2024","Sun Apr 21 04:50:51 UTC 2024","121786","","[FNN-661] Send interest","","[FNN-661] Send interest","should check if the Freelancer user on the project","should check if the Freelancer user on the project",""
"skipped","Sun Apr 21 05:26:53 UTC 2024","Sun Apr 21 05:26:53 UTC 2024","1","","My Transactions: [FNN-708] Hourly project: In advance. Positive","","My Transactions: [FNN-708] Hourly project: In advance. Positive","should verify that the money paid","should verify that the money paid",""
"passed","Sun Apr 21 04:48:11 UTC 2024","Sun Apr 21 04:49:30 UTC 2024","79463","","[FNN-813] Change language","","[FNN-813] Change language","should change language to Dutch from the footer","should change language to Dutch from the footer",""
"passed","Sun Apr 21 04:22:24 UTC 2024","Sun Apr 21 04:23:07 UTC 2024","43189","","Post Project: [FNN-649] Post project with account Negative","","Post Project: [FNN-649] Post project with account Negative","should post project without step 1","should post project without step 1",""
"passed","Sun Apr 21 04:09:06 UTC 2024","Sun Apr 21 04:09:36 UTC 2024","29657","","Login: [FNN-574] Log in from the Login page Negative","","Login: [FNN-574] Log in from the Login page Negative","should log in without credentials","should log in without credentials",""
"passed","Sun Apr 21 04:42:26 UTC 2024","Sun Apr 21 04:42:34 UTC 2024","7467","","Freelancer search: [FNN-816] Create list Functionality","","Freelancer search: [FNN-816] Create list Functionality","should re-open original search","should re-open original search",""
"passed","Sun Apr 21 05:01:32 UTC 2024","Sun Apr 21 05:01:42 UTC 2024","9918","","My Transactions: [FNN-737] Hourly project: Start project. Negative","","My Transactions: [FNN-737] Hourly project: Start project. Negative","should start project without Hourly rate","should start project without Hourly rate",""
"passed","Sun Apr 21 04:56:53 UTC 2024","Sun Apr 21 04:56:56 UTC 2024","3596","","My Transactions: [FNN-1439] Hourly project: Add time. Negative","","My Transactions: [FNN-1439] Hourly project: Add time. Negative","should add hours without Hours","should add hours without Hours",""
"passed","Sun Apr 21 05:25:00 UTC 2024","Sun Apr 21 05:25:15 UTC 2024","15147","","CR","","CR","[FNN-750] Invite to the organization through search","[FNN-750] Invite to the organization through search",""
"passed","Sun Apr 21 04:54:46 UTC 2024","Sun Apr 21 04:55:30 UTC 2024","44513","","My Transactions: [FNN-1430] Milestones project: In retrospect. Positive","","My Transactions: [FNN-1430] Milestones project: In retrospect. Positive","should approve milestone and pay for it","should approve milestone and pay for it",""
"passed","Sun Apr 21 04:56:48 UTC 2024","Sun Apr 21 04:56:53 UTC 2024","4555","","My Transactions: [FNN-1439] Hourly project: Add time. Negative","","My Transactions: [FNN-1439] Hourly project: Add time. Negative","should add hours without Date","should add hours without Date",""
"skipped","Sun Apr 21 04:07:27 UTC 2024","Sun Apr 21 04:07:52 UTC 2024","25091","","Subscribe","","Subscribe","[FNN-2387] Professional receives Verify email letter","[FNN-2387] Professional receives Verify email letter",""
"passed","Sun Apr 21 04:11:44 UTC 2024","Sun Apr 21 04:11:57 UTC 2024","12580","","Subscribe: [FNN-577] Subscribe Negative","","Subscribe: [FNN-577] Subscribe Negative","should subscribe without email","should subscribe without email",""
"failed","Sun Apr 21 05:25:31 UTC 2024","Sun Apr 21 05:26:12 UTC 2024","40700","","My Transactions: [FNN-1431] Hourly project: In retrospect. Positive","","My Transactions: [FNN-1431] Hourly project: In retrospect. Positive","should accept the project and add hours","should accept the project and add hours",""
"passed","Sun Apr 21 04:12:34 UTC 2024","Sun Apr 21 04:12:47 UTC 2024","13840","","Subscribe: [FNN-577] Subscribe Negative","","Subscribe: [FNN-577] Subscribe Negative","should subscribe with wrong phone number","should subscribe with wrong phone number",""
"passed","Sun Apr 21 05:09:58 UTC 2024","Sun Apr 21 05:10:44 UTC 2024","45491","","Post Project","","Post Project","[FNN-650] Post project without account Positive","[FNN-650] Post project without account Positive",""
"passed","Sun Apr 21 04:11:57 UTC 2024","Sun Apr 21 04:12:09 UTC 2024","12003","","Subscribe: [FNN-577] Subscribe Negative","","Subscribe: [FNN-577] Subscribe Negative","should subscribe with wrong email format","should subscribe with wrong email format",""
"passed","Sun Apr 21 04:59:14 UTC 2024","Sun Apr 21 04:59:25 UTC 2024","11545","","CR: [FNN-744] CR Subscribe Negative","","CR: [FNN-744] CR Subscribe Negative","should subscribe as CR without email","should subscribe as CR without email",""
"passed","Sun Apr 21 04:33:49 UTC 2024","Sun Apr 21 04:34:42 UTC 2024","53082","","My Network: [FNN-1233] Invite manually via email without custom message with signup bonus","","My Network: [FNN-1233] Invite manually via email without custom message with signup bonus","should check My Dashboard and My Transactions page for the signup bonus as the inviter user","should check My Dashboard and My Transactions page for the signup bonus as the inviter user",""
"passed","Sun Apr 21 04:55:48 UTC 2024","Sun Apr 21 05:01:29 UTC 2024","341902","","My Transactions: [FNN-710] Milestones project: In advance. Positive","","My Transactions: [FNN-710] Milestones project: In advance. Positive","should start project with milestone","should start project with milestone",""
"passed","Sun Apr 21 04:13:33 UTC 2024","Sun Apr 21 04:13:45 UTC 2024","12737","","Subscribe: [FNN-577] Subscribe Negative","","Subscribe: [FNN-577] Subscribe Negative","should subscribe with invalid repeat password","should subscribe with invalid repeat password",""
"passed","Sun Apr 21 05:25:44 UTC 2024","Sun Apr 21 05:26:18 UTC 2024","34233","","My Transactions: [FNN-708] Hourly project: In advance. Positive","","My Transactions: [FNN-708] Hourly project: In advance. Positive","should pay deposit","should pay deposit",""
"passed","Sun Apr 21 05:11:58 UTC 2024","Sun Apr 21 05:13:21 UTC 2024","83067","","Settings: [FNN-671] Change email address Positive","","Settings: [FNN-671] Change email address Positive","should change email address with valid credentials","should change email address with valid credentials",""
"passed","Sun Apr 21 05:14:38 UTC 2024","Sun Apr 21 05:14:59 UTC 2024","21201","","Post Project: [FNN-588] Post project without account Negative","","Post Project: [FNN-588] Post project without account Negative","should post project with taken email","should post project with taken email",""
"passed","Sun Apr 21 04:44:07 UTC 2024","Sun Apr 21 04:44:50 UTC 2024","43110","","Create Profile: [FNN-684] Create profile Negative","","Create Profile: [FNN-684] Create profile Negative","should create profile without required fields","should create profile without required fields",""
"passed","Sun Apr 21 05:07:56 UTC 2024","Sun Apr 21 05:08:25 UTC 2024","28440","","Upgrade: [FNN-659] Upgrade account Negative","","Upgrade: [FNN-659] Upgrade account Negative","should upgrade account to Standard 1 month: Processing error decline","should upgrade account to Standard 1 month: Processing error decline",""
"passed","Sun Apr 21 04:40:44 UTC 2024","Sun Apr 21 04:42:57 UTC 2024","132949","","Freelancer search: [FNN-822] Send message","","Freelancer search: [FNN-822] Send message","should send a message via the ""Send message"" action","should send a message via the ""Send message"" action",""
"passed","Sun Apr 21 04:48:45 UTC 2024","Sun Apr 21 04:54:26 UTC 2024","341181","","My Transactions: [FNN-1430] Milestones project: In retrospect. Positive","","My Transactions: [FNN-1430] Milestones project: In retrospect. Positive","should start project with milestone","should start project with milestone",""
"passed","Sun Apr 21 04:13:11 UTC 2024","Sun Apr 21 04:13:20 UTC 2024","9535","","Subscribe: [FNN-577] Subscribe Negative","","Subscribe: [FNN-577] Subscribe Negative","should subscribe without repeat password","should subscribe without repeat password",""
"skipped","Sun Apr 21 05:26:12 UTC 2024","Sun Apr 21 05:26:12 UTC 2024","1","","My Transactions: [FNN-1431] Hourly project: In retrospect. Positive","","My Transactions: [FNN-1431] Hourly project: In retrospect. Positive","should approve the time and pay deposits","should approve the time and pay deposits",""
"passed","Sun Apr 21 04:33:19 UTC 2024","Sun Apr 21 04:33:34 UTC 2024","15753","","Search Project: [FNN-568] Project search","","Search Project: [FNN-568] Project search","should filter projects by Hourly rate","should filter projects by Hourly rate",""
"skipped","Sun Apr 21 05:26:12 UTC 2024","Sun Apr 21 05:26:12 UTC 2024","2","","My Transactions: [FNN-1431] Hourly project: In retrospect. Positive","","My Transactions: [FNN-1431] Hourly project: In retrospect. Positive","should close the period","should close the period",""
"passed","Sun Apr 21 04:43:05 UTC 2024","Sun Apr 21 04:44:01 UTC 2024","55969","","Freelancer search: [FNN-822] Send message","","Freelancer search: [FNN-822] Send message","should check the message as the Freelancer user","should check the message as the Freelancer user",""
"broken","Sun Apr 21 05:13:29 UTC 2024","Sun Apr 21 05:13:59 UTC 2024","29383","","Post Project","","Post Project","[FNN-2422] Correctness of project data on the Project page (with account)","[FNN-2422] Correctness of project data on the Project page (with account)",""
"broken","Sun Apr 21 05:14:45 UTC 2024","Sun Apr 21 05:18:52 UTC 2024","246435","","My Projects: [FNN-1058] Complete project Negative","","My Projects: [FNN-1058] Complete project Negative","""before each"" hook for [FNN-1058] Complete project Negative","""before each"" hook for [FNN-1058] Complete project Negative",""
"passed","Sun Apr 21 05:11:15 UTC 2024","Sun Apr 21 05:11:36 UTC 2024","21453","","My Profile: [FNN-730] Request reference Negative","","My Profile: [FNN-730] Request reference Negative","should pass step 3 without 1 rating","should pass step 3 without 1 rating",""
"broken","Sun Apr 21 05:10:44 UTC 2024","Sun Apr 21 05:11:11 UTC 2024","27660","","Post Project","","Post Project","[FNN-2422] Correctness of project data on the Project page (FNN-650)","[FNN-2422] Correctness of project data on the Project page (FNN-650)",""
"passed","Sun Apr 21 04:12:47 UTC 2024","Sun Apr 21 04:13:01 UTC 2024","13272","","Subscribe: [FNN-577] Subscribe Negative","","Subscribe: [FNN-577] Subscribe Negative","should subscribe with taken phone number","should subscribe with taken phone number",""
"skipped","Sun Apr 21 04:45:18 UTC 2024","Sun Apr 21 04:47:49 UTC 2024","150669","","[FNN-667] Send contact","","[FNN-667] Send contact","should send a contact","should send a contact",""
"passed","Sun Apr 21 04:16:00 UTC 2024","Sun Apr 21 04:16:36 UTC 2024","35589","","My Profile: [FNN-690] Add resume Positive","","My Profile: [FNN-690] Add resume Positive","should check the attached part of the resume on the Profile page","should check the attached part of the resume on the Profile page",""
"skipped","Sun Apr 21 04:47:49 UTC 2024","Sun Apr 21 04:48:37 UTC 2024","48590","","[FNN-667] Send contact","","[FNN-667] Send contact","should check the contact as the second user","should check the contact as the second user",""
"passed","Sun Apr 21 05:16:48 UTC 2024","Sun Apr 21 05:17:10 UTC 2024","22398","","Post Project: [FNN-588] Post project without account Negative","","Post Project: [FNN-588] Post project without account Negative","should post project with short password and repeat password","should post project with short password and repeat password",""
"passed","Sun Apr 21 05:01:20 UTC 2024","Sun Apr 21 05:01:29 UTC 2024","8872","","My Transactions: [FNN-738] Milestones project: Add milestone. Negative","","My Transactions: [FNN-738] Milestones project: Add milestone. Negative","should add milestone without Amount","should add milestone without Amount",""
"passed","Sun Apr 21 05:01:43 UTC 2024","Sun Apr 21 05:02:51 UTC 2024","67240","","CR: [FNN-751] Invite to the organization manually Negative","","CR: [FNN-751] Invite to the organization manually Negative","should invite manually to the organization without email","should invite manually to the organization without email",""
"passed","Sun Apr 21 05:14:29 UTC 2024","Sun Apr 21 05:15:35 UTC 2024","65534","","My Network: [FNN-619] Invite manually via sms with signup bonus","","My Network: [FNN-619] Invite manually via sms with signup bonus","should subscribe as the freelancer with recipient details and accept the invitation","should subscribe as the freelancer with recipient details and accept the invitation",""
"passed","Sun Apr 21 04:27:46 UTC 2024","Sun Apr 21 04:28:05 UTC 2024","19386","","Settings: [FNN-675] Change password Negative","","Settings: [FNN-675] Change password Negative","should change password with short new password","should change password with short new password",""
"passed","Sun Apr 21 04:33:39 UTC 2024","Sun Apr 21 04:33:45 UTC 2024","6042","","Search Project: [FNN-568] Project search","","Search Project: [FNN-568] Project search","should filter projects by Status Open projects","should filter projects by Status Open projects",""
