"Status","Start Time","Stop Time","Duration in ms","Parent Suite","Suite","Sub Suite","Test Class","Test Method","Name","Description"
"passed","Sat Mar 23 04:07:46 UTC 2024","Sat Mar 23 04:08:06 UTC 2024","20459","","Subscribe","","Subscribe","[FNN-578] Subscribe Positive","[FNN-578] Subscribe Positive",""
"passed","Sat Mar 23 05:12:02 UTC 2024","Sat Mar 23 05:13:30 UTC 2024","88494","","My Projects: [FNN-1058] Complete project Negative","","My Projects: [FNN-1058] Complete project Negative","should complete project with short Comments","should complete project with short Comments",""
"passed","Sat Mar 23 04:30:48 UTC 2024","Sat Mar 23 04:30:53 UTC 2024","4526","","My Network: [FNN-620] Invite manually via email and sms Negative","","My Network: [FNN-620] Invite manually via email and sms Negative","should invite manually via email without last name","should invite manually via email without last name",""
"passed","Sat Mar 23 04:25:35 UTC 2024","Sat Mar 23 04:26:09 UTC 2024","34547","","Settings: [FNN-675] Change password Negative","","Settings: [FNN-675] Change password Negative","should change password without new and repeat password","should change password without new and repeat password",""
"passed","Sat Mar 23 05:03:32 UTC 2024","Sat Mar 23 05:03:43 UTC 2024","10646","","My Profile: [FNN-730] Request reference Negative","","My Profile: [FNN-730] Request reference Negative","should pass step 3 without 3 rating","should pass step 3 without 3 rating",""
"passed","Sat Mar 23 05:09:53 UTC 2024","Sat Mar 23 05:10:43 UTC 2024","50792","","Freelancer search: [FNN-815] Freelancer search as non-CR user","","Freelancer search: [FNN-815] Freelancer search as non-CR user","should filter freelancers by Skills","should filter freelancers by Skills",""
"passed","Sat Mar 23 04:37:00 UTC 2024","Sat Mar 23 04:39:18 UTC 2024","138124","","Freelancer search: [FNN-817] Add note","","Freelancer search: [FNN-817] Add note","should add a note via the note button","should add a note via the note button",""
"passed","Sat Mar 23 04:14:26 UTC 2024","Sat Mar 23 04:14:53 UTC 2024","27096","","Upgrade: [FNN-659] Upgrade account Negative","","Upgrade: [FNN-659] Upgrade account Negative","should upgrade account to Standard 1 month: Expired card decline","should upgrade account to Standard 1 month: Expired card decline",""
"passed","Sat Mar 23 05:03:49 UTC 2024","Sat Mar 23 05:04:21 UTC 2024","31050","","My Profile: [FNN-719] Add resume Negative","","My Profile: [FNN-719] Add resume Negative","should add language without reading level","should add language without reading level",""
"passed","Sat Mar 23 04:27:27 UTC 2024","Sat Mar 23 04:27:30 UTC 2024","2350","","Settings: [FNN-678] Delete account without subscription","","Settings: [FNN-678] Delete account without subscription","should receive a ""account deleted"" letter","should receive a ""account deleted"" letter",""
"passed","Sat Mar 23 04:39:18 UTC 2024","Sat Mar 23 04:39:34 UTC 2024","16436","","Freelancer search: [FNN-817] Add note","","Freelancer search: [FNN-817] Add note","should add a note via the action ""Add note""","should add a note via the action ""Add note""",""
"passed","Sat Mar 23 04:10:34 UTC 2024","Sat Mar 23 04:10:44 UTC 2024","10293","","Subscribe: [FNN-577] Subscribe Negative","","Subscribe: [FNN-577] Subscribe Negative","should subscribe without email","should subscribe without email",""
"broken","Sat Mar 23 05:02:53 UTC 2024","Sat Mar 23 05:03:22 UTC 2024","29002","","My Profile: [FNN-730] Request reference Negative","","My Profile: [FNN-730] Request reference Negative","should pass step 3 without 1 rating","should pass step 3 without 1 rating",""
"passed","Sat Mar 23 04:56:29 UTC 2024","Sat Mar 23 04:56:35 UTC 2024","6340","","My Transactions: [FNN-738] Milestones project: Add milestone. Negative","","My Transactions: [FNN-738] Milestones project: Add milestone. Negative","should add milestone without Description","should add milestone without Description",""
"failed","Sat Mar 23 05:02:43 UTC 2024","Sat Mar 23 05:05:17 UTC 2024","153883","","Upgrade: [FNN-658] Upgrade account Positive","","Upgrade: [FNN-658] Upgrade account Positive","should upgrade account to Business 1 month","should upgrade account to Business 1 month",""
"passed","Sat Mar 23 04:42:10 UTC 2024","Sat Mar 23 04:43:24 UTC 2024","74172","","[FNN-717] Edit email settings","","[FNN-717] Edit email settings","should edit Email settings and verify that the settings are saved","should edit Email settings and verify that the settings are saved",""
"passed","Sat Mar 23 04:38:38 UTC 2024","Sat Mar 23 04:42:11 UTC 2024","213163","","Freelancer search: [FNN-924] Freelancer search as CR user","","Freelancer search: [FNN-924] Freelancer search as CR user","should filter freelancers by Terms","should filter freelancers by Terms",""
"passed","Sat Mar 23 05:20:32 UTC 2024","Sat Mar 23 05:20:46 UTC 2024","13898","","My Transactions: [FNN-708] Hourly project: In advance. Positive","","My Transactions: [FNN-708] Hourly project: In advance. Positive","should accept the project","should accept the project",""
"passed","Sat Mar 23 04:53:52 UTC 2024","Sat Mar 23 04:55:01 UTC 2024","69041","","CR: [FNN-744] CR Subscribe Negative","","CR: [FNN-744] CR Subscribe Negative","should subscribe as CR without sector","should subscribe as CR without sector",""
"passed","Sat Mar 23 04:09:59 UTC 2024","Sat Mar 23 04:10:27 UTC 2024","27473","","Login: [FNN-563] Log in from the header Negative","","Login: [FNN-563] Log in from the header Negative","should log in without credentials","should log in without credentials",""
"passed","Sat Mar 23 04:31:32 UTC 2024","Sat Mar 23 04:32:20 UTC 2024","48056","","My Network: [FNN-1233] Invite manually via email without custom message with signup bonus","","My Network: [FNN-1233] Invite manually via email without custom message with signup bonus","should check My Dashboard and My Transactions page for the signup bonus as the inviter user","should check My Dashboard and My Transactions page for the signup bonus as the inviter user",""
"passed","Sat Mar 23 04:13:08 UTC 2024","Sat Mar 23 04:13:36 UTC 2024","28935","","Upgrade: [FNN-659] Upgrade account Negative","","Upgrade: [FNN-659] Upgrade account Negative","should upgrade account to Standard 1 month: Insufficient funds decline","should upgrade account to Standard 1 month: Insufficient funds decline",""
"broken","Sat Mar 23 05:18:14 UTC 2024","Sat Mar 23 05:18:16 UTC 2024","2381","","My Transactions: [FNN-1432] Milestones project: Start project. Negative","","My Transactions: [FNN-1432] Milestones project: Start project. Negative","should start project without Way of paying","should start project without Way of paying",""
"passed","Sat Mar 23 05:05:24 UTC 2024","Sat Mar 23 05:06:21 UTC 2024","57336","","My Network: [FNN-619] Invite manually via sms with signup bonus","","My Network: [FNN-619] Invite manually via sms with signup bonus","should invite manually via sms with valid recipient details","should invite manually via sms with valid recipient details",""
"passed","Sat Mar 23 04:09:51 UTC 2024","Sat Mar 23 04:09:55 UTC 2024","3860","","Login: [FNN-563] Log in from the header Negative","","Login: [FNN-563] Log in from the header Negative","should log in with wrong email format","should log in with wrong email format",""
"passed","Sat Mar 23 05:18:48 UTC 2024","Sat Mar 23 05:18:58 UTC 2024","9885","","My Transactions: [FNN-710] Milestones project: In advance. Positive","","My Transactions: [FNN-710] Milestones project: In advance. Positive","should accept the project","should accept the project",""
"passed","Sat Mar 23 04:57:33 UTC 2024","Sat Mar 23 04:57:44 UTC 2024","11187","","CR: [FNN-744] CR Subscribe Negative","","CR: [FNN-744] CR Subscribe Negative","should subscribe as CR without agreeing to the Terms and Conditions","should subscribe as CR without agreeing to the Terms and Conditions",""
"passed","Sat Mar 23 04:39:19 UTC 2024","Sat Mar 23 04:40:08 UTC 2024","49430","","Freelancer search: [FNN-822] Send message","","Freelancer search: [FNN-822] Send message","should check the message as the freelancer user","should check the message as the freelancer user",""
"skipped","Sat Mar 23 04:43:18 UTC 2024","Sat Mar 23 04:43:18 UTC 2024","0","","[FNN-667] Send contact","","[FNN-667] Send contact","should forward the contact request","should forward the contact request",""
"passed","Sat Mar 23 04:09:45 UTC 2024","Sat Mar 23 04:09:51 UTC 2024","5768","","Login: [FNN-563] Log in from the header Negative","","Login: [FNN-563] Log in from the header Negative","should log in with invalid credentials","should log in with invalid credentials",""
"passed","Sat Mar 23 05:09:10 UTC 2024","Sat Mar 23 05:09:32 UTC 2024","22032","","Post Project: [FNN-588] Post project without account Negative","","Post Project: [FNN-588] Post project without account Negative","should post project with short password and repeat password","should post project with short password and repeat password",""
