"Status","Start Time","Stop Time","Duration in ms","Parent Suite","Suite","Sub Suite","Test Class","Test Method","Name","Description"
"passed","Fri Jan 05 04:45:14 UTC 2024","Fri Jan 05 04:45:23 UTC 2024","8259","","My Transactions: [FNN-738] Milestones project: Add milestone. Negative","","My Transactions: [FNN-738] Milestones project: Add milestone. Negative","should add milestone without Amount","should add milestone without Amount",""
"passed","Fri Jan 05 04:54:23 UTC 2024","Fri Jan 05 04:54:40 UTC 2024","16159","","Post Project: [FNN-588] Post project without account Negative","","Post Project: [FNN-588] Post project without account Negative","should post project without password","should post project without password",""
"passed","Fri Jan 05 04:07:57 UTC 2024","Fri Jan 05 04:07:59 UTC 2024","2563","","Login: [FNN-563] Log in from the header Negative","","Login: [FNN-563] Log in from the header Negative","should log in with wrong email format","should log in with wrong email format",""
"passed","Fri Jan 05 04:25:50 UTC 2024","Fri Jan 05 04:25:55 UTC 2024","4972","","My Network: [FNN-620] Invite manually via email and sms Negative","","My Network: [FNN-620] Invite manually via email and sms Negative","should invite manually via email with wrong email format","should invite manually via email with wrong email format",""
"passed","Fri Jan 05 04:51:39 UTC 2024","Fri Jan 05 04:51:51 UTC 2024","12012","","Post Project: [FNN-588] Post project without account Negative","","Post Project: [FNN-588] Post project without account Negative","should post project without first name","should post project without first name",""
"passed","Fri Jan 05 04:18:25 UTC 2024","Fri Jan 05 04:19:09 UTC 2024","43870","","Settings: [FNN-671] Change email address Positive","","Settings: [FNN-671] Change email address Positive","should change email address with valid credentials","should change email address with valid credentials",""
"passed","Fri Jan 05 04:29:33 UTC 2024","Fri Jan 05 04:30:11 UTC 2024","37857","","Freelancer search: [FNN-815] Freelancer search as non-CR user","","Freelancer search: [FNN-815] Freelancer search as non-CR user","should filter freelancers by Skills","should filter freelancers by Skills",""
"passed","Fri Jan 05 04:51:15 UTC 2024","Fri Jan 05 04:51:19 UTC 2024","4100","","My Profile: [FNN-719] Add resume Negative","","My Profile: [FNN-719] Add resume Negative","should add certificate without achieved annual","should add certificate without achieved annual",""
"passed","Fri Jan 05 04:45:36 UTC 2024","Fri Jan 05 04:45:59 UTC 2024","22514","","My Transactions: [FNN-738] Milestones project: Add milestone. Negative","","My Transactions: [FNN-738] Milestones project: Add milestone. Negative","should add milestone with Amount less than 250","should add milestone with Amount less than 250",""
"passed","Fri Jan 05 04:51:07 UTC 2024","Fri Jan 05 04:51:11 UTC 2024","3917","","My Profile: [FNN-719] Add resume Negative","","My Profile: [FNN-719] Add resume Negative","should add certificate without certificate","should add certificate without certificate",""
"broken","Fri Jan 05 05:02:31 UTC 2024","Fri Jan 05 05:06:29 UTC 2024","238238","","My Transactions: [FNN-1439] Hourly project: Add time. Negative","","My Transactions: [FNN-1439] Hourly project: Add time. Negative","""before all"" hook for [FNN-1439] Hourly project: Add time. Negative","""before all"" hook for [FNN-1439] Hourly project: Add time. Negative",""
"passed","Fri Jan 05 04:49:14 UTC 2024","Fri Jan 05 04:49:31 UTC 2024","16818","","My Profile: [FNN-730] Request reference Negative","","My Profile: [FNN-730] Request reference Negative","should pass step 3 without 1 rating","should pass step 3 without 1 rating",""
"broken","Fri Jan 05 04:49:21 UTC 2024","Fri Jan 05 04:49:26 UTC 2024","5046","","Settings: [FNN-673] Confirm email address","","Settings: [FNN-673] Confirm email address","""before all"" hook for [FNN-673] Confirm email address","""before all"" hook for [FNN-673] Confirm email address",""
"passed","Fri Jan 05 04:08:04 UTC 2024","Fri Jan 05 04:08:26 UTC 2024","22280","","Login: [FNN-574] Log in from the Login page Negative","","Login: [FNN-574] Log in from the Login page Negative","should log in without credentials","should log in without credentials",""
"passed","Fri Jan 05 04:09:15 UTC 2024","Fri Jan 05 04:09:25 UTC 2024","10274","","Subscribe: [FNN-577] Subscribe Negative","","Subscribe: [FNN-577] Subscribe Negative","should subscribe with wrong phone number","should subscribe with wrong phone number",""
"failed","Fri Jan 05 04:48:36 UTC 2024","Fri Jan 05 04:50:15 UTC 2024","98972","","Post Project: [FNN-650] Post project without account Positive","","Post Project: [FNN-650] Post project without account Positive","should post a project as an unregistered user with valid project data","should post a project as an unregistered user with valid project data",""
"passed","Fri Jan 05 04:07:53 UTC 2024","Fri Jan 05 04:07:57 UTC 2024","3532","","Login: [FNN-563] Log in from the header Negative","","Login: [FNN-563] Log in from the header Negative","should log in with invalid credentials","should log in with invalid credentials",""
