"Status","Start Time","Stop Time","Duration in ms","Parent Suite","Suite","Sub Suite","Test Class","Test Method","Name","Description"
"passed","Sun Mar 31 04:35:44 UTC 2024","Sun Mar 31 04:37:13 UTC 2024","89648","","My Projects: [FNN-1093] Pause project","","My Projects: [FNN-1093] Pause project","should verify status of the project as unregistered user","should verify status of the project as unregistered user",""
"passed","Sun Mar 31 04:59:54 UTC 2024","Sun Mar 31 05:00:03 UTC 2024","8949","","My Profile: [FNN-668] Edit account details Negative","","My Profile: [FNN-668] Edit account details Negative","should edit account details with invalid Twitter, LinkedIn and Website urls","should edit account details with invalid Twitter, LinkedIn and Website urls",""
"passed","Sun Mar 31 04:56:51 UTC 2024","Sun Mar 31 04:57:04 UTC 2024","12341","","CR: [FNN-744] CR Subscribe Negative","","CR: [FNN-744] CR Subscribe Negative","should subscribe as CR without phone number","should subscribe as CR without phone number",""
"passed","Sun Mar 31 04:27:14 UTC 2024","Sun Mar 31 04:28:59 UTC 2024","104216","","Settings: [FNN-679] Delete account with subscription","","Settings: [FNN-679] Delete account with subscription","should delete account with subscription","should delete account with subscription",""
"passed","Sun Mar 31 05:01:31 UTC 2024","Sun Mar 31 05:01:43 UTC 2024","11363","","My Profile: [FNN-719] Add resume Negative","","My Profile: [FNN-719] Add resume Negative","should add experience without company","should add experience without company",""
"passed","Sun Mar 31 05:20:26 UTC 2024","Sun Mar 31 05:22:30 UTC 2024","124582","","CR: [FNN-750] Invite to the organization through search","","CR: [FNN-750] Invite to the organization through search","should invite freelancer","should invite freelancer",""
"passed","Sun Mar 31 04:15:41 UTC 2024","Sun Mar 31 04:15:47 UTC 2024","6270","","My Profile: [FNN-690] Add resume Positive","","My Profile: [FNN-690] Add resume Positive","should add Motivation","should add Motivation",""
"passed","Sun Mar 31 04:10:27 UTC 2024","Sun Mar 31 04:10:51 UTC 2024","24775","","Login: [FNN-574] Log in from the Login page Negative","","Login: [FNN-574] Log in from the Login page Negative","should log in with valid email and invalid password","should log in with valid email and invalid password",""
"passed","Sun Mar 31 04:09:07 UTC 2024","Sun Mar 31 04:10:22 UTC 2024","74527","","Subscribe: [FNN-577] Subscribe Negative","","Subscribe: [FNN-577] Subscribe Negative","should subscribe without category","should subscribe without category",""
"passed","Sun Mar 31 04:25:32 UTC 2024","Sun Mar 31 04:25:50 UTC 2024","17358","","Settings: [FNN-672] Change email address Negative","","Settings: [FNN-672] Change email address Negative","should change email address with invalid email format","should change email address with invalid email format",""
"broken","Sun Mar 31 05:06:13 UTC 2024","Sun Mar 31 05:10:41 UTC 2024","267691","","My Projects: [FNN-1058] Complete project Negative","","My Projects: [FNN-1058] Complete project Negative","""before each"" hook for [FNN-1058] Complete project Negative","""before each"" hook for [FNN-1058] Complete project Negative",""
"broken","Sun Mar 31 05:24:13 UTC 2024","Sun Mar 31 05:24:14 UTC 2024","1661","","My Transactions: [FNN-737] Hourly project: Start project. Negative","","My Transactions: [FNN-737] Hourly project: Start project. Negative","should start project without Hourly rate","should start project without Hourly rate",""
"passed","Sun Mar 31 04:32:06 UTC 2024","Sun Mar 31 04:32:58 UTC 2024","51741","","My Network: [FNN-1233] Invite manually via email without custom message with signup bonus","","My Network: [FNN-1233] Invite manually via email without custom message with signup bonus","should check My Dashboard and My Transactions page for the signup bonus as the inviter user","should check My Dashboard and My Transactions page for the signup bonus as the inviter user",""
"passed","Sun Mar 31 04:39:06 UTC 2024","Sun Mar 31 04:42:34 UTC 2024","208805","","Freelancer search: [FNN-924] Freelancer search as CR user","","Freelancer search: [FNN-924] Freelancer search as CR user","should filter freelancers by Terms","should filter freelancers by Terms",""
"passed","Sun Mar 31 05:04:13 UTC 2024","Sun Mar 31 05:04:23 UTC 2024","10267","","My Profile: [FNN-730] Request reference Negative","","My Profile: [FNN-730] Request reference Negative","should pass step 3 without 2 rating","should pass step 3 without 2 rating",""
"passed","Sun Mar 31 05:03:38 UTC 2024","Sun Mar 31 05:03:42 UTC 2024","4202","","My Profile: [FNN-719] Add resume Negative","","My Profile: [FNN-719] Add resume Negative","should add certificate without data","should add certificate without data",""
"skipped","Sun Mar 31 05:21:43 UTC 2024","Sun Mar 31 05:21:43 UTC 2024","0","","My Transactions: [FNN-710] Milestones project: In advance. Positive","","My Transactions: [FNN-710] Milestones project: In advance. Positive","should approve milestone","should approve milestone",""
"skipped","Sun Mar 31 05:12:00 UTC 2024","Sun Mar 31 05:12:00 UTC 2024","0","","My Network: [FNN-1027] Invite freelancers","","My Network: [FNN-1027] Invite freelancers","should accept an invitation","should accept an invitation",""
"passed","Sun Mar 31 05:05:51 UTC 2024","Sun Mar 31 05:06:57 UTC 2024","65709","","My Network: [FNN-619] Invite manually via sms with signup bonus","","My Network: [FNN-619] Invite manually via sms with signup bonus","should subscribe as the freelancer with recipient details and accept the invitation","should subscribe as the freelancer with recipient details and accept the invitation",""
"passed","Sun Mar 31 04:25:36 UTC 2024","Sun Mar 31 04:27:03 UTC 2024","87699","","Settings: [FNN-674] Change password Positive","","Settings: [FNN-674] Change password Positive","should change password with valid credentials","should change password with valid credentials",""
"passed","Sun Mar 31 04:14:56 UTC 2024","Sun Mar 31 04:15:16 UTC 2024","19592","","My Profile: [FNN-690] Add resume Positive","","My Profile: [FNN-690] Add resume Positive","should add Experience","should add Experience",""
"broken","Sun Mar 31 05:02:50 UTC 2024","Sun Mar 31 05:03:17 UTC 2024","26801","","Post Project: [FNN-650] Post project without account Positive","","Post Project: [FNN-650] Post project without account Positive","should verify that the project informations is correct","should verify that the project informations is correct",""
"passed","Sun Mar 31 04:11:02 UTC 2024","Sun Mar 31 04:11:05 UTC 2024","3447","","Login: [FNN-574] Log in from the Login page Negative","","Login: [FNN-574] Log in from the Login page Negative","should log in without email","should log in without email",""
"passed","Sun Mar 31 04:14:32 UTC 2024","Sun Mar 31 04:15:01 UTC 2024","28906","","Upgrade: [FNN-659] Upgrade account Negative","","Upgrade: [FNN-659] Upgrade account Negative","should upgrade account to Standard 1 month: Stolen card decline","should upgrade account to Standard 1 month: Stolen card decline",""
"passed","Sun Mar 31 04:11:59 UTC 2024","Sun Mar 31 04:12:12 UTC 2024","13253","","Subscribe: [FNN-577] Subscribe Negative","","Subscribe: [FNN-577] Subscribe Negative","should subscribe without password","should subscribe without password",""
"passed","Sun Mar 31 04:10:51 UTC 2024","Sun Mar 31 04:10:57 UTC 2024","5523","","Login: [FNN-574] Log in from the Login page Negative","","Login: [FNN-574] Log in from the Login page Negative","should log in with invalid credentials","should log in with invalid credentials",""
"passed","Sun Mar 31 04:43:27 UTC 2024","Sun Mar 31 04:43:51 UTC 2024","23474","","Freelancer search: [FNN-924] Freelancer search as CR user","","Freelancer search: [FNN-924] Freelancer search as CR user","should filter freelancers by Hourly Rate","should filter freelancers by Hourly Rate",""
"passed","Sun Mar 31 05:07:14 UTC 2024","Sun Mar 31 05:08:51 UTC 2024","97162","","Freelancer search: [FNN-815] Freelancer search as non-CR user","","Freelancer search: [FNN-815] Freelancer search as non-CR user","should filter freelancers by Sector","should filter freelancers by Sector",""
"passed","Sun Mar 31 04:58:41 UTC 2024","Sun Mar 31 05:01:07 UTC 2024","145967","","My Profile: [FNN-669] Edit account details Positive","","My Profile: [FNN-669] Edit account details Positive","should edit freelancer account details with valid information","should edit freelancer account details with valid information",""
"passed","Sun Mar 31 05:04:05 UTC 2024","Sun Mar 31 05:04:08 UTC 2024","3027","","My Profile: [FNN-719] Add resume Negative","","My Profile: [FNN-719] Add resume Negative","should add language without levels","should add language without levels",""
"passed","Sun Mar 31 05:03:27 UTC 2024","Sun Mar 31 05:03:42 UTC 2024","15759","","My Profile: [FNN-730] Request reference Negative","","My Profile: [FNN-730] Request reference Negative","should pass step 3 without data","should pass step 3 without data",""
"passed","Sun Mar 31 05:03:17 UTC 2024","Sun Mar 31 05:03:22 UTC 2024","4623","","Post Project: [FNN-650] Post project without account Positive","","Post Project: [FNN-650] Post project without account Positive","should verify that the user received a verify email letter","should verify that the user received a verify email letter",""
"passed","Sun Mar 31 04:45:03 UTC 2024","Sun Mar 31 04:46:21 UTC 2024","78475","","[FNN-813] Change language","","[FNN-813] Change language","should change language to Dutch from the footer","should change language to Dutch from the footer",""
"passed","Sun Mar 31 04:57:40 UTC 2024","Sun Mar 31 04:57:50 UTC 2024","9827","","CR: [FNN-744] CR Subscribe Negative","","CR: [FNN-744] CR Subscribe Negative","should subscribe as CR without repeat password","should subscribe as CR without repeat password",""
"passed","Sun Mar 31 04:28:24 UTC 2024","Sun Mar 31 04:30:48 UTC 2024","144638","","Search Project: [FNN-568] Project search","","Search Project: [FNN-568] Project search","should filter projects by Category","should filter projects by Category",""
"passed","Sun Mar 31 05:04:44 UTC 2024","Sun Mar 31 05:04:53 UTC 2024","8973","","My Profile: [FNN-730] Request reference Negative","","My Profile: [FNN-730] Request reference Negative","should pass step 3 without comments","should pass step 3 without comments",""
"failed","Sun Mar 31 05:10:47 UTC 2024","Sun Mar 31 05:11:33 UTC 2024","45820","","My Network: [FNN-664] Invite freelancer","","My Network: [FNN-664] Invite freelancer","should check network as sender user","should check network as sender user",""
"passed","Sun Mar 31 04:14:49 UTC 2024","Sun Mar 31 04:17:21 UTC 2024","152118","","Upgrade: [FNN-658] Upgrade account Positive","","Upgrade: [FNN-658] Upgrade account Positive","should upgrade account to Business 1 month","should upgrade account to Business 1 month",""
"passed","Sun Mar 31 05:01:13 UTC 2024","Sun Mar 31 05:01:38 UTC 2024","24239","","Post Project: [FNN-588] Post project without account Negative","","Post Project: [FNN-588] Post project without account Negative","should post project with wrong email","should post project with wrong email",""
"passed","Sun Mar 31 04:20:27 UTC 2024","Sun Mar 31 04:22:47 UTC 2024","140303","","My Profile: [FNN-793] Remove resume","","My Profile: [FNN-793] Remove resume","should remove resume","should remove resume",""
"failed","Sun Mar 31 05:13:46 UTC 2024","Sun Mar 31 05:14:09 UTC 2024","22783","","Freelancer search: [FNN-822] Send message","","Freelancer search: [FNN-822] Send message","should check the message as the CR user","should check the message as the CR user",""
"passed","Sun Mar 31 04:58:27 UTC 2024","Sun Mar 31 04:58:28 UTC 2024","1711","","CR: [FNN-744] CR Subscribe Negative","","CR: [FNN-744] CR Subscribe Negative","should subscribe as CR without data","should subscribe as CR without data",""
"skipped","Sun Mar 31 04:45:11 UTC 2024","Sun Mar 31 04:45:11 UTC 2024","1","","[FNN-667] Send contact","","[FNN-667] Send contact","should check the contact as the first user","should check the contact as the first user",""
"passed","Sun Mar 31 04:41:11 UTC 2024","Sun Mar 31 04:41:47 UTC 2024","35926","","Create Profile: [FNN-684] Create profile Negative","","Create Profile: [FNN-684] Create profile Negative","should create profile without required fields","should create profile without required fields",""
"passed","Sun Mar 31 04:17:21 UTC 2024","Sun Mar 31 04:20:21 UTC 2024","180312","","Upgrade: [FNN-658] Upgrade account Positive","","Upgrade: [FNN-658] Upgrade account Positive","should upgrade account to Enterprise 1 month","should upgrade account to Enterprise 1 month",""
"skipped","Sun Mar 31 05:03:17 UTC 2024","Sun Mar 31 05:03:17 UTC 2024","0","","Post Project: [FNN-650] Post project without account Positive","","Post Project: [FNN-650] Post project without account Positive","should verify that the user received a welcome letter","should verify that the user received a welcome letter",""
"passed","Sun Mar 31 04:26:41 UTC 2024","Sun Mar 31 04:27:06 UTC 2024","25161","","Settings: [FNN-675] Change password Negative","","Settings: [FNN-675] Change password Negative","should change password with invalid repeat new password","should change password with invalid repeat new password",""
"passed","Sun Mar 31 05:03:42 UTC 2024","Sun Mar 31 05:03:49 UTC 2024","6484","","My Profile: [FNN-719] Add resume Negative","","My Profile: [FNN-719] Add resume Negative","should add certificate without certificate","should add certificate without certificate",""
"passed","Sun Mar 31 04:55:06 UTC 2024","Sun Mar 31 04:57:24 UTC 2024","137806","","CR: [FNN-749] Invite to the organization manually Positive","","CR: [FNN-749] Invite to the organization manually Positive","should invite manually to the organization with valid recipient details","should invite manually to the organization with valid recipient details",""
"passed","Sun Mar 31 04:23:53 UTC 2024","Sun Mar 31 04:24:05 UTC 2024","12398","","Post Project: [FNN-649] Post project with account Negative","","Post Project: [FNN-649] Post project with account Negative","should post project without Category","should post project without Category",""
"passed","Sun Mar 31 04:44:56 UTC 2024","Sun Mar 31 04:46:47 UTC 2024","110457","","Freelancer search: [FNN-924] Freelancer search as CR user","","Freelancer search: [FNN-924] Freelancer search as CR user","should filter freelancers by Availability","should filter freelancers by Availability",""
"passed","Sun Mar 31 04:27:06 UTC 2024","Sun Mar 31 04:27:56 UTC 2024","49592","","Settings: [FNN-675] Change password Negative","","Settings: [FNN-675] Change password Negative","should change password with invalid old password","should change password with invalid old password",""
"passed","Sun Mar 31 05:04:19 UTC 2024","Sun Mar 31 05:04:50 UTC 2024","31259","","My Profile: [FNN-719] Add resume Negative","","My Profile: [FNN-719] Add resume Negative","should add language without reading level","should add language without reading level",""
"passed","Sun Mar 31 04:34:01 UTC 2024","Sun Mar 31 04:34:05 UTC 2024","4722","","My Network: [FNN-620] Invite manually via email and sms Negative","","My Network: [FNN-620] Invite manually via email and sms Negative","should invite manually via email without last name","should invite manually via email without last name",""
"passed","Sun Mar 31 04:11:44 UTC 2024","Sun Mar 31 04:11:59 UTC 2024","15073","","Subscribe: [FNN-577] Subscribe Negative","","Subscribe: [FNN-577] Subscribe Negative","should subscribe with taken phone number","should subscribe with taken phone number",""
"passed","Sun Mar 31 05:00:31 UTC 2024","Sun Mar 31 05:00:51 UTC 2024","20449","","Post Project: [FNN-588] Post project without account Negative","","Post Project: [FNN-588] Post project without account Negative","should post project without last name","should post project without last name",""
"failed","Sun Mar 31 05:06:57 UTC 2024","Sun Mar 31 05:08:09 UTC 2024","71882","","My Network: [FNN-619] Invite manually via sms with signup bonus","","My Network: [FNN-619] Invite manually via sms with signup bonus","should check My Dashboard and My Transactions page for the signup bonus as the inviter user","should check My Dashboard and My Transactions page for the signup bonus as the inviter user",""
"passed","Sun Mar 31 04:16:12 UTC 2024","Sun Mar 31 04:16:46 UTC 2024","34252","","My Profile: [FNN-690] Add resume Positive","","My Profile: [FNN-690] Add resume Positive","should check the attached part of the resume on the Profile page","should check the attached part of the resume on the Profile page",""
"passed","Sun Mar 31 04:44:16 UTC 2024","Sun Mar 31 04:44:55 UTC 2024","39267","","[FNN-717] Edit email settings","","[FNN-717] Edit email settings","should edit Notification settings and verify that the settings are saved","should edit Notification settings and verify that the settings are saved",""
"passed","Sun Mar 31 05:03:17 UTC 2024","Sun Mar 31 05:03:27 UTC 2024","9655","","My Profile: [FNN-730] Request reference Negative","","My Profile: [FNN-730] Request reference Negative","should pass step 2 with invalid website format","should pass step 2 with invalid website format",""
"passed","Sun Mar 31 04:15:16 UTC 2024","Sun Mar 31 04:15:28 UTC 2024","11861","","My Profile: [FNN-690] Add resume Positive","","My Profile: [FNN-690] Add resume Positive","should add Education","should add Education",""
"passed","Sun Mar 31 04:34:05 UTC 2024","Sun Mar 31 04:34:08 UTC 2024","2493","","My Network: [FNN-620] Invite manually via email and sms Negative","","My Network: [FNN-620] Invite manually via email and sms Negative","should invite manually via email without data","should invite manually via email without data",""
"passed","Sun Mar 31 04:59:46 UTC 2024","Sun Mar 31 04:59:50 UTC 2024","3945","","My Profile: [FNN-668] Edit account details Negative","","My Profile: [FNN-668] Edit account details Negative","should edit account details without sector","should edit account details without sector",""
"passed","Sun Mar 31 04:31:01 UTC 2024","Sun Mar 31 04:31:12 UTC 2024","10593","","Search Project: [FNN-568] Project search","","Search Project: [FNN-568] Project search","should filter projects by Location","should filter projects by Location",""
"passed","Sun Mar 31 04:24:18 UTC 2024","Sun Mar 31 04:24:34 UTC 2024","15651","","Post Project: [FNN-649] Post project with account Negative","","Post Project: [FNN-649] Post project with account Negative","should post project without Budget","should post project without Budget",""
"passed","Sun Mar 31 04:41:59 UTC 2024","Sun Mar 31 04:42:04 UTC 2024","4891","","Create Profile: [FNN-684] Create profile Negative","","Create Profile: [FNN-684] Create profile Negative","should create profile with wrong website","should create profile with wrong website",""
"passed","Sun Mar 31 04:53:21 UTC 2024","Sun Mar 31 04:54:19 UTC 2024","57791","","CR: [FNN-742] CR subscribe Positive","","CR: [FNN-742] CR subscribe Positive","should subscribe as CR with valid credentials","should subscribe as CR with valid credentials",""
"passed","Sun Mar 31 04:56:37 UTC 2024","Sun Mar 31 04:56:51 UTC 2024","13750","","CR: [FNN-744] CR Subscribe Negative","","CR: [FNN-744] CR Subscribe Negative","should subscribe as CR with taken email","should subscribe as CR with taken email",""
"passed","Sun Mar 31 04:25:42 UTC 2024","Sun Mar 31 04:26:22 UTC 2024","40089","","Settings: [FNN-675] Change password Negative","","Settings: [FNN-675] Change password Negative","should change password without new and repeat password","should change password without new and repeat password",""
"passed","Sun Mar 31 05:01:55 UTC 2024","Sun Mar 31 05:02:07 UTC 2024","12148","","My Profile: [FNN-719] Add resume Negative","","My Profile: [FNN-719] Add resume Negative","should add experience without period until","should add experience without period until",""
"passed","Sun Mar 31 05:00:20 UTC 2024","Sun Mar 31 05:01:19 UTC 2024","59091","","My Profile: [FNN-719] Add resume Negative","","My Profile: [FNN-719] Add resume Negative","should add CV without CV","should add CV without CV",""
"passed","Sun Mar 31 04:31:58 UTC 2024","Sun Mar 31 04:32:03 UTC 2024","4608","","Search Project: [FNN-568] Project search","","Search Project: [FNN-568] Project search","should filter projects by Status All projects","should filter projects by Status All projects",""
"passed","Sun Mar 31 04:10:00 UTC 2024","Sun Mar 31 04:10:04 UTC 2024","3691","","Login: [FNN-563] Log in from the header Negative","","Login: [FNN-563] Log in from the header Negative","should log in with wrong email format","should log in with wrong email format",""
"skipped","Sun Mar 31 04:42:41 UTC 2024","Sun Mar 31 04:45:11 UTC 2024","149809","","[FNN-667] Send contact","","[FNN-667] Send contact","should send a contact","should send a contact",""
"passed","Sun Mar 31 04:59:50 UTC 2024","Sun Mar 31 04:59:54 UTC 2024","4682","","My Profile: [FNN-668] Edit account details Negative","","My Profile: [FNN-668] Edit account details Negative","should edit account details with invalid phone number","should edit account details with invalid phone number",""
"passed","Sun Mar 31 04:09:05 UTC 2024","Sun Mar 31 04:10:23 UTC 2024","77490","","Subscribe: [FNN-2167] 500 € signup bonus","","Subscribe: [FNN-2167] 500 € signup bonus","should verify 500€ signup bonus","should verify 500€ signup bonus",""
"passed","Sun Mar 31 04:58:55 UTC 2024","Sun Mar 31 05:00:08 UTC 2024","73586","","Post Project: [FNN-588] Post project without account Negative","","Post Project: [FNN-588] Post project without account Negative","should post project without account details","should post project without account details",""
"failed","Sun Mar 31 05:22:30 UTC 2024","Sun Mar 31 05:23:08 UTC 2024","38099","","CR: [FNN-750] Invite to the organization through search","","CR: [FNN-750] Invite to the organization through search","should accept invitation","should accept invitation",""
"passed","Sun Mar 31 04:13:50 UTC 2024","Sun Mar 31 04:14:56 UTC 2024","66355","","My Profile: [FNN-690] Add resume Positive","","My Profile: [FNN-690] Add resume Positive","should add CV","should add CV",""
"passed","Sun Mar 31 04:42:09 UTC 2024","Sun Mar 31 04:45:46 UTC 2024","217925","","[FNN-661] Send interest","","[FNN-661] Send interest","should send interest in the employer's project","should send interest in the employer's project",""
"passed","Sun Mar 31 04:26:11 UTC 2024","Sun Mar 31 04:27:02 UTC 2024","50621","","Post Project: [FNN-649] Post project with account Negative","","Post Project: [FNN-649] Post project with account Negative","should post project with short Description","should post project with short Description",""
"skipped","Sun Mar 31 05:24:01 UTC 2024","Sun Mar 31 05:24:01 UTC 2024","1","","My Transactions: [FNN-708] Hourly project: In advance. Positive","","My Transactions: [FNN-708] Hourly project: In advance. Positive","should approve the time and pay for extra money","should approve the time and pay for extra money",""
"passed","Sun Mar 31 04:15:55 UTC 2024","Sun Mar 31 04:16:03 UTC 2024","7950","","My Profile: [FNN-690] Add resume Positive","","My Profile: [FNN-690] Add resume Positive","should add Expertise","should add Expertise",""
"passed","Sun Mar 31 05:00:08 UTC 2024","Sun Mar 31 05:00:31 UTC 2024","22467","","Post Project: [FNN-588] Post project without account Negative","","Post Project: [FNN-588] Post project without account Negative","should post project without first name","should post project without first name",""
"passed","Sun Mar 31 04:26:22 UTC 2024","Sun Mar 31 04:26:41 UTC 2024","19054","","Settings: [FNN-675] Change password Negative","","Settings: [FNN-675] Change password Negative","should change password with short new password","should change password with short new password",""
"passed","Sun Mar 31 04:58:14 UTC 2024","Sun Mar 31 04:58:27 UTC 2024","12500","","CR: [FNN-744] CR Subscribe Negative","","CR: [FNN-744] CR Subscribe Negative","should subscribe as CR without agreeing to the Terms and Conditions","should subscribe as CR without agreeing to the Terms and Conditions",""
"failed","Sun Mar 31 05:02:46 UTC 2024","Sun Mar 31 05:03:27 UTC 2024","41428","","Post Project: [FNN-588] Post project without account Negative","","Post Project: [FNN-588] Post project without account Negative","should post project with taken phone number","should post project with taken phone number",""
"passed","Sun Mar 31 04:16:55 UTC 2024","Sun Mar 31 04:18:37 UTC 2024","101570","","My Profile: [FNN-698] Confirm phone number Positive","","My Profile: [FNN-698] Confirm phone number Positive","should confirm phone number with valid code","should confirm phone number with valid code",""
"skipped","Sun Mar 31 04:45:11 UTC 2024","Sun Mar 31 04:45:11 UTC 2024","0","","[FNN-667] Send contact","","[FNN-667] Send contact","should forward the contact request","should forward the contact request",""
"failed","Sun Mar 31 04:56:33 UTC 2024","Sun Mar 31 04:58:47 UTC 2024","133261","","CR: [FNN-1779] My Dashboard page integrity as Employer","","CR: [FNN-1779] My Dashboard page integrity as Employer","should verify the integrity of the My Dashboard page as employer","should verify the integrity of the My Dashboard page as employer",""
"broken","Sun Mar 31 05:24:16 UTC 2024","Sun Mar 31 05:24:18 UTC 2024","1648","","My Transactions: [FNN-737] Hourly project: Start project. Negative","","My Transactions: [FNN-737] Hourly project: Start project. Negative","should start project without Way of paying","should start project without Way of paying",""
