"Status","Start Time","Stop Time","Duration in ms","Parent Suite","Suite","Sub Suite","Test Class","Test Method","Name","Description"
"broken","Sun Mar 31 05:13:05 UTC 2024","Sun Mar 31 05:17:42 UTC 2024","276831","","My Transactions: [FNN-1430] Milestones project: In retrospect. Positive","","My Transactions: [FNN-1430] Milestones project: In retrospect. Positive","""before all"" hook for [FNN-1430] Milestones project: In retrospect. Positive","""before all"" hook for [FNN-1430] Milestones project: In retrospect. Positive",""
"passed","Sun Mar 31 05:08:51 UTC 2024","Sun Mar 31 05:09:14 UTC 2024","22304","","Freelancer search: [FNN-815] Freelancer search as non-CR user","","Freelancer search: [FNN-815] Freelancer search as non-CR user","should filter freelancers by Location","should filter freelancers by Location",""
"passed","Sun Mar 31 04:12:24 UTC 2024","Sun Mar 31 04:12:37 UTC 2024","13127","","Subscribe: [FNN-577] Subscribe Negative","","Subscribe: [FNN-577] Subscribe Negative","should subscribe with short password","should subscribe with short password",""
"passed","Sun Mar 31 04:25:52 UTC 2024","Sun Mar 31 04:26:11 UTC 2024","19298","","Post Project: [FNN-649] Post project with account Negative","","Post Project: [FNN-649] Post project with account Negative","should post project without Description","should post project without Description",""
"failed","Sun Mar 31 04:09:07 UTC 2024","Sun Mar 31 04:10:27 UTC 2024","80041","","CR: [FNN-1779] My Dashboard page integrity as Employer","","CR: [FNN-1779] My Dashboard page integrity as Employer","""before all"" hook for [FNN-1779] My Dashboard page integrity as Employer","""before all"" hook for [FNN-1779] My Dashboard page integrity as Employer",""
"passed","Sun Mar 31 04:20:31 UTC 2024","Sun Mar 31 04:22:20 UTC 2024","109055","","My Profile: [FNN-795] Remove portfolio","","My Profile: [FNN-795] Remove portfolio","should remove portfolio","should remove portfolio",""
"passed","Sun Mar 31 04:24:05 UTC 2024","Sun Mar 31 04:24:18 UTC 2024","12991","","Post Project: [FNN-649] Post project with account Negative","","Post Project: [FNN-649] Post project with account Negative","should post project without step 2","should post project without step 2",""
"passed","Sun Mar 31 04:31:42 UTC 2024","Sun Mar 31 04:31:58 UTC 2024","16389","","Search Project: [FNN-568] Project search","","Search Project: [FNN-568] Project search","should filter projects by Hourly rate","should filter projects by Hourly rate",""
"passed","Sun Mar 31 05:10:41 UTC 2024","Sun Mar 31 05:11:54 UTC 2024","73501","","My Projects: [FNN-1058] Complete project Negative","","My Projects: [FNN-1058] Complete project Negative","should complete project with short Comments","should complete project with short Comments",""
"passed","Sun Mar 31 04:58:03 UTC 2024","Sun Mar 31 04:58:14 UTC 2024","11502","","CR: [FNN-744] CR Subscribe Negative","","CR: [FNN-744] CR Subscribe Negative","should subscribe as CR with invalid repeat password","should subscribe as CR with invalid repeat password",""
"passed","Sun Mar 31 04:25:11 UTC 2024","Sun Mar 31 04:25:30 UTC 2024","18750","","Post Project: [FNN-649] Post project with account Negative","","Post Project: [FNN-649] Post project with account Negative","should post project without Start date","should post project without Start date",""
"passed","Sun Mar 31 05:22:51 UTC 2024","Sun Mar 31 05:23:27 UTC 2024","35691","","My Transactions: [FNN-708] Hourly project: In advance. Positive","","My Transactions: [FNN-708] Hourly project: In advance. Positive","should pay deposit","should pay deposit",""
"passed","Sun Mar 31 05:03:27 UTC 2024","Sun Mar 31 05:03:49 UTC 2024","22340","","Post Project: [FNN-588] Post project without account Negative","","Post Project: [FNN-588] Post project without account Negative","should post project with wrong phone number","should post project with wrong phone number",""
"broken","Sun Mar 31 05:17:52 UTC 2024","Sun Mar 31 05:22:24 UTC 2024","271790","","My Transactions: [FNN-738] Milestones project: Add milestone. Negative","","My Transactions: [FNN-738] Milestones project: Add milestone. Negative","""before all"" hook for [FNN-738] Milestones project: Add milestone. Negative","""before all"" hook for [FNN-738] Milestones project: Add milestone. Negative",""
"broken","Sun Mar 31 05:14:36 UTC 2024","Sun Mar 31 05:19:14 UTC 2024","277883","","My Transactions: [FNN-1432] Milestones project: Start project. Negative","","My Transactions: [FNN-1432] Milestones project: Start project. Negative","""before all"" hook for [FNN-1432] Milestones project: Start project. Negative","""before all"" hook for [FNN-1432] Milestones project: Start project. Negative",""
"passed","Sun Mar 31 05:09:14 UTC 2024","Sun Mar 31 05:09:37 UTC 2024","23350","","Freelancer search: [FNN-815] Freelancer search as non-CR user","","Freelancer search: [FNN-815] Freelancer search as non-CR user","should filter freelancers by Hourly Rate","should filter freelancers by Hourly Rate",""
"passed","Sun Mar 31 05:01:22 UTC 2024","Sun Mar 31 05:01:31 UTC 2024","8794","","My Profile: [FNN-719] Add resume Negative","","My Profile: [FNN-719] Add resume Negative","should add experience without position","should add experience without position",""
"passed","Sun Mar 31 04:56:12 UTC 2024","Sun Mar 31 04:56:25 UTC 2024","12488","","CR: [FNN-744] CR Subscribe Negative","","CR: [FNN-744] CR Subscribe Negative","should subscribe as CR without email","should subscribe as CR without email",""
"passed","Sun Mar 31 04:35:38 UTC 2024","Sun Mar 31 04:37:58 UTC 2024","140067","","Freelancer search: [FNN-816] Create list Functionality","","Freelancer search: [FNN-816] Create list Functionality","should create a list of freelancers","should create a list of freelancers",""
"passed","Sun Mar 31 04:10:54 UTC 2024","Sun Mar 31 04:11:06 UTC 2024","12444","","Subscribe: [FNN-577] Subscribe Negative","","Subscribe: [FNN-577] Subscribe Negative","should subscribe with wrong email format","should subscribe with wrong email format",""
"passed","Sun Mar 31 04:59:32 UTC 2024","Sun Mar 31 05:00:46 UTC 2024","73895","","Post Project: [FNN-587] Post project with account Positive","","Post Project: [FNN-587] Post project with account Positive","should post a project as a registered user with valid project data","should post a project as a registered user with valid project data",""
"passed","Sun Mar 31 04:24:09 UTC 2024","Sun Mar 31 04:25:28 UTC 2024","78783","","Settings: [FNN-671] Change email address Positive","","Settings: [FNN-671] Change email address Positive","should change email address with valid credentials","should change email address with valid credentials",""
"passed","Sun Mar 31 04:10:09 UTC 2024","Sun Mar 31 04:10:38 UTC 2024","29180","","Login: [FNN-563] Log in from the header Negative","","Login: [FNN-563] Log in from the header Negative","should log in without credentials","should log in without credentials",""
"passed","Sun Mar 31 04:18:51 UTC 2024","Sun Mar 31 04:19:10 UTC 2024","18491","","My Profile: [FNN-699] Request reference Positive","","My Profile: [FNN-699] Request reference Positive","should validate reference","should validate reference",""
"passed","Sun Mar 31 04:16:55 UTC 2024","Sun Mar 31 04:17:55 UTC 2024","60161","","Upgrade: [FNN-659] Upgrade account Negative","","Upgrade: [FNN-659] Upgrade account Negative","should upgrade account to Standard 1 month: Exceeding velocity limit decline","should upgrade account to Standard 1 month: Exceeding velocity limit decline",""
"passed","Sun Mar 31 05:22:37 UTC 2024","Sun Mar 31 05:22:51 UTC 2024","13597","","My Transactions: [FNN-708] Hourly project: In advance. Positive","","My Transactions: [FNN-708] Hourly project: In advance. Positive","should accept the project","should accept the project",""
"passed","Sun Mar 31 04:12:06 UTC 2024","Sun Mar 31 04:13:36 UTC 2024","90337","","Reset password: [FNN-656] Reset password Positive","","Reset password: [FNN-656] Reset password Positive","should reset password with valid credentials","should reset password with valid credentials",""
"passed","Sun Mar 31 04:17:09 UTC 2024","Sun Mar 31 04:18:51 UTC 2024","102594","","My Profile: [FNN-699] Request reference Positive","","My Profile: [FNN-699] Request reference Positive","should add experience and request reference","should add experience and request reference",""
"passed","Sun Mar 31 04:10:32 UTC 2024","Sun Mar 31 04:10:42 UTC 2024","9764","","Subscribe: [FNN-577] Subscribe Negative","","Subscribe: [FNN-577] Subscribe Negative","should subscribe without last name","should subscribe without last name",""
"passed","Sun Mar 31 04:57:50 UTC 2024","Sun Mar 31 04:58:03 UTC 2024","12721","","CR: [FNN-744] CR Subscribe Negative","","CR: [FNN-744] CR Subscribe Negative","should subscribe as CR with short password","should subscribe as CR with short password",""
"passed","Sun Mar 31 04:15:47 UTC 2024","Sun Mar 31 04:15:55 UTC 2024","7254","","My Profile: [FNN-690] Add resume Positive","","My Profile: [FNN-690] Add resume Positive","should add Qualities","should add Qualities",""
"failed","Sun Mar 31 05:23:27 UTC 2024","Sun Mar 31 05:24:01 UTC 2024","34634","","My Transactions: [FNN-708] Hourly project: In advance. Positive","","My Transactions: [FNN-708] Hourly project: In advance. Positive","should add hours","should add hours",""
"passed","Sun Mar 31 04:15:07 UTC 2024","Sun Mar 31 04:16:57 UTC 2024","109471","","My Profile: [FNN-695] Add portfolio Positive","","My Profile: [FNN-695] Add portfolio Positive","should add portfolio","should add portfolio",""
"passed","Sun Mar 31 04:10:42 UTC 2024","Sun Mar 31 04:10:54 UTC 2024","11955","","Subscribe: [FNN-577] Subscribe Negative","","Subscribe: [FNN-577] Subscribe Negative","should subscribe without email","should subscribe without email",""
"passed","Sun Mar 31 04:09:07 UTC 2024","Sun Mar 31 04:09:53 UTC 2024","46333","","Login: [FNN-563] Log in from the header Negative","","Login: [FNN-563] Log in from the header Negative","should log in with valid email and invalid password","should log in with valid email and invalid password",""
"passed","Sun Mar 31 04:32:24 UTC 2024","Sun Mar 31 04:32:34 UTC 2024","9266","","Search Project: [FNN-568] Project search","","Search Project: [FNN-568] Project search","should filter projects by Posted since Last 30 days","should filter projects by Posted since Last 30 days",""
"skipped","Sun Mar 31 05:24:01 UTC 2024","Sun Mar 31 05:24:01 UTC 2024","1","","My Transactions: [FNN-708] Hourly project: In advance. Positive","","My Transactions: [FNN-708] Hourly project: In advance. Positive","should close the period","should close the period",""
"failed","Sun Mar 31 04:22:28 UTC 2024","Sun Mar 31 04:23:07 UTC 2024","39572","","Post Project: [FNN-588] Post project without account Negative","","Post Project: [FNN-588] Post project without account Negative","""before all"" hook for [FNN-588] Post project without account Negative","""before all"" hook for [FNN-588] Post project without account Negative",""
"passed","Sun Mar 31 04:33:01 UTC 2024","Sun Mar 31 04:33:49 UTC 2024","47793","","My Network: [FNN-620] Invite manually via email and sms Negative","","My Network: [FNN-620] Invite manually via email and sms Negative","should invite manually via email without email","should invite manually via email without email",""
"passed","Sun Mar 31 04:11:06 UTC 2024","Sun Mar 31 04:11:20 UTC 2024","13923","","Subscribe: [FNN-577] Subscribe Negative","","Subscribe: [FNN-577] Subscribe Negative","should subscribe with taken email","should subscribe with taken email",""
"passed","Sun Mar 31 04:32:09 UTC 2024","Sun Mar 31 04:32:18 UTC 2024","8858","","Search Project: [FNN-568] Project search","","Search Project: [FNN-568] Project search","should filter projects by Posted since Last 3 days","should filter projects by Posted since Last 3 days",""
"passed","Sun Mar 31 04:10:04 UTC 2024","Sun Mar 31 04:10:06 UTC 2024","2667","","Login: [FNN-563] Log in from the header Negative","","Login: [FNN-563] Log in from the header Negative","should log in without email","should log in without email",""
"failed","Sun Mar 31 05:01:13 UTC 2024","Sun Mar 31 05:01:57 UTC 2024","43232","","Post Project: [FNN-587] Post project with account Positive","","Post Project: [FNN-587] Post project with account Positive","should verify that the user received a project posted letter","should verify that the user received a project posted letter",""
"skipped","Sun Mar 31 05:24:01 UTC 2024","Sun Mar 31 05:24:01 UTC 2024","1","","My Transactions: [FNN-708] Hourly project: In advance. Positive","","My Transactions: [FNN-708] Hourly project: In advance. Positive","should verify that the period is closed","should verify that the period is closed",""
"failed","Sun Mar 31 05:04:06 UTC 2024","Sun Mar 31 05:05:11 UTC 2024","65120","","My Network: [FNN-1232] Invite manually via email with custom message with signup bonus","","My Network: [FNN-1232] Invite manually via email with custom message with signup bonus","should invite manually via email with valid recipient data and with message","should invite manually via email with valid recipient data and with message",""
"passed","Sun Mar 31 04:37:58 UTC 2024","Sun Mar 31 04:38:08 UTC 2024","9486","","Freelancer search: [FNN-816] Create list Functionality","","Freelancer search: [FNN-816] Create list Functionality","should re-open original search","should re-open original search",""
"broken","Sun Mar 31 04:33:08 UTC 2024","Sun Mar 31 04:35:02 UTC 2024","113839","","My Network: [FNN-664] Invite freelancer","","My Network: [FNN-664] Invite freelancer","""before all"" hook for [FNN-664] Invite freelancer","""before all"" hook for [FNN-664] Invite freelancer",""
"passed","Sun Mar 31 04:55:48 UTC 2024","Sun Mar 31 04:56:00 UTC 2024","12027","","CR: [FNN-744] CR Subscribe Negative","","CR: [FNN-744] CR Subscribe Negative","should subscribe as CR without first name","should subscribe as CR without first name",""
"passed","Sun Mar 31 04:07:48 UTC 2024","Sun Mar 31 04:08:08 UTC 2024","20635","","Subscribe","","Subscribe","[FNN-578] Subscribe Positive","[FNN-578] Subscribe Positive",""
"passed","Sun Mar 31 05:03:58 UTC 2024","Sun Mar 31 05:04:05 UTC 2024","7509","","My Profile: [FNN-719] Add resume Negative","","My Profile: [FNN-719] Add resume Negative","should add certificate without achieved annual","should add certificate without achieved annual",""
"passed","Sun Mar 31 04:07:48 UTC 2024","Sun Mar 31 04:08:51 UTC 2024","63770","","Login: [FNN-647] Log in from the header Positive","","Login: [FNN-647] Log in from the header Positive","should log in with valid credentials","should log in with valid credentials",""
"failed","Sun Mar 31 05:01:38 UTC 2024","Sun Mar 31 05:02:24 UTC 2024","46102","","Post Project: [FNN-588] Post project without account Negative","","Post Project: [FNN-588] Post project without account Negative","should post project with taken email","should post project with taken email",""
"passed","Sun Mar 31 04:15:01 UTC 2024","Sun Mar 31 04:15:32 UTC 2024","31078","","Upgrade: [FNN-659] Upgrade account Negative","","Upgrade: [FNN-659] Upgrade account Negative","should upgrade account to Standard 1 month: Expired card decline","should upgrade account to Standard 1 month: Expired card decline",""
"broken","Sun Mar 31 05:03:51 UTC 2024","Sun Mar 31 05:06:06 UTC 2024","135610","","My Profile: [FNN-669] Edit account details Positive","","My Profile: [FNN-669] Edit account details Positive","should edit cr account details with valid information","should edit cr account details with valid information",""
"passed","Sun Mar 31 05:04:11 UTC 2024","Sun Mar 31 05:04:33 UTC 2024","21278","","Post Project: [FNN-588] Post project without account Negative","","Post Project: [FNN-588] Post project without account Negative","should post project without repeat password","should post project without repeat password",""
"passed","Sun Mar 31 05:02:24 UTC 2024","Sun Mar 31 05:02:46 UTC 2024","21855","","Post Project: [FNN-588] Post project without account Negative","","Post Project: [FNN-588] Post project without account Negative","should post project without phone number","should post project without phone number",""
"passed","Sun Mar 31 05:17:38 UTC 2024","Sun Mar 31 05:22:37 UTC 2024","299167","","My Transactions: [FNN-708] Hourly project: In advance. Positive","","My Transactions: [FNN-708] Hourly project: In advance. Positive","should start hourly project","should start hourly project",""
"passed","Sun Mar 31 04:32:03 UTC 2024","Sun Mar 31 04:32:09 UTC 2024","6110","","Search Project: [FNN-568] Project search","","Search Project: [FNN-568] Project search","should filter projects by Status Open projects","should filter projects by Status Open projects",""
"passed","Sun Mar 31 04:58:35 UTC 2024","Sun Mar 31 04:59:46 UTC 2024","71198","","My Profile: [FNN-668] Edit account details Negative","","My Profile: [FNN-668] Edit account details Negative","should edit account details without required fields","should edit account details without required fields",""
"passed","Sun Mar 31 04:26:02 UTC 2024","Sun Mar 31 04:28:38 UTC 2024","156237","","Settings: [FNN-676] Change profile settings","","Settings: [FNN-676] Change profile settings","it's not possible to contact me through the contact button on my profile","it's not possible to contact me through the contact button on my profile",""
"passed","Sun Mar 31 04:18:43 UTC 2024","Sun Mar 31 04:19:43 UTC 2024","60009","","My Profile: [FNN-718] Add portfolio Negative","","My Profile: [FNN-718] Add portfolio Negative","should add portfolio without data","should add portfolio without data",""
"failed","Sun Mar 31 05:00:46 UTC 2024","Sun Mar 31 05:01:13 UTC 2024","27481","","Post Project: [FNN-587] Post project with account Positive","","Post Project: [FNN-587] Post project with account Positive","should verify that the project informations is correct","should verify that the project informations is correct",""
"passed","Sun Mar 31 05:04:33 UTC 2024","Sun Mar 31 05:04:44 UTC 2024","10720","","My Profile: [FNN-730] Request reference Negative","","My Profile: [FNN-730] Request reference Negative","should pass step 3 without 4 rating","should pass step 3 without 4 rating",""
"passed","Sun Mar 31 04:12:12 UTC 2024","Sun Mar 31 04:12:24 UTC 2024","11489","","Subscribe: [FNN-577] Subscribe Negative","","Subscribe: [FNN-577] Subscribe Negative","should subscribe without repeat password","should subscribe without repeat password",""
"passed","Sun Mar 31 05:02:59 UTC 2024","Sun Mar 31 05:03:06 UTC 2024","6635","","My Profile: [FNN-730] Request reference Negative","","My Profile: [FNN-730] Request reference Negative","should pass step 2 without last name","should pass step 2 without last name",""
"failed","Sun Mar 31 05:12:00 UTC 2024","Sun Mar 31 05:16:15 UTC 2024","255143","","Freelancer search: [FNN-846] Invite to project","","Freelancer search: [FNN-846] Invite to project","should invite to a project via the ""Invite to project"" action","should invite to a project via the ""Invite to project"" action",""
"passed","Sun Mar 31 04:33:56 UTC 2024","Sun Mar 31 04:34:01 UTC 2024","4716","","My Network: [FNN-620] Invite manually via email and sms Negative","","My Network: [FNN-620] Invite manually via email and sms Negative","should invite manually via email without first name","should invite manually via email without first name",""
"passed","Sun Mar 31 04:43:06 UTC 2024","Sun Mar 31 04:44:16 UTC 2024","69488","","[FNN-717] Edit email settings","","[FNN-717] Edit email settings","should edit Email settings and verify that the settings are saved","should edit Email settings and verify that the settings are saved",""
"passed","Sun Mar 31 04:23:40 UTC 2024","Sun Mar 31 04:23:53 UTC 2024","12549","","Post Project: [FNN-649] Post project with account Negative","","Post Project: [FNN-649] Post project with account Negative","should post project with short Title","should post project with short Title",""
"failed","Sun Mar 31 05:14:09 UTC 2024","Sun Mar 31 05:15:24 UTC 2024","74457","","Freelancer search: [FNN-822] Send message","","Freelancer search: [FNN-822] Send message","should check the message as the Freelancer user","should check the message as the Freelancer user",""
"passed","Sun Mar 31 05:01:19 UTC 2024","Sun Mar 31 05:01:22 UTC 2024","3430","","My Profile: [FNN-719] Add resume Negative","","My Profile: [FNN-719] Add resume Negative","should add experience without data","should add experience without data",""
"passed","Sun Mar 31 04:11:05 UTC 2024","Sun Mar 31 04:11:08 UTC 2024","3334","","Login: [FNN-574] Log in from the Login page Negative","","Login: [FNN-574] Log in from the Login page Negative","should log in without password","should log in without password",""
"passed","Sun Mar 31 04:10:41 UTC 2024","Sun Mar 31 04:11:40 UTC 2024","58982","","Login: [FNN-648] Log in from the Login page Positive","","Login: [FNN-648] Log in from the Login page Positive","should log in with valid credentials","should log in with valid credentials",""
"passed","Sun Mar 31 05:01:10 UTC 2024","Sun Mar 31 05:02:52 UTC 2024","101505","","My Profile: [FNN-730] Request reference Negative","","My Profile: [FNN-730] Request reference Negative","should pass step 2 without data","should pass step 2 without data",""
"passed","Sun Mar 31 04:42:15 UTC 2024","Sun Mar 31 04:43:00 UTC 2024","44635","","Create Profile: [FNN-684] Create profile Negative","","Create Profile: [FNN-684] Create profile Negative","should create profile without Description of yourself","should create profile without Description of yourself",""
"passed","Sun Mar 31 04:39:46 UTC 2024","Sun Mar 31 04:40:02 UTC 2024","16273","","Freelancer search: [FNN-817] Add note","","Freelancer search: [FNN-817] Add note","should add a note via the action ""Add note""","should add a note via the action ""Add note""",""
"broken","Sun Mar 31 05:08:17 UTC 2024","Sun Mar 31 05:12:52 UTC 2024","275009","","My Projects: [FNN-971] Complete project Positive","","My Projects: [FNN-971] Complete project Positive","should complete project","should complete project",""
"passed","Sun Mar 31 04:19:10 UTC 2024","Sun Mar 31 04:19:54 UTC 2024","44407","","My Profile: [FNN-699] Request reference Positive","","My Profile: [FNN-699] Request reference Positive","should check the validated reference","should check the validated reference",""
"broken","Sun Mar 31 05:24:14 UTC 2024","Sun Mar 31 05:24:16 UTC 2024","1623","","My Transactions: [FNN-737] Hourly project: Start project. Negative","","My Transactions: [FNN-737] Hourly project: Start project. Negative","should start project with Hourly rate rate than 25","should start project with Hourly rate rate than 25",""
"passed","Sun Mar 31 04:55:37 UTC 2024","Sun Mar 31 04:55:48 UTC 2024","11216","","CR: [FNN-744] CR Subscribe Negative","","CR: [FNN-744] CR Subscribe Negative","should subscribe as CR without company name","should subscribe as CR without company name",""
"passed","Sun Mar 31 04:11:03 UTC 2024","Sun Mar 31 04:12:16 UTC 2024","73474","","Login: [FNN-685] Log out","","Login: [FNN-685] Log out","should log out","should log out",""
"skipped","Sun Mar 31 05:16:15 UTC 2024","Sun Mar 31 05:17:29 UTC 2024","73627","","Freelancer search: [FNN-846] Invite to project","","Freelancer search: [FNN-846] Invite to project","should verify if the ""Assign project"" button is enable","should verify if the ""Assign project"" button is enable",""
"passed","Sun Mar 31 05:01:43 UTC 2024","Sun Mar 31 05:01:55 UTC 2024","12055","","My Profile: [FNN-719] Add resume Negative","","My Profile: [FNN-719] Add resume Negative","should add experience without period from  ","should add experience without period from  ",""
"skipped","Sun Mar 31 05:16:15 UTC 2024","Sun Mar 31 05:16:15 UTC 2024","17","","Freelancer search: [FNN-846] Invite to project","","Freelancer search: [FNN-846] Invite to project","should check the invitation and send an interest of the project","should check the invitation and send an interest of the project",""
"passed","Sun Mar 31 04:18:02 UTC 2024","Sun Mar 31 04:19:49 UTC 2024","106387","","My Profile: [FNN-713] Confirm phone number Negative","","My Profile: [FNN-713] Confirm phone number Negative","should confirm phone number with invalid code","should confirm phone number with invalid code",""
"broken","Sun Mar 31 05:19:24 UTC 2024","Sun Mar 31 05:24:11 UTC 2024","287147","","My Transactions: [FNN-737] Hourly project: Start project. Negative","","My Transactions: [FNN-737] Hourly project: Start project. Negative","should start project without Hours per period and Hourly rate","should start project without Hours per period and Hourly rate",""
"passed","Sun Mar 31 04:11:21 UTC 2024","Sun Mar 31 04:13:10 UTC 2024","109078","","Upgrade: [FNN-658] Upgrade account Positive","","Upgrade: [FNN-658] Upgrade account Positive","should upgrade account to Standaard 1 month","should upgrade account to Standaard 1 month",""
"passed","Sun Mar 31 04:32:34 UTC 2024","Sun Mar 31 04:34:20 UTC 2024","106490","","Search Project: [FNN-568] Project search","","Search Project: [FNN-568] Project search","should filter projects by Number of responses","should filter projects by Number of responses",""
"passed","Sun Mar 31 04:34:08 UTC 2024","Sun Mar 31 04:34:14 UTC 2024","5957","","My Network: [FNN-620] Invite manually via email and sms Negative","","My Network: [FNN-620] Invite manually via email and sms Negative","should invite manually via sms without phone number","should invite manually via sms without phone number",""
"passed","Sun Mar 31 04:57:33 UTC 2024","Sun Mar 31 04:58:05 UTC 2024","32349","","CR: [FNN-751] Invite to the organization manually Negative","","CR: [FNN-751] Invite to the organization manually Negative","should invite manually to the organization without role","should invite manually to the organization without role",""
