"Status","Start Time","Stop Time","Duration in ms","Parent Suite","Suite","Sub Suite","Test Class","Test Method","Name","Description"
"passed","Sun Jun 09 04:50:45 UTC 2024","Sun Jun 09 04:51:55 UTC 2024","69651","","Freelancer search: [FNN-924] Freelancer search as CR user","","Freelancer search: [FNN-924] Freelancer search as CR user","should filter freelancers by Minimum rating","should filter freelancers by Minimum rating",""
"passed","Sun Jun 09 04:28:40 UTC 2024","Sun Jun 09 04:28:56 UTC 2024","16754","","Post Project: [FNN-649] Post project with account Negative","","Post Project: [FNN-649] Post project with account Negative","should post project without Start date","should post project without Start date",""
"passed","Sun Jun 09 05:26:00 UTC 2024","Sun Jun 09 05:28:02 UTC 2024","122543","","My Transactions: [FNN-710] Milestones project: In advance. Positive","","My Transactions: [FNN-710] Milestones project: In advance. Positive","should pay deposit","should pay deposit",""
"passed","Sun Jun 09 04:43:43 UTC 2024","Sun Jun 09 04:43:46 UTC 2024","3275","","Freelancer search: [FNN-822] Send message","","Freelancer search: [FNN-822] Send message","should check the message as the CR user","should check the message as the CR user",""
"passed","Sun Jun 09 04:37:04 UTC 2024","Sun Jun 09 04:37:11 UTC 2024","6646","","My Network: [FNN-620] Invite manually via email and sms Negative","","My Network: [FNN-620] Invite manually via email and sms Negative","should invite manually via email with wrong email format","should invite manually via email with wrong email format",""
"passed","Sun Jun 09 04:38:19 UTC 2024","Sun Jun 09 04:38:32 UTC 2024","12266","","Search Project: [FNN-568] Project search","","Search Project: [FNN-568] Project search","should filter projects by Posted since Last 30 days","should filter projects by Posted since Last 30 days",""
"passed","Sun Jun 09 05:10:53 UTC 2024","Sun Jun 09 05:11:01 UTC 2024","8183","","My Profile: [FNN-730] Request reference Negative","","My Profile: [FNN-730] Request reference Negative","should pass step 2 without last name","should pass step 2 without last name",""
"passed","Sun Jun 09 04:57:26 UTC 2024","Sun Jun 09 04:58:35 UTC 2024","69466","","CR: [FNN-744] CR Subscribe Negative","","CR: [FNN-744] CR Subscribe Negative","should subscribe as CR without sector","should subscribe as CR without sector",""
"passed","Sun Jun 09 04:32:35 UTC 2024","Sun Jun 09 04:34:18 UTC 2024","102550","","Settings: [FNN-680] Deactivate profile","","Settings: [FNN-680] Deactivate profile","should deactivate profile","should deactivate profile",""
"passed","Sun Jun 09 05:09:21 UTC 2024","Sun Jun 09 05:09:25 UTC 2024","3264","","My Profile: [FNN-719] Add resume Negative","","My Profile: [FNN-719] Add resume Negative","should add language without levels","should add language without levels",""
"passed","Sun Jun 09 05:15:48 UTC 2024","Sun Jun 09 05:17:35 UTC 2024","106376","","Post Project: [FNN-588] Post project without account Negative","","Post Project: [FNN-588] Post project without account Negative","should post project without passwords matching","should post project without passwords matching",""
"passed","Sun Jun 09 05:07:16 UTC 2024","Sun Jun 09 05:07:44 UTC 2024","27910","","Upgrade: [FNN-659] Upgrade account Negative","","Upgrade: [FNN-659] Upgrade account Negative","should upgrade account to Standard 1 month: Processing error decline","should upgrade account to Standard 1 month: Processing error decline",""
"passed","Sun Jun 09 04:13:46 UTC 2024","Sun Jun 09 04:13:56 UTC 2024","9771","","Subscribe: [FNN-577] Subscribe Negative","","Subscribe: [FNN-577] Subscribe Negative","should subscribe without password","should subscribe without password",""
"passed","Sun Jun 09 04:13:07 UTC 2024","Sun Jun 09 04:13:11 UTC 2024","3983","","Reset password: Reset password Positive","","Reset password: Reset password Positive","[FNN-2397] User receives the Reset password letter","[FNN-2397] User receives the Reset password letter",""
"passed","Sun Jun 09 04:27:19 UTC 2024","Sun Jun 09 04:27:31 UTC 2024","12402","","Post Project: [FNN-649] Post project with account Negative","","Post Project: [FNN-649] Post project with account Negative","should post project with short Title","should post project with short Title",""
"passed","Sun Jun 09 05:09:15 UTC 2024","Sun Jun 09 05:10:45 UTC 2024","90513","","My Profile: [FNN-730] Request reference Negative","","My Profile: [FNN-730] Request reference Negative","should pass step 2 without data","should pass step 2 without data",""
"passed","Sun Jun 09 04:59:12 UTC 2024","Sun Jun 09 04:59:16 UTC 2024","4108","","CR: [FNN-751] Invite to the organization manually Negative","","CR: [FNN-751] Invite to the organization manually Negative","should invite manually to the organization without first name","should invite manually to the organization without first name",""
"failed","Sun Jun 09 05:18:15 UTC 2024","Sun Jun 09 05:28:47 UTC 2024","632313","","My Transactions: [FNN-737] Hourly project: Start project. Negative","","My Transactions: [FNN-737] Hourly project: Start project. Negative","should start project without Hours per period and Hourly rate","should start project without Hours per period and Hourly rate",""
"skipped","Sun Jun 09 04:37:57 UTC 2024","Sun Jun 09 04:37:57 UTC 2024","0","","My Projects: [FNN-1058] Complete project Negative","","My Projects: [FNN-1058] Complete project Negative","should complete project without profile picture","should complete project without profile picture",""
"passed","Sun Jun 09 05:06:49 UTC 2024","Sun Jun 09 05:07:16 UTC 2024","27169","","Upgrade: [FNN-659] Upgrade account Negative","","Upgrade: [FNN-659] Upgrade account Negative","should upgrade account to Standard 1 month: Incorrect CVC decline","should upgrade account to Standard 1 month: Incorrect CVC decline",""
"passed","Sun Jun 09 04:35:43 UTC 2024","Sun Jun 09 04:36:47 UTC 2024","64649","","My Network: Invite via Email without message","","My Network: Invite via Email without message","[FNN-1233][FNN-2451] Create a user and accept network invitation","[FNN-1233][FNN-2451] Create a user and accept network invitation",""
"broken","Sun Jun 09 05:02:24 UTC 2024","Sun Jun 09 05:04:32 UTC 2024","127599","","Upgrade: [FNN-659] Upgrade account Negative","","Upgrade: [FNN-659] Upgrade account Negative","should upgrade account to Standard 1 month without required fields","should upgrade account to Standard 1 month without required fields",""
"passed","Sun Jun 09 04:58:07 UTC 2024","Sun Jun 09 04:59:06 UTC 2024","58877","","CR: [FNN-751] Invite to the organization manually Negative","","CR: [FNN-751] Invite to the organization manually Negative","should invite manually to the organization without email","should invite manually to the organization without email",""
"passed","Sun Jun 09 05:12:35 UTC 2024","Sun Jun 09 05:12:45 UTC 2024","10104","","My Profile: [FNN-730] Request reference Negative","","My Profile: [FNN-730] Request reference Negative","should pass step 3 without comments","should pass step 3 without comments",""
"passed","Sun Jun 09 04:32:12 UTC 2024","Sun Jun 09 04:32:14 UTC 2024","2747","","Settings: [FNN-678] Delete account without subscription","","Settings: [FNN-678] Delete account without subscription","should receive a ""account deleted"" letter","should receive a ""account deleted"" letter",""
"passed","Sun Jun 09 05:00:24 UTC 2024","Sun Jun 09 05:00:33 UTC 2024","8968","","CR: [FNN-744] CR Subscribe Negative","","CR: [FNN-744] CR Subscribe Negative","should subscribe as CR without repeat password","should subscribe as CR without repeat password",""
"passed","Sun Jun 09 04:56:45 UTC 2024","Sun Jun 09 04:56:48 UTC 2024","2757","","My Transactions: [FNN-1431] Hourly project: In retrospect. Positive","","My Transactions: [FNN-1431] Hourly project: In retrospect. Positive","should close the period","should close the period",""
"passed","Sun Jun 09 05:13:09 UTC 2024","Sun Jun 09 05:13:24 UTC 2024","14844","","Post Project: [FNN-588] Post project without account Negative","","Post Project: [FNN-588] Post project without account Negative","should post project with wrong phone number","should post project with wrong phone number",""
"passed","Sun Jun 09 05:11:32 UTC 2024","Sun Jun 09 05:11:49 UTC 2024","16695","","Post Project: [FNN-588] Post project without account Negative","","Post Project: [FNN-588] Post project without account Negative","should post project without last name","should post project without last name",""
"passed","Sun Jun 09 04:56:35 UTC 2024","Sun Jun 09 04:56:38 UTC 2024","3391","","My Transactions: [FNN-1439] Hourly project: Add time. Negative","","My Transactions: [FNN-1439] Hourly project: Add time. Negative","should add hours without Hours","should add hours without Hours",""
"passed","Sun Jun 09 04:47:46 UTC 2024","Sun Jun 09 04:48:57 UTC 2024","70684","","[FNN-717] Edit email settings","","[FNN-717] Edit email settings","should edit Email settings and verify that the settings are saved","should edit Email settings and verify that the settings are saved",""
"broken","Sun Jun 09 05:03:34 UTC 2024","Sun Jun 09 05:06:15 UTC 2024","161151","","Upgrade: Upgrade Positive","","Upgrade: Upgrade Positive","[FNN-658] Upgrade account Positive: Standaard 1 month","[FNN-658] Upgrade account Positive: Standaard 1 month",""
"passed","Sun Jun 09 04:41:35 UTC 2024","Sun Jun 09 04:43:43 UTC 2024","128048","","Freelancer search: [FNN-822] Send message","","Freelancer search: [FNN-822] Send message","should send a message via the ""Send message"" action","should send a message via the ""Send message"" action",""
"passed","Sun Jun 09 04:42:39 UTC 2024","Sun Jun 09 04:44:19 UTC 2024","99512","","Create Profile: [FNN-683] Create profile Positive","","Create Profile: [FNN-683] Create profile Positive","should create profile with valid data","should create profile with valid data",""
"passed","Sun Jun 09 04:37:57 UTC 2024","Sun Jun 09 04:38:04 UTC 2024","7048","","Search Project: [FNN-568] Project search","","Search Project: [FNN-568] Project search","should filter projects by Status Open projects","should filter projects by Status Open projects",""
"passed","Sun Jun 09 05:23:11 UTC 2024","Sun Jun 09 05:23:27 UTC 2024","15813","","CR: Invite Positive","","CR: Invite Positive","[FNN-749][FNN-2401] Accept manual invitation to organization","[FNN-749][FNN-2401] Accept manual invitation to organization",""
"passed","Sun Jun 09 04:48:57 UTC 2024","Sun Jun 09 04:50:10 UTC 2024","73484","","[FNN-717] Edit email settings","","[FNN-717] Edit email settings","should edit Notification settings and verify that the settings are saved","should edit Notification settings and verify that the settings are saved",""
"passed","Sun Jun 09 05:02:01 UTC 2024","Sun Jun 09 05:03:10 UTC 2024","68510","","My Transactions: [FNN-708] Hourly project: In advance. Positive","","My Transactions: [FNN-708] Hourly project: In advance. Positive","should approve the time and pay for extra money","should approve the time and pay for extra money",""
"failed","Sun Jun 09 04:54:43 UTC 2024","Sun Jun 09 04:57:15 UTC 2024","151623","","My Transactions: [FNN-738] Milestones project: Add milestone. Negative","","My Transactions: [FNN-738] Milestones project: Add milestone. Negative","""before all"" hook for [FNN-738] Milestones project: Add milestone. Negative","""before all"" hook for [FNN-738] Milestones project: Add milestone. Negative",""
"passed","Sun Jun 09 05:03:10 UTC 2024","Sun Jun 09 05:03:27 UTC 2024","16724","","My Transactions: [FNN-708] Hourly project: In advance. Positive","","My Transactions: [FNN-708] Hourly project: In advance. Positive","should verify that the money paid","should verify that the money paid",""
"passed","Sun Jun 09 05:04:57 UTC 2024","Sun Jun 09 05:05:22 UTC 2024","24976","","Upgrade: [FNN-659] Upgrade account Negative","","Upgrade: [FNN-659] Upgrade account Negative","should upgrade account to Standard 1 month: Insufficient funds decline","should upgrade account to Standard 1 month: Insufficient funds decline",""
"passed","Sun Jun 09 04:27:40 UTC 2024","Sun Jun 09 04:27:52 UTC 2024","11914","","Post Project: [FNN-649] Post project with account Negative","","Post Project: [FNN-649] Post project with account Negative","should post project without step 2","should post project without step 2",""
"broken","Sun Jun 09 05:07:56 UTC 2024","Sun Jun 09 05:11:23 UTC 2024","206645","","Upgrade: Upgrade Positive","","Upgrade: Upgrade Positive","[FNN-658] Upgrade account Positive: Business 1 month","[FNN-658] Upgrade account Positive: Business 1 month",""
"passed","Sun Jun 09 04:29:49 UTC 2024","Sun Jun 09 04:31:14 UTC 2024","85056","","Settings: [FNN-674] Change password Positive","","Settings: [FNN-674] Change password Positive","should change password with valid credentials","should change password with valid credentials",""
"passed","Sun Jun 09 04:37:11 UTC 2024","Sun Jun 09 04:37:15 UTC 2024","4043","","My Network: [FNN-620] Invite manually via email and sms Negative","","My Network: [FNN-620] Invite manually via email and sms Negative","should invite manually via email without first name","should invite manually via email without first name",""
"broken","Sun Jun 09 05:08:42 UTC 2024","Sun Jun 09 05:10:47 UTC 2024","124582","","My Profile: [FNN-669] Edit account details Positive","","My Profile: [FNN-669] Edit account details Positive","should edit cr account details with valid information","should edit cr account details with valid information",""
"passed","Sun Jun 09 05:11:01 UTC 2024","Sun Jun 09 05:11:09 UTC 2024","7603","","My Profile: [FNN-730] Request reference Negative","","My Profile: [FNN-730] Request reference Negative","should pass step 2 without phone","should pass step 2 without phone",""
"passed","Sun Jun 09 04:59:28 UTC 2024","Sun Jun 09 04:59:42 UTC 2024","13144","","CR: [FNN-744] CR Subscribe Negative","","CR: [FNN-744] CR Subscribe Negative","should subscribe as CR with taken email","should subscribe as CR with taken email",""
"passed","Sun Jun 09 04:38:18 UTC 2024","Sun Jun 09 04:40:28 UTC 2024","130235","","My Projects: [FNN-1093] Pause project","","My Projects: [FNN-1093] Pause project","should pause the project","should pause the project",""
"passed","Sun Jun 09 05:29:45 UTC 2024","Sun Jun 09 05:31:33 UTC 2024","108085","","My Transactions: [FNN-710] Milestones project: In advance. Positive","","My Transactions: [FNN-710] Milestones project: In advance. Positive","should approve milestone","should approve milestone",""
"passed","Sun Jun 09 05:05:45 UTC 2024","Sun Jun 09 05:06:43 UTC 2024","58428","","My Profile: [FNN-719] Add resume Negative","","My Profile: [FNN-719] Add resume Negative","should add CV without CV","should add CV without CV",""
"passed","Sun Jun 09 04:27:25 UTC 2024","Sun Jun 09 04:30:49 UTC 2024","203975","","Settings: [FNN-671] Change email address Positive","","Settings: [FNN-671] Change email address Positive","should change email address with valid credentials","should change email address with valid credentials",""
"passed","Sun Jun 09 05:00:03 UTC 2024","Sun Jun 09 05:00:15 UTC 2024","11737","","CR: [FNN-744] CR Subscribe Negative","","CR: [FNN-744] CR Subscribe Negative","should subscribe as CR with taken phone number","should subscribe as CR with taken phone number",""
