"Status","Start Time","Stop Time","Duration in ms","Parent Suite","Suite","Sub Suite","Test Class","Test Method","Name","Description"
"passed","Sun Apr 21 04:55:52 UTC 2024","Sun Apr 21 04:56:03 UTC 2024","10968","","My Transactions: [FNN-1432] Milestones project: Start project. Negative","","My Transactions: [FNN-1432] Milestones project: Start project. Negative","should start project without Way of paying","should start project without Way of paying",""
"passed","Sun Apr 21 05:10:35 UTC 2024","Sun Apr 21 05:10:42 UTC 2024","7317","","My Profile: [FNN-730] Request reference Negative","","My Profile: [FNN-730] Request reference Negative","should pass step 2 without phone","should pass step 2 without phone",""
"passed","Sun Apr 21 05:11:13 UTC 2024","Sun Apr 21 05:11:47 UTC 2024","34060","","My Profile: [FNN-719] Add resume Negative","","My Profile: [FNN-719] Add resume Negative","should add language without reading level","should add language without reading level",""
"passed","Sun Apr 21 05:15:41 UTC 2024","Sun Apr 21 05:16:02 UTC 2024","21627","","Post Project: [FNN-588] Post project without account Negative","","Post Project: [FNN-588] Post project without account Negative","should post project with wrong phone number","should post project with wrong phone number",""
"failed","Sun Apr 21 05:15:35 UTC 2024","Sun Apr 21 05:16:49 UTC 2024","74111","","My Network: [FNN-619] Invite manually via sms with signup bonus","","My Network: [FNN-619] Invite manually via sms with signup bonus","should check My Dashboard and My Transactions page for the signup bonus as the inviter user","should check My Dashboard and My Transactions page for the signup bonus as the inviter user",""
"passed","Sun Apr 21 05:06:22 UTC 2024","Sun Apr 21 05:08:10 UTC 2024","108692","","Upgrade","","Upgrade","[FNN-658] Upgrade account Positive: Premium 1 month","[FNN-658] Upgrade account Positive: Premium 1 month",""
"passed","Sun Apr 21 05:10:38 UTC 2024","Sun Apr 21 05:10:41 UTC 2024","3137","","My Profile: [FNN-719] Add resume Negative","","My Profile: [FNN-719] Add resume Negative","should add certificate without data","should add certificate without data",""
"passed","Sun Apr 21 05:10:48 UTC 2024","Sun Apr 21 05:10:58 UTC 2024","9941","","My Profile: [FNN-730] Request reference Negative","","My Profile: [FNN-730] Request reference Negative","should pass step 2 with invalid website format","should pass step 2 with invalid website format",""
"failed","Sun Apr 21 05:09:09 UTC 2024","Sun Apr 21 05:09:33 UTC 2024","24091","","My Profile: [FNN-719] Add resume Negative","","My Profile: [FNN-719] Add resume Negative","should add education without data","should add education without data",""
"passed","Sun Apr 21 05:02:31 UTC 2024","Sun Apr 21 05:02:44 UTC 2024","12255","","My Transactions: [FNN-710] Milestones project: In advance. Positive","","My Transactions: [FNN-710] Milestones project: In advance. Positive","should request payout","should request payout",""
"passed","Sun Apr 21 04:08:50 UTC 2024","Sun Apr 21 04:08:56 UTC 2024","5750","","Login: [FNN-574] Log in from the Login page Negative","","Login: [FNN-574] Log in from the Login page Negative","should log in with invalid credentials","should log in with invalid credentials",""
"passed","Sun Apr 21 04:46:23 UTC 2024","Sun Apr 21 04:47:32 UTC 2024","69247","","Freelancer search: [FNN-846] Invite to project","","Freelancer search: [FNN-846] Invite to project","should verify if the ""Assign project"" button is enable","should verify if the ""Assign project"" button is enable",""
"passed","Sun Apr 21 05:15:20 UTC 2024","Sun Apr 21 05:15:41 UTC 2024","20762","","Post Project: [FNN-588] Post project without account Negative","","Post Project: [FNN-588] Post project without account Negative","should post project with taken phone number","should post project with taken phone number",""
"passed","Sun Apr 21 04:20:33 UTC 2024","Sun Apr 21 04:22:20 UTC 2024","106744","","My Profile: [FNN-795] Remove portfolio","","My Profile: [FNN-795] Remove portfolio","should remove portfolio","should remove portfolio",""
"skipped","Sun Apr 21 04:37:15 UTC 2024","Sun Apr 21 04:38:13 UTC 2024","57697","","My Network: [FNN-1027] Invite freelancers","","My Network: [FNN-1027] Invite freelancers","should check network as sender user","should check network as sender user",""
"passed","Sun Apr 21 04:31:40 UTC 2024","Sun Apr 21 04:32:44 UTC 2024","64158","","My Network: [FNN-1233] Invite manually via email without custom message with signup bonus","","My Network: [FNN-1233] Invite manually via email without custom message with signup bonus","should invite manually via email with valid recipient data and without message","should invite manually via email with valid recipient data and without message",""
"passed","Sun Apr 21 04:29:44 UTC 2024","Sun Apr 21 04:29:47 UTC 2024","2823","","Settings: [FNN-678] Delete account without subscription","","Settings: [FNN-678] Delete account without subscription","should receive a ""account deleted"" letter","should receive a ""account deleted"" letter",""
"passed","Sun Apr 21 05:03:05 UTC 2024","Sun Apr 21 05:03:07 UTC 2024","2001","","CR: [FNN-751] Invite to the organization manually Negative","","CR: [FNN-751] Invite to the organization manually Negative","should invite manually to the organization without first step","should invite manually to the organization without first step",""
"passed","Sun Apr 21 04:29:36 UTC 2024","Sun Apr 21 04:31:11 UTC 2024","95010","","Settings: [FNN-680] Deactivate profile","","Settings: [FNN-680] Deactivate profile","should deactivate profile","should deactivate profile",""
"passed","Sun Apr 21 05:11:04 UTC 2024","Sun Apr 21 05:11:08 UTC 2024","4253","","My Profile: [FNN-719] Add resume Negative","","My Profile: [FNN-719] Add resume Negative","should add language without speaking level","should add language without speaking level",""
"passed","Sun Apr 21 05:14:59 UTC 2024","Sun Apr 21 05:15:20 UTC 2024","21186","","Post Project: [FNN-588] Post project without account Negative","","Post Project: [FNN-588] Post project without account Negative","should post project without phone number","should post project without phone number",""
"passed","Sun Apr 21 05:01:05 UTC 2024","Sun Apr 21 05:01:19 UTC 2024","14338","","CR: [FNN-744] CR Subscribe Negative","","CR: [FNN-744] CR Subscribe Negative","should subscribe as CR with invalid repeat password","should subscribe as CR with invalid repeat password",""
"passed","Sun Apr 21 05:18:55 UTC 2024","Sun Apr 21 05:19:24 UTC 2024","28853","","My Network: [FNN-664] Invite freelancer","","My Network: [FNN-664] Invite freelancer","should accept an invitation","should accept an invitation",""
"passed","Sun Apr 21 04:57:24 UTC 2024","Sun Apr 21 04:58:41 UTC 2024","77129","","CR: [FNN-744] CR Subscribe Negative","","CR: [FNN-744] CR Subscribe Negative","should subscribe as CR without sector","should subscribe as CR without sector",""
"passed","Sun Apr 21 04:45:17 UTC 2024","Sun Apr 21 04:46:02 UTC 2024","44604","","Create Profile: [FNN-684] Create profile Negative","","Create Profile: [FNN-684] Create profile Negative","should create profile without Description of yourself","should create profile without Description of yourself",""
"passed","Sun Apr 21 05:16:02 UTC 2024","Sun Apr 21 05:16:25 UTC 2024","22297","","Post Project: [FNN-588] Post project without account Negative","","Post Project: [FNN-588] Post project without account Negative","should post project without password","should post project without password",""
"passed","Sun Apr 21 04:07:05 UTC 2024","Sun Apr 21 04:08:10 UTC 2024","65331","","Login: [FNN-647] Log in from the header Positive","","Login: [FNN-647] Log in from the header Positive","should log in with valid credentials","should log in with valid credentials",""
"failed","Sun Apr 21 05:10:11 UTC 2024","Sun Apr 21 05:10:38 UTC 2024","26495","","My Profile: [FNN-719] Add resume Negative","","My Profile: [FNN-719] Add resume Negative","should add education without period to","should add education without period to",""
"failed","Sun Apr 21 05:25:56 UTC 2024","Sun Apr 21 05:27:19 UTC 2024","83703","","CR","","CR","[FNN-2405] Check the invited user is in the organization (platform)","[FNN-2405] Check the invited user is in the organization (platform)",""
"passed","Sun Apr 21 04:24:27 UTC 2024","Sun Apr 21 04:24:46 UTC 2024","19310","","Post Project: [FNN-649] Post project with account Negative","","Post Project: [FNN-649] Post project with account Negative","should post project without Location","should post project without Location",""
"passed","Sun Apr 21 04:07:04 UTC 2024","Sun Apr 21 04:07:27 UTC 2024","22769","","Subscribe","","Subscribe","[FNN-578] Subscribe Positive","[FNN-578] Subscribe Positive",""
"passed","Sun Apr 21 04:11:34 UTC 2024","Sun Apr 21 04:11:44 UTC 2024","10071","","Subscribe: [FNN-577] Subscribe Negative","","Subscribe: [FNN-577] Subscribe Negative","should subscribe without last name","should subscribe without last name",""
"passed","Sun Apr 21 05:11:00 UTC 2024","Sun Apr 21 05:11:04 UTC 2024","3361","","My Profile: [FNN-719] Add resume Negative","","My Profile: [FNN-719] Add resume Negative","should add language without levels","should add language without levels",""
"passed","Sun Apr 21 04:18:19 UTC 2024","Sun Apr 21 04:18:39 UTC 2024","19753","","My Profile: [FNN-699] Request reference Positive","","My Profile: [FNN-699] Request reference Positive","should validate reference","should validate reference",""
"passed","Sun Apr 21 04:59:39 UTC 2024","Sun Apr 21 04:59:53 UTC 2024","14437","","CR: [FNN-744] CR Subscribe Negative","","CR: [FNN-744] CR Subscribe Negative","should subscribe as CR with taken email","should subscribe as CR with taken email",""
"passed","Sun Apr 21 05:01:29 UTC 2024","Sun Apr 21 05:01:37 UTC 2024","8677","","My Transactions: [FNN-738] Milestones project: Add milestone. Negative","","My Transactions: [FNN-738] Milestones project: Add milestone. Negative","should add milestone without Delivery date","should add milestone without Delivery date",""
"passed","Sun Apr 21 04:35:45 UTC 2024","Sun Apr 21 04:35:52 UTC 2024","7046","","My Network: [FNN-620] Invite manually via email and sms Negative","","My Network: [FNN-620] Invite manually via email and sms Negative","should invite manually via sms with invalid phone number","should invite manually via sms with invalid phone number",""
"passed","Sun Apr 21 04:29:49 UTC 2024","Sun Apr 21 04:31:32 UTC 2024","102973","","Settings: [FNN-808] Cancel downgrade","","Settings: [FNN-808] Cancel downgrade","should cancel downgrade","should cancel downgrade",""
"passed","Sun Apr 21 04:33:57 UTC 2024","Sun Apr 21 04:34:06 UTC 2024","9206","","Search Project: [FNN-568] Project search","","Search Project: [FNN-568] Project search","should filter projects by Posted since Last 30 days","should filter projects by Posted since Last 30 days",""
"passed","Sun Apr 21 04:43:19 UTC 2024","Sun Apr 21 04:44:26 UTC 2024","67611","","Freelancer search: [FNN-817] Add note","","Freelancer search: [FNN-817] Add note","should add note from the notes popup","should add note from the notes popup",""
"passed","Sun Apr 21 05:11:22 UTC 2024","Sun Apr 21 05:14:24 UTC 2024","181216","","Upgrade","","Upgrade","[FNN-658] Upgrade account Positive: Enterprise 1 month","[FNN-658] Upgrade account Positive: Enterprise 1 month",""
"broken","Sun Apr 21 05:16:55 UTC 2024","Sun Apr 21 05:21:35 UTC 2024","279926","","My Projects: [FNN-971] Complete project Positive","","My Projects: [FNN-971] Complete project Positive","should complete project","should complete project",""
