"Status","Start Time","Stop Time","Duration in ms","Parent Suite","Suite","Sub Suite","Test Class","Test Method","Name","Description"
"passed","Sun Apr 21 04:09:25 UTC 2024","Sun Apr 21 04:09:27 UTC 2024","2577","","Login: [FNN-563] Log in from the header Negative","","Login: [FNN-563] Log in from the header Negative","should log in without password","should log in without password",""
"failed","Sun Apr 21 05:13:28 UTC 2024","Sun Apr 21 05:14:33 UTC 2024","64756","","My Network: [FNN-1232] Invite manually via email with custom message with signup bonus","","My Network: [FNN-1232] Invite manually via email with custom message with signup bonus","should invite manually via email with valid recipient data and with message","should invite manually via email with valid recipient data and with message",""
"passed","Sun Apr 21 04:14:32 UTC 2024","Sun Apr 21 04:16:19 UTC 2024","106526","","My Profile: [FNN-695] Add portfolio Positive","","My Profile: [FNN-695] Add portfolio Positive","should add portfolio","should add portfolio",""
"passed","Sun Apr 21 04:50:34 UTC 2024","Sun Apr 21 04:51:04 UTC 2024","30595","","Freelancer search: [FNN-924] Freelancer search as CR user","","Freelancer search: [FNN-924] Freelancer search as CR user","should filter freelancers by Minimum references","should filter freelancers by Minimum references",""
"passed","Sun Apr 21 04:48:07 UTC 2024","Sun Apr 21 04:48:49 UTC 2024","42402","","[FNN-661] Send interest","","[FNN-661] Send interest","should assign the Freelancer user","should assign the Freelancer user",""
"passed","Sun Apr 21 05:01:54 UTC 2024","Sun Apr 21 05:02:02 UTC 2024","8130","","My Transactions: [FNN-737] Hourly project: Start project. Negative","","My Transactions: [FNN-737] Hourly project: Start project. Negative","should start project without Way of paying","should start project without Way of paying",""
"passed","Sun Apr 21 05:14:14 UTC 2024","Sun Apr 21 05:14:38 UTC 2024","23691","","Post Project: [FNN-588] Post project without account Negative","","Post Project: [FNN-588] Post project without account Negative","should post project with wrong email","should post project with wrong email",""
"passed","Sun Apr 21 05:10:54 UTC 2024","Sun Apr 21 05:11:00 UTC 2024","6294","","My Profile: [FNN-719] Add resume Negative","","My Profile: [FNN-719] Add resume Negative","should add certificate without achieved annual","should add certificate without achieved annual",""
"passed","Sun Apr 21 05:20:51 UTC 2024","Sun Apr 21 05:21:33 UTC 2024","41978","","[FNN-743] Archive and restore message","","[FNN-743] Archive and restore message","should restore the message","should restore the message",""
"passed","Sun Apr 21 04:13:20 UTC 2024","Sun Apr 21 04:13:33 UTC 2024","12290","","Subscribe: [FNN-577] Subscribe Negative","","Subscribe: [FNN-577] Subscribe Negative","should subscribe with short password","should subscribe with short password",""
"failed","Sun Apr 21 05:26:18 UTC 2024","Sun Apr 21 05:26:53 UTC 2024","34846","","My Transactions: [FNN-708] Hourly project: In advance. Positive","","My Transactions: [FNN-708] Hourly project: In advance. Positive","should add hours","should add hours",""
"passed","Sun Apr 21 04:29:52 UTC 2024","Sun Apr 21 04:32:27 UTC 2024","154143","","Search Project: [FNN-568] Project search","","Search Project: [FNN-568] Project search","should filter projects by Category","should filter projects by Category",""
"passed","Sun Apr 21 04:55:30 UTC 2024","Sun Apr 21 04:55:44 UTC 2024","13367","","My Transactions: [FNN-1430] Milestones project: In retrospect. Positive","","My Transactions: [FNN-1430] Milestones project: In retrospect. Positive","should verify that the money paid","should verify that the money paid",""
"passed","Sun Apr 21 04:26:27 UTC 2024","Sun Apr 21 04:27:48 UTC 2024","81074","","Settings: [FNN-674] Change password Positive","","Settings: [FNN-674] Change password Positive","should change password with valid credentials","should change password with valid credentials",""
"passed","Sun Apr 21 04:41:52 UTC 2024","Sun Apr 21 04:46:04 UTC 2024","252520","","Freelancer search: [FNN-846] Invite to project","","Freelancer search: [FNN-846] Invite to project","should invite to a project via the ""Invite to project"" action","should invite to a project via the ""Invite to project"" action",""
"skipped","Sun Apr 21 05:26:53 UTC 2024","Sun Apr 21 05:26:53 UTC 2024","0","","My Transactions: [FNN-708] Hourly project: In advance. Positive","","My Transactions: [FNN-708] Hourly project: In advance. Positive","should verify that the period is closed","should verify that the period is closed",""
"failed","Sun Apr 21 05:09:43 UTC 2024","Sun Apr 21 05:10:11 UTC 2024","27815","","My Profile: [FNN-719] Add resume Negative","","My Profile: [FNN-719] Add resume Negative","should add education without period from","should add education without period from",""
"passed","Sun Apr 21 04:18:39 UTC 2024","Sun Apr 21 04:19:25 UTC 2024","46301","","My Profile: [FNN-699] Request reference Positive","","My Profile: [FNN-699] Request reference Positive","should check the validated reference","should check the validated reference",""
"passed","Sun Apr 21 04:51:04 UTC 2024","Sun Apr 21 04:52:16 UTC 2024","71201","","Freelancer search: [FNN-924] Freelancer search as CR user","","Freelancer search: [FNN-924] Freelancer search as CR user","should filter freelancers by Minimum rating","should filter freelancers by Minimum rating",""
"passed","Sun Apr 21 04:15:17 UTC 2024","Sun Apr 21 04:15:31 UTC 2024","14066","","My Profile: [FNN-690] Add resume Positive","","My Profile: [FNN-690] Add resume Positive","should add Certificate","should add Certificate",""
"passed","Sun Apr 21 04:08:56 UTC 2024","Sun Apr 21 04:09:00 UTC 2024","4484","","Login: [FNN-574] Log in from the Login page Negative","","Login: [FNN-574] Log in from the Login page Negative","should log in with wrong email format","should log in with wrong email format",""
"passed","Sun Apr 21 05:08:25 UTC 2024","Sun Apr 21 05:08:55 UTC 2024","29792","","Upgrade: [FNN-659] Upgrade account Negative","","Upgrade: [FNN-659] Upgrade account Negative","should upgrade account to Standard 1 month: Incorrect number decline","should upgrade account to Standard 1 month: Incorrect number decline",""
"passed","Sun Apr 21 05:05:55 UTC 2024","Sun Apr 21 05:06:26 UTC 2024","30857","","Upgrade: [FNN-659] Upgrade account Negative","","Upgrade: [FNN-659] Upgrade account Negative","should upgrade account to Standard 1 month: Lost card decline","should upgrade account to Standard 1 month: Lost card decline",""
"passed","Sun Apr 21 05:09:33 UTC 2024","Sun Apr 21 05:09:38 UTC 2024","5036","","My Profile: [FNN-719] Add resume Negative","","My Profile: [FNN-719] Add resume Negative","should add education without institute","should add education without institute",""
"passed","Sun Apr 21 04:23:18 UTC 2024","Sun Apr 21 04:23:31 UTC 2024","13530","","Post Project: [FNN-649] Post project with account Negative","","Post Project: [FNN-649] Post project with account Negative","should post project with short Title","should post project with short Title",""
"passed","Sun Apr 21 05:18:40 UTC 2024","Sun Apr 21 05:19:00 UTC 2024","20159","","Freelancer search: [FNN-815] Freelancer search as non-CR user","","Freelancer search: [FNN-815] Freelancer search as non-CR user","should filter freelancers by Hourly Rate","should filter freelancers by Hourly Rate",""
"passed","Sun Apr 21 04:38:39 UTC 2024","Sun Apr 21 04:39:54 UTC 2024","74810","","My Projects: [FNN-1093] Pause project","","My Projects: [FNN-1093] Pause project","should verify status of the project as unregistered user","should verify status of the project as unregistered user",""
"passed","Sun Apr 21 05:04:40 UTC 2024","Sun Apr 21 05:04:45 UTC 2024","5525","","My Profile: [FNN-668] Edit account details Negative","","My Profile: [FNN-668] Edit account details Negative","should edit account details with invalid phone number","should edit account details with invalid phone number",""
"passed","Sun Apr 21 05:00:03 UTC 2024","Sun Apr 21 05:00:15 UTC 2024","12017","","CR: [FNN-744] CR Subscribe Negative","","CR: [FNN-744] CR Subscribe Negative","should subscribe as CR with wrong phone number","should subscribe as CR with wrong phone number",""
"passed","Sun Apr 21 04:33:45 UTC 2024","Sun Apr 21 04:33:51 UTC 2024","5659","","Search Project: [FNN-568] Project search","","Search Project: [FNN-568] Project search","should filter projects by Posted since Last 3 days","should filter projects by Posted since Last 3 days",""
"passed","Sun Apr 21 05:11:19 UTC 2024","Sun Apr 21 05:11:23 UTC 2024","4738","","Post Project","","Post Project","[FNN-2387] Professional receives Verify email letter (FNN-650)","[FNN-2387] Professional receives Verify email letter (FNN-650)",""
"passed","Sun Apr 21 05:00:15 UTC 2024","Sun Apr 21 05:00:29 UTC 2024","13678","","CR: [FNN-744] CR Subscribe Negative","","CR: [FNN-744] CR Subscribe Negative","should subscribe as CR with taken phone number","should subscribe as CR with taken phone number",""
"passed","Sun Apr 21 05:14:33 UTC 2024","Sun Apr 21 05:15:37 UTC 2024","63484","","My Network: [FNN-1232] Invite manually via email with custom message with signup bonus","","My Network: [FNN-1232] Invite manually via email with custom message with signup bonus","should subscribe as the freelancer with recipient details and accept the invitation","should subscribe as the freelancer with recipient details and accept the invitation",""
"passed","Sun Apr 21 04:32:38 UTC 2024","Sun Apr 21 04:32:50 UTC 2024","12052","","Search Project: [FNN-568] Project search","","Search Project: [FNN-568] Project search","should filter projects by Location","should filter projects by Location",""
"passed","Sun Apr 21 05:08:46 UTC 2024","Sun Apr 21 05:08:58 UTC 2024","12037","","My Profile: [FNN-719] Add resume Negative","","My Profile: [FNN-719] Add resume Negative","should add experience without period from  ","should add experience without period from  ",""
"passed","Sun Apr 21 05:04:31 UTC 2024","Sun Apr 21 05:06:22 UTC 2024","110326","","Upgrade","","Upgrade","[FNN-658] Upgrade account Positive: Standaard 1 month","[FNN-658] Upgrade account Positive: Standaard 1 month",""
"passed","Sun Apr 21 04:33:34 UTC 2024","Sun Apr 21 04:33:39 UTC 2024","4770","","Search Project: [FNN-568] Project search","","Search Project: [FNN-568] Project search","should filter projects by Status All projects","should filter projects by Status All projects",""
"passed","Sun Apr 21 04:59:02 UTC 2024","Sun Apr 21 04:59:14 UTC 2024","11200","","CR: [FNN-744] CR Subscribe Negative","","CR: [FNN-744] CR Subscribe Negative","should subscribe as CR without last name","should subscribe as CR without last name",""
"passed","Sun Apr 21 05:06:56 UTC 2024","Sun Apr 21 05:07:25 UTC 2024","29705","","Upgrade: [FNN-659] Upgrade account Negative","","Upgrade: [FNN-659] Upgrade account Negative","should upgrade account to Standard 1 month: Expired card decline","should upgrade account to Standard 1 month: Expired card decline",""
"failed","Sun Apr 21 05:02:07 UTC 2024","Sun Apr 21 05:04:28 UTC 2024","140868","","CR: [FNN-1779] My Dashboard page integrity as Employer","","CR: [FNN-1779] My Dashboard page integrity as Employer","should verify the integrity of the My Dashboard page as employer","should verify the integrity of the My Dashboard page as employer",""
"passed","Sun Apr 21 05:12:09 UTC 2024","Sun Apr 21 05:12:18 UTC 2024","8657","","My Profile: [FNN-730] Request reference Negative","","My Profile: [FNN-730] Request reference Negative","should pass step 3 without comments","should pass step 3 without comments",""
"passed","Sun Apr 21 04:35:32 UTC 2024","Sun Apr 21 04:35:38 UTC 2024","5864","","My Network: [FNN-620] Invite manually via email and sms Negative","","My Network: [FNN-620] Invite manually via email and sms Negative","should invite manually via email without last name","should invite manually via email without last name",""
"passed","Sun Apr 21 05:19:58 UTC 2024","Sun Apr 21 05:25:31 UTC 2024","333023","","My Transactions: [FNN-1431] Hourly project: In retrospect. Positive","","My Transactions: [FNN-1431] Hourly project: In retrospect. Positive","should start hourly project","should start hourly project",""
"passed","Sun Apr 21 04:35:40 UTC 2024","Sun Apr 21 04:35:45 UTC 2024","4880","","My Network: [FNN-620] Invite manually via email and sms Negative","","My Network: [FNN-620] Invite manually via email and sms Negative","should invite manually via sms without phone number","should invite manually via sms without phone number",""
"passed","Sun Apr 21 05:01:42 UTC 2024","Sun Apr 21 05:01:54 UTC 2024","11447","","My Transactions: [FNN-737] Hourly project: Start project. Negative","","My Transactions: [FNN-737] Hourly project: Start project. Negative","should start project with Hourly rate rate than 25","should start project with Hourly rate rate than 25",""
"passed","Sun Apr 21 04:56:11 UTC 2024","Sun Apr 21 05:01:20 UTC 2024","308843","","My Transactions: [FNN-738] Milestones project: Add milestone. Negative","","My Transactions: [FNN-738] Milestones project: Add milestone. Negative","should add milestone without Amount, Delivery date, and Description","should add milestone without Amount, Delivery date, and Description",""
"passed","Sun Apr 21 05:17:10 UTC 2024","Sun Apr 21 05:18:05 UTC 2024","55032","","Post Project: [FNN-588] Post project without account Negative","","Post Project: [FNN-588] Post project without account Negative","should post project without passwords matching","should post project without passwords matching",""
"passed","Sun Apr 21 04:27:11 UTC 2024","Sun Apr 21 04:27:46 UTC 2024","35253","","Settings: [FNN-675] Change password Negative","","Settings: [FNN-675] Change password Negative","should change password without new and repeat password","should change password without new and repeat password",""
"passed","Sun Apr 21 04:15:31 UTC 2024","Sun Apr 21 04:15:38 UTC 2024","6602","","My Profile: [FNN-690] Add resume Positive","","My Profile: [FNN-690] Add resume Positive","should add Motivation","should add Motivation",""
"passed","Sun Apr 21 05:18:52 UTC 2024","Sun Apr 21 05:20:36 UTC 2024","103633","","My Projects: [FNN-1058] Complete project Negative","","My Projects: [FNN-1058] Complete project Negative","should complete project with short Comments","should complete project with short Comments",""
"passed","Sun Apr 21 04:23:53 UTC 2024","Sun Apr 21 04:24:08 UTC 2024","14651","","Post Project: [FNN-649] Post project with account Negative","","Post Project: [FNN-649] Post project with account Negative","should post project without Budget","should post project without Budget",""
"passed","Sun Apr 21 04:09:03 UTC 2024","Sun Apr 21 04:09:06 UTC 2024","3302","","Login: [FNN-574] Log in from the Login page Negative","","Login: [FNN-574] Log in from the Login page Negative","should log in without password","should log in without password",""
"passed","Sun Apr 21 04:28:03 UTC 2024","Sun Apr 21 04:29:39 UTC 2024","95704","","Settings: [FNN-677] Downgrade to ""Stand-by Standaard""","","Settings: [FNN-677] Downgrade to ""Stand-by Standaard""","should downgrade to ""Stand-by Standaard""","should downgrade to ""Stand-by Standaard""",""
"passed","Sun Apr 21 04:28:25 UTC 2024","Sun Apr 21 04:29:13 UTC 2024","47793","","Settings: [FNN-675] Change password Negative","","Settings: [FNN-675] Change password Negative","should change password with invalid old password","should change password with invalid old password",""
"passed","Sun Apr 21 04:09:27 UTC 2024","Sun Apr 21 04:09:58 UTC 2024","31184","","Login: [FNN-563] Log in from the header Negative","","Login: [FNN-563] Log in from the header Negative","should log in without credentials","should log in without credentials",""
"passed","Sun Apr 21 04:26:12 UTC 2024","Sun Apr 21 04:27:06 UTC 2024","53684","","Settings: [FNN-673] Confirm email address","","Settings: [FNN-673] Confirm email address","should confirm email address","should confirm email address",""
"passed","Sun Apr 21 04:25:03 UTC 2024","Sun Apr 21 04:25:19 UTC 2024","16517","","Post Project: [FNN-649] Post project with account Negative","","Post Project: [FNN-649] Post project with account Negative","should post project without End date","should post project without End date",""
"passed","Sun Apr 21 05:03:25 UTC 2024","Sun Apr 21 05:04:34 UTC 2024","69148","","My Profile: [FNN-668] Edit account details Negative","","My Profile: [FNN-668] Edit account details Negative","should edit account details without required fields","should edit account details without required fields",""
"passed","Sun Apr 21 05:14:30 UTC 2024","Sun Apr 21 05:18:55 UTC 2024","265061","","My Network: [FNN-664] Invite freelancer","","My Network: [FNN-664] Invite freelancer","should invite freelancer","should invite freelancer",""
"passed","Sun Apr 21 05:01:19 UTC 2024","Sun Apr 21 05:01:33 UTC 2024","13861","","CR: [FNN-744] CR Subscribe Negative","","CR: [FNN-744] CR Subscribe Negative","should subscribe as CR without agreeing to the Terms and Conditions","should subscribe as CR without agreeing to the Terms and Conditions",""
"passed","Sun Apr 21 05:20:50 UTC 2024","Sun Apr 21 05:24:34 UTC 2024","223946","","CR","","CR","[FNN-749] Invite to the organization manually","[FNN-749] Invite to the organization manually",""
"passed","Sun Apr 21 05:16:25 UTC 2024","Sun Apr 21 05:16:48 UTC 2024","23037","","Post Project: [FNN-588] Post project without account Negative","","Post Project: [FNN-588] Post project without account Negative","should post project without repeat password","should post project without repeat password",""
"passed","Sun Apr 21 05:08:21 UTC 2024","Sun Apr 21 05:08:33 UTC 2024","11995","","My Profile: [FNN-719] Add resume Negative","","My Profile: [FNN-719] Add resume Negative","should add experience without position","should add experience without position",""
"passed","Sun Apr 21 04:11:01 UTC 2024","Sun Apr 21 04:11:49 UTC 2024","48307","","Reset password","","Reset password","[FNN-656] Forgot password button functionality","[FNN-656] Forgot password button functionality",""
"passed","Sun Apr 21 04:12:22 UTC 2024","Sun Apr 21 04:12:34 UTC 2024","11168","","Subscribe: [FNN-577] Subscribe Negative","","Subscribe: [FNN-577] Subscribe Negative","should subscribe without phone number","should subscribe without phone number",""
"passed","Sun Apr 21 04:46:04 UTC 2024","Sun Apr 21 04:46:23 UTC 2024","19166","","Freelancer search: [FNN-846] Invite to project","","Freelancer search: [FNN-846] Invite to project","should check the invitation and send an interest of the project","should check the invitation and send an interest of the project",""
"passed","Sun Apr 21 05:08:33 UTC 2024","Sun Apr 21 05:08:46 UTC 2024","12937","","My Profile: [FNN-719] Add resume Negative","","My Profile: [FNN-719] Add resume Negative","should add experience without company","should add experience without company",""
"passed","Sun Apr 21 04:23:40 UTC 2024","Sun Apr 21 04:23:53 UTC 2024","12515","","Post Project: [FNN-649] Post project with account Negative","","Post Project: [FNN-649] Post project with account Negative","should post project without step 2","should post project without step 2",""
"skipped","Sun Apr 21 04:47:49 UTC 2024","Sun Apr 21 04:47:49 UTC 2024","1","","[FNN-667] Send contact","","[FNN-667] Send contact","should check the contact as the first user","should check the contact as the first user",""
"passed","Sun Apr 21 05:10:28 UTC 2024","Sun Apr 21 05:10:35 UTC 2024","6748","","My Profile: [FNN-730] Request reference Negative","","My Profile: [FNN-730] Request reference Negative","should pass step 2 without last name","should pass step 2 without last name",""
"skipped","Sun Apr 21 05:26:12 UTC 2024","Sun Apr 21 05:26:12 UTC 2024","0","","My Transactions: [FNN-1431] Hourly project: In retrospect. Positive","","My Transactions: [FNN-1431] Hourly project: In retrospect. Positive","should verify that the period is closed","should verify that the period is closed",""
"passed","Sun Apr 21 04:24:08 UTC 2024","Sun Apr 21 04:24:27 UTC 2024","19264","","Post Project: [FNN-649] Post project with account Negative","","Post Project: [FNN-649] Post project with account Negative","should post project without Work on location","should post project without Work on location",""
"broken","Sun Apr 21 05:20:23 UTC 2024","Sun Apr 21 05:20:44 UTC 2024","21142","","CR: [FNN-742] CR subscribe Positive","","CR: [FNN-742] CR subscribe Positive","should subscribe as CR with valid credentials","should subscribe as CR with valid credentials",""
"failed","Sun Apr 21 05:11:23 UTC 2024","Sun Apr 21 05:12:05 UTC 2024","41654","","Post Project","","Post Project","[FNN-2423] User receives the Project posted letter (FNN-650)","[FNN-2423] User receives the Project posted letter (FNN-650)",""
"passed","Sun Apr 21 04:18:11 UTC 2024","Sun Apr 21 04:19:59 UTC 2024","107907","","My Profile: [FNN-713] Confirm phone number Negative","","My Profile: [FNN-713] Confirm phone number Negative","should confirm phone number with invalid code","should confirm phone number with invalid code",""
"passed","Sun Apr 21 05:24:37 UTC 2024","Sun Apr 21 05:24:53 UTC 2024","16544","","CR","","CR","[FNN-2401] Accept manual invitation to organization (manual)","[FNN-2401] Accept manual invitation to organization (manual)",""
"passed","Sun Apr 21 04:44:50 UTC 2024","Sun Apr 21 04:45:02 UTC 2024","11843","","Create Profile: [FNN-684] Create profile Negative","","Create Profile: [FNN-684] Create profile Negative","should create profile without City","should create profile without City",""
"passed","Sun Apr 21 04:15:52 UTC 2024","Sun Apr 21 04:16:00 UTC 2024","8940","","My Profile: [FNN-690] Add resume Positive","","My Profile: [FNN-690] Add resume Positive","should add Language","should add Language",""
"failed","Sun Apr 21 05:04:54 UTC 2024","Sun Apr 21 05:05:54 UTC 2024","59699","","My Profile: [FNN-668] Edit account details Negative","","My Profile: [FNN-668] Edit account details Negative","should edit account details with invalid VAT number","should edit account details with invalid VAT number",""
"passed","Sun Apr 21 04:42:48 UTC 2024","Sun Apr 21 04:46:25 UTC 2024","217123","","Freelancer search: [FNN-924] Freelancer search as CR user","","Freelancer search: [FNN-924] Freelancer search as CR user","should filter freelancers by Terms","should filter freelancers by Terms",""
"skipped","Sun Apr 21 05:26:53 UTC 2024","Sun Apr 21 05:26:53 UTC 2024","2","","My Transactions: [FNN-708] Hourly project: In advance. Positive","","My Transactions: [FNN-708] Hourly project: In advance. Positive","should close the period","should close the period",""
"passed","Sun Apr 21 04:32:27 UTC 2024","Sun Apr 21 04:32:38 UTC 2024","11669","","Search Project: [FNN-568] Project search","","Search Project: [FNN-568] Project search","should filter projects by Search terms","should filter projects by Search terms",""
"passed","Sun Apr 21 04:15:06 UTC 2024","Sun Apr 21 04:15:17 UTC 2024","11547","","My Profile: [FNN-690] Add resume Positive","","My Profile: [FNN-690] Add resume Positive","should add Education","should add Education",""
"passed","Sun Apr 21 05:02:44 UTC 2024","Sun Apr 21 05:03:07 UTC 2024","23021","","My Transactions: [FNN-710] Milestones project: In advance. Positive","","My Transactions: [FNN-710] Milestones project: In advance. Positive","should approve milestone","should approve milestone",""
"passed","Sun Apr 21 04:36:23 UTC 2024","Sun Apr 21 04:38:39 UTC 2024","136197","","My Projects: [FNN-1093] Pause project","","My Projects: [FNN-1093] Pause project","should pause the project","should pause the project",""
"passed","Sun Apr 21 04:34:32 UTC 2024","Sun Apr 21 04:35:20 UTC 2024","47605","","My Network: [FNN-620] Invite manually via email and sms Negative","","My Network: [FNN-620] Invite manually via email and sms Negative","should invite manually via email without email","should invite manually via email without email",""
"passed","Sun Apr 21 05:01:33 UTC 2024","Sun Apr 21 05:01:35 UTC 2024","2269","","CR: [FNN-744] CR Subscribe Negative","","CR: [FNN-744] CR Subscribe Negative","should subscribe as CR without data","should subscribe as CR without data",""
"passed","Sun Apr 21 04:40:05 UTC 2024","Sun Apr 21 04:42:26 UTC 2024","141236","","Freelancer search: [FNN-816] Create list Functionality","","Freelancer search: [FNN-816] Create list Functionality","should create a list of freelancers","should create a list of freelancers",""
"passed","Sun Apr 21 05:08:55 UTC 2024","Sun Apr 21 05:09:54 UTC 2024","59666","","Upgrade: [FNN-659] Upgrade account Negative","","Upgrade: [FNN-659] Upgrade account Negative","should upgrade account to Standard 1 month: Exceeding velocity limit decline","should upgrade account to Standard 1 month: Exceeding velocity limit decline",""
"passed","Sun Apr 21 04:34:06 UTC 2024","Sun Apr 21 04:36:17 UTC 2024","130621","","Search Project: [FNN-568] Project search","","Search Project: [FNN-568] Project search","should filter projects by Number of responses","should filter projects by Number of responses",""
"passed","Sun Apr 21 05:01:45 UTC 2024","Sun Apr 21 05:02:10 UTC 2024","25354","","My Transactions: [FNN-738] Milestones project: Add milestone. Negative","","My Transactions: [FNN-738] Milestones project: Add milestone. Negative","should add milestone with Amount less than 250","should add milestone with Amount less than 250",""
"passed","Sun Apr 21 04:51:03 UTC 2024","Sun Apr 21 04:55:52 UTC 2024","288596","","My Transactions: [FNN-1432] Milestones project: Start project. Negative","","My Transactions: [FNN-1432] Milestones project: Start project. Negative","should start project without milestone","should start project without milestone",""
