"Status","Start Time","Stop Time","Duration in ms","Parent Suite","Suite","Sub Suite","Test Class","Test Method","Name","Description"
"passed","Sun Mar 10 04:20:07 UTC 2024","Sun Mar 10 04:20:13 UTC 2024","6082","","My Network: [FNN-620] Invite manually via email and sms Negative","","My Network: [FNN-620] Invite manually via email and sms Negative","should invite manually via email with wrong email format","should invite manually via email with wrong email format",""
"failed","Sun Mar 10 04:28:51 UTC 2024","Sun Mar 10 04:29:47 UTC 2024","56059","","My Profile: [FNN-669] Edit account details Positive","","My Profile: [FNN-669] Edit account details Positive","""before each"" hook for [FNN-669] Edit account details Positive","""before each"" hook for [FNN-669] Edit account details Positive",""
"broken","Sun Mar 10 04:33:47 UTC 2024","Sun Mar 10 04:34:23 UTC 2024","35723","","Settings: [FNN-678] Delete account without subscription","","Settings: [FNN-678] Delete account without subscription","""before all"" hook for [FNN-678] Delete account without subscription","""before all"" hook for [FNN-678] Delete account without subscription",""
"broken","Sun Mar 10 04:41:48 UTC 2024","Sun Mar 10 04:42:30 UTC 2024","41941","","[FNN-813] Change language","","[FNN-813] Change language","""before all"" hook for [FNN-813] Change language","""before all"" hook for [FNN-813] Change language",""
"failed","Sun Mar 10 04:32:39 UTC 2024","Sun Mar 10 04:33:17 UTC 2024","38024","","Settings: [FNN-675] Change password Negative","","Settings: [FNN-675] Change password Negative","""before all"" hook for [FNN-675] Change password Negative","""before all"" hook for [FNN-675] Change password Negative",""
"passed","Sun Mar 10 04:45:40 UTC 2024","Sun Mar 10 04:45:50 UTC 2024","10737","","CR: [FNN-744] CR Subscribe Negative","","CR: [FNN-744] CR Subscribe Negative","should subscribe as CR with wrong email format","should subscribe as CR with wrong email format",""
"passed","Sun Mar 10 04:36:24 UTC 2024","Sun Mar 10 04:36:26 UTC 2024","2405","","My Profile: [FNN-719] Add resume Negative","","My Profile: [FNN-719] Add resume Negative","should add language without levels","should add language without levels",""
"passed","Sun Mar 10 04:27:34 UTC 2024","Sun Mar 10 04:27:49 UTC 2024","14864","","Subscribe: [FNN-577] Subscribe Negative","","Subscribe: [FNN-577] Subscribe Negative","should subscribe without data","should subscribe without data",""
"failed","Sun Mar 10 04:35:09 UTC 2024","Sun Mar 10 04:35:35 UTC 2024","26315","","My Profile: [FNN-719] Add resume Negative","","My Profile: [FNN-719] Add resume Negative","should add education without period from","should add education without period from",""
"passed","Sun Mar 10 04:43:18 UTC 2024","Sun Mar 10 04:43:27 UTC 2024","8837","","Create Profile: [FNN-684] Create profile Negative","","Create Profile: [FNN-684] Create profile Negative","should create profile without Profile picture","should create profile without Profile picture",""
"broken","Sun Mar 10 04:32:38 UTC 2024","Sun Mar 10 04:33:58 UTC 2024","79849","","Post Project: [FNN-650] Post project without account Positive","","Post Project: [FNN-650] Post project without account Positive","""after all"" hook for [FNN-650] Post project without account Positive","""after all"" hook for [FNN-650] Post project without account Positive",""
"passed","Sun Mar 10 04:45:21 UTC 2024","Sun Mar 10 04:45:30 UTC 2024","9481","","CR: [FNN-744] CR Subscribe Negative","","CR: [FNN-744] CR Subscribe Negative","should subscribe as CR without last name","should subscribe as CR without last name",""
"passed","Sun Mar 10 04:27:19 UTC 2024","Sun Mar 10 04:27:43 UTC 2024","24764","","Subscribe: [FNN-2167] 500 € signup bonus","","Subscribe: [FNN-2167] 500 € signup bonus","should verify 500€ signup bonus","should verify 500€ signup bonus",""
"passed","Sun Mar 10 04:36:45 UTC 2024","Sun Mar 10 04:36:59 UTC 2024","14435","","My Network: [FNN-619] Invite manually via sms with signup bonus","","My Network: [FNN-619] Invite manually via sms with signup bonus","should check My Dashboard and My Transactions page for the signup bonus as the inviter user","should check My Dashboard and My Transactions page for the signup bonus as the inviter user",""
"broken","Sun Mar 10 04:17:49 UTC 2024","Sun Mar 10 04:18:24 UTC 2024","35006","","Settings: [FNN-680] Deactivate profile","","Settings: [FNN-680] Deactivate profile","""before all"" hook for [FNN-680] Deactivate profile","""before all"" hook for [FNN-680] Deactivate profile",""
"broken","Sun Mar 10 04:44:01 UTC 2024","Sun Mar 10 04:44:45 UTC 2024","44390","","My Transactions: [FNN-710] Milestones project: In advance. Positive","","My Transactions: [FNN-710] Milestones project: In advance. Positive","""before all"" hook for [FNN-710] Milestones project: In advance. Positive","""before all"" hook for [FNN-710] Milestones project: In advance. Positive",""
"failed","Sun Mar 10 04:25:31 UTC 2024","Sun Mar 10 04:26:08 UTC 2024","37031","","CR: [FNN-744] CR Subscribe Negative","","CR: [FNN-744] CR Subscribe Negative","""before all"" hook for [FNN-744] CR Subscribe Negative","""before all"" hook for [FNN-744] CR Subscribe Negative",""
"failed","Sun Mar 10 04:44:40 UTC 2024","Sun Mar 10 04:45:18 UTC 2024","38402","","CR: [FNN-751] Invite to the organization manually Negative","","CR: [FNN-751] Invite to the organization manually Negative","""before all"" hook for [FNN-751] Invite to the organization manually Negative","""before all"" hook for [FNN-751] Invite to the organization manually Negative",""
"failed","Sun Mar 10 04:34:34 UTC 2024","Sun Mar 10 04:34:57 UTC 2024","23086","","My Profile: [FNN-719] Add resume Negative","","My Profile: [FNN-719] Add resume Negative","should add education without data","should add education without data",""
"failed","Sun Mar 10 04:42:52 UTC 2024","Sun Mar 10 04:43:47 UTC 2024","55232","","My Transactions: [FNN-1432] Milestones project: Start project. Negative","","My Transactions: [FNN-1432] Milestones project: Start project. Negative","""before all"" hook for [FNN-1432] Milestones project: Start project. Negative","""before all"" hook for [FNN-1432] Milestones project: Start project. Negative",""
"passed","Sun Mar 10 04:35:03 UTC 2024","Sun Mar 10 04:35:09 UTC 2024","5828","","My Profile: [FNN-719] Add resume Negative","","My Profile: [FNN-719] Add resume Negative","should add education without education","should add education without education",""
"passed","Sun Mar 10 04:10:49 UTC 2024","Sun Mar 10 04:11:18 UTC 2024","28834","","Login: [FNN-574] Log in from the Login page Negative","","Login: [FNN-574] Log in from the Login page Negative","should log in without credentials","should log in without credentials",""
"broken","Sun Mar 10 04:30:13 UTC 2024","Sun Mar 10 04:30:51 UTC 2024","38037","","My Profile: [FNN-698] Confirm phone number Positive","","My Profile: [FNN-698] Confirm phone number Positive","""before all"" hook for [FNN-698] Confirm phone number Positive","""before all"" hook for [FNN-698] Confirm phone number Positive",""
"broken","Sun Mar 10 04:17:25 UTC 2024","Sun Mar 10 04:17:58 UTC 2024","33542","","Post Project: [FNN-649] Post project with account Negative","","Post Project: [FNN-649] Post project with account Negative","should post project without Start date","should post project without Start date",""
"passed","Sun Mar 10 04:43:29 UTC 2024","Sun Mar 10 04:44:16 UTC 2024","47556","","CR: [FNN-742] CR subscribe Positive","","CR: [FNN-742] CR subscribe Positive","should subscribe as CR with valid credentials","should subscribe as CR with valid credentials",""
"passed","Sun Mar 10 04:47:31 UTC 2024","Sun Mar 10 04:47:41 UTC 2024","10267","","CR: [FNN-744] CR Subscribe Negative","","CR: [FNN-744] CR Subscribe Negative","should subscribe as CR without agreeing to the Terms and Conditions","should subscribe as CR without agreeing to the Terms and Conditions",""
"broken","Sun Mar 10 04:31:26 UTC 2024","Sun Mar 10 04:32:06 UTC 2024","40151","","My Profile: [FNN-730] Request reference Negative","","My Profile: [FNN-730] Request reference Negative","""before all"" hook for [FNN-730] Request reference Negative","""before all"" hook for [FNN-730] Request reference Negative",""
"passed","Sun Mar 10 04:36:44 UTC 2024","Sun Mar 10 04:40:36 UTC 2024","232089","","My Network: [FNN-664] Invite freelancer","","My Network: [FNN-664] Invite freelancer","should invite freelancer","should invite freelancer",""
"passed","Sun Mar 10 04:45:05 UTC 2024","Sun Mar 10 04:45:11 UTC 2024","5523","","CR: [FNN-749] Invite to the organization manually Positive","","CR: [FNN-749] Invite to the organization manually Positive","should check organization page as the inviting user","should check organization page as the inviting user",""
"failed","Sun Mar 10 04:28:25 UTC 2024","Sun Mar 10 04:29:19 UTC 2024","53333","","Upgrade: [FNN-659] Upgrade account Negative","","Upgrade: [FNN-659] Upgrade account Negative","""before all"" hook for [FNN-659] Upgrade account Negative","""before all"" hook for [FNN-659] Upgrade account Negative",""
"passed","Sun Mar 10 04:20:25 UTC 2024","Sun Mar 10 04:20:31 UTC 2024","5238","","My Network: [FNN-620] Invite manually via email and sms Negative","","My Network: [FNN-620] Invite manually via email and sms Negative","should invite manually via sms without phone number","should invite manually via sms without phone number",""
"passed","Sun Mar 10 04:43:54 UTC 2024","Sun Mar 10 04:45:01 UTC 2024","66278","","CR: [FNN-744] CR Subscribe Negative","","CR: [FNN-744] CR Subscribe Negative","should subscribe as CR without sector","should subscribe as CR without sector",""
"broken","Sun Mar 10 04:11:17 UTC 2024","Sun Mar 10 04:11:57 UTC 2024","39185","","Reset password: [FNN-656] Reset password Positive","","Reset password: [FNN-656] Reset password Positive","""before all"" hook for [FNN-656] Reset password Positive","""before all"" hook for [FNN-656] Reset password Positive",""
"passed","Sun Mar 10 04:32:20 UTC 2024","Sun Mar 10 04:32:34 UTC 2024","14569","","Post Project: [FNN-588] Post project without account Negative","","Post Project: [FNN-588] Post project without account Negative","should post project without passwords matching","should post project without passwords matching",""
"broken","Sun Mar 10 04:33:37 UTC 2024","Sun Mar 10 04:35:02 UTC 2024","85122","","Settings: [FNN-676] Change profile settings","","Settings: [FNN-676] Change profile settings","""before all"" hook for [FNN-676] Change profile settings","""before all"" hook for [FNN-676] Change profile settings",""
"broken","Sun Mar 10 04:42:41 UTC 2024","Sun Mar 10 04:43:25 UTC 2024","44383","","My Transactions: [FNN-1431] Hourly project: In retrospect. Positive","","My Transactions: [FNN-1431] Hourly project: In retrospect. Positive","""before all"" hook for [FNN-1431] Hourly project: In retrospect. Positive","""before all"" hook for [FNN-1431] Hourly project: In retrospect. Positive",""
"passed","Sun Mar 10 04:36:33 UTC 2024","Sun Mar 10 04:37:01 UTC 2024","28009","","My Profile: [FNN-719] Add resume Negative","","My Profile: [FNN-719] Add resume Negative","should add language without reading level","should add language without reading level",""
"passed","Sun Mar 10 04:20:38 UTC 2024","Sun Mar 10 04:21:06 UTC 2024","28412","","My Network: [FNN-620] Invite manually via email and sms Negative","","My Network: [FNN-620] Invite manually via email and sms Negative","should invite manually via sms without data","should invite manually via sms without data",""
"failed","Sun Mar 10 04:44:21 UTC 2024","Sun Mar 10 04:45:46 UTC 2024","84309","","CR: [FNN-750] Invite to the organization through search","","CR: [FNN-750] Invite to the organization through search","""before all"" hook for [FNN-750] Invite to the organization through search","""before all"" hook for [FNN-750] Invite to the organization through search",""
"passed","Sun Mar 10 04:45:01 UTC 2024","Sun Mar 10 04:45:10 UTC 2024","9828","","CR: [FNN-744] CR Subscribe Negative","","CR: [FNN-744] CR Subscribe Negative","should subscribe as CR without company name","should subscribe as CR without company name",""
"passed","Sun Mar 10 04:45:10 UTC 2024","Sun Mar 10 04:45:21 UTC 2024","10402","","CR: [FNN-744] CR Subscribe Negative","","CR: [FNN-744] CR Subscribe Negative","should subscribe as CR without first name","should subscribe as CR without first name",""
"passed","Sun Mar 10 04:14:24 UTC 2024","Sun Mar 10 04:15:03 UTC 2024","39126","","Post Project: [FNN-649] Post project with account Negative","","Post Project: [FNN-649] Post project with account Negative","should post project without step 1","should post project without step 1",""
"passed","Sun Mar 10 04:34:13 UTC 2024","Sun Mar 10 04:34:23 UTC 2024","9907","","My Profile: [FNN-719] Add resume Negative","","My Profile: [FNN-719] Add resume Negative","should add experience without period from  ","should add experience without period from  ",""
"passed","Sun Mar 10 04:29:50 UTC 2024","Sun Mar 10 04:30:06 UTC 2024","15768","","Upgrade: [FNN-658] Upgrade account Positive","","Upgrade: [FNN-658] Upgrade account Positive","should upgrade account to Standaard 1 month","should upgrade account to Standaard 1 month",""
"passed","Sun Mar 10 04:12:25 UTC 2024","Sun Mar 10 04:12:50 UTC 2024","24821","","Upgrade: [FNN-658] Upgrade account Positive","","Upgrade: [FNN-658] Upgrade account Positive","should upgrade account to Premium 1 month","should upgrade account to Premium 1 month",""
"passed","Sun Mar 10 04:29:37 UTC 2024","Sun Mar 10 04:31:10 UTC 2024","92692","","My Profile: [FNN-695] Add portfolio Positive","","My Profile: [FNN-695] Add portfolio Positive","should add portfolio","should add portfolio",""
"failed","Sun Mar 10 04:26:27 UTC 2024","Sun Mar 10 04:27:19 UTC 2024","51655","","Subscribe: [FNN-2167] 500 € signup bonus","","Subscribe: [FNN-2167] 500 € signup bonus","""before all"" hook for [FNN-2167] 500 € signup bonus","""before all"" hook for [FNN-2167] 500 € signup bonus",""
"passed","Sun Mar 10 04:45:30 UTC 2024","Sun Mar 10 04:45:40 UTC 2024","9393","","CR: [FNN-744] CR Subscribe Negative","","CR: [FNN-744] CR Subscribe Negative","should subscribe as CR without email","should subscribe as CR without email",""
"passed","Sun Mar 10 04:47:21 UTC 2024","Sun Mar 10 04:47:31 UTC 2024","10184","","CR: [FNN-744] CR Subscribe Negative","","CR: [FNN-744] CR Subscribe Negative","should subscribe as CR with invalid repeat password","should subscribe as CR with invalid repeat password",""
"passed","Sun Mar 10 04:46:02 UTC 2024","Sun Mar 10 04:46:12 UTC 2024","9200","","CR: [FNN-744] CR Subscribe Negative","","CR: [FNN-744] CR Subscribe Negative","should subscribe as CR without phone number","should subscribe as CR without phone number",""
"passed","Sun Mar 10 04:28:25 UTC 2024","Sun Mar 10 04:28:39 UTC 2024","14190","","CR: [FNN-1888] My Dashboard page integrity as Freelancer","","CR: [FNN-1888] My Dashboard page integrity as Freelancer","should verify the integrity of the My Dashboard page as freelancer","should verify the integrity of the My Dashboard page as freelancer",""
"broken","Sun Mar 10 04:40:44 UTC 2024","Sun Mar 10 04:41:25 UTC 2024","40932","","[FNN-667] Send contact","","[FNN-667] Send contact","""before all"" hook for [FNN-667] Send contact","""before all"" hook for [FNN-667] Send contact",""
"broken","Sun Mar 10 04:27:49 UTC 2024","Sun Mar 10 04:28:25 UTC 2024","36545","","CR: [FNN-1888] My Dashboard page integrity as Freelancer","","CR: [FNN-1888] My Dashboard page integrity as Freelancer","""before all"" hook for [FNN-1888] My Dashboard page integrity as Freelancer","""before all"" hook for [FNN-1888] My Dashboard page integrity as Freelancer",""
"passed","Sun Mar 10 04:45:50 UTC 2024","Sun Mar 10 04:46:02 UTC 2024","11892","","CR: [FNN-744] CR Subscribe Negative","","CR: [FNN-744] CR Subscribe Negative","should subscribe as CR with taken email","should subscribe as CR with taken email",""
"failed","Sun Mar 10 04:35:35 UTC 2024","Sun Mar 10 04:36:02 UTC 2024","26457","","My Profile: [FNN-719] Add resume Negative","","My Profile: [FNN-719] Add resume Negative","should add education without period to","should add education without period to",""
"broken","Sun Mar 10 04:19:32 UTC 2024","Sun Mar 10 04:20:10 UTC 2024","37781","","My Network: [FNN-664] Invite freelancer","","My Network: [FNN-664] Invite freelancer","""before all"" hook for [FNN-664] Invite freelancer","""before all"" hook for [FNN-664] Invite freelancer",""
"passed","Sun Mar 10 04:29:19 UTC 2024","Sun Mar 10 04:29:33 UTC 2024","14468","","Upgrade: [FNN-659] Upgrade account Negative","","Upgrade: [FNN-659] Upgrade account Negative","should upgrade account to Standard 1 month: Exceeding velocity limit decline","should upgrade account to Standard 1 month: Exceeding velocity limit decline",""
"passed","Sun Mar 10 04:34:57 UTC 2024","Sun Mar 10 04:35:03 UTC 2024","6215","","My Profile: [FNN-719] Add resume Negative","","My Profile: [FNN-719] Add resume Negative","should add education without institute","should add education without institute",""
"passed","Sun Mar 10 04:34:23 UTC 2024","Sun Mar 10 04:34:34 UTC 2024","10942","","My Profile: [FNN-719] Add resume Negative","","My Profile: [FNN-719] Add resume Negative","should add experience without period until","should add experience without period until",""
"passed","Sun Mar 10 04:20:18 UTC 2024","Sun Mar 10 04:20:23 UTC 2024","4830","","My Network: [FNN-620] Invite manually via email and sms Negative","","My Network: [FNN-620] Invite manually via email and sms Negative","should invite manually via email without last name","should invite manually via email without last name",""
"passed","Sun Mar 10 04:39:48 UTC 2024","Sun Mar 10 04:40:02 UTC 2024","14281","","My Projects: [FNN-971] Complete project Positive","","My Projects: [FNN-971] Complete project Positive","should check review as freelancer user","should check review as freelancer user",""
"skipped","Sun Mar 10 04:08:34 UTC 2024","Sun Mar 10 04:08:56 UTC 2024","21911","","Subscribe: [FNN-578] Subscribe Positive","","Subscribe: [FNN-578] Subscribe Positive","should verify the Verify email letter","should verify the Verify email letter",""
"skipped","Sun Mar 10 04:19:50 UTC 2024","Sun Mar 10 04:19:50 UTC 2024","1","","My Network: [FNN-1233] Invite manually via email without custom message with signup bonus","","My Network: [FNN-1233] Invite manually via email without custom message with signup bonus","should subscribe as the freelancer with recipient details and accept the invitation","should subscribe as the freelancer with recipient details and accept the invitation",""
"failed","Sun Mar 10 04:44:51 UTC 2024","Sun Mar 10 04:46:17 UTC 2024","86122","","My Transactions: [FNN-737] Hourly project: Start project. Negative","","My Transactions: [FNN-737] Hourly project: Start project. Negative","""before all"" hook for [FNN-737] Hourly project: Start project. Negative","""before all"" hook for [FNN-737] Hourly project: Start project. Negative",""
"broken","Sun Mar 10 04:14:44 UTC 2024","Sun Mar 10 04:16:14 UTC 2024","89665","","Post Project: [FNN-650] Post project without account Positive","","Post Project: [FNN-650] Post project without account Positive","should post a project as an unregistered user with valid project data","should post a project as an unregistered user with valid project data",""
"passed","Sun Mar 10 04:47:41 UTC 2024","Sun Mar 10 04:47:42 UTC 2024","1237","","CR: [FNN-744] CR Subscribe Negative","","CR: [FNN-744] CR Subscribe Negative","should subscribe as CR without data","should subscribe as CR without data",""
"failed","Sun Mar 10 04:44:11 UTC 2024","Sun Mar 10 04:45:05 UTC 2024","54483","","CR: [FNN-749] Invite to the organization manually Positive","","CR: [FNN-749] Invite to the organization manually Positive","""before all"" hook for [FNN-749] Invite to the organization manually Positive","""before all"" hook for [FNN-749] Invite to the organization manually Positive",""
"passed","Sun Mar 10 04:10:46 UTC 2024","Sun Mar 10 04:10:49 UTC 2024","2925","","Login: [FNN-574] Log in from the Login page Negative","","Login: [FNN-574] Log in from the Login page Negative","should log in without password","should log in without password",""
"passed","Sun Mar 10 04:31:03 UTC 2024","Sun Mar 10 04:31:18 UTC 2024","15097","","My Profile: [FNN-690] Add resume Positive","","My Profile: [FNN-690] Add resume Positive","should check the attached part of the resume on the Profile page","should check the attached part of the resume on the Profile page",""
"passed","Sun Mar 10 04:18:15 UTC 2024","Sun Mar 10 04:18:34 UTC 2024","18723","","Post Project: [FNN-649] Post project with account Negative","","Post Project: [FNN-649] Post project with account Negative","should post project without Description","should post project without Description",""
"broken","Sun Mar 10 04:26:57 UTC 2024","Sun Mar 10 04:27:34 UTC 2024","36684","","Subscribe: [FNN-577] Subscribe Negative","","Subscribe: [FNN-577] Subscribe Negative","""before all"" hook for [FNN-577] Subscribe Negative","""before all"" hook for [FNN-577] Subscribe Negative",""
"passed","Sun Mar 10 04:32:21 UTC 2024","Sun Mar 10 04:32:36 UTC 2024","14232","","My Profile: [FNN-795] Remove portfolio","","My Profile: [FNN-795] Remove portfolio","should remove portfolio","should remove portfolio",""
"broken","Sun Mar 10 04:39:17 UTC 2024","Sun Mar 10 04:39:52 UTC 2024","35018","","[FNN-661] Send interest","","[FNN-661] Send interest","""before all"" hook for [FNN-661] Send interest","""before all"" hook for [FNN-661] Send interest",""
"passed","Sun Mar 10 04:26:58 UTC 2024","Sun Mar 10 04:27:39 UTC 2024","40833","","Login: [FNN-563] Log in from the header Negative","","Login: [FNN-563] Log in from the header Negative","should log in with valid email and invalid password","should log in with valid email and invalid password",""
"broken","Sun Mar 10 04:27:54 UTC 2024","Sun Mar 10 04:28:31 UTC 2024","36793","","Login: [FNN-648] Log in from the Login page Positive","","Login: [FNN-648] Log in from the Login page Positive","""before all"" hook for [FNN-648] Log in from the Login page Positive","""before all"" hook for [FNN-648] Log in from the Login page Positive",""
"passed","Sun Mar 10 04:37:56 UTC 2024","Sun Mar 10 04:38:11 UTC 2024","14546","","Freelancer search: [FNN-816] Create list Functionality","","Freelancer search: [FNN-816] Create list Functionality","should remove created list","should remove created list",""
"broken","Sun Mar 10 04:22:25 UTC 2024","Sun Mar 10 04:22:25 UTC 2024","410","","Freelancer search: [FNN-924] Freelancer search as CR user","","Freelancer search: [FNN-924] Freelancer search as CR user","""after all"" hook for [FNN-924] Freelancer search as CR user","""after all"" hook for [FNN-924] Freelancer search as CR user",""
"passed","Sun Mar 10 04:37:48 UTC 2024","Sun Mar 10 04:38:16 UTC 2024","28174","","Freelancer search: [FNN-815] Freelancer search as non-CR user","","Freelancer search: [FNN-815] Freelancer search as non-CR user","should filter freelancers by Skills","should filter freelancers by Skills",""
"passed","Sun Mar 10 04:45:46 UTC 2024","Sun Mar 10 04:46:10 UTC 2024","24059","","CR: [FNN-750] Invite to the organization through search","","CR: [FNN-750] Invite to the organization through search","should check organization page as the inviting user","should check organization page as the inviting user",""
"failed","Sun Mar 10 04:18:43 UTC 2024","Sun Mar 10 04:19:50 UTC 2024","66626","","My Network: [FNN-1233] Invite manually via email without custom message with signup bonus","","My Network: [FNN-1233] Invite manually via email without custom message with signup bonus","should invite manually via email with valid recipient data and without message","should invite manually via email with valid recipient data and without message",""
"failed","Sun Mar 10 04:39:01 UTC 2024","Sun Mar 10 04:42:17 UTC 2024","196005","","Freelancer search: [FNN-924] Freelancer search as CR user","","Freelancer search: [FNN-924] Freelancer search as CR user","""before all"" hook for [FNN-924] Freelancer search as CR user","""before all"" hook for [FNN-924] Freelancer search as CR user",""
"passed","Sun Mar 10 04:36:29 UTC 2024","Sun Mar 10 04:36:33 UTC 2024","3232","","My Profile: [FNN-719] Add resume Negative","","My Profile: [FNN-719] Add resume Negative","should add language without writing level","should add language without writing level",""
"passed","Sun Mar 10 04:16:14 UTC 2024","Sun Mar 10 04:17:31 UTC 2024","76348","","Settings: [FNN-674] Change password Positive","","Settings: [FNN-674] Change password Positive","should change password with valid credentials","should change password with valid credentials",""
"failed","Sun Mar 10 04:41:36 UTC 2024","Sun Mar 10 04:42:34 UTC 2024","58430","","My Transactions: [FNN-1430] Milestones project: In retrospect. Positive","","My Transactions: [FNN-1430] Milestones project: In retrospect. Positive","""before all"" hook for [FNN-1430] Milestones project: In retrospect. Positive","""before all"" hook for [FNN-1430] Milestones project: In retrospect. Positive",""
"passed","Sun Mar 10 04:35:42 UTC 2024","Sun Mar 10 04:35:56 UTC 2024","14332","","My Network: [FNN-1027] Invite freelancers","","My Network: [FNN-1027] Invite freelancers","should check network as sender user","should check network as sender user",""
"broken","Sun Mar 10 04:36:48 UTC 2024","Sun Mar 10 04:38:30 UTC 2024","102340","","My Projects: [FNN-1058] Complete project Negative","","My Projects: [FNN-1058] Complete project Negative","""before all"" hook for [FNN-1058] Complete project Negative","""before all"" hook for [FNN-1058] Complete project Negative",""
