"Status","Start Time","Stop Time","Duration in ms","Parent Suite","Suite","Sub Suite","Test Class","Test Method","Name","Description"
"failed","Fri Jan 05 04:27:28 UTC 2024","Fri Jan 05 04:32:48 UTC 2024","319621","","My Projects: [FNN-971] Complete project Positive","","My Projects: [FNN-971] Complete project Positive","should complete project","should complete project",""
"passed","Fri Jan 05 04:25:59 UTC 2024","Fri Jan 05 04:26:03 UTC 2024","3280","","My Network: [FNN-620] Invite manually via email and sms Negative","","My Network: [FNN-620] Invite manually via email and sms Negative","should invite manually via email without last name","should invite manually via email without last name",""
"passed","Fri Jan 05 04:08:04 UTC 2024","Fri Jan 05 04:08:27 UTC 2024","22277","","Login: [FNN-563] Log in from the header Negative","","Login: [FNN-563] Log in from the header Negative","should log in without credentials","should log in without credentials",""
"passed","Fri Jan 05 04:44:57 UTC 2024","Fri Jan 05 04:45:05 UTC 2024","7881","","CR: [FNN-744] CR Subscribe Negative","","CR: [FNN-744] CR Subscribe Negative","should subscribe as CR without phone number","should subscribe as CR without phone number",""
"passed","Fri Jan 05 04:44:30 UTC 2024","Fri Jan 05 04:44:36 UTC 2024","5663","","CR: [FNN-744] CR Subscribe Negative","","CR: [FNN-744] CR Subscribe Negative","should subscribe as CR without last name","should subscribe as CR without last name",""
"passed","Fri Jan 05 04:51:25 UTC 2024","Fri Jan 05 04:51:28 UTC 2024","3385","","My Profile: [FNN-719] Add resume Negative","","My Profile: [FNN-719] Add resume Negative","should add language without writing level","should add language without writing level",""
"skipped","Fri Jan 05 05:10:12 UTC 2024","Fri Jan 05 05:10:12 UTC 2024","1","","CR: [FNN-750] Invite to the organization through search","","CR: [FNN-750] Invite to the organization through search","should accept invitation","should accept invitation",""
"passed","Fri Jan 05 04:35:16 UTC 2024","Fri Jan 05 04:36:14 UTC 2024","58511","","[FNN-813] Change language","","[FNN-813] Change language","should change language to Dutch from the footer","should change language to Dutch from the footer",""
"passed","Fri Jan 05 04:07:53 UTC 2024","Fri Jan 05 04:07:56 UTC 2024","3320","","Login: [FNN-574] Log in from the Login page Negative","","Login: [FNN-574] Log in from the Login page Negative","should log in with invalid credentials","should log in with invalid credentials",""
"passed","Fri Jan 05 04:06:51 UTC 2024","Fri Jan 05 04:07:22 UTC 2024","31006","","Login: [FNN-647] Log in from the header Positive","","Login: [FNN-647] Log in from the header Positive","should log in with valid credentials","should log in with valid credentials",""
"passed","Fri Jan 05 04:11:59 UTC 2024","Fri Jan 05 04:12:16 UTC 2024","17400","","My Profile: [FNN-690] Add resume Positive","","My Profile: [FNN-690] Add resume Positive","should add Experience","should add Experience",""
"passed","Fri Jan 05 04:11:58 UTC 2024","Fri Jan 05 04:14:20 UTC 2024","142086","","Upgrade: [FNN-658] Upgrade account Positive","","Upgrade: [FNN-658] Upgrade account Positive","should upgrade account to Business 1 month","should upgrade account to Business 1 month",""
"passed","Fri Jan 05 04:09:24 UTC 2024","Fri Jan 05 04:10:14 UTC 2024","49531","","Upgrade: [FNN-659] Upgrade account Negative","","Upgrade: [FNN-659] Upgrade account Negative","should upgrade account to Standard 1 month without required fields","should upgrade account to Standard 1 month without required fields",""
"failed","Fri Jan 05 04:47:38 UTC 2024","Fri Jan 05 04:48:28 UTC 2024","50580","","My Profile: [FNN-668] Edit account details Negative","","My Profile: [FNN-668] Edit account details Negative","should edit account details with invalid VAT number","should edit account details with invalid VAT number",""
"passed","Fri Jan 05 04:31:49 UTC 2024","Fri Jan 05 04:31:53 UTC 2024","4095","","My Projects: [FNN-1058] Complete project Negative","","My Projects: [FNN-1058] Complete project Negative","should complete project without profile picture","should complete project without profile picture",""
"failed","Fri Jan 05 04:50:12 UTC 2024","Fri Jan 05 04:50:37 UTC 2024","24951","","My Profile: [FNN-719] Add resume Negative","","My Profile: [FNN-719] Add resume Negative","should add education without period from","should add education without period from",""
"passed","Fri Jan 05 04:15:45 UTC 2024","Fri Jan 05 04:16:11 UTC 2024","26226","","My Profile: [FNN-718] Add portfolio Negative","","My Profile: [FNN-718] Add portfolio Negative","should add portfolio without Type","should add portfolio without Type",""
"failed","Fri Jan 05 04:49:38 UTC 2024","Fri Jan 05 04:50:02 UTC 2024","24417","","My Profile: [FNN-719] Add resume Negative","","My Profile: [FNN-719] Add resume Negative","should add education without data","should add education without data",""
"passed","Fri Jan 05 04:48:08 UTC 2024","Fri Jan 05 04:49:56 UTC 2024","107992","","My Profile: [FNN-793] Remove resume","","My Profile: [FNN-793] Remove resume","should remove resume","should remove resume",""
"failed","Fri Jan 05 05:10:17 UTC 2024","Fri Jan 05 05:10:40 UTC 2024","23100","","My Transactions: [FNN-737] Hourly project: Start project. Negative","","My Transactions: [FNN-737] Hourly project: Start project. Negative","should start project with Hourly rate rate than 25","should start project with Hourly rate rate than 25",""
"passed","Fri Jan 05 04:52:22 UTC 2024","Fri Jan 05 04:52:41 UTC 2024","19036","","Post Project: [FNN-649] Post project with account Negative","","Post Project: [FNN-649] Post project with account Negative","should post project without Description","should post project without Description",""
"passed","Fri Jan 05 04:51:48 UTC 2024","Fri Jan 05 04:52:05 UTC 2024","17514","","Post Project: [FNN-649] Post project with account Negative","","Post Project: [FNN-649] Post project with account Negative","should post project without Start date","should post project without Start date",""
"passed","Fri Jan 05 04:36:18 UTC 2024","Fri Jan 05 04:36:30 UTC 2024","12569","","[FNN-661] Send interest","","[FNN-661] Send interest","should assign the freelancer user","should assign the freelancer user",""
"broken","Fri Jan 05 04:53:19 UTC 2024","Fri Jan 05 04:54:42 UTC 2024","83161","","Search Project: [FNN-568] Project search","","Search Project: [FNN-568] Project search","""before all"" hook for [FNN-568] Project search","""before all"" hook for [FNN-568] Project search",""
"passed","Fri Jan 05 04:46:21 UTC 2024","Fri Jan 05 04:46:45 UTC 2024","24010","","CR: [FNN-751] Invite to the organization manually Negative","","CR: [FNN-751] Invite to the organization manually Negative","should invite manually to the organization without role","should invite manually to the organization without role",""
"failed","Fri Jan 05 04:33:37 UTC 2024","Fri Jan 05 04:35:33 UTC 2024","115582","","[FNN-667] Send contact","","[FNN-667] Send contact","""before all"" hook for [FNN-667] Send contact","""before all"" hook for [FNN-667] Send contact",""
"passed","Fri Jan 05 04:13:58 UTC 2024","Fri Jan 05 04:15:21 UTC 2024","83204","","My Profile: [FNN-713] Confirm phone number Negative","","My Profile: [FNN-713] Confirm phone number Negative","should confirm phone number with invalid code","should confirm phone number with invalid code",""
"broken","Fri Jan 05 04:54:42 UTC 2024","Fri Jan 05 04:58:00 UTC 2024","198337","","Search Project: [FNN-568] Project search","","Search Project: [FNN-568] Project search","""after all"" hook for [FNN-568] Project search","""after all"" hook for [FNN-568] Project search",""
"passed","Fri Jan 05 04:32:19 UTC 2024","Fri Jan 05 04:32:26 UTC 2024","6792","","My Projects: [FNN-1058] Complete project Negative","","My Projects: [FNN-1058] Complete project Negative","should complete project without Comments","should complete project without Comments",""
"failed","Fri Jan 05 04:59:07 UTC 2024","Fri Jan 05 05:00:01 UTC 2024","53970","","Create Profile: [FNN-684] Create profile Negative","","Create Profile: [FNN-684] Create profile Negative","should create profile with short Description of yourself","should create profile with short Description of yourself",""
"skipped","Fri Jan 05 04:53:12 UTC 2024","Fri Jan 05 04:53:42 UTC 2024","29193","","My Network: [FNN-1232] Invite manually via email with custom message with signup bonus","","My Network: [FNN-1232] Invite manually via email with custom message with signup bonus","should check My Dashboard and My Transactions page for the signup bonus as the inviter user","should check My Dashboard and My Transactions page for the signup bonus as the inviter user",""
"passed","Fri Jan 05 04:50:02 UTC 2024","Fri Jan 05 04:50:20 UTC 2024","18401","","Post Project: [FNN-649] Post project with account Negative","","Post Project: [FNN-649] Post project with account Negative","should post project without step 1","should post project without step 1",""
"broken","Fri Jan 05 04:52:33 UTC 2024","Fri Jan 05 04:53:12 UTC 2024","39146","","My Network: [FNN-1232] Invite manually via email with custom message with signup bonus","","My Network: [FNN-1232] Invite manually via email with custom message with signup bonus","should subscribe as the freelancer with recipient details and accept the invitation","should subscribe as the freelancer with recipient details and accept the invitation",""
"passed","Fri Jan 05 04:49:26 UTC 2024","Fri Jan 05 04:49:36 UTC 2024","10368","","Settings: [FNN-673] Confirm email address","","Settings: [FNN-673] Confirm email address","should confirm email address","should confirm email address",""
"passed","Fri Jan 05 04:48:18 UTC 2024","Fri Jan 05 04:49:02 UTC 2024","44268","","My Profile: [FNN-719] Add resume Negative","","My Profile: [FNN-719] Add resume Negative","should add CV without CV","should add CV without CV",""
"passed","Fri Jan 05 04:51:04 UTC 2024","Fri Jan 05 04:51:17 UTC 2024","13422","","Post Project: [FNN-649] Post project with account Negative","","Post Project: [FNN-649] Post project with account Negative","should post project without Budget","should post project without Budget",""
"passed","Fri Jan 05 04:19:48 UTC 2024","Fri Jan 05 04:20:15 UTC 2024","26932","","Settings: [FNN-672] Change email address Negative","","Settings: [FNN-672] Change email address Negative","should change email address with wrong password","should change email address with wrong password",""
"passed","Fri Jan 05 05:01:28 UTC 2024","Fri Jan 05 05:01:39 UTC 2024","11413","","[FNN-667] Send contact","","[FNN-667] Send contact","should forward the contact request","should forward the contact request",""
"failed","Fri Jan 05 04:47:44 UTC 2024","Fri Jan 05 04:49:17 UTC 2024","92196","","Post Project: [FNN-587] Post project with account Positive","","Post Project: [FNN-587] Post project with account Positive","should post a project as a registered user with valid project data","should post a project as a registered user with valid project data",""
"passed","Fri Jan 05 04:45:32 UTC 2024","Fri Jan 05 04:45:40 UTC 2024","8720","","CR: [FNN-744] CR Subscribe Negative","","CR: [FNN-744] CR Subscribe Negative","should subscribe as CR without repeat password","should subscribe as CR without repeat password",""
"passed","Fri Jan 05 04:58:40 UTC 2024","Fri Jan 05 04:58:51 UTC 2024","10597","","Create Profile: [FNN-684] Create profile Negative","","Create Profile: [FNN-684] Create profile Negative","should create profile with wrong website","should create profile with wrong website",""
"passed","Fri Jan 05 04:10:32 UTC 2024","Fri Jan 05 04:10:55 UTC 2024","22944","","Upgrade: [FNN-659] Upgrade account Negative","","Upgrade: [FNN-659] Upgrade account Negative","should upgrade account to Standard 1 month: Insufficient funds decline","should upgrade account to Standard 1 month: Insufficient funds decline",""
"passed","Fri Jan 05 04:09:23 UTC 2024","Fri Jan 05 04:09:31 UTC 2024","7782","","Reset password: [FNN-655] Reset password Negative","","Reset password: [FNN-655] Reset password Negative","should reset password without data","should reset password without data",""
"passed","Fri Jan 05 04:12:41 UTC 2024","Fri Jan 05 04:12:50 UTC 2024","8902","","My Profile: [FNN-690] Add resume Positive","","My Profile: [FNN-690] Add resume Positive","should add Motivation","should add Motivation",""
"passed","Fri Jan 05 05:01:39 UTC 2024","Fri Jan 05 05:01:47 UTC 2024","8174","","[FNN-667] Send contact","","[FNN-667] Send contact","should check the contact as the first user","should check the contact as the first user",""
"passed","Fri Jan 05 04:58:56 UTC 2024","Fri Jan 05 04:59:07 UTC 2024","10281","","Create Profile: [FNN-684] Create profile Negative","","Create Profile: [FNN-684] Create profile Negative","should create profile without Description of yourself","should create profile without Description of yourself",""
"passed","Fri Jan 05 04:08:58 UTC 2024","Fri Jan 05 04:09:05 UTC 2024","7028","","Subscribe: [FNN-577] Subscribe Negative","","Subscribe: [FNN-577] Subscribe Negative","should subscribe with taken email","should subscribe with taken email",""
"passed","Fri Jan 05 04:20:11 UTC 2024","Fri Jan 05 04:21:12 UTC 2024","61162","","Settings: [FNN-677] Downgrade to ""Stand-by Standaard""","","Settings: [FNN-677] Downgrade to ""Stand-by Standaard""","should downgrade to ""Stand-by Standaard""","should downgrade to ""Stand-by Standaard""",""
"failed","Fri Jan 05 04:53:48 UTC 2024","Fri Jan 05 04:57:14 UTC 2024","206509","","My Network: [FNN-664] Invite freelancer","","My Network: [FNN-664] Invite freelancer","should invite freelancer","should invite freelancer",""
"passed","Fri Jan 05 04:09:19 UTC 2024","Fri Jan 05 04:10:43 UTC 2024","83706","","Upgrade: [FNN-658] Upgrade account Positive","","Upgrade: [FNN-658] Upgrade account Positive","should upgrade account to Standaard 1 month","should upgrade account to Standaard 1 month",""
"passed","Fri Jan 05 05:06:35 UTC 2024","Fri Jan 05 05:10:10 UTC 2024","215682","","My Transactions: [FNN-737] Hourly project: Start project. Negative","","My Transactions: [FNN-737] Hourly project: Start project. Negative","should start project without Hours per period and Hourly rate","should start project without Hours per period and Hourly rate",""
"passed","Fri Jan 05 04:46:18 UTC 2024","Fri Jan 05 04:46:20 UTC 2024","2407","","CR: [FNN-751] Invite to the organization manually Negative","","CR: [FNN-751] Invite to the organization manually Negative","should invite manually to the organization without last name","should invite manually to the organization without last name",""
"failed","Fri Jan 05 04:22:46 UTC 2024","Fri Jan 05 04:27:52 UTC 2024","306180","","My Network: [FNN-1027] Invite freelancers","","My Network: [FNN-1027] Invite freelancers","should invite multiple freelancers","should invite multiple freelancers",""
"passed","Fri Jan 05 04:10:43 UTC 2024","Fri Jan 05 04:11:58 UTC 2024","74783","","Upgrade: [FNN-658] Upgrade account Positive","","Upgrade: [FNN-658] Upgrade account Positive","should upgrade account to Premium 1 month","should upgrade account to Premium 1 month",""
"passed","Fri Jan 05 04:45:23 UTC 2024","Fri Jan 05 04:45:28 UTC 2024","4971","","My Transactions: [FNN-738] Milestones project: Add milestone. Negative","","My Transactions: [FNN-738] Milestones project: Add milestone. Negative","should add milestone without Delivery date","should add milestone without Delivery date",""
"failed","Fri Jan 05 05:10:40 UTC 2024","Fri Jan 05 05:11:03 UTC 2024","23478","","My Transactions: [FNN-737] Hourly project: Start project. Negative","","My Transactions: [FNN-737] Hourly project: Start project. Negative","should start project without Way of paying","should start project without Way of paying",""
"passed","Fri Jan 05 04:45:40 UTC 2024","Fri Jan 05 04:45:48 UTC 2024","7753","","CR: [FNN-744] CR Subscribe Negative","","CR: [FNN-744] CR Subscribe Negative","should subscribe as CR with short password","should subscribe as CR with short password",""
"passed","Fri Jan 05 04:10:55 UTC 2024","Fri Jan 05 04:11:14 UTC 2024","18497","","Upgrade: [FNN-659] Upgrade account Negative","","Upgrade: [FNN-659] Upgrade account Negative","should upgrade account to Standard 1 month: Lost card decline","should upgrade account to Standard 1 month: Lost card decline",""
"passed","Fri Jan 05 04:49:48 UTC 2024","Fri Jan 05 04:49:57 UTC 2024","9413","","Settings: [FNN-675] Change password Negative","","Settings: [FNN-675] Change password Negative","should change password with invalid old password","should change password with invalid old password",""
"passed","Fri Jan 05 04:58:58 UTC 2024","Fri Jan 05 04:59:40 UTC 2024","42191","","My Network: [FNN-1027] Invite freelancers","","My Network: [FNN-1027] Invite freelancers","should check network as sender user","should check network as sender user",""
"skipped","Fri Jan 05 04:57:14 UTC 2024","Fri Jan 05 04:57:46 UTC 2024","31532","","My Network: [FNN-664] Invite freelancer","","My Network: [FNN-664] Invite freelancer","should check network as sender user","should check network as sender user",""
"passed","Fri Jan 05 04:08:34 UTC 2024","Fri Jan 05 04:09:08 UTC 2024","34642","","Login: [FNN-685] Log out","","Login: [FNN-685] Log out","should log out","should log out",""
"passed","Fri Jan 05 04:49:37 UTC 2024","Fri Jan 05 04:49:43 UTC 2024","6093","","My Profile: [FNN-730] Request reference Negative","","My Profile: [FNN-730] Request reference Negative","should pass step 3 without 3 rating","should pass step 3 without 3 rating",""
"failed","Fri Jan 05 04:51:52 UTC 2024","Fri Jan 05 04:52:33 UTC 2024","40761","","My Network: [FNN-1232] Invite manually via email with custom message with signup bonus","","My Network: [FNN-1232] Invite manually via email with custom message with signup bonus","should invite manually via email with valid recipient data and with message","should invite manually via email with valid recipient data and with message",""
"passed","Fri Jan 05 04:08:01 UTC 2024","Fri Jan 05 04:08:04 UTC 2024","2992","","Login: [FNN-574] Log in from the Login page Negative","","Login: [FNN-574] Log in from the Login page Negative","should log in without password","should log in without password",""
"passed","Fri Jan 05 04:26:06 UTC 2024","Fri Jan 05 04:26:10 UTC 2024","4220","","My Network: [FNN-620] Invite manually via email and sms Negative","","My Network: [FNN-620] Invite manually via email and sms Negative","should invite manually via sms without phone number","should invite manually via sms without phone number",""
"passed","Fri Jan 05 04:58:31 UTC 2024","Fri Jan 05 04:58:40 UTC 2024","9293","","Create Profile: [FNN-684] Create profile Negative","","Create Profile: [FNN-684] Create profile Negative","should create profile without City","should create profile without City",""
"passed","Fri Jan 05 04:49:07 UTC 2024","Fri Jan 05 04:49:16 UTC 2024","9031","","My Profile: [FNN-719] Add resume Negative","","My Profile: [FNN-719] Add resume Negative","should add experience without position","should add experience without position",""
"passed","Fri Jan 05 05:03:05 UTC 2024","Fri Jan 05 05:03:25 UTC 2024","19853","","Freelancer search: [FNN-924] Freelancer search as CR user","","Freelancer search: [FNN-924] Freelancer search as CR user","should filter freelancers by Hourly Rate","should filter freelancers by Hourly Rate",""
"passed","Fri Jan 05 04:08:30 UTC 2024","Fri Jan 05 04:08:38 UTC 2024","8262","","Subscribe: [FNN-577] Subscribe Negative","","Subscribe: [FNN-577] Subscribe Negative","should subscribe without first name","should subscribe without first name",""
"passed","Fri Jan 05 04:28:49 UTC 2024","Fri Jan 05 04:29:14 UTC 2024","25237","","Freelancer search: [FNN-815] Freelancer search as non-CR user","","Freelancer search: [FNN-815] Freelancer search as non-CR user","should filter freelancers by Location","should filter freelancers by Location",""
"passed","Fri Jan 05 05:01:47 UTC 2024","Fri Jan 05 05:02:22 UTC 2024","35179","","[FNN-667] Send contact","","[FNN-667] Send contact","should check the contact as the second user","should check the contact as the second user",""
"skipped","Fri Jan 05 04:27:52 UTC 2024","Fri Jan 05 04:27:52 UTC 2024","7","","My Network: [FNN-1027] Invite freelancers","","My Network: [FNN-1027] Invite freelancers","should accept an invitation","should accept an invitation",""
"passed","Fri Jan 05 05:00:20 UTC 2024","Fri Jan 05 05:00:44 UTC 2024","24162","","[FNN-743] Archive and restore message","","[FNN-743] Archive and restore message","should restore the message","should restore the message",""
"passed","Fri Jan 05 04:11:14 UTC 2024","Fri Jan 05 04:11:32 UTC 2024","17708","","Upgrade: [FNN-659] Upgrade account Negative","","Upgrade: [FNN-659] Upgrade account Negative","should upgrade account to Standard 1 month: Stolen card decline","should upgrade account to Standard 1 month: Stolen card decline",""
"passed","Fri Jan 05 05:08:36 UTC 2024","Fri Jan 05 05:09:05 UTC 2024","29638","","CR: [FNN-749] Invite to the organization manually Positive","","CR: [FNN-749] Invite to the organization manually Positive","should check organization page as the inviting user","should check organization page as the inviting user",""
"passed","Fri Jan 05 04:11:55 UTC 2024","Fri Jan 05 04:13:25 UTC 2024","90356","","My Profile: [FNN-695] Add portfolio Positive","","My Profile: [FNN-695] Add portfolio Positive","should add portfolio","should add portfolio",""
"failed","Fri Jan 05 04:54:33 UTC 2024","Fri Jan 05 04:58:58 UTC 2024","265213","","My Network: [FNN-1027] Invite freelancers","","My Network: [FNN-1027] Invite freelancers","""before all"" hook for [FNN-1027] Invite freelancers","""before all"" hook for [FNN-1027] Invite freelancers",""
"passed","Fri Jan 05 04:50:08 UTC 2024","Fri Jan 05 04:50:12 UTC 2024","4035","","My Profile: [FNN-719] Add resume Negative","","My Profile: [FNN-719] Add resume Negative","should add education without education","should add education without education",""
"broken","Fri Jan 05 04:57:21 UTC 2024","Fri Jan 05 04:59:21 UTC 2024","119871","","Freelancer search: [FNN-846] Invite to project","","Freelancer search: [FNN-846] Invite to project","""before all"" hook for [FNN-846] Invite to project","""before all"" hook for [FNN-846] Invite to project",""
"passed","Fri Jan 05 04:20:00 UTC 2024","Fri Jan 05 04:21:38 UTC 2024","98249","","Settings: [FNN-676] Change profile settings","","Settings: [FNN-676] Change profile settings","it's not possible to contact me through the contact button on my profile","it's not possible to contact me through the contact button on my profile",""
"passed","Fri Jan 05 04:51:11 UTC 2024","Fri Jan 05 04:51:15 UTC 2024","3396","","My Profile: [FNN-719] Add resume Negative","","My Profile: [FNN-719] Add resume Negative","should add certificate without organization","should add certificate without organization",""
"passed","Fri Jan 05 04:30:43 UTC 2024","Fri Jan 05 04:31:20 UTC 2024","36927","","Freelancer search: [FNN-817] Add note","","Freelancer search: [FNN-817] Add note","should add note from the notes popup","should add note from the notes popup",""
"passed","Fri Jan 05 04:52:03 UTC 2024","Fri Jan 05 04:52:18 UTC 2024","14656","","Post Project: [FNN-588] Post project without account Negative","","Post Project: [FNN-588] Post project without account Negative","should post project without email","should post project without email",""
"passed","Fri Jan 05 04:41:28 UTC 2024","Fri Jan 05 04:45:14 UTC 2024","226857","","My Transactions: [FNN-738] Milestones project: Add milestone. Negative","","My Transactions: [FNN-738] Milestones project: Add milestone. Negative","should add milestone without Amount, Delivery date, and Description","should add milestone without Amount, Delivery date, and Description",""
"passed","Fri Jan 05 04:51:17 UTC 2024","Fri Jan 05 04:51:33 UTC 2024","16128","","Post Project: [FNN-649] Post project with account Negative","","Post Project: [FNN-649] Post project with account Negative","should post project without Work on location","should post project without Work on location",""
"broken","Fri Jan 05 04:59:29 UTC 2024","Fri Jan 05 05:00:20 UTC 2024","50779","","[FNN-743] Archive and restore message","","[FNN-743] Archive and restore message","""before all"" hook for [FNN-743] Archive and restore message","""before all"" hook for [FNN-743] Archive and restore message",""
"failed","Fri Jan 05 05:00:09 UTC 2024","Fri Jan 05 05:04:44 UTC 2024","274462","","My Transactions: [FNN-1431] Hourly project: In retrospect. Positive","","My Transactions: [FNN-1431] Hourly project: In retrospect. Positive","should start hourly project","should start hourly project",""
"passed","Fri Jan 05 04:12:16 UTC 2024","Fri Jan 05 04:12:28 UTC 2024","12316","","My Profile: [FNN-690] Add resume Positive","","My Profile: [FNN-690] Add resume Positive","should add Education","should add Education",""
"passed","Fri Jan 05 04:33:35 UTC 2024","Fri Jan 05 04:36:18 UTC 2024","163138","","[FNN-661] Send interest","","[FNN-661] Send interest","should send interest in the employer's project","should send interest in the employer's project",""
"passed","Fri Jan 05 04:32:12 UTC 2024","Fri Jan 05 04:32:19 UTC 2024","6587","","My Projects: [FNN-1058] Complete project Negative","","My Projects: [FNN-1058] Complete project Negative","should complete project without Professionalism","should complete project without Professionalism",""
"passed","Fri Jan 05 04:30:20 UTC 2024","Fri Jan 05 04:31:35 UTC 2024","75159","","Freelancer search: [FNN-822] Send message","","Freelancer search: [FNN-822] Send message","should send a message via the ""Send message"" action","should send a message via the ""Send message"" action",""
