"Status","Start Time","Stop Time","Duration in ms","Parent Suite","Suite","Sub Suite","Test Class","Test Method","Name","Description"
"passed","Fri Nov 24 08:40:07 UTC 2023","Fri Nov 24 08:40:20 UTC 2023","13357","","Post Project: [FNN-588] Post project without account Negative","","Post Project: [FNN-588] Post project without account Negative","should post project with wrong email","should post project with wrong email",""
"broken","Fri Nov 24 07:59:20 UTC 2023","Fri Nov 24 07:59:49 UTC 2023","29097","","Login: [FNN-574] Log in from the Login page Negative","","Login: [FNN-574] Log in from the Login page Negative","""before all"" hook for [FNN-574] Log in from the Login page Negative","""before all"" hook for [FNN-574] Log in from the Login page Negative",""
"failed","Fri Nov 24 08:39:47 UTC 2023","Fri Nov 24 08:40:10 UTC 2023","22413","","Settings: [FNN-676] Change profile settings","","Settings: [FNN-676] Change profile settings","""after all"" hook for [FNN-676] Change profile settings","""after all"" hook for [FNN-676] Change profile settings",""
"passed","Fri Nov 24 08:27:20 UTC 2023","Fri Nov 24 08:27:24 UTC 2023","3738","","My Transactions: [FNN-1431] Hourly project: In retrospect. Positive","","My Transactions: [FNN-1431] Hourly project: In retrospect. Positive","should close the period","should close the period",""
"passed","Fri Nov 24 08:35:12 UTC 2023","Fri Nov 24 08:35:20 UTC 2023","8012","","Subscribe: [FNN-577] Subscribe Negative","","Subscribe: [FNN-577] Subscribe Negative","should subscribe without last name","should subscribe without last name",""
"broken","Fri Nov 24 08:35:54 UTC 2023","Fri Nov 24 08:37:10 UTC 2023","76273","","My Profile: [FNN-730] Request reference Negative","","My Profile: [FNN-730] Request reference Negative","""before all"" hook for [FNN-730] Request reference Negative","""before all"" hook for [FNN-730] Request reference Negative",""
"failed","Fri Nov 24 08:46:08 UTC 2023","Fri Nov 24 08:48:05 UTC 2023","116625","","[FNN-743] Archive and restore message","","[FNN-743] Archive and restore message","should archive the message","should archive the message",""
"passed","Fri Nov 24 07:59:44 UTC 2023","Fri Nov 24 07:59:46 UTC 2023","1715","","Login: [FNN-563] Log in from the header Negative","","Login: [FNN-563] Log in from the header Negative","should log in without email","should log in without email",""
"passed","Fri Nov 24 08:30:23 UTC 2023","Fri Nov 24 08:30:29 UTC 2023","5986","","CR: [FNN-744] CR Subscribe Negative","","CR: [FNN-744] CR Subscribe Negative","should subscribe as CR without company name","should subscribe as CR without company name",""
"passed","Fri Nov 24 08:33:02 UTC 2023","Fri Nov 24 08:33:16 UTC 2023","14169","","My Transactions: [FNN-710] Milestones project: In advance. Positive","","My Transactions: [FNN-710] Milestones project: In advance. Positive","should verify that the money paid","should verify that the money paid",""
"failed","Fri Nov 24 08:45:38 UTC 2023","Fri Nov 24 08:46:00 UTC 2023","22219","","Freelancer search: [FNN-924] Freelancer search as CR user","","Freelancer search: [FNN-924] Freelancer search as CR user","""after all"" hook for [FNN-924] Freelancer search as CR user","""after all"" hook for [FNN-924] Freelancer search as CR user",""
"passed","Fri Nov 24 08:01:03 UTC 2023","Fri Nov 24 08:01:06 UTC 2023","2206","","Reset password: [FNN-655] Reset password Negative","","Reset password: [FNN-655] Reset password Negative","should reset password with wrong email","should reset password with wrong email",""
"passed","Fri Nov 24 08:30:50 UTC 2023","Fri Nov 24 08:30:56 UTC 2023","6346","","CR: [FNN-744] CR Subscribe Negative","","CR: [FNN-744] CR Subscribe Negative","should subscribe as CR with wrong email format","should subscribe as CR with wrong email format",""
"passed","Fri Nov 24 08:29:48 UTC 2023","Fri Nov 24 08:31:08 UTC 2023","79950","","My Transactions: [FNN-708] Hourly project: In advance. Positive","","My Transactions: [FNN-708] Hourly project: In advance. Positive","should approve the time and pay for extra money","should approve the time and pay for extra money",""
"broken","Fri Nov 24 08:36:28 UTC 2023","Fri Nov 24 08:37:43 UTC 2023","74964","","Post Project: [FNN-587] Post project with account Positive","","Post Project: [FNN-587] Post project with account Positive","should post a project as a registered user with valid project data","should post a project as a registered user with valid project data",""
"passed","Fri Nov 24 08:10:46 UTC 2023","Fri Nov 24 08:11:06 UTC 2023","19815","","Post Project: [FNN-649] Post project with account Negative","","Post Project: [FNN-649] Post project with account Negative","should post project without Start date","should post project without Start date",""
"passed","Fri Nov 24 08:37:10 UTC 2023","Fri Nov 24 08:37:28 UTC 2023","18381","","My Profile: [FNN-730] Request reference Negative","","My Profile: [FNN-730] Request reference Negative","should pass step 3 with comments less then 200 chars","should pass step 3 with comments less then 200 chars",""
"passed","Fri Nov 24 08:48:05 UTC 2023","Fri Nov 24 08:48:30 UTC 2023","24828","","[FNN-743] Archive and restore message","","[FNN-743] Archive and restore message","should restore the message","should restore the message",""
"passed","Fri Nov 24 08:31:41 UTC 2023","Fri Nov 24 08:31:50 UTC 2023","9006","","CR: [FNN-744] CR Subscribe Negative","","CR: [FNN-744] CR Subscribe Negative","should subscribe as CR with short password","should subscribe as CR with short password",""
"passed","Fri Nov 24 08:40:11 UTC 2023","Fri Nov 24 08:40:15 UTC 2023","4136","","My Profile: [FNN-719] Add resume Negative","","My Profile: [FNN-719] Add resume Negative","should add certificate without data","should add certificate without data",""
"passed","Fri Nov 24 07:58:41 UTC 2023","Fri Nov 24 07:59:10 UTC 2023","29475","","Login: [FNN-647] Log in from the header Positive","","Login: [FNN-647] Log in from the header Positive","should log in with valid credentials","should log in with valid credentials",""
"passed","Fri Nov 24 08:51:55 UTC 2023","Fri Nov 24 08:51:59 UTC 2023","3897","","My Transactions: [FNN-738] Milestones project: Add milestone. Negative","","My Transactions: [FNN-738] Milestones project: Add milestone. Negative","should add milestone without Delivery date","should add milestone without Delivery date",""
"passed","Fri Nov 24 08:33:41 UTC 2023","Fri Nov 24 08:33:44 UTC 2023","3201","","Login: [FNN-574] Log in from the Login page Negative","","Login: [FNN-574] Log in from the Login page Negative","should log in with invalid credentials","should log in with invalid credentials",""
"passed","Fri Nov 24 08:24:49 UTC 2023","Fri Nov 24 08:28:30 UTC 2023","220667","","My Transactions: [FNN-1439] Hourly project: Add time. Negative","","My Transactions: [FNN-1439] Hourly project: Add time. Negative","should add hours without Date and Hours","should add hours without Date and Hours",""
"passed","Fri Nov 24 08:32:23 UTC 2023","Fri Nov 24 08:32:29 UTC 2023","5618","","My Transactions: [FNN-737] Hourly project: Start project. Negative","","My Transactions: [FNN-737] Hourly project: Start project. Negative","should start project with Hourly rate rate than 25","should start project with Hourly rate rate than 25",""
"passed","Fri Nov 24 07:58:41 UTC 2023","Fri Nov 24 07:59:09 UTC 2023","28079","","Subscribe: [FNN-578] Subscribe Positive","","Subscribe: [FNN-578] Subscribe Positive","should subscribe with valid credentials","should subscribe with valid credentials",""
"passed","Fri Nov 24 07:59:48 UTC 2023","Fri Nov 24 08:00:09 UTC 2023","20947","","Login: [FNN-563] Log in from the header Negative","","Login: [FNN-563] Log in from the header Negative","should log in without credentials","should log in without credentials",""
"broken","Fri Nov 24 08:34:35 UTC 2023","Fri Nov 24 08:35:24 UTC 2023","49387","","My Profile: [FNN-699] Request reference Positive","","My Profile: [FNN-699] Request reference Positive","""before all"" hook for [FNN-699] Request reference Positive","""before all"" hook for [FNN-699] Request reference Positive",""
"passed","Fri Nov 24 08:08:18 UTC 2023","Fri Nov 24 08:08:36 UTC 2023","17620","","Post Project: [FNN-649] Post project with account Negative","","Post Project: [FNN-649] Post project with account Negative","should post project without step 1","should post project without step 1",""
"failed","Fri Nov 24 08:00:14 UTC 2023","Fri Nov 24 08:00:53 UTC 2023","39056","","Login: [FNN-685] Log out","","Login: [FNN-685] Log out","""after all"" hook for [FNN-685] Log out","""after all"" hook for [FNN-685] Log out",""
"passed","Fri Nov 24 08:37:24 UTC 2023","Fri Nov 24 08:37:47 UTC 2023","22838","","Settings: [FNN-672] Change email address Negative","","Settings: [FNN-672] Change email address Negative","should change email address without password","should change email address without password",""
"passed","Fri Nov 24 08:13:20 UTC 2023","Fri Nov 24 08:14:25 UTC 2023","65140","","Settings: [FNN-808] Cancel downgrade","","Settings: [FNN-808] Cancel downgrade","should cancel downgrade","should cancel downgrade",""
"passed","Fri Nov 24 08:40:41 UTC 2023","Fri Nov 24 08:40:45 UTC 2023","4154","","My Profile: [FNN-719] Add resume Negative","","My Profile: [FNN-719] Add resume Negative","should add language without writing level","should add language without writing level",""
"passed","Fri Nov 24 08:04:39 UTC 2023","Fri Nov 24 08:04:50 UTC 2023","10494","","My Profile: [FNN-690] Add resume Positive","","My Profile: [FNN-690] Add resume Positive","should add Language","should add Language",""
"passed","Fri Nov 24 08:00:53 UTC 2023","Fri Nov 24 08:01:28 UTC 2023","34442","","Upgrade: [FNN-659] Upgrade account Negative","","Upgrade: [FNN-659] Upgrade account Negative","should upgrade account to Standard 1 month without required fields","should upgrade account to Standard 1 month without required fields",""
"passed","Fri Nov 24 08:35:48 UTC 2023","Fri Nov 24 08:35:57 UTC 2023","8782","","Subscribe: [FNN-577] Subscribe Negative","","Subscribe: [FNN-577] Subscribe Negative","should subscribe without phone number","should subscribe without phone number",""
"passed","Fri Nov 24 08:37:47 UTC 2023","Fri Nov 24 08:37:56 UTC 2023","9027","","Settings: [FNN-672] Change email address Negative","","Settings: [FNN-672] Change email address Negative","should change email address with invalid email format","should change email address with invalid email format",""
"passed","Fri Nov 24 08:09:41 UTC 2023","Fri Nov 24 08:09:56 UTC 2023","14542","","Post Project: [FNN-649] Post project with account Negative","","Post Project: [FNN-649] Post project with account Negative","should post project without Budget","should post project without Budget",""
"passed","Fri Nov 24 08:38:21 UTC 2023","Fri Nov 24 08:38:31 UTC 2023","10121","","Post Project: [FNN-649] Post project with account Negative","","Post Project: [FNN-649] Post project with account Negative","should post project with short Description","should post project with short Description",""
"failed","Fri Nov 24 08:38:45 UTC 2023","Fri Nov 24 08:39:11 UTC 2023","25979","","My Profile: [FNN-719] Add resume Negative","","My Profile: [FNN-719] Add resume Negative","should add education without data","should add education without data",""
"passed","Fri Nov 24 08:11:24 UTC 2023","Fri Nov 24 08:11:42 UTC 2023","18570","","Post Project: [FNN-649] Post project with account Negative","","Post Project: [FNN-649] Post project with account Negative","should post project without Description","should post project without Description",""
"broken","Fri Nov 24 08:38:22 UTC 2023","Fri Nov 24 08:40:27 UTC 2023","125569","","Settings: [FNN-678] Delete account without subscription","","Settings: [FNN-678] Delete account without subscription","should delete account without subscription","should delete account without subscription",""
"passed","Fri Nov 24 08:41:57 UTC 2023","Fri Nov 24 08:42:14 UTC 2023","16874","","Post Project: [FNN-588] Post project without account Negative","","Post Project: [FNN-588] Post project without account Negative","should post project with wrong phone number","should post project with wrong phone number",""
"passed","Fri Nov 24 08:45:04 UTC 2023","Fri Nov 24 08:45:11 UTC 2023","7260","","Create Profile: [FNN-684] Create profile Negative","","Create Profile: [FNN-684] Create profile Negative","should create profile without Description of yourself","should create profile without Description of yourself",""
"passed","Fri Nov 24 08:24:54 UTC 2023","Fri Nov 24 08:28:20 UTC 2023","206007","","My Transactions: [FNN-708] Hourly project: In advance. Positive","","My Transactions: [FNN-708] Hourly project: In advance. Positive","should start hourly project","should start hourly project",""
"passed","Fri Nov 24 08:14:56 UTC 2023","Fri Nov 24 08:15:00 UTC 2023","3965","","My Network: [FNN-620] Invite manually via email and sms Negative","","My Network: [FNN-620] Invite manually via email and sms Negative","should invite manually via email without first name","should invite manually via email without first name",""
"passed","Fri Nov 24 08:22:39 UTC 2023","Fri Nov 24 08:23:33 UTC 2023","54122","","[FNN-813] Change language","","[FNN-813] Change language","should change language to Dutch from the footer","should change language to Dutch from the footer",""
"passed","Fri Nov 24 08:44:19 UTC 2023","Fri Nov 24 08:44:39 UTC 2023","20087","","Create Profile: [FNN-684] Create profile Negative","","Create Profile: [FNN-684] Create profile Negative","should create profile without required fields","should create profile without required fields",""
"passed","Fri Nov 24 08:35:20 UTC 2023","Fri Nov 24 08:35:29 UTC 2023","8116","","Subscribe: [FNN-577] Subscribe Negative","","Subscribe: [FNN-577] Subscribe Negative","should subscribe without email","should subscribe without email",""
"passed","Fri Nov 24 08:38:42 UTC 2023","Fri Nov 24 08:39:34 UTC 2023","52235","","Post Project: [FNN-588] Post project without account Negative","","Post Project: [FNN-588] Post project without account Negative","should post project without account details","should post project without account details",""
"passed","Fri Nov 24 08:39:16 UTC 2023","Fri Nov 24 08:39:20 UTC 2023","4695","","My Profile: [FNN-719] Add resume Negative","","My Profile: [FNN-719] Add resume Negative","should add education without education","should add education without education",""
"passed","Fri Nov 24 08:39:11 UTC 2023","Fri Nov 24 08:39:16 UTC 2023","4933","","My Profile: [FNN-719] Add resume Negative","","My Profile: [FNN-719] Add resume Negative","should add education without institute","should add education without institute",""
"passed","Fri Nov 24 08:47:00 UTC 2023","Fri Nov 24 08:48:17 UTC 2023","77521","","[FNN-661] Send interest","","[FNN-661] Send interest","should check if the freelancer user on the project","should check if the freelancer user on the project",""
"failed","Fri Nov 24 08:48:34 UTC 2023","Fri Nov 24 08:51:30 UTC 2023","176084","","My Transactions: [FNN-738] Milestones project: Add milestone. Negative","","My Transactions: [FNN-738] Milestones project: Add milestone. Negative","should add milestone without Amount, Delivery date, and Description","should add milestone without Amount, Delivery date, and Description",""
"passed","Fri Nov 24 08:05:51 UTC 2023","Fri Nov 24 08:07:10 UTC 2023","78833","","My Profile: [FNN-669] Edit account details Positive","","My Profile: [FNN-669] Edit account details Positive","should edit cr account details with valid information","should edit cr account details with valid information",""
"passed","Fri Nov 24 08:29:14 UTC 2023","Fri Nov 24 08:29:33 UTC 2023","18558","","My Transactions: [FNN-708] Hourly project: In advance. Positive","","My Transactions: [FNN-708] Hourly project: In advance. Positive","should add hours","should add hours",""
"passed","Fri Nov 24 08:20:53 UTC 2023","Fri Nov 24 08:21:06 UTC 2023","12629","","Freelancer search: [FNN-846] Invite to project","","Freelancer search: [FNN-846] Invite to project","should check the invitation and send an interest of the project","should check the invitation and send an interest of the project",""
"passed","Fri Nov 24 08:12:27 UTC 2023","Fri Nov 24 08:13:31 UTC 2023","63199","","Settings: [FNN-680] Deactivate profile","","Settings: [FNN-680] Deactivate profile","should deactivate profile","should deactivate profile",""
"passed","Fri Nov 24 08:28:56 UTC 2023","Fri Nov 24 08:29:28 UTC 2023","31929","","CR: [FNN-742] CR subscribe Positive","","CR: [FNN-742] CR subscribe Positive","should subscribe as CR with valid credentials","should subscribe as CR with valid credentials",""
"skipped","Fri Nov 24 08:51:38 UTC 2023","Fri Nov 24 08:52:00 UTC 2023","21654","","CR: [FNN-750] Invite to the organization through search","","CR: [FNN-750] Invite to the organization through search","should check organization page as the inviting user","should check organization page as the inviting user",""
"passed","Fri Nov 24 08:13:19 UTC 2023","Fri Nov 24 08:15:14 UTC 2023","115773","","Search Project: [FNN-568] Project search","","Search Project: [FNN-568] Project search","should filter projects by Category","should filter projects by Category",""
"passed","Fri Nov 24 07:59:39 UTC 2023","Fri Nov 24 07:59:42 UTC 2023","2605","","Login: [FNN-563] Log in from the header Negative","","Login: [FNN-563] Log in from the header Negative","should log in with invalid credentials","should log in with invalid credentials",""
"passed","Fri Nov 24 08:04:31 UTC 2023","Fri Nov 24 08:04:39 UTC 2023","8188","","My Profile: [FNN-690] Add resume Positive","","My Profile: [FNN-690] Add resume Positive","should add Expertise","should add Expertise",""
"failed","Fri Nov 24 08:37:48 UTC 2023","Fri Nov 24 08:38:21 UTC 2023","33433","","Post Project: [FNN-649] Post project with account Negative","","Post Project: [FNN-649] Post project with account Negative","""before all"" hook for [FNN-649] Post project with account Negative","""before all"" hook for [FNN-649] Post project with account Negative",""
"passed","Fri Nov 24 08:44:39 UTC 2023","Fri Nov 24 08:44:47 UTC 2023","8578","","Create Profile: [FNN-684] Create profile Negative","","Create Profile: [FNN-684] Create profile Negative","should create profile without City","should create profile without City",""
"passed","Fri Nov 24 08:34:34 UTC 2023","Fri Nov 24 08:35:17 UTC 2023","42885","","My Profile: [FNN-668] Edit account details Negative","","My Profile: [FNN-668] Edit account details Negative","should edit account details without required fields","should edit account details without required fields",""
"broken","Fri Nov 24 08:10:19 UTC 2023","Fri Nov 24 08:10:19 UTC 2023","391","","Settings: [FNN-672] Change email address Negative","","Settings: [FNN-672] Change email address Negative","""after all"" hook for [FNN-672] Change email address Negative","""after all"" hook for [FNN-672] Change email address Negative",""
"failed","Fri Nov 24 08:34:13 UTC 2023","Fri Nov 24 08:35:54 UTC 2023","100609","","CR: [FNN-1779] My Dashboard page integrity as Employer","","CR: [FNN-1779] My Dashboard page integrity as Employer","should verify the integrity of the My Dashboard page as employer","should verify the integrity of the My Dashboard page as employer",""
"passed","Fri Nov 24 08:43:40 UTC 2023","Fri Nov 24 08:44:18 UTC 2023","38472","","Freelancer search: [FNN-822] Send message","","Freelancer search: [FNN-822] Send message","should check the message as the freelancer user","should check the message as the freelancer user",""
"passed","Fri Nov 24 08:27:31 UTC 2023","Fri Nov 24 08:28:33 UTC 2023","62284","","My Transactions: [FNN-1431] Hourly project: In retrospect. Positive","","My Transactions: [FNN-1431] Hourly project: In retrospect. Positive","should approve the time and pay deposits","should approve the time and pay deposits",""
"passed","Fri Nov 24 08:40:28 UTC 2023","Fri Nov 24 08:40:33 UTC 2023","5387","","My Profile: [FNN-719] Add resume Negative","","My Profile: [FNN-719] Add resume Negative","should add certificate without achieved annual","should add certificate without achieved annual",""
"failed","Fri Nov 24 08:51:30 UTC 2023","Fri Nov 24 08:51:55 UTC 2023","25046","","My Transactions: [FNN-738] Milestones project: Add milestone. Negative","","My Transactions: [FNN-738] Milestones project: Add milestone. Negative","should add milestone without Amount","should add milestone without Amount",""
"passed","Fri Nov 24 08:26:55 UTC 2023","Fri Nov 24 08:27:20 UTC 2023","24622","","My Transactions: [FNN-1431] Hourly project: In retrospect. Positive","","My Transactions: [FNN-1431] Hourly project: In retrospect. Positive","should accept the project and add hours","should accept the project and add hours",""
"passed","Fri Nov 24 08:15:08 UTC 2023","Fri Nov 24 08:15:12 UTC 2023","4205","","My Network: [FNN-620] Invite manually via email and sms Negative","","My Network: [FNN-620] Invite manually via email and sms Negative","should invite manually via sms without phone number","should invite manually via sms without phone number",""
"passed","Fri Nov 24 08:28:20 UTC 2023","Fri Nov 24 08:28:35 UTC 2023","15279","","My Transactions: [FNN-708] Hourly project: In advance. Positive","","My Transactions: [FNN-708] Hourly project: In advance. Positive","should accept the project","should accept the project",""
"passed","Fri Nov 24 08:43:14 UTC 2023","Fri Nov 24 08:43:24 UTC 2023","10165","","Freelancer search: [FNN-817] Add note","","Freelancer search: [FNN-817] Add note","should add a note via the action ""Add note""","should add a note via the action ""Add note""",""
"broken","Fri Nov 24 08:41:17 UTC 2023","Fri Nov 24 08:56:17 UTC 2023","900022","","My Projects: [FNN-1058] Complete project Negative","","My Projects: [FNN-1058] Complete project Negative","""before all"" hook for [FNN-1058] Complete project Negative","""before all"" hook for [FNN-1058] Complete project Negative",""
"passed","Fri Nov 24 08:03:36 UTC 2023","Fri Nov 24 08:03:50 UTC 2023","14598","","My Profile: [FNN-690] Add resume Positive","","My Profile: [FNN-690] Add resume Positive","should add Experience","should add Experience",""
"passed","Fri Nov 24 08:31:04 UTC 2023","Fri Nov 24 08:31:10 UTC 2023","6390","","CR: [FNN-744] CR Subscribe Negative","","CR: [FNN-744] CR Subscribe Negative","should subscribe as CR without phone number","should subscribe as CR without phone number",""
"failed","Fri Nov 24 08:33:40 UTC 2023","Fri Nov 24 08:35:05 UTC 2023","84276","","CR: [FNN-1888] My Dashboard page integrity as Employer","","CR: [FNN-1888] My Dashboard page integrity as Employer","should verify the integrity of the My Dashboard page as freelancer","should verify the integrity of the My Dashboard page as freelancer",""
"passed","Fri Nov 24 08:23:40 UTC 2023","Fri Nov 24 08:23:49 UTC 2023","8441","","[FNN-667] Send contact","","[FNN-667] Send contact","should check the contact as the first user","should check the contact as the first user",""
"passed","Fri Nov 24 08:00:58 UTC 2023","Fri Nov 24 08:01:03 UTC 2023","5798","","Reset password: [FNN-655] Reset password Negative","","Reset password: [FNN-655] Reset password Negative","should reset password without data","should reset password without data",""
"passed","Fri Nov 24 08:35:38 UTC 2023","Fri Nov 24 08:35:48 UTC 2023","10257","","Subscribe: [FNN-577] Subscribe Negative","","Subscribe: [FNN-577] Subscribe Negative","should subscribe with taken email","should subscribe with taken email",""
"passed","Fri Nov 24 08:10:47 UTC 2023","Fri Nov 24 08:10:58 UTC 2023","11446","","Settings: [FNN-675] Change password Negative","","Settings: [FNN-675] Change password Negative","should change password with short new password","should change password with short new password",""
"passed","Fri Nov 24 08:40:38 UTC 2023","Fri Nov 24 08:40:41 UTC 2023","3625","","My Profile: [FNN-719] Add resume Negative","","My Profile: [FNN-719] Add resume Negative","should add language without speaking level","should add language without speaking level",""
"broken","Fri Nov 24 08:38:24 UTC 2023","Fri Nov 24 08:40:09 UTC 2023","105111","","Settings: [FNN-679] Delete account with subscription","","Settings: [FNN-679] Delete account with subscription","should delete account with subscription","should delete account with subscription",""
"passed","Fri Nov 24 08:04:42 UTC 2023","Fri Nov 24 08:06:00 UTC 2023","78091","","My Profile: [FNN-713] Confirm phone number Negative","","My Profile: [FNN-713] Confirm phone number Negative","should confirm phone number with invalid code","should confirm phone number with invalid code",""
"passed","Fri Nov 24 08:39:56 UTC 2023","Fri Nov 24 08:40:07 UTC 2023","10765","","Post Project: [FNN-588] Post project without account Negative","","Post Project: [FNN-588] Post project without account Negative","should post project without email","should post project without email",""
"passed","Fri Nov 24 08:56:17 UTC 2023","Fri Nov 24 08:56:39 UTC 2023","22151","","My Projects: [FNN-1058] Complete project Negative","","My Projects: [FNN-1058] Complete project Negative","should complete project with short Comments","should complete project with short Comments",""
"failed","Fri Nov 24 08:40:20 UTC 2023","Fri Nov 24 08:41:01 UTC 2023","41083","","Post Project: [FNN-588] Post project without account Negative","","Post Project: [FNN-588] Post project without account Negative","should post project with taken email","should post project with taken email",""
"passed","Fri Nov 24 08:42:52 UTC 2023","Fri Nov 24 08:43:36 UTC 2023","44798","","Create Profile: [FNN-683] Create profile Positive","","Create Profile: [FNN-683] Create profile Positive","should create profile with valid data","should create profile with valid data",""
