"Status","Start Time","Stop Time","Duration in ms","Parent Suite","Suite","Sub Suite","Test Class","Test Method","Name","Description"
"passed","Fri Nov 24 08:32:22 UTC 2023","Fri Nov 24 08:32:31 UTC 2023","9073","","My Transactions: [FNN-710] Milestones project: In advance. Positive","","My Transactions: [FNN-710] Milestones project: In advance. Positive","should request payout","should request payout",""
"passed","Fri Nov 24 08:10:50 UTC 2023","Fri Nov 24 08:11:56 UTC 2023","65623","","Settings: [FNN-677] Downgrade to ""Stand-by Standaard""","","Settings: [FNN-677] Downgrade to ""Stand-by Standaard""","should downgrade to ""Stand-by Standaard""","should downgrade to ""Stand-by Standaard""",""
"passed","Fri Nov 24 08:29:36 UTC 2023","Fri Nov 24 08:30:23 UTC 2023","46571","","CR: [FNN-744] CR Subscribe Negative","","CR: [FNN-744] CR Subscribe Negative","should subscribe as CR without sector","should subscribe as CR without sector",""
"failed","Fri Nov 24 08:18:31 UTC 2023","Fri Nov 24 08:19:39 UTC 2023","67741","","Freelancer search: [FNN-822] Send message","","Freelancer search: [FNN-822] Send message","""before all"" hook for [FNN-822] Send message","""before all"" hook for [FNN-822] Send message",""
"passed","Fri Nov 24 08:38:08 UTC 2023","Fri Nov 24 08:38:17 UTC 2023","8459","","My Profile: [FNN-719] Add resume Negative","","My Profile: [FNN-719] Add resume Negative","should add experience without position","should add experience without position",""
"failed","Fri Nov 24 08:42:48 UTC 2023","Fri Nov 24 08:43:23 UTC 2023","34659","","Post Project: [FNN-588] Post project without account Negative","","Post Project: [FNN-588] Post project without account Negative","should post project with short password and repeat password","should post project with short password and repeat password",""
"passed","Fri Nov 24 08:35:24 UTC 2023","Fri Nov 24 08:35:46 UTC 2023","21457","","My Profile: [FNN-699] Request reference Positive","","My Profile: [FNN-699] Request reference Positive","should check the validated reference","should check the validated reference",""
"passed","Fri Nov 24 08:32:31 UTC 2023","Fri Nov 24 08:33:02 UTC 2023","31345","","My Transactions: [FNN-710] Milestones project: In advance. Positive","","My Transactions: [FNN-710] Milestones project: In advance. Positive","should approve milestone","should approve milestone",""
"broken","Fri Nov 24 08:41:12 UTC 2023","Fri Nov 24 08:42:28 UTC 2023","76427","","My Network: [FNN-664] Invite freelancer","","My Network: [FNN-664] Invite freelancer","""before all"" hook for [FNN-664] Invite freelancer","""before all"" hook for [FNN-664] Invite freelancer",""
"passed","Fri Nov 24 08:32:29 UTC 2023","Fri Nov 24 08:32:34 UTC 2023","4738","","My Transactions: [FNN-737] Hourly project: Start project. Negative","","My Transactions: [FNN-737] Hourly project: Start project. Negative","should start project without Way of paying","should start project without Way of paying",""
"passed","Fri Nov 24 07:59:46 UTC 2023","Fri Nov 24 07:59:48 UTC 2023","2023","","Login: [FNN-563] Log in from the header Negative","","Login: [FNN-563] Log in from the header Negative","should log in without password","should log in without password",""
"passed","Fri Nov 24 08:22:40 UTC 2023","Fri Nov 24 08:23:09 UTC 2023","29443","","[FNN-717] Edit email settings","","[FNN-717] Edit email settings","should edit Notification settings and verify that the settings are saved","should edit Notification settings and verify that the settings are saved",""
"passed","Fri Nov 24 08:10:28 UTC 2023","Fri Nov 24 08:10:46 UTC 2023","18187","","Post Project: [FNN-649] Post project with account Negative","","Post Project: [FNN-649] Post project with account Negative","should post project without Location","should post project without Location",""
"passed","Fri Nov 24 08:39:45 UTC 2023","Fri Nov 24 08:39:56 UTC 2023","11648","","Post Project: [FNN-588] Post project without account Negative","","Post Project: [FNN-588] Post project without account Negative","should post project without last name","should post project without last name",""
"passed","Fri Nov 24 08:03:03 UTC 2023","Fri Nov 24 08:04:20 UTC 2023","76572","","My Profile: [FNN-695] Add portfolio Positive","","My Profile: [FNN-695] Add portfolio Positive","should add portfolio","should add portfolio",""
"failed","Fri Nov 24 08:39:46 UTC 2023","Fri Nov 24 08:40:11 UTC 2023","24984","","My Profile: [FNN-719] Add resume Negative","","My Profile: [FNN-719] Add resume Negative","should add education without period to","should add education without period to",""
"passed","Fri Nov 24 08:02:17 UTC 2023","Fri Nov 24 08:03:57 UTC 2023","99426","","My Profile: [FNN-669] Edit account details Positive","","My Profile: [FNN-669] Edit account details Positive","should edit freelancer account details with valid information","should edit freelancer account details with valid information",""
"passed","Fri Nov 24 08:49:48 UTC 2023","Fri Nov 24 08:50:10 UTC 2023","21760","","CR: [FNN-749] Invite to the organization manually Positive","","CR: [FNN-749] Invite to the organization manually Positive","should check organization page as the inviting user","should check organization page as the inviting user",""
"passed","Fri Nov 24 08:00:03 UTC 2023","Fri Nov 24 08:00:39 UTC 2023","35736","","Login: [FNN-648] Log in from the Login page Positive","","Login: [FNN-648] Log in from the Login page Positive","should log in with valid credentials","should log in with valid credentials",""
"failed","Fri Nov 24 08:10:02 UTC 2023","Fri Nov 24 08:10:31 UTC 2023","29715","","Settings: [FNN-673] Confirm email address","","Settings: [FNN-673] Confirm email address","""before all"" hook for [FNN-673] Confirm email address","""before all"" hook for [FNN-673] Confirm email address",""
"passed","Fri Nov 24 08:21:27 UTC 2023","Fri Nov 24 08:23:32 UTC 2023","125189","","[FNN-667] Send contact","","[FNN-667] Send contact","should send a contact","should send a contact",""
"passed","Fri Nov 24 08:31:19 UTC 2023","Fri Nov 24 08:31:27 UTC 2023","8613","","CR: [FNN-744] CR Subscribe Negative","","CR: [FNN-744] CR Subscribe Negative","should subscribe as CR with taken phone number","should subscribe as CR with taken phone number",""
"broken","Fri Nov 24 08:36:47 UTC 2023","Fri Nov 24 08:38:14 UTC 2023","86937","","Post Project: [FNN-650] Post project without account Positive","","Post Project: [FNN-650] Post project without account Positive","should post a project as an unregistered user with valid project data","should post a project as an unregistered user with valid project data",""
"passed","Fri Nov 24 08:14:27 UTC 2023","Fri Nov 24 08:15:17 UTC 2023","49831","","My Network: [FNN-619] Invite manually via sms","","My Network: [FNN-619] Invite manually via sms","should invite manually via sms with valid recipient data","should invite manually via sms with valid recipient data",""
"passed","Fri Nov 24 08:23:49 UTC 2023","Fri Nov 24 08:24:23 UTC 2023","34630","","[FNN-667] Send contact","","[FNN-667] Send contact","should check the contact as the second user","should check the contact as the second user",""
"passed","Fri Nov 24 08:35:57 UTC 2023","Fri Nov 24 08:36:06 UTC 2023","9773","","Subscribe: [FNN-577] Subscribe Negative","","Subscribe: [FNN-577] Subscribe Negative","should subscribe with wrong phone number","should subscribe with wrong phone number",""
"failed","Fri Nov 24 08:52:03 UTC 2023","Fri Nov 24 08:52:43 UTC 2023","39797","","My Transactions: [FNN-738] Milestones project: Add milestone. Negative","","My Transactions: [FNN-738] Milestones project: Add milestone. Negative","should add milestone with Amount less than 250","should add milestone with Amount less than 250",""
"passed","Fri Nov 24 08:37:34 UTC 2023","Fri Nov 24 08:38:14 UTC 2023","39968","","Settings: [FNN-673] Confirm email address","","Settings: [FNN-673] Confirm email address","should confirm email address","should confirm email address",""
"passed","Fri Nov 24 08:15:24 UTC 2023","Fri Nov 24 08:16:49 UTC 2023","84603","","My Projects: [FNN-1093] Pause project","","My Projects: [FNN-1093] Pause project","should pause the project","should pause the project",""
"passed","Fri Nov 24 08:11:06 UTC 2023","Fri Nov 24 08:11:24 UTC 2023","17985","","Post Project: [FNN-649] Post project with account Negative","","Post Project: [FNN-649] Post project with account Negative","should post project without End date","should post project without End date",""
"passed","Fri Nov 24 08:33:18 UTC 2023","Fri Nov 24 08:33:22 UTC 2023","3098","","CR: [FNN-751] Invite to the organization manually Negative","","CR: [FNN-751] Invite to the organization manually Negative","should invite manually via email with wrong email format","should invite manually via email with wrong email format",""
"passed","Fri Nov 24 08:10:58 UTC 2023","Fri Nov 24 08:11:12 UTC 2023","13836","","Settings: [FNN-675] Change password Negative","","Settings: [FNN-675] Change password Negative","should change password with invalid repeat new password","should change password with invalid repeat new password",""
"passed","Fri Nov 24 07:59:21 UTC 2023","Fri Nov 24 07:59:39 UTC 2023","18471","","Login: [FNN-563] Log in from the header Negative","","Login: [FNN-563] Log in from the header Negative","should log in with valid email and invalid password","should log in with valid email and invalid password",""
"broken","Fri Nov 24 08:40:16 UTC 2023","Fri Nov 24 08:41:05 UTC 2023","49774","","My Network: [FNN-1233] Invite manually via email without custom message","","My Network: [FNN-1233] Invite manually via email without custom message","should invite manually via email with valid recipient data and without message","should invite manually via email with valid recipient data and without message",""
"passed","Fri Nov 24 08:18:23 UTC 2023","Fri Nov 24 08:19:04 UTC 2023","41565","","Freelancer search: [FNN-816] Create list Functionality","","Freelancer search: [FNN-816] Create list Functionality","should remove created list","should remove created list",""
"passed","Fri Nov 24 08:23:39 UTC 2023","Fri Nov 24 08:26:55 UTC 2023","196164","","My Transactions: [FNN-1431] Hourly project: In retrospect. Positive","","My Transactions: [FNN-1431] Hourly project: In retrospect. Positive","should start hourly project","should start hourly project",""
"failed","Fri Nov 24 08:43:23 UTC 2023","Fri Nov 24 08:44:21 UTC 2023","58518","","Post Project: [FNN-588] Post project without account Negative","","Post Project: [FNN-588] Post project without account Negative","should post project without passwords matching","should post project without passwords matching",""
"passed","Fri Nov 24 08:11:12 UTC 2023","Fri Nov 24 08:11:44 UTC 2023","31296","","Settings: [FNN-675] Change password Negative","","Settings: [FNN-675] Change password Negative","should change password with invalid old password","should change password with invalid old password",""
"passed","Fri Nov 24 08:28:34 UTC 2023","Fri Nov 24 08:28:39 UTC 2023","4950","","My Transactions: [FNN-1439] Hourly project: Add time. Negative","","My Transactions: [FNN-1439] Hourly project: Add time. Negative","should add hours without Hours","should add hours without Hours",""
"passed","Fri Nov 24 08:35:24 UTC 2023","Fri Nov 24 08:35:29 UTC 2023","4481","","My Profile: [FNN-668] Edit account details Negative","","My Profile: [FNN-668] Edit account details Negative","should edit account details with invalid Twitter, LinkedIn and Website urls","should edit account details with invalid Twitter, LinkedIn and Website urls",""
"passed","Fri Nov 24 08:15:37 UTC 2023","Fri Nov 24 08:16:02 UTC 2023","25189","","Search Project: [FNN-568] Project search","","Search Project: [FNN-568] Project search","should filter projects by Fixed price","should filter projects by Fixed price",""
"passed","Fri Nov 24 08:31:34 UTC 2023","Fri Nov 24 08:31:41 UTC 2023","7283","","CR: [FNN-744] CR Subscribe Negative","","CR: [FNN-744] CR Subscribe Negative","should subscribe as CR without repeat password","should subscribe as CR without repeat password",""
"passed","Fri Nov 24 08:28:29 UTC 2023","Fri Nov 24 08:32:15 UTC 2023","225555","","My Transactions: [FNN-737] Hourly project: Start project. Negative","","My Transactions: [FNN-737] Hourly project: Start project. Negative","should start project without Hours per period and Hourly rate","should start project without Hours per period and Hourly rate",""
"passed","Fri Nov 24 08:05:20 UTC 2023","Fri Nov 24 08:07:15 UTC 2023","114781","","Upgrade: [FNN-658] Upgrade account Positive","","Upgrade: [FNN-658] Upgrade account Positive","should upgrade account to Enterprise 1 month","should upgrade account to Enterprise 1 month",""
"passed","Fri Nov 24 08:16:36 UTC 2023","Fri Nov 24 08:16:43 UTC 2023","6585","","Search Project: [FNN-568] Project search","","Search Project: [FNN-568] Project search","should filter projects by Posted since Last 7 days","should filter projects by Posted since Last 7 days",""
"broken","Fri Nov 24 08:41:15 UTC 2023","Fri Nov 24 08:41:21 UTC 2023","5862","","Freelancer search: [FNN-815] Freelancer search as non-CR user","","Freelancer search: [FNN-815] Freelancer search as non-CR user","""before all"" hook for [FNN-815] Freelancer search as non-CR user","""before all"" hook for [FNN-815] Freelancer search as non-CR user",""
"passed","Fri Nov 24 08:32:15 UTC 2023","Fri Nov 24 08:32:18 UTC 2023","3575","","My Transactions: [FNN-737] Hourly project: Start project. Negative","","My Transactions: [FNN-737] Hourly project: Start project. Negative","should start project without Hours per period","should start project without Hours per period",""
"passed","Fri Nov 24 08:08:47 UTC 2023","Fri Nov 24 08:09:00 UTC 2023","12187","","Post Project: [FNN-649] Post project with account Negative","","Post Project: [FNN-649] Post project with account Negative","should post project with short Title","should post project with short Title",""
"failed","Fri Nov 24 08:35:32 UTC 2023","Fri Nov 24 08:36:20 UTC 2023","48296","","My Profile: [FNN-668] Edit account details Negative","","My Profile: [FNN-668] Edit account details Negative","should edit account details with invalid VAT number","should edit account details with invalid VAT number",""
"passed","Fri Nov 24 08:37:23 UTC 2023","Fri Nov 24 08:38:05 UTC 2023","41310","","My Profile: [FNN-719] Add resume Negative","","My Profile: [FNN-719] Add resume Negative","should add CV without CV","should add CV without CV",""
"passed","Fri Nov 24 08:36:58 UTC 2023","Fri Nov 24 08:37:19 UTC 2023","21520","","Subscribe: [FNN-577] Subscribe Negative","","Subscribe: [FNN-577] Subscribe Negative","should subscribe without data","should subscribe without data",""
"passed","Fri Nov 24 08:37:56 UTC 2023","Fri Nov 24 08:38:24 UTC 2023","28117","","Settings: [FNN-672] Change email address Negative","","Settings: [FNN-672] Change email address Negative","should change email address with wrong password","should change email address with wrong password",""
"passed","Fri Nov 24 08:16:02 UTC 2023","Fri Nov 24 08:16:17 UTC 2023","15477","","Search Project: [FNN-568] Project search","","Search Project: [FNN-568] Project search","should filter projects by Hourly rate","should filter projects by Hourly rate",""
"passed","Fri Nov 24 08:44:47 UTC 2023","Fri Nov 24 08:44:58 UTC 2023","10042","","Create Profile: [FNN-684] Create profile Negative","","Create Profile: [FNN-684] Create profile Negative","should create profile with wrong website","should create profile with wrong website",""
"passed","Fri Nov 24 08:36:32 UTC 2023","Fri Nov 24 08:36:41 UTC 2023","9300","","Subscribe: [FNN-577] Subscribe Negative","","Subscribe: [FNN-577] Subscribe Negative","should subscribe with short password","should subscribe with short password",""
"passed","Fri Nov 24 08:08:36 UTC 2023","Fri Nov 24 08:08:47 UTC 2023","11900","","Post Project: [FNN-649] Post project with account Negative","","Post Project: [FNN-649] Post project with account Negative","should post project without Title","should post project without Title",""
"passed","Fri Nov 24 08:04:23 UTC 2023","Fri Nov 24 08:04:31 UTC 2023","7767","","My Profile: [FNN-690] Add resume Positive","","My Profile: [FNN-690] Add resume Positive","should add Qualities","should add Qualities",""
"passed","Fri Nov 24 08:23:32 UTC 2023","Fri Nov 24 08:23:40 UTC 2023","8248","","[FNN-667] Send contact","","[FNN-667] Send contact","should forward the contact request","should forward the contact request",""
"passed","Fri Nov 24 08:21:17 UTC 2023","Fri Nov 24 08:21:47 UTC 2023","29460","","My Projects: [FNN-971] Complete project Positive","","My Projects: [FNN-971] Complete project Positive","should check review as freelancer user","should check review as freelancer user",""
"passed","Fri Nov 24 08:16:49 UTC 2023","Fri Nov 24 08:18:19 UTC 2023","90690","","My Projects: [FNN-1093] Pause project","","My Projects: [FNN-1093] Pause project","should verify status of the project as unregistered user","should verify status of the project as unregistered user",""
"passed","Fri Nov 24 08:04:14 UTC 2023","Fri Nov 24 08:04:23 UTC 2023","9630","","My Profile: [FNN-690] Add resume Positive","","My Profile: [FNN-690] Add resume Positive","should add Motivation","should add Motivation",""
"passed","Fri Nov 24 08:27:24 UTC 2023","Fri Nov 24 08:27:31 UTC 2023","7075","","My Transactions: [FNN-1431] Hourly project: In retrospect. Positive","","My Transactions: [FNN-1431] Hourly project: In retrospect. Positive","should verify that the period is closed","should verify that the period is closed",""
"broken","Fri Nov 24 08:48:21 UTC 2023","Fri Nov 24 08:49:48 UTC 2023","86905","","CR: [FNN-749] Invite to the organization manually Positive","","CR: [FNN-749] Invite to the organization manually Positive","should invite manually to the organization with valid recipient details","should invite manually to the organization with valid recipient details",""
"passed","Fri Nov 24 08:28:35 UTC 2023","Fri Nov 24 08:29:14 UTC 2023","38893","","My Transactions: [FNN-708] Hourly project: In advance. Positive","","My Transactions: [FNN-708] Hourly project: In advance. Positive","should pay deposit","should pay deposit",""
"passed","Fri Nov 24 08:40:21 UTC 2023","Fri Nov 24 08:40:28 UTC 2023","6717","","My Profile: [FNN-719] Add resume Negative","","My Profile: [FNN-719] Add resume Negative","should add certificate without organization","should add certificate without organization",""
"passed","Fri Nov 24 08:38:35 UTC 2023","Fri Nov 24 08:38:45 UTC 2023","9340","","My Profile: [FNN-719] Add resume Negative","","My Profile: [FNN-719] Add resume Negative","should add experience without period until","should add experience without period until",""
"passed","Fri Nov 24 08:35:03 UTC 2023","Fri Nov 24 08:35:12 UTC 2023","9347","","Subscribe: [FNN-577] Subscribe Negative","","Subscribe: [FNN-577] Subscribe Negative","should subscribe without first name","should subscribe without first name",""
"passed","Fri Nov 24 08:42:15 UTC 2023","Fri Nov 24 08:43:33 UTC 2023","77563","","Freelancer search: [FNN-822] Send message","","Freelancer search: [FNN-822] Send message","should send a message via the ""Send message"" action","should send a message via the ""Send message"" action",""
"passed","Fri Nov 24 08:15:00 UTC 2023","Fri Nov 24 08:15:04 UTC 2023","3302","","My Network: [FNN-620] Invite manually via email and sms Negative","","My Network: [FNN-620] Invite manually via email and sms Negative","should invite manually via email without last name","should invite manually via email without last name",""
"passed","Fri Nov 24 08:01:06 UTC 2023","Fri Nov 24 08:02:03 UTC 2023","57456","","Reset password: [FNN-656] Reset password Positive","","Reset password: [FNN-656] Reset password Positive","should reset password with valid credentials","should reset password with valid credentials",""
"passed","Fri Nov 24 08:15:12 UTC 2023","Fri Nov 24 08:15:17 UTC 2023","5281","","My Network: [FNN-620] Invite manually via email and sms Negative","","My Network: [FNN-620] Invite manually via email and sms Negative","should invite manually via sms with invalid phone number","should invite manually via sms with invalid phone number",""
"passed","Fri Nov 24 08:51:59 UTC 2023","Fri Nov 24 08:52:03 UTC 2023","3966","","My Transactions: [FNN-738] Milestones project: Add milestone. Negative","","My Transactions: [FNN-738] Milestones project: Add milestone. Negative","should add milestone without Description","should add milestone without Description",""
"passed","Fri Nov 24 08:46:09 UTC 2023","Fri Nov 24 08:49:17 UTC 2023","187529","","My Transactions: [FNN-1430] Milestones project: In retrospect. Positive","","My Transactions: [FNN-1430] Milestones project: In retrospect. Positive","should start project with milestone","should start project with milestone",""
"passed","Fri Nov 24 08:44:58 UTC 2023","Fri Nov 24 08:45:04 UTC 2023","6237","","Create Profile: [FNN-684] Create profile Negative","","Create Profile: [FNN-684] Create profile Negative","should create profile without Profile picture","should create profile without Profile picture",""
"passed","Fri Nov 24 08:28:21 UTC 2023","Fri Nov 24 08:31:29 UTC 2023","187650","","My Transactions: [FNN-710] Milestones project: In advance. Positive","","My Transactions: [FNN-710] Milestones project: In advance. Positive","should start project with milestone","should start project with milestone",""
"passed","Fri Nov 24 08:32:18 UTC 2023","Fri Nov 24 08:32:23 UTC 2023","4936","","My Transactions: [FNN-737] Hourly project: Start project. Negative","","My Transactions: [FNN-737] Hourly project: Start project. Negative","should start project without Hourly rate","should start project without Hourly rate",""
"failed","Fri Nov 24 08:49:30 UTC 2023","Fri Nov 24 08:50:25 UTC 2023","55039","","My Transactions: [FNN-1430] Milestones project: In retrospect. Positive","","My Transactions: [FNN-1430] Milestones project: In retrospect. Positive","should approve milestone and pay for it","should approve milestone and pay for it",""
"passed","Fri Nov 24 08:34:19 UTC 2023","Fri Nov 24 08:35:03 UTC 2023","43886","","Subscribe: [FNN-577] Subscribe Negative","","Subscribe: [FNN-577] Subscribe Negative","should subscribe without category","should subscribe without category",""
"passed","Fri Nov 24 08:36:06 UTC 2023","Fri Nov 24 08:36:15 UTC 2023","8447","","Subscribe: [FNN-577] Subscribe Negative","","Subscribe: [FNN-577] Subscribe Negative","should subscribe with taken phone number","should subscribe with taken phone number",""
"broken","Fri Nov 24 08:44:29 UTC 2023","Fri Nov 24 08:59:29 UTC 2023","900024","","My Projects: [FNN-971] Complete project Positive","","My Projects: [FNN-971] Complete project Positive","""before all"" hook for [FNN-971] Complete project Positive","""before all"" hook for [FNN-971] Complete project Positive",""
"passed","Fri Nov 24 08:29:33 UTC 2023","Fri Nov 24 08:29:39 UTC 2023","5998","","My Transactions: [FNN-708] Hourly project: In advance. Positive","","My Transactions: [FNN-708] Hourly project: In advance. Positive","should close the period","should close the period",""
"passed","Fri Nov 24 07:59:42 UTC 2023","Fri Nov 24 07:59:44 UTC 2023","2204","","Login: [FNN-563] Log in from the header Negative","","Login: [FNN-563] Log in from the header Negative","should log in with wrong email format","should log in with wrong email format",""
"failed","Fri Nov 24 08:39:20 UTC 2023","Fri Nov 24 08:39:46 UTC 2023","25536","","My Profile: [FNN-719] Add resume Negative","","My Profile: [FNN-719] Add resume Negative","should add education without period from","should add education without period from",""
"passed","Fri Nov 24 08:03:10 UTC 2023","Fri Nov 24 08:05:20 UTC 2023","130265","","Upgrade: [FNN-658] Upgrade account Positive","","Upgrade: [FNN-658] Upgrade account Positive","should upgrade account to Business 1 month","should upgrade account to Business 1 month",""
"broken","Fri Nov 24 08:59:29 UTC 2023","Fri Nov 24 09:01:12 UTC 2023","103435","","My Projects: [FNN-971] Complete project Positive","","My Projects: [FNN-971] Complete project Positive","""after all"" hook for [FNN-971] Complete project Positive","""after all"" hook for [FNN-971] Complete project Positive",""
"passed","Fri Nov 24 08:03:50 UTC 2023","Fri Nov 24 08:04:03 UTC 2023","12328","","My Profile: [FNN-690] Add resume Positive","","My Profile: [FNN-690] Add resume Positive","should add Education","should add Education",""
"passed","Fri Nov 24 08:16:17 UTC 2023","Fri Nov 24 08:16:25 UTC 2023","7088","","Search Project: [FNN-568] Project search","","Search Project: [FNN-568] Project search","should filter projects by Status All projects","should filter projects by Status All projects",""
"passed","Fri Nov 24 08:39:34 UTC 2023","Fri Nov 24 08:39:45 UTC 2023","10428","","Post Project: [FNN-588] Post project without account Negative","","Post Project: [FNN-588] Post project without account Negative","should post project without first name","should post project without first name",""
"passed","Fri Nov 24 08:31:08 UTC 2023","Fri Nov 24 08:31:34 UTC 2023","25897","","My Transactions: [FNN-708] Hourly project: In advance. Positive","","My Transactions: [FNN-708] Hourly project: In advance. Positive","should verify that the money paid","should verify that the money paid",""
"passed","Fri Nov 24 08:10:03 UTC 2023","Fri Nov 24 08:10:41 UTC 2023","37559","","Settings: [FNN-674] Change password Positive","","Settings: [FNN-674] Change password Positive","should change password with valid credentials","should change password with valid credentials",""
"passed","Fri Nov 24 08:10:48 UTC 2023","Fri Nov 24 08:12:25 UTC 2023","96244","","Settings: [FNN-676] Change profile settings","","Settings: [FNN-676] Change profile settings","it's not possible to contact me through the contact button on my profile","it's not possible to contact me through the contact button on my profile",""
