"Status","Start Time","Stop Time","Duration in ms","Parent Suite","Suite","Sub Suite","Test Class","Test Method","Name","Description"
"passed","Sat Mar 23 05:01:34 UTC 2024","Sat Mar 23 05:01:45 UTC 2024","11680","","My Profile: [FNN-719] Add resume Negative","","My Profile: [FNN-719] Add resume Negative","should add experience without period until","should add experience without period until",""
"passed","Sat Mar 23 04:55:33 UTC 2024","Sat Mar 23 04:55:43 UTC 2024","10184","","CR: [FNN-744] CR Subscribe Negative","","CR: [FNN-744] CR Subscribe Negative","should subscribe as CR without email","should subscribe as CR without email",""
"skipped","Sat Mar 23 05:22:30 UTC 2024","Sat Mar 23 05:22:30 UTC 2024","2","","My Transactions: [FNN-708] Hourly project: In advance. Positive","","My Transactions: [FNN-708] Hourly project: In advance. Positive","should verify that the money paid","should verify that the money paid",""
"passed","Sat Mar 23 04:11:37 UTC 2024","Sat Mar 23 04:11:40 UTC 2024","3942","","Reset password: [FNN-655] Reset password Negative","","Reset password: [FNN-655] Reset password Negative","should reset password with wrong email","should reset password with wrong email",""
"passed","Sat Mar 23 05:03:12 UTC 2024","Sat Mar 23 05:03:15 UTC 2024","2749","","My Profile: [FNN-719] Add resume Negative","","My Profile: [FNN-719] Add resume Negative","should add certificate without data","should add certificate without data",""
"broken","Sat Mar 23 05:06:21 UTC 2024","Sat Mar 23 05:07:16 UTC 2024","54271","","My Network: [FNN-619] Invite manually via sms with signup bonus","","My Network: [FNN-619] Invite manually via sms with signup bonus","should subscribe as the freelancer with recipient details and accept the invitation","should subscribe as the freelancer with recipient details and accept the invitation",""
"passed","Sat Mar 23 04:41:08 UTC 2024","Sat Mar 23 04:41:12 UTC 2024","3755","","Create Profile: [FNN-684] Create profile Negative","","Create Profile: [FNN-684] Create profile Negative","should create profile with wrong website","should create profile with wrong website",""
"passed","Sat Mar 23 04:24:46 UTC 2024","Sat Mar 23 04:25:03 UTC 2024","16229","","Post Project: [FNN-649] Post project with account Negative","","Post Project: [FNN-649] Post project with account Negative","should post project without End date","should post project without End date",""
"failed","Sat Mar 23 05:08:57 UTC 2024","Sat Mar 23 05:09:28 UTC 2024","31024","","Freelancer search: [FNN-815] Freelancer search as non-CR user","","Freelancer search: [FNN-815] Freelancer search as non-CR user","should filter freelancers by Location","should filter freelancers by Location",""
"passed","Sat Mar 23 05:03:21 UTC 2024","Sat Mar 23 05:03:28 UTC 2024","7076","","My Profile: [FNN-719] Add resume Negative","","My Profile: [FNN-719] Add resume Negative","should add certificate without organization","should add certificate without organization",""
"passed","Sat Mar 23 05:08:50 UTC 2024","Sat Mar 23 05:09:10 UTC 2024","19234","","Post Project: [FNN-588] Post project without account Negative","","Post Project: [FNN-588] Post project without account Negative","should post project without repeat password","should post project without repeat password",""
"failed","Sat Mar 23 05:06:22 UTC 2024","Sat Mar 23 05:07:03 UTC 2024","41233","","Post Project: [FNN-588] Post project without account Negative","","Post Project: [FNN-588] Post project without account Negative","should post project with taken email","should post project with taken email",""
"passed","Sat Mar 23 05:18:21 UTC 2024","Sat Mar 23 05:20:14 UTC 2024","113809","","CR: [FNN-750] Invite to the organization through search","","CR: [FNN-750] Invite to the organization through search","should invite freelancer","should invite freelancer",""
"passed","Sat Mar 23 04:42:11 UTC 2024","Sat Mar 23 04:42:33 UTC 2024","21996","","Freelancer search: [FNN-924] Freelancer search as CR user","","Freelancer search: [FNN-924] Freelancer search as CR user","should filter freelancers by Category","should filter freelancers by Category",""
"passed","Sat Mar 23 04:22:49 UTC 2024","Sat Mar 23 04:23:01 UTC 2024","11458","","Post Project: [FNN-649] Post project with account Negative","","Post Project: [FNN-649] Post project with account Negative","should post project without Title","should post project without Title",""
"failed","Sat Mar 23 05:21:50 UTC 2024","Sat Mar 23 05:22:30 UTC 2024","40582","","My Transactions: [FNN-708] Hourly project: In advance. Positive","","My Transactions: [FNN-708] Hourly project: In advance. Positive","should approve the time and pay for extra money","should approve the time and pay for extra money",""
"passed","Sat Mar 23 05:21:41 UTC 2024","Sat Mar 23 05:21:50 UTC 2024","8399","","My Transactions: [FNN-708] Hourly project: In advance. Positive","","My Transactions: [FNN-708] Hourly project: In advance. Positive","should verify that the period is closed","should verify that the period is closed",""
"passed","Sat Mar 23 04:59:11 UTC 2024","Sat Mar 23 04:59:21 UTC 2024","10076","","My Profile: [FNN-668] Edit account details Negative","","My Profile: [FNN-668] Edit account details Negative","should edit account details with invalid Twitter, LinkedIn and Website urls","should edit account details with invalid Twitter, LinkedIn and Website urls",""
"passed","Sat Mar 23 05:00:53 UTC 2024","Sat Mar 23 05:03:27 UTC 2024","154073","","My Profile: [FNN-669] Edit account details Positive","","My Profile: [FNN-669] Edit account details Positive","should edit employer account details with valid information","should edit employer account details with valid information",""
"passed","Sat Mar 23 05:04:56 UTC 2024","Sat Mar 23 05:05:17 UTC 2024","21118","","Post Project: [FNN-588] Post project without account Negative","","Post Project: [FNN-588] Post project without account Negative","should post project without first name","should post project without first name",""
"passed","Sat Mar 23 04:10:56 UTC 2024","Sat Mar 23 04:11:08 UTC 2024","12267","","Subscribe: [FNN-577] Subscribe Negative","","Subscribe: [FNN-577] Subscribe Negative","should subscribe with taken email","should subscribe with taken email",""
"skipped","Sat Mar 23 04:08:06 UTC 2024","Sat Mar 23 04:08:06 UTC 2024","1","","Subscribe","","Subscribe","[FNN-2373] Professional receives Welcome letter","[FNN-2373] Professional receives Welcome letter",""
"failed","Sat Mar 23 05:03:02 UTC 2024","Sat Mar 23 05:03:38 UTC 2024","36077","","Post Project: [FNN-650] Post project without account Positive","","Post Project: [FNN-650] Post project without account Positive","should verify that the user received a project posted letter","should verify that the user received a project posted letter",""
"skipped","Sat Mar 23 05:18:28 UTC 2024","Sat Mar 23 05:18:28 UTC 2024","1","","My Transactions: [FNN-1431] Hourly project: In retrospect. Positive","","My Transactions: [FNN-1431] Hourly project: In retrospect. Positive","should close the period","should close the period",""
"failed","Sat Mar 23 05:00:54 UTC 2024","Sat Mar 23 05:01:33 UTC 2024","38914","","Post Project: [FNN-587] Post project with account Positive","","Post Project: [FNN-587] Post project with account Positive","should verify that the user received a project posted letter","should verify that the user received a project posted letter",""
"passed","Sat Mar 23 04:18:55 UTC 2024","Sat Mar 23 04:19:27 UTC 2024","32407","","My Profile: [FNN-718] Add portfolio Negative","","My Profile: [FNN-718] Add portfolio Negative","should add portfolio without Type","should add portfolio without Type",""
"passed","Sat Mar 23 04:26:18 UTC 2024","Sat Mar 23 04:27:47 UTC 2024","88816","","Settings: [FNN-677] Downgrade to ""Stand-by Standaard""","","Settings: [FNN-677] Downgrade to ""Stand-by Standaard""","should downgrade to ""Stand-by Standaard""","should downgrade to ""Stand-by Standaard""",""
"passed","Sat Mar 23 05:02:01 UTC 2024","Sat Mar 23 05:02:08 UTC 2024","6976","","My Profile: [FNN-730] Request reference Negative","","My Profile: [FNN-730] Request reference Negative","should pass step 2 without first name","should pass step 2 without first name",""
"passed","Sat Mar 23 05:08:31 UTC 2024","Sat Mar 23 05:08:50 UTC 2024","19841","","Post Project: [FNN-588] Post project without account Negative","","Post Project: [FNN-588] Post project without account Negative","should post project without password","should post project without password",""
"failed","Sat Mar 23 05:01:45 UTC 2024","Sat Mar 23 05:02:09 UTC 2024","23758","","My Profile: [FNN-719] Add resume Negative","","My Profile: [FNN-719] Add resume Negative","should add education without data","should add education without data",""
"failed","Sat Mar 23 05:04:24 UTC 2024","Sat Mar 23 05:05:24 UTC 2024","60121","","Search Project: [FNN-568] Project search","","Search Project: [FNN-568] Project search","""before all"" hook for [FNN-568] Project search","""before all"" hook for [FNN-568] Project search",""
"passed","Sat Mar 23 04:15:24 UTC 2024","Sat Mar 23 04:15:31 UTC 2024","6598","","My Profile: [FNN-690] Add resume Positive","","My Profile: [FNN-690] Add resume Positive","should add Expertise","should add Expertise",""
"passed","Sat Mar 23 04:10:17 UTC 2024","Sat Mar 23 04:10:42 UTC 2024","25225","","Login: [FNN-574] Log in from the Login page Negative","","Login: [FNN-574] Log in from the Login page Negative","should log in with valid email and invalid password","should log in with valid email and invalid password",""
"passed","Sat Mar 23 04:39:16 UTC 2024","Sat Mar 23 04:39:19 UTC 2024","2872","","Freelancer search: [FNN-822] Send message","","Freelancer search: [FNN-822] Send message","should check the message as the CR user","should check the message as the CR user",""
"passed","Sat Mar 23 04:24:39 UTC 2024","Sat Mar 23 04:25:31 UTC 2024","52270","","Settings: [FNN-673] Confirm email address","","Settings: [FNN-673] Confirm email address","should confirm email address","should confirm email address",""
"passed","Sat Mar 23 04:44:38 UTC 2024","Sat Mar 23 04:46:45 UTC 2024","127062","","[FNN-661] Send interest","","[FNN-661] Send interest","should check if the freelancer user on the project","should check if the freelancer user on the project",""
"skipped","Sat Mar 23 05:18:28 UTC 2024","Sat Mar 23 05:18:28 UTC 2024","0","","My Transactions: [FNN-1431] Hourly project: In retrospect. Positive","","My Transactions: [FNN-1431] Hourly project: In retrospect. Positive","should verify that the money paid","should verify that the money paid",""
"passed","Sat Mar 23 04:23:38 UTC 2024","Sat Mar 23 04:23:53 UTC 2024","15029","","Post Project: [FNN-649] Post project with account Negative","","Post Project: [FNN-649] Post project with account Negative","should post project without Budget","should post project without Budget",""
"skipped","Sat Mar 23 04:43:18 UTC 2024","Sat Mar 23 04:44:01 UTC 2024","42444","","[FNN-667] Send contact","","[FNN-667] Send contact","should check the contact as the second user","should check the contact as the second user",""
"passed","Sat Mar 23 04:29:32 UTC 2024","Sat Mar 23 04:30:32 UTC 2024","60021","","My Network: [FNN-1233] Invite manually via email without custom message with signup bonus","","My Network: [FNN-1233] Invite manually via email without custom message with signup bonus","should invite manually via email with valid recipient data and without message","should invite manually via email with valid recipient data and without message",""
"failed","Sat Mar 23 05:02:19 UTC 2024","Sat Mar 23 05:02:46 UTC 2024","26200","","My Profile: [FNN-719] Add resume Negative","","My Profile: [FNN-719] Add resume Negative","should add education without period from","should add education without period from",""
"passed","Sat Mar 23 04:27:36 UTC 2024","Sat Mar 23 04:29:20 UTC 2024","104270","","Settings: [FNN-679] Delete account with subscription","","Settings: [FNN-679] Delete account with subscription","should delete account with subscription","should delete account with subscription",""
"passed","Sat Mar 23 05:02:23 UTC 2024","Sat Mar 23 05:02:27 UTC 2024","4635","","My Profile: [FNN-730] Request reference Negative","","My Profile: [FNN-730] Request reference Negative","should pass step 2 without picture","should pass step 2 without picture",""
"skipped","Sat Mar 23 05:18:28 UTC 2024","Sat Mar 23 05:18:28 UTC 2024","1","","My Transactions: [FNN-1431] Hourly project: In retrospect. Positive","","My Transactions: [FNN-1431] Hourly project: In retrospect. Positive","should verify that the period is closed","should verify that the period is closed",""
"passed","Sat Mar 23 04:11:33 UTC 2024","Sat Mar 23 04:11:47 UTC 2024","13551","","Subscribe: [FNN-577] Subscribe Negative","","Subscribe: [FNN-577] Subscribe Negative","should subscribe with taken phone number","should subscribe with taken phone number",""
"passed","Sat Mar 23 04:56:35 UTC 2024","Sat Mar 23 04:56:59 UTC 2024","23478","","My Transactions: [FNN-738] Milestones project: Add milestone. Negative","","My Transactions: [FNN-738] Milestones project: Add milestone. Negative","should add milestone with Amount less than 250","should add milestone with Amount less than 250",""
"skipped","Sat Mar 23 04:34:56 UTC 2024","Sat Mar 23 04:35:53 UTC 2024","56096","","My Network: [FNN-1027] Invite freelancers","","My Network: [FNN-1027] Invite freelancers","should check network as sender user","should check network as sender user",""
"failed","Sat Mar 23 05:01:02 UTC 2024","Sat Mar 23 05:02:43 UTC 2024","101669","","Upgrade: [FNN-658] Upgrade account Positive","","Upgrade: [FNN-658] Upgrade account Positive","should upgrade account to Premium 1 month","should upgrade account to Premium 1 month",""
"passed","Sat Mar 23 04:19:35 UTC 2024","Sat Mar 23 04:21:47 UTC 2024","132149","","My Profile: [FNN-793] Remove resume","","My Profile: [FNN-793] Remove resume","should remove resume","should remove resume",""
"passed","Sat Mar 23 04:12:36 UTC 2024","Sat Mar 23 04:12:47 UTC 2024","11054","","Subscribe: [FNN-577] Subscribe Negative","","Subscribe: [FNN-577] Subscribe Negative","should subscribe without agreeing to the Terms and Conditions","should subscribe without agreeing to the Terms and Conditions",""
"passed","Sat Mar 23 05:00:01 UTC 2024","Sat Mar 23 05:01:00 UTC 2024","58300","","My Profile: [FNN-719] Add resume Negative","","My Profile: [FNN-719] Add resume Negative","should add CV without CV","should add CV without CV",""
"failed","Sat Mar 23 04:57:55 UTC 2024","Sat Mar 23 04:59:57 UTC 2024","121779","","CR: [FNN-1779] My Dashboard page integrity as Employer","","CR: [FNN-1779] My Dashboard page integrity as Employer","should verify the integrity of the My Dashboard page as employer","should verify the integrity of the My Dashboard page as employer",""
"passed","Sat Mar 23 04:38:18 UTC 2024","Sat Mar 23 04:39:07 UTC 2024","49136","","Freelancer search: [FNN-816] Create list Functionality","","Freelancer search: [FNN-816] Create list Functionality","should remove created list","should remove created list",""
"failed","Sat Mar 23 05:07:23 UTC 2024","Sat Mar 23 05:08:05 UTC 2024","41439","","Post Project: [FNN-588] Post project without account Negative","","Post Project: [FNN-588] Post project without account Negative","should post project with taken phone number","should post project with taken phone number",""
"passed","Sat Mar 23 04:17:12 UTC 2024","Sat Mar 23 04:18:47 UTC 2024","94390","","My Profile: [FNN-713] Confirm phone number Negative","","My Profile: [FNN-713] Confirm phone number Negative","should confirm phone number with invalid code","should confirm phone number with invalid code",""
"passed","Sat Mar 23 04:40:57 UTC 2024","Sat Mar 23 04:41:08 UTC 2024","11413","","Create Profile: [FNN-684] Create profile Negative","","Create Profile: [FNN-684] Create profile Negative","should create profile without City","should create profile without City",""
"broken","Sat Mar 23 05:08:03 UTC 2024","Sat Mar 23 05:12:02 UTC 2024","238781","","My Projects: [FNN-1058] Complete project Negative","","My Projects: [FNN-1058] Complete project Negative","""before each"" hook for [FNN-1058] Complete project Negative","""before each"" hook for [FNN-1058] Complete project Negative",""
"broken","Sat Mar 23 05:12:11 UTC 2024","Sat Mar 23 05:12:30 UTC 2024","19396","","My Network: [FNN-664] Invite freelancer","","My Network: [FNN-664] Invite freelancer","should accept an invitation","should accept an invitation",""
"skipped","Sat Mar 23 05:12:54 UTC 2024","Sat Mar 23 05:14:10 UTC 2024","76385","","My Projects: [FNN-971] Complete project Positive","","My Projects: [FNN-971] Complete project Positive","should check review as freelancer user","should check review as freelancer user",""
"passed","Sat Mar 23 04:15:31 UTC 2024","Sat Mar 23 04:15:41 UTC 2024","10291","","My Profile: [FNN-690] Add resume Positive","","My Profile: [FNN-690] Add resume Positive","should add Language","should add Language",""
"passed","Sat Mar 23 05:12:54 UTC 2024","Sat Mar 23 05:13:35 UTC 2024","41165","","[FNN-743] Archive and restore message","","[FNN-743] Archive and restore message","should restore the message","should restore the message",""
"broken","Sat Mar 23 05:18:58 UTC 2024","Sat Mar 23 05:19:09 UTC 2024","10516","","My Transactions: [FNN-710] Milestones project: In advance. Positive","","My Transactions: [FNN-710] Milestones project: In advance. Positive","should pay deposit","should pay deposit",""
"passed","Sat Mar 23 04:30:37 UTC 2024","Sat Mar 23 04:30:43 UTC 2024","5728","","My Network: [FNN-620] Invite manually via email and sms Negative","","My Network: [FNN-620] Invite manually via email and sms Negative","should invite manually via email with wrong email format","should invite manually via email with wrong email format",""
"passed","Sat Mar 23 05:06:10 UTC 2024","Sat Mar 23 05:07:10 UTC 2024","59648","","My Network: [FNN-1232] Invite manually via email with custom message with signup bonus","","My Network: [FNN-1232] Invite manually via email with custom message with signup bonus","should subscribe as the freelancer with recipient details and accept the invitation","should subscribe as the freelancer with recipient details and accept the invitation",""
"passed","Sat Mar 23 04:57:55 UTC 2024","Sat Mar 23 04:59:02 UTC 2024","67113","","My Profile: [FNN-668] Edit account details Negative","","My Profile: [FNN-668] Edit account details Negative","should edit account details without required fields","should edit account details without required fields",""
"passed","Sat Mar 23 04:55:30 UTC 2024","Sat Mar 23 04:55:48 UTC 2024","18529","","My Transactions: [FNN-737] Hourly project: Start project. Negative","","My Transactions: [FNN-737] Hourly project: Start project. Negative","should start project without Hours per period","should start project without Hours per period",""
"passed","Sat Mar 23 04:56:16 UTC 2024","Sat Mar 23 04:56:23 UTC 2024","7062","","My Transactions: [FNN-738] Milestones project: Add milestone. Negative","","My Transactions: [FNN-738] Milestones project: Add milestone. Negative","should add milestone without Amount","should add milestone without Amount",""
"failed","Sat Mar 23 05:04:02 UTC 2024","Sat Mar 23 05:05:02 UTC 2024","59400","","My Profile: [FNN-730] Request reference Negative","","My Profile: [FNN-730] Request reference Negative","should pass step 3 with comments less then 200 chars","should pass step 3 with comments less then 200 chars",""
"passed","Sat Mar 23 04:26:34 UTC 2024","Sat Mar 23 04:27:27 UTC 2024","53217","","Settings: [FNN-678] Delete account without subscription","","Settings: [FNN-678] Delete account without subscription","should delete account without subscription","should delete account without subscription",""
"passed","Sat Mar 23 04:23:53 UTC 2024","Sat Mar 23 04:24:09 UTC 2024","16502","","Post Project: [FNN-649] Post project with account Negative","","Post Project: [FNN-649] Post project with account Negative","should post project without Work on location","should post project without Work on location",""
"passed","Sat Mar 23 04:10:51 UTC 2024","Sat Mar 23 04:10:54 UTC 2024","2990","","Login: [FNN-574] Log in from the Login page Negative","","Login: [FNN-574] Log in from the Login page Negative","should log in without email","should log in without email",""
"failed","Sat Mar 23 04:57:05 UTC 2024","Sat Mar 23 04:59:05 UTC 2024","119102","","CR: [FNN-1888] My Dashboard page integrity as Freelancer","","CR: [FNN-1888] My Dashboard page integrity as Freelancer","should verify the integrity of the My Dashboard page as freelancer","should verify the integrity of the My Dashboard page as freelancer",""
"failed","Sat Mar 23 05:02:30 UTC 2024","Sat Mar 23 05:02:56 UTC 2024","26797","","Post Project: [FNN-650] Post project without account Positive","","Post Project: [FNN-650] Post project without account Positive","should verify that the project informations is correct","should verify that the project informations is correct",""
"passed","Sat Mar 23 05:02:16 UTC 2024","Sat Mar 23 05:02:23 UTC 2024","7213","","My Profile: [FNN-730] Request reference Negative","","My Profile: [FNN-730] Request reference Negative","should pass step 2 without phone","should pass step 2 without phone",""
"passed","Sat Mar 23 05:03:40 UTC 2024","Sat Mar 23 05:03:45 UTC 2024","4770","","My Profile: [FNN-719] Add resume Negative","","My Profile: [FNN-719] Add resume Negative","should add language without speaking level","should add language without speaking level",""
"passed","Sat Mar 23 04:43:03 UTC 2024","Sat Mar 23 04:43:22 UTC 2024","18580","","Freelancer search: [FNN-924] Freelancer search as CR user","","Freelancer search: [FNN-924] Freelancer search as CR user","should filter freelancers by Hourly Rate","should filter freelancers by Hourly Rate",""
"passed","Sat Mar 23 04:14:54 UTC 2024","Sat Mar 23 04:16:37 UTC 2024","102772","","My Profile: [FNN-695] Add portfolio Positive","","My Profile: [FNN-695] Add portfolio Positive","should add portfolio","should add portfolio",""
"passed","Sat Mar 23 04:52:51 UTC 2024","Sat Mar 23 04:53:48 UTC 2024","56988","","CR: [FNN-742] CR subscribe Positive","","CR: [FNN-742] CR subscribe Positive","should subscribe as CR with valid credentials","should subscribe as CR with valid credentials",""
"passed","Sat Mar 23 04:44:19 UTC 2024","Sat Mar 23 04:45:56 UTC 2024","96367","","Freelancer search: [FNN-924] Freelancer search as CR user","","Freelancer search: [FNN-924] Freelancer search as CR user","should filter freelancers by Availability","should filter freelancers by Availability",""
"passed","Sat Mar 23 04:44:10 UTC 2024","Sat Mar 23 04:45:29 UTC 2024","78605","","[FNN-813] Change language","","[FNN-813] Change language","should change language to Dutch from the footer","should change language to Dutch from the footer",""
"passed","Sat Mar 23 04:40:38 UTC 2024","Sat Mar 23 04:44:02 UTC 2024","204290","","[FNN-661] Send interest","","[FNN-661] Send interest","should send interest in the employer's project","should send interest in the employer's project",""
"passed","Sat Mar 23 04:38:11 UTC 2024","Sat Mar 23 04:38:18 UTC 2024","6976","","Freelancer search: [FNN-816] Create list Functionality","","Freelancer search: [FNN-816] Create list Functionality","should re-open original search","should re-open original search",""
"skipped","Sat Mar 23 05:15:20 UTC 2024","Sat Mar 23 05:15:20 UTC 2024","0","","My Transactions: [FNN-1430] Milestones project: In retrospect. Positive","","My Transactions: [FNN-1430] Milestones project: In retrospect. Positive","should verify that the money paid","should verify that the money paid",""
"passed","Sat Mar 23 04:58:43 UTC 2024","Sat Mar 23 05:00:53 UTC 2024","130536","","My Profile: [FNN-669] Edit account details Positive","","My Profile: [FNN-669] Edit account details Positive","should edit freelancer account details with valid information","should edit freelancer account details with valid information",""
"passed","Sat Mar 23 04:56:51 UTC 2024","Sat Mar 23 04:57:48 UTC 2024","57497","","CR: [FNN-751] Invite to the organization manually Negative","","CR: [FNN-751] Invite to the organization manually Negative","should invite manually to the organization without email","should invite manually to the organization without email",""
"passed","Sat Mar 23 05:20:46 UTC 2024","Sat Mar 23 05:21:19 UTC 2024","33162","","My Transactions: [FNN-708] Hourly project: In advance. Positive","","My Transactions: [FNN-708] Hourly project: In advance. Positive","should pay deposit","should pay deposit",""
"passed","Sat Mar 23 04:11:47 UTC 2024","Sat Mar 23 04:13:21 UTC 2024","93869","","Reset password: [FNN-656] Reset password Positive","","Reset password: [FNN-656] Reset password Positive","should reset password with valid credentials","should reset password with valid credentials",""
"passed","Sat Mar 23 04:55:23 UTC 2024","Sat Mar 23 04:55:33 UTC 2024","10201","","CR: [FNN-744] CR Subscribe Negative","","CR: [FNN-744] CR Subscribe Negative","should subscribe as CR without last name","should subscribe as CR without last name",""
"broken","Sat Mar 23 05:13:25 UTC 2024","Sat Mar 23 05:18:28 UTC 2024","302733","","My Transactions: [FNN-1431] Hourly project: In retrospect. Positive","","My Transactions: [FNN-1431] Hourly project: In retrospect. Positive","should start hourly project","should start hourly project",""
"passed","Sat Mar 23 04:14:28 UTC 2024","Sat Mar 23 04:14:45 UTC 2024","16523","","My Profile: [FNN-690] Add resume Positive","","My Profile: [FNN-690] Add resume Positive","should add Experience","should add Experience",""
"passed","Sat Mar 23 04:59:02 UTC 2024","Sat Mar 23 04:59:07 UTC 2024","4081","","My Profile: [FNN-668] Edit account details Negative","","My Profile: [FNN-668] Edit account details Negative","should edit account details without sector","should edit account details without sector",""
