"Status","Start Time","Stop Time","Duration in ms","Parent Suite","Suite","Sub Suite","Test Class","Test Method","Name","Description"
"passed","Fri Jan 05 04:09:56 UTC 2024","Fri Jan 05 04:10:06 UTC 2024","10625","","Subscribe: [FNN-577] Subscribe Negative","","Subscribe: [FNN-577] Subscribe Negative","should subscribe with short password","should subscribe with short password",""
"passed","Fri Jan 05 04:47:27 UTC 2024","Fri Jan 05 04:48:41 UTC 2024","74044","","My Profile: [FNN-730] Request reference Negative","","My Profile: [FNN-730] Request reference Negative","should pass step 2 without data","should pass step 2 without data",""
"passed","Fri Jan 05 04:51:04 UTC 2024","Fri Jan 05 04:51:07 UTC 2024","3843","","My Profile: [FNN-719] Add resume Negative","","My Profile: [FNN-719] Add resume Negative","should add certificate without data","should add certificate without data",""
"passed","Fri Jan 05 04:43:29 UTC 2024","Fri Jan 05 04:44:15 UTC 2024","46730","","CR: [FNN-744] CR Subscribe Negative","","CR: [FNN-744] CR Subscribe Negative","should subscribe as CR without sector","should subscribe as CR without sector",""
"passed","Fri Jan 05 04:52:41 UTC 2024","Fri Jan 05 04:53:15 UTC 2024","34010","","Post Project: [FNN-649] Post project with account Negative","","Post Project: [FNN-649] Post project with account Negative","should post project with short Description","should post project with short Description",""
"passed","Fri Jan 05 04:51:28 UTC 2024","Fri Jan 05 04:51:47 UTC 2024","18426","","My Profile: [FNN-719] Add resume Negative","","My Profile: [FNN-719] Add resume Negative","should add language without reading level","should add language without reading level",""
"passed","Fri Jan 05 04:46:04 UTC 2024","Fri Jan 05 04:46:07 UTC 2024","2695","","CR: [FNN-744] CR Subscribe Negative","","CR: [FNN-744] CR Subscribe Negative","should subscribe as CR without data","should subscribe as CR without data",""
"passed","Fri Jan 05 04:53:13 UTC 2024","Fri Jan 05 04:53:28 UTC 2024","14371","","Post Project: [FNN-588] Post project without account Negative","","Post Project: [FNN-588] Post project without account Negative","should post project without phone number","should post project without phone number",""
"passed","Fri Jan 05 04:36:30 UTC 2024","Fri Jan 05 04:38:43 UTC 2024","132839","","[FNN-661] Send interest","","[FNN-661] Send interest","should check if the freelancer user on the project","should check if the freelancer user on the project",""
"passed","Fri Jan 05 04:31:35 UTC 2024","Fri Jan 05 04:31:38 UTC 2024","2579","","Freelancer search: [FNN-822] Send message","","Freelancer search: [FNN-822] Send message","should check the message as the CR user","should check the message as the CR user",""
"passed","Fri Jan 05 04:47:32 UTC 2024","Fri Jan 05 04:47:34 UTC 2024","2660","","My Profile: [FNN-668] Edit account details Negative","","My Profile: [FNN-668] Edit account details Negative","should edit account details with invalid phone number","should edit account details with invalid phone number",""
"passed","Fri Jan 05 04:08:46 UTC 2024","Fri Jan 05 04:08:52 UTC 2024","6201","","Subscribe: [FNN-577] Subscribe Negative","","Subscribe: [FNN-577] Subscribe Negative","should subscribe without email","should subscribe without email",""
"passed","Fri Jan 05 04:10:06 UTC 2024","Fri Jan 05 04:10:16 UTC 2024","9539","","Subscribe: [FNN-577] Subscribe Negative","","Subscribe: [FNN-577] Subscribe Negative","should subscribe with invalid repeat password","should subscribe with invalid repeat password",""
"passed","Fri Jan 05 04:14:42 UTC 2024","Fri Jan 05 04:16:09 UTC 2024","86966","","My Profile: [FNN-669] Edit account details Positive","","My Profile: [FNN-669] Edit account details Positive","should edit cr account details with valid information","should edit cr account details with valid information",""
"passed","Fri Jan 05 05:10:10 UTC 2024","Fri Jan 05 05:10:13 UTC 2024","2920","","My Transactions: [FNN-737] Hourly project: Start project. Negative","","My Transactions: [FNN-737] Hourly project: Start project. Negative","should start project without Hours per period","should start project without Hours per period",""
"passed","Fri Jan 05 04:48:50 UTC 2024","Fri Jan 05 04:48:54 UTC 2024","4151","","My Profile: [FNN-730] Request reference Negative","","My Profile: [FNN-730] Request reference Negative","should pass step 2 without phone","should pass step 2 without phone",""
"passed","Fri Jan 05 04:09:05 UTC 2024","Fri Jan 05 04:09:15 UTC 2024","9338","","Subscribe: [FNN-577] Subscribe Negative","","Subscribe: [FNN-577] Subscribe Negative","should subscribe without phone number","should subscribe without phone number",""
"broken","Fri Jan 05 04:53:08 UTC 2024","Fri Jan 05 04:53:48 UTC 2024","39640","","My Network: [FNN-1233] Invite manually via email without custom message with signup bonus","","My Network: [FNN-1233] Invite manually via email without custom message with signup bonus","should subscribe as the freelancer with recipient details and accept the invitation","should subscribe as the freelancer with recipient details and accept the invitation",""
"passed","Fri Jan 05 04:46:15 UTC 2024","Fri Jan 05 04:46:18 UTC 2024","2700","","CR: [FNN-751] Invite to the organization manually Negative","","CR: [FNN-751] Invite to the organization manually Negative","should invite manually to the organization without first name","should invite manually to the organization without first name",""
"passed","Fri Jan 05 04:49:43 UTC 2024","Fri Jan 05 04:49:48 UTC 2024","5039","","My Profile: [FNN-730] Request reference Negative","","My Profile: [FNN-730] Request reference Negative","should pass step 3 without 4 rating","should pass step 3 without 4 rating",""
"passed","Fri Jan 05 04:29:14 UTC 2024","Fri Jan 05 04:29:33 UTC 2024","18306","","Freelancer search: [FNN-815] Freelancer search as non-CR user","","Freelancer search: [FNN-815] Freelancer search as non-CR user","should filter freelancers by Hourly Rate","should filter freelancers by Hourly Rate",""
"passed","Fri Jan 05 04:45:48 UTC 2024","Fri Jan 05 04:45:56 UTC 2024","7731","","CR: [FNN-744] CR Subscribe Negative","","CR: [FNN-744] CR Subscribe Negative","should subscribe as CR with invalid repeat password","should subscribe as CR with invalid repeat password",""
"passed","Fri Jan 05 05:08:19 UTC 2024","Fri Jan 05 05:08:30 UTC 2024","10688","","My Transactions: [FNN-710] Milestones project: In advance. Positive","","My Transactions: [FNN-710] Milestones project: In advance. Positive","should accept the project","should accept the project",""
"passed","Fri Jan 05 04:58:10 UTC 2024","Fri Jan 05 04:59:14 UTC 2024","63561","","Create Profile: [FNN-683] Create profile Positive","","Create Profile: [FNN-683] Create profile Positive","should create profile with valid data","should create profile with valid data",""
"passed","Fri Jan 05 04:54:40 UTC 2024","Fri Jan 05 04:54:53 UTC 2024","13362","","Post Project: [FNN-588] Post project without account Negative","","Post Project: [FNN-588] Post project without account Negative","should post project without repeat password","should post project without repeat password",""
"passed","Fri Jan 05 04:08:52 UTC 2024","Fri Jan 05 04:08:58 UTC 2024","6214","","Subscribe: [FNN-577] Subscribe Negative","","Subscribe: [FNN-577] Subscribe Negative","should subscribe with wrong email format","should subscribe with wrong email format",""
"passed","Fri Jan 05 05:05:23 UTC 2024","Fri Jan 05 05:05:48 UTC 2024","25097","","Freelancer search: [FNN-924] Freelancer search as CR user","","Freelancer search: [FNN-924] Freelancer search as CR user","should filter freelancers by Minimum references","should filter freelancers by Minimum references",""
"passed","Fri Jan 05 05:10:13 UTC 2024","Fri Jan 05 05:10:17 UTC 2024","3380","","My Transactions: [FNN-737] Hourly project: Start project. Negative","","My Transactions: [FNN-737] Hourly project: Start project. Negative","should start project without Hourly rate","should start project without Hourly rate",""
"passed","Fri Jan 05 04:51:33 UTC 2024","Fri Jan 05 04:51:48 UTC 2024","14405","","Post Project: [FNN-649] Post project with account Negative","","Post Project: [FNN-649] Post project with account Negative","should post project without Location","should post project without Location",""
"passed","Fri Jan 05 04:52:30 UTC 2024","Fri Jan 05 04:53:06 UTC 2024","36446","","My Network: [FNN-619] Invite manually via sms with signup bonus","","My Network: [FNN-619] Invite manually via sms with signup bonus","should invite manually via sms with valid recipient details","should invite manually via sms with valid recipient details",""
"passed","Fri Jan 05 04:50:32 UTC 2024","Fri Jan 05 04:50:44 UTC 2024","11867","","Post Project: [FNN-649] Post project with account Negative","","Post Project: [FNN-649] Post project with account Negative","should post project with short Title","should post project with short Title",""
"passed","Fri Jan 05 05:02:16 UTC 2024","Fri Jan 05 05:02:39 UTC 2024","23077","","Freelancer search: [FNN-924] Freelancer search as CR user","","Freelancer search: [FNN-924] Freelancer search as CR user","should filter freelancers by Category","should filter freelancers by Category",""
"passed","Fri Jan 05 04:12:14 UTC 2024","Fri Jan 05 04:12:33 UTC 2024","19476","","Upgrade: [FNN-659] Upgrade account Negative","","Upgrade: [FNN-659] Upgrade account Negative","should upgrade account to Standard 1 month: Processing error decline","should upgrade account to Standard 1 month: Processing error decline",""
"passed","Fri Jan 05 04:08:38 UTC 2024","Fri Jan 05 04:08:46 UTC 2024","7969","","Subscribe: [FNN-577] Subscribe Negative","","Subscribe: [FNN-577] Subscribe Negative","should subscribe without last name","should subscribe without last name",""
"passed","Fri Jan 05 04:54:53 UTC 2024","Fri Jan 05 04:55:06 UTC 2024","13531","","Post Project: [FNN-588] Post project without account Negative","","Post Project: [FNN-588] Post project without account Negative","should post project with short password and repeat password","should post project with short password and repeat password",""
"passed","Fri Jan 05 04:51:22 UTC 2024","Fri Jan 05 04:51:25 UTC 2024","2803","","My Profile: [FNN-719] Add resume Negative","","My Profile: [FNN-719] Add resume Negative","should add language without speaking level","should add language without speaking level",""
"passed","Fri Jan 05 04:44:15 UTC 2024","Fri Jan 05 04:44:23 UTC 2024","7908","","CR: [FNN-744] CR Subscribe Negative","","CR: [FNN-744] CR Subscribe Negative","should subscribe as CR without company name","should subscribe as CR without company name",""
"failed","Fri Jan 05 05:05:48 UTC 2024","Fri Jan 05 05:06:53 UTC 2024","65800","","Freelancer search: [FNN-924] Freelancer search as CR user","","Freelancer search: [FNN-924] Freelancer search as CR user","should filter freelancers by Minimum rating","should filter freelancers by Minimum rating",""
"passed","Fri Jan 05 04:51:51 UTC 2024","Fri Jan 05 04:52:03 UTC 2024","12396","","Post Project: [FNN-588] Post project without account Negative","","Post Project: [FNN-588] Post project without account Negative","should post project without last name","should post project without last name",""
"passed","Fri Jan 05 04:07:35 UTC 2024","Fri Jan 05 04:08:30 UTC 2024","54574","","Subscribe: [FNN-577] Subscribe Negative","","Subscribe: [FNN-577] Subscribe Negative","should subscribe without category","should subscribe without category",""
"passed","Fri Jan 05 04:44:47 UTC 2024","Fri Jan 05 04:44:57 UTC 2024","9641","","CR: [FNN-744] CR Subscribe Negative","","CR: [FNN-744] CR Subscribe Negative","should subscribe as CR with taken email","should subscribe as CR with taken email",""
"passed","Fri Jan 05 04:07:56 UTC 2024","Fri Jan 05 04:07:59 UTC 2024","3043","","Login: [FNN-574] Log in from the Login page Negative","","Login: [FNN-574] Log in from the Login page Negative","should log in with wrong email format","should log in with wrong email format",""
"passed","Fri Jan 05 05:04:09 UTC 2024","Fri Jan 05 05:05:23 UTC 2024","73161","","Freelancer search: [FNN-924] Freelancer search as CR user","","Freelancer search: [FNN-924] Freelancer search as CR user","should filter freelancers by Availability","should filter freelancers by Availability",""
"passed","Fri Jan 05 05:05:13 UTC 2024","Fri Jan 05 05:08:19 UTC 2024","185924","","My Transactions: [FNN-710] Milestones project: In advance. Positive","","My Transactions: [FNN-710] Milestones project: In advance. Positive","should start project with milestone","should start project with milestone",""
"passed","Fri Jan 05 04:26:10 UTC 2024","Fri Jan 05 04:26:14 UTC 2024","4316","","My Network: [FNN-620] Invite manually via email and sms Negative","","My Network: [FNN-620] Invite manually via email and sms Negative","should invite manually via sms with invalid phone number","should invite manually via sms with invalid phone number",""
"passed","Fri Jan 05 04:10:57 UTC 2024","Fri Jan 05 04:12:42 UTC 2024","104544","","My Profile: [FNN-669] Edit account details Positive","","My Profile: [FNN-669] Edit account details Positive","should edit freelancer account details with valid information","should edit freelancer account details with valid information",""
"passed","Fri Jan 05 05:03:25 UTC 2024","Fri Jan 05 05:04:09 UTC 2024","43993","","Freelancer search: [FNN-924] Freelancer search as CR user","","Freelancer search: [FNN-924] Freelancer search as CR user","should filter freelancers by Years of experience","should filter freelancers by Years of experience",""
"passed","Fri Jan 05 04:07:59 UTC 2024","Fri Jan 05 04:08:02 UTC 2024","2413","","Login: [FNN-563] Log in from the header Negative","","Login: [FNN-563] Log in from the header Negative","should log in without email","should log in without email",""
"passed","Fri Jan 05 04:49:31 UTC 2024","Fri Jan 05 04:49:37 UTC 2024","6104","","My Profile: [FNN-730] Request reference Negative","","My Profile: [FNN-730] Request reference Negative","should pass step 3 without 2 rating","should pass step 3 without 2 rating",""
"passed","Fri Jan 05 04:16:23 UTC 2024","Fri Jan 05 04:17:40 UTC 2024","77172","","My Profile: [FNN-795] Remove portfolio","","My Profile: [FNN-795] Remove portfolio","should remove portfolio","should remove portfolio",""
"passed","Fri Jan 05 04:44:36 UTC 2024","Fri Jan 05 04:44:41 UTC 2024","5410","","CR: [FNN-744] CR Subscribe Negative","","CR: [FNN-744] CR Subscribe Negative","should subscribe as CR without email","should subscribe as CR without email",""
"passed","Fri Jan 05 04:22:12 UTC 2024","Fri Jan 05 04:23:23 UTC 2024","71155","","Settings: [FNN-808] Cancel downgrade","","Settings: [FNN-808] Cancel downgrade","should cancel downgrade","should cancel downgrade",""
"broken","Fri Jan 05 04:46:21 UTC 2024","Fri Jan 05 04:47:22 UTC 2024","61289","","Reset password: [FNN-656] Reset password Positive","","Reset password: [FNN-656] Reset password Positive","should reset password with valid credentials","should reset password with valid credentials",""
"passed","Fri Jan 05 04:48:46 UTC 2024","Fri Jan 05 04:48:50 UTC 2024","4592","","My Profile: [FNN-730] Request reference Negative","","My Profile: [FNN-730] Request reference Negative","should pass step 2 without last name","should pass step 2 without last name",""
"passed","Fri Jan 05 04:13:45 UTC 2024","Fri Jan 05 04:15:08 UTC 2024","83417","","My Profile: [FNN-699] Request reference Positive","","My Profile: [FNN-699] Request reference Positive","should add experience and request reference","should add experience and request reference",""
"passed","Fri Jan 05 04:34:36 UTC 2024","Fri Jan 05 04:35:07 UTC 2024","31023","","[FNN-717] Edit email settings","","[FNN-717] Edit email settings","should edit Notification settings and verify that the settings are saved","should edit Notification settings and verify that the settings are saved",""
"passed","Fri Jan 05 04:50:02 UTC 2024","Fri Jan 05 04:50:08 UTC 2024","5841","","My Profile: [FNN-719] Add resume Negative","","My Profile: [FNN-719] Add resume Negative","should add education without institute","should add education without institute",""
"passed","Fri Jan 05 04:13:23 UTC 2024","Fri Jan 05 04:13:51 UTC 2024","27709","","My Profile: [FNN-690] Add resume Positive","","My Profile: [FNN-690] Add resume Positive","should check the attached part of the resume on the Profile page","should check the attached part of the resume on the Profile page",""
"passed","Fri Jan 05 04:26:03 UTC 2024","Fri Jan 05 04:26:06 UTC 2024","3203","","My Network: [FNN-620] Invite manually via email and sms Negative","","My Network: [FNN-620] Invite manually via email and sms Negative","should invite manually via email without data","should invite manually via email without data",""
"passed","Fri Jan 05 05:04:20 UTC 2024","Fri Jan 05 05:04:34 UTC 2024","14104","","My Transactions: [FNN-1430] Milestones project: In retrospect. Positive","","My Transactions: [FNN-1430] Milestones project: In retrospect. Positive","should accept the project and request payout","should accept the project and request payout",""
"passed","Fri Jan 05 04:21:58 UTC 2024","Fri Jan 05 04:23:09 UTC 2024","70929","","Settings: [FNN-680] Deactivate profile","","Settings: [FNN-680] Deactivate profile","should deactivate profile","should deactivate profile",""
"passed","Fri Jan 05 04:58:15 UTC 2024","Fri Jan 05 04:58:31 UTC 2024","16078","","Create Profile: [FNN-684] Create profile Negative","","Create Profile: [FNN-684] Create profile Negative","should create profile without required fields","should create profile without required fields",""
"passed","Fri Jan 05 05:02:39 UTC 2024","Fri Jan 05 05:03:05 UTC 2024","26346","","Freelancer search: [FNN-924] Freelancer search as CR user","","Freelancer search: [FNN-924] Freelancer search as CR user","should filter freelancers by Location","should filter freelancers by Location",""
"passed","Fri Jan 05 04:25:30 UTC 2024","Fri Jan 05 04:25:50 UTC 2024","20139","","My Network: [FNN-620] Invite manually via email and sms Negative","","My Network: [FNN-620] Invite manually via email and sms Negative","should invite manually via email without email","should invite manually via email without email",""
"passed","Fri Jan 05 04:13:12 UTC 2024","Fri Jan 05 04:13:23 UTC 2024","11104","","My Profile: [FNN-690] Add resume Positive","","My Profile: [FNN-690] Add resume Positive","should add Language","should add Language",""
"passed","Fri Jan 05 04:12:59 UTC 2024","Fri Jan 05 04:13:12 UTC 2024","12791","","My Profile: [FNN-690] Add resume Positive","","My Profile: [FNN-690] Add resume Positive","should add Expertise","should add Expertise",""
"passed","Fri Jan 05 04:48:54 UTC 2024","Fri Jan 05 04:48:57 UTC 2024","2634","","My Profile: [FNN-730] Request reference Negative","","My Profile: [FNN-730] Request reference Negative","should pass step 2 without picture","should pass step 2 without picture",""
"passed","Fri Jan 05 04:09:25 UTC 2024","Fri Jan 05 04:09:36 UTC 2024","11226","","Subscribe: [FNN-577] Subscribe Negative","","Subscribe: [FNN-577] Subscribe Negative","should subscribe with taken phone number","should subscribe with taken phone number",""
"passed","Fri Jan 05 04:33:42 UTC 2024","Fri Jan 05 04:34:36 UTC 2024","54047","","[FNN-717] Edit email settings","","[FNN-717] Edit email settings","should edit Email settings and verify that the settings are saved","should edit Email settings and verify that the settings are saved",""
"failed","Fri Jan 05 05:04:50 UTC 2024","Fri Jan 05 05:08:39 UTC 2024","228978","","My Transactions: [FNN-708] Hourly project: In advance. Positive","","My Transactions: [FNN-708] Hourly project: In advance. Positive","should start hourly project","should start hourly project",""
"passed","Fri Jan 05 04:42:42 UTC 2024","Fri Jan 05 04:43:22 UTC 2024","40382","","CR: [FNN-742] CR subscribe Positive","","CR: [FNN-742] CR subscribe Positive","should subscribe as CR with valid credentials","should subscribe as CR with valid credentials",""
"passed","Fri Jan 05 04:45:12 UTC 2024","Fri Jan 05 04:45:23 UTC 2024","10703","","CR: [FNN-744] CR Subscribe Negative","","CR: [FNN-744] CR Subscribe Negative","should subscribe as CR with taken phone number","should subscribe as CR with taken phone number",""
"passed","Fri Jan 05 04:45:23 UTC 2024","Fri Jan 05 04:45:32 UTC 2024","8528","","CR: [FNN-744] CR Subscribe Negative","","CR: [FNN-744] CR Subscribe Negative","should subscribe as CR without password","should subscribe as CR without password",""
"skipped","Fri Jan 05 04:57:14 UTC 2024","Fri Jan 05 04:57:14 UTC 2024","1","","My Network: [FNN-664] Invite freelancer","","My Network: [FNN-664] Invite freelancer","should accept an invitation","should accept an invitation",""
"passed","Fri Jan 05 04:50:52 UTC 2024","Fri Jan 05 04:51:04 UTC 2024","11239","","Post Project: [FNN-649] Post project with account Negative","","Post Project: [FNN-649] Post project with account Negative","should post project without step 2","should post project without step 2",""
"passed","Fri Jan 05 04:52:05 UTC 2024","Fri Jan 05 04:52:22 UTC 2024","16563","","Post Project: [FNN-649] Post project with account Negative","","Post Project: [FNN-649] Post project with account Negative","should post project without End date","should post project without End date",""
"passed","Fri Jan 05 04:32:48 UTC 2024","Fri Jan 05 04:33:28 UTC 2024","39827","","My Projects: [FNN-971] Complete project Positive","","My Projects: [FNN-971] Complete project Positive","should check review as freelancer user","should check review as freelancer user",""
"passed","Fri Jan 05 04:41:12 UTC 2024","Fri Jan 05 04:41:21 UTC 2024","9592","","My Transactions: [FNN-1432] Milestones project: Start project. Negative","","My Transactions: [FNN-1432] Milestones project: Start project. Negative","should start project without Way of paying","should start project without Way of paying",""
"passed","Fri Jan 05 04:45:28 UTC 2024","Fri Jan 05 04:45:36 UTC 2024","8742","","My Transactions: [FNN-738] Milestones project: Add milestone. Negative","","My Transactions: [FNN-738] Milestones project: Add milestone. Negative","should add milestone without Description","should add milestone without Description",""
"passed","Fri Jan 05 04:50:44 UTC 2024","Fri Jan 05 04:50:52 UTC 2024","8818","","Post Project: [FNN-649] Post project with account Negative","","Post Project: [FNN-649] Post project with account Negative","should post project without Category","should post project without Category",""
"failed","Fri Jan 05 04:46:09 UTC 2024","Fri Jan 05 04:47:38 UTC 2024","89053","","CR: [FNN-1888] My Dashboard page integrity as Freelancer","","CR: [FNN-1888] My Dashboard page integrity as Freelancer","should verify the integrity of the My Dashboard page as freelancer","should verify the integrity of the My Dashboard page as freelancer",""
"passed","Fri Jan 05 04:12:50 UTC 2024","Fri Jan 05 04:12:59 UTC 2024","9364","","My Profile: [FNN-690] Add resume Positive","","My Profile: [FNN-690] Add resume Positive","should add Qualities","should add Qualities",""
"passed","Fri Jan 05 04:44:23 UTC 2024","Fri Jan 05 04:44:30 UTC 2024","7180","","CR: [FNN-744] CR Subscribe Negative","","CR: [FNN-744] CR Subscribe Negative","should subscribe as CR without first name","should subscribe as CR without first name",""
"broken","Fri Jan 05 04:59:21 UTC 2024","Fri Jan 05 04:59:22 UTC 2024","761","","Freelancer search: [FNN-846] Invite to project","","Freelancer search: [FNN-846] Invite to project","""after all"" hook for [FNN-846] Invite to project","""after all"" hook for [FNN-846] Invite to project",""
"passed","Fri Jan 05 04:15:08 UTC 2024","Fri Jan 05 04:15:25 UTC 2024","16903","","My Profile: [FNN-699] Request reference Positive","","My Profile: [FNN-699] Request reference Positive","should validate reference","should validate reference",""
"broken","Fri Jan 05 05:12:55 UTC 2024","Fri Jan 05 05:14:54 UTC 2024","119218","","My Projects: [FNN-971] Complete project Positive","","My Projects: [FNN-971] Complete project Positive","""after all"" hook for [FNN-971] Complete project Positive","""after all"" hook for [FNN-971] Complete project Positive",""
"passed","Fri Jan 05 04:46:13 UTC 2024","Fri Jan 05 04:46:15 UTC 2024","2354","","CR: [FNN-751] Invite to the organization manually Negative","","CR: [FNN-751] Invite to the organization manually Negative","should invite manually via email with wrong email format","should invite manually via email with wrong email format",""
"passed","Fri Jan 05 04:25:55 UTC 2024","Fri Jan 05 04:25:59 UTC 2024","4185","","My Network: [FNN-620] Invite manually via email and sms Negative","","My Network: [FNN-620] Invite manually via email and sms Negative","should invite manually via email without first name","should invite manually via email without first name",""
"passed","Fri Jan 05 04:44:41 UTC 2024","Fri Jan 05 04:44:47 UTC 2024","5640","","CR: [FNN-744] CR Subscribe Negative","","CR: [FNN-744] CR Subscribe Negative","should subscribe as CR with wrong email format","should subscribe as CR with wrong email format",""
"passed","Fri Jan 05 04:14:20 UTC 2024","Fri Jan 05 04:16:18 UTC 2024","117986","","Upgrade: [FNN-658] Upgrade account Positive","","Upgrade: [FNN-658] Upgrade account Positive","should upgrade account to Enterprise 1 month","should upgrade account to Enterprise 1 month",""
"passed","Fri Jan 05 04:07:31 UTC 2024","Fri Jan 05 04:07:53 UTC 2024","21648","","Login: [FNN-563] Log in from the header Negative","","Login: [FNN-563] Log in from the header Negative","should log in with valid email and invalid password","should log in with valid email and invalid password",""
