"Status","Start Time","Stop Time","Duration in ms","Parent Suite","Suite","Sub Suite","Test Class","Test Method","Name","Description"
"passed","Tue May 14 04:23:10 UTC 2024","Tue May 14 04:23:26 UTC 2024","16393","","My Profile: [FNN-730] Request reference Negative","","My Profile: [FNN-730] Request reference Negative","should pass step 3 without data","should pass step 3 without data",""
"failed","Tue May 14 05:10:35 UTC 2024","Tue May 14 05:11:17 UTC 2024","42469","","Post Project: [FNN-588] Post project without account Negative","","Post Project: [FNN-588] Post project without account Negative","should post project with taken email","should post project with taken email",""
"passed","Tue May 14 04:33:04 UTC 2024","Tue May 14 04:33:19 UTC 2024","14709","","Search Project: [FNN-568] Project search","","Search Project: [FNN-568] Project search","should filter projects by Search terms","should filter projects by Search terms",""
"failed","Tue May 14 05:08:48 UTC 2024","Tue May 14 05:09:30 UTC 2024","42382","","Post Project: Post Project Positive","","Post Project: Post Project Positive","[FNN-650][FNN-2423] User receives the Project posted letter","[FNN-650][FNN-2423] User receives the Project posted letter",""
"passed","Tue May 14 04:21:34 UTC 2024","Tue May 14 04:23:24 UTC 2024","109714","","My Profile: [FNN-795] Remove portfolio","","My Profile: [FNN-795] Remove portfolio","should remove portfolio","should remove portfolio",""
"passed","Tue May 14 04:25:26 UTC 2024","Tue May 14 04:26:54 UTC 2024","87860","","Settings: [FNN-671] Change email address Positive","","Settings: [FNN-671] Change email address Positive","should change email address with valid credentials","should change email address with valid credentials",""
"passed","Tue May 14 04:31:06 UTC 2024","Tue May 14 04:32:21 UTC 2024","74567","","Settings: [FNN-676] Change profile settings","","Settings: [FNN-676] Change profile settings","i don't want to display my profile in the database","i don't want to display my profile in the database",""
"passed","Tue May 14 04:29:39 UTC 2024","Tue May 14 04:29:41 UTC 2024","2551","","Settings: [FNN-678] Delete account without subscription","","Settings: [FNN-678] Delete account without subscription","should receive a ""account deleted"" letter","should receive a ""account deleted"" letter",""
"passed","Tue May 14 05:04:47 UTC 2024","Tue May 14 05:05:18 UTC 2024","31053","","Subscribe: Subscribe Positive","","Subscribe: Subscribe Positive","[FNN-2387] Professional receives Verify email letter","[FNN-2387] Professional receives Verify email letter",""
"passed","Tue May 14 05:08:06 UTC 2024","Tue May 14 05:09:08 UTC 2024","61976","","Post Project: [FNN-588] Post project without account Negative","","Post Project: [FNN-588] Post project without account Negative","should post project without account details","should post project without account details",""
"passed","Tue May 14 04:16:26 UTC 2024","Tue May 14 04:16:46 UTC 2024","20567","","My Profile: [FNN-690] Add resume Positive","","My Profile: [FNN-690] Add resume Positive","should add Experience","should add Experience",""
"passed","Tue May 14 04:41:25 UTC 2024","Tue May 14 04:42:22 UTC 2024","57679","","Freelancer search: [FNN-815] Freelancer search as non-CR user","","Freelancer search: [FNN-815] Freelancer search as non-CR user","should filter freelancers by Skills","should filter freelancers by Skills",""
"passed","Tue May 14 04:46:23 UTC 2024","Tue May 14 04:46:28 UTC 2024","4451","","Create Profile: [FNN-684] Create profile Negative","","Create Profile: [FNN-684] Create profile Negative","should create profile with wrong website","should create profile with wrong website",""
"skipped","Tue May 14 04:50:01 UTC 2024","Tue May 14 04:50:01 UTC 2024","2","","[FNN-667] Send contact","","[FNN-667] Send contact","should forward the contact request","should forward the contact request",""
"passed","Tue May 14 05:08:54 UTC 2024","Tue May 14 05:09:00 UTC 2024","6221","","My Profile: [FNN-719] Add resume Negative","","My Profile: [FNN-719] Add resume Negative","should add certificate without certificate","should add certificate without certificate",""
"passed","Tue May 14 04:19:41 UTC 2024","Tue May 14 04:21:52 UTC 2024","131566","","My Profile: [FNN-669] Edit account details Positive","","My Profile: [FNN-669] Edit account details Positive","should edit cr account details with valid information","should edit cr account details with valid information",""
"passed","Tue May 14 04:50:05 UTC 2024","Tue May 14 04:52:57 UTC 2024","171902","","[FNN-661] Send interest","","[FNN-661] Send interest","should check if the Freelancer user on the project","should check if the Freelancer user on the project",""
"passed","Tue May 14 04:44:16 UTC 2024","Tue May 14 04:45:20 UTC 2024","63568","","Freelancer search: [FNN-822] Send message","","Freelancer search: [FNN-822] Send message","should check the message as the Freelancer user","should check the message as the Freelancer user",""
"broken","Tue May 14 05:15:45 UTC 2024","Tue May 14 05:18:19 UTC 2024","153297","","[FNN-743] Archive and restore message","","[FNN-743] Archive and restore message","""before all"" hook for [FNN-743] Archive and restore message","""before all"" hook for [FNN-743] Archive and restore message",""
"passed","Tue May 14 04:23:55 UTC 2024","Tue May 14 04:24:05 UTC 2024","10218","","My Profile: [FNN-730] Request reference Negative","","My Profile: [FNN-730] Request reference Negative","should pass step 3 without 2 rating","should pass step 3 without 2 rating",""
"passed","Tue May 14 04:25:51 UTC 2024","Tue May 14 04:26:46 UTC 2024","55029","","Settings: [FNN-672] Change email address Negative","","Settings: [FNN-672] Change email address Negative","should change email address without password","should change email address without password",""
"passed","Tue May 14 05:16:47 UTC 2024","Tue May 14 05:17:49 UTC 2024","62666","","Freelancer search: [FNN-816] Create list Functionality","","Freelancer search: [FNN-816] Create list Functionality","should remove created list","should remove created list",""
"passed","Tue May 14 04:14:01 UTC 2024","Tue May 14 04:16:32 UTC 2024","150899","","My Profile: [FNN-669] Edit account details Positive","","My Profile: [FNN-669] Edit account details Positive","should edit freelancer account details with valid information","should edit freelancer account details with valid information",""
"passed","Tue May 14 05:05:53 UTC 2024","Tue May 14 05:05:56 UTC 2024","3236","","My Profile: [FNN-668] Edit account details Negative","","My Profile: [FNN-668] Edit account details Negative","should edit account details without sector","should edit account details without sector",""
"passed","Tue May 14 04:16:32 UTC 2024","Tue May 14 04:19:41 UTC 2024","189240","","My Profile: [FNN-669] Edit account details Positive","","My Profile: [FNN-669] Edit account details Positive","should edit employer account details with valid information","should edit employer account details with valid information",""
"broken","Tue May 14 05:28:25 UTC 2024","Tue May 14 05:28:37 UTC 2024","12283","","My Transactions: [FNN-737] Hourly project: Start project. Negative","","My Transactions: [FNN-737] Hourly project: Start project. Negative","should start project without Hours per period","should start project without Hours per period",""
"passed","Tue May 14 04:16:12 UTC 2024","Tue May 14 04:16:44 UTC 2024","32163","","Upgrade: [FNN-659] Upgrade account Negative","","Upgrade: [FNN-659] Upgrade account Negative","should upgrade account to Standard 1 month: Incorrect number decline","should upgrade account to Standard 1 month: Incorrect number decline",""
"passed","Tue May 14 05:10:06 UTC 2024","Tue May 14 05:14:09 UTC 2024","243574","","My Network: [FNN-664] Invite freelancer","","My Network: [FNN-664] Invite freelancer","should invite freelancer","should invite freelancer",""
"passed","Tue May 14 05:09:52 UTC 2024","Tue May 14 05:10:13 UTC 2024","20628","","Post Project: [FNN-588] Post project without account Negative","","Post Project: [FNN-588] Post project without account Negative","should post project without email","should post project without email",""
"passed","Tue May 14 04:41:00 UTC 2024","Tue May 14 04:41:25 UTC 2024","24652","","Freelancer search: [FNN-815] Freelancer search as non-CR user","","Freelancer search: [FNN-815] Freelancer search as non-CR user","should filter freelancers by Hourly Rate","should filter freelancers by Hourly Rate",""
"broken","Tue May 14 05:16:58 UTC 2024","Tue May 14 05:22:23 UTC 2024","324770","","My Transactions: [FNN-1430] Milestones project: In retrospect. Positive","","My Transactions: [FNN-1430] Milestones project: In retrospect. Positive","should start project with milestone","should start project with milestone",""
"passed","Tue May 14 05:02:53 UTC 2024","Tue May 14 05:02:56 UTC 2024","2310","","CR: [FNN-744] CR Subscribe Negative","","CR: [FNN-744] CR Subscribe Negative","should subscribe as CR without data","should subscribe as CR without data",""
"skipped","Tue May 14 05:24:40 UTC 2024","Tue May 14 05:24:40 UTC 2024","1","","My Transactions: [FNN-708] Hourly project: In advance. Positive","","My Transactions: [FNN-708] Hourly project: In advance. Positive","should approve the time and pay for extra money","should approve the time and pay for extra money",""
"passed","Tue May 14 04:11:57 UTC 2024","Tue May 14 04:12:09 UTC 2024","11930","","Reset password: [FNN-655] Reset password Negative","","Reset password: [FNN-655] Reset password Negative","should reset password without data","should reset password without data",""
"passed","Tue May 14 05:09:25 UTC 2024","Tue May 14 05:10:00 UTC 2024","34914","","My Profile: [FNN-719] Add resume Negative","","My Profile: [FNN-719] Add resume Negative","should add language without reading level","should add language without reading level",""
"broken","Tue May 14 05:14:41 UTC 2024","Tue May 14 05:16:47 UTC 2024","126556","","Create Profile: [FNN-683] Create profile Positive","","Create Profile: [FNN-683] Create profile Positive","should create profile with valid data","should create profile with valid data",""
"passed","Tue May 14 04:26:46 UTC 2024","Tue May 14 04:27:02 UTC 2024","16364","","Settings: [FNN-672] Change email address Negative","","Settings: [FNN-672] Change email address Negative","should change email address with invalid email format","should change email address with invalid email format",""
"passed","Tue May 14 04:58:42 UTC 2024","Tue May 14 05:00:00 UTC 2024","77719","","CR: [FNN-744] CR Subscribe Negative","","CR: [FNN-744] CR Subscribe Negative","should subscribe as CR without sector","should subscribe as CR without sector",""
"passed","Tue May 14 04:14:32 UTC 2024","Tue May 14 04:14:44 UTC 2024","12226","","Subscribe: [FNN-577] Subscribe Negative","","Subscribe: [FNN-577] Subscribe Negative","should subscribe without agreeing to the Terms and Conditions","should subscribe without agreeing to the Terms and Conditions",""
"passed","Tue May 14 04:09:10 UTC 2024","Tue May 14 04:09:13 UTC 2024","3738","","Login: [FNN-574] Log in from the Login page Negative","","Login: [FNN-574] Log in from the Login page Negative","should log in without password","should log in without password",""
"passed","Tue May 14 05:05:27 UTC 2024","Tue May 14 05:07:58 UTC 2024","151484","","My Profile: [FNN-793] Remove resume","","My Profile: [FNN-793] Remove resume","should remove resume","should remove resume",""
"passed","Tue May 14 05:01:40 UTC 2024","Tue May 14 05:01:56 UTC 2024","15358","","CR: [FNN-744] CR Subscribe Negative","","CR: [FNN-744] CR Subscribe Negative","should subscribe as CR with taken phone number","should subscribe as CR with taken phone number",""
"passed","Tue May 14 04:12:07 UTC 2024","Tue May 14 04:12:57 UTC 2024","49748","","Reset password: Reset password Positive","","Reset password: Reset password Positive","[FNN-656] Forgot password button functionality","[FNN-656] Forgot password button functionality",""
"passed","Tue May 14 04:25:56 UTC 2024","Tue May 14 04:26:15 UTC 2024","19304","","Post Project: [FNN-649] Post project with account Negative","","Post Project: [FNN-649] Post project with account Negative","should post project without Location","should post project without Location",""
"passed","Tue May 14 04:30:29 UTC 2024","Tue May 14 04:33:04 UTC 2024","155244","","Search Project: [FNN-568] Project search","","Search Project: [FNN-568] Project search","should filter projects by Category","should filter projects by Category",""
"passed","Tue May 14 05:16:45 UTC 2024","Tue May 14 05:18:41 UTC 2024","115648","","My Projects: [FNN-1058] Complete project Negative","","My Projects: [FNN-1058] Complete project Negative","should complete project with short Comments","should complete project with short Comments",""
"passed","Tue May 14 04:45:26 UTC 2024","Tue May 14 04:46:14 UTC 2024","47958","","Create Profile: [FNN-684] Create profile Negative","","Create Profile: [FNN-684] Create profile Negative","should create profile without required fields","should create profile without required fields",""
"broken","Tue May 14 05:12:35 UTC 2024","Tue May 14 05:16:45 UTC 2024","249951","","My Projects: [FNN-1058] Complete project Negative","","My Projects: [FNN-1058] Complete project Negative","""before each"" hook for [FNN-1058] Complete project Negative","""before each"" hook for [FNN-1058] Complete project Negative",""
"passed","Tue May 14 04:47:39 UTC 2024","Tue May 14 04:47:58 UTC 2024","19642","","Freelancer search: [FNN-924] Freelancer search as CR user","","Freelancer search: [FNN-924] Freelancer search as CR user","should filter freelancers by Hourly Rate","should filter freelancers by Hourly Rate",""
"passed","Tue May 14 04:25:17 UTC 2024","Tue May 14 04:25:36 UTC 2024","19278","","Post Project: [FNN-649] Post project with account Negative","","Post Project: [FNN-649] Post project with account Negative","should post project without Budget","should post project without Budget",""
"passed","Tue May 14 05:13:23 UTC 2024","Tue May 14 05:14:18 UTC 2024","55396","","Post Project: [FNN-588] Post project without account Negative","","Post Project: [FNN-588] Post project without account Negative","should post project without passwords matching","should post project without passwords matching",""
"passed","Tue May 14 05:06:00 UTC 2024","Tue May 14 05:06:10 UTC 2024","10015","","My Profile: [FNN-668] Edit account details Negative","","My Profile: [FNN-668] Edit account details Negative","should edit account details with invalid Twitter, LinkedIn and Website urls","should edit account details with invalid Twitter, LinkedIn and Website urls",""
"passed","Tue May 14 04:12:39 UTC 2024","Tue May 14 04:13:09 UTC 2024","30167","","Upgrade: [FNN-659] Upgrade account Negative","","Upgrade: [FNN-659] Upgrade account Negative","should upgrade account to Standard 1 month: Generic decline","should upgrade account to Standard 1 month: Generic decline",""
"passed","Tue May 14 04:24:27 UTC 2024","Tue May 14 04:24:37 UTC 2024","9623","","My Profile: [FNN-730] Request reference Negative","","My Profile: [FNN-730] Request reference Negative","should pass step 3 without comments","should pass step 3 without comments",""
"failed","Tue May 14 05:14:41 UTC 2024","Tue May 14 05:15:39 UTC 2024","58364","","My Network: [FNN-664] Invite freelancer","","My Network: [FNN-664] Invite freelancer","should check network as sender user","should check network as sender user",""
"passed","Tue May 14 05:07:10 UTC 2024","Tue May 14 05:07:22 UTC 2024","11044","","My Profile: [FNN-719] Add resume Negative","","My Profile: [FNN-719] Add resume Negative","should add experience without period until","should add experience without period until",""
"passed","Tue May 14 04:24:05 UTC 2024","Tue May 14 04:24:16 UTC 2024","10816","","My Profile: [FNN-730] Request reference Negative","","My Profile: [FNN-730] Request reference Negative","should pass step 3 without 3 rating","should pass step 3 without 3 rating",""
"passed","Tue May 14 04:36:48 UTC 2024","Tue May 14 04:36:54 UTC 2024","6633","","My Network: [FNN-620] Invite manually via email and sms Negative","","My Network: [FNN-620] Invite manually via email and sms Negative","should invite manually via sms with invalid phone number","should invite manually via sms with invalid phone number",""
"passed","Tue May 14 04:35:34 UTC 2024","Tue May 14 04:36:21 UTC 2024","47281","","My Network: [FNN-620] Invite manually via email and sms Negative","","My Network: [FNN-620] Invite manually via email and sms Negative","should invite manually via email without email","should invite manually via email without email",""
"passed","Tue May 14 04:27:02 UTC 2024","Tue May 14 04:27:50 UTC 2024","47979","","Settings: [FNN-672] Change email address Negative","","Settings: [FNN-672] Change email address Negative","should change email address with wrong password","should change email address with wrong password",""
"passed","Tue May 14 05:06:34 UTC 2024","Tue May 14 05:06:37 UTC 2024","2904","","My Profile: [FNN-719] Add resume Negative","","My Profile: [FNN-719] Add resume Negative","should add experience without data","should add experience without data",""
"passed","Tue May 14 05:00:12 UTC 2024","Tue May 14 05:00:25 UTC 2024","12503","","CR: [FNN-744] CR Subscribe Negative","","CR: [FNN-744] CR Subscribe Negative","should subscribe as CR without first name","should subscribe as CR without first name",""
"passed","Tue May 14 04:25:04 UTC 2024","Tue May 14 04:25:17 UTC 2024","13448","","Post Project: [FNN-649] Post project with account Negative","","Post Project: [FNN-649] Post project with account Negative","should post project without step 2","should post project without step 2",""
"skipped","Tue May 14 05:27:23 UTC 2024","Tue May 14 05:27:23 UTC 2024","1","","My Transactions: [FNN-710] Milestones project: In advance. Positive","","My Transactions: [FNN-710] Milestones project: In advance. Positive","should accept the project","should accept the project",""
"passed","Tue May 14 04:09:38 UTC 2024","Tue May 14 04:10:11 UTC 2024","33299","","Login: [FNN-563] Log in from the header Negative","","Login: [FNN-563] Log in from the header Negative","should log in without credentials","should log in without credentials",""
"passed","Tue May 14 04:24:25 UTC 2024","Tue May 14 04:24:39 UTC 2024","13996","","Post Project: [FNN-649] Post project with account Negative","","Post Project: [FNN-649] Post project with account Negative","should post project without Title","should post project without Title",""
"broken","Tue May 14 05:17:43 UTC 2024","Tue May 14 05:23:03 UTC 2024","319842","","My Transactions: [FNN-1431] Hourly project: In retrospect. Positive","","My Transactions: [FNN-1431] Hourly project: In retrospect. Positive","should start hourly project","should start hourly project",""
"passed","Tue May 14 04:11:07 UTC 2024","Tue May 14 04:13:09 UTC 2024","122115","","Upgrade: Upgrade Positive","","Upgrade: Upgrade Positive","[FNN-658] Upgrade account Positive: Standaard 1 month","[FNN-658] Upgrade account Positive: Standaard 1 month",""
"passed","Tue May 14 05:08:50 UTC 2024","Tue May 14 05:08:54 UTC 2024","3263","","My Profile: [FNN-719] Add resume Negative","","My Profile: [FNN-719] Add resume Negative","should add certificate without data","should add certificate without data",""
"broken","Tue May 14 05:28:37 UTC 2024","Tue May 14 05:28:49 UTC 2024","12419","","My Transactions: [FNN-738] Milestones project: Add milestone. Negative","","My Transactions: [FNN-738] Milestones project: Add milestone. Negative","should add milestone without Delivery date","should add milestone without Delivery date",""
"passed","Tue May 14 04:34:54 UTC 2024","Tue May 14 04:37:25 UTC 2024","150611","","Search Project: [FNN-568] Project search","","Search Project: [FNN-568] Project search","should filter projects by Number of responses","should filter projects by Number of responses",""
"passed","Tue May 14 04:27:01 UTC 2024","Tue May 14 04:28:10 UTC 2024","68379","","Settings: [FNN-673] Confirm email address","","Settings: [FNN-673] Confirm email address","should confirm email address","should confirm email address",""
"passed","Tue May 14 04:10:36 UTC 2024","Tue May 14 04:11:46 UTC 2024","70481","","Subscribe: [FNN-577] Subscribe Negative","","Subscribe: [FNN-577] Subscribe Negative","should subscribe without category","should subscribe without category",""
"skipped","Tue May 14 05:27:23 UTC 2024","Tue May 14 05:27:23 UTC 2024","0","","My Transactions: [FNN-710] Milestones project: In advance. Positive","","My Transactions: [FNN-710] Milestones project: In advance. Positive","should request payout","should request payout",""
"passed","Tue May 14 05:18:19 UTC 2024","Tue May 14 05:19:07 UTC 2024","48511","","[FNN-743] Archive and restore message","","[FNN-743] Archive and restore message","should restore the message","should restore the message",""
"passed","Tue May 14 04:26:35 UTC 2024","Tue May 14 04:26:55 UTC 2024","20456","","Post Project: [FNN-649] Post project with account Negative","","Post Project: [FNN-649] Post project with account Negative","should post project without End date","should post project without End date",""
"skipped","Tue May 14 05:23:03 UTC 2024","Tue May 14 05:23:03 UTC 2024","2","","My Transactions: [FNN-1431] Hourly project: In retrospect. Positive","","My Transactions: [FNN-1431] Hourly project: In retrospect. Positive","should accept the project and add hours","should accept the project and add hours",""
"passed","Tue May 14 04:24:39 UTC 2024","Tue May 14 04:24:54 UTC 2024","15488","","Post Project: [FNN-649] Post project with account Negative","","Post Project: [FNN-649] Post project with account Negative","should post project with short Title","should post project with short Title",""
"failed","Tue May 14 05:03:03 UTC 2024","Tue May 14 05:05:25 UTC 2024","141361","","CR: [FNN-1779] My Dashboard page integrity as Employer","","CR: [FNN-1779] My Dashboard page integrity as Employer","should verify the integrity of the My Dashboard page as employer","should verify the integrity of the My Dashboard page as employer",""
"passed","Tue May 14 04:34:28 UTC 2024","Tue May 14 04:34:35 UTC 2024","6338","","Search Project: [FNN-568] Project search","","Search Project: [FNN-568] Project search","should filter projects by Status Open projects","should filter projects by Status Open projects",""
"passed","Tue May 14 05:06:37 UTC 2024","Tue May 14 05:06:50 UTC 2024","13250","","My Profile: [FNN-719] Add resume Negative","","My Profile: [FNN-719] Add resume Negative","should add experience without position","should add experience without position",""
"passed","Tue May 14 05:28:22 UTC 2024","Tue May 14 05:28:37 UTC 2024","15770","","CR: Invite Positive","","CR: Invite Positive","[FNN-749][FNN-2401] Accept manual invitation to organization","[FNN-749][FNN-2401] Accept manual invitation to organization",""
"skipped","Tue May 14 05:23:03 UTC 2024","Tue May 14 05:23:03 UTC 2024","4","","My Transactions: [FNN-1431] Hourly project: In retrospect. Positive","","My Transactions: [FNN-1431] Hourly project: In retrospect. Positive","should approve the time and pay deposits","should approve the time and pay deposits",""
"passed","Tue May 14 05:05:34 UTC 2024","Tue May 14 05:06:34 UTC 2024","59970","","My Profile: [FNN-719] Add resume Negative","","My Profile: [FNN-719] Add resume Negative","should add CV without CV","should add CV without CV",""
"passed","Tue May 14 04:12:09 UTC 2024","Tue May 14 04:12:14 UTC 2024","4264","","Reset password: [FNN-655] Reset password Negative","","Reset password: [FNN-655] Reset password Negative","should reset password with wrong email","should reset password with wrong email",""
"failed","Tue May 14 05:10:34 UTC 2024","Tue May 14 05:10:39 UTC 2024","4477","","My Network: Invite via Email","","My Network: Invite via Email","[FNN-1232][FNN-2450] User receives the Network invitation letter","[FNN-1232][FNN-2450] User receives the Network invitation letter",""
"skipped","Tue May 14 04:31:43 UTC 2024","Tue May 14 04:37:51 UTC 2024","367415","","My Network: [FNN-1027] Invite freelancers","","My Network: [FNN-1027] Invite freelancers","should invite multiple freelancers","should invite multiple freelancers",""
"passed","Tue May 14 04:17:27 UTC 2024","Tue May 14 04:17:34 UTC 2024","7381","","My Profile: [FNN-690] Add resume Positive","","My Profile: [FNN-690] Add resume Positive","should add Expertise","should add Expertise",""
"passed","Tue May 14 05:24:37 UTC 2024","Tue May 14 05:28:19 UTC 2024","221666","","CR: Invite Positive","","CR: Invite Positive","[FNN-749] Invite to the organization manually","[FNN-749] Invite to the organization manually",""
"passed","Tue May 14 04:37:33 UTC 2024","Tue May 14 04:39:55 UTC 2024","142567","","My Projects: [FNN-1093] Pause project","","My Projects: [FNN-1093] Pause project","should pause the project","should pause the project",""
"passed","Tue May 14 05:12:41 UTC 2024","Tue May 14 05:13:02 UTC 2024","20885","","Post Project: [FNN-588] Post project without account Negative","","Post Project: [FNN-588] Post project without account Negative","should post project without repeat password","should post project without repeat password",""
"passed","Tue May 14 05:02:38 UTC 2024","Tue May 14 05:02:44 UTC 2024","5771","","CR: [FNN-751] Invite to the organization manually Negative","","CR: [FNN-751] Invite to the organization manually Negative","should invite manually via email with wrong email format","should invite manually via email with wrong email format",""
"passed","Tue May 14 04:17:39 UTC 2024","Tue May 14 04:19:23 UTC 2024","103987","","My Profile: [FNN-698] Confirm phone number Positive","","My Profile: [FNN-698] Confirm phone number Positive","should confirm phone number with valid code","should confirm phone number with valid code",""
