"Status","Start Time","Stop Time","Duration in ms","Parent Suite","Suite","Sub Suite","Test Class","Test Method","Name","Description"
"passed","Sun Jun 09 04:47:05 UTC 2024","Sun Jun 09 04:47:31 UTC 2024","25323","","Freelancer search: [FNN-924] Freelancer search as CR user","","Freelancer search: [FNN-924] Freelancer search as CR user","should filter freelancers by Location","should filter freelancers by Location",""
"passed","Sun Jun 09 05:12:38 UTC 2024","Sun Jun 09 05:12:54 UTC 2024","16534","","Post Project: [FNN-588] Post project without account Negative","","Post Project: [FNN-588] Post project without account Negative","should post project without phone number","should post project without phone number",""
"passed","Sun Jun 09 05:13:32 UTC 2024","Sun Jun 09 05:13:34 UTC 2024","1814","","My Network: Invite via SMS","","My Network: Invite via SMS","[FNN-2455] Invite manually via sms with signup bonus","[FNN-2455] Invite manually via sms with signup bonus",""
"passed","Sun Jun 09 04:09:59 UTC 2024","Sun Jun 09 04:10:04 UTC 2024","5040","","Login: [FNN-563] Log in from the header Negative","","Login: [FNN-563] Log in from the header Negative","should log in with invalid credentials","should log in with invalid credentials",""
"passed","Sun Jun 09 05:17:41 UTC 2024","Sun Jun 09 05:24:22 UTC 2024","401808","","My Transactions: [FNN-738] Milestones project: Add milestone. Negative","","My Transactions: [FNN-738] Milestones project: Add milestone. Negative","should add milestone without Amount, Delivery date, and Description","should add milestone without Amount, Delivery date, and Description",""
"passed","Sun Jun 09 04:09:34 UTC 2024","Sun Jun 09 04:09:40 UTC 2024","6204","","Login: [FNN-574] Log in from the Login page Negative","","Login: [FNN-574] Log in from the Login page Negative","should log in with invalid credentials","should log in with invalid credentials",""
"skipped","Sun Jun 09 05:24:04 UTC 2024","Sun Jun 09 05:25:22 UTC 2024","77222","","CR: Invite Positive","","CR: Invite Positive","[FNN-750][FNN-2405] Check the invited user is in the organization","[FNN-750][FNN-2405] Check the invited user is in the organization",""
"passed","Sun Jun 09 04:45:54 UTC 2024","Sun Jun 09 04:46:09 UTC 2024","15122","","Freelancer search: [FNN-846] Invite to project","","Freelancer search: [FNN-846] Invite to project","should check the invitation and send an interest of the project","should check the invitation and send an interest of the project",""
"passed","Sun Jun 09 05:28:22 UTC 2024","Sun Jun 09 05:30:10 UTC 2024","108096","","My Transactions: [FNN-1430] Milestones project: In retrospect. Positive","","My Transactions: [FNN-1430] Milestones project: In retrospect. Positive","should accept the project and request payout","should accept the project and request payout",""
"passed","Sun Jun 09 04:29:29 UTC 2024","Sun Jun 09 04:30:21 UTC 2024","52408","","Post Project: [FNN-649] Post project with account Negative","","Post Project: [FNN-649] Post project with account Negative","should post project with short Description","should post project with short Description",""
"passed","Sun Jun 09 04:15:51 UTC 2024","Sun Jun 09 04:17:27 UTC 2024","95292","","My Profile: [FNN-695] Add portfolio Positive","","My Profile: [FNN-695] Add portfolio Positive","should add portfolio","should add portfolio",""
"passed","Sun Jun 09 05:24:39 UTC 2024","Sun Jun 09 05:25:00 UTC 2024","20975","","My Transactions: [FNN-738] Milestones project: Add milestone. Negative","","My Transactions: [FNN-738] Milestones project: Add milestone. Negative","should add milestone with Amount less than 250","should add milestone with Amount less than 250",""
"passed","Sun Jun 09 04:26:30 UTC 2024","Sun Jun 09 04:27:09 UTC 2024","39018","","Post Project: [FNN-649] Post project with account Negative","","Post Project: [FNN-649] Post project with account Negative","should post project without step 1","should post project without step 1",""
"passed","Sun Jun 09 04:47:31 UTC 2024","Sun Jun 09 04:47:54 UTC 2024","23684","","Freelancer search: [FNN-924] Freelancer search as CR user","","Freelancer search: [FNN-924] Freelancer search as CR user","should filter freelancers by Hourly Rate","should filter freelancers by Hourly Rate",""
"passed","Sun Jun 09 04:23:25 UTC 2024","Sun Jun 09 04:24:04 UTC 2024","38588","","My Profile: [FNN-718] Add portfolio Negative","","My Profile: [FNN-718] Add portfolio Negative","should add portfolio without Type","should add portfolio without Type",""
"passed","Sun Jun 09 04:21:35 UTC 2024","Sun Jun 09 04:22:41 UTC 2024","65126","","My Profile: [FNN-690] Add resume Positive","","My Profile: [FNN-690] Add resume Positive","should check the attached part of the resume on the Profile page","should check the attached part of the resume on the Profile page",""
"skipped","Sun Jun 09 04:47:01 UTC 2024","Sun Jun 09 04:47:01 UTC 2024","0","","[FNN-667] Send contact","","[FNN-667] Send contact","should forward the contact request","should forward the contact request",""
"passed","Sun Jun 09 04:37:36 UTC 2024","Sun Jun 09 04:38:12 UTC 2024","36064","","My Network: [FNN-620] Invite manually via email and sms Negative","","My Network: [FNN-620] Invite manually via email and sms Negative","should invite manually via sms without data","should invite manually via sms without data",""
"passed","Sun Jun 09 04:37:28 UTC 2024","Sun Jun 09 04:37:36 UTC 2024","8186","","My Network: [FNN-620] Invite manually via email and sms Negative","","My Network: [FNN-620] Invite manually via email and sms Negative","should invite manually via sms with invalid phone number","should invite manually via sms with invalid phone number",""
"passed","Sun Jun 09 04:19:10 UTC 2024","Sun Jun 09 04:20:46 UTC 2024","96465","","My Profile: [FNN-699] Request reference Positive","","My Profile: [FNN-699] Request reference Positive","should add experience and request reference","should add experience and request reference",""
"passed","Sun Jun 09 05:11:42 UTC 2024","Sun Jun 09 05:12:03 UTC 2024","21486","","My Profile: [FNN-730] Request reference Negative","","My Profile: [FNN-730] Request reference Negative","should pass step 3 without 1 rating","should pass step 3 without 1 rating",""
"passed","Sun Jun 09 05:05:50 UTC 2024","Sun Jun 09 05:06:21 UTC 2024","30853","","Upgrade: [FNN-659] Upgrade account Negative","","Upgrade: [FNN-659] Upgrade account Negative","should upgrade account to Standard 1 month: Stolen card decline","should upgrade account to Standard 1 month: Stolen card decline",""
"failed","Sun Jun 09 05:07:25 UTC 2024","Sun Jun 09 05:07:49 UTC 2024","23686","","My Profile: [FNN-719] Add resume Negative","","My Profile: [FNN-719] Add resume Negative","should add education without data","should add education without data",""
"failed","Sun Jun 09 05:00:13 UTC 2024","Sun Jun 09 05:02:15 UTC 2024","122309","","Dashboard: [FNN-1888] My Dashboard page integrity as Freelancer","","Dashboard: [FNN-1888] My Dashboard page integrity as Freelancer","should verify the integrity of the My Dashboard page as freelancer","should verify the integrity of the My Dashboard page as freelancer",""
"passed","Sun Jun 09 04:59:06 UTC 2024","Sun Jun 09 04:59:12 UTC 2024","6158","","CR: [FNN-751] Invite to the organization manually Negative","","CR: [FNN-751] Invite to the organization manually Negative","should invite manually via email with wrong email format","should invite manually via email with wrong email format",""
"passed","Sun Jun 09 05:24:22 UTC 2024","Sun Jun 09 05:24:29 UTC 2024","6154","","My Transactions: [FNN-738] Milestones project: Add milestone. Negative","","My Transactions: [FNN-738] Milestones project: Add milestone. Negative","should add milestone without Amount","should add milestone without Amount",""
"passed","Sun Jun 09 04:50:22 UTC 2024","Sun Jun 09 04:50:45 UTC 2024","23046","","Freelancer search: [FNN-924] Freelancer search as CR user","","Freelancer search: [FNN-924] Freelancer search as CR user","should filter freelancers by Minimum references","should filter freelancers by Minimum references",""
"passed","Sun Jun 09 05:06:57 UTC 2024","Sun Jun 09 05:07:06 UTC 2024","9212","","My Profile: [FNN-719] Add resume Negative","","My Profile: [FNN-719] Add resume Negative","should add experience without company","should add experience without company",""
"passed","Sun Jun 09 05:02:15 UTC 2024","Sun Jun 09 05:03:23 UTC 2024","68111","","My Profile: [FNN-668] Edit account details Negative","","My Profile: [FNN-668] Edit account details Negative","should edit account details without required fields","should edit account details without required fields",""
"passed","Sun Jun 09 05:01:13 UTC 2024","Sun Jun 09 05:01:32 UTC 2024","18447","","Subscribe: Subscribe Positive","","Subscribe: Subscribe Positive","[FNN-578] Subscribe with valid credentials","[FNN-578] Subscribe with valid credentials",""
"passed","Sun Jun 09 05:32:20 UTC 2024","Sun Jun 09 05:32:30 UTC 2024","9840","","My Transactions: [FNN-1430] Milestones project: In retrospect. Positive","","My Transactions: [FNN-1430] Milestones project: In retrospect. Positive","should verify that the money paid","should verify that the money paid",""
"passed","Sun Jun 09 04:59:15 UTC 2024","Sun Jun 09 05:01:27 UTC 2024","132410","","My Transactions: [FNN-708] Hourly project: In advance. Positive","","My Transactions: [FNN-708] Hourly project: In advance. Positive","should pay deposit","should pay deposit",""
"passed","Sun Jun 09 04:13:25 UTC 2024","Sun Jun 09 04:13:35 UTC 2024","10339","","Subscribe: [FNN-577] Subscribe Negative","","Subscribe: [FNN-577] Subscribe Negative","should subscribe with wrong phone number","should subscribe with wrong phone number",""
"passed","Sun Jun 09 05:01:07 UTC 2024","Sun Jun 09 05:01:10 UTC 2024","2687","","CR: [FNN-744] CR Subscribe Negative","","CR: [FNN-744] CR Subscribe Negative","should subscribe as CR without data","should subscribe as CR without data",""
"passed","Sun Jun 09 05:17:20 UTC 2024","Sun Jun 09 05:24:13 UTC 2024","412698","","My Transactions: [FNN-710] Milestones project: In advance. Positive","","My Transactions: [FNN-710] Milestones project: In advance. Positive","should start project with milestone","should start project with milestone",""
"passed","Sun Jun 09 05:11:25 UTC 2024","Sun Jun 09 05:11:42 UTC 2024","17050","","My Profile: [FNN-730] Request reference Negative","","My Profile: [FNN-730] Request reference Negative","should pass step 3 without data","should pass step 3 without data",""
"passed","Sun Jun 09 04:34:35 UTC 2024","Sun Jun 09 04:35:37 UTC 2024","62376","","My Network: Invite via Email without message","","My Network: Invite via Email without message","[FNN-1233] Invite manually via email with custom message with signup bonus","[FNN-1233] Invite manually via email with custom message with signup bonus",""
"passed","Sun Jun 09 04:56:30 UTC 2024","Sun Jun 09 04:56:35 UTC 2024","4234","","My Transactions: [FNN-1439] Hourly project: Add time. Negative","","My Transactions: [FNN-1439] Hourly project: Add time. Negative","should add hours without Date","should add hours without Date",""
"skipped","Sun Jun 09 04:37:57 UTC 2024","Sun Jun 09 04:37:57 UTC 2024","0","","My Projects: [FNN-1058] Complete project Negative","","My Projects: [FNN-1058] Complete project Negative","should complete project without Communication","should complete project without Communication",""
"passed","Sun Jun 09 05:12:18 UTC 2024","Sun Jun 09 05:12:38 UTC 2024","19897","","Post Project: [FNN-588] Post project without account Negative","","Post Project: [FNN-588] Post project without account Negative","should post project with taken email","should post project with taken email",""
"passed","Sun Jun 09 04:46:09 UTC 2024","Sun Jun 09 04:47:39 UTC 2024","89753","","Freelancer search: [FNN-846] Invite to project","","Freelancer search: [FNN-846] Invite to project","should verify if the ""Assign project"" button is enable","should verify if the ""Assign project"" button is enable",""
"passed","Sun Jun 09 05:23:09 UTC 2024","Sun Jun 09 05:23:11 UTC 2024","2800","","CR: Invite Positive","","CR: Invite Positive","[FNN-749][FNN-2400] User receives the Invitation to organization letter","[FNN-749][FNN-2400] User receives the Invitation to organization letter",""
"failed","Sun Jun 09 05:15:40 UTC 2024","Sun Jun 09 05:18:09 UTC 2024","149123","","My Transactions: [FNN-1432] Milestones project: Start project. Negative","","My Transactions: [FNN-1432] Milestones project: Start project. Negative","""before all"" hook for [FNN-1432] Milestones project: Start project. Negative","""before all"" hook for [FNN-1432] Milestones project: Start project. Negative",""
"passed","Sun Jun 09 04:09:45 UTC 2024","Sun Jun 09 04:09:48 UTC 2024","2916","","Login: [FNN-574] Log in from the Login page Negative","","Login: [FNN-574] Log in from the Login page Negative","should log in without email","should log in without email",""
"passed","Sun Jun 09 04:31:19 UTC 2024","Sun Jun 09 04:32:12 UTC 2024","52264","","Settings: [FNN-678] Delete account without subscription","","Settings: [FNN-678] Delete account without subscription","should delete account without subscription","should delete account without subscription",""
"passed","Sun Jun 09 04:40:04 UTC 2024","Sun Jun 09 04:40:29 UTC 2024","24387","","Freelancer search: [FNN-815] Freelancer search as non-CR user","","Freelancer search: [FNN-815] Freelancer search as non-CR user","should filter freelancers by Location","should filter freelancers by Location",""
"passed","Sun Jun 09 05:07:06 UTC 2024","Sun Jun 09 05:07:16 UTC 2024","9776","","My Profile: [FNN-719] Add resume Negative","","My Profile: [FNN-719] Add resume Negative","should add experience without period from  ","should add experience without period from  ",""
"passed","Sun Jun 09 04:10:48 UTC 2024","Sun Jun 09 04:12:08 UTC 2024","79695","","Subscribe: Signup bonus","","Subscribe: Signup bonus","[FNN-2167] 500 € signup bonus","[FNN-2167] 500 € signup bonus",""
"skipped","Sun Jun 09 04:34:29 UTC 2024","Sun Jun 09 04:34:29 UTC 2024","0","","My Network: [FNN-1027] Invite freelancers","","My Network: [FNN-1027] Invite freelancers","should accept an invitation","should accept an invitation",""
"passed","Sun Jun 09 04:10:04 UTC 2024","Sun Jun 09 04:10:07 UTC 2024","3645","","Login: [FNN-563] Log in from the header Negative","","Login: [FNN-563] Log in from the header Negative","should log in with wrong email format","should log in with wrong email format",""
"passed","Sun Jun 09 04:12:20 UTC 2024","Sun Jun 09 04:12:24 UTC 2024","3968","","Reset password: [FNN-655] Reset password Negative","","Reset password: [FNN-655] Reset password Negative","should reset password with wrong email","should reset password with wrong email",""
"failed","Sun Jun 09 05:01:32 UTC 2024","Sun Jun 09 05:01:33 UTC 2024","1449","","Subscribe: Subscribe Positive","","Subscribe: Subscribe Positive","[FNN-2373] Professional receives Welcome letter","[FNN-2373] Professional receives Welcome letter",""
"passed","Sun Jun 09 05:15:01 UTC 2024","Sun Jun 09 05:15:48 UTC 2024","47396","","Post Project: [FNN-588] Post project without account Negative","","Post Project: [FNN-588] Post project without account Negative","should post project with short password and repeat password","should post project with short password and repeat password",""
"passed","Sun Jun 09 05:31:33 UTC 2024","Sun Jun 09 05:33:15 UTC 2024","102158","","My Transactions: [FNN-710] Milestones project: In advance. Positive","","My Transactions: [FNN-710] Milestones project: In advance. Positive","should verify that the money paid","should verify that the money paid",""
"failed","Sun Jun 09 05:11:40 UTC 2024","Sun Jun 09 05:11:46 UTC 2024","6059","","Post Project: Post Project without account Positive ","","Post Project: Post Project without account Positive ","[FNN-2426] User receives the Employer welcome letter","[FNN-2426] User receives the Employer welcome letter",""
"failed","Sun Jun 09 05:11:58 UTC 2024","Sun Jun 09 05:12:02 UTC 2024","4058","","My Network: Invite via Email with message","","My Network: Invite via Email with message","[FNN-1232][FNN-2450] User receives the Network invitation letter","[FNN-1232][FNN-2450] User receives the Network invitation letter",""
"passed","Sun Jun 09 04:27:31 UTC 2024","Sun Jun 09 04:27:40 UTC 2024","8663","","Post Project: [FNN-649] Post project with account Negative","","Post Project: [FNN-649] Post project with account Negative","should post project without Category","should post project without Category",""
"passed","Sun Jun 09 04:29:35 UTC 2024","Sun Jun 09 04:30:39 UTC 2024","64331","","Settings: [FNN-673] Confirm email address","","Settings: [FNN-673] Confirm email address","should confirm email address","should confirm email address",""
"passed","Sun Jun 09 05:09:31 UTC 2024","Sun Jun 09 05:10:06 UTC 2024","34677","","My Profile: [FNN-719] Add resume Negative","","My Profile: [FNN-719] Add resume Negative","should add language without reading level","should add language without reading level",""
"skipped","Sun Jun 09 04:37:57 UTC 2024","Sun Jun 09 04:38:27 UTC 2024","30093","","My Projects: [FNN-1058] Complete project Negative","","My Projects: [FNN-1058] Complete project Negative","should complete project with short Comments","should complete project with short Comments",""
"passed","Sun Jun 09 04:28:48 UTC 2024","Sun Jun 09 04:29:32 UTC 2024","43404","","Settings: [FNN-672] Change email address Negative","","Settings: [FNN-672] Change email address Negative","should change email address with wrong password","should change email address with wrong password",""
"passed","Sun Jun 09 05:08:10 UTC 2024","Sun Jun 09 05:09:08 UTC 2024","57509","","Upgrade: [FNN-659] Upgrade account Negative","","Upgrade: [FNN-659] Upgrade account Negative","should upgrade account to Standard 1 month: Exceeding velocity limit decline","should upgrade account to Standard 1 month: Exceeding velocity limit decline",""
"failed","Sun Jun 09 05:09:09 UTC 2024","Sun Jun 09 05:09:50 UTC 2024","40653","","Post Project: Post Project with account Positive","","Post Project: Post Project with account Positive","[FNN-587][FNN-2423] User receives the Project posted letter","[FNN-587][FNN-2423] User receives the Project posted letter",""
"skipped","Sun Jun 09 04:37:57 UTC 2024","Sun Jun 09 04:37:57 UTC 2024","0","","My Projects: [FNN-1058] Complete project Negative","","My Projects: [FNN-1058] Complete project Negative","should complete project without Comments","should complete project without Comments",""
"passed","Sun Jun 09 04:57:26 UTC 2024","Sun Jun 09 04:59:15 UTC 2024","109293","","My Transactions: [FNN-708] Hourly project: In advance. Positive","","My Transactions: [FNN-708] Hourly project: In advance. Positive","should accept the project","should accept the project",""
"passed","Sun Jun 09 05:03:26 UTC 2024","Sun Jun 09 05:03:30 UTC 2024","4134","","My Profile: [FNN-668] Edit account details Negative","","My Profile: [FNN-668] Edit account details Negative","should edit account details with invalid phone number","should edit account details with invalid phone number",""
"passed","Sun Jun 09 04:37:22 UTC 2024","Sun Jun 09 04:37:28 UTC 2024","5357","","My Network: [FNN-620] Invite manually via email and sms Negative","","My Network: [FNN-620] Invite manually via email and sms Negative","should invite manually via sms without phone number","should invite manually via sms without phone number",""
"passed","Sun Jun 09 04:10:28 UTC 2024","Sun Jun 09 04:11:29 UTC 2024","60784","","Login: [FNN-648] Log in from the Login page Positive","","Login: [FNN-648] Log in from the Login page Positive","should log in with valid credentials","should log in with valid credentials",""
"skipped","Sun Jun 09 04:44:57 UTC 2024","Sun Jun 09 04:47:01 UTC 2024","123919","","[FNN-667] Send contact","","[FNN-667] Send contact","should send a contact","should send a contact",""
"passed","Sun Jun 09 04:40:28 UTC 2024","Sun Jun 09 04:42:28 UTC 2024","119597","","My Projects: [FNN-1093] Pause project","","My Projects: [FNN-1093] Pause project","should verify status of the project as unregistered user","should verify status of the project as unregistered user",""
"passed","Sun Jun 09 04:20:58 UTC 2024","Sun Jun 09 04:21:35 UTC 2024","37719","","My Profile: [FNN-690] Add resume Positive","","My Profile: [FNN-690] Add resume Positive","should add Language","should add Language",""
"passed","Sun Jun 09 04:36:48 UTC 2024","Sun Jun 09 04:37:01 UTC 2024","13581","","Search Project: [FNN-568] Project search","","Search Project: [FNN-568] Project search","should filter projects by Location","should filter projects by Location",""
"passed","Sun Jun 09 05:06:47 UTC 2024","Sun Jun 09 05:06:57 UTC 2024","10182","","My Profile: [FNN-719] Add resume Negative","","My Profile: [FNN-719] Add resume Negative","should add experience without position","should add experience without position",""
"passed","Sun Jun 09 05:09:25 UTC 2024","Sun Jun 09 05:09:28 UTC 2024","3363","","My Profile: [FNN-719] Add resume Negative","","My Profile: [FNN-719] Add resume Negative","should add language without speaking level","should add language without speaking level",""
"passed","Sun Jun 09 05:06:15 UTC 2024","Sun Jun 09 05:07:56 UTC 2024","100989","","Upgrade: Upgrade Positive","","Upgrade: Upgrade Positive","[FNN-658] Upgrade account Positive: Premium 1 month","[FNN-658] Upgrade account Positive: Premium 1 month",""
"passed","Sun Jun 09 04:48:58 UTC 2024","Sun Jun 09 04:56:21 UTC 2024","443789","","My Transactions: [FNN-1431] Hourly project: In retrospect. Positive","","My Transactions: [FNN-1431] Hourly project: In retrospect. Positive","should start hourly project","should start hourly project",""
"passed","Sun Jun 09 05:11:49 UTC 2024","Sun Jun 09 05:12:03 UTC 2024","14624","","Post Project: [FNN-588] Post project without account Negative","","Post Project: [FNN-588] Post project without account Negative","should post project without email","should post project without email",""
"failed","Sun Jun 09 05:14:09 UTC 2024","Sun Jun 09 05:16:45 UTC 2024","155222","","[FNN-661] Send interest","","[FNN-661] Send interest","""before all"" hook for [FNN-661] Send interest","""before all"" hook for [FNN-661] Send interest",""
"passed","Sun Jun 09 04:17:33 UTC 2024","Sun Jun 09 04:19:07 UTC 2024","93516","","My Profile: [FNN-698] Confirm phone number Positive","","My Profile: [FNN-698] Confirm phone number Positive","should confirm phone number with valid code","should confirm phone number with valid code",""
"passed","Sun Jun 09 05:11:23 UTC 2024","Sun Jun 09 05:14:28 UTC 2024","184671","","Upgrade: Upgrade Positive","","Upgrade: Upgrade Positive","[FNN-658] Upgrade account Positive: Enterprise 1 month","[FNN-658] Upgrade account Positive: Enterprise 1 month",""
"passed","Sun Jun 09 04:38:04 UTC 2024","Sun Jun 09 04:38:11 UTC 2024","6331","","Search Project: [FNN-568] Project search","","Search Project: [FNN-568] Project search","should filter projects by Posted since Last 3 days","should filter projects by Posted since Last 3 days",""
"passed","Sun Jun 09 05:11:46 UTC 2024","Sun Jun 09 05:11:49 UTC 2024","3752","","Post Project: Post Project without account Positive ","","Post Project: Post Project without account Positive ","[FNN-650][FNN-2387] Professional receives Verify email letter","[FNN-650][FNN-2387] Professional receives Verify email letter",""
"failed","Sun Jun 09 05:29:13 UTC 2024","Sun Jun 09 05:29:39 UTC 2024","25866","","My Transactions: [FNN-737] Hourly project: Start project. Negative","","My Transactions: [FNN-737] Hourly project: Start project. Negative","should start project without Hourly rate","should start project without Hourly rate",""
"passed","Sun Jun 09 04:31:45 UTC 2024","Sun Jun 09 04:32:37 UTC 2024","51957","","Settings: [FNN-675] Change password Negative","","Settings: [FNN-675] Change password Negative","should change password with invalid old password","should change password with invalid old password",""
"passed","Sun Jun 09 05:09:13 UTC 2024","Sun Jun 09 05:09:21 UTC 2024","8309","","My Profile: [FNN-719] Add resume Negative","","My Profile: [FNN-719] Add resume Negative","should add certificate without achieved annual","should add certificate without achieved annual",""
"passed","Sun Jun 09 05:01:47 UTC 2024","Sun Jun 09 05:01:50 UTC 2024","3639","","My Transactions: [FNN-708] Hourly project: In advance. Positive","","My Transactions: [FNN-708] Hourly project: In advance. Positive","should close the period","should close the period",""
"passed","Sun Jun 09 04:33:11 UTC 2024","Sun Jun 09 04:34:25 UTC 2024","73322","","Settings: [FNN-676] Change profile settings","","Settings: [FNN-676] Change profile settings","i don't want to display my profile in the database","i don't want to display my profile in the database",""
"passed","Sun Jun 09 04:40:29 UTC 2024","Sun Jun 09 04:40:49 UTC 2024","20839","","Freelancer search: [FNN-815] Freelancer search as non-CR user","","Freelancer search: [FNN-815] Freelancer search as non-CR user","should filter freelancers by Hourly Rate","should filter freelancers by Hourly Rate",""
"passed","Sun Jun 09 04:41:18 UTC 2024","Sun Jun 09 04:42:19 UTC 2024","60600","","Freelancer search: [FNN-816] Create list Functionality","","Freelancer search: [FNN-816] Create list Functionality","should remove created list","should remove created list",""
"passed","Sun Jun 09 04:57:48 UTC 2024","Sun Jun 09 04:58:01 UTC 2024","13052","","My Transactions: [FNN-1431] Hourly project: In retrospect. Positive","","My Transactions: [FNN-1431] Hourly project: In retrospect. Positive","should verify that the money paid","should verify that the money paid",""
