"Status","Start Time","Stop Time","Duration in ms","Parent Suite","Suite","Sub Suite","Test Class","Test Method","Name","Description"
"passed","Tue May 14 05:09:16 UTC 2024","Tue May 14 05:09:21 UTC 2024","4493","","My Profile: [FNN-719] Add resume Negative","","My Profile: [FNN-719] Add resume Negative","should add language without speaking level","should add language without speaking level",""
"broken","Tue May 14 05:05:30 UTC 2024","Tue May 14 05:13:56 UTC 2024","505670","","Post Project: Post Project Positive","","Post Project: Post Project Positive","[FNN-587] Post project with account Positive","[FNN-587] Post project with account Positive",""
"passed","Tue May 14 05:02:28 UTC 2024","Tue May 14 05:02:41 UTC 2024","12156","","CR: [FNN-744] CR Subscribe Negative","","CR: [FNN-744] CR Subscribe Negative","should subscribe as CR with invalid repeat password","should subscribe as CR with invalid repeat password",""
"passed","Tue May 14 04:15:00 UTC 2024","Tue May 14 04:18:28 UTC 2024","207871","","Upgrade: Upgrade Positive","","Upgrade: Upgrade Positive","[FNN-658] Upgrade account Positive: Business 1 month","[FNN-658] Upgrade account Positive: Business 1 month",""
"passed","Tue May 14 05:08:51 UTC 2024","Tue May 14 05:09:25 UTC 2024","34230","","My Profile: [FNN-730] Request reference Negative","","My Profile: [FNN-730] Request reference Negative","should pass step 3 with comments less then 200 chars","should pass step 3 with comments less then 200 chars",""
"passed","Tue May 14 04:49:23 UTC 2024","Tue May 14 04:50:05 UTC 2024","41743","","[FNN-661] Send interest","","[FNN-661] Send interest","should assign the Freelancer user","should assign the Freelancer user",""
"broken","Tue May 14 05:23:10 UTC 2024","Tue May 14 05:28:25 UTC 2024","314919","","My Transactions: [FNN-737] Hourly project: Start project. Negative","","My Transactions: [FNN-737] Hourly project: Start project. Negative","should start project without Hours per period and Hourly rate","should start project without Hours per period and Hourly rate",""
"passed","Tue May 14 05:04:45 UTC 2024","Tue May 14 05:05:53 UTC 2024","67633","","My Profile: [FNN-668] Edit account details Negative","","My Profile: [FNN-668] Edit account details Negative","should edit account details without required fields","should edit account details without required fields",""
"passed","Tue May 14 05:11:17 UTC 2024","Tue May 14 05:11:37 UTC 2024","19688","","Post Project: [FNN-588] Post project without account Negative","","Post Project: [FNN-588] Post project without account Negative","should post project without phone number","should post project without phone number",""
"passed","Tue May 14 04:32:12 UTC 2024","Tue May 14 04:33:17 UTC 2024","64903","","My Network: Invite via Email","","My Network: Invite via Email","[FNN-1233] Invite manually via email with custom message with signup bonus","[FNN-1233] Invite manually via email with custom message with signup bonus",""
"passed","Tue May 14 04:17:57 UTC 2024","Tue May 14 04:19:40 UTC 2024","102698","","My Profile: [FNN-699] Request reference Positive","","My Profile: [FNN-699] Request reference Positive","should add experience and request reference","should add experience and request reference",""
"passed","Tue May 14 04:30:23 UTC 2024","Tue May 14 04:32:04 UTC 2024","101019","","Settings: [FNN-808] Cancel downgrade","","Settings: [FNN-808] Cancel downgrade","should cancel downgrade","should cancel downgrade",""
"passed","Tue May 14 04:12:01 UTC 2024","Tue May 14 04:12:15 UTC 2024","13558","","Subscribe: [FNN-577] Subscribe Negative","","Subscribe: [FNN-577] Subscribe Negative","should subscribe without last name","should subscribe without last name",""
"passed","Tue May 14 04:09:34 UTC 2024","Tue May 14 04:09:38 UTC 2024","3837","","Login: [FNN-563] Log in from the header Negative","","Login: [FNN-563] Log in from the header Negative","should log in without password","should log in without password",""
"passed","Tue May 14 04:33:17 UTC 2024","Tue May 14 04:33:22 UTC 2024","4456","","My Network: Invite via Email","","My Network: Invite via Email","[FNN-1233][FNN-2450] User receives the Network invitation letter","[FNN-1233][FNN-2450] User receives the Network invitation letter",""
"passed","Tue May 14 04:13:39 UTC 2024","Tue May 14 04:13:53 UTC 2024","14405","","Subscribe: [FNN-577] Subscribe Negative","","Subscribe: [FNN-577] Subscribe Negative","should subscribe without password","should subscribe without password",""
"passed","Tue May 14 04:47:33 UTC 2024","Tue May 14 04:49:33 UTC 2024","120515","","Freelancer search: [FNN-846] Invite to project","","Freelancer search: [FNN-846] Invite to project","should verify if the ""Assign project"" button is enable","should verify if the ""Assign project"" button is enable",""
"passed","Tue May 14 04:14:39 UTC 2024","Tue May 14 04:15:12 UTC 2024","32562","","Upgrade: [FNN-659] Upgrade account Negative","","Upgrade: [FNN-659] Upgrade account Negative","should upgrade account to Standard 1 month: Expired card decline","should upgrade account to Standard 1 month: Expired card decline",""
"passed","Tue May 14 04:22:55 UTC 2024","Tue May 14 04:23:00 UTC 2024","4421","","My Profile: [FNN-730] Request reference Negative","","My Profile: [FNN-730] Request reference Negative","should pass step 2 without picture","should pass step 2 without picture",""
"passed","Tue May 14 05:16:42 UTC 2024","Tue May 14 05:16:47 UTC 2024","4666","","Freelancer search: [FNN-816] Create list Functionality","","Freelancer search: [FNN-816] Create list Functionality","should re-open original search","should re-open original search",""
"failed","Tue May 14 05:03:46 UTC 2024","Tue May 14 05:05:22 UTC 2024","95390","","Subscribe","","Subscribe","[FNN-2167] 500  signup bonus","[FNN-2167] 500  signup bonus",""
"passed","Tue May 14 04:45:45 UTC 2024","Tue May 14 04:49:23 UTC 2024","218220","","[FNN-661] Send interest","","[FNN-661] Send interest","should send interest in the employer's project","should send interest in the employer's project",""
"passed","Tue May 14 04:41:52 UTC 2024","Tue May 14 04:44:13 UTC 2024","141274","","Freelancer search: [FNN-822] Send message","","Freelancer search: [FNN-822] Send message","should send a message via the ""Send message"" action","should send a message via the ""Send message"" action",""
"passed","Tue May 14 05:16:24 UTC 2024","Tue May 14 05:17:35 UTC 2024","71273","","My Projects: [FNN-971] Complete project Positive","","My Projects: [FNN-971] Complete project Positive","should check review as freelancer user","should check review as freelancer user",""
"passed","Tue May 14 04:46:32 UTC 2024","Tue May 14 04:46:59 UTC 2024","26719","","Freelancer search: [FNN-924] Freelancer search as CR user","","Freelancer search: [FNN-924] Freelancer search as CR user","should filter freelancers by Category","should filter freelancers by Category",""
"passed","Tue May 14 05:00:00 UTC 2024","Tue May 14 05:00:12 UTC 2024","12091","","CR: [FNN-744] CR Subscribe Negative","","CR: [FNN-744] CR Subscribe Negative","should subscribe as CR without company name","should subscribe as CR without company name",""
"passed","Tue May 14 05:02:41 UTC 2024","Tue May 14 05:02:53 UTC 2024","12960","","CR: [FNN-744] CR Subscribe Negative","","CR: [FNN-744] CR Subscribe Negative","should subscribe as CR without agreeing to the Terms and Conditions","should subscribe as CR without agreeing to the Terms and Conditions",""
"passed","Tue May 14 05:01:00 UTC 2024","Tue May 14 05:01:15 UTC 2024","14485","","CR: [FNN-744] CR Subscribe Negative","","CR: [FNN-744] CR Subscribe Negative","should subscribe as CR with taken email","should subscribe as CR with taken email",""
"passed","Tue May 14 04:51:11 UTC 2024","Tue May 14 04:52:32 UTC 2024","80992","","Freelancer search: [FNN-924] Freelancer search as CR user","","Freelancer search: [FNN-924] Freelancer search as CR user","should filter freelancers by Minimum rating","should filter freelancers by Minimum rating",""
"passed","Tue May 14 04:46:14 UTC 2024","Tue May 14 04:46:23 UTC 2024","9796","","Create Profile: [FNN-684] Create profile Negative","","Create Profile: [FNN-684] Create profile Negative","should create profile without City","should create profile without City",""
"passed","Tue May 14 04:41:42 UTC 2024","Tue May 14 04:44:13 UTC 2024","151193","","Freelancer search: [FNN-817] Add note","","Freelancer search: [FNN-817] Add note","should add a note via the note button","should add a note via the note button",""
"passed","Tue May 14 04:27:55 UTC 2024","Tue May 14 04:28:38 UTC 2024","42508","","Settings: [FNN-675] Change password Negative","","Settings: [FNN-675] Change password Negative","should change password without new and repeat password","should change password without new and repeat password",""
"passed","Tue May 14 04:14:13 UTC 2024","Tue May 14 04:14:39 UTC 2024","26627","","Upgrade: [FNN-659] Upgrade account Negative","","Upgrade: [FNN-659] Upgrade account Negative","should upgrade account to Standard 1 month: Stolen card decline","should upgrade account to Standard 1 month: Stolen card decline",""
"passed","Tue May 14 04:19:40 UTC 2024","Tue May 14 04:20:01 UTC 2024","21114","","My Profile: [FNN-699] Request reference Positive","","My Profile: [FNN-699] Request reference Positive","should validate reference","should validate reference",""
"broken","Tue May 14 05:07:21 UTC 2024","Tue May 14 05:08:51 UTC 2024","89257","","My Profile: [FNN-730] Request reference Negative","","My Profile: [FNN-730] Request reference Negative","""before all"" hook for [FNN-730] Request reference Negative","""before all"" hook for [FNN-730] Request reference Negative",""
"passed","Tue May 14 04:28:57 UTC 2024","Tue May 14 04:29:19 UTC 2024","21715","","Settings: [FNN-675] Change password Negative","","Settings: [FNN-675] Change password Negative","should change password with invalid repeat new password","should change password with invalid repeat new password",""
"skipped","Tue May 14 05:13:56 UTC 2024","Tue May 14 05:14:30 UTC 2024","33738","","Post Project: Post Project Positive","","Post Project: Post Project Positive","[FNN-587][FNN-2423] User receives the Project posted letter","[FNN-587][FNN-2423] User receives the Project posted letter",""
"failed","Tue May 14 05:06:10 UTC 2024","Tue May 14 05:07:15 UTC 2024","64209","","My Profile: [FNN-668] Edit account details Negative","","My Profile: [FNN-668] Edit account details Negative","should edit account details with invalid VAT number","should edit account details with invalid VAT number",""
"passed","Tue May 14 04:42:49 UTC 2024","Tue May 14 04:46:32 UTC 2024","223229","","Freelancer search: [FNN-924] Freelancer search as CR user","","Freelancer search: [FNN-924] Freelancer search as CR user","should filter freelancers by Terms","should filter freelancers by Terms",""
"passed","Tue May 14 04:17:18 UTC 2024","Tue May 14 04:17:27 UTC 2024","8529","","My Profile: [FNN-690] Add resume Positive","","My Profile: [FNN-690] Add resume Positive","should add Qualities","should add Qualities",""
"broken","Tue May 14 05:08:13 UTC 2024","Tue May 14 05:08:39 UTC 2024","25528","","Post Project: Post Project Positive","","Post Project: Post Project Positive","[FNN-650][FNN-2422] Correctness of project data on the Project page","[FNN-650][FNN-2422] Correctness of project data on the Project page",""
"passed","Tue May 14 04:58:32 UTC 2024","Tue May 14 04:59:35 UTC 2024","62333","","CR: [FNN-742] CR subscribe Positive","","CR: [FNN-742] CR subscribe Positive","should subscribe as CR with valid credentials","should subscribe as CR with valid credentials",""
"skipped","Tue May 14 05:27:23 UTC 2024","Tue May 14 05:27:23 UTC 2024","0","","My Transactions: [FNN-710] Milestones project: In advance. Positive","","My Transactions: [FNN-710] Milestones project: In advance. Positive","should pay deposit","should pay deposit",""
"passed","Tue May 14 04:16:44 UTC 2024","Tue May 14 04:17:47 UTC 2024","63526","","Upgrade: [FNN-659] Upgrade account Negative","","Upgrade: [FNN-659] Upgrade account Negative","should upgrade account to Standard 1 month: Exceeding velocity limit decline","should upgrade account to Standard 1 month: Exceeding velocity limit decline",""
"skipped","Tue May 14 04:37:51 UTC 2024","Tue May 14 04:38:52 UTC 2024","61084","","My Network: [FNN-1027] Invite freelancers","","My Network: [FNN-1027] Invite freelancers","should check network as sender user","should check network as sender user",""
"passed","Tue May 14 05:13:02 UTC 2024","Tue May 14 05:13:23 UTC 2024","20569","","Post Project: [FNN-588] Post project without account Negative","","Post Project: [FNN-588] Post project without account Negative","should post project with short password and repeat password","should post project with short password and repeat password",""
"passed","Tue May 14 04:47:58 UTC 2024","Tue May 14 04:48:52 UTC 2024","54275","","Freelancer search: [FNN-924] Freelancer search as CR user","","Freelancer search: [FNN-924] Freelancer search as CR user","should filter freelancers by Years of experience","should filter freelancers by Years of experience",""
"passed","Tue May 14 05:06:50 UTC 2024","Tue May 14 05:07:00 UTC 2024","9997","","My Profile: [FNN-719] Add resume Negative","","My Profile: [FNN-719] Add resume Negative","should add experience without company","should add experience without company",""
"passed","Tue May 14 04:22:48 UTC 2024","Tue May 14 04:22:55 UTC 2024","7188","","My Profile: [FNN-730] Request reference Negative","","My Profile: [FNN-730] Request reference Negative","should pass step 2 without phone","should pass step 2 without phone",""
"passed","Tue May 14 04:15:12 UTC 2024","Tue May 14 04:15:43 UTC 2024","31421","","Upgrade: [FNN-659] Upgrade account Negative","","Upgrade: [FNN-659] Upgrade account Negative","should upgrade account to Standard 1 month: Incorrect CVC decline","should upgrade account to Standard 1 month: Incorrect CVC decline",""
"passed","Tue May 14 04:22:41 UTC 2024","Tue May 14 04:22:48 UTC 2024","6930","","My Profile: [FNN-730] Request reference Negative","","My Profile: [FNN-730] Request reference Negative","should pass step 2 without last name","should pass step 2 without last name",""
"failed","Tue May 14 05:28:59 UTC 2024","Tue May 14 05:29:02 UTC 2024","2754","","CR: Invite Positive","","CR: Invite Positive","[FNN-750][FNN-2400] User receives the Invitation to organization letter","[FNN-750][FNN-2400] User receives the Invitation to organization letter",""
"passed","Tue May 14 04:42:33 UTC 2024","Tue May 14 04:47:11 UTC 2024","277550","","Freelancer search: [FNN-846] Invite to project","","Freelancer search: [FNN-846] Invite to project","should invite to a project via the ""Invite to project"" action","should invite to a project via the ""Invite to project"" action",""
"passed","Tue May 14 05:01:56 UTC 2024","Tue May 14 05:02:06 UTC 2024","10146","","CR: [FNN-744] CR Subscribe Negative","","CR: [FNN-744] CR Subscribe Negative","should subscribe as CR without password","should subscribe as CR without password",""
"broken","Tue May 14 05:28:37 UTC 2024","Tue May 14 05:28:49 UTC 2024","12612","","My Transactions: [FNN-737] Hourly project: Start project. Negative","","My Transactions: [FNN-737] Hourly project: Start project. Negative","should start project without Hourly rate","should start project without Hourly rate",""
"passed","Tue May 14 04:11:46 UTC 2024","Tue May 14 04:12:01 UTC 2024","14816","","Subscribe: [FNN-577] Subscribe Negative","","Subscribe: [FNN-577] Subscribe Negative","should subscribe without first name","should subscribe without first name",""
"passed","Tue May 14 05:09:08 UTC 2024","Tue May 14 05:09:31 UTC 2024","22833","","Post Project: [FNN-588] Post project without account Negative","","Post Project: [FNN-588] Post project without account Negative","should post project without first name","should post project without first name",""
"skipped","Tue May 14 05:13:56 UTC 2024","Tue May 14 05:13:56 UTC 2024","2","","Post Project: Post Project Positive","","Post Project: Post Project Positive","[FNN-587][FNN-2422] Correctness of project data on the Project page","[FNN-587][FNN-2422] Correctness of project data on the Project page",""
"passed","Tue May 14 04:47:41 UTC 2024","Tue May 14 04:48:48 UTC 2024","66633","","[FNN-717] Edit email settings","","[FNN-717] Edit email settings","should edit Email settings and verify that the settings are saved","should edit Email settings and verify that the settings are saved",""
"passed","Tue May 14 04:24:54 UTC 2024","Tue May 14 04:25:04 UTC 2024","9429","","Post Project: [FNN-649] Post project with account Negative","","Post Project: [FNN-649] Post project with account Negative","should post project without Category","should post project without Category",""
"passed","Tue May 14 04:28:38 UTC 2024","Tue May 14 04:28:57 UTC 2024","19779","","Settings: [FNN-675] Change password Negative","","Settings: [FNN-675] Change password Negative","should change password with short new password","should change password with short new password",""
"passed","Tue May 14 05:00:37 UTC 2024","Tue May 14 05:00:48 UTC 2024","11381","","CR: [FNN-744] CR Subscribe Negative","","CR: [FNN-744] CR Subscribe Negative","should subscribe as CR without email","should subscribe as CR without email",""
"passed","Tue May 14 05:02:17 UTC 2024","Tue May 14 05:02:28 UTC 2024","11754","","CR: [FNN-744] CR Subscribe Negative","","CR: [FNN-744] CR Subscribe Negative","should subscribe as CR with short password","should subscribe as CR with short password",""
"passed","Tue May 14 05:01:26 UTC 2024","Tue May 14 05:01:40 UTC 2024","13953","","CR: [FNN-744] CR Subscribe Negative","","CR: [FNN-744] CR Subscribe Negative","should subscribe as CR with wrong phone number","should subscribe as CR with wrong phone number",""
"passed","Tue May 14 04:28:20 UTC 2024","Tue May 14 04:31:06 UTC 2024","166067","","Settings: [FNN-676] Change profile settings","","Settings: [FNN-676] Change profile settings","it's not possible to contact me through the contact button on my profile","it's not possible to contact me through the contact button on my profile",""
"passed","Tue May 14 04:30:06 UTC 2024","Tue May 14 04:31:52 UTC 2024","105983","","Settings: [FNN-680] Deactivate profile","","Settings: [FNN-680] Deactivate profile","should deactivate profile","should deactivate profile",""
"passed","Tue May 14 04:15:12 UTC 2024","Tue May 14 04:16:26 UTC 2024","73656","","My Profile: [FNN-690] Add resume Positive","","My Profile: [FNN-690] Add resume Positive","should add CV","should add CV",""
"passed","Tue May 14 05:11:39 UTC 2024","Tue May 14 05:12:29 UTC 2024","50154","","My Network: Invite via Email","","My Network: Invite via Email","[FNN-1232][FNN-2452] Checks earnings from the invitation bonus for registration","[FNN-1232][FNN-2452] Checks earnings from the invitation bonus for registration",""
"passed","Tue May 14 04:13:02 UTC 2024","Tue May 14 04:13:51 UTC 2024","49248","","Reset password: Reset password Positive","","Reset password: Reset password Positive","[FNN-2399] Reset link functionality","[FNN-2399] Reset link functionality",""
"skipped","Tue May 14 05:24:40 UTC 2024","Tue May 14 05:24:40 UTC 2024","4","","My Transactions: [FNN-708] Hourly project: In advance. Positive","","My Transactions: [FNN-708] Hourly project: In advance. Positive","should accept the project","should accept the project",""
"passed","Tue May 14 04:14:20 UTC 2024","Tue May 14 04:14:32 UTC 2024","11279","","Subscribe: [FNN-577] Subscribe Negative","","Subscribe: [FNN-577] Subscribe Negative","should subscribe with invalid repeat password","should subscribe with invalid repeat password",""
"passed","Tue May 14 04:09:22 UTC 2024","Tue May 14 04:09:27 UTC 2024","4797","","Login: [FNN-563] Log in from the header Negative","","Login: [FNN-563] Log in from the header Negative","should log in with invalid credentials","should log in with invalid credentials",""
"passed","Tue May 14 04:28:42 UTC 2024","Tue May 14 04:29:39 UTC 2024","56564","","Settings: [FNN-678] Delete account without subscription","","Settings: [FNN-678] Delete account without subscription","should delete account without subscription","should delete account without subscription",""
"passed","Tue May 14 05:02:54 UTC 2024","Tue May 14 05:03:40 UTC 2024","46115","","CR: [FNN-751] Invite to the organization manually Negative","","CR: [FNN-751] Invite to the organization manually Negative","should invite manually to the organization without role","should invite manually to the organization without role",""
"passed","Tue May 14 05:10:39 UTC 2024","Tue May 14 05:11:39 UTC 2024","60005","","My Network: Invite via Email","","My Network: Invite via Email","[FNN-1232][FNN-2451] Create a user and accept network invitation","[FNN-1232][FNN-2451] Create a user and accept network invitation",""
"skipped","Tue May 14 05:27:23 UTC 2024","Tue May 14 05:27:23 UTC 2024","1","","My Transactions: [FNN-710] Milestones project: In advance. Positive","","My Transactions: [FNN-710] Milestones project: In advance. Positive","should verify that the money paid","should verify that the money paid",""
"failed","Tue May 14 05:07:22 UTC 2024","Tue May 14 05:07:46 UTC 2024","24506","","My Profile: [FNN-719] Add resume Negative","","My Profile: [FNN-719] Add resume Negative","should add education without data","should add education without data",""
"passed","Tue May 14 04:29:19 UTC 2024","Tue May 14 04:30:14 UTC 2024","54400","","Settings: [FNN-675] Change password Negative","","Settings: [FNN-675] Change password Negative","should change password with invalid old password","should change password with invalid old password",""
"passed","Tue May 14 05:07:25 UTC 2024","Tue May 14 05:08:13 UTC 2024","47984","","Post Project: Post Project Positive","","Post Project: Post Project Positive","[FNN-650] Post project without account Positive","[FNN-650] Post project without account Positive",""
"passed","Tue May 14 04:13:09 UTC 2024","Tue May 14 04:15:00 UTC 2024","110580","","Upgrade: Upgrade Positive","","Upgrade: Upgrade Positive","[FNN-658] Upgrade account Positive: Premium 1 month","[FNN-658] Upgrade account Positive: Premium 1 month",""
"passed","Tue May 14 04:44:30 UTC 2024","Tue May 14 04:45:34 UTC 2024","64645","","Freelancer search: [FNN-817] Add note","","Freelancer search: [FNN-817] Add note","should add note from the notes popup","should add note from the notes popup",""
"passed","Tue May 14 05:10:13 UTC 2024","Tue May 14 05:10:35 UTC 2024","21857","","Post Project: [FNN-588] Post project without account Negative","","Post Project: [FNN-588] Post project without account Negative","should post project with wrong email","should post project with wrong email",""
"passed","Tue May 14 04:09:07 UTC 2024","Tue May 14 04:09:10 UTC 2024","2946","","Login: [FNN-574] Log in from the Login page Negative","","Login: [FNN-574] Log in from the Login page Negative","should log in without email","should log in without email",""
"passed","Tue May 14 04:27:04 UTC 2024","Tue May 14 04:28:34 UTC 2024","89743","","Settings: [FNN-674] Change password Positive","","Settings: [FNN-674] Change password Positive","should change password with valid credentials","should change password with valid credentials",""
"passed","Tue May 14 04:36:36 UTC 2024","Tue May 14 04:36:41 UTC 2024","5245","","My Network: [FNN-620] Invite manually via email and sms Negative","","My Network: [FNN-620] Invite manually via email and sms Negative","should invite manually via email without last name","should invite manually via email without last name",""
"passed","Tue May 14 04:34:26 UTC 2024","Tue May 14 04:35:27 UTC 2024","60711","","My Network: Invite via Email","","My Network: Invite via Email","[FNN-1233][FNN-2452] Checks earnings from the invitation bonus for registration","[FNN-1233][FNN-2452] Checks earnings from the invitation bonus for registration",""
"passed","Tue May 14 04:47:11 UTC 2024","Tue May 14 04:47:33 UTC 2024","21653","","Freelancer search: [FNN-846] Invite to project","","Freelancer search: [FNN-846] Invite to project","should check the invitation and send an interest of the project","should check the invitation and send an interest of the project",""
"skipped","Tue May 14 05:24:40 UTC 2024","Tue May 14 05:24:40 UTC 2024","0","","My Transactions: [FNN-708] Hourly project: In advance. Positive","","My Transactions: [FNN-708] Hourly project: In advance. Positive","should verify that the period is closed","should verify that the period is closed",""
"passed","Tue May 14 05:09:21 UTC 2024","Tue May 14 05:09:25 UTC 2024","4599","","My Profile: [FNN-719] Add resume Negative","","My Profile: [FNN-719] Add resume Negative","should add language without writing level","should add language without writing level",""
"broken","Tue May 14 05:28:49 UTC 2024","Tue May 14 05:29:01 UTC 2024","11935","","My Transactions: [FNN-738] Milestones project: Add milestone. Negative","","My Transactions: [FNN-738] Milestones project: Add milestone. Negative","should add milestone without Description","should add milestone without Description",""
"passed","Tue May 14 04:34:22 UTC 2024","Tue May 14 04:34:28 UTC 2024","6052","","Search Project: [FNN-568] Project search","","Search Project: [FNN-568] Project search","should filter projects by Status All projects","should filter projects by Status All projects",""
"passed","Tue May 14 04:19:31 UTC 2024","Tue May 14 04:20:34 UTC 2024","62480","","My Profile: [FNN-718] Add portfolio Negative","","My Profile: [FNN-718] Add portfolio Negative","should add portfolio without data","should add portfolio without data",""
"passed","Tue May 14 05:07:51 UTC 2024","Tue May 14 05:07:57 UTC 2024","5588","","My Profile: [FNN-719] Add resume Negative","","My Profile: [FNN-719] Add resume Negative","should add education without education","should add education without education",""
