"Status","Start Time","Stop Time","Duration in ms","Parent Suite","Suite","Sub Suite","Test Class","Test Method","Name","Description"
"passed","Sun Apr 21 05:03:07 UTC 2024","Sun Apr 21 05:03:42 UTC 2024","34649","","CR: [FNN-751] Invite to the organization manually Negative","","CR: [FNN-751] Invite to the organization manually Negative","should invite manually to the organization without role","should invite manually to the organization without role",""
"skipped","Sun Apr 21 05:21:35 UTC 2024","Sun Apr 21 05:23:29 UTC 2024","113965","","My Projects: [FNN-971] Complete project Positive","","My Projects: [FNN-971] Complete project Positive","should check review as freelancer user","should check review as freelancer user",""
"passed","Sun Apr 21 04:09:17 UTC 2024","Sun Apr 21 04:09:21 UTC 2024","3752","","Login: [FNN-563] Log in from the header Negative","","Login: [FNN-563] Log in from the header Negative","should log in with wrong email format","should log in with wrong email format",""
"passed","Sun Apr 21 04:27:12 UTC 2024","Sun Apr 21 04:27:56 UTC 2024","43895","","Settings: [FNN-672] Change email address Negative","","Settings: [FNN-672] Change email address Negative","should change email address with wrong password","should change email address with wrong password",""
"passed","Sun Apr 21 04:08:21 UTC 2024","Sun Apr 21 04:08:50 UTC 2024","28917","","Login: [FNN-574] Log in from the Login page Negative","","Login: [FNN-574] Log in from the Login page Negative","should log in with valid email and invalid password","should log in with valid email and invalid password",""
"passed","Sun Apr 21 04:28:05 UTC 2024","Sun Apr 21 04:28:25 UTC 2024","19685","","Settings: [FNN-675] Change password Negative","","Settings: [FNN-675] Change password Negative","should change password with invalid repeat new password","should change password with invalid repeat new password",""
"passed","Sun Apr 21 04:09:39 UTC 2024","Sun Apr 21 04:10:56 UTC 2024","77146","","Subscribe","","Subscribe","[FNN-2167] 500  signup bonus","[FNN-2167] 500  signup bonus",""
"passed","Sun Apr 21 04:47:25 UTC 2024","Sun Apr 21 04:47:51 UTC 2024","26457","","Freelancer search: [FNN-924] Freelancer search as CR user","","Freelancer search: [FNN-924] Freelancer search as CR user","should filter freelancers by Hourly Rate","should filter freelancers by Hourly Rate",""
"passed","Sun Apr 21 05:05:29 UTC 2024","Sun Apr 21 05:05:55 UTC 2024","26368","","Upgrade: [FNN-659] Upgrade account Negative","","Upgrade: [FNN-659] Upgrade account Negative","should upgrade account to Standard 1 month: Insufficient funds decline","should upgrade account to Standard 1 month: Insufficient funds decline",""
"passed","Sun Apr 21 04:11:24 UTC 2024","Sun Apr 21 04:11:34 UTC 2024","10657","","Subscribe: [FNN-577] Subscribe Negative","","Subscribe: [FNN-577] Subscribe Negative","should subscribe without first name","should subscribe without first name",""
"passed","Sun Apr 21 04:10:40 UTC 2024","Sun Apr 21 04:10:47 UTC 2024","6637","","Reset password: [FNN-655] Reset password Negative","","Reset password: [FNN-655] Reset password Negative","should reset password without data","should reset password without data",""
"passed","Sun Apr 21 04:13:36 UTC 2024","Sun Apr 21 04:14:46 UTC 2024","70316","","My Profile: [FNN-690] Add resume Positive","","My Profile: [FNN-690] Add resume Positive","should add CV","should add CV",""
"failed","Sun Apr 21 05:12:18 UTC 2024","Sun Apr 21 05:13:25 UTC 2024","67162","","My Profile: [FNN-730] Request reference Negative","","My Profile: [FNN-730] Request reference Negative","should pass step 3 with comments less then 200 chars","should pass step 3 with comments less then 200 chars",""
"passed","Sun Apr 21 04:25:19 UTC 2024","Sun Apr 21 04:25:37 UTC 2024","18065","","Post Project: [FNN-649] Post project with account Negative","","Post Project: [FNN-649] Post project with account Negative","should post project without Description","should post project without Description",""
"passed","Sun Apr 21 04:23:07 UTC 2024","Sun Apr 21 04:23:18 UTC 2024","10817","","Post Project: [FNN-649] Post project with account Negative","","Post Project: [FNN-649] Post project with account Negative","should post project without Title","should post project without Title",""
"passed","Sun Apr 21 04:09:27 UTC 2024","Sun Apr 21 04:10:36 UTC 2024","69385","","Login: [FNN-685] Log out","","Login: [FNN-685] Log out","should log out","should log out",""
"passed","Sun Apr 21 05:10:48 UTC 2024","Sun Apr 21 05:10:54 UTC 2024","5516","","My Profile: [FNN-719] Add resume Negative","","My Profile: [FNN-719] Add resume Negative","should add certificate without organization","should add certificate without organization",""
"passed","Sun Apr 21 05:04:41 UTC 2024","Sun Apr 21 05:06:58 UTC 2024","137293","","My Profile: [FNN-669] Edit account details Positive","","My Profile: [FNN-669] Edit account details Positive","should edit freelancer account details with valid information","should edit freelancer account details with valid information",""
"passed","Sun Apr 21 05:10:41 UTC 2024","Sun Apr 21 05:10:48 UTC 2024","7538","","My Profile: [FNN-719] Add resume Negative","","My Profile: [FNN-719] Add resume Negative","should add certificate without certificate","should add certificate without certificate",""
"passed","Sun Apr 21 05:06:26 UTC 2024","Sun Apr 21 05:06:56 UTC 2024","29776","","Upgrade: [FNN-659] Upgrade account Negative","","Upgrade: [FNN-659] Upgrade account Negative","should upgrade account to Standard 1 month: Stolen card decline","should upgrade account to Standard 1 month: Stolen card decline",""
"failed","Sun Apr 21 05:25:18 UTC 2024","Sun Apr 21 05:25:56 UTC 2024","37611","","CR","","CR","[FNN-2401] Accept manual invitation to organization (platform)","[FNN-2401] Accept manual invitation to organization (platform)",""
"passed","Sun Apr 21 04:35:27 UTC 2024","Sun Apr 21 04:35:32 UTC 2024","4912","","My Network: [FNN-620] Invite manually via email and sms Negative","","My Network: [FNN-620] Invite manually via email and sms Negative","should invite manually via email without first name","should invite manually via email without first name",""
"failed","Sun Apr 21 05:11:11 UTC 2024","Sun Apr 21 05:11:19 UTC 2024","7348","","Post Project","","Post Project","[FNN-2426] User receives the Employer welcome letter","[FNN-2426] User receives the Employer welcome letter",""
"passed","Sun Apr 21 05:05:59 UTC 2024","Sun Apr 21 05:08:30 UTC 2024","151081","","My Profile: [FNN-793] Remove resume","","My Profile: [FNN-793] Remove resume","should remove resume","should remove resume",""
"passed","Sun Apr 21 05:01:22 UTC 2024","Sun Apr 21 05:01:32 UTC 2024","10313","","My Transactions: [FNN-737] Hourly project: Start project. Negative","","My Transactions: [FNN-737] Hourly project: Start project. Negative","should start project without Hours per period","should start project without Hours per period",""
"passed","Sun Apr 21 05:00:41 UTC 2024","Sun Apr 21 05:00:52 UTC 2024","10917","","CR: [FNN-744] CR Subscribe Negative","","CR: [FNN-744] CR Subscribe Negative","should subscribe as CR without repeat password","should subscribe as CR without repeat password",""
"passed","Sun Apr 21 04:44:31 UTC 2024","Sun Apr 21 04:48:07 UTC 2024","215379","","[FNN-661] Send interest","","[FNN-661] Send interest","should send interest in the employer's project","should send interest in the employer's project",""
"passed","Sun Apr 21 05:24:53 UTC 2024","Sun Apr 21 05:25:00 UTC 2024","7014","","CR","","CR","[FNN-2405] Check the invited user is in the organization (manual)","[FNN-2405] Check the invited user is in the organization (manual)",""
"passed","Sun Apr 21 04:59:25 UTC 2024","Sun Apr 21 04:59:39 UTC 2024","13401","","CR: [FNN-744] CR Subscribe Negative","","CR: [FNN-744] CR Subscribe Negative","should subscribe as CR with wrong email format","should subscribe as CR with wrong email format",""
"passed","Sun Apr 21 05:15:37 UTC 2024","Sun Apr 21 05:16:28 UTC 2024","51720","","My Network: [FNN-1232] Invite manually via email with custom message with signup bonus","","My Network: [FNN-1232] Invite manually via email with custom message with signup bonus","should check My Dashboard and My Transactions page for the signup bonus as the inviter user","should check My Dashboard and My Transactions page for the signup bonus as the inviter user",""
"passed","Sun Apr 21 04:12:09 UTC 2024","Sun Apr 21 04:12:22 UTC 2024","13498","","Subscribe: [FNN-577] Subscribe Negative","","Subscribe: [FNN-577] Subscribe Negative","should subscribe with taken email","should subscribe with taken email",""
"passed","Sun Apr 21 04:26:57 UTC 2024","Sun Apr 21 04:27:12 UTC 2024","15101","","Settings: [FNN-672] Change email address Negative","","Settings: [FNN-672] Change email address Negative","should change email address with invalid email format","should change email address with invalid email format",""
"skipped","Sun Apr 21 04:37:15 UTC 2024","Sun Apr 21 04:37:15 UTC 2024","0","","My Network: [FNN-1027] Invite freelancers","","My Network: [FNN-1027] Invite freelancers","should accept an invitation","should accept an invitation",""
"passed","Sun Apr 21 04:09:21 UTC 2024","Sun Apr 21 04:09:25 UTC 2024","3397","","Login: [FNN-563] Log in from the header Negative","","Login: [FNN-563] Log in from the header Negative","should log in without email","should log in without email",""
"passed","Sun Apr 21 04:35:20 UTC 2024","Sun Apr 21 04:35:27 UTC 2024","7225","","My Network: [FNN-620] Invite manually via email and sms Negative","","My Network: [FNN-620] Invite manually via email and sms Negative","should invite manually via email with wrong email format","should invite manually via email with wrong email format",""
"passed","Sun Apr 21 04:46:13 UTC 2024","Sun Apr 21 04:47:22 UTC 2024","69360","","[FNN-717] Edit email settings","","[FNN-717] Edit email settings","should edit Email settings and verify that the settings are saved","should edit Email settings and verify that the settings are saved",""
"passed","Sun Apr 21 05:18:14 UTC 2024","Sun Apr 21 05:18:40 UTC 2024","25915","","Freelancer search: [FNN-815] Freelancer search as non-CR user","","Freelancer search: [FNN-815] Freelancer search as non-CR user","should filter freelancers by Location","should filter freelancers by Location",""
"passed","Sun Apr 21 05:03:00 UTC 2024","Sun Apr 21 05:03:05 UTC 2024","4950","","CR: [FNN-751] Invite to the organization manually Negative","","CR: [FNN-751] Invite to the organization manually Negative","should invite manually to the organization without last name","should invite manually to the organization without last name",""
"passed","Sun Apr 21 05:20:43 UTC 2024","Sun Apr 21 05:25:29 UTC 2024","285800","","My Transactions: [FNN-708] Hourly project: In advance. Positive","","My Transactions: [FNN-708] Hourly project: In advance. Positive","should start hourly project","should start hourly project",""
"passed","Sun Apr 21 04:48:53 UTC 2024","Sun Apr 21 04:50:34 UTC 2024","100377","","Freelancer search: [FNN-924] Freelancer search as CR user","","Freelancer search: [FNN-924] Freelancer search as CR user","should filter freelancers by Availability","should filter freelancers by Availability",""
"passed","Sun Apr 21 05:08:41 UTC 2024","Sun Apr 21 05:10:21 UTC 2024","100014","","My Profile: [FNN-730] Request reference Negative","","My Profile: [FNN-730] Request reference Negative","should pass step 2 without data","should pass step 2 without data",""
"passed","Sun Apr 21 04:15:45 UTC 2024","Sun Apr 21 04:15:52 UTC 2024","6825","","My Profile: [FNN-690] Add resume Positive","","My Profile: [FNN-690] Add resume Positive","should add Expertise","should add Expertise",""
"passed","Sun Apr 21 04:15:38 UTC 2024","Sun Apr 21 04:15:45 UTC 2024","6785","","My Profile: [FNN-690] Add resume Positive","","My Profile: [FNN-690] Add resume Positive","should add Qualities","should add Qualities",""
"passed","Sun Apr 21 05:16:38 UTC 2024","Sun Apr 21 05:18:14 UTC 2024","95930","","Freelancer search: [FNN-815] Freelancer search as non-CR user","","Freelancer search: [FNN-815] Freelancer search as non-CR user","should filter freelancers by Sector","should filter freelancers by Sector",""
"passed","Sun Apr 21 05:13:54 UTC 2024","Sun Apr 21 05:14:14 UTC 2024","19977","","Post Project: [FNN-588] Post project without account Negative","","Post Project: [FNN-588] Post project without account Negative","should post project without email","should post project without email",""
"passed","Sun Apr 21 05:08:10 UTC 2024","Sun Apr 21 05:11:22 UTC 2024","191962","","Upgrade","","Upgrade","[FNN-658] Upgrade account Positive: Business 1 month","[FNN-658] Upgrade account Positive: Business 1 month",""
"passed","Sun Apr 21 04:11:54 UTC 2024","Sun Apr 21 04:12:37 UTC 2024","43394","","Reset password","","Reset password","[FNN-2399] Reset link functionality","[FNN-2399] Reset link functionality",""
"passed","Sun Apr 21 04:45:07 UTC 2024","Sun Apr 21 04:45:17 UTC 2024","10616","","Create Profile: [FNN-684] Create profile Negative","","Create Profile: [FNN-684] Create profile Negative","should create profile without Profile picture","should create profile without Profile picture",""
"passed","Sun Apr 21 04:33:51 UTC 2024","Sun Apr 21 04:33:57 UTC 2024","6095","","Search Project: [FNN-568] Project search","","Search Project: [FNN-568] Project search","should filter projects by Posted since Last 7 days","should filter projects by Posted since Last 7 days",""
"passed","Sun Apr 21 04:40:34 UTC 2024","Sun Apr 21 04:43:06 UTC 2024","151669","","Freelancer search: [FNN-817] Add note","","Freelancer search: [FNN-817] Add note","should add a note via the note button","should add a note via the note button",""
"passed","Sun Apr 21 04:55:54 UTC 2024","Sun Apr 21 05:01:22 UTC 2024","327851","","My Transactions: [FNN-737] Hourly project: Start project. Negative","","My Transactions: [FNN-737] Hourly project: Start project. Negative","should start project without Hours per period and Hourly rate","should start project without Hours per period and Hourly rate",""
"passed","Sun Apr 21 04:43:06 UTC 2024","Sun Apr 21 04:43:19 UTC 2024","12871","","Freelancer search: [FNN-817] Add note","","Freelancer search: [FNN-817] Add note","should add a note via the action ""Add note""","should add a note via the action ""Add note""",""
"passed","Sun Apr 21 04:14:46 UTC 2024","Sun Apr 21 04:15:06 UTC 2024","19631","","My Profile: [FNN-690] Add resume Positive","","My Profile: [FNN-690] Add resume Positive","should add Experience","should add Experience",""
"passed","Sun Apr 21 05:02:56 UTC 2024","Sun Apr 21 05:03:00 UTC 2024","4294","","CR: [FNN-751] Invite to the organization manually Negative","","CR: [FNN-751] Invite to the organization manually Negative","should invite manually to the organization without first name","should invite manually to the organization without first name",""
"passed","Sun Apr 21 05:24:34 UTC 2024","Sun Apr 21 05:24:37 UTC 2024","2496","","CR","","CR","[FNN-2400] User receives the Invitation to organization letter (manual)","[FNN-2400] User receives the Invitation to organization letter (manual)",""
"passed","Sun Apr 21 05:12:12 UTC 2024","Sun Apr 21 05:13:29 UTC 2024","77379","","Post Project","","Post Project","[FNN-587] Post project with account Positive","[FNN-587] Post project with account Positive",""
"passed","Sun Apr 21 05:04:45 UTC 2024","Sun Apr 21 05:04:54 UTC 2024","8700","","My Profile: [FNN-668] Edit account details Negative","","My Profile: [FNN-668] Edit account details Negative","should edit account details with invalid Twitter, LinkedIn and Website urls","should edit account details with invalid Twitter, LinkedIn and Website urls",""
"skipped","Sun Apr 21 04:47:49 UTC 2024","Sun Apr 21 04:47:49 UTC 2024","0","","[FNN-667] Send contact","","[FNN-667] Send contact","should forward the contact request","should forward the contact request",""
"passed","Sun Apr 21 05:01:37 UTC 2024","Sun Apr 21 05:01:45 UTC 2024","7435","","My Transactions: [FNN-738] Milestones project: Add milestone. Negative","","My Transactions: [FNN-738] Milestones project: Add milestone. Negative","should add milestone without Description","should add milestone without Description",""
"skipped","Sun Apr 21 05:26:12 UTC 2024","Sun Apr 21 05:26:12 UTC 2024","0","","My Transactions: [FNN-1431] Hourly project: In retrospect. Positive","","My Transactions: [FNN-1431] Hourly project: In retrospect. Positive","should verify that the money paid","should verify that the money paid",""
"passed","Sun Apr 21 04:13:57 UTC 2024","Sun Apr 21 04:14:29 UTC 2024","31770","","Subscribe: [FNN-577] Subscribe Negative","","Subscribe: [FNN-577] Subscribe Negative","should subscribe without data","should subscribe without data",""
"passed","Sun Apr 21 05:10:58 UTC 2024","Sun Apr 21 05:11:15 UTC 2024","16810","","My Profile: [FNN-730] Request reference Negative","","My Profile: [FNN-730] Request reference Negative","should pass step 3 without data","should pass step 3 without data",""
"passed","Sun Apr 21 05:04:34 UTC 2024","Sun Apr 21 05:04:40 UTC 2024","5513","","My Profile: [FNN-668] Edit account details Negative","","My Profile: [FNN-668] Edit account details Negative","should edit account details without sector","should edit account details without sector",""
"passed","Sun Apr 21 04:16:42 UTC 2024","Sun Apr 21 04:18:19 UTC 2024","97423","","My Profile: [FNN-699] Request reference Positive","","My Profile: [FNN-699] Request reference Positive","should add experience and request reference","should add experience and request reference",""
"passed","Sun Apr 21 04:32:44 UTC 2024","Sun Apr 21 04:33:49 UTC 2024","65102","","My Network: [FNN-1233] Invite manually via email without custom message with signup bonus","","My Network: [FNN-1233] Invite manually via email without custom message with signup bonus","should subscribe as the freelancer with recipient details and accept the invitation","should subscribe as the freelancer with recipient details and accept the invitation",""
"passed","Sun Apr 21 04:58:41 UTC 2024","Sun Apr 21 04:58:52 UTC 2024","10707","","CR: [FNN-744] CR Subscribe Negative","","CR: [FNN-744] CR Subscribe Negative","should subscribe as CR without company name","should subscribe as CR without company name",""
"passed","Sun Apr 21 05:05:02 UTC 2024","Sun Apr 21 05:05:29 UTC 2024","26480","","Upgrade: [FNN-659] Upgrade account Negative","","Upgrade: [FNN-659] Upgrade account Negative","should upgrade account to Standard 1 month: Generic decline","should upgrade account to Standard 1 month: Generic decline",""
"passed","Sun Apr 21 04:46:52 UTC 2024","Sun Apr 21 04:47:25 UTC 2024","33115","","Freelancer search: [FNN-924] Freelancer search as CR user","","Freelancer search: [FNN-924] Freelancer search as CR user","should filter freelancers by Location","should filter freelancers by Location",""
"passed","Sun Apr 21 04:35:52 UTC 2024","Sun Apr 21 04:36:26 UTC 2024","33892","","My Network: [FNN-620] Invite manually via email and sms Negative","","My Network: [FNN-620] Invite manually via email and sms Negative","should invite manually via sms without data","should invite manually via sms without data",""
"passed","Sun Apr 21 05:11:59 UTC 2024","Sun Apr 21 05:13:09 UTC 2024","70513","","Post Project: [FNN-588] Post project without account Negative","","Post Project: [FNN-588] Post project without account Negative","should post project without account details","should post project without account details",""
"passed","Sun Apr 21 04:58:52 UTC 2024","Sun Apr 21 04:59:02 UTC 2024","10874","","CR: [FNN-744] CR Subscribe Negative","","CR: [FNN-744] CR Subscribe Negative","should subscribe as CR without first name","should subscribe as CR without first name",""
"passed","Sun Apr 21 05:09:38 UTC 2024","Sun Apr 21 05:09:43 UTC 2024","5595","","My Profile: [FNN-719] Add resume Negative","","My Profile: [FNN-719] Add resume Negative","should add education without education","should add education without education",""
"passed","Sun Apr 21 04:16:26 UTC 2024","Sun Apr 21 04:18:05 UTC 2024","99251","","My Profile: [FNN-698] Confirm phone number Positive","","My Profile: [FNN-698] Confirm phone number Positive","should confirm phone number with valid code","should confirm phone number with valid code",""
"passed","Sun Apr 21 05:25:15 UTC 2024","Sun Apr 21 05:25:18 UTC 2024","2524","","CR","","CR","[FNN-2400] User receives the Invitation to organization letter (platform)","[FNN-2400] User receives the Invitation to organization letter (platform)",""
"skipped","Sun Apr 21 05:26:53 UTC 2024","Sun Apr 21 05:26:53 UTC 2024","0","","My Transactions: [FNN-708] Hourly project: In advance. Positive","","My Transactions: [FNN-708] Hourly project: In advance. Positive","should approve the time and pay for extra money","should approve the time and pay for extra money",""
"passed","Sun Apr 21 04:59:53 UTC 2024","Sun Apr 21 05:00:03 UTC 2024","10425","","CR: [FNN-744] CR Subscribe Negative","","CR: [FNN-744] CR Subscribe Negative","should subscribe as CR without phone number","should subscribe as CR without phone number",""
"passed","Sun Apr 21 04:13:01 UTC 2024","Sun Apr 21 04:13:11 UTC 2024","9985","","Subscribe: [FNN-577] Subscribe Negative","","Subscribe: [FNN-577] Subscribe Negative","should subscribe without password","should subscribe without password",""
"passed","Sun Apr 21 04:23:31 UTC 2024","Sun Apr 21 04:23:40 UTC 2024","9367","","Post Project: [FNN-649] Post project with account Negative","","Post Project: [FNN-649] Post project with account Negative","should post project without Category","should post project without Category",""
"passed","Sun Apr 21 04:18:49 UTC 2024","Sun Apr 21 04:19:54 UTC 2024","64578","","My Profile: [FNN-718] Add portfolio Negative","","My Profile: [FNN-718] Add portfolio Negative","should add portfolio without data","should add portfolio without data",""
"passed","Sun Apr 21 04:42:57 UTC 2024","Sun Apr 21 04:43:05 UTC 2024","7440","","Freelancer search: [FNN-822] Send message","","Freelancer search: [FNN-822] Send message","should check the message as the CR user","should check the message as the CR user",""
"passed","Sun Apr 21 04:09:00 UTC 2024","Sun Apr 21 04:09:03 UTC 2024","2639","","Login: [FNN-574] Log in from the Login page Negative","","Login: [FNN-574] Log in from the Login page Negative","should log in without email","should log in without email",""
"passed","Sun Apr 21 04:30:36 UTC 2024","Sun Apr 21 04:31:51 UTC 2024","75320","","Settings: [FNN-676] Change profile settings","","Settings: [FNN-676] Change profile settings","i don't want to display my profile in the database","i don't want to display my profile in the database",""
"passed","Sun Apr 21 04:45:02 UTC 2024","Sun Apr 21 04:45:07 UTC 2024","4933","","Create Profile: [FNN-684] Create profile Negative","","Create Profile: [FNN-684] Create profile Negative","should create profile with wrong website","should create profile with wrong website",""
"passed","Sun Apr 21 05:11:08 UTC 2024","Sun Apr 21 05:11:13 UTC 2024","5327","","My Profile: [FNN-719] Add resume Negative","","My Profile: [FNN-719] Add resume Negative","should add language without writing level","should add language without writing level",""
"passed","Sun Apr 21 04:10:06 UTC 2024","Sun Apr 21 04:11:24 UTC 2024","78012","","Subscribe: [FNN-577] Subscribe Negative","","Subscribe: [FNN-577] Subscribe Negative","should subscribe without category","should subscribe without category",""
"passed","Sun Apr 21 05:13:35 UTC 2024","Sun Apr 21 05:14:29 UTC 2024","54947","","My Network: [FNN-619] Invite manually via sms with signup bonus","","My Network: [FNN-619] Invite manually via sms with signup bonus","should invite manually via sms with valid recipient details","should invite manually via sms with valid recipient details",""
"passed","Sun Apr 21 05:01:49 UTC 2024","Sun Apr 21 05:02:31 UTC 2024","42092","","My Transactions: [FNN-710] Milestones project: In advance. Positive","","My Transactions: [FNN-710] Milestones project: In advance. Positive","should pay deposit","should pay deposit",""
"passed","Sun Apr 21 05:07:25 UTC 2024","Sun Apr 21 05:07:56 UTC 2024","31236","","Upgrade: [FNN-659] Upgrade account Negative","","Upgrade: [FNN-659] Upgrade account Negative","should upgrade account to Standard 1 month: Incorrect CVC decline","should upgrade account to Standard 1 month: Incorrect CVC decline",""
"passed","Sun Apr 21 05:03:07 UTC 2024","Sun Apr 21 05:03:20 UTC 2024","13715","","My Transactions: [FNN-710] Milestones project: In advance. Positive","","My Transactions: [FNN-710] Milestones project: In advance. Positive","should verify that the money paid","should verify that the money paid",""
"passed","Sun Apr 21 05:01:29 UTC 2024","Sun Apr 21 05:01:49 UTC 2024","19730","","My Transactions: [FNN-710] Milestones project: In advance. Positive","","My Transactions: [FNN-710] Milestones project: In advance. Positive","should accept the project","should accept the project",""
"passed","Sun Apr 21 04:51:27 UTC 2024","Sun Apr 21 04:56:48 UTC 2024","320885","","My Transactions: [FNN-1439] Hourly project: Add time. Negative","","My Transactions: [FNN-1439] Hourly project: Add time. Negative","should add hours without Date and Hours","should add hours without Date and Hours",""
"passed","Sun Apr 21 05:03:46 UTC 2024","Sun Apr 21 05:05:02 UTC 2024","75671","","Upgrade: [FNN-659] Upgrade account Negative","","Upgrade: [FNN-659] Upgrade account Negative","should upgrade account to Standard 1 month without required fields","should upgrade account to Standard 1 month without required fields",""
"passed","Sun Apr 21 05:19:00 UTC 2024","Sun Apr 21 05:19:52 UTC 2024","52016","","Freelancer search: [FNN-815] Freelancer search as non-CR user","","Freelancer search: [FNN-815] Freelancer search as non-CR user","should filter freelancers by Skills","should filter freelancers by Skills",""
