"Status","Start Time","Stop Time","Duration in ms","Parent Suite","Suite","Sub Suite","Test Class","Test Method","Name","Description"
"passed","Fri Nov 24 08:36:15 UTC 2023","Fri Nov 24 08:36:23 UTC 2023","7907","","Subscribe: [FNN-577] Subscribe Negative","","Subscribe: [FNN-577] Subscribe Negative","should subscribe without password","should subscribe without password",""
"failed","Fri Nov 24 08:09:45 UTC 2023","Fri Nov 24 08:10:19 UTC 2023","33424","","Settings: [FNN-672] Change email address Negative","","Settings: [FNN-672] Change email address Negative","""before all"" hook for [FNN-672] Change email address Negative","""before all"" hook for [FNN-672] Change email address Negative",""
"passed","Fri Nov 24 08:21:53 UTC 2023","Fri Nov 24 08:22:40 UTC 2023","46744","","[FNN-717] Edit email settings","","[FNN-717] Edit email settings","should edit Email settings and verify that the settings are saved","should edit Email settings and verify that the settings are saved",""
"broken","Fri Nov 24 08:51:18 UTC 2023","Fri Nov 24 08:51:38 UTC 2023","19615","","CR: [FNN-750] Invite to the organization through search","","CR: [FNN-750] Invite to the organization through search","should accept invitation","should accept invitation",""
"passed","Fri Nov 24 08:31:27 UTC 2023","Fri Nov 24 08:31:34 UTC 2023","6581","","CR: [FNN-744] CR Subscribe Negative","","CR: [FNN-744] CR Subscribe Negative","should subscribe as CR without password","should subscribe as CR without password",""
"passed","Fri Nov 24 08:35:29 UTC 2023","Fri Nov 24 08:35:32 UTC 2023","3339","","My Profile: [FNN-668] Edit account details Negative","","My Profile: [FNN-668] Edit account details Negative","should edit account details without Chamber of Commerce","should edit account details without Chamber of Commerce",""
"failed","Fri Nov 24 08:41:19 UTC 2023","Fri Nov 24 08:41:57 UTC 2023","37824","","Post Project: [FNN-588] Post project without account Negative","","Post Project: [FNN-588] Post project without account Negative","should post project with taken phone number","should post project with taken phone number",""
"passed","Fri Nov 24 08:24:35 UTC 2023","Fri Nov 24 08:28:12 UTC 2023","217205","","My Transactions: [FNN-1432] Milestones project: Start project. Negative","","My Transactions: [FNN-1432] Milestones project: Start project. Negative","should start project without milestone","should start project without milestone",""
"passed","Fri Nov 24 08:43:33 UTC 2023","Fri Nov 24 08:43:40 UTC 2023","7037","","Freelancer search: [FNN-822] Send message","","Freelancer search: [FNN-822] Send message","should check the message as the CR user","should check the message as the CR user",""
"passed","Fri Nov 24 08:35:21 UTC 2023","Fri Nov 24 08:35:24 UTC 2023","3345","","My Profile: [FNN-668] Edit account details Negative","","My Profile: [FNN-668] Edit account details Negative","should edit account details with invalid phone number","should edit account details with invalid phone number",""
"passed","Fri Nov 24 08:42:28 UTC 2023","Fri Nov 24 08:42:46 UTC 2023","17665","","My Network: [FNN-664] Invite freelancer","","My Network: [FNN-664] Invite freelancer","should check network as sender user","should check network as sender user",""
"passed","Fri Nov 24 08:40:33 UTC 2023","Fri Nov 24 08:40:38 UTC 2023","4579","","My Profile: [FNN-719] Add resume Negative","","My Profile: [FNN-719] Add resume Negative","should add language without levels","should add language without levels",""
"passed","Fri Nov 24 08:41:49 UTC 2023","Fri Nov 24 08:42:07 UTC 2023","18316","","My Network: [FNN-1027] Invite freelancers","","My Network: [FNN-1027] Invite freelancers","should check network as sender user","should check network as sender user",""
"passed","Fri Nov 24 08:06:08 UTC 2023","Fri Nov 24 08:06:29 UTC 2023","21045","","My Profile: [FNN-718] Add portfolio Negative","","My Profile: [FNN-718] Add portfolio Negative","should add portfolio without Type","should add portfolio without Type",""
"passed","Fri Nov 24 08:04:28 UTC 2023","Fri Nov 24 08:05:47 UTC 2023","79308","","My Profile: [FNN-699] Request reference Positive","","My Profile: [FNN-699] Request reference Positive","should add experience and request reference","should add experience and request reference",""
"passed","Fri Nov 24 08:49:17 UTC 2023","Fri Nov 24 08:49:30 UTC 2023","12769","","My Transactions: [FNN-1430] Milestones project: In retrospect. Positive","","My Transactions: [FNN-1430] Milestones project: In retrospect. Positive","should accept the project and request payout","should accept the project and request payout",""
"passed","Fri Nov 24 08:41:01 UTC 2023","Fri Nov 24 08:41:19 UTC 2023","18032","","Post Project: [FNN-588] Post project without account Negative","","Post Project: [FNN-588] Post project without account Negative","should post project without phone number","should post project without phone number",""
"passed","Fri Nov 24 08:15:04 UTC 2023","Fri Nov 24 08:15:08 UTC 2023","3922","","My Network: [FNN-620] Invite manually via email and sms Negative","","My Network: [FNN-620] Invite manually via email and sms Negative","should invite manually via email without data","should invite manually via email without data",""
"passed","Fri Nov 24 08:30:43 UTC 2023","Fri Nov 24 08:30:50 UTC 2023","6550","","CR: [FNN-744] CR Subscribe Negative","","CR: [FNN-744] CR Subscribe Negative","should subscribe as CR without email","should subscribe as CR without email",""
"passed","Fri Nov 24 08:18:14 UTC 2023","Fri Nov 24 08:18:23 UTC 2023","8241","","Freelancer search: [FNN-816] Create list Functionality","","Freelancer search: [FNN-816] Create list Functionality","should re-open original search","should re-open original search",""
"passed","Fri Nov 24 08:16:29 UTC 2023","Fri Nov 24 08:16:36 UTC 2023","6812","","Search Project: [FNN-568] Project search","","Search Project: [FNN-568] Project search","should filter projects by Posted since Last 3 days","should filter projects by Posted since Last 3 days",""
"passed","Fri Nov 24 08:03:57 UTC 2023","Fri Nov 24 08:05:51 UTC 2023","114348","","My Profile: [FNN-669] Edit account details Positive","","My Profile: [FNN-669] Edit account details Positive","should edit employer account details with valid information","should edit employer account details with valid information",""
"passed","Fri Nov 24 08:41:46 UTC 2023","Fri Nov 24 08:43:14 UTC 2023","88076","","Freelancer search: [FNN-817] Add note","","Freelancer search: [FNN-817] Add note","should add a note via the note button","should add a note via the note button",""
"passed","Fri Nov 24 08:02:00 UTC 2023","Fri Nov 24 08:03:10 UTC 2023","69725","","Upgrade: [FNN-658] Upgrade account Positive","","Upgrade: [FNN-658] Upgrade account Positive","should upgrade account to Premium 1 month","should upgrade account to Premium 1 month",""
"passed","Fri Nov 24 08:50:13 UTC 2023","Fri Nov 24 08:51:18 UTC 2023","65008","","CR: [FNN-750] Invite to the organization through search","","CR: [FNN-750] Invite to the organization through search","should invite freelancer","should invite freelancer",""
"passed","Fri Nov 24 08:02:00 UTC 2023","Fri Nov 24 08:02:40 UTC 2023","39930","","Upgrade: [FNN-659] Upgrade account Negative","","Upgrade: [FNN-659] Upgrade account Negative","should upgrade account to Standard 1 month Refuse","should upgrade account to Standard 1 month Refuse",""
"passed","Fri Nov 24 08:30:36 UTC 2023","Fri Nov 24 08:30:43 UTC 2023","6841","","CR: [FNN-744] CR Subscribe Negative","","CR: [FNN-744] CR Subscribe Negative","should subscribe as CR without last name","should subscribe as CR without last name",""
"passed","Fri Nov 24 08:16:25 UTC 2023","Fri Nov 24 08:16:29 UTC 2023","4780","","Search Project: [FNN-568] Project search","","Search Project: [FNN-568] Project search","should filter projects by Status Open projects","should filter projects by Status Open projects",""
"failed","Fri Nov 24 08:09:08 UTC 2023","Fri Nov 24 08:09:41 UTC 2023","32637","","Post Project: [FNN-649] Post project with account Negative","","Post Project: [FNN-649] Post project with account Negative","should post project without step 2","should post project without step 2",""
"passed","Fri Nov 24 08:28:33 UTC 2023","Fri Nov 24 08:28:52 UTC 2023","18784","","My Transactions: [FNN-1431] Hourly project: In retrospect. Positive","","My Transactions: [FNN-1431] Hourly project: In retrospect. Positive","should verify that the money paid","should verify that the money paid",""
"passed","Fri Nov 24 08:33:22 UTC 2023","Fri Nov 24 08:33:25 UTC 2023","3572","","CR: [FNN-751] Invite to the organization manually Negative","","CR: [FNN-751] Invite to the organization manually Negative","should invite manually to the organization without first name","should invite manually to the organization without first name",""
"passed","Fri Nov 24 08:42:31 UTC 2023","Fri Nov 24 08:42:48 UTC 2023","16823","","Post Project: [FNN-588] Post project without account Negative","","Post Project: [FNN-588] Post project without account Negative","should post project without repeat password","should post project without repeat password",""
"passed","Fri Nov 24 08:04:50 UTC 2023","Fri Nov 24 08:05:17 UTC 2023","27119","","My Profile: [FNN-690] Add resume Positive","","My Profile: [FNN-690] Add resume Positive","should check the attached part of the resume on the Profile page","should check the attached part of the resume on the Profile page",""
"passed","Fri Nov 24 08:38:27 UTC 2023","Fri Nov 24 08:38:35 UTC 2023","8806","","My Profile: [FNN-719] Add resume Negative","","My Profile: [FNN-719] Add resume Negative","should add experience without period from  ","should add experience without period from  ",""
"passed","Fri Nov 24 08:33:44 UTC 2023","Fri Nov 24 08:33:46 UTC 2023","2087","","Login: [FNN-574] Log in from the Login page Negative","","Login: [FNN-574] Log in from the Login page Negative","should log in with wrong email format","should log in with wrong email format",""
"passed","Fri Nov 24 08:40:15 UTC 2023","Fri Nov 24 08:40:21 UTC 2023","5892","","My Profile: [FNN-719] Add resume Negative","","My Profile: [FNN-719] Add resume Negative","should add certificate without certificate","should add certificate without certificate",""
"passed","Fri Nov 24 08:00:46 UTC 2023","Fri Nov 24 08:02:00 UTC 2023","74017","","Upgrade: [FNN-658] Upgrade account Positive","","Upgrade: [FNN-658] Upgrade account Positive","should upgrade account to Standaard 1 month","should upgrade account to Standaard 1 month",""
"passed","Fri Nov 24 08:31:10 UTC 2023","Fri Nov 24 08:31:19 UTC 2023","8523","","CR: [FNN-744] CR Subscribe Negative","","CR: [FNN-744] CR Subscribe Negative","should subscribe as CR with wrong phone number","should subscribe as CR with wrong phone number",""
"passed","Fri Nov 24 08:05:47 UTC 2023","Fri Nov 24 08:06:05 UTC 2023","18455","","My Profile: [FNN-699] Request reference Positive","","My Profile: [FNN-699] Request reference Positive","should validate reference","should validate reference",""
"passed","Fri Nov 24 08:28:30 UTC 2023","Fri Nov 24 08:28:34 UTC 2023","4006","","My Transactions: [FNN-1439] Hourly project: Add time. Negative","","My Transactions: [FNN-1439] Hourly project: Add time. Negative","should add hours without Date","should add hours without Date",""
"passed","Fri Nov 24 08:14:52 UTC 2023","Fri Nov 24 08:14:56 UTC 2023","3950","","My Network: [FNN-620] Invite manually via email and sms Negative","","My Network: [FNN-620] Invite manually via email and sms Negative","should invite manually via email with wrong email format","should invite manually via email with wrong email format",""
"passed","Fri Nov 24 08:15:14 UTC 2023","Fri Nov 24 08:15:26 UTC 2023","11407","","Search Project: [FNN-568] Project search","","Search Project: [FNN-568] Project search","should filter projects by Search terms","should filter projects by Search terms",""
"passed","Fri Nov 24 08:33:25 UTC 2023","Fri Nov 24 08:33:27 UTC 2023","2151","","CR: [FNN-751] Invite to the organization manually Negative","","CR: [FNN-751] Invite to the organization manually Negative","should invite manually to the organization without last name","should invite manually to the organization without last name",""
"passed","Fri Nov 24 08:21:06 UTC 2023","Fri Nov 24 08:22:29 UTC 2023","83351","","Freelancer search: [FNN-846] Invite to project","","Freelancer search: [FNN-846] Invite to project","should verify if the ""Assign project"" button is enable","should verify if the ""Assign project"" button is enable",""
"passed","Fri Nov 24 08:36:23 UTC 2023","Fri Nov 24 08:36:32 UTC 2023","8912","","Subscribe: [FNN-577] Subscribe Negative","","Subscribe: [FNN-577] Subscribe Negative","should subscribe without repeat password","should subscribe without repeat password",""
"passed","Fri Nov 24 08:01:43 UTC 2023","Fri Nov 24 08:02:00 UTC 2023","16971","","Upgrade: [FNN-659] Upgrade account Negative","","Upgrade: [FNN-659] Upgrade account Negative","should upgrade account to Standard 1 month Pending","should upgrade account to Standard 1 month Pending",""
"passed","Fri Nov 24 08:02:45 UTC 2023","Fri Nov 24 08:03:36 UTC 2023","50465","","My Profile: [FNN-690] Add resume Positive","","My Profile: [FNN-690] Add resume Positive","should add CV","should add CV",""
"passed","Fri Nov 24 08:16:55 UTC 2023","Fri Nov 24 08:18:17 UTC 2023","81859","","Search Project: [FNN-568] Project search","","Search Project: [FNN-568] Project search","should filter projects by Number of responses","should filter projects by Number of responses",""
"failed","Fri Nov 24 08:07:48 UTC 2023","Fri Nov 24 08:08:13 UTC 2023","25275","","My Profile: [FNN-730] Request reference Negative","","My Profile: [FNN-730] Request reference Negative","""after all"" hook for [FNN-730] Request reference Negative","""after all"" hook for [FNN-730] Request reference Negative",""
"passed","Fri Nov 24 08:36:04 UTC 2023","Fri Nov 24 08:37:16 UTC 2023","72557","","My Profile: [FNN-795] Remove portfolio","","My Profile: [FNN-795] Remove portfolio","should remove portfolio","should remove portfolio",""
"passed","Fri Nov 24 08:03:21 UTC 2023","Fri Nov 24 08:04:36 UTC 2023","74989","","My Profile: [FNN-698] Confirm phone number Positive","","My Profile: [FNN-698] Confirm phone number Positive","should confirm phone number with valid code","should confirm phone number with valid code",""
"passed","Fri Nov 24 08:14:32 UTC 2023","Fri Nov 24 08:14:52 UTC 2023","20801","","My Network: [FNN-620] Invite manually via email and sms Negative","","My Network: [FNN-620] Invite manually via email and sms Negative","should invite manually via email without email","should invite manually via email without email",""
"passed","Fri Nov 24 08:05:24 UTC 2023","Fri Nov 24 08:06:08 UTC 2023","44161","","My Profile: [FNN-718] Add portfolio Negative","","My Profile: [FNN-718] Add portfolio Negative","should add portfolio without data","should add portfolio without data",""
"passed","Fri Nov 24 08:30:29 UTC 2023","Fri Nov 24 08:30:36 UTC 2023","7195","","CR: [FNN-744] CR Subscribe Negative","","CR: [FNN-744] CR Subscribe Negative","should subscribe as CR without first name","should subscribe as CR without first name",""
"broken","Fri Nov 24 08:43:43 UTC 2023","Fri Nov 24 08:45:38 UTC 2023","114624","","Freelancer search: [FNN-924] Freelancer search as CR user","","Freelancer search: [FNN-924] Freelancer search as CR user","""before all"" hook for [FNN-924] Freelancer search as CR user","""before all"" hook for [FNN-924] Freelancer search as CR user",""
"passed","Fri Nov 24 08:33:29 UTC 2023","Fri Nov 24 08:33:49 UTC 2023","19903","","CR: [FNN-751] Invite to the organization manually Negative","","CR: [FNN-751] Invite to the organization manually Negative","should invite manually to the organization without role","should invite manually to the organization without role",""
"passed","Fri Nov 24 08:16:43 UTC 2023","Fri Nov 24 08:16:55 UTC 2023","12377","","Search Project: [FNN-568] Project search","","Search Project: [FNN-568] Project search","should filter projects by Posted since Last 30 days","should filter projects by Posted since Last 30 days",""
"broken","Fri Nov 24 08:41:21 UTC 2023","Fri Nov 24 08:41:42 UTC 2023","21057","","Freelancer search: [FNN-815] Freelancer search as non-CR user","","Freelancer search: [FNN-815] Freelancer search as non-CR user","""after all"" hook for [FNN-815] Freelancer search as non-CR user","""after all"" hook for [FNN-815] Freelancer search as non-CR user",""
"passed","Fri Nov 24 08:35:17 UTC 2023","Fri Nov 24 08:35:21 UTC 2023","3521","","My Profile: [FNN-668] Edit account details Negative","","My Profile: [FNN-668] Edit account details Negative","should edit account details without sector","should edit account details without sector",""
"passed","Fri Nov 24 08:31:50 UTC 2023","Fri Nov 24 08:31:56 UTC 2023","6096","","CR: [FNN-744] CR Subscribe Negative","","CR: [FNN-744] CR Subscribe Negative","should subscribe as CR with invalid repeat password","should subscribe as CR with invalid repeat password",""
"passed","Fri Nov 24 08:43:24 UTC 2023","Fri Nov 24 08:44:11 UTC 2023","46712","","Freelancer search: [FNN-817] Add note","","Freelancer search: [FNN-817] Add note","should add note from the notes popup","should add note from the notes popup",""
"broken","Fri Nov 24 08:40:14 UTC 2023","Fri Nov 24 08:41:00 UTC 2023","46306","","My Network: [FNN-1232] Invite manually via email with custom message","","My Network: [FNN-1232] Invite manually via email with custom message","should invite manually via email with valid recipient data and with message","should invite manually via email with valid recipient data and with message",""
"passed","Fri Nov 24 08:18:33 UTC 2023","Fri Nov 24 08:20:53 UTC 2023","139682","","Freelancer search: [FNN-846] Invite to project","","Freelancer search: [FNN-846] Invite to project","should invite to a project via the ""Invite to project"" action","should invite to a project via the ""Invite to project"" action",""
"passed","Fri Nov 24 08:33:46 UTC 2023","Fri Nov 24 08:33:48 UTC 2023","2122","","Login: [FNN-574] Log in from the Login page Negative","","Login: [FNN-574] Log in from the Login page Negative","should log in without email","should log in without email",""
"passed","Fri Nov 24 08:36:24 UTC 2023","Fri Nov 24 08:36:42 UTC 2023","17848","","My Profile: [FNN-793] Remove resume","","My Profile: [FNN-793] Remove resume","should remove resume","should remove resume",""
"passed","Fri Nov 24 08:28:12 UTC 2023","Fri Nov 24 08:28:23 UTC 2023","10445","","My Transactions: [FNN-1432] Milestones project: Start project. Negative","","My Transactions: [FNN-1432] Milestones project: Start project. Negative","should start project without Way of paying","should start project without Way of paying",""
"failed","Fri Nov 24 08:45:11 UTC 2023","Fri Nov 24 08:46:01 UTC 2023","50302","","Create Profile: [FNN-684] Create profile Negative","","Create Profile: [FNN-684] Create profile Negative","should create profile with short Description of yourself","should create profile with short Description of yourself",""
"broken","Fri Nov 24 08:09:56 UTC 2023","Fri Nov 24 08:10:28 UTC 2023","32191","","Post Project: [FNN-649] Post project with account Negative","","Post Project: [FNN-649] Post project with account Negative","should post project without Work on location","should post project without Work on location",""
"broken","Fri Nov 24 08:19:51 UTC 2023","Fri Nov 24 08:20:19 UTC 2023","28092","","Create Profile: [FNN-683] Create profile Positive","","Create Profile: [FNN-683] Create profile Positive","""before all"" hook for [FNN-683] Create profile Positive","""before all"" hook for [FNN-683] Create profile Positive",""
"failed","Fri Nov 24 08:15:48 UTC 2023","Fri Nov 24 08:21:17 UTC 2023","329040","","My Projects: [FNN-971] Complete project Positive","","My Projects: [FNN-971] Complete project Positive","should complete project","should complete project",""
"passed","Fri Nov 24 08:31:56 UTC 2023","Fri Nov 24 08:32:03 UTC 2023","6438","","CR: [FNN-744] CR Subscribe Negative","","CR: [FNN-744] CR Subscribe Negative","should subscribe as CR without agreeing to the Terms and Conditions","should subscribe as CR without agreeing to the Terms and Conditions",""
"passed","Fri Nov 24 08:33:50 UTC 2023","Fri Nov 24 08:34:09 UTC 2023","18875","","Login: [FNN-574] Log in from the Login page Negative","","Login: [FNN-574] Log in from the Login page Negative","should log in without credentials","should log in without credentials",""
"passed","Fri Nov 24 08:33:48 UTC 2023","Fri Nov 24 08:33:50 UTC 2023","1825","","Login: [FNN-574] Log in from the Login page Negative","","Login: [FNN-574] Log in from the Login page Negative","should log in without password","should log in without password",""
"broken","Fri Nov 24 08:40:36 UTC 2023","Fri Nov 24 08:41:49 UTC 2023","72709","","My Network: [FNN-1027] Invite freelancers","","My Network: [FNN-1027] Invite freelancers","""before all"" hook for [FNN-1027] Invite freelancers","""before all"" hook for [FNN-1027] Invite freelancers",""
"failed","Fri Nov 24 08:44:33 UTC 2023","Fri Nov 24 08:47:00 UTC 2023","146453","","[FNN-661] Send interest","","[FNN-661] Send interest","should send interest in the employer's project","should send interest in the employer's project",""
"passed","Fri Nov 24 08:36:41 UTC 2023","Fri Nov 24 08:36:49 UTC 2023","8004","","Subscribe: [FNN-577] Subscribe Negative","","Subscribe: [FNN-577] Subscribe Negative","should subscribe with invalid repeat password","should subscribe with invalid repeat password",""
"passed","Fri Nov 24 08:10:23 UTC 2023","Fri Nov 24 08:10:47 UTC 2023","23906","","Settings: [FNN-675] Change password Negative","","Settings: [FNN-675] Change password Negative","should change password without new and repeat password","should change password without new and repeat password",""
"passed","Fri Nov 24 08:16:51 UTC 2023","Fri Nov 24 08:18:14 UTC 2023","83289","","Freelancer search: [FNN-816] Create list Functionality","","Freelancer search: [FNN-816] Create list Functionality","should create a list of freelancers","should create a list of freelancers",""
"passed","Fri Nov 24 08:42:14 UTC 2023","Fri Nov 24 08:42:31 UTC 2023","17160","","Post Project: [FNN-588] Post project without account Negative","","Post Project: [FNN-588] Post project without account Negative","should post project without password","should post project without password",""
"passed","Fri Nov 24 08:33:52 UTC 2023","Fri Nov 24 08:34:28 UTC 2023","35972","","Login: [FNN-685] Log out","","Login: [FNN-685] Log out","should log out","should log out",""
"passed","Fri Nov 24 08:15:26 UTC 2023","Fri Nov 24 08:15:37 UTC 2023","11117","","Search Project: [FNN-568] Project search","","Search Project: [FNN-568] Project search","should filter projects by Location","should filter projects by Location",""
"passed","Fri Nov 24 08:35:29 UTC 2023","Fri Nov 24 08:35:38 UTC 2023","9066","","Subscribe: [FNN-577] Subscribe Negative","","Subscribe: [FNN-577] Subscribe Negative","should subscribe with wrong email format","should subscribe with wrong email format",""
"passed","Fri Nov 24 08:32:41 UTC 2023","Fri Nov 24 08:33:18 UTC 2023","37033","","CR: [FNN-751] Invite to the organization manually Negative","","CR: [FNN-751] Invite to the organization manually Negative","should invite manually to the organization without email","should invite manually to the organization without email",""
"passed","Fri Nov 24 08:38:17 UTC 2023","Fri Nov 24 08:38:27 UTC 2023","9925","","My Profile: [FNN-719] Add resume Negative","","My Profile: [FNN-719] Add resume Negative","should add experience without company","should add experience without company",""
"failed","Fri Nov 24 08:35:13 UTC 2023","Fri Nov 24 08:36:24 UTC 2023","71216","","My Profile: [FNN-793] Remove resume","","My Profile: [FNN-793] Remove resume","""before all"" hook for [FNN-793] Remove resume","""before all"" hook for [FNN-793] Remove resume",""
"passed","Fri Nov 24 08:29:39 UTC 2023","Fri Nov 24 08:29:48 UTC 2023","9110","","My Transactions: [FNN-708] Hourly project: In advance. Positive","","My Transactions: [FNN-708] Hourly project: In advance. Positive","should verify that the period is closed","should verify that the period is closed",""
"passed","Fri Nov 24 08:30:56 UTC 2023","Fri Nov 24 08:31:04 UTC 2023","7686","","CR: [FNN-744] CR Subscribe Negative","","CR: [FNN-744] CR Subscribe Negative","should subscribe as CR with taken email","should subscribe as CR with taken email",""
"passed","Fri Nov 24 08:33:27 UTC 2023","Fri Nov 24 08:33:29 UTC 2023","1794","","CR: [FNN-751] Invite to the organization manually Negative","","CR: [FNN-751] Invite to the organization manually Negative","should invite manually to the organization without first step","should invite manually to the organization without first step",""
"passed","Fri Nov 24 08:09:16 UTC 2023","Fri Nov 24 08:09:58 UTC 2023","41730","","Settings: [FNN-671] Change email address Positive","","Settings: [FNN-671] Change email address Positive","should change email address with valid credentials","should change email address with valid credentials",""
"passed","Fri Nov 24 08:31:42 UTC 2023","Fri Nov 24 08:32:22 UTC 2023","40080","","My Transactions: [FNN-710] Milestones project: In advance. Positive","","My Transactions: [FNN-710] Milestones project: In advance. Positive","should pay deposit","should pay deposit",""
"passed","Fri Nov 24 08:40:45 UTC 2023","Fri Nov 24 08:41:08 UTC 2023","22297","","My Profile: [FNN-719] Add resume Negative","","My Profile: [FNN-719] Add resume Negative","should add language without reading level","should add language without reading level",""
"passed","Fri Nov 24 08:38:05 UTC 2023","Fri Nov 24 08:38:08 UTC 2023","3614","","My Profile: [FNN-719] Add resume Negative","","My Profile: [FNN-719] Add resume Negative","should add experience without data","should add experience without data",""
