"Status","Start Time","Stop Time","Duration in ms","Parent Suite","Suite","Sub Suite","Test Class","Test Method","Name","Description"
"passed","Sat Mar 23 04:56:10 UTC 2024","Sat Mar 23 04:56:21 UTC 2024","10402","","CR: [FNN-744] CR Subscribe Negative","","CR: [FNN-744] CR Subscribe Negative","should subscribe as CR without phone number","should subscribe as CR without phone number",""
"passed","Sat Mar 23 04:41:12 UTC 2024","Sat Mar 23 04:41:20 UTC 2024","8502","","Create Profile: [FNN-684] Create profile Negative","","Create Profile: [FNN-684] Create profile Negative","should create profile without Profile picture","should create profile without Profile picture",""
"passed","Sat Mar 23 04:39:18 UTC 2024","Sat Mar 23 04:40:49 UTC 2024","91307","","Create Profile: [FNN-683] Create profile Positive","","Create Profile: [FNN-683] Create profile Positive","should create profile with valid data","should create profile with valid data",""
"passed","Sat Mar 23 04:55:01 UTC 2024","Sat Mar 23 04:55:12 UTC 2024","10998","","CR: [FNN-744] CR Subscribe Negative","","CR: [FNN-744] CR Subscribe Negative","should subscribe as CR without company name","should subscribe as CR without company name",""
"passed","Sat Mar 23 05:06:00 UTC 2024","Sat Mar 23 05:06:22 UTC 2024","22069","","Post Project: [FNN-588] Post project without account Negative","","Post Project: [FNN-588] Post project without account Negative","should post project with wrong email","should post project with wrong email",""
"passed","Sat Mar 23 05:02:15 UTC 2024","Sat Mar 23 05:02:19 UTC 2024","4718","","My Profile: [FNN-719] Add resume Negative","","My Profile: [FNN-719] Add resume Negative","should add education without education","should add education without education",""
"passed","Sat Mar 23 04:51:33 UTC 2024","Sat Mar 23 04:56:16 UTC 2024","282363","","My Transactions: [FNN-738] Milestones project: Add milestone. Negative","","My Transactions: [FNN-738] Milestones project: Add milestone. Negative","should add milestone without Amount, Delivery date, and Description","should add milestone without Amount, Delivery date, and Description",""
"passed","Sat Mar 23 04:15:11 UTC 2024","Sat Mar 23 04:15:18 UTC 2024","7093","","My Profile: [FNN-690] Add resume Positive","","My Profile: [FNN-690] Add resume Positive","should add Motivation","should add Motivation",""
"passed","Sat Mar 23 04:09:55 UTC 2024","Sat Mar 23 04:09:57 UTC 2024","2485","","Login: [FNN-563] Log in from the header Negative","","Login: [FNN-563] Log in from the header Negative","should log in without email","should log in without email",""
"passed","Sat Mar 23 04:39:34 UTC 2024","Sat Mar 23 04:40:33 UTC 2024","58449","","Freelancer search: [FNN-817] Add note","","Freelancer search: [FNN-817] Add note","should add note from the notes popup","should add note from the notes popup",""
"passed","Sat Mar 23 04:43:24 UTC 2024","Sat Mar 23 04:43:59 UTC 2024","35486","","[FNN-717] Edit email settings","","[FNN-717] Edit email settings","should edit Notification settings and verify that the settings are saved","should edit Notification settings and verify that the settings are saved",""
"passed","Sat Mar 23 05:03:36 UTC 2024","Sat Mar 23 05:03:40 UTC 2024","3771","","My Profile: [FNN-719] Add resume Negative","","My Profile: [FNN-719] Add resume Negative","should add language without levels","should add language without levels",""
"skipped","Sat Mar 23 05:15:20 UTC 2024","Sat Mar 23 05:15:20 UTC 2024","1","","My Transactions: [FNN-1430] Milestones project: In retrospect. Positive","","My Transactions: [FNN-1430] Milestones project: In retrospect. Positive","should approve milestone and pay for it","should approve milestone and pay for it",""
"passed","Sat Mar 23 05:03:28 UTC 2024","Sat Mar 23 05:03:36 UTC 2024","8210","","My Profile: [FNN-719] Add resume Negative","","My Profile: [FNN-719] Add resume Negative","should add certificate without achieved annual","should add certificate without achieved annual",""
"passed","Sat Mar 23 04:10:13 UTC 2024","Sat Mar 23 04:10:24 UTC 2024","11091","","Subscribe: [FNN-577] Subscribe Negative","","Subscribe: [FNN-577] Subscribe Negative","should subscribe without first name","should subscribe without first name",""
"passed","Sat Mar 23 04:23:25 UTC 2024","Sat Mar 23 04:23:38 UTC 2024","12100","","Post Project: [FNN-649] Post project with account Negative","","Post Project: [FNN-649] Post project with account Negative","should post project without step 2","should post project without step 2",""
"passed","Sat Mar 23 04:10:47 UTC 2024","Sat Mar 23 04:10:51 UTC 2024","4100","","Login: [FNN-574] Log in from the Login page Negative","","Login: [FNN-574] Log in from the Login page Negative","should log in with wrong email format","should log in with wrong email format",""
"passed","Sat Mar 23 04:11:05 UTC 2024","Sat Mar 23 04:12:11 UTC 2024","66156","","Login: [FNN-685] Log out","","Login: [FNN-685] Log out","should log out","should log out",""
"skipped","Sat Mar 23 05:02:56 UTC 2024","Sat Mar 23 05:02:56 UTC 2024","0","","Post Project: [FNN-650] Post project without account Positive","","Post Project: [FNN-650] Post project without account Positive","should verify that the user received a welcome letter","should verify that the user received a welcome letter",""
"passed","Sat Mar 23 05:02:56 UTC 2024","Sat Mar 23 05:03:02 UTC 2024","5157","","Post Project: [FNN-650] Post project without account Positive","","Post Project: [FNN-650] Post project without account Positive","should verify that the user received a verify email letter","should verify that the user received a verify email letter",""
"passed","Sat Mar 23 04:56:34 UTC 2024","Sat Mar 23 04:56:48 UTC 2024","14474","","CR: [FNN-744] CR Subscribe Negative","","CR: [FNN-744] CR Subscribe Negative","should subscribe as CR with taken phone number","should subscribe as CR with taken phone number",""
"passed","Sat Mar 23 04:14:53 UTC 2024","Sat Mar 23 04:15:19 UTC 2024","25763","","Upgrade: [FNN-659] Upgrade account Negative","","Upgrade: [FNN-659] Upgrade account Negative","should upgrade account to Standard 1 month: Incorrect CVC decline","should upgrade account to Standard 1 month: Incorrect CVC decline",""
"skipped","Sat Mar 23 05:07:16 UTC 2024","Sat Mar 23 05:07:54 UTC 2024","38177","","My Network: [FNN-619] Invite manually via sms with signup bonus","","My Network: [FNN-619] Invite manually via sms with signup bonus","should check My Dashboard and My Transactions page for the signup bonus as the inviter user","should check My Dashboard and My Transactions page for the signup bonus as the inviter user",""
"passed","Sat Mar 23 04:41:20 UTC 2024","Sat Mar 23 04:42:00 UTC 2024","39521","","Create Profile: [FNN-684] Create profile Negative","","Create Profile: [FNN-684] Create profile Negative","should create profile without Description of yourself","should create profile without Description of yourself",""
"passed","Sat Mar 23 05:01:00 UTC 2024","Sat Mar 23 05:01:03 UTC 2024","3246","","My Profile: [FNN-719] Add resume Negative","","My Profile: [FNN-719] Add resume Negative","should add experience without data","should add experience without data",""
"passed","Sat Mar 23 05:03:53 UTC 2024","Sat Mar 23 05:04:02 UTC 2024","9214","","My Profile: [FNN-730] Request reference Negative","","My Profile: [FNN-730] Request reference Negative","should pass step 3 without comments","should pass step 3 without comments",""
"passed","Sat Mar 23 04:12:24 UTC 2024","Sat Mar 23 04:12:36 UTC 2024","11705","","Subscribe: [FNN-577] Subscribe Negative","","Subscribe: [FNN-577] Subscribe Negative","should subscribe with invalid repeat password","should subscribe with invalid repeat password",""
"passed","Sat Mar 23 05:02:08 UTC 2024","Sat Mar 23 05:02:16 UTC 2024","7708","","My Profile: [FNN-730] Request reference Negative","","My Profile: [FNN-730] Request reference Negative","should pass step 2 without last name","should pass step 2 without last name",""
"passed","Sat Mar 23 04:56:48 UTC 2024","Sat Mar 23 04:56:59 UTC 2024","10197","","CR: [FNN-744] CR Subscribe Negative","","CR: [FNN-744] CR Subscribe Negative","should subscribe as CR without password","should subscribe as CR without password",""
"passed","Sat Mar 23 04:25:22 UTC 2024","Sat Mar 23 04:26:11 UTC 2024","48353","","Post Project: [FNN-649] Post project with account Negative","","Post Project: [FNN-649] Post project with account Negative","should post project with short Description","should post project with short Description",""
"passed","Sat Mar 23 04:40:14 UTC 2024","Sat Mar 23 04:40:57 UTC 2024","42596","","Create Profile: [FNN-684] Create profile Negative","","Create Profile: [FNN-684] Create profile Negative","should create profile without required fields","should create profile without required fields",""
"passed","Sat Mar 23 04:26:28 UTC 2024","Sat Mar 23 04:26:49 UTC 2024","20995","","Settings: [FNN-675] Change password Negative","","Settings: [FNN-675] Change password Negative","should change password with invalid repeat new password","should change password with invalid repeat new password",""
"passed","Sat Mar 23 04:31:06 UTC 2024","Sat Mar 23 04:31:35 UTC 2024","28971","","My Network: [FNN-620] Invite manually via email and sms Negative","","My Network: [FNN-620] Invite manually via email and sms Negative","should invite manually via sms without data","should invite manually via sms without data",""
"passed","Sat Mar 23 04:57:58 UTC 2024","Sat Mar 23 04:58:02 UTC 2024","3821","","CR: [FNN-751] Invite to the organization manually Negative","","CR: [FNN-751] Invite to the organization manually Negative","should invite manually to the organization without last name","should invite manually to the organization without last name",""
"passed","Sat Mar 23 05:05:17 UTC 2024","Sat Mar 23 05:05:38 UTC 2024","20245","","Post Project: [FNN-588] Post project without account Negative","","Post Project: [FNN-588] Post project without account Negative","should post project without last name","should post project without last name",""
"passed","Sat Mar 23 04:11:31 UTC 2024","Sat Mar 23 04:12:41 UTC 2024","69582","","Upgrade: [FNN-659] Upgrade account Negative","","Upgrade: [FNN-659] Upgrade account Negative","should upgrade account to Standard 1 month without required fields","should upgrade account to Standard 1 month without required fields",""
"passed","Sat Mar 23 04:18:00 UTC 2024","Sat Mar 23 04:18:55 UTC 2024","54916","","My Profile: [FNN-718] Add portfolio Negative","","My Profile: [FNN-718] Add portfolio Negative","should add portfolio without data","should add portfolio without data",""
"passed","Sat Mar 23 04:30:53 UTC 2024","Sat Mar 23 04:30:55 UTC 2024","1845","","My Network: [FNN-620] Invite manually via email and sms Negative","","My Network: [FNN-620] Invite manually via email and sms Negative","should invite manually via email without data","should invite manually via email without data",""
"passed","Sat Mar 23 05:03:45 UTC 2024","Sat Mar 23 05:03:49 UTC 2024","4720","","My Profile: [FNN-719] Add resume Negative","","My Profile: [FNN-719] Add resume Negative","should add language without writing level","should add language without writing level",""
"passed","Sat Mar 23 04:14:45 UTC 2024","Sat Mar 23 04:14:58 UTC 2024","13019","","My Profile: [FNN-690] Add resume Positive","","My Profile: [FNN-690] Add resume Positive","should add Education","should add Education",""
"passed","Sat Mar 23 04:11:47 UTC 2024","Sat Mar 23 04:11:57 UTC 2024","10212","","Subscribe: [FNN-577] Subscribe Negative","","Subscribe: [FNN-577] Subscribe Negative","should subscribe without password","should subscribe without password",""
"passed","Sat Mar 23 04:10:58 UTC 2024","Sat Mar 23 04:11:25 UTC 2024","27780","","Login: [FNN-574] Log in from the Login page Negative","","Login: [FNN-574] Log in from the Login page Negative","should log in without credentials","should log in without credentials",""
"passed","Sat Mar 23 04:10:42 UTC 2024","Sat Mar 23 04:10:47 UTC 2024","5286","","Login: [FNN-574] Log in from the Login page Negative","","Login: [FNN-574] Log in from the Login page Negative","should log in with invalid credentials","should log in with invalid credentials",""
"passed","Sat Mar 23 04:57:54 UTC 2024","Sat Mar 23 04:57:58 UTC 2024","4290","","CR: [FNN-751] Invite to the organization manually Negative","","CR: [FNN-751] Invite to the organization manually Negative","should invite manually to the organization without first name","should invite manually to the organization without first name",""
"skipped","Sat Mar 23 05:19:09 UTC 2024","Sat Mar 23 05:19:09 UTC 2024","1","","My Transactions: [FNN-710] Milestones project: In advance. Positive","","My Transactions: [FNN-710] Milestones project: In advance. Positive","should verify that the money paid","should verify that the money paid",""
"passed","Sat Mar 23 04:09:57 UTC 2024","Sat Mar 23 04:09:59 UTC 2024","2294","","Login: [FNN-563] Log in from the header Negative","","Login: [FNN-563] Log in from the header Negative","should log in without password","should log in without password",""
"passed","Sat Mar 23 05:21:37 UTC 2024","Sat Mar 23 05:21:41 UTC 2024","4211","","My Transactions: [FNN-708] Hourly project: In advance. Positive","","My Transactions: [FNN-708] Hourly project: In advance. Positive","should close the period","should close the period",""
"passed","Sat Mar 23 04:56:26 UTC 2024","Sat Mar 23 04:56:45 UTC 2024","18716","","My Transactions: [FNN-737] Hourly project: Start project. Negative","","My Transactions: [FNN-737] Hourly project: Start project. Negative","should start project without Way of paying","should start project without Way of paying",""
"passed","Sat Mar 23 04:22:09 UTC 2024","Sat Mar 23 04:22:49 UTC 2024","40406","","Post Project: [FNN-649] Post project with account Negative","","Post Project: [FNN-649] Post project with account Negative","should post project without step 1","should post project without step 1",""
"skipped","Sat Mar 23 04:43:18 UTC 2024","Sat Mar 23 04:43:18 UTC 2024","1","","[FNN-667] Send contact","","[FNN-667] Send contact","should check the contact as the first user","should check the contact as the first user",""
"passed","Sat Mar 23 04:55:48 UTC 2024","Sat Mar 23 04:56:06 UTC 2024","17741","","My Transactions: [FNN-737] Hourly project: Start project. Negative","","My Transactions: [FNN-737] Hourly project: Start project. Negative","should start project without Hourly rate","should start project without Hourly rate",""
"passed","Sat Mar 23 04:23:19 UTC 2024","Sat Mar 23 04:24:35 UTC 2024","75876","","Settings: [FNN-671] Change email address Positive","","Settings: [FNN-671] Change email address Positive","should change email address with valid credentials","should change email address with valid credentials",""
"passed","Sat Mar 23 04:27:45 UTC 2024","Sat Mar 23 04:29:15 UTC 2024","90489","","Settings: [FNN-680] Deactivate profile","","Settings: [FNN-680] Deactivate profile","should deactivate profile","should deactivate profile",""
"passed","Sat Mar 23 04:29:56 UTC 2024","Sat Mar 23 04:30:37 UTC 2024","41018","","My Network: [FNN-620] Invite manually via email and sms Negative","","My Network: [FNN-620] Invite manually via email and sms Negative","should invite manually via email without email","should invite manually via email without email",""
"skipped","Sat Mar 23 05:18:28 UTC 2024","Sat Mar 23 05:18:28 UTC 2024","2","","My Transactions: [FNN-1431] Hourly project: In retrospect. Positive","","My Transactions: [FNN-1431] Hourly project: In retrospect. Positive","should accept the project and add hours","should accept the project and add hours",""
"failed","Sat Mar 23 04:59:09 UTC 2024","Sat Mar 23 05:01:02 UTC 2024","112121","","Upgrade: [FNN-658] Upgrade account Positive","","Upgrade: [FNN-658] Upgrade account Positive","should upgrade account to Standaard 1 month","should upgrade account to Standaard 1 month",""
"passed","Sat Mar 23 04:56:06 UTC 2024","Sat Mar 23 04:56:26 UTC 2024","20373","","My Transactions: [FNN-737] Hourly project: Start project. Negative","","My Transactions: [FNN-737] Hourly project: Start project. Negative","should start project with Hourly rate rate than 25","should start project with Hourly rate rate than 25",""
"passed","Sat Mar 23 04:30:32 UTC 2024","Sat Mar 23 04:31:32 UTC 2024","60166","","My Network: [FNN-1233] Invite manually via email without custom message with signup bonus","","My Network: [FNN-1233] Invite manually via email without custom message with signup bonus","should subscribe as the freelancer with recipient details and accept the invitation","should subscribe as the freelancer with recipient details and accept the invitation",""
"passed","Sat Mar 23 04:58:02 UTC 2024","Sat Mar 23 04:58:03 UTC 2024","1251","","CR: [FNN-751] Invite to the organization manually Negative","","CR: [FNN-751] Invite to the organization manually Negative","should invite manually to the organization without first step","should invite manually to the organization without first step",""
"passed","Sat Mar 23 04:07:46 UTC 2024","Sat Mar 23 04:08:46 UTC 2024","60604","","Login: [FNN-647] Log in from the header Positive","","Login: [FNN-647] Log in from the header Positive","should log in with valid credentials","should log in with valid credentials",""
"passed","Sat Mar 23 04:43:22 UTC 2024","Sat Mar 23 04:44:19 UTC 2024","57410","","Freelancer search: [FNN-924] Freelancer search as CR user","","Freelancer search: [FNN-924] Freelancer search as CR user","should filter freelancers by Years of experience","should filter freelancers by Years of experience",""
"passed","Sat Mar 23 04:23:15 UTC 2024","Sat Mar 23 04:23:25 UTC 2024","10677","","Post Project: [FNN-649] Post project with account Negative","","Post Project: [FNN-649] Post project with account Negative","should post project without Category","should post project without Category",""
"passed","Sat Mar 23 04:36:03 UTC 2024","Sat Mar 23 04:38:11 UTC 2024","127325","","Freelancer search: [FNN-816] Create list Functionality","","Freelancer search: [FNN-816] Create list Functionality","should create a list of freelancers","should create a list of freelancers",""
"passed","Sat Mar 23 04:15:41 UTC 2024","Sat Mar 23 04:16:14 UTC 2024","32895","","My Profile: [FNN-690] Add resume Positive","","My Profile: [FNN-690] Add resume Positive","should check the attached part of the resume on the Profile page","should check the attached part of the resume on the Profile page",""
"skipped","Sat Mar 23 05:19:09 UTC 2024","Sat Mar 23 05:19:09 UTC 2024","0","","My Transactions: [FNN-710] Milestones project: In advance. Positive","","My Transactions: [FNN-710] Milestones project: In advance. Positive","should approve milestone","should approve milestone",""
"passed","Sat Mar 23 04:12:41 UTC 2024","Sat Mar 23 04:13:08 UTC 2024","26771","","Upgrade: [FNN-659] Upgrade account Negative","","Upgrade: [FNN-659] Upgrade account Negative","should upgrade account to Standard 1 month: Generic decline","should upgrade account to Standard 1 month: Generic decline",""
"passed","Sat Mar 23 05:21:19 UTC 2024","Sat Mar 23 05:21:37 UTC 2024","17685","","My Transactions: [FNN-708] Hourly project: In advance. Positive","","My Transactions: [FNN-708] Hourly project: In advance. Positive","should add hours","should add hours",""
"passed","Sat Mar 23 04:56:44 UTC 2024","Sat Mar 23 04:57:01 UTC 2024","17518","","CR: [FNN-749] Invite to the organization manually Positive","","CR: [FNN-749] Invite to the organization manually Positive","should accept invitation","should accept invitation",""
"passed","Sat Mar 23 04:10:54 UTC 2024","Sat Mar 23 04:10:58 UTC 2024","3334","","Login: [FNN-574] Log in from the Login page Negative","","Login: [FNN-574] Log in from the Login page Negative","should log in without password","should log in without password",""
"passed","Sat Mar 23 05:03:45 UTC 2024","Sat Mar 23 05:04:56 UTC 2024","71373","","Post Project: [FNN-588] Post project without account Negative","","Post Project: [FNN-588] Post project without account Negative","should post project without account details","should post project without account details",""
"passed","Sat Mar 23 05:05:24 UTC 2024","Sat Mar 23 05:05:39 UTC 2024","14764","","Search Project: [FNN-568] Project search","","Search Project: [FNN-568] Project search","should filter projects by Number of responses","should filter projects by Number of responses",""
"skipped","Sat Mar 23 04:29:22 UTC 2024","Sat Mar 23 04:34:56 UTC 2024","334452","","My Network: [FNN-1027] Invite freelancers","","My Network: [FNN-1027] Invite freelancers","should invite multiple freelancers","should invite multiple freelancers",""
"passed","Sat Mar 23 05:03:22 UTC 2024","Sat Mar 23 05:03:32 UTC 2024","10335","","My Profile: [FNN-730] Request reference Negative","","My Profile: [FNN-730] Request reference Negative","should pass step 3 without 2 rating","should pass step 3 without 2 rating",""
"passed","Sat Mar 23 04:16:42 UTC 2024","Sat Mar 23 04:18:19 UTC 2024","97216","","My Profile: [FNN-699] Request reference Positive","","My Profile: [FNN-699] Request reference Positive","should add experience and request reference","should add experience and request reference",""
"passed","Sat Mar 23 04:18:19 UTC 2024","Sat Mar 23 04:18:40 UTC 2024","20852","","My Profile: [FNN-699] Request reference Positive","","My Profile: [FNN-699] Request reference Positive","should validate reference","should validate reference",""
"passed","Sat Mar 23 05:07:59 UTC 2024","Sat Mar 23 05:12:11 UTC 2024","251779","","My Network: [FNN-664] Invite freelancer","","My Network: [FNN-664] Invite freelancer","should invite freelancer","should invite freelancer",""
"passed","Sat Mar 23 04:50:32 UTC 2024","Sat Mar 23 04:55:30 UTC 2024","297530","","My Transactions: [FNN-737] Hourly project: Start project. Negative","","My Transactions: [FNN-737] Hourly project: Start project. Negative","should start project without Hours per period and Hourly rate","should start project without Hours per period and Hourly rate",""
"failed","Sat Mar 23 04:59:21 UTC 2024","Sat Mar 23 05:00:19 UTC 2024","58049","","My Profile: [FNN-668] Edit account details Negative","","My Profile: [FNN-668] Edit account details Negative","should edit account details with invalid VAT number","should edit account details with invalid VAT number",""
"passed","Sat Mar 23 04:59:12 UTC 2024","Sat Mar 23 05:00:27 UTC 2024","75003","","Post Project: [FNN-587] Post project with account Positive","","Post Project: [FNN-587] Post project with account Positive","should post a project as a registered user with valid project data","should post a project as a registered user with valid project data",""
"passed","Sat Mar 23 04:56:59 UTC 2024","Sat Mar 23 04:57:09 UTC 2024","10505","","CR: [FNN-744] CR Subscribe Negative","","CR: [FNN-744] CR Subscribe Negative","should subscribe as CR without repeat password","should subscribe as CR without repeat password",""
"passed","Sat Mar 23 04:56:21 UTC 2024","Sat Mar 23 04:56:34 UTC 2024","13116","","CR: [FNN-744] CR Subscribe Negative","","CR: [FNN-744] CR Subscribe Negative","should subscribe as CR with wrong phone number","should subscribe as CR with wrong phone number",""
"passed","Sat Mar 23 05:07:10 UTC 2024","Sat Mar 23 05:07:57 UTC 2024","47226","","My Network: [FNN-1232] Invite manually via email with custom message with signup bonus","","My Network: [FNN-1232] Invite manually via email with custom message with signup bonus","should check My Dashboard and My Transactions page for the signup bonus as the inviter user","should check My Dashboard and My Transactions page for the signup bonus as the inviter user",""
"passed","Sat Mar 23 04:16:14 UTC 2024","Sat Mar 23 04:17:06 UTC 2024","52216","","Upgrade: [FNN-659] Upgrade account Negative","","Upgrade: [FNN-659] Upgrade account Negative","should upgrade account to Standard 1 month: Exceeding velocity limit decline","should upgrade account to Standard 1 month: Exceeding velocity limit decline",""
"broken","Sat Mar 23 05:10:50 UTC 2024","Sat Mar 23 05:15:20 UTC 2024","269832","","My Transactions: [FNN-1430] Milestones project: In retrospect. Positive","","My Transactions: [FNN-1430] Milestones project: In retrospect. Positive","should start project with milestone","should start project with milestone",""
"passed","Sat Mar 23 04:10:24 UTC 2024","Sat Mar 23 04:10:34 UTC 2024","9660","","Subscribe: [FNN-577] Subscribe Negative","","Subscribe: [FNN-577] Subscribe Negative","should subscribe without last name","should subscribe without last name",""
"passed","Sat Mar 23 04:11:20 UTC 2024","Sat Mar 23 04:11:33 UTC 2024","13342","","Subscribe: [FNN-577] Subscribe Negative","","Subscribe: [FNN-577] Subscribe Negative","should subscribe with wrong phone number","should subscribe with wrong phone number",""
"failed","Sat Mar 23 05:12:30 UTC 2024","Sat Mar 23 05:13:16 UTC 2024","45578","","My Network: [FNN-664] Invite freelancer","","My Network: [FNN-664] Invite freelancer","should check network as sender user","should check network as sender user",""
"broken","Sat Mar 23 05:08:30 UTC 2024","Sat Mar 23 05:12:54 UTC 2024","263282","","My Projects: [FNN-971] Complete project Positive","","My Projects: [FNN-971] Complete project Positive","should complete project","should complete project",""
"passed","Sat Mar 23 04:45:56 UTC 2024","Sat Mar 23 04:46:24 UTC 2024","28455","","Freelancer search: [FNN-924] Freelancer search as CR user","","Freelancer search: [FNN-924] Freelancer search as CR user","should filter freelancers by Minimum references","should filter freelancers by Minimum references",""
"passed","Sat Mar 23 04:09:00 UTC 2024","Sat Mar 23 04:10:13 UTC 2024","73110","","Subscribe: [FNN-577] Subscribe Negative","","Subscribe: [FNN-577] Subscribe Negative","should subscribe without category","should subscribe without category",""
