"Status","Start Time","Stop Time","Duration in ms","Parent Suite","Suite","Sub Suite","Test Class","Test Method","Name","Description"
"passed","Sun Jun 09 05:12:36 UTC 2024","Sun Jun 09 05:13:32 UTC 2024","55734","","My Network: Invite via SMS","","My Network: Invite via SMS","[FNN-619]Invite manually via sms with signup bonus","[FNN-619]Invite manually via sms with signup bonus",""
"passed","Sun Jun 09 05:14:34 UTC 2024","Sun Jun 09 05:28:22 UTC 2024","827809","","My Transactions: [FNN-1430] Milestones project: In retrospect. Positive","","My Transactions: [FNN-1430] Milestones project: In retrospect. Positive","should start project with milestone","should start project with milestone",""
"passed","Sun Jun 09 05:00:15 UTC 2024","Sun Jun 09 05:00:24 UTC 2024","9517","","CR: [FNN-744] CR Subscribe Negative","","CR: [FNN-744] CR Subscribe Negative","should subscribe as CR without password","should subscribe as CR without password",""
"passed","Sun Jun 09 04:13:11 UTC 2024","Sun Jun 09 04:13:53 UTC 2024","41457","","Reset password: Reset password Positive","","Reset password: Reset password Positive","[FNN-2399] Reset link functionality","[FNN-2399] Reset link functionality",""
"passed","Sun Jun 09 04:20:46 UTC 2024","Sun Jun 09 04:21:06 UTC 2024","19371","","My Profile: [FNN-699] Request reference Positive","","My Profile: [FNN-699] Request reference Positive","should validate reference","should validate reference",""
"passed","Sun Jun 09 04:58:35 UTC 2024","Sun Jun 09 04:58:45 UTC 2024","10090","","CR: [FNN-744] CR Subscribe Negative","","CR: [FNN-744] CR Subscribe Negative","should subscribe as CR without company name","should subscribe as CR without company name",""
"passed","Sun Jun 09 04:59:42 UTC 2024","Sun Jun 09 04:59:51 UTC 2024","9757","","CR: [FNN-744] CR Subscribe Negative","","CR: [FNN-744] CR Subscribe Negative","should subscribe as CR without phone number","should subscribe as CR without phone number",""
"passed","Sun Jun 09 05:17:46 UTC 2024","Sun Jun 09 05:18:07 UTC 2024","20887","","My Network: [FNN-664] Invite freelancer","","My Network: [FNN-664] Invite freelancer","should accept an invitation","should accept an invitation",""
"passed","Sun Jun 09 05:12:02 UTC 2024","Sun Jun 09 05:13:06 UTC 2024","63879","","My Network: Invite via Email with message","","My Network: Invite via Email with message","[FNN-1232][FNN-2451] Create a user and accept network invitation","[FNN-1232][FNN-2451] Create a user and accept network invitation",""
"passed","Sun Jun 09 04:09:40 UTC 2024","Sun Jun 09 04:09:45 UTC 2024","4688","","Login: [FNN-574] Log in from the Login page Negative","","Login: [FNN-574] Log in from the Login page Negative","should log in with wrong email format","should log in with wrong email format",""
"passed","Sun Jun 09 05:09:28 UTC 2024","Sun Jun 09 05:09:31 UTC 2024","3055","","My Profile: [FNN-719] Add resume Negative","","My Profile: [FNN-719] Add resume Negative","should add language without writing level","should add language without writing level",""
"passed","Sun Jun 09 05:19:12 UTC 2024","Sun Jun 09 05:23:09 UTC 2024","236076","","CR: Invite Positive","","CR: Invite Positive","[FNN-749] Invite to the organization manually","[FNN-749] Invite to the organization manually",""
"passed","Sun Jun 09 04:43:46 UTC 2024","Sun Jun 09 04:44:51 UTC 2024","64719","","Freelancer search: [FNN-822] Send message","","Freelancer search: [FNN-822] Send message","should check the message as the Freelancer user","should check the message as the Freelancer user",""
"failed","Sun Jun 09 05:28:47 UTC 2024","Sun Jun 09 05:29:13 UTC 2024","25823","","My Transactions: [FNN-737] Hourly project: Start project. Negative","","My Transactions: [FNN-737] Hourly project: Start project. Negative","should start project without Hours per period","should start project without Hours per period",""
"passed","Sun Jun 09 05:00:33 UTC 2024","Sun Jun 09 05:00:44 UTC 2024","10630","","CR: [FNN-744] CR Subscribe Negative","","CR: [FNN-744] CR Subscribe Negative","should subscribe as CR with short password","should subscribe as CR with short password",""
"skipped","Sun Jun 09 04:47:01 UTC 2024","Sun Jun 09 04:47:48 UTC 2024","46815","","[FNN-667] Send contact","","[FNN-667] Send contact","should check the contact as the second user","should check the contact as the second user",""
"passed","Sun Jun 09 05:11:09 UTC 2024","Sun Jun 09 05:11:14 UTC 2024","5569","","My Profile: [FNN-730] Request reference Negative","","My Profile: [FNN-730] Request reference Negative","should pass step 2 without picture","should pass step 2 without picture",""
"skipped","Sun Jun 09 04:38:27 UTC 2024","Sun Jun 09 04:38:56 UTC 2024","29231","","My Projects: [FNN-971] Complete project Positive","","My Projects: [FNN-971] Complete project Positive","should check review as freelancer user","should check review as freelancer user",""
"passed","Sun Jun 09 04:38:33 UTC 2024","Sun Jun 09 04:40:04 UTC 2024","90774","","Freelancer search: [FNN-815] Freelancer search as non-CR user","","Freelancer search: [FNN-815] Freelancer search as non-CR user","should filter freelancers by Sector","should filter freelancers by Sector",""
"passed","Sun Jun 09 04:28:23 UTC 2024","Sun Jun 09 04:28:40 UTC 2024","16971","","Post Project: [FNN-649] Post project with account Negative","","Post Project: [FNN-649] Post project with account Negative","should post project without Location","should post project without Location",""
"passed","Sun Jun 09 05:07:16 UTC 2024","Sun Jun 09 05:07:25 UTC 2024","9372","","My Profile: [FNN-719] Add resume Negative","","My Profile: [FNN-719] Add resume Negative","should add experience without period until","should add experience without period until",""
"passed","Sun Jun 09 04:59:17 UTC 2024","Sun Jun 09 04:59:28 UTC 2024","11514","","CR: [FNN-744] CR Subscribe Negative","","CR: [FNN-744] CR Subscribe Negative","should subscribe as CR with wrong email format","should subscribe as CR with wrong email format",""
"passed","Sun Jun 09 04:46:14 UTC 2024","Sun Jun 09 04:46:54 UTC 2024","40093","","Create Profile: [FNN-684] Create profile Negative","","Create Profile: [FNN-684] Create profile Negative","should create profile without Profile picture","should create profile without Profile picture",""
"passed","Sun Jun 09 04:37:15 UTC 2024","Sun Jun 09 04:37:19 UTC 2024","4433","","My Network: [FNN-620] Invite manually via email and sms Negative","","My Network: [FNN-620] Invite manually via email and sms Negative","should invite manually via email without last name","should invite manually via email without last name",""
"passed","Sun Jun 09 04:14:17 UTC 2024","Sun Jun 09 04:14:28 UTC 2024","11354","","Subscribe: [FNN-577] Subscribe Negative","","Subscribe: [FNN-577] Subscribe Negative","should subscribe with invalid repeat password","should subscribe with invalid repeat password",""
"passed","Sun Jun 09 04:42:37 UTC 2024","Sun Jun 09 04:42:55 UTC 2024","17735","","Freelancer search: [FNN-817] Add note","","Freelancer search: [FNN-817] Add note","should add a note via the action ""Add note""","should add a note via the action ""Add note""",""
"failed","Sun Jun 09 05:03:40 UTC 2024","Sun Jun 09 05:05:37 UTC 2024","116789","","My Profile: [FNN-668] Edit account details Negative","","My Profile: [FNN-668] Edit account details Negative","should edit account details with invalid VAT number","should edit account details with invalid VAT number",""
"passed","Sun Jun 09 04:34:15 UTC 2024","Sun Jun 09 04:36:34 UTC 2024","139005","","Search Project: [FNN-568] Project search","","Search Project: [FNN-568] Project search","should filter projects by Category","should filter projects by Category",""
"passed","Sun Jun 09 04:42:55 UTC 2024","Sun Jun 09 04:44:05 UTC 2024","70138","","Freelancer search: [FNN-817] Add note","","Freelancer search: [FNN-817] Add note","should add note from the notes popup","should add note from the notes popup",""
"skipped","Sun Jun 09 04:37:57 UTC 2024","Sun Jun 09 04:37:57 UTC 2024","0","","My Projects: [FNN-1058] Complete project Negative","","My Projects: [FNN-1058] Complete project Negative","should complete project without Deadline","should complete project without Deadline",""
"failed","Sun Jun 09 04:52:01 UTC 2024","Sun Jun 09 04:54:36 UTC 2024","155243","","My Transactions: [FNN-710] Milestones project: In advance. Positive","","My Transactions: [FNN-710] Milestones project: In advance. Positive","""before all"" hook for [FNN-710] Milestones project: In advance. Positive","""before all"" hook for [FNN-710] Milestones project: In advance. Positive",""
"passed","Sun Jun 09 04:09:06 UTC 2024","Sun Jun 09 04:09:34 UTC 2024","28297","","Login: [FNN-574] Log in from the Login page Negative","","Login: [FNN-574] Log in from the Login page Negative","should log in with valid email and invalid password","should log in with valid email and invalid password",""
"skipped","Sun Jun 09 04:47:52 UTC 2024","Sun Jun 09 04:48:20 UTC 2024","28119","","[FNN-743] Archive and restore message","","[FNN-743] Archive and restore message","should restore the message","should restore the message",""
"passed","Sun Jun 09 04:59:20 UTC 2024","Sun Jun 09 04:59:22 UTC 2024","1481","","CR: [FNN-751] Invite to the organization manually Negative","","CR: [FNN-751] Invite to the organization manually Negative","should invite manually to the organization without first step","should invite manually to the organization without first step",""
"passed","Sun Jun 09 04:37:33 UTC 2024","Sun Jun 09 04:37:49 UTC 2024","16541","","Search Project: [FNN-568] Project search","","Search Project: [FNN-568] Project search","should filter projects by Hourly rate","should filter projects by Hourly rate",""
"passed","Sun Jun 09 04:12:51 UTC 2024","Sun Jun 09 04:13:01 UTC 2024","10712","","Subscribe: [FNN-577] Subscribe Negative","","Subscribe: [FNN-577] Subscribe Negative","should subscribe with wrong email format","should subscribe with wrong email format",""
"passed","Sun Jun 09 04:28:56 UTC 2024","Sun Jun 09 04:29:13 UTC 2024","16330","","Post Project: [FNN-649] Post project with account Negative","","Post Project: [FNN-649] Post project with account Negative","should post project without End date","should post project without End date",""
"failed","Sun Jun 09 05:08:00 UTC 2024","Sun Jun 09 05:08:27 UTC 2024","26861","","My Profile: [FNN-719] Add resume Negative","","My Profile: [FNN-719] Add resume Negative","should add education without period from","should add education without period from",""
"passed","Sun Jun 09 05:24:29 UTC 2024","Sun Jun 09 05:24:34 UTC 2024","5615","","My Transactions: [FNN-738] Milestones project: Add milestone. Negative","","My Transactions: [FNN-738] Milestones project: Add milestone. Negative","should add milestone without Delivery date","should add milestone without Delivery date",""
"passed","Sun Jun 09 05:03:30 UTC 2024","Sun Jun 09 05:03:40 UTC 2024","10412","","My Profile: [FNN-668] Edit account details Negative","","My Profile: [FNN-668] Edit account details Negative","should edit account details with invalid Twitter, LinkedIn and Website urls","should edit account details with invalid Twitter, LinkedIn and Website urls",""
"failed","Sun Jun 09 05:23:35 UTC 2024","Sun Jun 09 05:24:04 UTC 2024","29447","","CR: Invite Positive","","CR: Invite Positive","[FNN-750] Invite to the organization through search","[FNN-750] Invite to the organization through search",""
"passed","Sun Jun 09 04:51:20 UTC 2024","Sun Jun 09 04:57:26 UTC 2024","365274","","My Transactions: [FNN-708] Hourly project: In advance. Positive","","My Transactions: [FNN-708] Hourly project: In advance. Positive","should start hourly project","should start hourly project",""
"passed","Sun Jun 09 04:37:49 UTC 2024","Sun Jun 09 04:37:57 UTC 2024","7706","","Search Project: [FNN-568] Project search","","Search Project: [FNN-568] Project search","should filter projects by Status All projects","should filter projects by Status All projects",""
"failed","Sun Jun 09 04:59:18 UTC 2024","Sun Jun 09 05:01:31 UTC 2024","133222","","Dashboard: [FNN-1779] My Dashboard page integrity as Employer","","Dashboard: [FNN-1779] My Dashboard page integrity as Employer","""before all"" hook for [FNN-1779] My Dashboard page integrity as Employer","""before all"" hook for [FNN-1779] My Dashboard page integrity as Employer",""
"passed","Sun Jun 09 04:16:45 UTC 2024","Sun Jun 09 04:17:36 UTC 2024","50449","","My Profile: [FNN-690] Add resume Positive","","My Profile: [FNN-690] Add resume Positive","should add Experience","should add Experience",""
"failed","Sun Jun 09 05:11:49 UTC 2024","Sun Jun 09 05:12:28 UTC 2024","38730","","Post Project: Post Project without account Positive ","","Post Project: Post Project without account Positive ","[FNN-650][FNN-2423] User receives the Project posted letter","[FNN-650][FNN-2423] User receives the Project posted letter",""
"passed","Sun Jun 09 05:01:31 UTC 2024","Sun Jun 09 05:02:03 UTC 2024","31945","","Dashboard: [FNN-1779] My Dashboard page integrity as Employer","","Dashboard: [FNN-1779] My Dashboard page integrity as Employer","should verify the integrity of the My Dashboard page as employer","should verify the integrity of the My Dashboard page as employer",""
"passed","Sun Jun 09 05:13:34 UTC 2024","Sun Jun 09 05:14:21 UTC 2024","47355","","My Network: Invite via SMS","","My Network: Invite via SMS","[FNN-619][FNN-2451] Create a user and accept network invitation","[FNN-619][FNN-2451] Create a user and accept network invitation",""
"skipped","Sun Jun 09 04:38:27 UTC 2024","Sun Jun 09 04:38:27 UTC 2024","1","","My Projects: [FNN-971] Complete project Positive","","My Projects: [FNN-971] Complete project Positive","should complete project","should complete project",""
"passed","Sun Jun 09 04:14:05 UTC 2024","Sun Jun 09 04:14:17 UTC 2024","11527","","Subscribe: [FNN-577] Subscribe Negative","","Subscribe: [FNN-577] Subscribe Negative","should subscribe with short password","should subscribe with short password",""
"passed","Sun Jun 09 05:12:24 UTC 2024","Sun Jun 09 05:12:35 UTC 2024","11146","","My Profile: [FNN-730] Request reference Negative","","My Profile: [FNN-730] Request reference Negative","should pass step 3 without 4 rating","should pass step 3 without 4 rating",""
"passed","Sun Jun 09 05:28:02 UTC 2024","Sun Jun 09 05:29:45 UTC 2024","102399","","My Transactions: [FNN-710] Milestones project: In advance. Positive","","My Transactions: [FNN-710] Milestones project: In advance. Positive","should request payout","should request payout",""
"passed","Sun Jun 09 05:08:56 UTC 2024","Sun Jun 09 05:09:00 UTC 2024","3682","","My Profile: [FNN-719] Add resume Negative","","My Profile: [FNN-719] Add resume Negative","should add certificate without data","should add certificate without data",""
"passed","Sun Jun 09 04:59:16 UTC 2024","Sun Jun 09 04:59:20 UTC 2024","4481","","CR: [FNN-751] Invite to the organization manually Negative","","CR: [FNN-751] Invite to the organization manually Negative","should invite manually to the organization without last name","should invite manually to the organization without last name",""
"passed","Sun Jun 09 05:29:39 UTC 2024","Sun Jun 09 05:29:45 UTC 2024","6056","","My Transactions: [FNN-737] Hourly project: Start project. Negative","","My Transactions: [FNN-737] Hourly project: Start project. Negative","should start project with Hourly rate rate than 25","should start project with Hourly rate rate than 25",""
"passed","Sun Jun 09 04:38:32 UTC 2024","Sun Jun 09 04:41:30 UTC 2024","178496","","Search Project: [FNN-568] Project search","","Search Project: [FNN-568] Project search","should filter projects by Number of responses","should filter projects by Number of responses",""
"skipped","Sun Jun 09 05:24:04 UTC 2024","Sun Jun 09 05:24:04 UTC 2024","2","","CR: Invite Positive","","CR: Invite Positive","[FNN-750][FNN-2400] User receives the Invitation to organization letter","[FNN-750][FNN-2400] User receives the Invitation to organization letter",""
"passed","Sun Jun 09 04:14:40 UTC 2024","Sun Jun 09 04:15:43 UTC 2024","62751","","Subscribe: [FNN-577] Subscribe Negative","","Subscribe: [FNN-577] Subscribe Negative","should subscribe without data","should subscribe without data",""
"broken","Sun Jun 09 05:11:13 UTC 2024","Sun Jun 09 05:11:40 UTC 2024","27039","","Post Project: Post Project without account Positive ","","Post Project: Post Project without account Positive ","[FNN-650][FNN-2422] Correctness of project data on the Project page","[FNN-650][FNN-2422] Correctness of project data on the Project page",""
"passed","Sun Jun 09 04:24:20 UTC 2024","Sun Jun 09 04:26:04 UTC 2024","103557","","My Profile: [FNN-795] Remove portfolio","","My Profile: [FNN-795] Remove portfolio","should remove portfolio","should remove portfolio",""
"passed","Sun Jun 09 04:45:39 UTC 2024","Sun Jun 09 04:46:14 UTC 2024","35018","","Create Profile: [FNN-684] Create profile Negative","","Create Profile: [FNN-684] Create profile Negative","should create profile with wrong website","should create profile with wrong website",""
"passed","Sun Jun 09 04:59:05 UTC 2024","Sun Jun 09 04:59:17 UTC 2024","12109","","CR: [FNN-744] CR Subscribe Negative","","CR: [FNN-744] CR Subscribe Negative","should subscribe as CR without email","should subscribe as CR without email",""
"passed","Sun Jun 09 04:12:13 UTC 2024","Sun Jun 09 04:12:20 UTC 2024","7785","","Reset password: [FNN-655] Reset password Negative","","Reset password: [FNN-655] Reset password Negative","should reset password without data","should reset password without data",""
"passed","Sun Jun 09 04:40:49 UTC 2024","Sun Jun 09 04:41:53 UTC 2024","63132","","Freelancer search: [FNN-815] Freelancer search as non-CR user","","Freelancer search: [FNN-815] Freelancer search as non-CR user","should filter freelancers by Skills","should filter freelancers by Skills",""
"passed","Sun Jun 09 05:18:07 UTC 2024","Sun Jun 09 05:19:06 UTC 2024","58943","","My Network: [FNN-664] Invite freelancer","","My Network: [FNN-664] Invite freelancer","should check network as sender user","should check network as sender user",""
"passed","Sun Jun 09 05:10:45 UTC 2024","Sun Jun 09 05:10:53 UTC 2024","7687","","My Profile: [FNN-730] Request reference Negative","","My Profile: [FNN-730] Request reference Negative","should pass step 2 without first name","should pass step 2 without first name",""
"passed","Sun Jun 09 05:00:55 UTC 2024","Sun Jun 09 05:01:07 UTC 2024","11897","","CR: [FNN-744] CR Subscribe Negative","","CR: [FNN-744] CR Subscribe Negative","should subscribe as CR without agreeing to the Terms and Conditions","should subscribe as CR without agreeing to the Terms and Conditions",""
"passed","Sun Jun 09 04:15:48 UTC 2024","Sun Jun 09 04:16:45 UTC 2024","57828","","My Profile: [FNN-690] Add resume Positive","","My Profile: [FNN-690] Add resume Positive","should add CV","should add CV",""
"failed","Sun Jun 09 05:04:33 UTC 2024","Sun Jun 09 05:08:42 UTC 2024","249061","","My Profile: [FNN-669] Edit account details Positive","","My Profile: [FNN-669] Edit account details Positive","should edit employer account details with valid information","should edit employer account details with valid information",""
"skipped","Sun Jun 09 04:37:57 UTC 2024","Sun Jun 09 04:37:57 UTC 2024","0","","My Projects: [FNN-1058] Complete project Negative","","My Projects: [FNN-1058] Complete project Negative","should complete project without Quality","should complete project without Quality",""
"passed","Sun Jun 09 04:11:04 UTC 2024","Sun Jun 09 04:12:13 UTC 2024","68902","","Subscribe: [FNN-577] Subscribe Negative","","Subscribe: [FNN-577] Subscribe Negative","should subscribe without category","should subscribe without category",""
"passed","Sun Jun 09 04:39:01 UTC 2024","Sun Jun 09 04:41:12 UTC 2024","130981","","Freelancer search: [FNN-816] Create list Functionality","","Freelancer search: [FNN-816] Create list Functionality","should create a list of freelancers","should create a list of freelancers",""
"skipped","Sun Jun 09 04:47:01 UTC 2024","Sun Jun 09 04:47:01 UTC 2024","0","","[FNN-667] Send contact","","[FNN-667] Send contact","should check the contact as the first user","should check the contact as the first user",""
"passed","Sun Jun 09 05:07:49 UTC 2024","Sun Jun 09 05:07:54 UTC 2024","5171","","My Profile: [FNN-719] Add resume Negative","","My Profile: [FNN-719] Add resume Negative","should add education without institute","should add education without institute",""
"passed","Sun Jun 09 05:24:13 UTC 2024","Sun Jun 09 05:26:00 UTC 2024","107169","","My Transactions: [FNN-710] Milestones project: In advance. Positive","","My Transactions: [FNN-710] Milestones project: In advance. Positive","should accept the project","should accept the project",""
"passed","Sun Jun 09 04:38:11 UTC 2024","Sun Jun 09 04:38:19 UTC 2024","8657","","Search Project: [FNN-568] Project search","","Search Project: [FNN-568] Project search","should filter projects by Posted since Last 7 days","should filter projects by Posted since Last 7 days",""
"broken","Sun Jun 09 05:02:18 UTC 2024","Sun Jun 09 05:04:33 UTC 2024","134626","","My Profile: [FNN-669] Edit account details Positive","","My Profile: [FNN-669] Edit account details Positive","should edit freelancer account details with valid information","should edit freelancer account details with valid information",""
"passed","Sun Jun 09 05:11:14 UTC 2024","Sun Jun 09 05:11:25 UTC 2024","10470","","My Profile: [FNN-730] Request reference Negative","","My Profile: [FNN-730] Request reference Negative","should pass step 2 with invalid website format","should pass step 2 with invalid website format",""
"passed","Sun Jun 09 04:13:15 UTC 2024","Sun Jun 09 04:13:25 UTC 2024","9873","","Subscribe: [FNN-577] Subscribe Negative","","Subscribe: [FNN-577] Subscribe Negative","should subscribe without phone number","should subscribe without phone number",""
"passed","Sun Jun 09 04:09:10 UTC 2024","Sun Jun 09 04:09:59 UTC 2024","49069","","Login: [FNN-563] Log in from the header Negative","","Login: [FNN-563] Log in from the header Negative","should log in with valid email and invalid password","should log in with valid email and invalid password",""
"passed","Sun Jun 09 04:14:28 UTC 2024","Sun Jun 09 04:14:40 UTC 2024","11842","","Subscribe: [FNN-577] Subscribe Negative","","Subscribe: [FNN-577] Subscribe Negative","should subscribe without agreeing to the Terms and Conditions","should subscribe without agreeing to the Terms and Conditions",""
"passed","Sun Jun 09 04:56:56 UTC 2024","Sun Jun 09 04:57:48 UTC 2024","51623","","My Transactions: [FNN-1431] Hourly project: In retrospect. Positive","","My Transactions: [FNN-1431] Hourly project: In retrospect. Positive","should approve the time and pay deposits","should approve the time and pay deposits",""
"passed","Sun Jun 09 05:13:24 UTC 2024","Sun Jun 09 05:14:12 UTC 2024","48325","","Post Project: [FNN-588] Post project without account Negative","","Post Project: [FNN-588] Post project without account Negative","should post project without password","should post project without password",""
"passed","Sun Jun 09 04:30:56 UTC 2024","Sun Jun 09 04:32:29 UTC 2024","93412","","Settings: [FNN-677] Downgrade to ""Stand-by Standaard""","","Settings: [FNN-677] Downgrade to ""Stand-by Standaard""","should downgrade to ""Stand-by Standaard""","should downgrade to ""Stand-by Standaard""",""
"passed","Sun Jun 09 04:28:06 UTC 2024","Sun Jun 09 04:28:23 UTC 2024","16443","","Post Project: [FNN-649] Post project with account Negative","","Post Project: [FNN-649] Post project with account Negative","should post project without Work on location","should post project without Work on location",""
"broken","Sun Jun 09 05:08:43 UTC 2024","Sun Jun 09 05:09:09 UTC 2024","25802","","Post Project: Post Project with account Positive","","Post Project: Post Project with account Positive","[FNN-587][FNN-2422] Correctness of project data on the Project page","[FNN-587][FNN-2422] Correctness of project data on the Project page",""
"passed","Sun Jun 09 04:48:42 UTC 2024","Sun Jun 09 04:50:22 UTC 2024","99836","","Freelancer search: [FNN-924] Freelancer search as CR user","","Freelancer search: [FNN-924] Freelancer search as CR user","should filter freelancers by Availability","should filter freelancers by Availability",""
"passed","Sun Jun 09 04:32:19 UTC 2024","Sun Jun 09 04:34:09 UTC 2024","109213","","Settings: [FNN-679] Delete account with subscription","","Settings: [FNN-679] Delete account with subscription","should delete account with subscription","should delete account with subscription",""
"passed","Sun Jun 09 04:19:40 UTC 2024","Sun Jun 09 04:20:19 UTC 2024","39664","","My Profile: [FNN-690] Add resume Positive","","My Profile: [FNN-690] Add resume Positive","should add Qualities","should add Qualities",""
"passed","Sun Jun 09 04:31:21 UTC 2024","Sun Jun 09 04:31:45 UTC 2024","23470","","Settings: [FNN-675] Change password Negative","","Settings: [FNN-675] Change password Negative","should change password with invalid repeat new password","should change password with invalid repeat new password",""
"passed","Sun Jun 09 05:07:34 UTC 2024","Sun Jun 09 05:08:43 UTC 2024","69107","","Post Project: Post Project with account Positive","","Post Project: Post Project with account Positive","[FNN-587] Post project with account Positive","[FNN-587] Post project with account Positive",""
"passed","Sun Jun 09 04:41:12 UTC 2024","Sun Jun 09 04:41:18 UTC 2024","5815","","Freelancer search: [FNN-816] Create list Functionality","","Freelancer search: [FNN-816] Create list Functionality","should re-open original search","should re-open original search",""
"passed","Sun Jun 09 04:12:13 UTC 2024","Sun Jun 09 04:12:25 UTC 2024","12562","","Subscribe: [FNN-577] Subscribe Negative","","Subscribe: [FNN-577] Subscribe Negative","should subscribe without first name","should subscribe without first name",""
