"Status","Start Time","Stop Time","Duration in ms","Parent Suite","Suite","Sub Suite","Test Class","Test Method","Name","Description"
"failed","Sat Apr 06 07:12:31 UTC 2024","Sat Apr 06 07:14:15 UTC 2024","103527","","My Transactions: [FNN-1439] Hourly project: Add time. Negative","","My Transactions: [FNN-1439] Hourly project: Add time. Negative","""before all"" hook for [FNN-1439] Hourly project: Add time. Negative","""before all"" hook for [FNN-1439] Hourly project: Add time. Negative",""
"passed","Sat Apr 06 06:56:20 UTC 2024","Sat Apr 06 06:56:23 UTC 2024","3548","","My Profile: [FNN-719] Add resume Negative","","My Profile: [FNN-719] Add resume Negative","should add certificate without data","should add certificate without data",""
"failed","Sat Apr 06 06:55:53 UTC 2024","Sat Apr 06 06:56:20 UTC 2024","27067","","My Profile: [FNN-719] Add resume Negative","","My Profile: [FNN-719] Add resume Negative","should add education without period to","should add education without period to",""
"passed","Sat Apr 06 06:25:54 UTC 2024","Sat Apr 06 06:26:35 UTC 2024","41892","","Settings: [FNN-675] Change password Negative","","Settings: [FNN-675] Change password Negative","should change password without new and repeat password","should change password without new and repeat password",""
"passed","Sat Apr 06 06:07:11 UTC 2024","Sat Apr 06 06:07:16 UTC 2024","4893","","Login: [FNN-574] Log in from the Login page Negative","","Login: [FNN-574] Log in from the Login page Negative","should log in with invalid credentials","should log in with invalid credentials",""
"passed","Sat Apr 06 06:26:13 UTC 2024","Sat Apr 06 06:28:43 UTC 2024","150891","","Settings: [FNN-676] Change profile settings","","Settings: [FNN-676] Change profile settings","it's not possible to contact me through the contact button on my profile","it's not possible to contact me through the contact button on my profile",""
"failed","Sat Apr 06 07:08:34 UTC 2024","Sat Apr 06 07:08:59 UTC 2024","24304","","Create Profile: [FNN-684] Create profile Negative","","Create Profile: [FNN-684] Create profile Negative","should create profile with wrong website","should create profile with wrong website",""
"passed","Sat Apr 06 07:11:00 UTC 2024","Sat Apr 06 07:11:29 UTC 2024","28746","","My Network: [FNN-664] Invite freelancer","","My Network: [FNN-664] Invite freelancer","should accept an invitation","should accept an invitation",""
"passed","Sat Apr 06 06:28:01 UTC 2024","Sat Apr 06 06:29:35 UTC 2024","94356","","Settings: [FNN-808] Cancel downgrade","","Settings: [FNN-808] Cancel downgrade","should cancel downgrade","should cancel downgrade",""
