"Status","Start Time","Stop Time","Duration in ms","Parent Suite","Suite","Sub Suite","Test Class","Test Method","Name","Description"
"passed","Sat Jan 06 06:52:11 UTC 2024","Sat Jan 06 06:52:16 UTC 2024","5478","","My Profile: [FNN-719] Add resume Negative","","My Profile: [FNN-719] Add resume Negative","should add certificate without certificate","should add certificate without certificate",""
"passed","Sat Jan 06 06:46:22 UTC 2024","Sat Jan 06 06:46:31 UTC 2024","9278","","CR: [FNN-744] CR Subscribe Negative","","CR: [FNN-744] CR Subscribe Negative","should subscribe as CR with invalid repeat password","should subscribe as CR with invalid repeat password",""
"failed","Sat Jan 06 06:57:23 UTC 2024","Sat Jan 06 06:58:29 UTC 2024","66444","","Create Profile: [FNN-684] Create profile Negative","","Create Profile: [FNN-684] Create profile Negative","should create profile with short Description of yourself","should create profile with short Description of yourself",""
"passed","Sat Jan 06 06:52:26 UTC 2024","Sat Jan 06 06:52:28 UTC 2024","2772","","My Profile: [FNN-719] Add resume Negative","","My Profile: [FNN-719] Add resume Negative","should add language without levels","should add language without levels",""
"passed","Sat Jan 06 06:47:44 UTC 2024","Sat Jan 06 06:47:46 UTC 2024","2331","","CR: [FNN-751] Invite to the organization manually Negative","","CR: [FNN-751] Invite to the organization manually Negative","should invite manually to the organization without last name","should invite manually to the organization without last name",""
"passed","Sat Jan 06 06:37:50 UTC 2024","Sat Jan 06 06:41:20 UTC 2024","209158","","My Transactions: [FNN-1432] Milestones project: Start project. Negative","","My Transactions: [FNN-1432] Milestones project: Start project. Negative","should start project without milestone","should start project without milestone",""
"passed","Sat Jan 06 06:06:42 UTC 2024","Sat Jan 06 06:06:45 UTC 2024","3086","","Login: [FNN-563] Log in from the header Negative","","Login: [FNN-563] Log in from the header Negative","should log in with wrong email format","should log in with wrong email format",""
"passed","Sat Jan 06 06:06:50 UTC 2024","Sat Jan 06 06:07:14 UTC 2024","24171","","Login: [FNN-563] Log in from the header Negative","","Login: [FNN-563] Log in from the header Negative","should log in without credentials","should log in without credentials",""
"passed","Sat Jan 06 06:49:20 UTC 2024","Sat Jan 06 06:50:09 UTC 2024","49782","","My Profile: [FNN-719] Add resume Negative","","My Profile: [FNN-719] Add resume Negative","should add CV without CV","should add CV without CV",""
"passed","Sat Jan 06 06:11:08 UTC 2024","Sat Jan 06 06:11:25 UTC 2024","16590","","My Profile: [FNN-690] Add resume Positive","","My Profile: [FNN-690] Add resume Positive","should add Experience","should add Experience",""
"passed","Sat Jan 06 06:49:48 UTC 2024","Sat Jan 06 06:50:17 UTC 2024","28701","","My Profile: [FNN-668] Edit account details Negative","","My Profile: [FNN-668] Edit account details Negative","should edit account details with invalid VAT number","should edit account details with invalid VAT number",""
"passed","Sat Jan 06 06:52:28 UTC 2024","Sat Jan 06 06:52:32 UTC 2024","3995","","My Profile: [FNN-719] Add resume Negative","","My Profile: [FNN-719] Add resume Negative","should add language without speaking level","should add language without speaking level",""
"passed","Sat Jan 06 07:00:51 UTC 2024","Sat Jan 06 07:01:25 UTC 2024","34586","","[FNN-743] Archive and restore message","","[FNN-743] Archive and restore message","should restore the message","should restore the message",""
"passed","Sat Jan 06 06:07:24 UTC 2024","Sat Jan 06 06:07:34 UTC 2024","9839","","Subscribe: [FNN-577] Subscribe Negative","","Subscribe: [FNN-577] Subscribe Negative","should subscribe without first name","should subscribe without first name",""
"passed","Sat Jan 06 06:52:36 UTC 2024","Sat Jan 06 06:53:00 UTC 2024","24377","","My Profile: [FNN-719] Add resume Negative","","My Profile: [FNN-719] Add resume Negative","should add language without reading level","should add language without reading level",""
"broken","Sat Jan 06 06:59:29 UTC 2024","Sat Jan 06 07:03:33 UTC 2024","244331","","My Transactions: [FNN-1439] Hourly project: Add time. Negative","","My Transactions: [FNN-1439] Hourly project: Add time. Negative","""before all"" hook for [FNN-1439] Hourly project: Add time. Negative","""before all"" hook for [FNN-1439] Hourly project: Add time. Negative",""
"failed","Sat Jan 06 06:58:35 UTC 2024","Sat Jan 06 07:02:27 UTC 2024","232023","","My Transactions: [FNN-1430] Milestones project: In retrospect. Positive","","My Transactions: [FNN-1430] Milestones project: In retrospect. Positive","should start project with milestone","should start project with milestone",""
"passed","Sat Jan 06 06:11:31 UTC 2024","Sat Jan 06 06:13:50 UTC 2024","138718","","My Profile: [FNN-669] Edit account details Positive","","My Profile: [FNN-669] Edit account details Positive","should edit employer account details with valid information","should edit employer account details with valid information",""
"passed","Sat Jan 06 06:06:54 UTC 2024","Sat Jan 06 06:07:17 UTC 2024","23393","","Login: [FNN-574] Log in from the Login page Negative","","Login: [FNN-574] Log in from the Login page Negative","should log in without credentials","should log in without credentials",""
"passed","Sat Jan 06 07:07:14 UTC 2024","Sat Jan 06 07:07:18 UTC 2024","3349","","My Transactions: [FNN-737] Hourly project: Start project. Negative","","My Transactions: [FNN-737] Hourly project: Start project. Negative","should start project without Hourly rate","should start project without Hourly rate",""
"failed","Sat Jan 06 06:49:24 UTC 2024","Sat Jan 06 06:49:48 UTC 2024","24410","","My Profile: [FNN-668] Edit account details Negative","","My Profile: [FNN-668] Edit account details Negative","should edit account details with invalid Twitter, LinkedIn and Website urls","should edit account details with invalid Twitter, LinkedIn and Website urls",""
"passed","Sat Jan 06 06:21:38 UTC 2024","Sat Jan 06 06:22:58 UTC 2024","79726","","Settings: [FNN-680] Deactivate profile","","Settings: [FNN-680] Deactivate profile","should deactivate profile","should deactivate profile",""
"passed","Sat Jan 06 06:22:41 UTC 2024","Sat Jan 06 06:23:59 UTC 2024","77422","","Settings: [FNN-808] Cancel downgrade","","Settings: [FNN-808] Cancel downgrade","should cancel downgrade","should cancel downgrade",""
"failed","Sat Jan 06 06:50:41 UTC 2024","Sat Jan 06 06:51:07 UTC 2024","25567","","My Profile: [FNN-719] Add resume Negative","","My Profile: [FNN-719] Add resume Negative","should add education without data","should add education without data",""
"passed","Sat Jan 06 06:08:56 UTC 2024","Sat Jan 06 06:09:04 UTC 2024","8114","","Subscribe: [FNN-577] Subscribe Negative","","Subscribe: [FNN-577] Subscribe Negative","should subscribe with short password","should subscribe with short password",""
"passed","Sat Jan 06 06:08:46 UTC 2024","Sat Jan 06 06:08:56 UTC 2024","10350","","Subscribe: [FNN-577] Subscribe Negative","","Subscribe: [FNN-577] Subscribe Negative","should subscribe without repeat password","should subscribe without repeat password",""
"passed","Sat Jan 06 06:06:51 UTC 2024","Sat Jan 06 06:06:54 UTC 2024","2929","","Login: [FNN-574] Log in from the Login page Negative","","Login: [FNN-574] Log in from the Login page Negative","should log in without password","should log in without password",""
"passed","Sat Jan 06 06:46:28 UTC 2024","Sat Jan 06 06:46:34 UTC 2024","6261","","My Transactions: [FNN-738] Milestones project: Add milestone. Negative","","My Transactions: [FNN-738] Milestones project: Add milestone. Negative","should add milestone without Delivery date","should add milestone without Delivery date",""
"passed","Sat Jan 06 06:18:40 UTC 2024","Sat Jan 06 06:18:56 UTC 2024","15685","","Post Project: [FNN-649] Post project with account Negative","","Post Project: [FNN-649] Post project with account Negative","should post project without Budget","should post project without Budget",""
"passed","Sat Jan 06 06:52:26 UTC 2024","Sat Jan 06 06:52:40 UTC 2024","13819","","Post Project: [FNN-588] Post project without account Negative","","Post Project: [FNN-588] Post project without account Negative","should post project without email","should post project without email",""
"broken","Sat Jan 06 06:50:50 UTC 2024","Sat Jan 06 06:51:03 UTC 2024","13070","","Settings: [FNN-675] Change password Negative","","Settings: [FNN-675] Change password Negative","""before all"" hook for [FNN-675] Change password Negative","""before all"" hook for [FNN-675] Change password Negative",""
"passed","Sat Jan 06 06:54:43 UTC 2024","Sat Jan 06 06:55:09 UTC 2024","25463","","My Network: [FNN-1027] Invite freelancers","","My Network: [FNN-1027] Invite freelancers","should check network as sender user","should check network as sender user",""
"broken","Sat Jan 06 06:56:01 UTC 2024","Sat Jan 06 06:58:44 UTC 2024","162914","","Freelancer search: [FNN-924] Freelancer search as CR user","","Freelancer search: [FNN-924] Freelancer search as CR user","""before all"" hook for [FNN-924] Freelancer search as CR user","""before all"" hook for [FNN-924] Freelancer search as CR user",""
"passed","Sat Jan 06 06:54:18 UTC 2024","Sat Jan 06 06:54:34 UTC 2024","16300","","Post Project: [FNN-588] Post project without account Negative","","Post Project: [FNN-588] Post project without account Negative","should post project without password","should post project without password",""
"passed","Sat Jan 06 06:05:30 UTC 2024","Sat Jan 06 06:06:06 UTC 2024","35278","","Login: [FNN-647] Log in from the header Positive","","Login: [FNN-647] Log in from the header Positive","should log in with valid credentials","should log in with valid credentials",""
"passed","Sat Jan 06 06:54:04 UTC 2024","Sat Jan 06 06:54:18 UTC 2024","14239","","Post Project: [FNN-588] Post project without account Negative","","Post Project: [FNN-588] Post project without account Negative","should post project with wrong phone number","should post project with wrong phone number",""
"passed","Sat Jan 06 06:46:05 UTC 2024","Sat Jan 06 06:46:13 UTC 2024","8519","","CR: [FNN-744] CR Subscribe Negative","","CR: [FNN-744] CR Subscribe Negative","should subscribe as CR without repeat password","should subscribe as CR without repeat password",""
"passed","Sat Jan 06 06:11:58 UTC 2024","Sat Jan 06 06:12:07 UTC 2024","9052","","My Profile: [FNN-690] Add resume Positive","","My Profile: [FNN-690] Add resume Positive","should add Qualities","should add Qualities",""
"passed","Sat Jan 06 06:46:31 UTC 2024","Sat Jan 06 06:46:40 UTC 2024","9378","","CR: [FNN-744] CR Subscribe Negative","","CR: [FNN-744] CR Subscribe Negative","should subscribe as CR without agreeing to the Terms and Conditions","should subscribe as CR without agreeing to the Terms and Conditions",""
"passed","Sat Jan 06 06:26:22 UTC 2024","Sat Jan 06 06:28:12 UTC 2024","110069","","My Projects: [FNN-1093] Pause project","","My Projects: [FNN-1093] Pause project","should pause the project","should pause the project",""
"broken","Sat Jan 06 06:56:48 UTC 2024","Sat Jan 06 06:58:09 UTC 2024","80939","","[FNN-813] Change language","","[FNN-813] Change language","should change language to Dutch from the footer","should change language to Dutch from the footer",""
"passed","Sat Jan 06 06:19:24 UTC 2024","Sat Jan 06 06:19:57 UTC 2024","32948","","Settings: [FNN-672] Change email address Negative","","Settings: [FNN-672] Change email address Negative","should change email address with wrong password","should change email address with wrong password",""
"passed","Sat Jan 06 06:15:32 UTC 2024","Sat Jan 06 06:17:22 UTC 2024","109841","","My Profile: [FNN-793] Remove resume","","My Profile: [FNN-793] Remove resume","should remove resume","should remove resume",""
"passed","Sat Jan 06 06:18:15 UTC 2024","Sat Jan 06 06:18:26 UTC 2024","11002","","Post Project: [FNN-649] Post project with account Negative","","Post Project: [FNN-649] Post project with account Negative","should post project without Category","should post project without Category",""
"passed","Sat Jan 06 06:28:14 UTC 2024","Sat Jan 06 06:29:57 UTC 2024","103494","","Freelancer search: [FNN-816] Create list Functionality","","Freelancer search: [FNN-816] Create list Functionality","should create a list of freelancers","should create a list of freelancers",""
"passed","Sat Jan 06 06:24:43 UTC 2024","Sat Jan 06 06:24:54 UTC 2024","11545","","Search Project: [FNN-568] Project search","","Search Project: [FNN-568] Project search","should filter projects by Search terms","should filter projects by Search terms",""
"passed","Sat Jan 06 06:50:17 UTC 2024","Sat Jan 06 06:50:44 UTC 2024","27488","","My Profile: [FNN-730] Request reference Negative","","My Profile: [FNN-730] Request reference Negative","should pass step 3 with comments less then 200 chars","should pass step 3 with comments less then 200 chars",""
"passed","Sat Jan 06 06:36:38 UTC 2024","Sat Jan 06 06:36:49 UTC 2024","11610","","[FNN-667] Send contact","","[FNN-667] Send contact","should forward the contact request","should forward the contact request",""
"passed","Sat Jan 06 06:18:45 UTC 2024","Sat Jan 06 06:19:13 UTC 2024","27716","","Settings: [FNN-672] Change email address Negative","","Settings: [FNN-672] Change email address Negative","should change email address without password","should change email address without password",""
"passed","Sat Jan 06 06:46:19 UTC 2024","Sat Jan 06 06:46:28 UTC 2024","9103","","My Transactions: [FNN-738] Milestones project: Add milestone. Negative","","My Transactions: [FNN-738] Milestones project: Add milestone. Negative","should add milestone without Amount","should add milestone without Amount",""
"passed","Sat Jan 06 06:45:13 UTC 2024","Sat Jan 06 06:45:20 UTC 2024","7613","","CR: [FNN-744] CR Subscribe Negative","","CR: [FNN-744] CR Subscribe Negative","should subscribe as CR with wrong email format","should subscribe as CR with wrong email format",""
"passed","Sat Jan 06 06:08:32 UTC 2024","Sat Jan 06 06:08:37 UTC 2024","4194","","Reset password: [FNN-655] Reset password Negative","","Reset password: [FNN-655] Reset password Negative","should reset password with wrong email","should reset password with wrong email",""
"passed","Sat Jan 06 06:31:58 UTC 2024","Sat Jan 06 06:32:49 UTC 2024","50946","","Freelancer search: [FNN-817] Add note","","Freelancer search: [FNN-817] Add note","should add note from the notes popup","should add note from the notes popup",""
"passed","Sat Jan 06 06:09:54 UTC 2024","Sat Jan 06 06:11:17 UTC 2024","83675","","Upgrade: [FNN-658] Upgrade account Positive","","Upgrade: [FNN-658] Upgrade account Positive","should upgrade account to Premium 1 month","should upgrade account to Premium 1 month",""
"broken","Sat Jan 06 06:55:32 UTC 2024","Sat Jan 06 07:10:32 UTC 2024","900041","","My Projects: [FNN-971] Complete project Positive","","My Projects: [FNN-971] Complete project Positive","""before all"" hook for [FNN-971] Complete project Positive","""before all"" hook for [FNN-971] Complete project Positive",""
"passed","Sat Jan 06 06:09:18 UTC 2024","Sat Jan 06 06:09:41 UTC 2024","22605","","Upgrade: [FNN-659] Upgrade account Negative","","Upgrade: [FNN-659] Upgrade account Negative","should upgrade account to Standard 1 month: Generic decline","should upgrade account to Standard 1 month: Generic decline",""
"passed","Sat Jan 06 06:31:46 UTC 2024","Sat Jan 06 06:31:54 UTC 2024","7919","","My Projects: [FNN-1058] Complete project Negative","","My Projects: [FNN-1058] Complete project Negative","should complete project without Communication","should complete project without Communication",""
"passed","Sat Jan 06 06:52:07 UTC 2024","Sat Jan 06 06:52:11 UTC 2024","3533","","My Profile: [FNN-719] Add resume Negative","","My Profile: [FNN-719] Add resume Negative","should add certificate without data","should add certificate without data",""
"passed","Sat Jan 06 06:30:05 UTC 2024","Sat Jan 06 06:30:43 UTC 2024","38313","","Freelancer search: [FNN-816] Create list Functionality","","Freelancer search: [FNN-816] Create list Functionality","should remove created list","should remove created list",""
"passed","Sat Jan 06 06:54:47 UTC 2024","Sat Jan 06 06:55:04 UTC 2024","16316","","Post Project: [FNN-588] Post project without account Negative","","Post Project: [FNN-588] Post project without account Negative","should post project with short password and repeat password","should post project with short password and repeat password",""
"passed","Sat Jan 06 06:31:35 UTC 2024","Sat Jan 06 06:31:42 UTC 2024","6800","","Freelancer search: [FNN-822] Send message","","Freelancer search: [FNN-822] Send message","should check the message as the CR user","should check the message as the CR user",""
"passed","Sat Jan 06 06:25:32 UTC 2024","Sat Jan 06 06:25:36 UTC 2024","3526","","My Network: [FNN-620] Invite manually via email and sms Negative","","My Network: [FNN-620] Invite manually via email and sms Negative","should invite manually via email with wrong email format","should invite manually via email with wrong email format",""
"passed","Sat Jan 06 06:46:46 UTC 2024","Sat Jan 06 06:47:39 UTC 2024","53330","","CR: [FNN-751] Invite to the organization manually Negative","","CR: [FNN-751] Invite to the organization manually Negative","should invite manually to the organization without email","should invite manually to the organization without email",""
"passed","Sat Jan 06 06:51:11 UTC 2024","Sat Jan 06 06:51:15 UTC 2024","4462","","My Profile: [FNN-719] Add resume Negative","","My Profile: [FNN-719] Add resume Negative","should add education without education","should add education without education",""
"passed","Sat Jan 06 06:09:15 UTC 2024","Sat Jan 06 06:09:26 UTC 2024","10435","","Subscribe: [FNN-577] Subscribe Negative","","Subscribe: [FNN-577] Subscribe Negative","should subscribe without agreeing to the Terms and Conditions","should subscribe without agreeing to the Terms and Conditions",""
"passed","Sat Jan 06 06:24:54 UTC 2024","Sat Jan 06 06:25:05 UTC 2024","10732","","Search Project: [FNN-568] Project search","","Search Project: [FNN-568] Project search","should filter projects by Location","should filter projects by Location",""
"passed","Sat Jan 06 06:32:10 UTC 2024","Sat Jan 06 06:32:17 UTC 2024","7245","","My Projects: [FNN-1058] Complete project Negative","","My Projects: [FNN-1058] Complete project Negative","should complete project without Comments","should complete project without Comments",""
"skipped","Sat Jan 06 06:53:45 UTC 2024","Sat Jan 06 06:54:17 UTC 2024","32034","","My Network: [FNN-1232] Invite manually via email with custom message with signup bonus","","My Network: [FNN-1232] Invite manually via email with custom message with signup bonus","should check My Dashboard and My Transactions page for the signup bonus as the inviter user","should check My Dashboard and My Transactions page for the signup bonus as the inviter user",""
"passed","Sat Jan 06 06:09:04 UTC 2024","Sat Jan 06 06:09:15 UTC 2024","10997","","Subscribe: [FNN-577] Subscribe Negative","","Subscribe: [FNN-577] Subscribe Negative","should subscribe with invalid repeat password","should subscribe with invalid repeat password",""
"failed","Sat Jan 06 06:52:21 UTC 2024","Sat Jan 06 06:53:08 UTC 2024","46496","","My Network: [FNN-1232] Invite manually via email with custom message with signup bonus","","My Network: [FNN-1232] Invite manually via email with custom message with signup bonus","should invite manually via email with valid recipient data and with message","should invite manually via email with valid recipient data and with message",""
"passed","Sat Jan 06 06:45:56 UTC 2024","Sat Jan 06 06:46:05 UTC 2024","8311","","CR: [FNN-744] CR Subscribe Negative","","CR: [FNN-744] CR Subscribe Negative","should subscribe as CR without password","should subscribe as CR without password",""
"failed","Sat Jan 06 06:51:42 UTC 2024","Sat Jan 06 06:52:07 UTC 2024","25552","","My Profile: [FNN-719] Add resume Negative","","My Profile: [FNN-719] Add resume Negative","should add education without period to","should add education without period to",""
"passed","Sat Jan 06 06:30:07 UTC 2024","Sat Jan 06 06:31:35 UTC 2024","87669","","Freelancer search: [FNN-822] Send message","","Freelancer search: [FNN-822] Send message","should send a message via the ""Send message"" action","should send a message via the ""Send message"" action",""
"failed","Sat Jan 06 06:53:45 UTC 2024","Sat Jan 06 06:54:34 UTC 2024","48460","","My Network: [FNN-619] Invite manually via sms with signup bonus","","My Network: [FNN-619] Invite manually via sms with signup bonus","should invite manually via sms with valid recipient details","should invite manually via sms with valid recipient details",""
"passed","Sat Jan 06 06:52:32 UTC 2024","Sat Jan 06 06:52:36 UTC 2024","3575","","My Profile: [FNN-719] Add resume Negative","","My Profile: [FNN-719] Add resume Negative","should add language without writing level","should add language without writing level",""
"passed","Sat Jan 06 06:11:53 UTC 2024","Sat Jan 06 06:12:13 UTC 2024","19284","","Upgrade: [FNN-659] Upgrade account Negative","","Upgrade: [FNN-659] Upgrade account Negative","should upgrade account to Standard 1 month: Incorrect number decline","should upgrade account to Standard 1 month: Incorrect number decline",""
"passed","Sat Jan 06 06:11:17 UTC 2024","Sat Jan 06 06:13:26 UTC 2024","128514","","Upgrade: [FNN-658] Upgrade account Positive","","Upgrade: [FNN-658] Upgrade account Positive","should upgrade account to Business 1 month","should upgrade account to Business 1 month",""
"broken","Sat Jan 06 06:58:17 UTC 2024","Sat Jan 06 07:02:25 UTC 2024","247453","","My Transactions: [FNN-1431] Hourly project: In retrospect. Positive","","My Transactions: [FNN-1431] Hourly project: In retrospect. Positive","should start hourly project","should start hourly project",""
"passed","Sat Jan 06 06:43:40 UTC 2024","Sat Jan 06 06:44:39 UTC 2024","59714","","CR: [FNN-744] CR Subscribe Negative","","CR: [FNN-744] CR Subscribe Negative","should subscribe as CR without sector","should subscribe as CR without sector",""
"passed","Sat Jan 06 06:13:26 UTC 2024","Sat Jan 06 06:15:18 UTC 2024","112234","","Upgrade: [FNN-658] Upgrade account Positive","","Upgrade: [FNN-658] Upgrade account Positive","should upgrade account to Enterprise 1 month","should upgrade account to Enterprise 1 month",""
"passed","Sat Jan 06 06:50:32 UTC 2024","Sat Jan 06 06:50:45 UTC 2024","12060","","Settings: [FNN-673] Confirm email address","","Settings: [FNN-673] Confirm email address","should confirm email address","should confirm email address",""
"passed","Sat Jan 06 06:30:50 UTC 2024","Sat Jan 06 06:33:50 UTC 2024","180145","","Freelancer search: [FNN-846] Invite to project","","Freelancer search: [FNN-846] Invite to project","should invite to a project via the ""Invite to project"" action","should invite to a project via the ""Invite to project"" action",""
"passed","Sat Jan 06 06:08:37 UTC 2024","Sat Jan 06 06:08:46 UTC 2024","9354","","Subscribe: [FNN-577] Subscribe Negative","","Subscribe: [FNN-577] Subscribe Negative","should subscribe without password","should subscribe without password",""
"passed","Sat Jan 06 06:07:40 UTC 2024","Sat Jan 06 06:07:48 UTC 2024","7209","","Subscribe: [FNN-577] Subscribe Negative","","Subscribe: [FNN-577] Subscribe Negative","should subscribe without email","should subscribe without email",""
"passed","Sat Jan 06 06:49:19 UTC 2024","Sat Jan 06 06:49:24 UTC 2024","4713","","My Profile: [FNN-668] Edit account details Negative","","My Profile: [FNN-668] Edit account details Negative","should edit account details with invalid phone number","should edit account details with invalid phone number",""
"passed","Sat Jan 06 06:26:23 UTC 2024","Sat Jan 06 06:28:04 UTC 2024","100805","","Search Project: [FNN-568] Project search","","Search Project: [FNN-568] Project search","should filter projects by Number of responses","should filter projects by Number of responses",""
"passed","Sat Jan 06 06:31:42 UTC 2024","Sat Jan 06 06:32:28 UTC 2024","45979","","Freelancer search: [FNN-822] Send message","","Freelancer search: [FNN-822] Send message","should check the message as the freelancer user","should check the message as the freelancer user",""
"passed","Sat Jan 06 06:19:50 UTC 2024","Sat Jan 06 06:21:57 UTC 2024","127433","","Settings: [FNN-676] Change profile settings","","Settings: [FNN-676] Change profile settings","it's not possible to contact me through the contact button on my profile","it's not possible to contact me through the contact button on my profile",""
"passed","Sat Jan 06 06:55:16 UTC 2024","Sat Jan 06 06:56:49 UTC 2024","93072","","Freelancer search: [FNN-815] Freelancer search as non-CR user","","Freelancer search: [FNN-815] Freelancer search as non-CR user","should filter freelancers by Sector","should filter freelancers by Sector",""
"passed","Sat Jan 06 06:41:49 UTC 2024","Sat Jan 06 06:46:19 UTC 2024","269340","","My Transactions: [FNN-738] Milestones project: Add milestone. Negative","","My Transactions: [FNN-738] Milestones project: Add milestone. Negative","should add milestone without Amount, Delivery date, and Description","should add milestone without Amount, Delivery date, and Description",""
"passed","Sat Jan 06 06:29:56 UTC 2024","Sat Jan 06 06:31:46 UTC 2024","109236","","Freelancer search: [FNN-817] Add note","","Freelancer search: [FNN-817] Add note","should add a note via the note button","should add a note via the note button",""
