"Status","Start Time","Stop Time","Duration in ms","Parent Suite","Suite","Sub Suite","Test Class","Test Method","Name","Description"
"passed","Sat Jan 06 06:10:25 UTC 2024","Sat Jan 06 06:10:46 UTC 2024","21130","","Upgrade: [FNN-659] Upgrade account Negative","","Upgrade: [FNN-659] Upgrade account Negative","should upgrade account to Standard 1 month: Stolen card decline","should upgrade account to Standard 1 month: Stolen card decline",""
"broken","Sat Jan 06 06:53:08 UTC 2024","Sat Jan 06 06:53:45 UTC 2024","36788","","My Network: [FNN-1232] Invite manually via email with custom message with signup bonus","","My Network: [FNN-1232] Invite manually via email with custom message with signup bonus","should subscribe as the freelancer with recipient details and accept the invitation","should subscribe as the freelancer with recipient details and accept the invitation",""
"passed","Sat Jan 06 06:25:30 UTC 2024","Sat Jan 06 06:25:44 UTC 2024","13940","","Search Project: [FNN-568] Project search","","Search Project: [FNN-568] Project search","should filter projects by Hourly rate","should filter projects by Hourly rate",""
"broken","Sat Jan 06 07:10:32 UTC 2024","Sat Jan 06 07:12:41 UTC 2024","129002","","My Projects: [FNN-971] Complete project Positive","","My Projects: [FNN-971] Complete project Positive","""after all"" hook for [FNN-971] Complete project Positive","""after all"" hook for [FNN-971] Complete project Positive",""
"passed","Sat Jan 06 06:07:25 UTC 2024","Sat Jan 06 06:08:06 UTC 2024","40828","","Login: [FNN-685] Log out","","Login: [FNN-685] Log out","should log out","should log out",""
"passed","Sat Jan 06 06:13:11 UTC 2024","Sat Jan 06 06:14:43 UTC 2024","91647","","My Profile: [FNN-713] Confirm phone number Negative","","My Profile: [FNN-713] Confirm phone number Negative","should confirm phone number with invalid code","should confirm phone number with invalid code",""
"passed","Sat Jan 06 06:10:05 UTC 2024","Sat Jan 06 06:10:25 UTC 2024","19867","","Upgrade: [FNN-659] Upgrade account Negative","","Upgrade: [FNN-659] Upgrade account Negative","should upgrade account to Standard 1 month: Lost card decline","should upgrade account to Standard 1 month: Lost card decline",""
"broken","Sat Jan 06 06:48:41 UTC 2024","Sat Jan 06 06:50:41 UTC 2024","120781","","Post Project: [FNN-587] Post project with account Positive","","Post Project: [FNN-587] Post project with account Positive","should post a project as a registered user with valid project data","should post a project as a registered user with valid project data",""
"passed","Sat Jan 06 06:12:44 UTC 2024","Sat Jan 06 06:14:09 UTC 2024","84841","","My Profile: [FNN-698] Confirm phone number Positive","","My Profile: [FNN-698] Confirm phone number Positive","should confirm phone number with valid code","should confirm phone number with valid code",""
"passed","Sat Jan 06 06:41:20 UTC 2024","Sat Jan 06 06:41:29 UTC 2024","9312","","My Transactions: [FNN-1432] Milestones project: Start project. Negative","","My Transactions: [FNN-1432] Milestones project: Start project. Negative","should start project without Way of paying","should start project without Way of paying",""
"failed","Sat Jan 06 06:50:49 UTC 2024","Sat Jan 06 06:52:13 UTC 2024","83688","","Post Project: [FNN-650] Post project without account Positive","","Post Project: [FNN-650] Post project without account Positive","should post a project as an unregistered user with valid project data","should post a project as an unregistered user with valid project data",""
"passed","Sat Jan 06 06:25:44 UTC 2024","Sat Jan 06 06:25:49 UTC 2024","5644","","Search Project: [FNN-568] Project search","","Search Project: [FNN-568] Project search","should filter projects by Status All projects","should filter projects by Status All projects",""
"broken","Sat Jan 06 06:48:38 UTC 2024","Sat Jan 06 06:50:16 UTC 2024","97990","","My Profile: [FNN-730] Request reference Negative","","My Profile: [FNN-730] Request reference Negative","""before each"" hook for [FNN-730] Request reference Negative","""before each"" hook for [FNN-730] Request reference Negative",""
"passed","Sat Jan 06 06:50:16 UTC 2024","Sat Jan 06 06:50:43 UTC 2024","27843","","My Profile: [FNN-699] Request reference Positive","","My Profile: [FNN-699] Request reference Positive","should check the validated reference","should check the validated reference",""
"skipped","Sat Jan 06 07:04:38 UTC 2024","Sat Jan 06 07:05:14 UTC 2024","36288","","CR: [FNN-749] Invite to the organization manually Positive","","CR: [FNN-749] Invite to the organization manually Positive","should check organization page as the inviting user","should check organization page as the inviting user",""
"passed","Sat Jan 06 06:31:46 UTC 2024","Sat Jan 06 06:31:58 UTC 2024","12637","","Freelancer search: [FNN-817] Add note","","Freelancer search: [FNN-817] Add note","should add a note via the action ""Add note""","should add a note via the action ""Add note""",""
"passed","Sat Jan 06 06:46:40 UTC 2024","Sat Jan 06 06:46:43 UTC 2024","2609","","CR: [FNN-744] CR Subscribe Negative","","CR: [FNN-744] CR Subscribe Negative","should subscribe as CR without data","should subscribe as CR without data",""
"broken","Sat Jan 06 07:01:32 UTC 2024","Sat Jan 06 07:05:32 UTC 2024","239984","","My Transactions: [FNN-708] Hourly project: In advance. Positive","","My Transactions: [FNN-708] Hourly project: In advance. Positive","should start hourly project","should start hourly project",""
"passed","Sat Jan 06 06:08:04 UTC 2024","Sat Jan 06 06:08:14 UTC 2024","10038","","Subscribe: [FNN-577] Subscribe Negative","","Subscribe: [FNN-577] Subscribe Negative","should subscribe without phone number","should subscribe without phone number",""
"passed","Sat Jan 06 06:36:30 UTC 2024","Sat Jan 06 06:37:04 UTC 2024","34508","","[FNN-717] Edit email settings","","[FNN-717] Edit email settings","should edit Notification settings and verify that the settings are saved","should edit Notification settings and verify that the settings are saved",""
"passed","Sat Jan 06 06:20:25 UTC 2024","Sat Jan 06 06:21:09 UTC 2024","43913","","Post Project: [FNN-649] Post project with account Negative","","Post Project: [FNN-649] Post project with account Negative","should post project with short Description","should post project with short Description",""
"passed","Sat Jan 06 06:11:09 UTC 2024","Sat Jan 06 06:11:31 UTC 2024","22287","","Upgrade: [FNN-659] Upgrade account Negative","","Upgrade: [FNN-659] Upgrade account Negative","should upgrade account to Standard 1 month: Incorrect CVC decline","should upgrade account to Standard 1 month: Incorrect CVC decline",""
"passed","Sat Jan 06 06:57:12 UTC 2024","Sat Jan 06 06:57:23 UTC 2024","10806","","Create Profile: [FNN-684] Create profile Negative","","Create Profile: [FNN-684] Create profile Negative","should create profile without Description of yourself","should create profile without Description of yourself",""
"passed","Sat Jan 06 06:47:41 UTC 2024","Sat Jan 06 06:47:44 UTC 2024","2388","","CR: [FNN-751] Invite to the organization manually Negative","","CR: [FNN-751] Invite to the organization manually Negative","should invite manually to the organization without first name","should invite manually to the organization without first name",""
"passed","Sat Jan 06 06:34:07 UTC 2024","Sat Jan 06 06:35:34 UTC 2024","87743","","Freelancer search: [FNN-846] Invite to project","","Freelancer search: [FNN-846] Invite to project","should verify if the ""Assign project"" button is enable","should verify if the ""Assign project"" button is enable",""
"passed","Sat Jan 06 06:08:24 UTC 2024","Sat Jan 06 06:08:37 UTC 2024","12816","","Subscribe: [FNN-577] Subscribe Negative","","Subscribe: [FNN-577] Subscribe Negative","should subscribe with taken phone number","should subscribe with taken phone number",""
"passed","Sat Jan 06 06:56:49 UTC 2024","Sat Jan 06 06:57:11 UTC 2024","21998","","Freelancer search: [FNN-815] Freelancer search as non-CR user","","Freelancer search: [FNN-815] Freelancer search as non-CR user","should filter freelancers by Location","should filter freelancers by Location",""
"broken","Sat Jan 06 06:53:04 UTC 2024","Sat Jan 06 06:54:43 UTC 2024","99175","","My Network: [FNN-1027] Invite freelancers","","My Network: [FNN-1027] Invite freelancers","""before all"" hook for [FNN-1027] Invite freelancers","""before all"" hook for [FNN-1027] Invite freelancers",""
"passed","Sat Jan 06 06:48:23 UTC 2024","Sat Jan 06 06:49:54 UTC 2024","90697","","My Profile: [FNN-699] Request reference Positive","","My Profile: [FNN-699] Request reference Positive","should add experience and request reference","should add experience and request reference",""
"failed","Sat Jan 06 06:49:54 UTC 2024","Sat Jan 06 06:50:16 UTC 2024","21500","","My Profile: [FNN-699] Request reference Positive","","My Profile: [FNN-699] Request reference Positive","should validate reference","should validate reference",""
"passed","Sat Jan 06 06:44:47 UTC 2024","Sat Jan 06 06:44:56 UTC 2024","8293","","CR: [FNN-744] CR Subscribe Negative","","CR: [FNN-744] CR Subscribe Negative","should subscribe as CR without first name","should subscribe as CR without first name",""
"passed","Sat Jan 06 06:14:17 UTC 2024","Sat Jan 06 06:15:12 UTC 2024","55169","","My Profile: [FNN-718] Add portfolio Negative","","My Profile: [FNN-718] Add portfolio Negative","should add portfolio without data","should add portfolio without data",""
"passed","Sat Jan 06 06:17:49 UTC 2024","Sat Jan 06 06:18:40 UTC 2024","50607","","Settings: [FNN-671] Change email address Positive","","Settings: [FNN-671] Change email address Positive","should change email address with valid credentials","should change email address with valid credentials",""
"passed","Sat Jan 06 06:32:41 UTC 2024","Sat Jan 06 06:33:59 UTC 2024","77559","","Create Profile: [FNN-683] Create profile Positive","","Create Profile: [FNN-683] Create profile Positive","should create profile with valid data","should create profile with valid data",""
"passed","Sat Jan 06 06:25:39 UTC 2024","Sat Jan 06 06:25:44 UTC 2024","4422","","My Network: [FNN-620] Invite manually via email and sms Negative","","My Network: [FNN-620] Invite manually via email and sms Negative","should invite manually via email without last name","should invite manually via email without last name",""
"passed","Sat Jan 06 06:51:03 UTC 2024","Sat Jan 06 06:51:15 UTC 2024","11683","","Settings: [FNN-675] Change password Negative","","Settings: [FNN-675] Change password Negative","should change password with invalid old password","should change password with invalid old password",""
"passed","Sat Jan 06 06:44:56 UTC 2024","Sat Jan 06 06:45:04 UTC 2024","8283","","CR: [FNN-744] CR Subscribe Negative","","CR: [FNN-744] CR Subscribe Negative","should subscribe as CR without last name","should subscribe as CR without last name",""
"passed","Sat Jan 06 06:09:41 UTC 2024","Sat Jan 06 06:10:05 UTC 2024","23886","","Upgrade: [FNN-659] Upgrade account Negative","","Upgrade: [FNN-659] Upgrade account Negative","should upgrade account to Standard 1 month: Insufficient funds decline","should upgrade account to Standard 1 month: Insufficient funds decline",""
"passed","Sat Jan 06 06:10:46 UTC 2024","Sat Jan 06 06:11:09 UTC 2024","23251","","Upgrade: [FNN-659] Upgrade account Negative","","Upgrade: [FNN-659] Upgrade account Negative","should upgrade account to Standard 1 month: Expired card decline","should upgrade account to Standard 1 month: Expired card decline",""
"passed","Sat Jan 06 06:58:44 UTC 2024","Sat Jan 06 06:59:22 UTC 2024","38106","","Freelancer search: [FNN-924] Freelancer search as CR user","","Freelancer search: [FNN-924] Freelancer search as CR user","should filter freelancers by Minimum rating","should filter freelancers by Minimum rating",""
"passed","Sat Jan 06 06:42:41 UTC 2024","Sat Jan 06 06:43:33 UTC 2024","51855","","CR: [FNN-742] CR subscribe Positive","","CR: [FNN-742] CR subscribe Positive","should subscribe as CR with valid credentials","should subscribe as CR with valid credentials",""
"passed","Sat Jan 06 06:56:17 UTC 2024","Sat Jan 06 06:56:28 UTC 2024","10179","","Create Profile: [FNN-684] Create profile Negative","","Create Profile: [FNN-684] Create profile Negative","should create profile without City","should create profile without City",""
"passed","Sat Jan 06 06:21:57 UTC 2024","Sat Jan 06 06:22:52 UTC 2024","54893","","Settings: [FNN-676] Change profile settings","","Settings: [FNN-676] Change profile settings","i don't want to display my profile in the database","i don't want to display my profile in the database",""
"passed","Sat Jan 06 06:47:46 UTC 2024","Sat Jan 06 06:47:48 UTC 2024","1870","","CR: [FNN-751] Invite to the organization manually Negative","","CR: [FNN-751] Invite to the organization manually Negative","should invite manually to the organization without first step","should invite manually to the organization without first step",""
"passed","Sat Jan 06 06:25:55 UTC 2024","Sat Jan 06 06:26:18 UTC 2024","23156","","My Network: [FNN-620] Invite manually via email and sms Negative","","My Network: [FNN-620] Invite manually via email and sms Negative","should invite manually via sms without data","should invite manually via sms without data",""
"passed","Sat Jan 06 06:26:19 UTC 2024","Sat Jan 06 06:31:32 UTC 2024","312887","","My Projects: [FNN-1058] Complete project Negative","","My Projects: [FNN-1058] Complete project Negative","should complete project without data","should complete project without data",""
"passed","Sat Jan 06 06:26:03 UTC 2024","Sat Jan 06 06:26:11 UTC 2024","8020","","Search Project: [FNN-568] Project search","","Search Project: [FNN-568] Project search","should filter projects by Posted since Last 7 days","should filter projects by Posted since Last 7 days",""
"passed","Sat Jan 06 06:11:37 UTC 2024","Sat Jan 06 06:11:52 UTC 2024","14824","","My Profile: [FNN-690] Add resume Positive","","My Profile: [FNN-690] Add resume Positive","should add Certificate","should add Certificate",""
"passed","Sat Jan 06 06:19:13 UTC 2024","Sat Jan 06 06:19:24 UTC 2024","10759","","Settings: [FNN-672] Change email address Negative","","Settings: [FNN-672] Change email address Negative","should change email address with invalid email format","should change email address with invalid email format",""
"passed","Sat Jan 06 06:48:16 UTC 2024","Sat Jan 06 06:49:14 UTC 2024","58620","","My Profile: [FNN-668] Edit account details Negative","","My Profile: [FNN-668] Edit account details Negative","should edit account details without required fields","should edit account details without required fields",""
"passed","Sat Jan 06 06:28:12 UTC 2024","Sat Jan 06 06:29:47 UTC 2024","94272","","My Projects: [FNN-1093] Pause project","","My Projects: [FNN-1093] Pause project","should verify status of the project as unregistered user","should verify status of the project as unregistered user",""
"passed","Sat Jan 06 06:54:34 UTC 2024","Sat Jan 06 06:54:47 UTC 2024","13057","","Post Project: [FNN-588] Post project without account Negative","","Post Project: [FNN-588] Post project without account Negative","should post project without repeat password","should post project without repeat password",""
"passed","Sat Jan 06 06:31:54 UTC 2024","Sat Jan 06 06:32:02 UTC 2024","7554","","My Projects: [FNN-1058] Complete project Negative","","My Projects: [FNN-1058] Complete project Negative","should complete project without Deadline","should complete project without Deadline",""
"passed","Sat Jan 06 06:57:11 UTC 2024","Sat Jan 06 06:57:29 UTC 2024","17490","","Freelancer search: [FNN-815] Freelancer search as non-CR user","","Freelancer search: [FNN-815] Freelancer search as non-CR user","should filter freelancers by Hourly Rate","should filter freelancers by Hourly Rate",""
"passed","Sat Jan 06 06:33:42 UTC 2024","Sat Jan 06 06:36:23 UTC 2024","160979","","[FNN-661] Send interest","","[FNN-661] Send interest","should send interest in the employer's project","should send interest in the employer's project",""
"passed","Sat Jan 06 06:19:30 UTC 2024","Sat Jan 06 06:19:48 UTC 2024","18099","","Post Project: [FNN-649] Post project with account Negative","","Post Project: [FNN-649] Post project with account Negative","should post project without Start date","should post project without Start date",""
"passed","Sat Jan 06 06:08:22 UTC 2024","Sat Jan 06 06:08:32 UTC 2024","10017","","Reset password: [FNN-655] Reset password Negative","","Reset password: [FNN-655] Reset password Negative","should reset password without data","should reset password without data",""
"passed","Sat Jan 06 06:17:50 UTC 2024","Sat Jan 06 06:18:01 UTC 2024","11279","","Post Project: [FNN-649] Post project with account Negative","","Post Project: [FNN-649] Post project with account Negative","should post project without Title","should post project without Title",""
"passed","Sat Jan 06 06:06:47 UTC 2024","Sat Jan 06 06:06:51 UTC 2024","3525","","Login: [FNN-574] Log in from the Login page Negative","","Login: [FNN-574] Log in from the Login page Negative","should log in without email","should log in without email",""
"passed","Sat Jan 06 06:12:16 UTC 2024","Sat Jan 06 06:12:26 UTC 2024","10727","","My Profile: [FNN-690] Add resume Positive","","My Profile: [FNN-690] Add resume Positive","should add Language","should add Language",""
"passed","Sat Jan 06 06:57:29 UTC 2024","Sat Jan 06 06:58:08 UTC 2024","39684","","Freelancer search: [FNN-815] Freelancer search as non-CR user","","Freelancer search: [FNN-815] Freelancer search as non-CR user","should filter freelancers by Skills","should filter freelancers by Skills",""
"failed","Sat Jan 06 06:26:48 UTC 2024","Sat Jan 06 06:31:08 UTC 2024","260652","","My Projects: [FNN-971] Complete project Positive","","My Projects: [FNN-971] Complete project Positive","should complete project","should complete project",""
"failed","Sat Jan 06 06:52:52 UTC 2024","Sat Jan 06 06:53:28 UTC 2024","35985","","Post Project: [FNN-588] Post project without account Negative","","Post Project: [FNN-588] Post project without account Negative","should post project with taken email","should post project with taken email",""
"skipped","Sat Jan 06 06:54:52 UTC 2024","Sat Jan 06 06:55:25 UTC 2024","33057","","My Network: [FNN-1233] Invite manually via email without custom message with signup bonus","","My Network: [FNN-1233] Invite manually via email without custom message with signup bonus","should check My Dashboard and My Transactions page for the signup bonus as the inviter user","should check My Dashboard and My Transactions page for the signup bonus as the inviter user",""
"passed","Sat Jan 06 06:50:26 UTC 2024","Sat Jan 06 06:50:34 UTC 2024","7916","","My Profile: [FNN-719] Add resume Negative","","My Profile: [FNN-719] Add resume Negative","should add experience without period from  ","should add experience without period from  ",""
"passed","Sat Jan 06 06:06:15 UTC 2024","Sat Jan 06 06:06:39 UTC 2024","24187","","Login: [FNN-563] Log in from the header Negative","","Login: [FNN-563] Log in from the header Negative","should log in with valid email and invalid password","should log in with valid email and invalid password",""
"passed","Sat Jan 06 06:20:06 UTC 2024","Sat Jan 06 06:21:31 UTC 2024","84708","","Settings: [FNN-677] Downgrade to ""Stand-by Standaard""","","Settings: [FNN-677] Downgrade to ""Stand-by Standaard""","should downgrade to ""Stand-by Standaard""","should downgrade to ""Stand-by Standaard""",""
"passed","Sat Jan 06 06:45:04 UTC 2024","Sat Jan 06 06:45:13 UTC 2024","8783","","CR: [FNN-744] CR Subscribe Negative","","CR: [FNN-744] CR Subscribe Negative","should subscribe as CR without email","should subscribe as CR without email",""
"passed","Sat Jan 06 06:25:49 UTC 2024","Sat Jan 06 06:25:57 UTC 2024","7142","","Search Project: [FNN-568] Project search","","Search Project: [FNN-568] Project search","should filter projects by Status Open projects","should filter projects by Status Open projects",""
"passed","Sat Jan 06 06:36:23 UTC 2024","Sat Jan 06 06:36:36 UTC 2024","13505","","[FNN-661] Send interest","","[FNN-661] Send interest","should assign the freelancer user","should assign the freelancer user",""
"passed","Sat Jan 06 06:29:57 UTC 2024","Sat Jan 06 06:30:05 UTC 2024","7778","","Freelancer search: [FNN-816] Create list Functionality","","Freelancer search: [FNN-816] Create list Functionality","should re-open original search","should re-open original search",""
"passed","Sat Jan 06 07:03:40 UTC 2024","Sat Jan 06 07:07:11 UTC 2024","210591","","My Transactions: [FNN-737] Hourly project: Start project. Negative","","My Transactions: [FNN-737] Hourly project: Start project. Negative","should start project without Hours per period and Hourly rate","should start project without Hours per period and Hourly rate",""
"failed","Sat Jan 06 06:47:12 UTC 2024","Sat Jan 06 06:49:11 UTC 2024","118984","","CR: [FNN-1779] My Dashboard page integrity as Employer","","CR: [FNN-1779] My Dashboard page integrity as Employer","should verify the integrity of the My Dashboard page as employer","should verify the integrity of the My Dashboard page as employer",""
"passed","Sat Jan 06 06:25:05 UTC 2024","Sat Jan 06 06:25:30 UTC 2024","24762","","Search Project: [FNN-568] Project search","","Search Project: [FNN-568] Project search","should filter projects by Fixed price","should filter projects by Fixed price",""
"passed","Sat Jan 06 06:20:04 UTC 2024","Sat Jan 06 06:20:25 UTC 2024","20854","","Post Project: [FNN-649] Post project with account Negative","","Post Project: [FNN-649] Post project with account Negative","should post project without Description","should post project without Description",""
"passed","Sat Jan 06 06:25:10 UTC 2024","Sat Jan 06 06:25:32 UTC 2024","21883","","My Network: [FNN-620] Invite manually via email and sms Negative","","My Network: [FNN-620] Invite manually via email and sms Negative","should invite manually via email without email","should invite manually via email without email",""
"passed","Sat Jan 06 06:11:25 UTC 2024","Sat Jan 06 06:11:37 UTC 2024","11663","","My Profile: [FNN-690] Add resume Positive","","My Profile: [FNN-690] Add resume Positive","should add Education","should add Education",""
"passed","Sat Jan 06 06:46:42 UTC 2024","Sat Jan 06 06:47:04 UTC 2024","22061","","My Transactions: [FNN-738] Milestones project: Add milestone. Negative","","My Transactions: [FNN-738] Milestones project: Add milestone. Negative","should add milestone with Amount less than 250","should add milestone with Amount less than 250",""
"passed","Sat Jan 06 06:17:27 UTC 2024","Sat Jan 06 06:17:50 UTC 2024","22153","","Post Project: [FNN-649] Post project with account Negative","","Post Project: [FNN-649] Post project with account Negative","should post project without step 1","should post project without step 1",""
"passed","Sat Jan 06 06:07:48 UTC 2024","Sat Jan 06 06:07:55 UTC 2024","7334","","Subscribe: [FNN-577] Subscribe Negative","","Subscribe: [FNN-577] Subscribe Negative","should subscribe with wrong email format","should subscribe with wrong email format",""
"failed","Sat Jan 06 07:07:18 UTC 2024","Sat Jan 06 07:07:42 UTC 2024","23842","","My Transactions: [FNN-737] Hourly project: Start project. Negative","","My Transactions: [FNN-737] Hourly project: Start project. Negative","should start project with Hourly rate rate than 25","should start project with Hourly rate rate than 25",""
"failed","Sat Jan 06 06:46:50 UTC 2024","Sat Jan 06 06:48:34 UTC 2024","104689","","CR: [FNN-1888] My Dashboard page integrity as Freelancer","","CR: [FNN-1888] My Dashboard page integrity as Freelancer","should verify the integrity of the My Dashboard page as freelancer","should verify the integrity of the My Dashboard page as freelancer",""
"passed","Sat Jan 06 06:45:20 UTC 2024","Sat Jan 06 06:45:32 UTC 2024","11294","","CR: [FNN-744] CR Subscribe Negative","","CR: [FNN-744] CR Subscribe Negative","should subscribe as CR with taken email","should subscribe as CR with taken email",""
"passed","Sat Jan 06 06:06:45 UTC 2024","Sat Jan 06 06:06:47 UTC 2024","2928","","Login: [FNN-574] Log in from the Login page Negative","","Login: [FNN-574] Log in from the Login page Negative","should log in with wrong email format","should log in with wrong email format",""
"passed","Sat Jan 06 06:09:39 UTC 2024","Sat Jan 06 06:11:31 UTC 2024","112777","","My Profile: [FNN-669] Edit account details Positive","","My Profile: [FNN-669] Edit account details Positive","should edit freelancer account details with valid information","should edit freelancer account details with valid information",""
"passed","Sat Jan 06 06:47:39 UTC 2024","Sat Jan 06 06:47:41 UTC 2024","2418","","CR: [FNN-751] Invite to the organization manually Negative","","CR: [FNN-751] Invite to the organization manually Negative","should invite manually via email with wrong email format","should invite manually via email with wrong email format",""
"passed","Sat Jan 06 06:11:31 UTC 2024","Sat Jan 06 06:11:53 UTC 2024","21965","","Upgrade: [FNN-659] Upgrade account Negative","","Upgrade: [FNN-659] Upgrade account Negative","should upgrade account to Standard 1 month: Processing error decline","should upgrade account to Standard 1 month: Processing error decline",""
"passed","Sat Jan 06 06:46:13 UTC 2024","Sat Jan 06 06:46:22 UTC 2024","8547","","CR: [FNN-744] CR Subscribe Negative","","CR: [FNN-744] CR Subscribe Negative","should subscribe as CR with short password","should subscribe as CR with short password",""
"failed","Sat Jan 06 06:58:16 UTC 2024","Sat Jan 06 07:00:51 UTC 2024","154903","","[FNN-743] Archive and restore message","","[FNN-743] Archive and restore message","should archive the message","should archive the message",""
