"Status","Start Time","Stop Time","Duration in ms","Parent Suite","Suite","Sub Suite","Test Class","Test Method","Name","Description"
"passed","Wed Mar 27 06:14:47 UTC 2024","Wed Mar 27 06:15:18 UTC 2024","31230","","Upgrade: [FNN-659] Upgrade account Negative","","Upgrade: [FNN-659] Upgrade account Negative","should upgrade account to Standard 1 month: Processing error decline","should upgrade account to Standard 1 month: Processing error decline",""
"passed","Wed Mar 27 06:07:39 UTC 2024","Wed Mar 27 06:08:32 UTC 2024","53240","","Login: [FNN-563] Log in from the header Negative","","Login: [FNN-563] Log in from the header Negative","should log in with valid email and invalid password","should log in with valid email and invalid password",""
"passed","Wed Mar 27 07:10:45 UTC 2024","Wed Mar 27 07:11:06 UTC 2024","20264","","Post Project: [FNN-588] Post project without account Negative","","Post Project: [FNN-588] Post project without account Negative","should post project with wrong email","should post project with wrong email",""
"passed","Wed Mar 27 06:27:21 UTC 2024","Wed Mar 27 06:28:08 UTC 2024","46235","","Settings: [FNN-672] Change email address Negative","","Settings: [FNN-672] Change email address Negative","should change email address with wrong password","should change email address with wrong password",""
"passed","Wed Mar 27 06:47:08 UTC 2024","Wed Mar 27 06:47:46 UTC 2024","37436","","Freelancer search: [FNN-924] Freelancer search as CR user","","Freelancer search: [FNN-924] Freelancer search as CR user","should filter freelancers by Location","should filter freelancers by Location",""
"passed","Wed Mar 27 06:35:49 UTC 2024","Wed Mar 27 06:36:21 UTC 2024","31860","","My Network: [FNN-620] Invite manually via email and sms Negative","","My Network: [FNN-620] Invite manually via email and sms Negative","should invite manually via sms without data","should invite manually via sms without data",""
"failed","Wed Mar 27 07:04:44 UTC 2024","Wed Mar 27 07:06:29 UTC 2024","105122","","Upgrade: [FNN-658] Upgrade account Positive","","Upgrade: [FNN-658] Upgrade account Positive","should upgrade account to Premium 1 month","should upgrade account to Premium 1 month",""
"passed","Wed Mar 27 06:35:30 UTC 2024","Wed Mar 27 06:35:35 UTC 2024","4841","","My Network: [FNN-620] Invite manually via email and sms Negative","","My Network: [FNN-620] Invite manually via email and sms Negative","should invite manually via email without last name","should invite manually via email without last name",""
"passed","Wed Mar 27 06:43:39 UTC 2024","Wed Mar 27 06:45:16 UTC 2024","96830","","Create Profile: [FNN-683] Create profile Positive","","Create Profile: [FNN-683] Create profile Positive","should create profile with valid data","should create profile with valid data",""
"broken","Wed Mar 27 07:20:32 UTC 2024","Wed Mar 27 07:25:18 UTC 2024","286813","","My Transactions: [FNN-1430] Milestones project: In retrospect. Positive","","My Transactions: [FNN-1430] Milestones project: In retrospect. Positive","should start project with milestone","should start project with milestone",""
"passed","Wed Mar 27 07:15:39 UTC 2024","Wed Mar 27 07:15:44 UTC 2024","4767","","Search Project: [FNN-568] Project search","","Search Project: [FNN-568] Project search","should filter projects by Status All projects","should filter projects by Status All projects",""
"passed","Wed Mar 27 06:24:06 UTC 2024","Wed Mar 27 06:24:17 UTC 2024","11279","","Post Project: [FNN-649] Post project with account Negative","","Post Project: [FNN-649] Post project with account Negative","should post project with short Title","should post project with short Title",""
"passed","Wed Mar 27 07:05:18 UTC 2024","Wed Mar 27 07:05:26 UTC 2024","7887","","My Profile: [FNN-730] Request reference Negative","","My Profile: [FNN-730] Request reference Negative","should pass step 2 without last name","should pass step 2 without last name",""
"passed","Wed Mar 27 07:00:57 UTC 2024","Wed Mar 27 07:01:09 UTC 2024","12101","","CR: [FNN-744] CR Subscribe Negative","","CR: [FNN-744] CR Subscribe Negative","should subscribe as CR with invalid repeat password","should subscribe as CR with invalid repeat password",""
"passed","Wed Mar 27 06:42:50 UTC 2024","Wed Mar 27 06:46:40 UTC 2024","229253","","Freelancer search: [FNN-924] Freelancer search as CR user","","Freelancer search: [FNN-924] Freelancer search as CR user","should filter freelancers by Terms","should filter freelancers by Terms",""
"passed","Wed Mar 27 06:11:13 UTC 2024","Wed Mar 27 06:11:27 UTC 2024","14466","","Subscribe: [FNN-577] Subscribe Negative","","Subscribe: [FNN-577] Subscribe Negative","should subscribe with invalid repeat password","should subscribe with invalid repeat password",""
"passed","Wed Mar 27 07:00:21 UTC 2024","Wed Mar 27 07:00:31 UTC 2024","9291","","My Transactions: [FNN-738] Milestones project: Add milestone. Negative","","My Transactions: [FNN-738] Milestones project: Add milestone. Negative","should add milestone without Amount","should add milestone without Amount",""
"passed","Wed Mar 27 06:48:07 UTC 2024","Wed Mar 27 06:49:07 UTC 2024","59441","","Freelancer search: [FNN-924] Freelancer search as CR user","","Freelancer search: [FNN-924] Freelancer search as CR user","should filter freelancers by Years of experience","should filter freelancers by Years of experience",""
"passed","Wed Mar 27 06:25:46 UTC 2024","Wed Mar 27 06:26:04 UTC 2024","18096","","Post Project: [FNN-649] Post project with account Negative","","Post Project: [FNN-649] Post project with account Negative","should post project without End date","should post project without End date",""
"passed","Wed Mar 27 07:03:00 UTC 2024","Wed Mar 27 07:04:05 UTC 2024","64397","","My Profile: [FNN-719] Add resume Negative","","My Profile: [FNN-719] Add resume Negative","should add CV without CV","should add CV without CV",""
"passed","Wed Mar 27 07:16:34 UTC 2024","Wed Mar 27 07:16:59 UTC 2024","25197","","Freelancer search: [FNN-815] Freelancer search as non-CR user","","Freelancer search: [FNN-815] Freelancer search as non-CR user","should filter freelancers by Location","should filter freelancers by Location",""
"passed","Wed Mar 27 06:59:50 UTC 2024","Wed Mar 27 07:00:02 UTC 2024","11816","","CR: [FNN-744] CR Subscribe Negative","","CR: [FNN-744] CR Subscribe Negative","should subscribe as CR with wrong phone number","should subscribe as CR with wrong phone number",""
"passed","Wed Mar 27 07:16:59 UTC 2024","Wed Mar 27 07:17:22 UTC 2024","22583","","Freelancer search: [FNN-815] Freelancer search as non-CR user","","Freelancer search: [FNN-815] Freelancer search as non-CR user","should filter freelancers by Hourly Rate","should filter freelancers by Hourly Rate",""
"passed","Wed Mar 27 06:29:27 UTC 2024","Wed Mar 27 06:29:30 UTC 2024","2499","","Settings: [FNN-678] Delete account without subscription","","Settings: [FNN-678] Delete account without subscription","should receive a ""account deleted"" letter","should receive a ""account deleted"" letter",""
"skipped","Wed Mar 27 07:29:32 UTC 2024","Wed Mar 27 07:29:32 UTC 2024","1","","My Transactions: [FNN-708] Hourly project: In advance. Positive","","My Transactions: [FNN-708] Hourly project: In advance. Positive","should verify that the money paid","should verify that the money paid",""
"skipped","Wed Mar 27 07:29:32 UTC 2024","Wed Mar 27 07:29:32 UTC 2024","1","","My Transactions: [FNN-708] Hourly project: In advance. Positive","","My Transactions: [FNN-708] Hourly project: In advance. Positive","should pay deposit","should pay deposit",""
"passed","Wed Mar 27 07:06:10 UTC 2024","Wed Mar 27 07:06:24 UTC 2024","14551","","My Profile: [FNN-730] Request reference Negative","","My Profile: [FNN-730] Request reference Negative","should pass step 3 without data","should pass step 3 without data",""
"passed","Wed Mar 27 07:12:44 UTC 2024","Wed Mar 27 07:13:50 UTC 2024","65932","","My Network: [FNN-619] Invite manually via sms with signup bonus","","My Network: [FNN-619] Invite manually via sms with signup bonus","should subscribe as the freelancer with recipient details and accept the invitation","should subscribe as the freelancer with recipient details and accept the invitation",""
"passed","Wed Mar 27 06:30:04 UTC 2024","Wed Mar 27 06:31:15 UTC 2024","71165","","Settings: [FNN-676] Change profile settings","","Settings: [FNN-676] Change profile settings","i don't want to display my profile in the database","i don't want to display my profile in the database",""
"passed","Wed Mar 27 06:42:44 UTC 2024","Wed Mar 27 06:43:01 UTC 2024","16497","","Freelancer search: [FNN-817] Add note","","Freelancer search: [FNN-817] Add note","should add a note via the action ""Add note""","should add a note via the action ""Add note""",""
"failed","Wed Mar 27 07:15:57 UTC 2024","Wed Mar 27 07:16:07 UTC 2024","9564","","Search Project: [FNN-568] Project search","","Search Project: [FNN-568] Project search","should filter projects by Posted since Last 7 days","should filter projects by Posted since Last 7 days",""
"failed","Wed Mar 27 07:10:13 UTC 2024","Wed Mar 27 07:11:10 UTC 2024","57166","","My Network: [FNN-1233] Invite manually via email without custom message with signup bonus","","My Network: [FNN-1233] Invite manually via email without custom message with signup bonus","should invite manually via email with valid recipient data and without message","should invite manually via email with valid recipient data and without message",""
"skipped","Wed Mar 27 07:29:32 UTC 2024","Wed Mar 27 07:29:32 UTC 2024","1","","My Transactions: [FNN-708] Hourly project: In advance. Positive","","My Transactions: [FNN-708] Hourly project: In advance. Positive","should add hours","should add hours",""
"passed","Wed Mar 27 06:25:29 UTC 2024","Wed Mar 27 06:25:46 UTC 2024","17586","","Post Project: [FNN-649] Post project with account Negative","","Post Project: [FNN-649] Post project with account Negative","should post project without Start date","should post project without Start date",""
