"Status","Start Time","Stop Time","Duration in ms","Parent Suite","Suite","Sub Suite","Test Class","Test Method","Name","Description"
"passed","Wed Mar 27 07:08:36 UTC 2024","Wed Mar 27 07:09:47 UTC 2024","70521","","Post Project: [FNN-588] Post project without account Negative","","Post Project: [FNN-588] Post project without account Negative","should post project without account details","should post project without account details",""
"failed","Wed Mar 27 07:20:51 UTC 2024","Wed Mar 27 07:26:38 UTC 2024","346840","","My Transactions: [FNN-1432] Milestones project: Start project. Negative","","My Transactions: [FNN-1432] Milestones project: Start project. Negative","should start project without milestone","should start project without milestone",""
"skipped","Wed Mar 27 07:25:18 UTC 2024","Wed Mar 27 07:25:18 UTC 2024","12","","My Transactions: [FNN-1430] Milestones project: In retrospect. Positive","","My Transactions: [FNN-1430] Milestones project: In retrospect. Positive","should verify that the money paid","should verify that the money paid",""
"passed","Wed Mar 27 06:42:28 UTC 2024","Wed Mar 27 06:42:39 UTC 2024","11659","","Freelancer search: [FNN-816] Create list Functionality","","Freelancer search: [FNN-816] Create list Functionality","should re-open original search","should re-open original search",""
"failed","Wed Mar 27 07:02:45 UTC 2024","Wed Mar 27 07:04:44 UTC 2024","119430","","Upgrade: [FNN-658] Upgrade account Positive","","Upgrade: [FNN-658] Upgrade account Positive","should upgrade account to Standaard 1 month","should upgrade account to Standaard 1 month",""
"passed","Wed Mar 27 07:04:09 UTC 2024","Wed Mar 27 07:05:28 UTC 2024","79262","","Post Project: [FNN-587] Post project with account Positive","","Post Project: [FNN-587] Post project with account Positive","should post a project as a registered user with valid project data","should post a project as a registered user with valid project data",""
"failed","Wed Mar 27 07:05:40 UTC 2024","Wed Mar 27 07:06:10 UTC 2024","29920","","My Profile: [FNN-730] Request reference Negative","","My Profile: [FNN-730] Request reference Negative","should pass step 2 with invalid website format","should pass step 2 with invalid website format",""
"passed","Wed Mar 27 07:14:29 UTC 2024","Wed Mar 27 07:14:42 UTC 2024","13390","","Search Project: [FNN-568] Project search","","Search Project: [FNN-568] Project search","should filter projects by Search terms","should filter projects by Search terms",""
"passed","Wed Mar 27 06:17:50 UTC 2024","Wed Mar 27 06:18:51 UTC 2024","61213","","My Profile: [FNN-718] Add portfolio Negative","","My Profile: [FNN-718] Add portfolio Negative","should add portfolio without data","should add portfolio without data",""
"passed","Wed Mar 27 06:06:15 UTC 2024","Wed Mar 27 06:07:22 UTC 2024","66974","","Login: [FNN-647] Log in from the header Positive","","Login: [FNN-647] Log in from the header Positive","should log in with valid credentials","should log in with valid credentials",""
"skipped","Wed Mar 27 06:06:38 UTC 2024","Wed Mar 27 06:06:38 UTC 2024","1","","Subscribe","","Subscribe","[FNN-2373] Professional receives Welcome letter","[FNN-2373] Professional receives Welcome letter",""
"passed","Wed Mar 27 06:10:31 UTC 2024","Wed Mar 27 06:11:50 UTC 2024","78528","","Upgrade: [FNN-659] Upgrade account Negative","","Upgrade: [FNN-659] Upgrade account Negative","should upgrade account to Standard 1 month without required fields","should upgrade account to Standard 1 month without required fields",""
"passed","Wed Mar 27 06:26:04 UTC 2024","Wed Mar 27 06:26:25 UTC 2024","20856","","Post Project: [FNN-649] Post project with account Negative","","Post Project: [FNN-649] Post project with account Negative","should post project without Description","should post project without Description",""
"passed","Wed Mar 27 06:38:40 UTC 2024","Wed Mar 27 06:40:19 UTC 2024","98474","","My Projects: [FNN-1093] Pause project","","My Projects: [FNN-1093] Pause project","should verify status of the project as unregistered user","should verify status of the project as unregistered user",""
"passed","Wed Mar 27 07:05:18 UTC 2024","Wed Mar 27 07:05:23 UTC 2024","4484","","My Profile: [FNN-719] Add resume Negative","","My Profile: [FNN-719] Add resume Negative","should add education without institute","should add education without institute",""
"passed","Wed Mar 27 06:59:00 UTC 2024","Wed Mar 27 06:59:13 UTC 2024","12353","","CR: [FNN-744] CR Subscribe Negative","","CR: [FNN-744] CR Subscribe Negative","should subscribe as CR without email","should subscribe as CR without email",""
"passed","Wed Mar 27 06:43:01 UTC 2024","Wed Mar 27 06:44:02 UTC 2024","61034","","Freelancer search: [FNN-817] Add note","","Freelancer search: [FNN-817] Add note","should add note from the notes popup","should add note from the notes popup",""
"skipped","Wed Mar 27 07:23:27 UTC 2024","Wed Mar 27 07:24:19 UTC 2024","52037","","Freelancer search: [FNN-846] Invite to project","","Freelancer search: [FNN-846] Invite to project","should verify if the ""Assign project"" button is enable","should verify if the ""Assign project"" button is enable",""
"passed","Wed Mar 27 06:18:51 UTC 2024","Wed Mar 27 06:19:21 UTC 2024","30184","","My Profile: [FNN-718] Add portfolio Negative","","My Profile: [FNN-718] Add portfolio Negative","should add portfolio without Type","should add portfolio without Type",""
"passed","Wed Mar 27 07:10:06 UTC 2024","Wed Mar 27 07:10:27 UTC 2024","20525","","Post Project: [FNN-588] Post project without account Negative","","Post Project: [FNN-588] Post project without account Negative","should post project without last name","should post project without last name",""
"broken","Wed Mar 27 07:09:06 UTC 2024","Wed Mar 27 07:17:00 UTC 2024","474303","","My Profile: [FNN-699] Request reference Positive","","My Profile: [FNN-699] Request reference Positive","should check the validated reference","should check the validated reference",""
"passed","Wed Mar 27 06:24:39 UTC 2024","Wed Mar 27 06:24:53 UTC 2024","14500","","Post Project: [FNN-649] Post project with account Negative","","Post Project: [FNN-649] Post project with account Negative","should post project without Budget","should post project without Budget",""
"passed","Wed Mar 27 06:35:35 UTC 2024","Wed Mar 27 06:35:37 UTC 2024","2124","","My Network: [FNN-620] Invite manually via email and sms Negative","","My Network: [FNN-620] Invite manually via email and sms Negative","should invite manually via email without data","should invite manually via email without data",""
"passed","Wed Mar 27 07:22:56 UTC 2024","Wed Mar 27 07:23:38 UTC 2024","41931","","[FNN-743] Archive and restore message","","[FNN-743] Archive and restore message","should restore the message","should restore the message",""
"failed","Wed Mar 27 07:19:26 UTC 2024","Wed Mar 27 07:20:16 UTC 2024","50446","","My Network: [FNN-664] Invite freelancer","","My Network: [FNN-664] Invite freelancer","should check network as sender user","should check network as sender user",""
"passed","Wed Mar 27 06:42:39 UTC 2024","Wed Mar 27 06:43:31 UTC 2024","51951","","Freelancer search: [FNN-816] Create list Functionality","","Freelancer search: [FNN-816] Create list Functionality","should remove created list","should remove created list",""
"passed","Wed Mar 27 06:12:18 UTC 2024","Wed Mar 27 06:12:51 UTC 2024","32784","","Upgrade: [FNN-659] Upgrade account Negative","","Upgrade: [FNN-659] Upgrade account Negative","should upgrade account to Standard 1 month: Insufficient funds decline","should upgrade account to Standard 1 month: Insufficient funds decline",""
"passed","Wed Mar 27 06:14:58 UTC 2024","Wed Mar 27 06:15:09 UTC 2024","10163","","My Profile: [FNN-690] Add resume Positive","","My Profile: [FNN-690] Add resume Positive","should add Language","should add Language",""
"passed","Wed Mar 27 06:09:42 UTC 2024","Wed Mar 27 06:09:45 UTC 2024","3162","","Login: [FNN-574] Log in from the Login page Negative","","Login: [FNN-574] Log in from the Login page Negative","should log in without email","should log in without email",""
"passed","Wed Mar 27 06:10:32 UTC 2024","Wed Mar 27 06:10:46 UTC 2024","14001","","Subscribe: [FNN-577] Subscribe Negative","","Subscribe: [FNN-577] Subscribe Negative","should subscribe without password","should subscribe without password",""
"passed","Wed Mar 27 07:12:20 UTC 2024","Wed Mar 27 07:14:29 UTC 2024","128811","","Search Project: [FNN-568] Project search","","Search Project: [FNN-568] Project search","should filter projects by Category","should filter projects by Category",""
"passed","Wed Mar 27 07:14:42 UTC 2024","Wed Mar 27 07:14:55 UTC 2024","12598","","Search Project: [FNN-568] Project search","","Search Project: [FNN-568] Project search","should filter projects by Location","should filter projects by Location",""
"passed","Wed Mar 27 06:12:34 UTC 2024","Wed Mar 27 06:13:46 UTC 2024","71379","","My Profile: [FNN-690] Add resume Positive","","My Profile: [FNN-690] Add resume Positive","should add CV","should add CV",""
"passed","Wed Mar 27 07:02:44 UTC 2024","Wed Mar 27 07:02:49 UTC 2024","4649","","My Profile: [FNN-668] Edit account details Negative","","My Profile: [FNN-668] Edit account details Negative","should edit account details without sector","should edit account details without sector",""
"passed","Wed Mar 27 06:40:26 UTC 2024","Wed Mar 27 06:42:45 UTC 2024","139033","","Freelancer search: [FNN-822] Send message","","Freelancer search: [FNN-822] Send message","should send a message via the ""Send message"" action","should send a message via the ""Send message"" action",""
"skipped","Wed Mar 27 07:30:43 UTC 2024","Wed Mar 27 07:30:43 UTC 2024","3","","My Transactions: [FNN-710] Milestones project: In advance. Positive","","My Transactions: [FNN-710] Milestones project: In advance. Positive","should accept the project","should accept the project",""
"passed","Wed Mar 27 07:16:50 UTC 2024","Wed Mar 27 07:18:39 UTC 2024","108585","","My Projects: [FNN-1058] Complete project Negative","","My Projects: [FNN-1058] Complete project Negative","should complete project with short Comments","should complete project with short Comments",""
"passed","Wed Mar 27 07:13:50 UTC 2024","Wed Mar 27 07:14:36 UTC 2024","46371","","Post Project: [FNN-588] Post project without account Negative","","Post Project: [FNN-588] Post project without account Negative","should post project without passwords matching","should post project without passwords matching",""
"failed","Wed Mar 27 07:02:56 UTC 2024","Wed Mar 27 07:03:27 UTC 2024","30930","","My Profile: [FNN-668] Edit account details Negative","","My Profile: [FNN-668] Edit account details Negative","should edit account details with invalid Twitter, LinkedIn and Website urls","should edit account details with invalid Twitter, LinkedIn and Website urls",""
"passed","Wed Mar 27 07:00:31 UTC 2024","Wed Mar 27 07:00:39 UTC 2024","7939","","My Transactions: [FNN-738] Milestones project: Add milestone. Negative","","My Transactions: [FNN-738] Milestones project: Add milestone. Negative","should add milestone without Delivery date","should add milestone without Delivery date",""
"skipped","Wed Mar 27 06:47:50 UTC 2024","Wed Mar 27 06:47:50 UTC 2024","5","","[FNN-667] Send contact","","[FNN-667] Send contact","should check the contact as the first user","should check the contact as the first user",""
"passed","Wed Mar 27 07:06:24 UTC 2024","Wed Mar 27 07:06:46 UTC 2024","21627","","My Profile: [FNN-730] Request reference Negative","","My Profile: [FNN-730] Request reference Negative","should pass step 3 without 1 rating","should pass step 3 without 1 rating",""
"passed","Wed Mar 27 06:09:32 UTC 2024","Wed Mar 27 06:09:37 UTC 2024","4386","","Login: [FNN-574] Log in from the Login page Negative","","Login: [FNN-574] Log in from the Login page Negative","should log in with invalid credentials","should log in with invalid credentials",""
"skipped","Wed Mar 27 07:23:27 UTC 2024","Wed Mar 27 07:23:27 UTC 2024","2","","Freelancer search: [FNN-846] Invite to project","","Freelancer search: [FNN-846] Invite to project","should check the invitation and send an interest of the project","should check the invitation and send an interest of the project",""
"passed","Wed Mar 27 07:04:09 UTC 2024","Wed Mar 27 07:04:21 UTC 2024","11875","","My Profile: [FNN-719] Add resume Negative","","My Profile: [FNN-719] Add resume Negative","should add experience without position","should add experience without position",""
"passed","Wed Mar 27 06:14:49 UTC 2024","Wed Mar 27 06:14:58 UTC 2024","9720","","My Profile: [FNN-690] Add resume Positive","","My Profile: [FNN-690] Add resume Positive","should add Expertise","should add Expertise",""
"broken","Wed Mar 27 07:13:03 UTC 2024","Wed Mar 27 07:16:50 UTC 2024","226670","","My Projects: [FNN-1058] Complete project Negative","","My Projects: [FNN-1058] Complete project Negative","""before each"" hook for [FNN-1058] Complete project Negative","""before each"" hook for [FNN-1058] Complete project Negative",""
"passed","Wed Mar 27 07:04:31 UTC 2024","Wed Mar 27 07:04:42 UTC 2024","11204","","My Profile: [FNN-719] Add resume Negative","","My Profile: [FNN-719] Add resume Negative","should add experience without period from  ","should add experience without period from  ",""
"broken","Wed Mar 27 07:20:25 UTC 2024","Wed Mar 27 07:22:56 UTC 2024","151066","","[FNN-743] Archive and restore message","","[FNN-743] Archive and restore message","""before all"" hook for [FNN-743] Archive and restore message","""before all"" hook for [FNN-743] Archive and restore message",""
"failed","Wed Mar 27 07:09:10 UTC 2024","Wed Mar 27 07:09:17 UTC 2024","7507","","Post Project: [FNN-650] Post project without account Positive","","Post Project: [FNN-650] Post project without account Positive","should verify that the user received a verify email letter","should verify that the user received a verify email letter",""
"failed","Wed Mar 27 07:25:31 UTC 2024","Wed Mar 27 07:30:43 UTC 2024","312053","","My Transactions: [FNN-710] Milestones project: In advance. Positive","","My Transactions: [FNN-710] Milestones project: In advance. Positive","should start project with milestone","should start project with milestone",""
"passed","Wed Mar 27 06:34:30 UTC 2024","Wed Mar 27 06:35:17 UTC 2024","47514","","My Network: [FNN-620] Invite manually via email and sms Negative","","My Network: [FNN-620] Invite manually via email and sms Negative","should invite manually via email without email","should invite manually via email without email",""
"skipped","Wed Mar 27 07:25:18 UTC 2024","Wed Mar 27 07:25:18 UTC 2024","0","","My Transactions: [FNN-1430] Milestones project: In retrospect. Positive","","My Transactions: [FNN-1430] Milestones project: In retrospect. Positive","should approve milestone and pay for it","should approve milestone and pay for it",""
"passed","Wed Mar 27 07:02:49 UTC 2024","Wed Mar 27 07:02:56 UTC 2024","6854","","My Profile: [FNN-668] Edit account details Negative","","My Profile: [FNN-668] Edit account details Negative","should edit account details with invalid phone number","should edit account details with invalid phone number",""
"skipped","Wed Mar 27 07:25:18 UTC 2024","Wed Mar 27 07:25:18 UTC 2024","2","","My Transactions: [FNN-1430] Milestones project: In retrospect. Positive","","My Transactions: [FNN-1430] Milestones project: In retrospect. Positive","should accept the project and request payout","should accept the project and request payout",""
"passed","Wed Mar 27 06:09:06 UTC 2024","Wed Mar 27 06:09:16 UTC 2024","10072","","Subscribe: [FNN-577] Subscribe Negative","","Subscribe: [FNN-577] Subscribe Negative","should subscribe without last name","should subscribe without last name",""
"passed","Wed Mar 27 06:25:12 UTC 2024","Wed Mar 27 06:25:29 UTC 2024","16639","","Post Project: [FNN-649] Post project with account Negative","","Post Project: [FNN-649] Post project with account Negative","should post project without Location","should post project without Location",""
"broken","Wed Mar 27 07:18:45 UTC 2024","Wed Mar 27 07:20:09 UTC 2024","83975","","[FNN-813] Change language","","[FNN-813] Change language","should change language to Dutch from the footer","should change language to Dutch from the footer",""
"skipped","Wed Mar 27 06:31:19 UTC 2024","Wed Mar 27 06:37:22 UTC 2024","363257","","My Network: [FNN-1027] Invite freelancers","","My Network: [FNN-1027] Invite freelancers","should invite multiple freelancers","should invite multiple freelancers",""
"skipped","Wed Mar 27 07:21:50 UTC 2024","Wed Mar 27 07:23:31 UTC 2024","101004","","My Projects: [FNN-971] Complete project Positive","","My Projects: [FNN-971] Complete project Positive","should check review as freelancer user","should check review as freelancer user",""
"failed","Wed Mar 27 07:05:28 UTC 2024","Wed Mar 27 07:05:55 UTC 2024","27138","","Post Project: [FNN-587] Post project with account Positive","","Post Project: [FNN-587] Post project with account Positive","should verify that the project informations is correct","should verify that the project informations is correct",""
"broken","Wed Mar 27 07:09:17 UTC 2024","Wed Mar 27 07:10:07 UTC 2024","49413","","Post Project: [FNN-650] Post project without account Positive","","Post Project: [FNN-650] Post project without account Positive","should verify that the user received a project posted letter","should verify that the user received a project posted letter",""
"passed","Wed Mar 27 07:00:17 UTC 2024","Wed Mar 27 07:00:29 UTC 2024","12461","","CR: [FNN-744] CR Subscribe Negative","","CR: [FNN-744] CR Subscribe Negative","should subscribe as CR without password","should subscribe as CR without password",""
"passed","Wed Mar 27 07:05:34 UTC 2024","Wed Mar 27 07:05:40 UTC 2024","5510","","My Profile: [FNN-730] Request reference Negative","","My Profile: [FNN-730] Request reference Negative","should pass step 2 without picture","should pass step 2 without picture",""
"passed","Wed Mar 27 06:15:18 UTC 2024","Wed Mar 27 06:15:46 UTC 2024","28362","","Upgrade: [FNN-659] Upgrade account Negative","","Upgrade: [FNN-659] Upgrade account Negative","should upgrade account to Standard 1 month: Incorrect number decline","should upgrade account to Standard 1 month: Incorrect number decline",""
"passed","Wed Mar 27 06:28:26 UTC 2024","Wed Mar 27 06:29:27 UTC 2024","60930","","Settings: [FNN-678] Delete account without subscription","","Settings: [FNN-678] Delete account without subscription","should delete account without subscription","should delete account without subscription",""
"passed","Wed Mar 27 07:10:27 UTC 2024","Wed Mar 27 07:10:45 UTC 2024","18603","","Post Project: [FNN-588] Post project without account Negative","","Post Project: [FNN-588] Post project without account Negative","should post project without email","should post project without email",""
"failed","Wed Mar 27 07:01:05 UTC 2024","Wed Mar 27 07:03:20 UTC 2024","134949","","CR: [FNN-1779] My Dashboard page integrity as Employer","","CR: [FNN-1779] My Dashboard page integrity as Employer","should verify the integrity of the My Dashboard page as employer","should verify the integrity of the My Dashboard page as employer",""
"failed","Wed Mar 27 07:00:39 UTC 2024","Wed Mar 27 07:02:38 UTC 2024","119568","","CR: [FNN-1888] My Dashboard page integrity as Freelancer","","CR: [FNN-1888] My Dashboard page integrity as Freelancer","should verify the integrity of the My Dashboard page as freelancer","should verify the integrity of the My Dashboard page as freelancer",""
"passed","Wed Mar 27 07:15:44 UTC 2024","Wed Mar 27 07:15:49 UTC 2024","5001","","Search Project: [FNN-568] Project search","","Search Project: [FNN-568] Project search","should filter projects by Status Open projects","should filter projects by Status Open projects",""
"skipped","Wed Mar 27 07:29:32 UTC 2024","Wed Mar 27 07:29:32 UTC 2024","0","","My Transactions: [FNN-708] Hourly project: In advance. Positive","","My Transactions: [FNN-708] Hourly project: In advance. Positive","should close the period","should close the period",""
"passed","Wed Mar 27 07:11:26 UTC 2024","Wed Mar 27 07:11:46 UTC 2024","19687","","Post Project: [FNN-588] Post project without account Negative","","Post Project: [FNN-588] Post project without account Negative","should post project without phone number","should post project without phone number",""
"broken","Wed Mar 27 07:23:39 UTC 2024","Wed Mar 27 07:33:21 UTC 2024","582021","","My Transactions: [FNN-1439] Hourly project: Add time. Negative","","My Transactions: [FNN-1439] Hourly project: Add time. Negative","""before all"" hook for [FNN-1439] Hourly project: Add time. Negative","""before all"" hook for [FNN-1439] Hourly project: Add time. Negative",""
"passed","Wed Mar 27 07:12:28 UTC 2024","Wed Mar 27 07:12:48 UTC 2024","20523","","Post Project: [FNN-588] Post project without account Negative","","Post Project: [FNN-588] Post project without account Negative","should post project with wrong phone number","should post project with wrong phone number",""
"passed","Wed Mar 27 06:29:36 UTC 2024","Wed Mar 27 06:31:11 UTC 2024","94596","","Settings: [FNN-680] Deactivate profile","","Settings: [FNN-680] Deactivate profile","should deactivate profile","should deactivate profile",""
"skipped","Wed Mar 27 07:29:32 UTC 2024","Wed Mar 27 07:29:32 UTC 2024","1","","My Transactions: [FNN-708] Hourly project: In advance. Positive","","My Transactions: [FNN-708] Hourly project: In advance. Positive","should verify that the period is closed","should verify that the period is closed",""
"passed","Wed Mar 27 06:24:17 UTC 2024","Wed Mar 27 06:24:28 UTC 2024","10673","","Post Project: [FNN-649] Post project with account Negative","","Post Project: [FNN-649] Post project with account Negative","should post project without Category","should post project without Category",""
"passed","Wed Mar 27 06:59:24 UTC 2024","Wed Mar 27 06:59:39 UTC 2024","15025","","CR: [FNN-744] CR Subscribe Negative","","CR: [FNN-744] CR Subscribe Negative","should subscribe as CR with taken email","should subscribe as CR with taken email",""
"broken","Wed Mar 27 07:29:23 UTC 2024","Wed Mar 27 07:29:25 UTC 2024","2403","","My Transactions: [FNN-737] Hourly project: Start project. Negative","","My Transactions: [FNN-737] Hourly project: Start project. Negative","should start project with Hourly rate rate than 25","should start project with Hourly rate rate than 25",""
"passed","Wed Mar 27 07:04:23 UTC 2024","Wed Mar 27 07:07:06 UTC 2024","163024","","My Profile: [FNN-669] Edit account details Positive","","My Profile: [FNN-669] Edit account details Positive","should edit employer account details with valid information","should edit employer account details with valid information",""
"failed","Wed Mar 27 07:19:24 UTC 2024","Wed Mar 27 07:19:49 UTC 2024","25254","","Create Profile: [FNN-684] Create profile Negative","","Create Profile: [FNN-684] Create profile Negative","should create profile with wrong website","should create profile with wrong website",""
"passed","Wed Mar 27 06:09:27 UTC 2024","Wed Mar 27 06:09:39 UTC 2024","12025","","Subscribe: [FNN-577] Subscribe Negative","","Subscribe: [FNN-577] Subscribe Negative","should subscribe with wrong email format","should subscribe with wrong email format",""
"passed","Wed Mar 27 07:11:54 UTC 2024","Wed Mar 27 07:12:44 UTC 2024","49989","","My Network: [FNN-619] Invite manually via sms with signup bonus","","My Network: [FNN-619] Invite manually via sms with signup bonus","should invite manually via sms with valid recipient details","should invite manually via sms with valid recipient details",""
"passed","Wed Mar 27 06:10:58 UTC 2024","Wed Mar 27 06:11:13 UTC 2024","14807","","Subscribe: [FNN-577] Subscribe Negative","","Subscribe: [FNN-577] Subscribe Negative","should subscribe with short password","should subscribe with short password",""
"passed","Wed Mar 27 06:09:39 UTC 2024","Wed Mar 27 06:09:52 UTC 2024","13230","","Subscribe: [FNN-577] Subscribe Negative","","Subscribe: [FNN-577] Subscribe Negative","should subscribe with taken email","should subscribe with taken email",""
"passed","Wed Mar 27 07:03:27 UTC 2024","Wed Mar 27 07:05:10 UTC 2024","102792","","My Profile: [FNN-730] Request reference Negative","","My Profile: [FNN-730] Request reference Negative","should pass step 2 without data","should pass step 2 without data",""
"broken","Wed Mar 27 07:23:50 UTC 2024","Wed Mar 27 07:29:32 UTC 2024","342416","","My Transactions: [FNN-708] Hourly project: In advance. Positive","","My Transactions: [FNN-708] Hourly project: In advance. Positive","should start hourly project","should start hourly project",""
"passed","Wed Mar 27 06:40:12 UTC 2024","Wed Mar 27 06:42:44 UTC 2024","152346","","Freelancer search: [FNN-817] Add note","","Freelancer search: [FNN-817] Add note","should add a note via the note button","should add a note via the note button",""
"passed","Wed Mar 27 06:47:46 UTC 2024","Wed Mar 27 06:48:07 UTC 2024","21901","","Freelancer search: [FNN-924] Freelancer search as CR user","","Freelancer search: [FNN-924] Freelancer search as CR user","should filter freelancers by Hourly Rate","should filter freelancers by Hourly Rate",""
"failed","Wed Mar 27 07:09:03 UTC 2024","Wed Mar 27 07:10:03 UTC 2024","60118","","My Network: [FNN-1232] Invite manually via email with custom message with signup bonus","","My Network: [FNN-1232] Invite manually via email with custom message with signup bonus","should invite manually via email with valid recipient data and with message","should invite manually via email with valid recipient data and with message",""
