"Status","Start Time","Stop Time","Duration in ms","Parent Suite","Suite","Sub Suite","Test Class","Test Method","Name","Description"
"passed","Thu Jan 11 06:43:22 UTC 2024","Thu Jan 11 06:43:30 UTC 2024","7769","","CR: [FNN-744] CR Subscribe Negative","","CR: [FNN-744] CR Subscribe Negative","should subscribe as CR with wrong email format","should subscribe as CR with wrong email format",""
"passed","Thu Jan 11 06:28:27 UTC 2024","Thu Jan 11 06:29:35 UTC 2024","68885","","My Projects: [FNN-1093] Pause project","","My Projects: [FNN-1093] Pause project","should verify status of the project as unregistered user","should verify status of the project as unregistered user",""
"passed","Thu Jan 11 06:55:08 UTC 2024","Thu Jan 11 06:55:45 UTC 2024","36931","","Freelancer search: [FNN-815] Freelancer search as non-CR user","","Freelancer search: [FNN-815] Freelancer search as non-CR user","should filter freelancers by Skills","should filter freelancers by Skills",""
"passed","Thu Jan 11 06:47:51 UTC 2024","Thu Jan 11 06:47:52 UTC 2024","466","","My Profile: [FNN-730] Request reference Negative","","My Profile: [FNN-730] Request reference Negative","should pass step 2 without data","should pass step 2 without data",""
"passed","Thu Jan 11 06:46:50 UTC 2024","Thu Jan 11 06:47:21 UTC 2024","30774","","My Profile: [FNN-668] Edit account details Negative","","My Profile: [FNN-668] Edit account details Negative","should edit account details with invalid VAT number","should edit account details with invalid VAT number",""
"passed","Thu Jan 11 06:44:56 UTC 2024","Thu Jan 11 06:44:58 UTC 2024","1400","","CR: [FNN-751] Invite to the organization manually Negative","","CR: [FNN-751] Invite to the organization manually Negative","should invite manually to the organization without first step","should invite manually to the organization without first step",""
"broken","Thu Jan 11 06:46:25 UTC 2024","Thu Jan 11 06:48:18 UTC 2024","113021","","Post Project: [FNN-587] Post project with account Positive","","Post Project: [FNN-587] Post project with account Positive","should post a project as a registered user with valid project data","should post a project as a registered user with valid project data",""
"passed","Thu Jan 11 06:30:14 UTC 2024","Thu Jan 11 06:30:51 UTC 2024","36731","","Freelancer search: [FNN-816] Create list Functionality","","Freelancer search: [FNN-816] Create list Functionality","should remove created list","should remove created list",""
"failed","Thu Jan 11 06:54:56 UTC 2024","Thu Jan 11 06:55:51 UTC 2024","54926","","Create Profile: [FNN-684] Create profile Negative","","Create Profile: [FNN-684] Create profile Negative","should create profile with short Description of yourself","should create profile with short Description of yourself",""
"passed","Thu Jan 11 06:14:25 UTC 2024","Thu Jan 11 06:15:55 UTC 2024","90227","","My Profile: [FNN-669] Edit account details Positive","","My Profile: [FNN-669] Edit account details Positive","should edit cr account details with valid information","should edit cr account details with valid information",""
"passed","Thu Jan 11 06:09:33 UTC 2024","Thu Jan 11 06:09:41 UTC 2024","8044","","Subscribe: [FNN-577] Subscribe Negative","","Subscribe: [FNN-577] Subscribe Negative","should subscribe with invalid repeat password","should subscribe with invalid repeat password",""
"skipped","Thu Jan 11 06:52:20 UTC 2024","Thu Jan 11 06:52:53 UTC 2024","32733","","My Network: [FNN-619] Invite manually via sms with signup bonus","","My Network: [FNN-619] Invite manually via sms with signup bonus","should check My Dashboard and My Transactions page for the signup bonus as the inviter user","should check My Dashboard and My Transactions page for the signup bonus as the inviter user",""
"passed","Thu Jan 11 06:52:41 UTC 2024","Thu Jan 11 06:53:05 UTC 2024","24425","","My Network: [FNN-664] Invite freelancer","","My Network: [FNN-664] Invite freelancer","should check network as sender user","should check network as sender user",""
"passed","Thu Jan 11 06:42:57 UTC 2024","Thu Jan 11 06:43:05 UTC 2024","7281","","CR: [FNN-744] CR Subscribe Negative","","CR: [FNN-744] CR Subscribe Negative","should subscribe as CR without first name","should subscribe as CR without first name",""
"passed","Thu Jan 11 06:25:41 UTC 2024","Thu Jan 11 06:25:55 UTC 2024","13800","","Search Project: [FNN-568] Project search","","Search Project: [FNN-568] Project search","should filter projects by Hourly rate","should filter projects by Hourly rate",""
"passed","Thu Jan 11 06:57:34 UTC 2024","Thu Jan 11 06:58:11 UTC 2024","37931","","Freelancer search: [FNN-822] Send message","","Freelancer search: [FNN-822] Send message","should check the message as the freelancer user","should check the message as the freelancer user",""
"passed","Thu Jan 11 06:14:32 UTC 2024","Thu Jan 11 06:15:26 UTC 2024","53582","","My Profile: [FNN-718] Add portfolio Negative","","My Profile: [FNN-718] Add portfolio Negative","should add portfolio without data","should add portfolio without data",""
"broken","Thu Jan 11 06:56:02 UTC 2024","Thu Jan 11 06:57:04 UTC 2024","61923","","[FNN-813] Change language","","[FNN-813] Change language","should change language to Dutch from the footer","should change language to Dutch from the footer",""
"passed","Thu Jan 11 06:57:30 UTC 2024","Thu Jan 11 06:57:34 UTC 2024","3514","","Freelancer search: [FNN-822] Send message","","Freelancer search: [FNN-822] Send message","should check the message as the CR user","should check the message as the CR user",""
"passed","Thu Jan 11 06:07:59 UTC 2024","Thu Jan 11 06:08:06 UTC 2024","6910","","Subscribe: [FNN-577] Subscribe Negative","","Subscribe: [FNN-577] Subscribe Negative","should subscribe without last name","should subscribe without last name",""
"passed","Thu Jan 11 06:09:51 UTC 2024","Thu Jan 11 06:10:22 UTC 2024","31298","","Subscribe: [FNN-577] Subscribe Negative","","Subscribe: [FNN-577] Subscribe Negative","should subscribe without data","should subscribe without data",""
"passed","Thu Jan 11 06:12:30 UTC 2024","Thu Jan 11 06:12:41 UTC 2024","10562","","My Profile: [FNN-690] Add resume Positive","","My Profile: [FNN-690] Add resume Positive","should add Expertise","should add Expertise",""
"passed","Thu Jan 11 06:44:52 UTC 2024","Thu Jan 11 06:44:54 UTC 2024","2277","","CR: [FNN-751] Invite to the organization manually Negative","","CR: [FNN-751] Invite to the organization manually Negative","should invite manually to the organization without first name","should invite manually to the organization without first name",""
"passed","Thu Jan 11 06:12:09 UTC 2024","Thu Jan 11 06:14:25 UTC 2024","135664","","My Profile: [FNN-669] Edit account details Positive","","My Profile: [FNN-669] Edit account details Positive","should edit employer account details with valid information","should edit employer account details with valid information",""
"passed","Thu Jan 11 06:25:27 UTC 2024","Thu Jan 11 06:25:31 UTC 2024","4361","","My Network: [FNN-620] Invite manually via email and sms Negative","","My Network: [FNN-620] Invite manually via email and sms Negative","should invite manually via email with wrong email format","should invite manually via email with wrong email format",""
"failed","Thu Jan 11 06:50:28 UTC 2024","Thu Jan 11 06:51:05 UTC 2024","36766","","Post Project: [FNN-588] Post project without account Negative","","Post Project: [FNN-588] Post project without account Negative","should post project with taken email","should post project with taken email",""
"passed","Thu Jan 11 06:38:00 UTC 2024","Thu Jan 11 06:38:10 UTC 2024","9741","","[FNN-667] Send contact","","[FNN-667] Send contact","should forward the contact request","should forward the contact request",""
"passed","Thu Jan 11 06:54:48 UTC 2024","Thu Jan 11 06:55:08 UTC 2024","20009","","Freelancer search: [FNN-815] Freelancer search as non-CR user","","Freelancer search: [FNN-815] Freelancer search as non-CR user","should filter freelancers by Hourly Rate","should filter freelancers by Hourly Rate",""
"passed","Thu Jan 11 06:08:22 UTC 2024","Thu Jan 11 06:08:32 UTC 2024","10660","","Subscribe: [FNN-577] Subscribe Negative","","Subscribe: [FNN-577] Subscribe Negative","should subscribe with taken email","should subscribe with taken email",""
"passed","Thu Jan 11 06:11:35 UTC 2024","Thu Jan 11 06:14:18 UTC 2024","162306","","Upgrade: [FNN-658] Upgrade account Positive","","Upgrade: [FNN-658] Upgrade account Positive","should upgrade account to Business 1 month","should upgrade account to Business 1 month",""
"passed","Thu Jan 11 06:59:10 UTC 2024","Thu Jan 11 06:59:45 UTC 2024","34985","","[FNN-743] Archive and restore message","","[FNN-743] Archive and restore message","should restore the message","should restore the message",""
"passed","Thu Jan 11 06:10:20 UTC 2024","Thu Jan 11 06:12:09 UTC 2024","109184","","My Profile: [FNN-669] Edit account details Positive","","My Profile: [FNN-669] Edit account details Positive","should edit freelancer account details with valid information","should edit freelancer account details with valid information",""
"passed","Thu Jan 11 06:56:31 UTC 2024","Thu Jan 11 06:57:32 UTC 2024","61280","","Freelancer search: [FNN-846] Invite to project","","Freelancer search: [FNN-846] Invite to project","should verify if the ""Assign project"" button is enable","should verify if the ""Assign project"" button is enable",""
"failed","Thu Jan 11 06:44:08 UTC 2024","Thu Jan 11 06:45:51 UTC 2024","102857","","CR: [FNN-1888] My Dashboard page integrity as Freelancer","","CR: [FNN-1888] My Dashboard page integrity as Freelancer","should verify the integrity of the My Dashboard page as freelancer","should verify the integrity of the My Dashboard page as freelancer",""
"passed","Thu Jan 11 06:08:37 UTC 2024","Thu Jan 11 06:08:48 UTC 2024","11199","","Reset password: [FNN-655] Reset password Negative","","Reset password: [FNN-655] Reset password Negative","should reset password without data","should reset password without data",""
"passed","Thu Jan 11 06:07:16 UTC 2024","Thu Jan 11 06:07:18 UTC 2024","2554","","Login: [FNN-574] Log in from the Login page Negative","","Login: [FNN-574] Log in from the Login page Negative","should log in without password","should log in without password",""
"passed","Thu Jan 11 06:51:05 UTC 2024","Thu Jan 11 06:51:21 UTC 2024","16605","","Post Project: [FNN-588] Post project without account Negative","","Post Project: [FNN-588] Post project without account Negative","should post project without phone number","should post project without phone number",""
"skipped","Thu Jan 11 07:04:12 UTC 2024","Thu Jan 11 07:04:38 UTC 2024","25748","","CR: [FNN-750] Invite to the organization through search","","CR: [FNN-750] Invite to the organization through search","should check organization page as the inviting user","should check organization page as the inviting user",""
"passed","Thu Jan 11 06:09:36 UTC 2024","Thu Jan 11 06:09:58 UTC 2024","22193","","Upgrade: [FNN-659] Upgrade account Negative","","Upgrade: [FNN-659] Upgrade account Negative","should upgrade account to Standard 1 month: Generic decline","should upgrade account to Standard 1 month: Generic decline",""
"passed","Thu Jan 11 06:41:09 UTC 2024","Thu Jan 11 06:41:48 UTC 2024","38907","","CR: [FNN-742] CR subscribe Positive","","CR: [FNN-742] CR subscribe Positive","should subscribe as CR with valid credentials","should subscribe as CR with valid credentials",""
"passed","Thu Jan 11 06:30:07 UTC 2024","Thu Jan 11 06:30:14 UTC 2024","7153","","Freelancer search: [FNN-816] Create list Functionality","","Freelancer search: [FNN-816] Create list Functionality","should re-open original search","should re-open original search",""
"passed","Thu Jan 11 06:16:02 UTC 2024","Thu Jan 11 06:17:32 UTC 2024","90125","","My Profile: [FNN-795] Remove portfolio","","My Profile: [FNN-795] Remove portfolio","should remove portfolio","should remove portfolio",""
"broken","Thu Jan 11 07:02:13 UTC 2024","Thu Jan 11 07:02:16 UTC 2024","2418","","My Transactions: [FNN-738] Milestones project: Add milestone. Negative","","My Transactions: [FNN-738] Milestones project: Add milestone. Negative","should add milestone without Description","should add milestone without Description",""
"passed","Thu Jan 11 06:05:58 UTC 2024","Thu Jan 11 06:06:30 UTC 2024","32411","","Subscribe: [FNN-578] Subscribe Positive","","Subscribe: [FNN-578] Subscribe Positive","should subscribe with valid credentials","should subscribe with valid credentials",""
"passed","Thu Jan 11 06:25:39 UTC 2024","Thu Jan 11 06:25:42 UTC 2024","2776","","My Network: [FNN-620] Invite manually via email and sms Negative","","My Network: [FNN-620] Invite manually via email and sms Negative","should invite manually via email without data","should invite manually via email without data",""
"passed","Thu Jan 11 06:43:05 UTC 2024","Thu Jan 11 06:43:15 UTC 2024","10086","","CR: [FNN-744] CR Subscribe Negative","","CR: [FNN-744] CR Subscribe Negative","should subscribe as CR without last name","should subscribe as CR without last name",""
"passed","Thu Jan 11 06:19:31 UTC 2024","Thu Jan 11 06:19:48 UTC 2024","16963","","Post Project: [FNN-649] Post project with account Negative","","Post Project: [FNN-649] Post project with account Negative","should post project without Location","should post project without Location",""
"passed","Thu Jan 11 06:38:10 UTC 2024","Thu Jan 11 06:38:18 UTC 2024","7970","","[FNN-667] Send contact","","[FNN-667] Send contact","should check the contact as the first user","should check the contact as the first user",""
"passed","Thu Jan 11 06:14:18 UTC 2024","Thu Jan 11 06:16:21 UTC 2024","123221","","Upgrade: [FNN-658] Upgrade account Positive","","Upgrade: [FNN-658] Upgrade account Positive","should upgrade account to Enterprise 1 month","should upgrade account to Enterprise 1 month",""
"passed","Thu Jan 11 06:51:42 UTC 2024","Thu Jan 11 06:51:54 UTC 2024","12208","","Post Project: [FNN-588] Post project without account Negative","","Post Project: [FNN-588] Post project without account Negative","should post project with wrong phone number","should post project with wrong phone number",""
"passed","Thu Jan 11 06:23:00 UTC 2024","Thu Jan 11 06:24:59 UTC 2024","118865","","Search Project: [FNN-568] Project search","","Search Project: [FNN-568] Project search","should filter projects by Category","should filter projects by Category",""
"passed","Thu Jan 11 06:52:10 UTC 2024","Thu Jan 11 06:52:25 UTC 2024","15789","","Post Project: [FNN-588] Post project without account Negative","","Post Project: [FNN-588] Post project without account Negative","should post project without repeat password","should post project without repeat password",""
"passed","Thu Jan 11 06:43:47 UTC 2024","Thu Jan 11 06:43:54 UTC 2024","7185","","CR: [FNN-744] CR Subscribe Negative","","CR: [FNN-744] CR Subscribe Negative","should subscribe as CR with wrong phone number","should subscribe as CR with wrong phone number",""
"passed","Thu Jan 11 06:15:26 UTC 2024","Thu Jan 11 06:15:55 UTC 2024","28992","","My Profile: [FNN-718] Add portfolio Negative","","My Profile: [FNN-718] Add portfolio Negative","should add portfolio without Type","should add portfolio without Type",""
"failed","Thu Jan 11 06:59:52 UTC 2024","Thu Jan 11 07:03:43 UTC 2024","230266","","My Transactions: [FNN-710] Milestones project: In advance. Positive","","My Transactions: [FNN-710] Milestones project: In advance. Positive","should start project with milestone","should start project with milestone",""
"passed","Thu Jan 11 06:48:30 UTC 2024","Thu Jan 11 06:48:36 UTC 2024","5235","","My Profile: [FNN-719] Add resume Negative","","My Profile: [FNN-719] Add resume Negative","should add education without institute","should add education without institute",""
"failed","Thu Jan 11 06:57:39 UTC 2024","Thu Jan 11 07:01:07 UTC 2024","208304","","My Transactions: [FNN-1432] Milestones project: Start project. Negative","","My Transactions: [FNN-1432] Milestones project: Start project. Negative","should start project without milestone","should start project without milestone",""
"passed","Thu Jan 11 06:53:53 UTC 2024","Thu Jan 11 06:54:03 UTC 2024","9558","","Create Profile: [FNN-684] Create profile Negative","","Create Profile: [FNN-684] Create profile Negative","should create profile without City","should create profile without City",""
"passed","Thu Jan 11 06:08:13 UTC 2024","Thu Jan 11 06:08:22 UTC 2024","8781","","Subscribe: [FNN-577] Subscribe Negative","","Subscribe: [FNN-577] Subscribe Negative","should subscribe with wrong email format","should subscribe with wrong email format",""
"passed","Thu Jan 11 06:18:59 UTC 2024","Thu Jan 11 06:19:15 UTC 2024","15109","","Post Project: [FNN-649] Post project with account Negative","","Post Project: [FNN-649] Post project with account Negative","should post project without Budget","should post project without Budget",""
"passed","Thu Jan 11 06:26:25 UTC 2024","Thu Jan 11 06:26:38 UTC 2024","13245","","Search Project: [FNN-568] Project search","","Search Project: [FNN-568] Project search","should filter projects by Posted since Last 30 days","should filter projects by Posted since Last 30 days",""
"passed","Thu Jan 11 06:06:43 UTC 2024","Thu Jan 11 06:07:49 UTC 2024","65696","","Subscribe: [FNN-577] Subscribe Negative","","Subscribe: [FNN-577] Subscribe Negative","should subscribe without category","should subscribe without category",""
"failed","Thu Jan 11 06:50:25 UTC 2024","Thu Jan 11 06:51:08 UTC 2024","43688","","My Network: [FNN-1232] Invite manually via email with custom message with signup bonus","","My Network: [FNN-1232] Invite manually via email with custom message with signup bonus","should invite manually via email with valid recipient data and with message","should invite manually via email with valid recipient data and with message",""
"passed","Thu Jan 11 06:31:46 UTC 2024","Thu Jan 11 06:31:55 UTC 2024","8464","","My Projects: [FNN-1058] Complete project Negative","","My Projects: [FNN-1058] Complete project Negative","should complete project without Deadline","should complete project without Deadline",""
"passed","Thu Jan 11 06:21:42 UTC 2024","Thu Jan 11 06:22:54 UTC 2024","71859","","Settings: [FNN-680] Deactivate profile","","Settings: [FNN-680] Deactivate profile","should deactivate profile","should deactivate profile",""
"failed","Thu Jan 11 06:50:53 UTC 2024","Thu Jan 11 06:51:37 UTC 2024","43411","","My Network: [FNN-619] Invite manually via sms with signup bonus","","My Network: [FNN-619] Invite manually via sms with signup bonus","should invite manually via sms with valid recipient details","should invite manually via sms with valid recipient details",""
"broken","Thu Jan 11 07:02:11 UTC 2024","Thu Jan 11 07:02:13 UTC 2024","2146","","My Transactions: [FNN-738] Milestones project: Add milestone. Negative","","My Transactions: [FNN-738] Milestones project: Add milestone. Negative","should add milestone without Delivery date","should add milestone without Delivery date",""
"passed","Thu Jan 11 06:46:15 UTC 2024","Thu Jan 11 06:46:20 UTC 2024","4106","","My Profile: [FNN-668] Edit account details Negative","","My Profile: [FNN-668] Edit account details Negative","should edit account details without sector","should edit account details without sector",""
"passed","Thu Jan 11 06:25:42 UTC 2024","Thu Jan 11 06:25:46 UTC 2024","3414","","My Network: [FNN-620] Invite manually via email and sms Negative","","My Network: [FNN-620] Invite manually via email and sms Negative","should invite manually via sms without phone number","should invite manually via sms without phone number",""
"passed","Thu Jan 11 06:53:02 UTC 2024","Thu Jan 11 06:56:14 UTC 2024","191590","","Freelancer search: [FNN-846] Invite to project","","Freelancer search: [FNN-846] Invite to project","should invite to a project via the ""Invite to project"" action","should invite to a project via the ""Invite to project"" action",""
"passed","Thu Jan 11 06:44:13 UTC 2024","Thu Jan 11 06:44:21 UTC 2024","7987","","CR: [FNN-744] CR Subscribe Negative","","CR: [FNN-744] CR Subscribe Negative","should subscribe as CR without repeat password","should subscribe as CR without repeat password",""
"failed","Thu Jan 11 06:48:07 UTC 2024","Thu Jan 11 06:48:30 UTC 2024","23736","","My Profile: [FNN-719] Add resume Negative","","My Profile: [FNN-719] Add resume Negative","should add education without data","should add education without data",""
"passed","Thu Jan 11 06:32:01 UTC 2024","Thu Jan 11 06:32:07 UTC 2024","6713","","My Projects: [FNN-1058] Complete project Negative","","My Projects: [FNN-1058] Complete project Negative","should complete project without Comments","should complete project without Comments",""
"passed","Thu Jan 11 06:47:38 UTC 2024","Thu Jan 11 06:47:41 UTC 2024","2523","","My Profile: [FNN-719] Add resume Negative","","My Profile: [FNN-719] Add resume Negative","should add experience without data","should add experience without data",""
"passed","Thu Jan 11 06:07:03 UTC 2024","Thu Jan 11 06:07:05 UTC 2024","2463","","Login: [FNN-563] Log in from the header Negative","","Login: [FNN-563] Log in from the header Negative","should log in with invalid credentials","should log in with invalid credentials",""
"passed","Thu Jan 11 06:20:05 UTC 2024","Thu Jan 11 06:20:22 UTC 2024","17155","","Post Project: [FNN-649] Post project with account Negative","","Post Project: [FNN-649] Post project with account Negative","should post project without End date","should post project without End date",""
"skipped","Thu Jan 11 06:52:21 UTC 2024","Thu Jan 11 06:52:53 UTC 2024","32077","","My Network: [FNN-1233] Invite manually via email without custom message with signup bonus","","My Network: [FNN-1233] Invite manually via email without custom message with signup bonus","should check My Dashboard and My Transactions page for the signup bonus as the inviter user","should check My Dashboard and My Transactions page for the signup bonus as the inviter user",""
"passed","Thu Jan 11 06:50:24 UTC 2024","Thu Jan 11 06:50:44 UTC 2024","19617","","My Network: [FNN-1027] Invite freelancers","","My Network: [FNN-1027] Invite freelancers","should check network as sender user","should check network as sender user",""
"passed","Thu Jan 11 06:20:12 UTC 2024","Thu Jan 11 06:22:03 UTC 2024","111257","","Settings: [FNN-676] Change profile settings","","Settings: [FNN-676] Change profile settings","it's not possible to contact me through the contact button on my profile","it's not possible to contact me through the contact button on my profile",""
"passed","Thu Jan 11 06:20:44 UTC 2024","Thu Jan 11 06:21:24 UTC 2024","39619","","Post Project: [FNN-649] Post project with account Negative","","Post Project: [FNN-649] Post project with account Negative","should post project with short Description","should post project with short Description",""
"passed","Thu Jan 11 06:08:48 UTC 2024","Thu Jan 11 06:08:53 UTC 2024","4180","","Reset password: [FNN-655] Reset password Negative","","Reset password: [FNN-655] Reset password Negative","should reset password with wrong email","should reset password with wrong email",""
"passed","Thu Jan 11 06:25:31 UTC 2024","Thu Jan 11 06:25:36 UTC 2024","4153","","My Network: [FNN-620] Invite manually via email and sms Negative","","My Network: [FNN-620] Invite manually via email and sms Negative","should invite manually via email without first name","should invite manually via email without first name",""
"passed","Thu Jan 11 06:07:49 UTC 2024","Thu Jan 11 06:07:59 UTC 2024","9493","","Subscribe: [FNN-577] Subscribe Negative","","Subscribe: [FNN-577] Subscribe Negative","should subscribe without first name","should subscribe without first name",""
"passed","Thu Jan 11 06:32:45 UTC 2024","Thu Jan 11 06:33:52 UTC 2024","67147","","Create Profile: [FNN-683] Create profile Positive","","Create Profile: [FNN-683] Create profile Positive","should create profile with valid data","should create profile with valid data",""
"passed","Thu Jan 11 06:20:17 UTC 2024","Thu Jan 11 06:21:34 UTC 2024","76871","","Settings: [FNN-677] Downgrade to ""Stand-by Standaard""","","Settings: [FNN-677] Downgrade to ""Stand-by Standaard""","should downgrade to ""Stand-by Standaard""","should downgrade to ""Stand-by Standaard""",""
"broken","Thu Jan 11 07:01:16 UTC 2024","Thu Jan 11 07:02:59 UTC 2024","102930","","CR: [FNN-749] Invite to the organization manually Positive","","CR: [FNN-749] Invite to the organization manually Positive","should invite manually to the organization with valid recipient details","should invite manually to the organization with valid recipient details",""
"passed","Thu Jan 11 06:25:36 UTC 2024","Thu Jan 11 06:25:39 UTC 2024","3703","","My Network: [FNN-620] Invite manually via email and sms Negative","","My Network: [FNN-620] Invite manually via email and sms Negative","should invite manually via email without last name","should invite manually via email without last name",""
"passed","Thu Jan 11 06:35:37 UTC 2024","Thu Jan 11 06:38:00 UTC 2024","143323","","[FNN-667] Send contact","","[FNN-667] Send contact","should send a contact","should send a contact",""
"passed","Thu Jan 11 06:47:52 UTC 2024","Thu Jan 11 06:48:16 UTC 2024","24519","","My Profile: [FNN-730] Request reference Negative","","My Profile: [FNN-730] Request reference Negative","should pass step 3 with comments less then 200 chars","should pass step 3 with comments less then 200 chars",""
"passed","Thu Jan 11 06:26:06 UTC 2024","Thu Jan 11 06:26:15 UTC 2024","8687","","Search Project: [FNN-568] Project search","","Search Project: [FNN-568] Project search","should filter projects by Posted since Last 3 days","should filter projects by Posted since Last 3 days",""
