"Status","Start Time","Stop Time","Duration in ms","Parent Suite","Suite","Sub Suite","Test Class","Test Method","Name","Description"
"passed","Wed Mar 27 06:26:45 UTC 2024","Wed Mar 27 06:28:16 UTC 2024","91478","","Settings: [FNN-674] Change password Positive","","Settings: [FNN-674] Change password Positive","should change password with valid credentials","should change password with valid credentials",""
"passed","Wed Mar 27 06:40:09 UTC 2024","Wed Mar 27 06:42:28 UTC 2024","138589","","Freelancer search: [FNN-816] Create list Functionality","","Freelancer search: [FNN-816] Create list Functionality","should create a list of freelancers","should create a list of freelancers",""
"passed","Wed Mar 27 06:35:37 UTC 2024","Wed Mar 27 06:35:42 UTC 2024","4994","","My Network: [FNN-620] Invite manually via email and sms Negative","","My Network: [FNN-620] Invite manually via email and sms Negative","should invite manually via sms without phone number","should invite manually via sms without phone number",""
"passed","Wed Mar 27 07:16:07 UTC 2024","Wed Mar 27 07:16:18 UTC 2024","11198","","Search Project: [FNN-568] Project search","","Search Project: [FNN-568] Project search","should filter projects by Posted since Last 30 days","should filter projects by Posted since Last 30 days",""
"passed","Wed Mar 27 06:14:19 UTC 2024","Wed Mar 27 06:14:47 UTC 2024","27804","","Upgrade: [FNN-659] Upgrade account Negative","","Upgrade: [FNN-659] Upgrade account Negative","should upgrade account to Standard 1 month: Incorrect CVC decline","should upgrade account to Standard 1 month: Incorrect CVC decline",""
"passed","Wed Mar 27 06:06:15 UTC 2024","Wed Mar 27 06:06:38 UTC 2024","23295","","Subscribe","","Subscribe","[FNN-578] Subscribe Positive","[FNN-578] Subscribe Positive",""
"passed","Wed Mar 27 06:44:14 UTC 2024","Wed Mar 27 06:47:43 UTC 2024","208873","","[FNN-661] Send interest","","[FNN-661] Send interest","should send interest in the employer's project","should send interest in the employer's project",""
"skipped","Wed Mar 27 06:45:22 UTC 2024","Wed Mar 27 06:47:50 UTC 2024","148241","","[FNN-667] Send contact","","[FNN-667] Send contact","should send a contact","should send a contact",""
"passed","Wed Mar 27 06:13:46 UTC 2024","Wed Mar 27 06:14:19 UTC 2024","32996","","Upgrade: [FNN-659] Upgrade account Negative","","Upgrade: [FNN-659] Upgrade account Negative","should upgrade account to Standard 1 month: Expired card decline","should upgrade account to Standard 1 month: Expired card decline",""
"passed","Wed Mar 27 07:06:48 UTC 2024","Wed Mar 27 07:06:53 UTC 2024","5400","","My Profile: [FNN-719] Add resume Negative","","My Profile: [FNN-719] Add resume Negative","should add language without levels","should add language without levels",""
"failed","Wed Mar 27 07:09:19 UTC 2024","Wed Mar 27 07:12:16 UTC 2024","176839","","Upgrade: [FNN-658] Upgrade account Positive","","Upgrade: [FNN-658] Upgrade account Positive","should upgrade account to Enterprise 1 month","should upgrade account to Enterprise 1 month",""
"passed","Wed Mar 27 07:06:33 UTC 2024","Wed Mar 27 07:06:40 UTC 2024","6882","","My Profile: [FNN-719] Add resume Negative","","My Profile: [FNN-719] Add resume Negative","should add certificate without organization","should add certificate without organization",""
"passed","Wed Mar 27 07:00:02 UTC 2024","Wed Mar 27 07:00:17 UTC 2024","15106","","CR: [FNN-744] CR Subscribe Negative","","CR: [FNN-744] CR Subscribe Negative","should subscribe as CR with taken phone number","should subscribe as CR with taken phone number",""
"passed","Wed Mar 27 06:09:21 UTC 2024","Wed Mar 27 06:10:23 UTC 2024","62163","","Login: [FNN-648] Log in from the Login page Positive","","Login: [FNN-648] Log in from the Login page Positive","should log in with valid credentials","should log in with valid credentials",""
"passed","Wed Mar 27 06:58:25 UTC 2024","Wed Mar 27 06:58:36 UTC 2024","10697","","CR: [FNN-744] CR Subscribe Negative","","CR: [FNN-744] CR Subscribe Negative","should subscribe as CR without company name","should subscribe as CR without company name",""
"failed","Wed Mar 27 07:11:46 UTC 2024","Wed Mar 27 07:12:28 UTC 2024","41899","","Post Project: [FNN-588] Post project without account Negative","","Post Project: [FNN-588] Post project without account Negative","should post project with taken phone number","should post project with taken phone number",""
"passed","Wed Mar 27 06:08:41 UTC 2024","Wed Mar 27 06:08:45 UTC 2024","3411","","Login: [FNN-563] Log in from the header Negative","","Login: [FNN-563] Log in from the header Negative","should log in without email","should log in without email",""
"broken","Wed Mar 27 07:29:11 UTC 2024","Wed Mar 27 07:29:18 UTC 2024","7031","","CR: [FNN-749] Invite to the organization manually Positive","","CR: [FNN-749] Invite to the organization manually Positive","should accept invitation","should accept invitation",""
"passed","Wed Mar 27 06:51:22 UTC 2024","Wed Mar 27 06:52:42 UTC 2024","79779","","Freelancer search: [FNN-924] Freelancer search as CR user","","Freelancer search: [FNN-924] Freelancer search as CR user","should filter freelancers by Minimum rating","should filter freelancers by Minimum rating",""
"passed","Wed Mar 27 07:00:29 UTC 2024","Wed Mar 27 07:00:43 UTC 2024","13079","","CR: [FNN-744] CR Subscribe Negative","","CR: [FNN-744] CR Subscribe Negative","should subscribe as CR without repeat password","should subscribe as CR without repeat password",""
"passed","Wed Mar 27 07:13:29 UTC 2024","Wed Mar 27 07:13:50 UTC 2024","20863","","Post Project: [FNN-588] Post project without account Negative","","Post Project: [FNN-588] Post project without account Negative","should post project with short password and repeat password","should post project with short password and repeat password",""
"passed","Wed Mar 27 07:07:00 UTC 2024","Wed Mar 27 07:07:07 UTC 2024","7490","","My Profile: [FNN-719] Add resume Negative","","My Profile: [FNN-719] Add resume Negative","should add language without writing level","should add language without writing level",""
"passed","Wed Mar 27 07:00:43 UTC 2024","Wed Mar 27 07:00:57 UTC 2024","14271","","CR: [FNN-744] CR Subscribe Negative","","CR: [FNN-744] CR Subscribe Negative","should subscribe as CR with short password","should subscribe as CR with short password",""
"passed","Wed Mar 27 06:08:48 UTC 2024","Wed Mar 27 06:09:17 UTC 2024","29116","","Login: [FNN-563] Log in from the header Negative","","Login: [FNN-563] Log in from the header Negative","should log in without credentials","should log in without credentials",""
"passed","Wed Mar 27 07:09:47 UTC 2024","Wed Mar 27 07:10:06 UTC 2024","19629","","Post Project: [FNN-588] Post project without account Negative","","Post Project: [FNN-588] Post project without account Negative","should post project without first name","should post project without first name",""
"failed","Wed Mar 27 07:18:28 UTC 2024","Wed Mar 27 07:23:27 UTC 2024","298489","","Freelancer search: [FNN-846] Invite to project","","Freelancer search: [FNN-846] Invite to project","should invite to a project via the ""Invite to project"" action","should invite to a project via the ""Invite to project"" action",""
"passed","Wed Mar 27 07:14:43 UTC 2024","Wed Mar 27 07:19:02 UTC 2024","258882","","My Network: [FNN-664] Invite freelancer","","My Network: [FNN-664] Invite freelancer","should invite freelancer","should invite freelancer",""
"passed","Wed Mar 27 07:06:26 UTC 2024","Wed Mar 27 07:06:33 UTC 2024","6622","","My Profile: [FNN-719] Add resume Negative","","My Profile: [FNN-719] Add resume Negative","should add certificate without certificate","should add certificate without certificate",""
"passed","Wed Mar 27 07:06:57 UTC 2024","Wed Mar 27 07:07:09 UTC 2024","11550","","My Profile: [FNN-730] Request reference Negative","","My Profile: [FNN-730] Request reference Negative","should pass step 3 without 3 rating","should pass step 3 without 3 rating",""
"passed","Wed Mar 27 06:11:39 UTC 2024","Wed Mar 27 06:12:13 UTC 2024","34135","","Subscribe: [FNN-577] Subscribe Negative","","Subscribe: [FNN-577] Subscribe Negative","should subscribe without data","should subscribe without data",""
"passed","Wed Mar 27 07:19:11 UTC 2024","Wed Mar 27 07:19:24 UTC 2024","12939","","Create Profile: [FNN-684] Create profile Negative","","Create Profile: [FNN-684] Create profile Negative","should create profile without City","should create profile without City",""
"passed","Wed Mar 27 06:59:13 UTC 2024","Wed Mar 27 06:59:24 UTC 2024","11585","","CR: [FNN-744] CR Subscribe Negative","","CR: [FNN-744] CR Subscribe Negative","should subscribe as CR with wrong email format","should subscribe as CR with wrong email format",""
"passed","Wed Mar 27 07:00:20 UTC 2024","Wed Mar 27 07:00:22 UTC 2024","1521","","CR: [FNN-751] Invite to the organization manually Negative","","CR: [FNN-751] Invite to the organization manually Negative","should invite manually to the organization without first step","should invite manually to the organization without first step",""
"passed","Wed Mar 27 07:06:53 UTC 2024","Wed Mar 27 07:07:00 UTC 2024","6765","","My Profile: [FNN-719] Add resume Negative","","My Profile: [FNN-719] Add resume Negative","should add language without speaking level","should add language without speaking level",""
"passed","Wed Mar 27 07:07:19 UTC 2024","Wed Mar 27 07:07:27 UTC 2024","8232","","My Profile: [FNN-730] Request reference Negative","","My Profile: [FNN-730] Request reference Negative","should pass step 3 without comments","should pass step 3 without comments",""
"passed","Wed Mar 27 06:28:21 UTC 2024","Wed Mar 27 06:29:56 UTC 2024","94921","","Settings: [FNN-677] Downgrade to ""Stand-by Standaard""","","Settings: [FNN-677] Downgrade to ""Stand-by Standaard""","should downgrade to ""Stand-by Standaard""","should downgrade to ""Stand-by Standaard""",""
"broken","Wed Mar 27 07:17:09 UTC 2024","Wed Mar 27 07:21:50 UTC 2024","281723","","My Projects: [FNN-971] Complete project Positive","","My Projects: [FNN-971] Complete project Positive","should complete project","should complete project",""
"passed","Wed Mar 27 07:02:02 UTC 2024","Wed Mar 27 07:04:23 UTC 2024","141119","","My Profile: [FNN-669] Edit account details Positive","","My Profile: [FNN-669] Edit account details Positive","should edit freelancer account details with valid information","should edit freelancer account details with valid information",""
"broken","Wed Mar 27 07:29:25 UTC 2024","Wed Mar 27 07:29:27 UTC 2024","2040","","My Transactions: [FNN-737] Hourly project: Start project. Negative","","My Transactions: [FNN-737] Hourly project: Start project. Negative","should start project without Way of paying","should start project without Way of paying",""
"passed","Wed Mar 27 06:14:21 UTC 2024","Wed Mar 27 06:14:33 UTC 2024","11944","","My Profile: [FNN-690] Add resume Positive","","My Profile: [FNN-690] Add resume Positive","should add Certificate","should add Certificate",""
"passed","Wed Mar 27 06:36:24 UTC 2024","Wed Mar 27 06:38:40 UTC 2024","136199","","My Projects: [FNN-1093] Pause project","","My Projects: [FNN-1093] Pause project","should pause the project","should pause the project",""
"skipped","Wed Mar 27 06:37:22 UTC 2024","Wed Mar 27 06:37:22 UTC 2024","0","","My Network: [FNN-1027] Invite freelancers","","My Network: [FNN-1027] Invite freelancers","should accept an invitation","should accept an invitation",""
"passed","Wed Mar 27 06:14:07 UTC 2024","Wed Mar 27 06:14:21 UTC 2024","13640","","My Profile: [FNN-690] Add resume Positive","","My Profile: [FNN-690] Add resume Positive","should add Education","should add Education",""
"passed","Wed Mar 27 06:16:54 UTC 2024","Wed Mar 27 06:18:47 UTC 2024","113180","","My Profile: [FNN-713] Confirm phone number Negative","","My Profile: [FNN-713] Confirm phone number Negative","should confirm phone number with invalid code","should confirm phone number with invalid code",""
"passed","Wed Mar 27 06:07:36 UTC 2024","Wed Mar 27 06:09:00 UTC 2024","83085","","Subscribe: [FNN-2167] 500  signup bonus","","Subscribe: [FNN-2167] 500  signup bonus","should verify 500 signup bonus","should verify 500 signup bonus",""
"passed","Wed Mar 27 06:09:45 UTC 2024","Wed Mar 27 06:09:49 UTC 2024","3960","","Login: [FNN-574] Log in from the Login page Negative","","Login: [FNN-574] Log in from the Login page Negative","should log in without password","should log in without password",""
"passed","Wed Mar 27 06:23:56 UTC 2024","Wed Mar 27 06:24:06 UTC 2024","9986","","Post Project: [FNN-649] Post project with account Negative","","Post Project: [FNN-649] Post project with account Negative","should post project without Title","should post project without Title",""
"passed","Wed Mar 27 07:06:46 UTC 2024","Wed Mar 27 07:06:57 UTC 2024","11376","","My Profile: [FNN-730] Request reference Negative","","My Profile: [FNN-730] Request reference Negative","should pass step 3 without 2 rating","should pass step 3 without 2 rating",""
"broken","Wed Mar 27 07:29:18 UTC 2024","Wed Mar 27 07:29:20 UTC 2024","1984","","My Transactions: [FNN-737] Hourly project: Start project. Negative","","My Transactions: [FNN-737] Hourly project: Start project. Negative","should start project without Hours per period","should start project without Hours per period",""
"passed","Wed Mar 27 07:01:22 UTC 2024","Wed Mar 27 07:01:24 UTC 2024","2412","","CR: [FNN-744] CR Subscribe Negative","","CR: [FNN-744] CR Subscribe Negative","should subscribe as CR without data","should subscribe as CR without data",""
"passed","Wed Mar 27 07:15:23 UTC 2024","Wed Mar 27 07:15:39 UTC 2024","15800","","Search Project: [FNN-568] Project search","","Search Project: [FNN-568] Project search","should filter projects by Hourly rate","should filter projects by Hourly rate",""
"passed","Wed Mar 27 06:11:27 UTC 2024","Wed Mar 27 06:11:39 UTC 2024","11710","","Subscribe: [FNN-577] Subscribe Negative","","Subscribe: [FNN-577] Subscribe Negative","should subscribe without agreeing to the Terms and Conditions","should subscribe without agreeing to the Terms and Conditions",""
"passed","Wed Mar 27 06:50:47 UTC 2024","Wed Mar 27 06:51:22 UTC 2024","35575","","Freelancer search: [FNN-924] Freelancer search as CR user","","Freelancer search: [FNN-924] Freelancer search as CR user","should filter freelancers by Minimum references","should filter freelancers by Minimum references",""
"passed","Wed Mar 27 06:27:30 UTC 2024","Wed Mar 27 06:30:04 UTC 2024","154284","","Settings: [FNN-676] Change profile settings","","Settings: [FNN-676] Change profile settings","it's not possible to contact me through the contact button on my profile","it's not possible to contact me through the contact button on my profile",""
"passed","Wed Mar 27 07:07:00 UTC 2024","Wed Mar 27 07:08:44 UTC 2024","104317","","My Profile: [FNN-699] Request reference Positive","","My Profile: [FNN-699] Request reference Positive","should add experience and request reference","should add experience and request reference",""
"passed","Wed Mar 27 06:13:19 UTC 2024","Wed Mar 27 06:13:46 UTC 2024","27091","","Upgrade: [FNN-659] Upgrade account Negative","","Upgrade: [FNN-659] Upgrade account Negative","should upgrade account to Standard 1 month: Stolen card decline","should upgrade account to Standard 1 month: Stolen card decline",""
"failed","Wed Mar 27 07:05:29 UTC 2024","Wed Mar 27 07:05:56 UTC 2024","27011","","My Profile: [FNN-719] Add resume Negative","","My Profile: [FNN-719] Add resume Negative","should add education without period from","should add education without period from",""
"passed","Wed Mar 27 06:47:35 UTC 2024","Wed Mar 27 06:48:15 UTC 2024","39553","","[FNN-717] Edit email settings","","[FNN-717] Edit email settings","should edit Notification settings and verify that the settings are saved","should edit Notification settings and verify that the settings are saved",""
"passed","Wed Mar 27 07:00:11 UTC 2024","Wed Mar 27 07:00:16 UTC 2024","4301","","CR: [FNN-751] Invite to the organization manually Negative","","CR: [FNN-751] Invite to the organization manually Negative","should invite manually to the organization without first name","should invite manually to the organization without first name",""
"broken","Wed Mar 27 07:24:29 UTC 2024","Wed Mar 27 07:29:18 UTC 2024","289905","","My Transactions: [FNN-737] Hourly project: Start project. Negative","","My Transactions: [FNN-737] Hourly project: Start project. Negative","should start project without Hours per period and Hourly rate","should start project without Hours per period and Hourly rate",""
"skipped","Wed Mar 27 07:09:10 UTC 2024","Wed Mar 27 07:09:10 UTC 2024","0","","Post Project: [FNN-650] Post project without account Positive","","Post Project: [FNN-650] Post project without account Positive","should verify that the user received a welcome letter","should verify that the user received a welcome letter",""
"passed","Wed Mar 27 06:46:22 UTC 2024","Wed Mar 27 06:47:35 UTC 2024","72893","","[FNN-717] Edit email settings","","[FNN-717] Edit email settings","should edit Email settings and verify that the settings are saved","should edit Email settings and verify that the settings are saved",""
"failed","Wed Mar 27 07:04:54 UTC 2024","Wed Mar 27 07:05:18 UTC 2024","24779","","My Profile: [FNN-719] Add resume Negative","","My Profile: [FNN-719] Add resume Negative","should add education without data","should add education without data",""
"passed","Wed Mar 27 06:09:03 UTC 2024","Wed Mar 27 06:09:32 UTC 2024","29188","","Login: [FNN-574] Log in from the Login page Negative","","Login: [FNN-574] Log in from the Login page Negative","should log in with valid email and invalid password","should log in with valid email and invalid password",""
"passed","Wed Mar 27 07:11:01 UTC 2024","Wed Mar 27 07:11:47 UTC 2024","46118","","My Network: [FNN-1232] Invite manually via email with custom message with signup bonus","","My Network: [FNN-1232] Invite manually via email with custom message with signup bonus","should check My Dashboard and My Transactions page for the signup bonus as the inviter user","should check My Dashboard and My Transactions page for the signup bonus as the inviter user",""
"broken","Wed Mar 27 07:31:26 UTC 2024","Wed Mar 27 07:31:37 UTC 2024","11022","","CR: [FNN-750] Invite to the organization through search","","CR: [FNN-750] Invite to the organization through search","should accept invitation","should accept invitation",""
"failed","Wed Mar 27 07:08:43 UTC 2024","Wed Mar 27 07:09:10 UTC 2024","27230","","Post Project: [FNN-650] Post project without account Positive","","Post Project: [FNN-650] Post project without account Positive","should verify that the project informations is correct","should verify that the project informations is correct",""
"passed","Wed Mar 27 06:24:28 UTC 2024","Wed Mar 27 06:24:39 UTC 2024","11102","","Post Project: [FNN-649] Post project with account Negative","","Post Project: [FNN-649] Post project with account Negative","should post project without step 2","should post project without step 2",""
"passed","Wed Mar 27 06:09:50 UTC 2024","Wed Mar 27 06:11:09 UTC 2024","79161","","Login: [FNN-685] Log out","","Login: [FNN-685] Log out","should log out","should log out",""
"passed","Wed Mar 27 06:12:51 UTC 2024","Wed Mar 27 06:13:19 UTC 2024","27431","","Upgrade: [FNN-659] Upgrade account Negative","","Upgrade: [FNN-659] Upgrade account Negative","should upgrade account to Standard 1 month: Lost card decline","should upgrade account to Standard 1 month: Lost card decline",""
"passed","Wed Mar 27 06:10:18 UTC 2024","Wed Mar 27 06:10:32 UTC 2024","14553","","Subscribe: [FNN-577] Subscribe Negative","","Subscribe: [FNN-577] Subscribe Negative","should subscribe with taken phone number","should subscribe with taken phone number",""
"passed","Wed Mar 27 07:13:09 UTC 2024","Wed Mar 27 07:13:29 UTC 2024","20021","","Post Project: [FNN-588] Post project without account Negative","","Post Project: [FNN-588] Post project without account Negative","should post project without repeat password","should post project without repeat password",""
"passed","Wed Mar 27 06:58:57 UTC 2024","Wed Mar 27 07:00:06 UTC 2024","68798","","CR: [FNN-751] Invite to the organization manually Negative","","CR: [FNN-751] Invite to the organization manually Negative","should invite manually to the organization without email","should invite manually to the organization without email",""
"passed","Wed Mar 27 06:56:18 UTC 2024","Wed Mar 27 06:57:14 UTC 2024","55390","","CR: [FNN-742] CR subscribe Positive","","CR: [FNN-742] CR subscribe Positive","should subscribe as CR with valid credentials","should subscribe as CR with valid credentials",""
"passed","Wed Mar 27 07:04:05 UTC 2024","Wed Mar 27 07:04:09 UTC 2024","3970","","My Profile: [FNN-719] Add resume Negative","","My Profile: [FNN-719] Add resume Negative","should add experience without data","should add experience without data",""
"passed","Wed Mar 27 07:07:51 UTC 2024","Wed Mar 27 07:08:43 UTC 2024","52085","","Post Project: [FNN-650] Post project without account Positive","","Post Project: [FNN-650] Post project without account Positive","should post a project as an unregistered user with valid project data","should post a project as an unregistered user with valid project data",""
"passed","Wed Mar 27 06:47:43 UTC 2024","Wed Mar 27 06:48:20 UTC 2024","37293","","[FNN-661] Send interest","","[FNN-661] Send interest","should assign the freelancer user","should assign the freelancer user",""
"skipped","Wed Mar 27 06:37:22 UTC 2024","Wed Mar 27 06:38:17 UTC 2024","54820","","My Network: [FNN-1027] Invite freelancers","","My Network: [FNN-1027] Invite freelancers","should check network as sender user","should check network as sender user",""
"passed","Wed Mar 27 06:24:57 UTC 2024","Wed Mar 27 06:26:13 UTC 2024","76512","","Settings: [FNN-671] Change email address Positive","","Settings: [FNN-671] Change email address Positive","should change email address with valid credentials","should change email address with valid credentials",""
"passed","Wed Mar 27 06:09:37 UTC 2024","Wed Mar 27 06:09:42 UTC 2024","4890","","Login: [FNN-574] Log in from the Login page Negative","","Login: [FNN-574] Log in from the Login page Negative","should log in with wrong email format","should log in with wrong email format",""
"passed","Wed Mar 27 06:42:58 UTC 2024","Wed Mar 27 06:43:54 UTC 2024","56373","","Freelancer search: [FNN-822] Send message","","Freelancer search: [FNN-822] Send message","should check the message as the freelancer user","should check the message as the freelancer user",""
"passed","Wed Mar 27 06:14:33 UTC 2024","Wed Mar 27 06:14:40 UTC 2024","7751","","My Profile: [FNN-690] Add resume Positive","","My Profile: [FNN-690] Add resume Positive","should add Motivation","should add Motivation",""
"passed","Wed Mar 27 06:11:50 UTC 2024","Wed Mar 27 06:12:18 UTC 2024","28764","","Upgrade: [FNN-659] Upgrade account Negative","","Upgrade: [FNN-659] Upgrade account Negative","should upgrade account to Standard 1 month: Generic decline","should upgrade account to Standard 1 month: Generic decline",""
"passed","Wed Mar 27 06:09:16 UTC 2024","Wed Mar 27 06:09:27 UTC 2024","10559","","Subscribe: [FNN-577] Subscribe Negative","","Subscribe: [FNN-577] Subscribe Negative","should subscribe without email","should subscribe without email",""
"passed","Wed Mar 27 07:04:21 UTC 2024","Wed Mar 27 07:04:31 UTC 2024","10218","","My Profile: [FNN-719] Add resume Negative","","My Profile: [FNN-719] Add resume Negative","should add experience without company","should add experience without company",""
"passed","Wed Mar 27 07:19:59 UTC 2024","Wed Mar 27 07:20:44 UTC 2024","45003","","Create Profile: [FNN-684] Create profile Negative","","Create Profile: [FNN-684] Create profile Negative","should create profile without Description of yourself","should create profile without Description of yourself",""
"passed","Wed Mar 27 07:05:23 UTC 2024","Wed Mar 27 07:05:29 UTC 2024","6305","","My Profile: [FNN-719] Add resume Negative","","My Profile: [FNN-719] Add resume Negative","should add education without education","should add education without education",""
"passed","Wed Mar 27 06:09:52 UTC 2024","Wed Mar 27 06:10:04 UTC 2024","11796","","Subscribe: [FNN-577] Subscribe Negative","","Subscribe: [FNN-577] Subscribe Negative","should subscribe without phone number","should subscribe without phone number",""
"passed","Wed Mar 27 06:08:55 UTC 2024","Wed Mar 27 06:09:06 UTC 2024","11434","","Subscribe: [FNN-577] Subscribe Negative","","Subscribe: [FNN-577] Subscribe Negative","should subscribe without first name","should subscribe without first name",""
"passed","Wed Mar 27 07:12:11 UTC 2024","Wed Mar 27 07:12:58 UTC 2024","46896","","My Network: [FNN-1233] Invite manually via email without custom message with signup bonus","","My Network: [FNN-1233] Invite manually via email without custom message with signup bonus","should check My Dashboard and My Transactions page for the signup bonus as the inviter user","should check My Dashboard and My Transactions page for the signup bonus as the inviter user",""
"skipped","Wed Mar 27 06:06:38 UTC 2024","Wed Mar 27 06:07:01 UTC 2024","22419","","Subscribe","","Subscribe","should verify the Verify email letter","should verify the Verify email letter",""
"skipped","Wed Mar 27 07:29:32 UTC 2024","Wed Mar 27 07:29:32 UTC 2024","0","","My Transactions: [FNN-708] Hourly project: In advance. Positive","","My Transactions: [FNN-708] Hourly project: In advance. Positive","should approve the time and pay for extra money","should approve the time and pay for extra money",""
