"Status","Start Time","Stop Time","Duration in ms","Parent Suite","Suite","Sub Suite","Test Class","Test Method","Name","Description"
"passed","Thu Jan 11 06:43:52 UTC 2024","Thu Jan 11 06:44:48 UTC 2024","56371","","CR: [FNN-751] Invite to the organization manually Negative","","CR: [FNN-751] Invite to the organization manually Negative","should invite manually to the organization without email","should invite manually to the organization without email",""
"passed","Thu Jan 11 06:09:41 UTC 2024","Thu Jan 11 06:09:51 UTC 2024","9580","","Subscribe: [FNN-577] Subscribe Negative","","Subscribe: [FNN-577] Subscribe Negative","should subscribe without agreeing to the Terms and Conditions","should subscribe without agreeing to the Terms and Conditions",""
"skipped","Thu Jan 11 07:03:04 UTC 2024","Thu Jan 11 07:03:37 UTC 2024","32243","","CR: [FNN-749] Invite to the organization manually Positive","","CR: [FNN-749] Invite to the organization manually Positive","should check organization page as the inviting user","should check organization page as the inviting user",""
"broken","Thu Jan 11 06:51:03 UTC 2024","Thu Jan 11 06:52:41 UTC 2024","97692","","My Network: [FNN-664] Invite freelancer","","My Network: [FNN-664] Invite freelancer","""before all"" hook for [FNN-664] Invite freelancer","""before all"" hook for [FNN-664] Invite freelancer",""
"passed","Thu Jan 11 06:07:41 UTC 2024","Thu Jan 11 06:08:22 UTC 2024","40967","","Login: [FNN-648] Log in from the Login page Positive","","Login: [FNN-648] Log in from the Login page Positive","should log in with valid credentials","should log in with valid credentials",""
"failed","Thu Jan 11 07:02:24 UTC 2024","Thu Jan 11 07:04:12 UTC 2024","108049","","CR: [FNN-750] Invite to the organization through search","","CR: [FNN-750] Invite to the organization through search","should invite freelancer","should invite freelancer",""
"passed","Thu Jan 11 06:42:48 UTC 2024","Thu Jan 11 06:42:57 UTC 2024","9120","","CR: [FNN-744] CR Subscribe Negative","","CR: [FNN-744] CR Subscribe Negative","should subscribe as CR without company name","should subscribe as CR without company name",""
"passed","Thu Jan 11 06:33:58 UTC 2024","Thu Jan 11 06:36:17 UTC 2024","139423","","[FNN-661] Send interest","","[FNN-661] Send interest","should send interest in the employer's project","should send interest in the employer's project",""
"failed","Thu Jan 11 06:53:02 UTC 2024","Thu Jan 11 07:07:42 UTC 2024","880494","","My Projects: [FNN-971] Complete project Positive","","My Projects: [FNN-971] Complete project Positive","should complete project","should complete project",""
"broken","Thu Jan 11 06:48:24 UTC 2024","Thu Jan 11 06:50:46 UTC 2024","141343","","Settings: [FNN-678] Delete account without subscription","","Settings: [FNN-678] Delete account without subscription","should delete account without subscription","should delete account without subscription",""
"passed","Thu Jan 11 06:44:04 UTC 2024","Thu Jan 11 06:44:13 UTC 2024","8748","","CR: [FNN-744] CR Subscribe Negative","","CR: [FNN-744] CR Subscribe Negative","should subscribe as CR without password","should subscribe as CR without password",""
"passed","Thu Jan 11 06:52:41 UTC 2024","Thu Jan 11 06:53:22 UTC 2024","41730","","Post Project: [FNN-588] Post project without account Negative","","Post Project: [FNN-588] Post project without account Negative","should post project without passwords matching","should post project without passwords matching",""
"broken","Thu Jan 11 06:48:51 UTC 2024","Thu Jan 11 06:50:24 UTC 2024","93485","","My Network: [FNN-1027] Invite freelancers","","My Network: [FNN-1027] Invite freelancers","""before all"" hook for [FNN-1027] Invite freelancers","""before all"" hook for [FNN-1027] Invite freelancers",""
"passed","Thu Jan 11 06:44:45 UTC 2024","Thu Jan 11 06:44:49 UTC 2024","3543","","CR: [FNN-744] CR Subscribe Negative","","CR: [FNN-744] CR Subscribe Negative","should subscribe as CR without data","should subscribe as CR without data",""
"passed","Thu Jan 11 06:12:21 UTC 2024","Thu Jan 11 06:12:30 UTC 2024","8689","","My Profile: [FNN-690] Add resume Positive","","My Profile: [FNN-690] Add resume Positive","should add Qualities","should add Qualities",""
"passed","Thu Jan 11 06:11:29 UTC 2024","Thu Jan 11 06:11:52 UTC 2024","23662","","Upgrade: [FNN-659] Upgrade account Negative","","Upgrade: [FNN-659] Upgrade account Negative","should upgrade account to Standard 1 month: Incorrect CVC decline","should upgrade account to Standard 1 month: Incorrect CVC decline",""
"passed","Thu Jan 11 06:24:59 UTC 2024","Thu Jan 11 06:25:08 UTC 2024","8493","","Search Project: [FNN-568] Project search","","Search Project: [FNN-568] Project search","should filter projects by Search terms","should filter projects by Search terms",""
"passed","Thu Jan 11 06:08:06 UTC 2024","Thu Jan 11 06:08:13 UTC 2024","7298","","Subscribe: [FNN-577] Subscribe Negative","","Subscribe: [FNN-577] Subscribe Negative","should subscribe without email","should subscribe without email",""
"passed","Thu Jan 11 06:48:35 UTC 2024","Thu Jan 11 06:49:36 UTC 2024","61143","","Post Project: [FNN-588] Post project without account Negative","","Post Project: [FNN-588] Post project without account Negative","should post project without account details","should post project without account details",""
"passed","Thu Jan 11 06:31:55 UTC 2024","Thu Jan 11 06:32:01 UTC 2024","6164","","My Projects: [FNN-1058] Complete project Negative","","My Projects: [FNN-1058] Complete project Negative","should complete project without Professionalism","should complete project without Professionalism",""
"passed","Thu Jan 11 06:51:21 UTC 2024","Thu Jan 11 06:51:42 UTC 2024","20422","","Post Project: [FNN-588] Post project without account Negative","","Post Project: [FNN-588] Post project without account Negative","should post project with taken phone number","should post project with taken phone number",""
"passed","Thu Jan 11 06:25:18 UTC 2024","Thu Jan 11 06:25:41 UTC 2024","23095","","Search Project: [FNN-568] Project search","","Search Project: [FNN-568] Project search","should filter projects by Fixed price","should filter projects by Fixed price",""
"passed","Thu Jan 11 06:10:21 UTC 2024","Thu Jan 11 06:10:45 UTC 2024","23459","","Upgrade: [FNN-659] Upgrade account Negative","","Upgrade: [FNN-659] Upgrade account Negative","should upgrade account to Standard 1 month: Lost card decline","should upgrade account to Standard 1 month: Lost card decline",""
"passed","Thu Jan 11 06:49:46 UTC 2024","Thu Jan 11 06:49:50 UTC 2024","3487","","My Profile: [FNN-719] Add resume Negative","","My Profile: [FNN-719] Add resume Negative","should add certificate without achieved annual","should add certificate without achieved annual",""
"passed","Thu Jan 11 06:47:48 UTC 2024","Thu Jan 11 06:48:12 UTC 2024","23837","","My Profile: [FNN-699] Request reference Positive","","My Profile: [FNN-699] Request reference Positive","should check the validated reference","should check the validated reference",""
"passed","Thu Jan 11 06:18:47 UTC 2024","Thu Jan 11 06:18:59 UTC 2024","12765","","Post Project: [FNN-649] Post project with account Negative","","Post Project: [FNN-649] Post project with account Negative","should post project without step 2","should post project without step 2",""
"passed","Thu Jan 11 06:05:58 UTC 2024","Thu Jan 11 06:06:30 UTC 2024","32337","","Login: [FNN-647] Log in from the header Positive","","Login: [FNN-647] Log in from the header Positive","should log in with valid credentials","should log in with valid credentials",""
"passed","Thu Jan 11 06:47:41 UTC 2024","Thu Jan 11 06:47:46 UTC 2024","5484","","My Profile: [FNN-719] Add resume Negative","","My Profile: [FNN-719] Add resume Negative","should add experience without position","should add experience without position",""
"passed","Thu Jan 11 06:31:29 UTC 2024","Thu Jan 11 06:31:38 UTC 2024","9044","","My Projects: [FNN-1058] Complete project Negative","","My Projects: [FNN-1058] Complete project Negative","should complete project without Quality","should complete project without Quality",""
"passed","Thu Jan 11 06:11:50 UTC 2024","Thu Jan 11 06:12:01 UTC 2024","11580","","My Profile: [FNN-690] Add resume Positive","","My Profile: [FNN-690] Add resume Positive","should add Education","should add Education",""
"broken","Thu Jan 11 06:46:18 UTC 2024","Thu Jan 11 06:47:51 UTC 2024","93612","","My Profile: [FNN-730] Request reference Negative","","My Profile: [FNN-730] Request reference Negative","""before each"" hook for [FNN-730] Request reference Negative","""before each"" hook for [FNN-730] Request reference Negative",""
"failed","Thu Jan 11 06:56:42 UTC 2024","Thu Jan 11 06:59:10 UTC 2024","148119","","[FNN-743] Archive and restore message","","[FNN-743] Archive and restore message","should archive the message","should archive the message",""
"failed","Thu Jan 11 06:52:26 UTC 2024","Thu Jan 11 06:54:21 UTC 2024","114135","","Freelancer search: [FNN-815] Freelancer search as non-CR user","","Freelancer search: [FNN-815] Freelancer search as non-CR user","should filter freelancers by Sector","should filter freelancers by Sector",""
"passed","Thu Jan 11 06:31:44 UTC 2024","Thu Jan 11 06:32:36 UTC 2024","51612","","Freelancer search: [FNN-817] Add note","","Freelancer search: [FNN-817] Add note","should add note from the notes popup","should add note from the notes popup",""
"passed","Thu Jan 11 06:43:40 UTC 2024","Thu Jan 11 06:43:47 UTC 2024","6727","","CR: [FNN-744] CR Subscribe Negative","","CR: [FNN-744] CR Subscribe Negative","should subscribe as CR without phone number","should subscribe as CR without phone number",""
"passed","Thu Jan 11 06:10:10 UTC 2024","Thu Jan 11 06:11:35 UTC 2024","85542","","Upgrade: [FNN-658] Upgrade account Positive","","Upgrade: [FNN-658] Upgrade account Positive","should upgrade account to Premium 1 month","should upgrade account to Premium 1 month",""
"passed","Thu Jan 11 06:07:05 UTC 2024","Thu Jan 11 06:07:07 UTC 2024","1934","","Login: [FNN-563] Log in from the header Negative","","Login: [FNN-563] Log in from the header Negative","should log in with wrong email format","should log in with wrong email format",""
"broken","Thu Jan 11 06:53:17 UTC 2024","Thu Jan 11 06:55:51 UTC 2024","153897","","Freelancer search: [FNN-924] Freelancer search as CR user","","Freelancer search: [FNN-924] Freelancer search as CR user","""before all"" hook for [FNN-924] Freelancer search as CR user","""before all"" hook for [FNN-924] Freelancer search as CR user",""
"failed","Thu Jan 11 06:54:03 UTC 2024","Thu Jan 11 06:54:37 UTC 2024","34272","","Create Profile: [FNN-684] Create profile Negative","","Create Profile: [FNN-684] Create profile Negative","should create profile with wrong website","should create profile with wrong website",""
"passed","Thu Jan 11 06:45:59 UTC 2024","Thu Jan 11 06:47:27 UTC 2024","87999","","My Profile: [FNN-699] Request reference Positive","","My Profile: [FNN-699] Request reference Positive","should add experience and request reference","should add experience and request reference",""
"passed","Thu Jan 11 07:07:42 UTC 2024","Thu Jan 11 07:08:24 UTC 2024","41646","","My Projects: [FNN-971] Complete project Positive","","My Projects: [FNN-971] Complete project Positive","should check review as freelancer user","should check review as freelancer user",""
"passed","Thu Jan 11 06:44:29 UTC 2024","Thu Jan 11 06:44:38 UTC 2024","9139","","CR: [FNN-744] CR Subscribe Negative","","CR: [FNN-744] CR Subscribe Negative","should subscribe as CR with invalid repeat password","should subscribe as CR with invalid repeat password",""
"passed","Thu Jan 11 06:25:46 UTC 2024","Thu Jan 11 06:25:50 UTC 2024","4060","","My Network: [FNN-620] Invite manually via email and sms Negative","","My Network: [FNN-620] Invite manually via email and sms Negative","should invite manually via sms with invalid phone number","should invite manually via sms with invalid phone number",""
"passed","Thu Jan 11 06:12:01 UTC 2024","Thu Jan 11 06:12:15 UTC 2024","13767","","My Profile: [FNN-690] Add resume Positive","","My Profile: [FNN-690] Add resume Positive","should add Certificate","should add Certificate",""
"passed","Thu Jan 11 06:06:40 UTC 2024","Thu Jan 11 06:07:06 UTC 2024","25937","","Login: [FNN-574] Log in from the Login page Negative","","Login: [FNN-574] Log in from the Login page Negative","should log in with valid email and invalid password","should log in with valid email and invalid password",""
"passed","Thu Jan 11 06:26:15 UTC 2024","Thu Jan 11 06:26:25 UTC 2024","9887","","Search Project: [FNN-568] Project search","","Search Project: [FNN-568] Project search","should filter projects by Posted since Last 7 days","should filter projects by Posted since Last 7 days",""
"passed","Thu Jan 11 06:48:27 UTC 2024","Thu Jan 11 06:48:36 UTC 2024","8935","","Settings: [FNN-673] Confirm email address","","Settings: [FNN-673] Confirm email address","should confirm email address","should confirm email address",""
"passed","Thu Jan 11 06:46:20 UTC 2024","Thu Jan 11 06:46:24 UTC 2024","4065","","My Profile: [FNN-668] Edit account details Negative","","My Profile: [FNN-668] Edit account details Negative","should edit account details with invalid phone number","should edit account details with invalid phone number",""
"broken","Thu Jan 11 06:51:37 UTC 2024","Thu Jan 11 06:52:20 UTC 2024","43563","","My Network: [FNN-619] Invite manually via sms with signup bonus","","My Network: [FNN-619] Invite manually via sms with signup bonus","should subscribe as the freelancer with recipient details and accept the invitation","should subscribe as the freelancer with recipient details and accept the invitation",""
"passed","Thu Jan 11 06:25:08 UTC 2024","Thu Jan 11 06:25:27 UTC 2024","19460","","My Network: [FNN-620] Invite manually via email and sms Negative","","My Network: [FNN-620] Invite manually via email and sms Negative","should invite manually via email without email","should invite manually via email without email",""
"passed","Thu Jan 11 06:10:45 UTC 2024","Thu Jan 11 06:11:05 UTC 2024","20520","","Upgrade: [FNN-659] Upgrade account Negative","","Upgrade: [FNN-659] Upgrade account Negative","should upgrade account to Standard 1 month: Stolen card decline","should upgrade account to Standard 1 month: Stolen card decline",""
"passed","Thu Jan 11 06:48:31 UTC 2024","Thu Jan 11 06:48:41 UTC 2024","9690","","Settings: [FNN-675] Change password Negative","","Settings: [FNN-675] Change password Negative","should change password with invalid old password","should change password with invalid old password",""
"passed","Thu Jan 11 06:55:55 UTC 2024","Thu Jan 11 06:57:30 UTC 2024","94674","","Freelancer search: [FNN-822] Send message","","Freelancer search: [FNN-822] Send message","should send a message via the ""Send message"" action","should send a message via the ""Send message"" action",""
"passed","Thu Jan 11 06:07:09 UTC 2024","Thu Jan 11 06:07:11 UTC 2024","2140","","Login: [FNN-563] Log in from the header Negative","","Login: [FNN-563] Log in from the header Negative","should log in without password","should log in without password",""
"passed","Thu Jan 11 06:51:54 UTC 2024","Thu Jan 11 06:52:10 UTC 2024","15628","","Post Project: [FNN-588] Post project without account Negative","","Post Project: [FNN-588] Post project without account Negative","should post project without password","should post project without password",""
"passed","Thu Jan 11 06:11:52 UTC 2024","Thu Jan 11 06:12:16 UTC 2024","23953","","Upgrade: [FNN-659] Upgrade account Negative","","Upgrade: [FNN-659] Upgrade account Negative","should upgrade account to Standard 1 month: Processing error decline","should upgrade account to Standard 1 month: Processing error decline",""
"passed","Thu Jan 11 06:11:32 UTC 2024","Thu Jan 11 06:11:50 UTC 2024","17715","","My Profile: [FNN-690] Add resume Positive","","My Profile: [FNN-690] Add resume Positive","should add Experience","should add Experience",""
"passed","Thu Jan 11 06:13:05 UTC 2024","Thu Jan 11 06:14:25 UTC 2024","80446","","My Profile: [FNN-698] Confirm phone number Positive","","My Profile: [FNN-698] Confirm phone number Positive","should confirm phone number with valid code","should confirm phone number with valid code",""
"passed","Thu Jan 11 06:44:54 UTC 2024","Thu Jan 11 06:44:56 UTC 2024","2229","","CR: [FNN-751] Invite to the organization manually Negative","","CR: [FNN-751] Invite to the organization manually Negative","should invite manually to the organization without last name","should invite manually to the organization without last name",""
"broken","Thu Jan 11 06:57:24 UTC 2024","Thu Jan 11 07:00:40 UTC 2024","196604","","My Transactions: [FNN-1430] Milestones project: In retrospect. Positive","","My Transactions: [FNN-1430] Milestones project: In retrospect. Positive","should start project with milestone","should start project with milestone",""
"passed","Thu Jan 11 06:48:36 UTC 2024","Thu Jan 11 06:48:41 UTC 2024","5424","","My Profile: [FNN-719] Add resume Negative","","My Profile: [FNN-719] Add resume Negative","should add education without education","should add education without education",""
"passed","Thu Jan 11 06:20:22 UTC 2024","Thu Jan 11 06:20:44 UTC 2024","22362","","Post Project: [FNN-649] Post project with account Negative","","Post Project: [FNN-649] Post project with account Negative","should post project without Description","should post project without Description",""
"passed","Thu Jan 11 06:47:54 UTC 2024","Thu Jan 11 06:47:59 UTC 2024","5305","","My Profile: [FNN-719] Add resume Negative","","My Profile: [FNN-719] Add resume Negative","should add experience without period from  ","should add experience without period from  ",""
"failed","Thu Jan 11 06:47:27 UTC 2024","Thu Jan 11 06:47:48 UTC 2024","21487","","My Profile: [FNN-699] Request reference Positive","","My Profile: [FNN-699] Request reference Positive","should validate reference","should validate reference",""
"passed","Thu Jan 11 06:50:03 UTC 2024","Thu Jan 11 06:50:16 UTC 2024","12143","","Post Project: [FNN-588] Post project without account Negative","","Post Project: [FNN-588] Post project without account Negative","should post project without email","should post project without email",""
"passed","Thu Jan 11 06:38:18 UTC 2024","Thu Jan 11 06:39:04 UTC 2024","46692","","[FNN-667] Send contact","","[FNN-667] Send contact","should check the contact as the second user","should check the contact as the second user",""
"passed","Thu Jan 11 06:49:59 UTC 2024","Thu Jan 11 06:50:21 UTC 2024","21859","","My Profile: [FNN-719] Add resume Negative","","My Profile: [FNN-719] Add resume Negative","should add language without reading level","should add language without reading level",""
"passed","Thu Jan 11 06:12:16 UTC 2024","Thu Jan 11 06:12:36 UTC 2024","20050","","Upgrade: [FNN-659] Upgrade account Negative","","Upgrade: [FNN-659] Upgrade account Negative","should upgrade account to Standard 1 month: Incorrect number decline","should upgrade account to Standard 1 month: Incorrect number decline",""
"passed","Thu Jan 11 06:43:54 UTC 2024","Thu Jan 11 06:44:04 UTC 2024","10384","","CR: [FNN-744] CR Subscribe Negative","","CR: [FNN-744] CR Subscribe Negative","should subscribe as CR with taken phone number","should subscribe as CR with taken phone number",""
"passed","Thu Jan 11 06:31:24 UTC 2024","Thu Jan 11 06:31:29 UTC 2024","5427","","My Projects: [FNN-1058] Complete project Negative","","My Projects: [FNN-1058] Complete project Negative","should complete project without profile picture","should complete project without profile picture",""
"skipped","Thu Jan 11 07:04:12 UTC 2024","Thu Jan 11 07:04:12 UTC 2024","1","","CR: [FNN-750] Invite to the organization through search","","CR: [FNN-750] Invite to the organization through search","should accept invitation","should accept invitation",""
"passed","Thu Jan 11 06:36:31 UTC 2024","Thu Jan 11 06:37:02 UTC 2024","30419","","[FNN-717] Edit email settings","","[FNN-717] Edit email settings","should edit Notification settings and verify that the settings are saved","should edit Notification settings and verify that the settings are saved",""
"broken","Thu Jan 11 07:02:09 UTC 2024","Thu Jan 11 07:02:11 UTC 2024","2258","","My Transactions: [FNN-738] Milestones project: Add milestone. Negative","","My Transactions: [FNN-738] Milestones project: Add milestone. Negative","should add milestone without Amount","should add milestone without Amount",""
"failed","Thu Jan 11 06:50:52 UTC 2024","Thu Jan 11 06:51:42 UTC 2024","49845","","My Network: [FNN-1233] Invite manually via email without custom message with signup bonus","","My Network: [FNN-1233] Invite manually via email without custom message with signup bonus","should invite manually via email with valid recipient data and without message","should invite manually via email with valid recipient data and without message",""
"passed","Thu Jan 11 06:25:08 UTC 2024","Thu Jan 11 06:25:18 UTC 2024","10490","","Search Project: [FNN-568] Project search","","Search Project: [FNN-568] Project search","should filter projects by Location","should filter projects by Location",""
"passed","Thu Jan 11 06:18:23 UTC 2024","Thu Jan 11 06:19:08 UTC 2024","44903","","Settings: [FNN-671] Change email address Positive","","Settings: [FNN-671] Change email address Positive","should change email address with valid credentials","should change email address with valid credentials",""
"passed","Thu Jan 11 06:31:33 UTC 2024","Thu Jan 11 06:31:44 UTC 2024","11384","","Freelancer search: [FNN-817] Add note","","Freelancer search: [FNN-817] Add note","should add a note via the action ""Add note""","should add a note via the action ""Add note""",""
"broken","Thu Jan 11 06:48:45 UTC 2024","Thu Jan 11 06:50:54 UTC 2024","128776","","Settings: [FNN-679] Delete account with subscription","","Settings: [FNN-679] Delete account with subscription","should delete account with subscription","should delete account with subscription",""
"passed","Thu Jan 11 06:18:22 UTC 2024","Thu Jan 11 06:18:36 UTC 2024","13965","","Post Project: [FNN-649] Post project with account Negative","","Post Project: [FNN-649] Post project with account Negative","should post project with short Title","should post project with short Title",""
"passed","Thu Jan 11 06:53:30 UTC 2024","Thu Jan 11 06:53:53 UTC 2024","23094","","Create Profile: [FNN-684] Create profile Negative","","Create Profile: [FNN-684] Create profile Negative","should create profile without required fields","should create profile without required fields",""
"passed","Thu Jan 11 06:49:51 UTC 2024","Thu Jan 11 06:50:03 UTC 2024","12779","","Post Project: [FNN-588] Post project without account Negative","","Post Project: [FNN-588] Post project without account Negative","should post project without last name","should post project without last name",""
"passed","Thu Jan 11 06:19:15 UTC 2024","Thu Jan 11 06:19:31 UTC 2024","16445","","Post Project: [FNN-649] Post project with account Negative","","Post Project: [FNN-649] Post project with account Negative","should post project without Work on location","should post project without Work on location",""
