"Status","Start Time","Stop Time","Duration in ms","Parent Suite","Suite","Sub Suite","Test Class","Test Method","Name","Description"
"failed","Sat Apr 06 06:49:09 UTC 2024","Sat Apr 06 06:50:25 UTC 2024","75285","","CR: [FNN-1779] My Dashboard page integrity as Employer","","CR: [FNN-1779] My Dashboard page integrity as Employer","""before all"" hook for [FNN-1779] My Dashboard page integrity as Employer","""before all"" hook for [FNN-1779] My Dashboard page integrity as Employer",""
"passed","Sat Apr 06 06:25:07 UTC 2024","Sat Apr 06 06:26:34 UTC 2024","86890","","Settings: [FNN-674] Change password Positive","","Settings: [FNN-674] Change password Positive","should change password with valid credentials","should change password with valid credentials",""
"passed","Sat Apr 06 07:04:21 UTC 2024","Sat Apr 06 07:04:40 UTC 2024","18797","","Post Project: [FNN-588] Post project without account Negative","","Post Project: [FNN-588] Post project without account Negative","should post project without password","should post project without password",""
"passed","Sat Apr 06 06:51:47 UTC 2024","Sat Apr 06 06:52:00 UTC 2024","13177","","CR: [FNN-744] CR Subscribe Negative","","CR: [FNN-744] CR Subscribe Negative","should subscribe as CR without repeat password","should subscribe as CR without repeat password",""
"passed","Sat Apr 06 06:27:15 UTC 2024","Sat Apr 06 06:28:06 UTC 2024","50683","","Settings: [FNN-675] Change password Negative","","Settings: [FNN-675] Change password Negative","should change password with invalid old password","should change password with invalid old password",""
"passed","Sat Apr 06 06:42:43 UTC 2024","Sat Apr 06 06:43:48 UTC 2024","64519","","[FNN-717] Edit email settings","","[FNN-717] Edit email settings","should edit Email settings and verify that the settings are saved","should edit Email settings and verify that the settings are saved",""
"failed","Sat Apr 06 07:04:57 UTC 2024","Sat Apr 06 07:06:21 UTC 2024","83394","","My Projects: [FNN-1058] Complete project Negative","","My Projects: [FNN-1058] Complete project Negative","""before all"" hook for [FNN-1058] Complete project Negative","""before all"" hook for [FNN-1058] Complete project Negative",""
"passed","Sat Apr 06 06:24:01 UTC 2024","Sat Apr 06 06:24:19 UTC 2024","18360","","Post Project: [FNN-649] Post project with account Negative","","Post Project: [FNN-649] Post project with account Negative","should post project without Location","should post project without Location",""
"passed","Sat Apr 06 06:39:13 UTC 2024","Sat Apr 06 06:40:21 UTC 2024","67742","","Freelancer search: [FNN-817] Add note","","Freelancer search: [FNN-817] Add note","should add note from the notes popup","should add note from the notes popup",""
"skipped","Sat Apr 06 06:05:47 UTC 2024","Sat Apr 06 06:06:10 UTC 2024","22513","","Subscribe","","Subscribe","[FNN-2387] Professional receives Verify email letter","[FNN-2387] Professional receives Verify email letter",""
"broken","Sat Apr 06 06:55:53 UTC 2024","Sat Apr 06 06:56:36 UTC 2024","42890","","Upgrade: [FNN-659] Upgrade account Negative","","Upgrade: [FNN-659] Upgrade account Negative","should upgrade account to Standard 1 month: Expired card decline","should upgrade account to Standard 1 month: Expired card decline",""
"passed","Sat Apr 06 07:06:46 UTC 2024","Sat Apr 06 07:07:14 UTC 2024","28388","","My Projects: [FNN-971] Complete project Positive","","My Projects: [FNN-971] Complete project Positive","should check review as freelancer user","should check review as freelancer user",""
"passed","Sat Apr 06 06:27:16 UTC 2024","Sat Apr 06 06:29:04 UTC 2024","108231","","Settings: [FNN-679] Delete account with subscription","","Settings: [FNN-679] Delete account with subscription","should delete account with subscription","should delete account with subscription",""
"passed","Sat Apr 06 06:07:16 UTC 2024","Sat Apr 06 06:07:21 UTC 2024","4908","","Login: [FNN-574] Log in from the Login page Negative","","Login: [FNN-574] Log in from the Login page Negative","should log in with wrong email format","should log in with wrong email format",""
"skipped","Sat Apr 06 06:34:55 UTC 2024","Sat Apr 06 06:35:53 UTC 2024","58880","","My Network: [FNN-1027] Invite freelancers","","My Network: [FNN-1027] Invite freelancers","should check network as sender user","should check network as sender user",""
"passed","Sat Apr 06 06:11:29 UTC 2024","Sat Apr 06 06:11:39 UTC 2024","9709","","Subscribe: [FNN-577] Subscribe Negative","","Subscribe: [FNN-577] Subscribe Negative","should subscribe without repeat password","should subscribe without repeat password",""
"passed","Sat Apr 06 06:18:25 UTC 2024","Sat Apr 06 06:20:32 UTC 2024","127074","","My Profile: [FNN-793] Remove resume","","My Profile: [FNN-793] Remove resume","should remove resume","should remove resume",""
"passed","Sat Apr 06 07:07:10 UTC 2024","Sat Apr 06 07:07:15 UTC 2024","4917","","Search Project: [FNN-568] Project search","","Search Project: [FNN-568] Project search","should filter projects by Status Open projects","should filter projects by Status Open projects",""
"failed","Sat Apr 06 06:54:50 UTC 2024","Sat Apr 06 06:55:14 UTC 2024","24342","","My Profile: [FNN-719] Add resume Negative","","My Profile: [FNN-719] Add resume Negative","should add education without data","should add education without data",""
"passed","Sat Apr 06 06:11:39 UTC 2024","Sat Apr 06 06:11:50 UTC 2024","11154","","Subscribe: [FNN-577] Subscribe Negative","","Subscribe: [FNN-577] Subscribe Negative","should subscribe with short password","should subscribe with short password",""
"passed","Sat Apr 06 07:09:41 UTC 2024","Sat Apr 06 07:10:12 UTC 2024","30729","","[FNN-667] Send contact","","[FNN-667] Send contact","should check the contact as the second user","should check the contact as the second user",""
"broken","Sat Apr 06 06:58:02 UTC 2024","Sat Apr 06 06:58:44 UTC 2024","41989","","Upgrade: [FNN-659] Upgrade account Negative","","Upgrade: [FNN-659] Upgrade account Negative","should upgrade account to Standard 1 month: Incorrect number decline","should upgrade account to Standard 1 month: Incorrect number decline",""
"passed","Sat Apr 06 06:23:45 UTC 2024","Sat Apr 06 06:24:01 UTC 2024","15313","","Post Project: [FNN-649] Post project with account Negative","","Post Project: [FNN-649] Post project with account Negative","should post project without Work on location","should post project without Work on location",""
"passed","Sat Apr 06 06:08:01 UTC 2024","Sat Apr 06 06:09:21 UTC 2024","80081","","Subscribe","","Subscribe","[FNN-2167] 500  signup bonus","[FNN-2167] 500  signup bonus",""
"passed","Sat Apr 06 06:50:03 UTC 2024","Sat Apr 06 06:50:07 UTC 2024","4049","","CR: [FNN-751] Invite to the organization manually Negative","","CR: [FNN-751] Invite to the organization manually Negative","should invite manually to the organization without first name","should invite manually to the organization without first name",""
"passed","Sat Apr 06 06:54:07 UTC 2024","Sat Apr 06 06:54:17 UTC 2024","9267","","My Profile: [FNN-719] Add resume Negative","","My Profile: [FNN-719] Add resume Negative","should add experience without position","should add experience without position",""
"failed","Sat Apr 06 07:01:13 UTC 2024","Sat Apr 06 07:01:19 UTC 2024","5981","","Post Project: [FNN-650] Post project without account Positive","","Post Project: [FNN-650] Post project without account Positive","should verify that the user received a verify email letter","should verify that the user received a verify email letter",""
"passed","Sat Apr 06 06:22:44 UTC 2024","Sat Apr 06 06:22:56 UTC 2024","11915","","Post Project: [FNN-649] Post project with account Negative","","Post Project: [FNN-649] Post project with account Negative","should post project without Title","should post project without Title",""
"passed","Sat Apr 06 06:16:50 UTC 2024","Sat Apr 06 06:17:46 UTC 2024","56675","","My Profile: [FNN-718] Add portfolio Negative","","My Profile: [FNN-718] Add portfolio Negative","should add portfolio without data","should add portfolio without data",""
"passed","Sat Apr 06 07:07:25 UTC 2024","Sat Apr 06 07:07:33 UTC 2024","8193","","Search Project: [FNN-568] Project search","","Search Project: [FNN-568] Project search","should filter projects by Posted since Last 7 days","should filter projects by Posted since Last 7 days",""
"passed","Sat Apr 06 06:07:34 UTC 2024","Sat Apr 06 06:07:39 UTC 2024","4683","","Login: [FNN-563] Log in from the header Negative","","Login: [FNN-563] Log in from the header Negative","should log in with invalid credentials","should log in with invalid credentials",""
"passed","Sat Apr 06 07:07:41 UTC 2024","Sat Apr 06 07:08:23 UTC 2024","42252","","Create Profile: [FNN-684] Create profile Negative","","Create Profile: [FNN-684] Create profile Negative","should create profile without required fields","should create profile without required fields",""
"passed","Sat Apr 06 06:59:59 UTC 2024","Sat Apr 06 07:00:47 UTC 2024","47603","","Post Project: [FNN-650] Post project without account Positive","","Post Project: [FNN-650] Post project without account Positive","should post a project as an unregistered user with valid project data","should post a project as an unregistered user with valid project data",""
"broken","Sat Apr 06 06:59:36 UTC 2024","Sat Apr 06 07:07:33 UTC 2024","477683","","My Profile: [FNN-699] Request reference Positive","","My Profile: [FNN-699] Request reference Positive","should check the validated reference","should check the validated reference",""
"passed","Sat Apr 06 06:09:00 UTC 2024","Sat Apr 06 06:09:08 UTC 2024","7866","","Reset password: [FNN-655] Reset password Negative","","Reset password: [FNN-655] Reset password Negative","should reset password without data","should reset password without data",""
"passed","Sat Apr 06 06:58:10 UTC 2024","Sat Apr 06 06:58:18 UTC 2024","7701","","My Profile: [FNN-730] Request reference Negative","","My Profile: [FNN-730] Request reference Negative","should pass step 2 without phone","should pass step 2 without phone",""
"broken","Sat Apr 06 06:54:37 UTC 2024","Sat Apr 06 06:56:16 UTC 2024","98810","","Upgrade: [FNN-658] Upgrade account Positive","","Upgrade: [FNN-658] Upgrade account Positive","should upgrade account to Premium 1 month","should upgrade account to Premium 1 month",""
"passed","Sat Apr 06 06:07:21 UTC 2024","Sat Apr 06 06:07:24 UTC 2024","3246","","Login: [FNN-574] Log in from the Login page Negative","","Login: [FNN-574] Log in from the Login page Negative","should log in without email","should log in without email",""
"passed","Sat Apr 06 06:07:47 UTC 2024","Sat Apr 06 06:07:49 UTC 2024","2649","","Login: [FNN-563] Log in from the header Negative","","Login: [FNN-563] Log in from the header Negative","should log in without password","should log in without password",""
"passed","Sat Apr 06 06:33:28 UTC 2024","Sat Apr 06 06:33:34 UTC 2024","6720","","My Network: [FNN-620] Invite manually via email and sms Negative","","My Network: [FNN-620] Invite manually via email and sms Negative","should invite manually via email with wrong email format","should invite manually via email with wrong email format",""
"failed","Sat Apr 06 07:05:26 UTC 2024","Sat Apr 06 07:06:46 UTC 2024","80149","","My Projects: [FNN-971] Complete project Positive","","My Projects: [FNN-971] Complete project Positive","""before all"" hook for [FNN-971] Complete project Positive","""before all"" hook for [FNN-971] Complete project Positive",""
"passed","Sat Apr 06 06:53:07 UTC 2024","Sat Apr 06 06:54:04 UTC 2024","57571","","My Profile: [FNN-719] Add resume Negative","","My Profile: [FNN-719] Add resume Negative","should add CV without CV","should add CV without CV",""
"broken","Sat Apr 06 06:58:44 UTC 2024","Sat Apr 06 06:59:53 UTC 2024","69458","","Upgrade: [FNN-659] Upgrade account Negative","","Upgrade: [FNN-659] Upgrade account Negative","should upgrade account to Standard 1 month: Exceeding velocity limit decline","should upgrade account to Standard 1 month: Exceeding velocity limit decline",""
"passed","Sat Apr 06 07:01:02 UTC 2024","Sat Apr 06 07:01:22 UTC 2024","19932","","Post Project: [FNN-588] Post project without account Negative","","Post Project: [FNN-588] Post project without account Negative","should post project without first name","should post project without first name",""
"broken","Sat Apr 06 06:59:16 UTC 2024","Sat Apr 06 07:02:17 UTC 2024","181179","","Upgrade: [FNN-658] Upgrade account Positive","","Upgrade: [FNN-658] Upgrade account Positive","should upgrade account to Enterprise 1 month","should upgrade account to Enterprise 1 month",""
"passed","Sat Apr 06 06:11:05 UTC 2024","Sat Apr 06 06:11:19 UTC 2024","13498","","Subscribe: [FNN-577] Subscribe Negative","","Subscribe: [FNN-577] Subscribe Negative","should subscribe with taken phone number","should subscribe with taken phone number",""
"passed","Sat Apr 06 06:14:11 UTC 2024","Sat Apr 06 06:14:48 UTC 2024","36645","","My Profile: [FNN-690] Add resume Positive","","My Profile: [FNN-690] Add resume Positive","should check the attached part of the resume on the Profile page","should check the attached part of the resume on the Profile page",""
"skipped","Sat Apr 06 07:13:42 UTC 2024","Sat Apr 06 07:14:32 UTC 2024","50528","","Freelancer search: [FNN-846] Invite to project","","Freelancer search: [FNN-846] Invite to project","should verify if the ""Assign project"" button is enable","should verify if the ""Assign project"" button is enable",""
"passed","Sat Apr 06 06:12:54 UTC 2024","Sat Apr 06 06:14:36 UTC 2024","101858","","My Profile: [FNN-695] Add portfolio Positive","","My Profile: [FNN-695] Add portfolio Positive","should add portfolio","should add portfolio",""
"passed","Sat Apr 06 07:09:09 UTC 2024","Sat Apr 06 07:09:47 UTC 2024","38688","","Create Profile: [FNN-684] Create profile Negative","","Create Profile: [FNN-684] Create profile Negative","should create profile without Description of yourself","should create profile without Description of yourself",""
"passed","Sat Apr 06 06:59:29 UTC 2024","Sat Apr 06 06:59:39 UTC 2024","9919","","My Profile: [FNN-730] Request reference Negative","","My Profile: [FNN-730] Request reference Negative","should pass step 3 without 2 rating","should pass step 3 without 2 rating",""
"broken","Sat Apr 06 06:53:06 UTC 2024","Sat Apr 06 06:53:48 UTC 2024","42521","","Upgrade: [FNN-659] Upgrade account Negative","","Upgrade: [FNN-659] Upgrade account Negative","should upgrade account to Standard 1 month: Generic decline","should upgrade account to Standard 1 month: Generic decline",""
"passed","Sat Apr 06 07:03:02 UTC 2024","Sat Apr 06 07:03:20 UTC 2024","18871","","Post Project: [FNN-588] Post project without account Negative","","Post Project: [FNN-588] Post project without account Negative","should post project without phone number","should post project without phone number",""
"passed","Sat Apr 06 06:58:18 UTC 2024","Sat Apr 06 06:58:24 UTC 2024","6088","","My Profile: [FNN-730] Request reference Negative","","My Profile: [FNN-730] Request reference Negative","should pass step 2 without picture","should pass step 2 without picture",""
"failed","Sat Apr 06 07:02:13 UTC 2024","Sat Apr 06 07:03:13 UTC 2024","59156","","My Network: [FNN-1233] Invite manually via email without custom message with signup bonus","","My Network: [FNN-1233] Invite manually via email without custom message with signup bonus","should invite manually via email with valid recipient data and without message","should invite manually via email with valid recipient data and without message",""
"passed","Sat Apr 06 07:03:16 UTC 2024","Sat Apr 06 07:04:11 UTC 2024","55707","","My Network: [FNN-619] Invite manually via sms with signup bonus","","My Network: [FNN-619] Invite manually via sms with signup bonus","should subscribe as the freelancer with recipient details and accept the invitation","should subscribe as the freelancer with recipient details and accept the invitation",""
"passed","Sat Apr 06 06:56:41 UTC 2024","Sat Apr 06 06:56:46 UTC 2024","4717","","My Profile: [FNN-719] Add resume Negative","","My Profile: [FNN-719] Add resume Negative","should add language without levels","should add language without levels",""
"passed","Sat Apr 06 06:24:36 UTC 2024","Sat Apr 06 06:24:53 UTC 2024","16294","","Post Project: [FNN-649] Post project with account Negative","","Post Project: [FNN-649] Post project with account Negative","should post project without End date","should post project without End date",""
"broken","Sat Apr 06 06:55:12 UTC 2024","Sat Apr 06 06:55:53 UTC 2024","41664","","Upgrade: [FNN-659] Upgrade account Negative","","Upgrade: [FNN-659] Upgrade account Negative","should upgrade account to Standard 1 month: Stolen card decline","should upgrade account to Standard 1 month: Stolen card decline",""
"passed","Sat Apr 06 06:51:03 UTC 2024","Sat Apr 06 06:52:16 UTC 2024","72691","","My Profile: [FNN-668] Edit account details Negative","","My Profile: [FNN-668] Edit account details Negative","should edit account details without required fields","should edit account details without required fields",""
"passed","Sat Apr 06 06:52:19 UTC 2024","Sat Apr 06 06:52:22 UTC 2024","3392","","My Profile: [FNN-668] Edit account details Negative","","My Profile: [FNN-668] Edit account details Negative","should edit account details with invalid phone number","should edit account details with invalid phone number",""
"passed","Sat Apr 06 06:59:39 UTC 2024","Sat Apr 06 06:59:50 UTC 2024","10936","","My Profile: [FNN-730] Request reference Negative","","My Profile: [FNN-730] Request reference Negative","should pass step 3 without 3 rating","should pass step 3 without 3 rating",""
"passed","Sat Apr 06 06:22:56 UTC 2024","Sat Apr 06 06:23:10 UTC 2024","13755","","Post Project: [FNN-649] Post project with account Negative","","Post Project: [FNN-649] Post project with account Negative","should post project with short Title","should post project with short Title",""
"passed","Sat Apr 06 06:27:37 UTC 2024","Sat Apr 06 06:27:39 UTC 2024","2588","","Settings: [FNN-678] Delete account without subscription","","Settings: [FNN-678] Delete account without subscription","should receive a ""account deleted"" letter","should receive a ""account deleted"" letter",""
"passed","Sat Apr 06 06:42:29 UTC 2024","Sat Apr 06 06:43:01 UTC 2024","32090","","Freelancer search: [FNN-924] Freelancer search as CR user","","Freelancer search: [FNN-924] Freelancer search as CR user","should filter freelancers by Location","should filter freelancers by Location",""
"passed","Sat Apr 06 06:08:24 UTC 2024","Sat Apr 06 06:09:44 UTC 2024","80225","","Subscribe: [FNN-577] Subscribe Negative","","Subscribe: [FNN-577] Subscribe Negative","should subscribe without category","should subscribe without category",""
"passed","Sat Apr 06 06:25:26 UTC 2024","Sat Apr 06 06:26:13 UTC 2024","46194","","Settings: [FNN-672] Change email address Negative","","Settings: [FNN-672] Change email address Negative","should change email address with wrong password","should change email address with wrong password",""
"passed","Sat Apr 06 06:33:40 UTC 2024","Sat Apr 06 06:33:45 UTC 2024","5322","","My Network: [FNN-620] Invite manually via email and sms Negative","","My Network: [FNN-620] Invite manually via email and sms Negative","should invite manually via email without last name","should invite manually via email without last name",""
"failed","Sat Apr 06 07:11:22 UTC 2024","Sat Apr 06 07:13:14 UTC 2024","112743","","My Transactions: [FNN-1430] Milestones project: In retrospect. Positive","","My Transactions: [FNN-1430] Milestones project: In retrospect. Positive","""before all"" hook for [FNN-1430] Milestones project: In retrospect. Positive","""before all"" hook for [FNN-1430] Milestones project: In retrospect. Positive",""
"passed","Sat Apr 06 06:50:25 UTC 2024","Sat Apr 06 06:50:55 UTC 2024","30172","","CR: [FNN-1779] My Dashboard page integrity as Employer","","CR: [FNN-1779] My Dashboard page integrity as Employer","should verify the integrity of the My Dashboard page as employer","should verify the integrity of the My Dashboard page as employer",""
"passed","Sat Apr 06 07:11:47 UTC 2024","Sat Apr 06 07:12:16 UTC 2024","28741","","[FNN-743] Archive and restore message","","[FNN-743] Archive and restore message","should restore the message","should restore the message",""
"passed","Sat Apr 06 06:24:19 UTC 2024","Sat Apr 06 06:24:36 UTC 2024","17232","","Post Project: [FNN-649] Post project with account Negative","","Post Project: [FNN-649] Post project with account Negative","should post project without Start date","should post project without Start date",""
"failed","Sat Apr 06 07:11:29 UTC 2024","Sat Apr 06 07:12:21 UTC 2024","52058","","My Network: [FNN-664] Invite freelancer","","My Network: [FNN-664] Invite freelancer","should check network as sender user","should check network as sender user",""
"passed","Sat Apr 06 07:08:23 UTC 2024","Sat Apr 06 07:08:34 UTC 2024","11269","","Create Profile: [FNN-684] Create profile Negative","","Create Profile: [FNN-684] Create profile Negative","should create profile without City","should create profile without City",""
"passed","Sat Apr 06 06:36:29 UTC 2024","Sat Apr 06 06:38:20 UTC 2024","111404","","My Projects: [FNN-1093] Pause project","","My Projects: [FNN-1093] Pause project","should verify status of the project as unregistered user","should verify status of the project as unregistered user",""
"passed","Sat Apr 06 06:57:33 UTC 2024","Sat Apr 06 06:59:15 UTC 2024","101073","","My Profile: [FNN-699] Request reference Positive","","My Profile: [FNN-699] Request reference Positive","should add experience and request reference","should add experience and request reference",""
"failed","Sat Apr 06 07:14:21 UTC 2024","Sat Apr 06 07:16:06 UTC 2024","105465","","My Transactions: [FNN-737] Hourly project: Start project. Negative","","My Transactions: [FNN-737] Hourly project: Start project. Negative","""before all"" hook for [FNN-737] Hourly project: Start project. Negative","""before all"" hook for [FNN-737] Hourly project: Start project. Negative",""
"passed","Sat Apr 06 07:01:22 UTC 2024","Sat Apr 06 07:01:40 UTC 2024","17983","","Post Project: [FNN-588] Post project without account Negative","","Post Project: [FNN-588] Post project without account Negative","should post project without last name","should post project without last name",""
"passed","Sat Apr 06 06:52:16 UTC 2024","Sat Apr 06 06:52:19 UTC 2024","2928","","My Profile: [FNN-668] Edit account details Negative","","My Profile: [FNN-668] Edit account details Negative","should edit account details without sector","should edit account details without sector",""
"passed","Sat Apr 06 07:06:22 UTC 2024","Sat Apr 06 07:06:49 UTC 2024","26474","","Search Project: [FNN-568] Project search","","Search Project: [FNN-568] Project search","should filter projects by Fixed price","should filter projects by Fixed price",""
"passed","Sat Apr 06 06:23:03 UTC 2024","Sat Apr 06 06:24:17 UTC 2024","74195","","Settings: [FNN-671] Change email address Positive","","Settings: [FNN-671] Change email address Positive","should change email address with valid credentials","should change email address with valid credentials",""
"passed","Sat Apr 06 06:49:57 UTC 2024","Sat Apr 06 06:50:03 UTC 2024","5572","","CR: [FNN-751] Invite to the organization manually Negative","","CR: [FNN-751] Invite to the organization manually Negative","should invite manually via email with wrong email format","should invite manually via email with wrong email format",""
"passed","Sat Apr 06 07:08:59 UTC 2024","Sat Apr 06 07:09:09 UTC 2024","9998","","Create Profile: [FNN-684] Create profile Negative","","Create Profile: [FNN-684] Create profile Negative","should create profile without Profile picture","should create profile without Profile picture",""
"passed","Sat Apr 06 07:01:40 UTC 2024","Sat Apr 06 07:01:59 UTC 2024","18845","","Post Project: [FNN-588] Post project without account Negative","","Post Project: [FNN-588] Post project without account Negative","should post project without email","should post project without email",""
"failed","Sat Apr 06 07:13:24 UTC 2024","Sat Apr 06 07:15:08 UTC 2024","104277","","My Transactions: [FNN-708] Hourly project: In advance. Positive","","My Transactions: [FNN-708] Hourly project: In advance. Positive","""before all"" hook for [FNN-708] Hourly project: In advance. Positive","""before all"" hook for [FNN-708] Hourly project: In advance. Positive",""
"broken","Sat Apr 06 07:09:53 UTC 2024","Sat Apr 06 07:11:13 UTC 2024","80752","","[FNN-813] Change language","","[FNN-813] Change language","should change language to Dutch from the footer","should change language to Dutch from the footer",""
"passed","Sat Apr 06 07:01:59 UTC 2024","Sat Apr 06 07:02:20 UTC 2024","21547","","Post Project: [FNN-588] Post project without account Negative","","Post Project: [FNN-588] Post project without account Negative","should post project with wrong email","should post project with wrong email",""
"passed","Sat Apr 06 06:06:46 UTC 2024","Sat Apr 06 06:07:34 UTC 2024","48568","","Login: [FNN-563] Log in from the header Negative","","Login: [FNN-563] Log in from the header Negative","should log in with valid email and invalid password","should log in with valid email and invalid password",""
"passed","Sat Apr 06 06:26:52 UTC 2024","Sat Apr 06 06:27:15 UTC 2024","22583","","Settings: [FNN-675] Change password Negative","","Settings: [FNN-675] Change password Negative","should change password with invalid repeat new password","should change password with invalid repeat new password",""
"passed","Sat Apr 06 06:50:38 UTC 2024","Sat Apr 06 06:50:54 UTC 2024","16049","","CR: [FNN-744] CR Subscribe Negative","","CR: [FNN-744] CR Subscribe Negative","should subscribe as CR with taken email","should subscribe as CR with taken email",""
