"Status","Start Time","Stop Time","Duration in ms","Parent Suite","Suite","Sub Suite","Test Class","Test Method","Name","Description"
"broken","Sat Apr 06 06:56:36 UTC 2024","Sat Apr 06 06:57:17 UTC 2024","40396","","Upgrade: [FNN-659] Upgrade account Negative","","Upgrade: [FNN-659] Upgrade account Negative","should upgrade account to Standard 1 month: Incorrect CVC decline","should upgrade account to Standard 1 month: Incorrect CVC decline",""
"passed","Sat Apr 06 06:10:04 UTC 2024","Sat Apr 06 06:10:17 UTC 2024","12572","","Subscribe: [FNN-577] Subscribe Negative","","Subscribe: [FNN-577] Subscribe Negative","should subscribe without email","should subscribe without email",""
"passed","Sat Apr 06 06:07:27 UTC 2024","Sat Apr 06 06:07:58 UTC 2024","30426","","Login: [FNN-574] Log in from the Login page Negative","","Login: [FNN-574] Log in from the Login page Negative","should log in without credentials","should log in without credentials",""
"passed","Sat Apr 06 06:45:58 UTC 2024","Sat Apr 06 06:46:23 UTC 2024","24195","","Freelancer search: [FNN-924] Freelancer search as CR user","","Freelancer search: [FNN-924] Freelancer search as CR user","should filter freelancers by Minimum references","should filter freelancers by Minimum references",""
"passed","Sat Apr 06 06:07:46 UTC 2024","Sat Apr 06 06:08:56 UTC 2024","70468","","Login: [FNN-685] Log out","","Login: [FNN-685] Log out","should log out","should log out",""
"passed","Sat Apr 06 06:17:46 UTC 2024","Sat Apr 06 06:18:19 UTC 2024","32475","","My Profile: [FNN-718] Add portfolio Negative","","My Profile: [FNN-718] Add portfolio Negative","should add portfolio without Type","should add portfolio without Type",""
"broken","Sat Apr 06 06:57:17 UTC 2024","Sat Apr 06 06:58:02 UTC 2024","44982","","Upgrade: [FNN-659] Upgrade account Negative","","Upgrade: [FNN-659] Upgrade account Negative","should upgrade account to Standard 1 month: Processing error decline","should upgrade account to Standard 1 month: Processing error decline",""
"passed","Sat Apr 06 06:38:58 UTC 2024","Sat Apr 06 06:39:13 UTC 2024","15135","","Freelancer search: [FNN-817] Add note","","Freelancer search: [FNN-817] Add note","should add a note via the action ""Add note""","should add a note via the action ""Add note""",""
"passed","Sat Apr 06 07:04:40 UTC 2024","Sat Apr 06 07:05:00 UTC 2024","19540","","Post Project: [FNN-588] Post project without account Negative","","Post Project: [FNN-588] Post project without account Negative","should post project without repeat password","should post project without repeat password",""
"passed","Sat Apr 06 06:33:45 UTC 2024","Sat Apr 06 06:33:47 UTC 2024","2027","","My Network: [FNN-620] Invite manually via email and sms Negative","","My Network: [FNN-620] Invite manually via email and sms Negative","should invite manually via email without data","should invite manually via email without data",""
"passed","Sat Apr 06 06:25:13 UTC 2024","Sat Apr 06 06:25:26 UTC 2024","13940","","Settings: [FNN-672] Change email address Negative","","Settings: [FNN-672] Change email address Negative","should change email address with invalid email format","should change email address with invalid email format",""
"passed","Sat Apr 06 06:52:24 UTC 2024","Sat Apr 06 06:52:36 UTC 2024","11877","","CR: [FNN-744] CR Subscribe Negative","","CR: [FNN-744] CR Subscribe Negative","should subscribe as CR without agreeing to the Terms and Conditions","should subscribe as CR without agreeing to the Terms and Conditions",""
"passed","Sat Apr 06 06:53:38 UTC 2024","Sat Apr 06 06:54:52 UTC 2024","73690","","Post Project: [FNN-587] Post project with account Positive","","Post Project: [FNN-587] Post project with account Positive","should post a project as a registered user with valid project data","should post a project as a registered user with valid project data",""
"passed","Sat Apr 06 07:03:56 UTC 2024","Sat Apr 06 07:05:58 UTC 2024","122103","","Search Project: [FNN-568] Project search","","Search Project: [FNN-568] Project search","should filter projects by Category","should filter projects by Category",""
"passed","Sat Apr 06 06:51:19 UTC 2024","Sat Apr 06 06:51:34 UTC 2024","14926","","CR: [FNN-744] CR Subscribe Negative","","CR: [FNN-744] CR Subscribe Negative","should subscribe as CR with taken phone number","should subscribe as CR with taken phone number",""
"passed","Sat Apr 06 07:04:08 UTC 2024","Sat Apr 06 07:04:52 UTC 2024","43727","","My Network: [FNN-1233] Invite manually via email without custom message with signup bonus","","My Network: [FNN-1233] Invite manually via email without custom message with signup bonus","should check My Dashboard and My Transactions page for the signup bonus as the inviter user","should check My Dashboard and My Transactions page for the signup bonus as the inviter user",""
"passed","Sat Apr 06 06:59:10 UTC 2024","Sat Apr 06 06:59:29 UTC 2024","19347","","My Profile: [FNN-730] Request reference Negative","","My Profile: [FNN-730] Request reference Negative","should pass step 3 without 1 rating","should pass step 3 without 1 rating",""
"passed","Sat Apr 06 06:50:12 UTC 2024","Sat Apr 06 06:50:47 UTC 2024","34946","","CR: [FNN-751] Invite to the organization manually Negative","","CR: [FNN-751] Invite to the organization manually Negative","should invite manually to the organization without role","should invite manually to the organization without role",""
"passed","Sat Apr 06 07:02:24 UTC 2024","Sat Apr 06 07:03:16 UTC 2024","51413","","My Network: [FNN-619] Invite manually via sms with signup bonus","","My Network: [FNN-619] Invite manually via sms with signup bonus","should invite manually via sms with valid recipient details","should invite manually via sms with valid recipient details",""
"passed","Sat Apr 06 06:26:35 UTC 2024","Sat Apr 06 06:26:52 UTC 2024","17053","","Settings: [FNN-675] Change password Negative","","Settings: [FNN-675] Change password Negative","should change password with short new password","should change password with short new password",""
"passed","Sat Apr 06 06:56:29 UTC 2024","Sat Apr 06 06:56:34 UTC 2024","4935","","My Profile: [FNN-719] Add resume Negative","","My Profile: [FNN-719] Add resume Negative","should add certificate without organization","should add certificate without organization",""
"passed","Sat Apr 06 06:51:34 UTC 2024","Sat Apr 06 06:51:47 UTC 2024","12586","","CR: [FNN-744] CR Subscribe Negative","","CR: [FNN-744] CR Subscribe Negative","should subscribe as CR without password","should subscribe as CR without password",""
"passed","Sat Apr 06 06:56:46 UTC 2024","Sat Apr 06 06:56:51 UTC 2024","4724","","My Profile: [FNN-719] Add resume Negative","","My Profile: [FNN-719] Add resume Negative","should add language without speaking level","should add language without speaking level",""
"passed","Sat Apr 06 06:35:58 UTC 2024","Sat Apr 06 06:38:05 UTC 2024","127583","","Freelancer search: [FNN-816] Create list Functionality","","Freelancer search: [FNN-816] Create list Functionality","should create a list of freelancers","should create a list of freelancers",""
"failed","Sat Apr 06 07:03:20 UTC 2024","Sat Apr 06 07:04:01 UTC 2024","40226","","Post Project: [FNN-588] Post project without account Negative","","Post Project: [FNN-588] Post project without account Negative","should post project with taken phone number","should post project with taken phone number",""
"failed","Sat Apr 06 07:00:47 UTC 2024","Sat Apr 06 07:01:13 UTC 2024","25789","","Post Project: [FNN-650] Post project without account Positive","","Post Project: [FNN-650] Post project without account Positive","should verify that the project informations is correct","should verify that the project informations is correct",""
"passed","Sat Apr 06 06:06:41 UTC 2024","Sat Apr 06 06:07:40 UTC 2024","58530","","Login: [FNN-648] Log in from the Login page Positive","","Login: [FNN-648] Log in from the Login page Positive","should log in with valid credentials","should log in with valid credentials",""
"passed","Sat Apr 06 06:59:50 UTC 2024","Sat Apr 06 07:00:01 UTC 2024","10848","","My Profile: [FNN-730] Request reference Negative","","My Profile: [FNN-730] Request reference Negative","should pass step 3 without 4 rating","should pass step 3 without 4 rating",""
"passed","Sat Apr 06 06:09:54 UTC 2024","Sat Apr 06 06:10:04 UTC 2024","9818","","Subscribe: [FNN-577] Subscribe Negative","","Subscribe: [FNN-577] Subscribe Negative","should subscribe without last name","should subscribe without last name",""
"passed","Sat Apr 06 06:10:27 UTC 2024","Sat Apr 06 06:10:41 UTC 2024","14016","","Subscribe: [FNN-577] Subscribe Negative","","Subscribe: [FNN-577] Subscribe Negative","should subscribe with taken email","should subscribe with taken email",""
"passed","Sat Apr 06 07:04:01 UTC 2024","Sat Apr 06 07:04:21 UTC 2024","20557","","Post Project: [FNN-588] Post project without account Negative","","Post Project: [FNN-588] Post project without account Negative","should post project with wrong phone number","should post project with wrong phone number",""
"passed","Sat Apr 06 06:54:04 UTC 2024","Sat Apr 06 06:54:07 UTC 2024","2825","","My Profile: [FNN-719] Add resume Negative","","My Profile: [FNN-719] Add resume Negative","should add experience without data","should add experience without data",""
"passed","Sat Apr 06 06:50:26 UTC 2024","Sat Apr 06 06:50:38 UTC 2024","12093","","CR: [FNN-744] CR Subscribe Negative","","CR: [FNN-744] CR Subscribe Negative","should subscribe as CR with wrong email format","should subscribe as CR with wrong email format",""
"passed","Sat Apr 06 07:05:23 UTC 2024","Sat Apr 06 07:06:10 UTC 2024","47774","","Post Project: [FNN-588] Post project without account Negative","","Post Project: [FNN-588] Post project without account Negative","should post project without passwords matching","should post project without passwords matching",""
"passed","Sat Apr 06 06:11:55 UTC 2024","Sat Apr 06 06:13:01 UTC 2024","65857","","My Profile: [FNN-690] Add resume Positive","","My Profile: [FNN-690] Add resume Positive","should add CV","should add CV",""
"passed","Sat Apr 06 06:23:19 UTC 2024","Sat Apr 06 06:23:31 UTC 2024","12183","","Post Project: [FNN-649] Post project with account Negative","","Post Project: [FNN-649] Post project with account Negative","should post project without step 2","should post project without step 2",""
"passed","Sat Apr 06 06:58:02 UTC 2024","Sat Apr 06 06:58:10 UTC 2024","8044","","My Profile: [FNN-730] Request reference Negative","","My Profile: [FNN-730] Request reference Negative","should pass step 2 without last name","should pass step 2 without last name",""
"passed","Sat Apr 06 06:23:31 UTC 2024","Sat Apr 06 06:23:45 UTC 2024","14234","","Post Project: [FNN-649] Post project with account Negative","","Post Project: [FNN-649] Post project with account Negative","should post project without Budget","should post project without Budget",""
"passed","Sat Apr 06 07:07:05 UTC 2024","Sat Apr 06 07:07:10 UTC 2024","5134","","Search Project: [FNN-568] Project search","","Search Project: [FNN-568] Project search","should filter projects by Status All projects","should filter projects by Status All projects",""
"broken","Sat Apr 06 07:16:37 UTC 2024","Sat Apr 06 07:16:44 UTC 2024","6866","","CR: [FNN-749] Invite to the organization manually Positive","","CR: [FNN-749] Invite to the organization manually Positive","should accept invitation","should accept invitation",""
"failed","Sat Apr 06 06:16:37 UTC 2024","Sat Apr 06 06:17:16 UTC 2024","38310","","My Profile: [FNN-669] Edit account details Positive","","My Profile: [FNN-669] Edit account details Positive","""before each"" hook for [FNN-669] Edit account details Positive","""before each"" hook for [FNN-669] Edit account details Positive",""
"failed","Sat Apr 06 06:59:15 UTC 2024","Sat Apr 06 06:59:36 UTC 2024","21079","","My Profile: [FNN-699] Request reference Positive","","My Profile: [FNN-699] Request reference Positive","should validate reference","should validate reference",""
"passed","Sat Apr 06 06:07:49 UTC 2024","Sat Apr 06 06:08:18 UTC 2024","28496","","Login: [FNN-563] Log in from the header Negative","","Login: [FNN-563] Log in from the header Negative","should log in without credentials","should log in without credentials",""
"passed","Sat Apr 06 06:44:15 UTC 2024","Sat Apr 06 06:45:58 UTC 2024","102892","","Freelancer search: [FNN-924] Freelancer search as CR user","","Freelancer search: [FNN-924] Freelancer search as CR user","should filter freelancers by Availability","should filter freelancers by Availability",""
"passed","Sat Apr 06 07:06:53 UTC 2024","Sat Apr 06 07:11:00 UTC 2024","247314","","My Network: [FNN-664] Invite freelancer","","My Network: [FNN-664] Invite freelancer","should invite freelancer","should invite freelancer",""
"passed","Sat Apr 06 06:27:45 UTC 2024","Sat Apr 06 06:29:25 UTC 2024","99875","","Settings: [FNN-680] Deactivate profile","","Settings: [FNN-680] Deactivate profile","should deactivate profile","should deactivate profile",""
"failed","Sat Apr 06 06:52:22 UTC 2024","Sat Apr 06 06:52:52 UTC 2024","30175","","My Profile: [FNN-668] Edit account details Negative","","My Profile: [FNN-668] Edit account details Negative","should edit account details with invalid Twitter, LinkedIn and Website urls","should edit account details with invalid Twitter, LinkedIn and Website urls",""
"passed","Sat Apr 06 07:03:09 UTC 2024","Sat Apr 06 07:03:53 UTC 2024","43748","","My Network: [FNN-1232] Invite manually via email with custom message with signup bonus","","My Network: [FNN-1232] Invite manually via email with custom message with signup bonus","should check My Dashboard and My Transactions page for the signup bonus as the inviter user","should check My Dashboard and My Transactions page for the signup bonus as the inviter user",""
"passed","Sat Apr 06 06:23:10 UTC 2024","Sat Apr 06 06:23:19 UTC 2024","9096","","Post Project: [FNN-649] Post project with account Negative","","Post Project: [FNN-649] Post project with account Negative","should post project without Category","should post project without Category",""
"passed","Sat Apr 06 07:07:15 UTC 2024","Sat Apr 06 07:07:25 UTC 2024","9611","","Search Project: [FNN-568] Project search","","Search Project: [FNN-568] Project search","should filter projects by Posted since Last 3 days","should filter projects by Posted since Last 3 days",""
"passed","Sat Apr 06 06:39:41 UTC 2024","Sat Apr 06 06:39:47 UTC 2024","6071","","Freelancer search: [FNN-822] Send message","","Freelancer search: [FNN-822] Send message","should check the message as the CR user","should check the message as the CR user",""
"passed","Sat Apr 06 06:10:41 UTC 2024","Sat Apr 06 06:10:53 UTC 2024","11961","","Subscribe: [FNN-577] Subscribe Negative","","Subscribe: [FNN-577] Subscribe Negative","should subscribe without phone number","should subscribe without phone number",""
"passed","Sat Apr 06 06:55:14 UTC 2024","Sat Apr 06 06:55:21 UTC 2024","7244","","My Profile: [FNN-719] Add resume Negative","","My Profile: [FNN-719] Add resume Negative","should add education without institute","should add education without institute",""
"failed","Sat Apr 06 07:10:18 UTC 2024","Sat Apr 06 07:11:47 UTC 2024","89538","","[FNN-743] Archive and restore message","","[FNN-743] Archive and restore message","""before all"" hook for [FNN-743] Archive and restore message","""before all"" hook for [FNN-743] Archive and restore message",""
"passed","Sat Apr 06 06:13:55 UTC 2024","Sat Apr 06 06:14:02 UTC 2024","6227","","My Profile: [FNN-690] Add resume Positive","","My Profile: [FNN-690] Add resume Positive","should add Expertise","should add Expertise",""
"failed","Sat Apr 06 07:08:56 UTC 2024","Sat Apr 06 07:10:45 UTC 2024","109095","","[FNN-661] Send interest","","[FNN-661] Send interest","""before all"" hook for [FNN-661] Send interest","""before all"" hook for [FNN-661] Send interest",""
"passed","Sat Apr 06 06:34:23 UTC 2024","Sat Apr 06 06:36:29 UTC 2024","126524","","My Projects: [FNN-1093] Pause project","","My Projects: [FNN-1093] Pause project","should pause the project","should pause the project",""
"passed","Sat Apr 06 06:28:43 UTC 2024","Sat Apr 06 06:29:59 UTC 2024","75833","","Settings: [FNN-676] Change profile settings","","Settings: [FNN-676] Change profile settings","i don't want to display my profile in the database","i don't want to display my profile in the database",""
"failed","Sat Apr 06 06:54:38 UTC 2024","Sat Apr 06 06:57:37 UTC 2024","178765","","My Profile: [FNN-669] Edit account details Positive","","My Profile: [FNN-669] Edit account details Positive","should edit employer account details with valid information","should edit employer account details with valid information",""
"passed","Sat Apr 06 07:07:22 UTC 2024","Sat Apr 06 07:08:50 UTC 2024","87857","","Create Profile: [FNN-683] Create profile Positive","","Create Profile: [FNN-683] Create profile Positive","should create profile with valid data","should create profile with valid data",""
"passed","Sat Apr 06 06:26:23 UTC 2024","Sat Apr 06 06:27:51 UTC 2024","88065","","Settings: [FNN-677] Downgrade to ""Stand-by Standaard""","","Settings: [FNN-677] Downgrade to ""Stand-by Standaard""","should downgrade to ""Stand-by Standaard""","should downgrade to ""Stand-by Standaard""",""
"failed","Sat Apr 06 06:55:27 UTC 2024","Sat Apr 06 06:55:53 UTC 2024","26350","","My Profile: [FNN-719] Add resume Negative","","My Profile: [FNN-719] Add resume Negative","should add education without period from","should add education without period from",""
"passed","Sat Apr 06 06:56:34 UTC 2024","Sat Apr 06 06:56:41 UTC 2024","7343","","My Profile: [FNN-719] Add resume Negative","","My Profile: [FNN-719] Add resume Negative","should add certificate without achieved annual","should add certificate without achieved annual",""
"passed","Sat Apr 06 06:49:42 UTC 2024","Sat Apr 06 06:49:53 UTC 2024","10871","","CR: [FNN-744] CR Subscribe Negative","","CR: [FNN-744] CR Subscribe Negative","should subscribe as CR without company name","should subscribe as CR without company name",""
"passed","Sat Apr 06 06:05:27 UTC 2024","Sat Apr 06 06:06:30 UTC 2024","63343","","Login: [FNN-647] Log in from the header Positive","","Login: [FNN-647] Log in from the header Positive","should log in with valid credentials","should log in with valid credentials",""
"broken","Sat Apr 06 06:55:18 UTC 2024","Sat Apr 06 06:56:12 UTC 2024","53744","","Post Project: [FNN-587] Post project with account Positive","","Post Project: [FNN-587] Post project with account Positive","should verify that the user received a project posted letter","should verify that the user received a project posted letter",""
"passed","Sat Apr 06 06:56:19 UTC 2024","Sat Apr 06 06:57:55 UTC 2024","96706","","My Profile: [FNN-730] Request reference Negative","","My Profile: [FNN-730] Request reference Negative","should pass step 2 without data","should pass step 2 without data",""
"passed","Sat Apr 06 06:11:19 UTC 2024","Sat Apr 06 06:11:29 UTC 2024","9921","","Subscribe: [FNN-577] Subscribe Negative","","Subscribe: [FNN-577] Subscribe Negative","should subscribe without password","should subscribe without password",""
"passed","Sat Apr 06 06:56:51 UTC 2024","Sat Apr 06 06:56:55 UTC 2024","3859","","My Profile: [FNN-719] Add resume Negative","","My Profile: [FNN-719] Add resume Negative","should add language without writing level","should add language without writing level",""
"failed","Sat Apr 06 07:13:26 UTC 2024","Sat Apr 06 07:15:12 UTC 2024","106053","","My Transactions: [FNN-710] Milestones project: In advance. Positive","","My Transactions: [FNN-710] Milestones project: In advance. Positive","""before all"" hook for [FNN-710] Milestones project: In advance. Positive","""before all"" hook for [FNN-710] Milestones project: In advance. Positive",""
"broken","Sat Apr 06 06:52:46 UTC 2024","Sat Apr 06 06:54:37 UTC 2024","111671","","Upgrade: [FNN-658] Upgrade account Positive","","Upgrade: [FNN-658] Upgrade account Positive","should upgrade account to Standaard 1 month","should upgrade account to Standaard 1 month",""
"passed","Sat Apr 06 07:15:18 UTC 2024","Sat Apr 06 07:17:01 UTC 2024","103798","","CR: [FNN-750] Invite to the organization through search","","CR: [FNN-750] Invite to the organization through search","should invite freelancer","should invite freelancer",""
"skipped","Sat Apr 06 06:34:55 UTC 2024","Sat Apr 06 06:34:55 UTC 2024","0","","My Network: [FNN-1027] Invite freelancers","","My Network: [FNN-1027] Invite freelancers","should accept an invitation","should accept an invitation",""
"passed","Sat Apr 06 06:48:28 UTC 2024","Sat Apr 06 06:49:42 UTC 2024","73959","","CR: [FNN-744] CR Subscribe Negative","","CR: [FNN-744] CR Subscribe Negative","should subscribe as CR without sector","should subscribe as CR without sector",""
"passed","Sat Apr 06 06:09:44 UTC 2024","Sat Apr 06 06:09:54 UTC 2024","10379","","Subscribe: [FNN-577] Subscribe Negative","","Subscribe: [FNN-577] Subscribe Negative","should subscribe without first name","should subscribe without first name",""
"passed","Sat Apr 06 06:56:23 UTC 2024","Sat Apr 06 06:56:29 UTC 2024","5497","","My Profile: [FNN-719] Add resume Negative","","My Profile: [FNN-719] Add resume Negative","should add certificate without certificate","should add certificate without certificate",""
"passed","Sat Apr 06 07:06:11 UTC 2024","Sat Apr 06 07:06:22 UTC 2024","11506","","Search Project: [FNN-568] Project search","","Search Project: [FNN-568] Project search","should filter projects by Location","should filter projects by Location",""
"passed","Sat Apr 06 06:12:14 UTC 2024","Sat Apr 06 06:12:47 UTC 2024","33200","","Subscribe: [FNN-577] Subscribe Negative","","Subscribe: [FNN-577] Subscribe Negative","should subscribe without data","should subscribe without data",""
"passed","Sat Apr 06 07:02:11 UTC 2024","Sat Apr 06 07:03:09 UTC 2024","58188","","My Network: [FNN-1232] Invite manually via email with custom message with signup bonus","","My Network: [FNN-1232] Invite manually via email with custom message with signup bonus","should subscribe as the freelancer with recipient details and accept the invitation","should subscribe as the freelancer with recipient details and accept the invitation",""
"passed","Sat Apr 06 06:09:22 UTC 2024","Sat Apr 06 06:10:58 UTC 2024","96018","","Reset password: [FNN-656] Reset password Positive","","Reset password: [FNN-656] Reset password Positive","should reset password with valid credentials","should reset password with valid credentials",""
"passed","Sat Apr 06 06:52:13 UTC 2024","Sat Apr 06 06:52:24 UTC 2024","11502","","CR: [FNN-744] CR Subscribe Negative","","CR: [FNN-744] CR Subscribe Negative","should subscribe as CR with invalid repeat password","should subscribe as CR with invalid repeat password",""
"passed","Sat Apr 06 06:13:43 UTC 2024","Sat Apr 06 06:13:49 UTC 2024","5530","","My Profile: [FNN-690] Add resume Positive","","My Profile: [FNN-690] Add resume Positive","should add Motivation","should add Motivation",""
"failed","Sat Apr 06 06:54:52 UTC 2024","Sat Apr 06 06:55:18 UTC 2024","26671","","Post Project: [FNN-587] Post project with account Positive","","Post Project: [FNN-587] Post project with account Positive","should verify that the project informations is correct","should verify that the project informations is correct",""
"broken","Sat Apr 06 06:53:48 UTC 2024","Sat Apr 06 06:54:27 UTC 2024","38805","","Upgrade: [FNN-659] Upgrade account Negative","","Upgrade: [FNN-659] Upgrade account Negative","should upgrade account to Standard 1 month: Insufficient funds decline","should upgrade account to Standard 1 month: Insufficient funds decline",""
"failed","Sat Apr 06 07:01:12 UTC 2024","Sat Apr 06 07:02:11 UTC 2024","58615","","My Network: [FNN-1232] Invite manually via email with custom message with signup bonus","","My Network: [FNN-1232] Invite manually via email with custom message with signup bonus","should invite manually via email with valid recipient data and with message","should invite manually via email with valid recipient data and with message",""
"passed","Sat Apr 06 06:22:05 UTC 2024","Sat Apr 06 06:22:44 UTC 2024","39094","","Post Project: [FNN-649] Post project with account Negative","","Post Project: [FNN-649] Post project with account Negative","should post project without step 1","should post project without step 1",""
"passed","Sat Apr 06 06:43:01 UTC 2024","Sat Apr 06 06:43:24 UTC 2024","22923","","Freelancer search: [FNN-924] Freelancer search as CR user","","Freelancer search: [FNN-924] Freelancer search as CR user","should filter freelancers by Hourly Rate","should filter freelancers by Hourly Rate",""
"broken","Sat Apr 06 07:01:19 UTC 2024","Sat Apr 06 07:02:07 UTC 2024","48078","","Post Project: [FNN-650] Post project without account Positive","","Post Project: [FNN-650] Post project without account Positive","should verify that the user received a project posted letter","should verify that the user received a project posted letter",""
"passed","Sat Apr 06 06:42:10 UTC 2024","Sat Apr 06 06:42:29 UTC 2024","18717","","Freelancer search: [FNN-924] Freelancer search as CR user","","Freelancer search: [FNN-924] Freelancer search as CR user","should filter freelancers by Category","should filter freelancers by Category",""
"passed","Sat Apr 06 06:33:34 UTC 2024","Sat Apr 06 06:33:40 UTC 2024","5575","","My Network: [FNN-620] Invite manually via email and sms Negative","","My Network: [FNN-620] Invite manually via email and sms Negative","should invite manually via email without first name","should invite manually via email without first name",""
