"Status","Start Time","Stop Time","Duration in ms","Parent Suite","Suite","Sub Suite","Test Class","Test Method","Name","Description"
"passed","Fri Oct 27 11:55:40 UTC 2023","Fri Oct 27 11:55:59 UTC 2023","18704","","Create Profile: [FNN-684] Create profile Negative","","Create Profile: [FNN-684] Create profile Negative","should create profile without required fields","should create profile without required fields",""
"passed","Fri Oct 27 11:49:52 UTC 2023","Fri Oct 27 11:49:57 UTC 2023","4496","","My Profile: [FNN-730] Request reference Negative","","My Profile: [FNN-730] Request reference Negative","should pass step 2 with invalid website format","should pass step 2 with invalid website format",""
"broken","Fri Oct 27 11:51:27 UTC 2023","Fri Oct 27 11:52:01 UTC 2023","33814","","Post Project: [FNN-649] Post project with account Negative","","Post Project: [FNN-649] Post project with account Negative","should post project without Budget","should post project without Budget",""
"failed","Fri Oct 27 11:52:49 UTC 2023","Fri Oct 27 11:53:13 UTC 2023","24102","","My Network: [FNN-1233] Invite manually via email without custom message","","My Network: [FNN-1233] Invite manually via email without custom message","""after all"" hook for [FNN-1233] Invite manually via email without custom message","""after all"" hook for [FNN-1233] Invite manually via email without custom message",""
"passed","Fri Oct 27 11:34:13 UTC 2023","Fri Oct 27 11:35:36 UTC 2023","83432","","Freelancer search: [FNN-822] Send message","","Freelancer search: [FNN-822] Send message","should send a message via the ""Send message"" action","should send a message via the ""Send message"" action",""
"failed","Fri Oct 27 11:46:54 UTC 2023","Fri Oct 27 11:47:24 UTC 2023","29789","","My Profile: [FNN-690] Add resume Positive","","My Profile: [FNN-690] Add resume Positive","should check the attached part of the resume on the Profile page","should check the attached part of the resume on the Profile page",""
"passed","Fri Oct 27 11:51:12 UTC 2023","Fri Oct 27 11:51:24 UTC 2023","12445","","Post Project: [FNN-588] Post project without account Negative","","Post Project: [FNN-588] Post project without account Negative","should post project without password","should post project without password",""
"broken","Fri Oct 27 11:43:40 UTC 2023","Fri Oct 27 11:44:05 UTC 2023","25568","","Login: [FNN-574] Log in from the Loing page Negative","","Login: [FNN-574] Log in from the Loing page Negative","""before each"" hook for [FNN-574] Log in from the Loing page Negative","""before each"" hook for [FNN-574] Log in from the Loing page Negative",""
"broken","Fri Oct 27 11:52:18 UTC 2023","Fri Oct 27 11:52:52 UTC 2023","34219","","Post Project: [FNN-649] Post project with account Negative","","Post Project: [FNN-649] Post project with account Negative","should post project without Location","should post project without Location",""
"failed","Fri Oct 27 11:55:48 UTC 2023","Fri Oct 27 11:55:56 UTC 2023","7678","","Search Project: [FNN-568] Project search","","Search Project: [FNN-568] Project search","should filter projects by Posted since Last 7 days","should filter projects by Posted since Last 7 days",""
"passed","Fri Oct 27 11:30:31 UTC 2023","Fri Oct 27 11:30:58 UTC 2023","26684","","My Network: [FNN-620] Invite manually via email and sms Negative","","My Network: [FNN-620] Invite manually via email and sms Negative","should invite manually via sms without data","should invite manually via sms without data",""
"passed","Fri Oct 27 11:43:15 UTC 2023","Fri Oct 27 11:43:18 UTC 2023","2402","","CR: [FNN-751] Invite to the organization manually Negative","","CR: [FNN-751] Invite to the organization manually Negative","should invite manually to the organization without first step","should invite manually to the organization without first step",""
"failed","Fri Oct 27 11:48:14 UTC 2023","Fri Oct 27 11:48:42 UTC 2023","28063","","Post Project: [FNN-587] Post project with account Positive","","Post Project: [FNN-587] Post project with account Positive","""after all"" hook for [FNN-587] Post project with account Positive","""after all"" hook for [FNN-587] Post project with account Positive",""
"passed","Fri Oct 27 11:58:41 UTC 2023","Fri Oct 27 11:58:53 UTC 2023","11375","","Freelancer search: [FNN-924] Freelancer search as CR user","","Freelancer search: [FNN-924] Freelancer search as CR user","should filter freelancers by Minimum rating","should filter freelancers by Minimum rating",""
"passed","Fri Oct 27 11:45:40 UTC 2023","Fri Oct 27 11:45:54 UTC 2023","14085","","My Profile: [FNN-690] Add resume Positive","","My Profile: [FNN-690] Add resume Positive","should add Experience","should add Experience",""
"passed","Fri Oct 27 11:15:03 UTC 2023","Fri Oct 27 11:15:06 UTC 2023","2229","","Login: [FNN-563] Log in from the header Negative","","Login: [FNN-563] Log in from the header Negative","should log in with wrong email format","should log in with wrong email format",""
"passed","Fri Oct 27 11:56:01 UTC 2023","Fri Oct 27 11:58:35 UTC 2023","153766","","Freelancer search: [FNN-846] Invite to project","","Freelancer search: [FNN-846] Invite to project","should invite to a project via the ""Invite to project"" action","should invite to a project via the ""Invite to project"" action",""
"broken","Fri Oct 27 11:47:36 UTC 2023","Fri Oct 27 11:48:14 UTC 2023","38042","","Post Project: [FNN-587] Post project with account Positive","","Post Project: [FNN-587] Post project with account Positive","""before all"" hook for [FNN-587] Post project with account Positive","""before all"" hook for [FNN-587] Post project with account Positive",""
"passed","Fri Oct 27 11:35:36 UTC 2023","Fri Oct 27 11:35:45 UTC 2023","8775","","Freelancer search: [FNN-822] Send message","","Freelancer search: [FNN-822] Send message","should check the message as the CR user","should check the message as the CR user",""
"passed","Fri Oct 27 11:47:32 UTC 2023","Fri Oct 27 11:48:27 UTC 2023","55547","","Post Project: [FNN-588] Post project without account Negative","","Post Project: [FNN-588] Post project without account Negative","should post project without acount data","should post project without acount data",""
"broken","Fri Oct 27 11:43:52 UTC 2023","Fri Oct 27 11:44:32 UTC 2023","39606","","Upgrade: [FNN-659] Upgrade account Negative","","Upgrade: [FNN-659] Upgrade account Negative","""before each"" hook for [FNN-659] Upgrade account Negative","""before each"" hook for [FNN-659] Upgrade account Negative",""
"passed","Fri Oct 27 11:30:18 UTC 2023","Fri Oct 27 11:30:21 UTC 2023","3476","","My Network: [FNN-620] Invite manually via email and sms Negative","","My Network: [FNN-620] Invite manually via email and sms Negative","should invite manually via email without data","should invite manually via email without data",""
"passed","Fri Oct 27 11:16:57 UTC 2023","Fri Oct 27 11:17:03 UTC 2023","5767","","My Profile: [FNN-668] Edit account details Negative","","My Profile: [FNN-668] Edit account details Negative","should edit account details without sector","should edit account details without sector",""
"passed","Fri Oct 27 11:52:52 UTC 2023","Fri Oct 27 11:53:08 UTC 2023","16453","","Post Project: [FNN-649] Post project with account Negative","","Post Project: [FNN-649] Post project with account Negative","should post project without Start date","should post project without Start date",""
"broken","Fri Oct 27 11:38:16 UTC 2023","Fri Oct 27 11:38:44 UTC 2023","28112","","Freelancer search: [FNN-924] Freelancer search as CR user","","Freelancer search: [FNN-924] Freelancer search as CR user","should filter freelancers by Category","should filter freelancers by Category",""
"passed","Fri Oct 27 11:50:26 UTC 2023","Fri Oct 27 11:50:31 UTC 2023","5375","","My Profile: [FNN-730] Request reference Negative","","My Profile: [FNN-730] Request reference Negative","should pass step 3 without 2 rating","should pass step 3 without 2 rating",""
"passed","Fri Oct 27 11:16:36 UTC 2023","Fri Oct 27 11:16:46 UTC 2023","10322","","Subscribe: [FNN-577] Subscribe Negative","","Subscribe: [FNN-577] Subscribe Negative","should subscribe with taken phone number","should subscribe with taken phone number",""
"failed","Fri Oct 27 11:23:49 UTC 2023","Fri Oct 27 11:24:18 UTC 2023","28805","","My Profile: [FNN-719] Add resume Negative","","My Profile: [FNN-719] Add resume Negative","""after all"" hook for [FNN-719] Add resume Negative","""after all"" hook for [FNN-719] Add resume Negative",""
"passed","Fri Oct 27 11:35:56 UTC 2023","Fri Oct 27 11:36:47 UTC 2023","51125","","Freelancer search: [FNN-817] Add note","","Freelancer search: [FNN-817] Add note","should add note from the notes popup","should add note from the notes popup",""
"passed","Fri Oct 27 11:24:50 UTC 2023","Fri Oct 27 11:25:00 UTC 2023","9485","","Settings: [FNN-672] Change email address Negative","","Settings: [FNN-672] Change email address Negative","should change email address with invalid email format","should change email address with invalid email format",""
"passed","Fri Oct 27 11:45:54 UTC 2023","Fri Oct 27 11:46:07 UTC 2023","12458","","My Profile: [FNN-690] Add resume Positive","","My Profile: [FNN-690] Add resume Positive","should add Education","should add Education",""
"passed","Fri Oct 27 11:44:05 UTC 2023","Fri Oct 27 11:44:27 UTC 2023","21947","","Login: [FNN-574] Log in from the Loing page Negative","","Login: [FNN-574] Log in from the Loing page Negative","should log in without credentials","should log in without credentials",""
"passed","Fri Oct 27 11:42:29 UTC 2023","Fri Oct 27 11:42:59 UTC 2023","29766","","Freelancer search: [FNN-924] Freelancer search as CR user","","Freelancer search: [FNN-924] Freelancer search as CR user","should filter freelancers by Minimum references","should filter freelancers by Minimum references",""
"passed","Fri Oct 27 11:35:38 UTC 2023","Fri Oct 27 11:38:16 UTC 2023","157767","","Freelancer search: [FNN-924] Freelancer search as CR user","","Freelancer search: [FNN-924] Freelancer search as CR user","should filter freelancers by Terms","should filter freelancers by Terms",""
"passed","Fri Oct 27 11:48:27 UTC 2023","Fri Oct 27 11:48:41 UTC 2023","13961","","Post Project: [FNN-588] Post project without account Negative","","Post Project: [FNN-588] Post project without account Negative","should post project without first name","should post project without first name",""
"failed","Fri Oct 27 11:56:42 UTC 2023","Fri Oct 27 11:57:44 UTC 2023","62079","","Create Profile: [FNN-684] Create profile Negative","","Create Profile: [FNN-684] Create profile Negative","should create profile with short Description of yourself","should create profile with short Description of yourself",""
"passed","Fri Oct 27 11:55:59 UTC 2023","Fri Oct 27 11:56:09 UTC 2023","9697","","Create Profile: [FNN-684] Create profile Negative","","Create Profile: [FNN-684] Create profile Negative","should create profile without City","should create profile without City",""
"passed","Fri Oct 27 11:57:47 UTC 2023","Fri Oct 27 11:58:43 UTC 2023","55909","","[FNN-813] Change language","","[FNN-813] Change language","should change language to English from the footer","should change language to English from the footer",""
"passed","Fri Oct 27 11:56:09 UTC 2023","Fri Oct 27 11:56:23 UTC 2023","14169","","Create Profile: [FNN-684] Create profile Negative","","Create Profile: [FNN-684] Create profile Negative","should create profile with wrong website","should create profile with wrong website",""
"passed","Fri Oct 27 11:42:06 UTC 2023","Fri Oct 27 11:42:15 UTC 2023","9713","","CR: [FNN-744] CR Subscribe Negative","","CR: [FNN-744] CR Subscribe Negative","should subscribe as CR with wrong email format","should subscribe as CR with wrong email format",""
"passed","Fri Oct 27 11:40:42 UTC 2023","Fri Oct 27 11:41:31 UTC 2023","48540","","CR: [FNN-744] CR Subscribe Negative","","CR: [FNN-744] CR Subscribe Negative","should subscribe as CR without sector","should subscribe as CR without sector",""
"passed","Fri Oct 27 11:17:26 UTC 2023","Fri Oct 27 11:17:34 UTC 2023","8157","","Subscribe: [FNN-577] Subscribe Negative","","Subscribe: [FNN-577] Subscribe Negative","should subscribe without agreeing to the Terms and Conditions","should subscribe without agreeing to the Terms and Conditions",""
"passed","Fri Oct 27 11:51:07 UTC 2023","Fri Oct 27 11:51:15 UTC 2023","8455","","Post Project: [FNN-649] Post project with account Negative","","Post Project: [FNN-649] Post project with account Negative","should post project without Category","should post project without Category",""
"passed","Fri Oct 27 11:25:00 UTC 2023","Fri Oct 27 11:25:36 UTC 2023","36098","","Settings: [FNN-672] Change email address Negative","","Settings: [FNN-672] Change email address Negative","should change email address with wrong password","should change email address with wrong password",""
"passed","Fri Oct 27 11:44:46 UTC 2023","Fri Oct 27 11:45:40 UTC 2023","54087","","My Profile: [FNN-690] Add resume Positive","","My Profile: [FNN-690] Add resume Positive","should add CV","should add CV",""
"passed","Fri Oct 27 11:42:15 UTC 2023","Fri Oct 27 11:42:29 UTC 2023","13468","","CR: [FNN-744] CR Subscribe Negative","","CR: [FNN-744] CR Subscribe Negative","should subscribe as CR with taken email","should subscribe as CR with taken email",""
"passed","Fri Oct 27 11:31:58 UTC 2023","Fri Oct 27 11:32:14 UTC 2023","15465","","My Projects: [FNN-1093] Pause project","","My Projects: [FNN-1093] Pause project","should verify status of the project as unregistered user","should verify status of the project as unregistered user",""
"passed","Fri Oct 27 11:47:57 UTC 2023","Fri Oct 27 11:48:40 UTC 2023","42531","","My Profile: [FNN-719] Add resume Negative","","My Profile: [FNN-719] Add resume Negative","should add CV without CV","should add CV without CV",""
"passed","Fri Oct 27 11:41:56 UTC 2023","Fri Oct 27 11:42:06 UTC 2023","9360","","CR: [FNN-744] CR Subscribe Negative","","CR: [FNN-744] CR Subscribe Negative","should subscribe as CR without email","should subscribe as CR without email",""
"passed","Fri Oct 27 11:14:38 UTC 2023","Fri Oct 27 11:15:29 UTC 2023","50314","","Subscribe: [FNN-577] Subscribe Negative","","Subscribe: [FNN-577] Subscribe Negative","should subscribe without category","should subscribe without category",""
"failed","Fri Oct 27 11:49:14 UTC 2023","Fri Oct 27 11:49:39 UTC 2023","24639","","My Profile: [FNN-719] Add resume Negative","","My Profile: [FNN-719] Add resume Negative","should add education without data","should add education without data",""
"passed","Fri Oct 27 11:54:31 UTC 2023","Fri Oct 27 11:54:41 UTC 2023","9952","","Search Project: [FNN-568] Project search","","Search Project: [FNN-568] Project search","should filter projects by Search terms","should filter projects by Search terms",""
"broken","Fri Oct 27 11:33:01 UTC 2023","Fri Oct 27 11:33:25 UTC 2023","23600","","My Network: [FNN-664] Invite freelancer","","My Network: [FNN-664] Invite freelancer","should accept an invitation","should accept an invitation",""
"passed","Fri Oct 27 11:44:13 UTC 2023","Fri Oct 27 11:45:39 UTC 2023","86483","","My Profile: [FNN-695] Add portfolio Positive","","My Profile: [FNN-695] Add portfolio Positive","should add portfolio","should add portfolio",""
"passed","Fri Oct 27 11:43:00 UTC 2023","Fri Oct 27 11:43:47 UTC 2023","47626","","CR: [FNN-749] Invite to the organization manually Positive","","CR: [FNN-749] Invite to the organization manually Positive","should check organization page as the inviting user","should check organization page as the inviting user",""
"failed","Fri Oct 27 11:52:39 UTC 2023","Fri Oct 27 11:53:47 UTC 2023","67949","","My Network: [FNN-1027] Invite freelancers","","My Network: [FNN-1027] Invite freelancers","""before all"" hook for [FNN-1027] Invite freelancers","""before all"" hook for [FNN-1027] Invite freelancers",""
"passed","Fri Oct 27 11:55:27 UTC 2023","Fri Oct 27 11:55:32 UTC 2023","4861","","Search Project: [FNN-568] Project search","","Search Project: [FNN-568] Project search","should filter projects by Status All projects","should filter projects by Status All projects",""
"passed","Fri Oct 27 11:46:19 UTC 2023","Fri Oct 27 11:46:28 UTC 2023","9794","","My Profile: [FNN-690] Add resume Positive","","My Profile: [FNN-690] Add resume Positive","should add Motivation","should add Motivation",""
"passed","Fri Oct 27 11:35:41 UTC 2023","Fri Oct 27 11:35:56 UTC 2023","15021","","Freelancer search: [FNN-817] Add note","","Freelancer search: [FNN-817] Add note","should add a note via the action ""Add note""","should add a note via the action ""Add note""",""
"passed","Fri Oct 27 11:50:00 UTC 2023","Fri Oct 27 11:50:12 UTC 2023","11882","","Post Project: [FNN-588] Post project without account Negative","","Post Project: [FNN-588] Post project without account Negative","should post project without phone number","should post project without phone number",""
"passed","Fri Oct 27 11:16:11 UTC 2023","Fri Oct 27 11:16:19 UTC 2023","8149","","Subscribe: [FNN-577] Subscribe Negative","","Subscribe: [FNN-577] Subscribe Negative","should subscribe with taken email","should subscribe with taken email",""
"passed","Fri Oct 27 11:48:40 UTC 2023","Fri Oct 27 11:48:43 UTC 2023","3191","","My Profile: [FNN-719] Add resume Negative","","My Profile: [FNN-719] Add resume Negative","should add experience without data","should add experience without data",""
"broken","Fri Oct 27 11:51:39 UTC 2023","Fri Oct 27 11:52:08 UTC 2023","28637","","My Network: [FNN-1232] Invite manually via email with custom message","","My Network: [FNN-1232] Invite manually via email with custom message","""after each"" hook for [FNN-1232] Invite manually via email with custom message","""after each"" hook for [FNN-1232] Invite manually via email with custom message",""
"passed","Fri Oct 27 11:17:34 UTC 2023","Fri Oct 27 11:18:05 UTC 2023","30548","","Subscribe: [FNN-577] Subscribe Negative","","Subscribe: [FNN-577] Subscribe Negative","should subscribe without data","should subscribe without data",""
"passed","Fri Oct 27 11:17:06 UTC 2023","Fri Oct 27 11:17:17 UTC 2023","10753","","Subscribe: [FNN-577] Subscribe Negative","","Subscribe: [FNN-577] Subscribe Negative","should subscribe with short password","should subscribe with short password",""
"passed","Fri Oct 27 11:57:04 UTC 2023","Fri Oct 27 11:57:51 UTC 2023","47672","","Freelancer search: [FNN-815] Freelancer search as non-CR user","","Freelancer search: [FNN-815] Freelancer search as non-CR user","should filter freelancers by Skills","should filter freelancers by Skills",""
"passed","Fri Oct 27 11:27:43 UTC 2023","Fri Oct 27 11:28:52 UTC 2023","69123","","Settings: [FNN-676] Change profile settings","","Settings: [FNN-676] Change profile settings","i don't want to display my profile in the database","i don't want to display my profile in the database",""
"passed","Fri Oct 27 11:14:37 UTC 2023","Fri Oct 27 11:15:01 UTC 2023","23420","","Login: [FNN-563] Log in from the header Negative","","Login: [FNN-563] Log in from the header Negative","should log in with valid email and invalid password","should log in with valid email and invalid password",""
"passed","Fri Oct 27 11:15:07 UTC 2023","Fri Oct 27 11:15:10 UTC 2023","2454","","Login: [FNN-563] Log in from the header Negative","","Login: [FNN-563] Log in from the header Negative","should log in without password","should log in without password",""
"passed","Fri Oct 27 11:48:57 UTC 2023","Fri Oct 27 11:49:13 UTC 2023","15710","","Post Project: [FNN-588] Post project without account Negative","","Post Project: [FNN-588] Post project without account Negative","should post project without email","should post project without email",""
"broken","Fri Oct 27 11:57:23 UTC 2023","Fri Oct 27 11:58:58 UTC 2023","94460","","[FNN-667] Send contact","","[FNN-667] Send contact","should send a contact","should send a contact",""
"passed","Fri Oct 27 11:58:58 UTC 2023","Fri Oct 27 11:59:29 UTC 2023","31641","","[FNN-667] Send contact","","[FNN-667] Send contact","should check the contact as the second user","should check the contact as the second user",""
"failed","Fri Oct 27 11:49:48 UTC 2023","Fri Oct 27 11:50:12 UTC 2023","24014","","My Profile: [FNN-719] Add resume Negative","","My Profile: [FNN-719] Add resume Negative","should add education without period from","should add education without period from",""
