"Status","Start Time","Stop Time","Duration in ms","Parent Suite","Suite","Sub Suite","Test Class","Test Method","Name","Description"
"passed","Tue Oct 24 04:35:39 UTC 2023","Tue Oct 24 04:35:46 UTC 2023","7495","","CR: [FNN-744] CR Subscribe Negative","","CR: [FNN-744] CR Subscribe Negative","should subscribe as CR with wrong email format","should subscribe as CR with wrong email format",""
"passed","Tue Oct 24 04:22:44 UTC 2023","Tue Oct 24 04:22:48 UTC 2023","4299","","My Network: [FNN-620] Invite manually via email and sms Negative","","My Network: [FNN-620] Invite manually via email and sms Negative","should invite manually via email without last name","should invite manually via email without last name",""
"passed","Tue Oct 24 04:07:54 UTC 2023","Tue Oct 24 04:07:56 UTC 2023","2054","","Login: [FNN-574] Log in from the Loing page Negative","","Login: [FNN-574] Log in from the Loing page Negative","should log in without email","should log in without email",""
"passed","Tue Oct 24 04:13:26 UTC 2023","Tue Oct 24 04:13:42 UTC 2023","16194","","My Profile: [FNN-699] Request reference Positive","","My Profile: [FNN-699] Request reference Positive","should validate reference","should validate reference",""
"passed","Tue Oct 24 04:07:24 UTC 2023","Tue Oct 24 04:07:48 UTC 2023","24343","","Login: [FNN-574] Log in from the Loing page Negative","","Login: [FNN-574] Log in from the Loing page Negative","should log in with valid email and invalid password","should log in with valid email and invalid password",""
"passed","Tue Oct 24 04:09:38 UTC 2023","Tue Oct 24 04:11:17 UTC 2023","98844","","My Profile: [FNN-669] Edit account details Positive","","My Profile: [FNN-669] Edit account details Positive","should edit freelancer account details with valid information","should edit freelancer account details with valid information",""
"passed","Tue Oct 24 04:27:18 UTC 2023","Tue Oct 24 04:27:28 UTC 2023","10165","","My Projects: [FNN-1058] Complete project Negative","","My Projects: [FNN-1058] Complete project Negative","should complete project with short Comments","should complete project with short Comments",""
"passed","Tue Oct 24 04:45:16 UTC 2023","Tue Oct 24 04:45:29 UTC 2023","13456","","Search Project: [FNN-568] Project search","","Search Project: [FNN-568] Project search","should filter projects by Hourly rate","should filter projects by Hourly rate",""
"failed","Tue Oct 24 04:40:56 UTC 2023","Tue Oct 24 04:41:22 UTC 2023","26054","","My Profile: [FNN-719] Add resume Negative","","My Profile: [FNN-719] Add resume Negative","should add education without period to","should add education without period to",""
"passed","Tue Oct 24 04:06:40 UTC 2023","Tue Oct 24 04:07:13 UTC 2023","33274","","Login: [FNN-647] Log in from the header Positive","","Login: [FNN-647] Log in from the header Positive","should log in with valid credentials","should log in with valid credentials",""
"passed","Tue Oct 24 04:31:26 UTC 2023","Tue Oct 24 04:32:15 UTC 2023","48282","","Freelancer search: [FNN-924] Freelancer search as CR user","","Freelancer search: [FNN-924] Freelancer search as CR user","should filter freelancers by Location","should filter freelancers by Location",""
"passed","Tue Oct 24 04:26:28 UTC 2023","Tue Oct 24 04:26:34 UTC 2023","5874","","My Projects: [FNN-1058] Complete project Negative","","My Projects: [FNN-1058] Complete project Negative","should complete project without profile picture","should complete project without profile picture",""
"passed","Tue Oct 24 04:24:25 UTC 2023","Tue Oct 24 04:25:06 UTC 2023","41199","","My Projects: [FNN-1093] Pause project","","My Projects: [FNN-1093] Pause project","should verify status of the project as unregistered user","should verify status of the project as unregistered user",""
"passed","Tue Oct 24 04:32:15 UTC 2023","Tue Oct 24 04:32:46 UTC 2023","30808","","Freelancer search: [FNN-924] Freelancer search as CR user","","Freelancer search: [FNN-924] Freelancer search as CR user","should filter freelancers by Hourly Rate","should filter freelancers by Hourly Rate",""
"passed","Tue Oct 24 04:12:41 UTC 2023","Tue Oct 24 04:13:23 UTC 2023","41558","","My Profile: [FNN-718] Add portfolio Negative","","My Profile: [FNN-718] Add portfolio Negative","should add portfolio without data","should add portfolio without data",""
"passed","Tue Oct 24 04:44:40 UTC 2023","Tue Oct 24 04:44:51 UTC 2023","11254","","Search Project: [FNN-568] Project search","","Search Project: [FNN-568] Project search","should filter projects by Location","should filter projects by Location",""
"passed","Tue Oct 24 04:27:01 UTC 2023","Tue Oct 24 04:27:10 UTC 2023","8838","","My Projects: [FNN-1058] Complete project Negative","","My Projects: [FNN-1058] Complete project Negative","should complete project without Professionalism","should complete project without Professionalism",""
"failed","Tue Oct 24 04:39:56 UTC 2023","Tue Oct 24 04:40:20 UTC 2023","24463","","My Profile: [FNN-719] Add resume Negative","","My Profile: [FNN-719] Add resume Negative","should add education without data","should add education without data",""
"passed","Tue Oct 24 04:08:25 UTC 2023","Tue Oct 24 04:08:33 UTC 2023","8097","","Subscribe: [FNN-577] Subscribe Negative","","Subscribe: [FNN-577] Subscribe Negative","should subscribe without last name","should subscribe without last name",""
"broken","Tue Oct 24 04:37:24 UTC 2023","Tue Oct 24 04:38:35 UTC 2023","70417","","My Profile: [FNN-795] Remove portfolio","","My Profile: [FNN-795] Remove portfolio","should remove portfolio","should remove portfolio",""
"passed","Tue Oct 24 04:12:16 UTC 2023","Tue Oct 24 04:13:39 UTC 2023","83194","","My Profile: [FNN-713] Confirm phone number Negative","","My Profile: [FNN-713] Confirm phone number Negative","should confirm phone number with invalid code","should confirm phone number with invalid code",""
"passed","Tue Oct 24 04:09:41 UTC 2023","Tue Oct 24 04:09:50 UTC 2023","8591","","Subscribe: [FNN-577] Subscribe Negative","","Subscribe: [FNN-577] Subscribe Negative","should subscribe without repeat password","should subscribe without repeat password",""
"passed","Tue Oct 24 04:28:27 UTC 2023","Tue Oct 24 04:29:24 UTC 2023","56786","","Create Profile: [FNN-683] Create profile Positive","","Create Profile: [FNN-683] Create profile Positive","should create profile with valid data","should create profile with valid data",""
"passed","Tue Oct 24 04:13:42 UTC 2023","Tue Oct 24 04:14:18 UTC 2023","36341","","My Profile: [FNN-699] Request reference Positive","","My Profile: [FNN-699] Request reference Positive","should check the validated reference","should check the validated reference",""
"passed","Tue Oct 24 04:40:46 UTC 2023","Tue Oct 24 04:41:05 UTC 2023","19597","","My Network: [FNN-1232] Invite manually via email with custom message","","My Network: [FNN-1232] Invite manually via email with custom message","should invite manually via email with valid recipient data and with message","should invite manually via email with valid recipient data and with message",""
"passed","Tue Oct 24 04:35:58 UTC 2023","Tue Oct 24 04:36:06 UTC 2023","7506","","CR: [FNN-744] CR Subscribe Negative","","CR: [FNN-744] CR Subscribe Negative","should subscribe as CR without phone number","should subscribe as CR without phone number",""
"passed","Tue Oct 24 04:12:02 UTC 2023","Tue Oct 24 04:12:12 UTC 2023","9514","","My Profile: [FNN-690] Add resume Positive","","My Profile: [FNN-690] Add resume Positive","should add Expertise","should add Expertise",""
"passed","Tue Oct 24 04:28:57 UTC 2023","Tue Oct 24 04:29:16 UTC 2023","19048","","Freelancer search: [FNN-817] Add note","","Freelancer search: [FNN-817] Add note","should add a note via the action ""Add note""","should add a note via the action ""Add note""",""
"failed","Tue Oct 24 04:33:00 UTC 2023","Tue Oct 24 04:33:28 UTC 2023","28473","","[FNN-661] Send interest","","[FNN-661] Send interest","should assign the freelancer user","should assign the freelancer user",""
"passed","Tue Oct 24 04:46:41 UTC 2023","Tue Oct 24 04:46:57 UTC 2023","16300","","Create Profile: [FNN-684] Create profile Negative","","Create Profile: [FNN-684] Create profile Negative","should create profile without required fields","should create profile without required fields",""
"passed","Tue Oct 24 04:29:06 UTC 2023","Tue Oct 24 04:29:23 UTC 2023","16746","","Freelancer search: [FNN-822] Send message","","Freelancer search: [FNN-822] Send message","should check the message as the CR user","should check the message as the CR user",""
"passed","Tue Oct 24 04:40:34 UTC 2023","Tue Oct 24 04:40:38 UTC 2023","4213","","My Profile: [FNN-730] Request reference Negative","","My Profile: [FNN-730] Request reference Negative","should pass step 2 without last name","should pass step 2 without last name",""
"passed","Tue Oct 24 04:36:16 UTC 2023","Tue Oct 24 04:37:38 UTC 2023","82392","","Freelancer search: [FNN-924] Freelancer search as CR user","","Freelancer search: [FNN-924] Freelancer search as CR user","should filter freelancers by Minimum rating","should filter freelancers by Minimum rating",""
"passed","Tue Oct 24 04:39:36 UTC 2023","Tue Oct 24 04:39:48 UTC 2023","11333","","Post Project: [FNN-649] Post project with account Negative","","Post Project: [FNN-649] Post project with account Negative","should post project without Title","should post project without Title",""
"passed","Tue Oct 24 04:07:48 UTC 2023","Tue Oct 24 04:07:51 UTC 2023","3165","","Login: [FNN-574] Log in from the Loing page Negative","","Login: [FNN-574] Log in from the Loing page Negative","should log in with invalid credentials","should log in with invalid credentials",""
"passed","Tue Oct 24 04:10:36 UTC 2023","Tue Oct 24 04:11:55 UTC 2023","79221","","My Profile: [FNN-695] Add portfolio Positive","","My Profile: [FNN-695] Add portfolio Positive","should add portfolio","should add portfolio",""
"passed","Tue Oct 24 04:08:14 UTC 2023","Tue Oct 24 04:08:54 UTC 2023","39199","","Upgrade: [FNN-659] Upgrade account Negative","","Upgrade: [FNN-659] Upgrade account Negative","should upgrade account to Standard 1 month without required fields","should upgrade account to Standard 1 month without required fields",""
"passed","Tue Oct 24 04:30:14 UTC 2023","Tue Oct 24 04:31:12 UTC 2023","58756","","[FNN-813] Change language","","[FNN-813] Change language","should change language to English from the footer","should change language to English from the footer",""
"failed","Tue Oct 24 04:37:43 UTC 2023","Tue Oct 24 04:39:16 UTC 2023","93072","","Post Project: [FNN-587] Post project with account Positive","","Post Project: [FNN-587] Post project with account Positive","should post a project as a registered user with valid project data","should post a project as a registered user with valid project data",""
"passed","Tue Oct 24 04:09:18 UTC 2023","Tue Oct 24 04:09:31 UTC 2023","12926","","Subscribe: [FNN-577] Subscribe Negative","","Subscribe: [FNN-577] Subscribe Negative","should subscribe with taken phone number","should subscribe with taken phone number",""
"passed","Tue Oct 24 04:09:26 UTC 2023","Tue Oct 24 04:10:35 UTC 2023","68912","","Upgrade: [FNN-658] Upgrade account Positive","","Upgrade: [FNN-658] Upgrade account Positive","should upgrade account to Premium 1 month","should upgrade account to Premium 1 month",""
"passed","Tue Oct 24 04:11:35 UTC 2023","Tue Oct 24 04:11:47 UTC 2023","11489","","My Profile: [FNN-690] Add resume Positive","","My Profile: [FNN-690] Add resume Positive","should add Certificate","should add Certificate",""
"passed","Tue Oct 24 04:18:24 UTC 2023","Tue Oct 24 04:18:48 UTC 2023","23180","","Settings: [FNN-675] Change password Negative","","Settings: [FNN-675] Change password Negative","should change password without new and repeat password","should change password without new and repeat password",""
"passed","Tue Oct 24 04:33:25 UTC 2023","Tue Oct 24 04:34:10 UTC 2023","45291","","[FNN-667] Send contact","","[FNN-667] Send contact","should check the contact as the second user","should check the contact as the second user",""
"passed","Tue Oct 24 04:42:41 UTC 2023","Tue Oct 24 04:42:54 UTC 2023","12902","","Post Project: [FNN-588] Post project without account Negative","","Post Project: [FNN-588] Post project without account Negative","should post project without password","should post project without password",""
"passed","Tue Oct 24 04:08:45 UTC 2023","Tue Oct 24 04:09:29 UTC 2023","43964","","My Profile: [FNN-668] Edit account details Negative","","My Profile: [FNN-668] Edit account details Negative","should edit account details without required fields","should edit account details without required fields",""
"passed","Tue Oct 24 04:32:45 UTC 2023","Tue Oct 24 04:34:56 UTC 2023","131164","","[FNN-743] Archive and restore message","","[FNN-743] Archive and restore message","should archive the message","should archive the message",""
"passed","Tue Oct 24 04:08:54 UTC 2023","Tue Oct 24 04:09:10 UTC 2023","16838","","Upgrade: [FNN-659] Upgrade account Negative","","Upgrade: [FNN-659] Upgrade account Negative","should upgrade account to Standard 1 month Cancelled","should upgrade account to Standard 1 month Cancelled",""
"passed","Tue Oct 24 04:07:24 UTC 2023","Tue Oct 24 04:07:47 UTC 2023","23478","","Login: [FNN-563] Log in from the header Negative","","Login: [FNN-563] Log in from the header Negative","should log in with valid email and invalid password","should log in with valid email and invalid password",""
"failed","Tue Oct 24 04:49:53 UTC 2023","Tue Oct 24 04:50:47 UTC 2023","54323","","CR: [FNN-750] Invite to the organization through search","","CR: [FNN-750] Invite to the organization through search","should check organization page as the inviting user","should check organization page as the inviting user",""
"broken","Tue Oct 24 04:37:31 UTC 2023","Tue Oct 24 04:38:59 UTC 2023","87811","","My Profile: [FNN-793] Remove resume","","My Profile: [FNN-793] Remove resume","should remove resume","should remove resume",""
"passed","Tue Oct 24 04:41:45 UTC 2023","Tue Oct 24 04:41:50 UTC 2023","4879","","My Profile: [FNN-719] Add resume Negative","","My Profile: [FNN-719] Add resume Negative","should add language without writing level","should add language without writing level",""
"passed","Tue Oct 24 04:41:41 UTC 2023","Tue Oct 24 04:41:45 UTC 2023","4168","","My Profile: [FNN-719] Add resume Negative","","My Profile: [FNN-719] Add resume Negative","should add language without speaking level","should add language without speaking level",""
"passed","Tue Oct 24 04:33:17 UTC 2023","Tue Oct 24 04:33:25 UTC 2023","7656","","[FNN-667] Send contact","","[FNN-667] Send contact","should check the contact as the first user","should check the contact as the first user",""
"passed","Tue Oct 24 04:10:35 UTC 2023","Tue Oct 24 04:12:24 UTC 2023","109196","","Upgrade: [FNN-658] Upgrade account Positive","","Upgrade: [FNN-658] Upgrade account Positive","should upgrade account to Business 1 month","should upgrade account to Business 1 month",""
"passed","Tue Oct 24 04:40:43 UTC 2023","Tue Oct 24 04:40:45 UTC 2023","1993","","My Profile: [FNN-730] Request reference Negative","","My Profile: [FNN-730] Request reference Negative","should pass step 2 without picture","should pass step 2 without picture",""
"passed","Tue Oct 24 04:26:34 UTC 2023","Tue Oct 24 04:26:44 UTC 2023","9686","","My Projects: [FNN-1058] Complete project Negative","","My Projects: [FNN-1058] Complete project Negative","should complete project without Quality","should complete project without Quality",""
"passed","Tue Oct 24 04:36:23 UTC 2023","Tue Oct 24 04:36:30 UTC 2023","7438","","CR: [FNN-744] CR Subscribe Negative","","CR: [FNN-744] CR Subscribe Negative","should subscribe as CR without password","should subscribe as CR without password",""
"passed","Tue Oct 24 04:40:43 UTC 2023","Tue Oct 24 04:40:55 UTC 2023","12066","","Post Project: [FNN-588] Post project without account Negative","","Post Project: [FNN-588] Post project without account Negative","should post project without email","should post project without email",""
"failed","Tue Oct 24 04:45:57 UTC 2023","Tue Oct 24 04:46:06 UTC 2023","8946","","Search Project: [FNN-568] Project search","","Search Project: [FNN-568] Project search","should filter projects by Posted since Last 30 days","should filter projects by Posted since Last 30 days",""
"passed","Tue Oct 24 04:08:33 UTC 2023","Tue Oct 24 04:08:43 UTC 2023","9366","","Subscribe: [FNN-577] Subscribe Negative","","Subscribe: [FNN-577] Subscribe Negative","should subscribe without email","should subscribe without email",""
"passed","Tue Oct 24 04:36:14 UTC 2023","Tue Oct 24 04:36:29 UTC 2023","15586","","CR: [FNN-749] Invite to the organization manually Positive","","CR: [FNN-749] Invite to the organization manually Positive","should accept invitation","should accept invitation",""
"broken","Tue Oct 24 04:40:19 UTC 2023","Tue Oct 24 04:40:51 UTC 2023","32107","","Post Project: [FNN-649] Post project with account Negative","","Post Project: [FNN-649] Post project with account Negative","should post project without Budget","should post project without Budget",""
"passed","Tue Oct 24 04:41:01 UTC 2023","Tue Oct 24 04:41:19 UTC 2023","17814","","My Profile: [FNN-730] Request reference Negative","","My Profile: [FNN-730] Request reference Negative","should pass step 3 without 1 rating","should pass step 3 without 1 rating",""
"passed","Tue Oct 24 04:40:25 UTC 2023","Tue Oct 24 04:40:30 UTC 2023","4331","","My Profile: [FNN-719] Add resume Negative","","My Profile: [FNN-719] Add resume Negative","should add education without education","should add education without education",""
"passed","Tue Oct 24 04:17:27 UTC 2023","Tue Oct 24 04:18:06 UTC 2023","39332","","Settings: [FNN-671] Change email address Positive","","Settings: [FNN-671] Change email address Positive","should change email address with valid credentials","should change email address with valid credentials",""
"passed","Tue Oct 24 04:27:07 UTC 2023","Tue Oct 24 04:27:28 UTC 2023","20583","","Freelancer search: [FNN-815] Freelancer search as non-CR user","","Freelancer search: [FNN-815] Freelancer search as non-CR user","should filter freelancers by Hourly Rate","should filter freelancers by Hourly Rate",""
"passed","Tue Oct 24 04:36:13 UTC 2023","Tue Oct 24 04:36:23 UTC 2023","9934","","CR: [FNN-744] CR Subscribe Negative","","CR: [FNN-744] CR Subscribe Negative","should subscribe as CR with taken phone number","should subscribe as CR with taken phone number",""
"passed","Tue Oct 24 04:40:51 UTC 2023","Tue Oct 24 04:41:05 UTC 2023","13959","","Post Project: [FNN-649] Post project with account Negative","","Post Project: [FNN-649] Post project with account Negative","should post project without Work on location","should post project without Work on location",""
"passed","Tue Oct 24 04:09:09 UTC 2023","Tue Oct 24 04:09:18 UTC 2023","8694","","Subscribe: [FNN-577] Subscribe Negative","","Subscribe: [FNN-577] Subscribe Negative","should subscribe with wrong phone number","should subscribe with wrong phone number",""
"passed","Tue Oct 24 04:30:53 UTC 2023","Tue Oct 24 04:31:26 UTC 2023","33776","","Freelancer search: [FNN-924] Freelancer search as CR user","","Freelancer search: [FNN-924] Freelancer search as CR user","should filter freelancers by Category","should filter freelancers by Category",""
"passed","Tue Oct 24 04:40:29 UTC 2023","Tue Oct 24 04:40:34 UTC 2023","5319","","My Profile: [FNN-730] Request reference Negative","","My Profile: [FNN-730] Request reference Negative","should pass step 2 without first name","should pass step 2 without first name",""
"passed","Tue Oct 24 04:45:43 UTC 2023","Tue Oct 24 04:45:56 UTC 2023","13146","","Freelancer search: [FNN-816] Create list Functionality","","Freelancer search: [FNN-816] Create list Functionality","should re-open original search","should re-open original search",""
"passed","Tue Oct 24 04:27:10 UTC 2023","Tue Oct 24 04:27:18 UTC 2023","7973","","My Projects: [FNN-1058] Complete project Negative","","My Projects: [FNN-1058] Complete project Negative","should complete project without Comments","should complete project without Comments",""
"passed","Tue Oct 24 04:22:56 UTC 2023","Tue Oct 24 04:23:00 UTC 2023","4075","","My Network: [FNN-620] Invite manually via email and sms Negative","","My Network: [FNN-620] Invite manually via email and sms Negative","should invite manually via sms with invalid phone number","should invite manually via sms with invalid phone number",""
"passed","Tue Oct 24 04:18:08 UTC 2023","Tue Oct 24 04:18:40 UTC 2023","31955","","Settings: [FNN-672] Change email address Negative","","Settings: [FNN-672] Change email address Negative","should change email address with wrong password","should change email address with wrong password",""
"passed","Tue Oct 24 04:10:16 UTC 2023","Tue Oct 24 04:11:05 UTC 2023","48818","","My Profile: [FNN-690] Add resume Positive","","My Profile: [FNN-690] Add resume Positive","should add CV","should add CV",""
"passed","Tue Oct 24 04:11:47 UTC 2023","Tue Oct 24 04:11:54 UTC 2023","7242","","My Profile: [FNN-690] Add resume Positive","","My Profile: [FNN-690] Add resume Positive","should add Motivation","should add Motivation",""
"passed","Tue Oct 24 04:47:03 UTC 2023","Tue Oct 24 04:47:16 UTC 2023","12363","","Create Profile: [FNN-684] Create profile Negative","","Create Profile: [FNN-684] Create profile Negative","should create profile with wrong website","should create profile with wrong website",""
"passed","Tue Oct 24 04:08:51 UTC 2023","Tue Oct 24 04:09:02 UTC 2023","10512","","Subscribe: [FNN-577] Subscribe Negative","","Subscribe: [FNN-577] Subscribe Negative","should subscribe with taken email","should subscribe with taken email",""
"passed","Tue Oct 24 04:46:32 UTC 2023","Tue Oct 24 04:48:28 UTC 2023","116473","","My Projects: [FNN-971] Complete project Positive","","My Projects: [FNN-971] Complete project Positive","should check review as freelancer user","should check review as freelancer user",""
"passed","Tue Oct 24 04:18:01 UTC 2023","Tue Oct 24 04:18:08 UTC 2023","7257","","Settings: [FNN-672] Change email address Negative","","Settings: [FNN-672] Change email address Negative","should change email address with invalid email format","should change email address with invalid email format",""
"passed","Tue Oct 24 04:41:30 UTC 2023","Tue Oct 24 04:41:36 UTC 2023","5341","","My Profile: [FNN-730] Request reference Negative","","My Profile: [FNN-730] Request reference Negative","should pass step 3 without 4 rating","should pass step 3 without 4 rating",""
"passed","Tue Oct 24 04:07:59 UTC 2023","Tue Oct 24 04:08:22 UTC 2023","23829","","Login: [FNN-574] Log in from the Loing page Negative","","Login: [FNN-574] Log in from the Loing page Negative","should log in without credentials","should log in without credentials",""
"failed","Tue Oct 24 04:49:20 UTC 2023","Tue Oct 24 04:49:53 UTC 2023","33314","","CR: [FNN-750] Invite to the organization through search","","CR: [FNN-750] Invite to the organization through search","should accept invitation","should accept invitation",""
"passed","Tue Oct 24 04:28:06 UTC 2023","Tue Oct 24 04:30:53 UTC 2023","166639","","Freelancer search: [FNN-924] Freelancer search as CR user","","Freelancer search: [FNN-924] Freelancer search as CR user","should filter freelancers by Terms","should filter freelancers by Terms",""
"passed","Tue Oct 24 04:06:40 UTC 2023","Tue Oct 24 04:07:12 UTC 2023","31483","","Subscribe: [FNN-578] Subscribe Positive","","Subscribe: [FNN-578] Subscribe Positive","should subscribe with valid credentials","should subscribe with valid credentials",""
"passed","Tue Oct 24 04:09:58 UTC 2023","Tue Oct 24 04:10:08 UTC 2023","9431","","Subscribe: [FNN-577] Subscribe Negative","","Subscribe: [FNN-577] Subscribe Negative","should subscribe with invalid repeat password","should subscribe with invalid repeat password",""
"passed","Tue Oct 24 04:09:50 UTC 2023","Tue Oct 24 04:09:58 UTC 2023","8441","","Subscribe: [FNN-577] Subscribe Negative","","Subscribe: [FNN-577] Subscribe Negative","should subscribe with short password","should subscribe with short password",""
"skipped","Tue Oct 24 04:47:19 UTC 2023","Tue Oct 24 04:47:19 UTC 2023","0","","My Network: [FNN-1027] Invite freelancers","","My Network: [FNN-1027] Invite freelancers","should accept an invitation","should accept an invitation",""
"passed","Tue Oct 24 04:09:34 UTC 2023","Tue Oct 24 04:09:39 UTC 2023","5399","","My Profile: [FNN-668] Edit account details Negative","","My Profile: [FNN-668] Edit account details Negative","should edit account details with invalid phone number","should edit account details with invalid phone number",""
"passed","Tue Oct 24 04:39:42 UTC 2023","Tue Oct 24 04:39:49 UTC 2023","6529","","My Profile: [FNN-719] Add resume Negative","","My Profile: [FNN-719] Add resume Negative","should add experience without period from  ","should add experience without period from  ",""
"passed","Tue Oct 24 04:37:02 UTC 2023","Tue Oct 24 04:37:05 UTC 2023","2459","","CR: [FNN-744] CR Subscribe Negative","","CR: [FNN-744] CR Subscribe Negative","should subscribe as CR without data","should subscribe as CR without data",""
"passed","Tue Oct 24 04:09:29 UTC 2023","Tue Oct 24 04:09:34 UTC 2023","5291","","My Profile: [FNN-668] Edit account details Negative","","My Profile: [FNN-668] Edit account details Negative","should edit account details without sector","should edit account details without sector",""
"passed","Tue Oct 24 04:19:15 UTC 2023","Tue Oct 24 04:19:51 UTC 2023","36225","","Settings: [FNN-675] Change password Negative","","Settings: [FNN-675] Change password Negative","should change password with invalid old password","should change password with invalid old password",""
