"Status","Start Time","Stop Time","Duration in ms","Parent Suite","Suite","Sub Suite","Test Class","Test Method","Name","Description"
"passed","Tue Oct 24 04:20:39 UTC 2023","Tue Oct 24 04:21:41 UTC 2023","61992","","Settings: [FNN-676] Change profile settings","","Settings: [FNN-676] Change profile settings","i don't want to display my profile in the database","i don't want to display my profile in the database",""
"passed","Tue Oct 24 04:19:27 UTC 2023","Tue Oct 24 04:20:40 UTC 2023","72127","","Settings: [FNN-678] Delete account without subscription","","Settings: [FNN-678] Delete account without subscription","should delete account without subscription","should delete account without subscription",""
"passed","Tue Oct 24 04:32:46 UTC 2023","Tue Oct 24 04:33:42 UTC 2023","56825","","Freelancer search: [FNN-924] Freelancer search as CR user","","Freelancer search: [FNN-924] Freelancer search as CR user","should filter freelancers by Years of experience","should filter freelancers by Years of experience",""
"passed","Tue Oct 24 04:42:54 UTC 2023","Tue Oct 24 04:43:08 UTC 2023","13770","","Post Project: [FNN-588] Post project without account Negative","","Post Project: [FNN-588] Post project without account Negative","should post project without repeat password","should post project without repeat password",""
"passed","Tue Oct 24 04:22:40 UTC 2023","Tue Oct 24 04:22:44 UTC 2023","4254","","My Network: [FNN-620] Invite manually via email and sms Negative","","My Network: [FNN-620] Invite manually via email and sms Negative","should invite manually via email without first name","should invite manually via email without first name",""
"passed","Tue Oct 24 04:34:56 UTC 2023","Tue Oct 24 04:35:47 UTC 2023","51266","","[FNN-743] Archive and restore message","","[FNN-743] Archive and restore message","should restore the message","should restore the message",""
"passed","Tue Oct 24 04:35:30 UTC 2023","Tue Oct 24 04:35:39 UTC 2023","8879","","CR: [FNN-744] CR Subscribe Negative","","CR: [FNN-744] CR Subscribe Negative","should subscribe as CR without email","should subscribe as CR without email",""
"passed","Tue Oct 24 04:46:57 UTC 2023","Tue Oct 24 04:47:03 UTC 2023","6523","","Create Profile: [FNN-684] Create profile Negative","","Create Profile: [FNN-684] Create profile Negative","should create profile without City","should create profile without City",""
"passed","Tue Oct 24 04:47:23 UTC 2023","Tue Oct 24 04:47:32 UTC 2023","8484","","Create Profile: [FNN-684] Create profile Negative","","Create Profile: [FNN-684] Create profile Negative","should create profile without Description of yourself","should create profile without Description of yourself",""
"passed","Tue Oct 24 04:42:21 UTC 2023","Tue Oct 24 04:42:42 UTC 2023","20757","","My Network: [FNN-619] Invite manually via sms","","My Network: [FNN-619] Invite manually via sms","should invite manually via sms with valid recipient data","should invite manually via sms with valid recipient data",""
"passed","Tue Oct 24 04:36:06 UTC 2023","Tue Oct 24 04:36:13 UTC 2023","7116","","CR: [FNN-744] CR Subscribe Negative","","CR: [FNN-744] CR Subscribe Negative","should subscribe as CR with wrong phone number","should subscribe as CR with wrong phone number",""
"passed","Tue Oct 24 04:09:31 UTC 2023","Tue Oct 24 04:09:41 UTC 2023","10293","","Subscribe: [FNN-577] Subscribe Negative","","Subscribe: [FNN-577] Subscribe Negative","should subscribe without password","should subscribe without password",""
"passed","Tue Oct 24 04:07:57 UTC 2023","Tue Oct 24 04:08:20 UTC 2023","23618","","Login: [FNN-563] Log in from the header Negative","","Login: [FNN-563] Log in from the header Negative","should log in without credentials","should log in without credentials",""
"passed","Tue Oct 24 04:40:45 UTC 2023","Tue Oct 24 04:40:50 UTC 2023","4748","","My Profile: [FNN-730] Request reference Negative","","My Profile: [FNN-730] Request reference Negative","should pass step 2 with invalid website format","should pass step 2 with invalid website format",""
"passed","Tue Oct 24 04:34:38 UTC 2023","Tue Oct 24 04:36:14 UTC 2023","95458","","CR: [FNN-749] Invite to the organization manually Positive","","CR: [FNN-749] Invite to the organization manually Positive","should invite manually to the organization with valid recipient details","should invite manually to the organization with valid recipient details",""
"passed","Tue Oct 24 04:45:29 UTC 2023","Tue Oct 24 04:45:35 UTC 2023","5923","","Search Project: [FNN-568] Project search","","Search Project: [FNN-568] Project search","should filter projects by Status All projects","should filter projects by Status All projects",""
"failed","Tue Oct 24 04:41:41 UTC 2023","Tue Oct 24 04:42:32 UTC 2023","51607","","My Profile: [FNN-730] Request reference Negative","","My Profile: [FNN-730] Request reference Negative","should pass step 3 with comments less then 200 chars","should pass step 3 with comments less then 200 chars",""
"passed","Tue Oct 24 04:33:02 UTC 2023","Tue Oct 24 04:33:17 UTC 2023","15622","","[FNN-667] Send contact","","[FNN-667] Send contact","should forward the contact request","should forward the contact request",""
"passed","Tue Oct 24 04:07:54 UTC 2023","Tue Oct 24 04:07:57 UTC 2023","2259","","Login: [FNN-563] Log in from the header Negative","","Login: [FNN-563] Log in from the header Negative","should log in without password","should log in without password",""
"passed","Tue Oct 24 04:41:38 UTC 2023","Tue Oct 24 04:41:41 UTC 2023","3235","","My Profile: [FNN-719] Add resume Negative","","My Profile: [FNN-719] Add resume Negative","should add language without levels","should add language without levels",""
"passed","Tue Oct 24 04:11:54 UTC 2023","Tue Oct 24 04:12:02 UTC 2023","8504","","My Profile: [FNN-690] Add resume Positive","","My Profile: [FNN-690] Add resume Positive","should add Qualities","should add Qualities",""
"passed","Tue Oct 24 04:10:08 UTC 2023","Tue Oct 24 04:10:16 UTC 2023","8281","","Subscribe: [FNN-577] Subscribe Negative","","Subscribe: [FNN-577] Subscribe Negative","should subscribe without agreeing to the Terms and Conditions","should subscribe without agreeing to the Terms and Conditions",""
"failed","Tue Oct 24 04:45:42 UTC 2023","Tue Oct 24 04:45:47 UTC 2023","5028","","Search Project: [FNN-568] Project search","","Search Project: [FNN-568] Project search","should filter projects by Posted since Last 3 days","should filter projects by Posted since Last 3 days",""
"passed","Tue Oct 24 04:30:58 UTC 2023","Tue Oct 24 04:32:33 UTC 2023","95502","","Freelancer search: [FNN-846] Invite to project","","Freelancer search: [FNN-846] Invite to project","should verify if the ""Assign project"" button is enable","should verify if the ""Assign project"" button is enable",""
"broken","Tue Oct 24 04:47:23 UTC 2023","Tue Oct 24 04:50:20 UTC 2023","177098","","My Transactions: [FNN-708] Hourly project: In advance. Positive","","My Transactions: [FNN-708] Hourly project: In advance. Positive","should start hourly project","should start hourly project",""
"passed","Tue Oct 24 04:29:23 UTC 2023","Tue Oct 24 04:30:07 UTC 2023","44025","","Freelancer search: [FNN-822] Send message","","Freelancer search: [FNN-822] Send message","should check the message as the freelancer user","should check the message as the freelancer user",""
"passed","Tue Oct 24 04:12:24 UTC 2023","Tue Oct 24 04:14:22 UTC 2023","118288","","Upgrade: [FNN-658] Upgrade account Positive","","Upgrade: [FNN-658] Upgrade account Positive","should upgrade account to Enterprise 1 month","should upgrade account to Enterprise 1 month",""
"passed","Tue Oct 24 04:36:38 UTC 2023","Tue Oct 24 04:36:46 UTC 2023","7406","","CR: [FNN-744] CR Subscribe Negative","","CR: [FNN-744] CR Subscribe Negative","should subscribe as CR with short password","should subscribe as CR with short password",""
"passed","Tue Oct 24 04:17:39 UTC 2023","Tue Oct 24 04:18:01 UTC 2023","21705","","Settings: [FNN-672] Change email address Negative","","Settings: [FNN-672] Change email address Negative","should change email address without password","should change email address without password",""
"broken","Tue Oct 24 04:41:09 UTC 2023","Tue Oct 24 04:41:42 UTC 2023","32728","","Post Project: [FNN-588] Post project without account Negative","","Post Project: [FNN-588] Post project without account Negative","should post project with taken email","should post project with taken email",""
"broken","Tue Oct 24 04:41:55 UTC 2023","Tue Oct 24 04:42:27 UTC 2023","32395","","Post Project: [FNN-588] Post project without account Negative","","Post Project: [FNN-588] Post project without account Negative","should post project with taken phone number","should post project with taken phone number",""
"passed","Tue Oct 24 04:35:21 UTC 2023","Tue Oct 24 04:35:30 UTC 2023","8419","","CR: [FNN-744] CR Subscribe Negative","","CR: [FNN-744] CR Subscribe Negative","should subscribe as CR without last name","should subscribe as CR without last name",""
"passed","Tue Oct 24 04:39:59 UTC 2023","Tue Oct 24 04:40:07 UTC 2023","8442","","Post Project: [FNN-649] Post project with account Negative","","Post Project: [FNN-649] Post project with account Negative","should post project without Category","should post project without Category",""
"passed","Tue Oct 24 04:17:40 UTC 2023","Tue Oct 24 04:18:20 UTC 2023","40561","","Settings: [FNN-673] Confirm email address","","Settings: [FNN-673] Confirm email address","should confirm email address","should confirm email address",""
"passed","Tue Oct 24 04:38:02 UTC 2023","Tue Oct 24 04:38:31 UTC 2023","29540","","CR: [FNN-751] Invite to the organization manually Negative","","CR: [FNN-751] Invite to the organization manually Negative","should invite manually to the organization without role","should invite manually to the organization without role",""
"passed","Tue Oct 24 04:36:29 UTC 2023","Tue Oct 24 04:37:17 UTC 2023","47678","","CR: [FNN-749] Invite to the organization manually Positive","","CR: [FNN-749] Invite to the organization manually Positive","should check organization page as the inviting user","should check organization page as the inviting user",""
"passed","Tue Oct 24 04:22:35 UTC 2023","Tue Oct 24 04:22:40 UTC 2023","4348","","My Network: [FNN-620] Invite manually via email and sms Negative","","My Network: [FNN-620] Invite manually via email and sms Negative","should invite manually via email with wrong email format","should invite manually via email with wrong email format",""
"failed","Tue Oct 24 04:47:32 UTC 2023","Tue Oct 24 04:48:34 UTC 2023","61891","","Create Profile: [FNN-684] Create profile Negative","","Create Profile: [FNN-684] Create profile Negative","should create profile with short Description of yourself","should create profile with short Description of yourself",""
"failed","Tue Oct 24 04:40:30 UTC 2023","Tue Oct 24 04:40:56 UTC 2023","26297","","My Profile: [FNN-719] Add resume Negative","","My Profile: [FNN-719] Add resume Negative","should add education without period from","should add education without period from",""
"passed","Tue Oct 24 04:07:51 UTC 2023","Tue Oct 24 04:07:52 UTC 2023","1687","","Login: [FNN-563] Log in from the header Negative","","Login: [FNN-563] Log in from the header Negative","should log in with wrong email format","should log in with wrong email format",""
"passed","Tue Oct 24 04:09:10 UTC 2023","Tue Oct 24 04:09:27 UTC 2023","16665","","Upgrade: [FNN-659] Upgrade account Negative","","Upgrade: [FNN-659] Upgrade account Negative","should upgrade account to Standard 1 month Pending","should upgrade account to Standard 1 month Pending",""
"broken","Tue Oct 24 04:41:18 UTC 2023","Tue Oct 24 04:41:49 UTC 2023","31282","","Post Project: [FNN-649] Post project with account Negative","","Post Project: [FNN-649] Post project with account Negative","should post project without Start date","should post project without Start date",""
"passed","Tue Oct 24 04:41:05 UTC 2023","Tue Oct 24 04:41:18 UTC 2023","12197","","Post Project: [FNN-649] Post project with account Negative","","Post Project: [FNN-649] Post project with account Negative","should post project without Location","should post project without Location",""
"passed","Tue Oct 24 04:41:34 UTC 2023","Tue Oct 24 04:41:38 UTC 2023","3974","","My Profile: [FNN-719] Add resume Negative","","My Profile: [FNN-719] Add resume Negative","should add certificate without achieved annual","should add certificate without achieved annual",""
"passed","Tue Oct 24 04:26:23 UTC 2023","Tue Oct 24 04:27:07 UTC 2023","44430","","Freelancer search: [FNN-815] Freelancer search as non-CR user","","Freelancer search: [FNN-815] Freelancer search as non-CR user","should filter freelancers by Location","should filter freelancers by Location",""
"passed","Tue Oct 24 04:09:45 UTC 2023","Tue Oct 24 04:10:27 UTC 2023","42252","","My Profile: [FNN-668] Edit account details Negative","","My Profile: [FNN-668] Edit account details Negative","should edit account details with invalid VAT number","should edit account details with invalid VAT number",""
"passed","Tue Oct 24 04:08:11 UTC 2023","Tue Oct 24 04:09:26 UTC 2023","74856","","Upgrade: [FNN-658] Upgrade account Positive","","Upgrade: [FNN-658] Upgrade account Positive","should upgrade account to Standaard 1 month","should upgrade account to Standaard 1 month",""
"passed","Tue Oct 24 04:07:24 UTC 2023","Tue Oct 24 04:08:07 UTC 2023","43127","","Login: [FNN-648] Log in from the Login page Positive","","Login: [FNN-648] Log in from the Login page Positive","should log in with valid credentials","should log in with valid credentials",""
"passed","Tue Oct 24 04:07:47 UTC 2023","Tue Oct 24 04:07:51 UTC 2023","3411","","Login: [FNN-563] Log in from the header Negative","","Login: [FNN-563] Log in from the header Negative","should log in with invalid credentials","should log in with invalid credentials",""
"passed","Tue Oct 24 04:38:36 UTC 2023","Tue Oct 24 04:40:13 UTC 2023","97095","","Post Project: [FNN-650] Post project without account Positive","","Post Project: [FNN-650] Post project without account Positive","should post a project as an unregistered user with valid project data","should post a project as an unregistered user with valid project data",""
"passed","Tue Oct 24 04:08:28 UTC 2023","Tue Oct 24 04:09:28 UTC 2023","59580","","Reset password: [FNN-656] Reset password Positive","","Reset password: [FNN-656] Reset password Positive","should reset password with valid credentials","should reset password with valid credentials",""
"passed","Tue Oct 24 04:35:12 UTC 2023","Tue Oct 24 04:35:21 UTC 2023","9213","","CR: [FNN-744] CR Subscribe Negative","","CR: [FNN-744] CR Subscribe Negative","should subscribe as CR without first name","should subscribe as CR without first name",""
"broken","Tue Oct 24 04:40:17 UTC 2023","Tue Oct 24 04:40:46 UTC 2023","28130","","My Network: [FNN-1232] Invite manually via email with custom message","","My Network: [FNN-1232] Invite manually via email with custom message","""after each"" hook for [FNN-1232] Invite manually via email with custom message","""after each"" hook for [FNN-1232] Invite manually via email with custom message",""
"passed","Tue Oct 24 04:31:22 UTC 2023","Tue Oct 24 04:33:02 UTC 2023","99215","","[FNN-667] Send contact","","[FNN-667] Send contact","should send a contact","should send a contact",""
"broken","Tue Oct 24 04:47:07 UTC 2023","Tue Oct 24 04:49:22 UTC 2023","135824","","[FNN-661] Send interest","","[FNN-661] Send interest","should send interest in the employer's project","should send interest in the employer's project",""
"passed","Tue Oct 24 04:18:46 UTC 2023","Tue Oct 24 04:20:39 UTC 2023","113421","","Settings: [FNN-676] Change profile settings","","Settings: [FNN-676] Change profile settings","it's not possible to contact me through the contact button on my profile","it's not possible to contact me through the contact button on my profile",""
"passed","Tue Oct 24 04:20:48 UTC 2023","Tue Oct 24 04:21:56 UTC 2023","68244","","Settings: [FNN-808] Cancel downgrade","","Settings: [FNN-808] Cancel downgrade","should cancel downgrade","should cancel downgrade",""
"passed","Tue Oct 24 04:40:50 UTC 2023","Tue Oct 24 04:41:01 UTC 2023","11157","","My Profile: [FNN-730] Request reference Negative","","My Profile: [FNN-730] Request reference Negative","should pass step 3 without data","should pass step 3 without data",""
"passed","Tue Oct 24 04:18:48 UTC 2023","Tue Oct 24 04:19:00 UTC 2023","12456","","Settings: [FNN-675] Change password Negative","","Settings: [FNN-675] Change password Negative","should change password with short new password","should change password with short new password",""
"passed","Tue Oct 24 04:41:30 UTC 2023","Tue Oct 24 04:41:34 UTC 2023","3832","","My Profile: [FNN-719] Add resume Negative","","My Profile: [FNN-719] Add resume Negative","should add certificate without organization","should add certificate without organization",""
"passed","Tue Oct 24 04:27:46 UTC 2023","Tue Oct 24 04:30:45 UTC 2023","179525","","Freelancer search: [FNN-846] Invite to project","","Freelancer search: [FNN-846] Invite to project","should invite to a project via the ""Invite to project"" action","should invite to a project via the ""Invite to project"" action",""
"passed","Tue Oct 24 04:07:56 UTC 2023","Tue Oct 24 04:07:59 UTC 2023","2581","","Login: [FNN-574] Log in from the Loing page Negative","","Login: [FNN-574] Log in from the Loing page Negative","should log in without password","should log in without password",""
"passed","Tue Oct 24 04:42:37 UTC 2023","Tue Oct 24 04:44:30 UTC 2023","113780","","Search Project: [FNN-568] Project search","","Search Project: [FNN-568] Project search","should filter projects by Category","should filter projects by Category",""
"broken","Tue Oct 24 04:41:08 UTC 2023","Tue Oct 24 04:41:37 UTC 2023","29527","","My Network: [FNN-1233] Invite manually via email without custom message","","My Network: [FNN-1233] Invite manually via email without custom message","""after each"" hook for [FNN-1233] Invite manually via email without custom message","""after each"" hook for [FNN-1233] Invite manually via email without custom message",""
"passed","Tue Oct 24 04:13:23 UTC 2023","Tue Oct 24 04:13:50 UTC 2023","26965","","My Profile: [FNN-718] Add portfolio Negative","","My Profile: [FNN-718] Add portfolio Negative","should add portfolio without Type","should add portfolio without Type",""
"passed","Tue Oct 24 04:35:38 UTC 2023","Tue Oct 24 04:36:16 UTC 2023","38406","","Freelancer search: [FNN-924] Freelancer search as CR user","","Freelancer search: [FNN-924] Freelancer search as CR user","should filter freelancers by Minimum references","should filter freelancers by Minimum references",""
"passed","Tue Oct 24 04:41:49 UTC 2023","Tue Oct 24 04:42:02 UTC 2023","12656","","Post Project: [FNN-649] Post project with account Negative","","Post Project: [FNN-649] Post project with account Negative","should post project without End date","should post project without End date",""
"passed","Tue Oct 24 04:27:28 UTC 2023","Tue Oct 24 04:28:22 UTC 2023","54841","","Freelancer search: [FNN-815] Freelancer search as non-CR user","","Freelancer search: [FNN-815] Freelancer search as non-CR user","should filter freelancers by Skills","should filter freelancers by Skills",""
"passed","Tue Oct 24 04:07:52 UTC 2023","Tue Oct 24 04:07:54 UTC 2023","1961","","Login: [FNN-563] Log in from the header Negative","","Login: [FNN-563] Log in from the header Negative","should log in without email","should log in without email",""
"passed","Tue Oct 24 04:39:07 UTC 2023","Tue Oct 24 04:40:29 UTC 2023","81474","","My Profile: [FNN-730] Request reference Negative","","My Profile: [FNN-730] Request reference Negative","should pass step 2 without data","should pass step 2 without data",""
"broken","Tue Oct 24 04:42:17 UTC 2023","Tue Oct 24 04:43:11 UTC 2023","54393","","Post Project: [FNN-649] Post project with account Negative","","Post Project: [FNN-649] Post project with account Negative","should post project with short Description","should post project with short Description",""
"passed","Tue Oct 24 04:35:46 UTC 2023","Tue Oct 24 04:35:58 UTC 2023","12201","","CR: [FNN-744] CR Subscribe Negative","","CR: [FNN-744] CR Subscribe Negative","should subscribe as CR with taken email","should subscribe as CR with taken email",""
"passed","Tue Oct 24 04:36:30 UTC 2023","Tue Oct 24 04:36:38 UTC 2023","7954","","CR: [FNN-744] CR Subscribe Negative","","CR: [FNN-744] CR Subscribe Negative","should subscribe as CR without repeat password","should subscribe as CR without repeat password",""
