"Status","Start Time","Stop Time","Duration in ms","Parent Suite","Suite","Sub Suite","Test Class","Test Method","Name","Description"
"passed","Fri Dec 23 04:48:59 UTC 2022","Fri Dec 23 04:49:02 UTC 2022","3273","","[FNN-649] Post project with account Negative","","[FNN-649] Post project with account Negative","post project without Category","post project without Category",""
"passed","Fri Dec 23 04:24:34 UTC 2022","Fri Dec 23 04:25:00 UTC 2022","25827","","[FNN-676] Change profile settings","","[FNN-676] Change profile settings","i don't want to display my profile in the database","i don't want to display my profile in the database",""
"passed","Fri Dec 23 04:49:28 UTC 2022","Fri Dec 23 04:49:33 UTC 2022","4890","","[FNN-649] Post project with account Negative","","[FNN-649] Post project with account Negative","post project without Location","post project without Location",""
"passed","Fri Dec 23 04:49:47 UTC 2022","Fri Dec 23 04:50:02 UTC 2022","14735","","[FNN-649] Post project with account Negative","","[FNN-649] Post project with account Negative","post project without Description ","post project without Description ",""
"passed","Fri Dec 23 04:05:51 UTC 2022","Fri Dec 23 04:05:52 UTC 2022","989","","[FNN-563] LogIn from the page header Negative","","[FNN-563] LogIn from the page header Negative","login from the page header with a wrong email format","login from the page header with a wrong email format",""
"passed","Fri Dec 23 04:09:09 UTC 2022","Fri Dec 23 04:09:22 UTC 2022","13043","","[FNN-659] Upgrade account Negative","","[FNN-659] Upgrade account Negative","upgrade account to Standard 1 month. Pending","upgrade account to Standard 1 month. Pending",""
"passed","Fri Dec 23 04:16:33 UTC 2022","Fri Dec 23 04:16:37 UTC 2022","4275","","[FNN-588] Post project without account Negative","","[FNN-588] Post project without account Negative","post project without an account password","post project without an account password",""
"failed","Fri Dec 23 04:47:57 UTC 2022","Fri Dec 23 04:48:27 UTC 2022","30669","","[FNN-656] Reset password Positive","","[FNN-656] Reset password Positive","reset password with valid cred.","reset password with valid cred.",""
"passed","Fri Dec 23 04:03:51 UTC 2022","Fri Dec 23 04:03:55 UTC 2022","4585","","[FNN-577] Subscribe Negative","","[FNN-577] Subscribe Negative","subscribe without a last name","subscribe without a last name",""
"passed","Fri Dec 23 04:49:33 UTC 2022","Fri Dec 23 04:49:40 UTC 2022","6521","","[FNN-649] Post project with account Negative","","[FNN-649] Post project with account Negative","post project without Start","post project without Start",""
"broken","Fri Dec 23 04:51:53 UTC 2022","Fri Dec 23 04:54:07 UTC 2022","134237","","[FNN-568] Search projects","","[FNN-568] Search projects","""before all"" hook for [FNN-568] Search projects","""before all"" hook for [FNN-568] Search projects",""
"passed","Fri Dec 23 04:05:50 UTC 2022","Fri Dec 23 04:05:51 UTC 2022","1728","","[FNN-563] LogIn from the page header Negative","","[FNN-563] LogIn from the page header Negative","login from the page header with invalid credentials","login from the page header with invalid credentials",""
"passed","Fri Dec 23 04:03:55 UTC 2022","Fri Dec 23 04:04:00 UTC 2022","4636","","[FNN-577] Subscribe Negative","","[FNN-577] Subscribe Negative","subscribe with a wrong email format","subscribe with a wrong email format",""
"passed","Fri Dec 23 04:25:01 UTC 2022","Fri Dec 23 04:25:40 UTC 2022","39060","","[FNN-677] Downgrade to ""Standby""","","[FNN-677] Downgrade to ""Standby""","downgrade to ""Standby""","downgrade to ""Standby""",""
"passed","Fri Dec 23 04:04:23 UTC 2022","Fri Dec 23 04:04:44 UTC 2022","21413","","[FNN-578] Subscribe Positive","","[FNN-578] Subscribe Positive","subscribe with valid credentials","subscribe with valid credentials",""
"passed","Fri Dec 23 04:13:24 UTC 2022","Fri Dec 23 04:13:29 UTC 2022","4993","","[FNN-690] Edit my resume Positive","","[FNN-690] Edit my resume Positive","add Expertise","add Expertise",""
"passed","Fri Dec 23 04:31:25 UTC 2022","Fri Dec 23 04:31:27 UTC 2022","1895","","[FNN-620] Invite manually via email and sms Negative","","[FNN-620] Invite manually via email and sms Negative","invite manually via email without first name","invite manually via email without first name",""
"passed","Fri Dec 23 04:06:27 UTC 2022","Fri Dec 23 04:06:48 UTC 2022","21740","","[FNN-685] LogOut","","[FNN-685] LogOut","logout","logout",""
"passed","Fri Dec 23 04:26:31 UTC 2022","Fri Dec 23 04:27:08 UTC 2022","36520","","[FNN-680] Downgrade to ""Free""","","[FNN-680] Downgrade to ""Free""","downgrade to ""Free""","downgrade to ""Free""",""
"passed","Fri Dec 23 04:16:54 UTC 2022","Fri Dec 23 04:16:58 UTC 2022","4124","","[FNN-588] Post project without account Negative","","[FNN-588] Post project without account Negative","post project without an account passwords matching","post project without an account passwords matching",""
"passed","Fri Dec 23 04:33:18 UTC 2022","Fri Dec 23 04:33:33 UTC 2022","14543","","[FNN-684] Create profile Negative","","[FNN-684] Create profile Negative","create profile without required fields","create profile without required fields",""
"passed","Fri Dec 23 04:56:25 UTC 2022","Fri Dec 23 04:58:14 UTC 2022","108556","","[FNN-625] Search Freelancers","","[FNN-625] Search Freelancers","search freelancers by Sector","search freelancers by Sector",""
"passed","Fri Dec 23 04:16:28 UTC 2022","Fri Dec 23 04:16:33 UTC 2022","4366","","[FNN-588] Post project without account Negative","","[FNN-588] Post project without account Negative","post project without an account phone number","post project without an account phone number",""
"passed","Fri Dec 23 04:09:50 UTC 2022","Fri Dec 23 04:09:51 UTC 2022","1321","","[FNN-655] Reset password Negative","","[FNN-655] Reset password Negative","reset password with wrong email","reset password with wrong email",""
"passed","Fri Dec 23 04:31:27 UTC 2022","Fri Dec 23 04:31:29 UTC 2022","1897","","[FNN-620] Invite manually via email and sms Negative","","[FNN-620] Invite manually via email and sms Negative","invite manually via email without last name","invite manually via email without last name",""
"passed","Fri Dec 23 04:31:29 UTC 2022","Fri Dec 23 04:31:40 UTC 2022","11272","","[FNN-620] Invite manually via email and sms Negative","","[FNN-620] Invite manually via email and sms Negative","invite manually via email empty data","invite manually via email empty data",""
"passed","Fri Dec 23 04:05:03 UTC 2022","Fri Dec 23 04:05:12 UTC 2022","9520","","[FNN-574] LogIn from the page footer Negative","","[FNN-574] LogIn from the page footer Negative","login from the page footer with an empty data","login from the page footer with an empty data",""
"passed","Fri Dec 23 04:10:50 UTC 2022","Fri Dec 23 04:11:12 UTC 2022","21862","","[FNN-668] Edit account details Negative","","[FNN-668] Edit account details Negative","edit account details with invalid phone number","edit account details with invalid phone number",""
"passed","Fri Dec 23 04:25:42 UTC 2022","Fri Dec 23 04:25:58 UTC 2022","15688","","[FNN-678] Delete account without subscription","","[FNN-678] Delete account without subscription","delete account without subscription","delete account without subscription",""
"passed","Fri Dec 23 04:03:41 UTC 2022","Fri Dec 23 04:03:46 UTC 2022","4946","","[FNN-577] Subscribe Negative","","[FNN-577] Subscribe Negative","subscribe without a sector","subscribe without a sector",""
"passed","Fri Dec 23 04:11:14 UTC 2022","Fri Dec 23 04:12:21 UTC 2022","66591","","[FNN-669] Edit account details Positive","","[FNN-669] Edit account details Positive","edit account details with valid information","edit account details with valid information",""
"passed","Fri Dec 23 04:14:34 UTC 2022","Fri Dec 23 04:15:07 UTC 2022","33625","","[FNN-698] Confirm phone number","","[FNN-698] Confirm phone number","confirm phone number with valid code","confirm phone number with valid code",""
"passed","Fri Dec 23 04:04:58 UTC 2022","Fri Dec 23 04:05:00 UTC 2022","1884","","[FNN-574] LogIn from the page footer Negative","","[FNN-574] LogIn from the page footer Negative","login from the page footer with invalid credentials","login from the page footer with invalid credentials",""
"passed","Fri Dec 23 04:03:46 UTC 2022","Fri Dec 23 04:03:51 UTC 2022","4594","","[FNN-577] Subscribe Negative","","[FNN-577] Subscribe Negative","subscribe without a first name","subscribe without a first name",""
"passed","Fri Dec 23 04:13:51 UTC 2022","Fri Dec 23 04:14:32 UTC 2022","41013","","[FNN-695] Add portfolio","","[FNN-695] Add portfolio","Add portfolio","Add portfolio",""
"passed","Fri Dec 23 04:04:05 UTC 2022","Fri Dec 23 04:04:10 UTC 2022","4821","","[FNN-577] Subscribe Negative","","[FNN-577] Subscribe Negative","subscribe with a short password","subscribe with a short password",""
"passed","Fri Dec 23 04:49:40 UTC 2022","Fri Dec 23 04:49:47 UTC 2022","7216","","[FNN-649] Post project with account Negative","","[FNN-649] Post project with account Negative","post project without End","post project without End",""
"passed","Fri Dec 23 04:16:20 UTC 2022","Fri Dec 23 04:16:24 UTC 2022","4047","","[FNN-588] Post project without account Negative","","[FNN-588] Post project without account Negative","post project without an account last name","post project without an account last name",""
"passed","Fri Dec 23 04:05:53 UTC 2022","Fri Dec 23 04:06:03 UTC 2022","9441","","[FNN-563] LogIn from the page header Negative","","[FNN-563] LogIn from the page header Negative","login from the page header with an empty data","login from the page header with an empty data",""
"passed","Fri Dec 23 04:16:37 UTC 2022","Fri Dec 23 04:16:41 UTC 2022","4008","","[FNN-588] Post project without account Negative","","[FNN-588] Post project without account Negative","post project without an account repeated password","post project without an account repeated password",""
"broken","Fri Dec 23 04:50:04 UTC 2022","Fri Dec 23 04:51:51 UTC 2022","107513","","[FNN-650] Post project without account Positive","","[FNN-650] Post project without account Positive","""after all"" hook for [FNN-650] Post project without account Positive","""after all"" hook for [FNN-650] Post project without account Positive",""
"passed","Fri Dec 23 04:16:24 UTC 2022","Fri Dec 23 04:16:28 UTC 2022","4286","","[FNN-588] Post project without account Negative","","[FNN-588] Post project without account Negative","post project without an account email","post project without an account email",""
"passed","Fri Dec 23 04:09:22 UTC 2022","Fri Dec 23 04:09:44 UTC 2022","21779","","[FNN-659] Upgrade account Negative","","[FNN-659] Upgrade account Negative","upgrade account to Standard 1 month. Refuse","upgrade account to Standard 1 month. Refuse",""
"passed","Fri Dec 23 04:10:27 UTC 2022","Fri Dec 23 04:10:50 UTC 2022","22948","","[FNN-668] Edit account details Negative","","[FNN-668] Edit account details Negative","edit account details without required fields","edit account details without required fields",""
"passed","Fri Dec 23 04:08:26 UTC 2022","Fri Dec 23 04:08:54 UTC 2022","28745","","[FNN-659] Upgrade account Negative","","[FNN-659] Upgrade account Negative","upgrade account to Standard 1 month without required fields","upgrade account to Standard 1 month without required fields",""
"passed","Fri Dec 23 04:32:42 UTC 2022","Fri Dec 23 04:33:17 UTC 2022","34961","","[FNN-683] Create profile Positive","","[FNN-683] Create profile Positive","create profile with valid information","create profile with valid information",""
"passed","Fri Dec 23 04:47:02 UTC 2022","Fri Dec 23 04:47:55 UTC 2022","52458","","[FNN-658] Upgrade account Positive","","[FNN-658] Upgrade account Positive","upgrade account to Enterprise 1 month","upgrade account to Enterprise 1 month",""
"broken","Fri Dec 23 05:02:26 UTC 2022","Fri Dec 23 05:04:30 UTC 2022","124772","","[FNN-661] Send interest","","[FNN-661] Send interest","""before all"" hook for [FNN-661] Send interest","""before all"" hook for [FNN-661] Send interest",""
"passed","Fri Dec 23 04:22:59 UTC 2022","Fri Dec 23 04:23:09 UTC 2022","10016","","[FNN-675] Change password Negative","","[FNN-675] Change password Negative","change password with short new password","change password with short new password",""
"passed","Fri Dec 23 04:23:41 UTC 2022","Fri Dec 23 04:24:34 UTC 2022","53098","","[FNN-676] Change profile settings","","[FNN-676] Change profile settings","it's not possible to contact me through the contact button on my profile","it's not possible to contact me through the contact button on my profile",""
"skipped","Fri Dec 23 04:30:55 UTC 2022","Fri Dec 23 04:30:55 UTC 2022","0","","[FNN-619] Invite manually via email and sms Positive","","[FNN-619] Invite manually via email and sms Positive","invite manually via email with valid recipient data and with message","invite manually via email with valid recipient data and with message",""
"passed","Fri Dec 23 04:49:16 UTC 2022","Fri Dec 23 04:49:23 UTC 2022","6747","","[FNN-649] Post project with account Negative","","[FNN-649] Post project with account Negative","post project without Budget","post project without Budget",""
"failed","Fri Dec 23 04:48:46 UTC 2022","Fri Dec 23 04:48:59 UTC 2022","13462","","[FNN-649] Post project with account Negative","","[FNN-649] Post project with account Negative","post project with short Title","post project with short Title",""
"passed","Fri Dec 23 04:16:49 UTC 2022","Fri Dec 23 04:16:54 UTC 2022","4315","","[FNN-588] Post project without account Negative","","[FNN-588] Post project without account Negative","post project with a short account password and a repeat password","post project with a short account password and a repeat password",""
"passed","Fri Dec 23 04:31:18 UTC 2022","Fri Dec 23 04:31:20 UTC 2022","2014","","[FNN-620] Invite manually via email and sms Negative","","[FNN-620] Invite manually via email and sms Negative","invite manually via email with wrong email format","invite manually via email with wrong email format",""
"failed","Fri Dec 23 04:49:02 UTC 2022","Fri Dec 23 04:49:16 UTC 2022","13694","","[FNN-649] Post project with account Negative","","[FNN-649] Post project with account Negative","post project with empty step 2","post project with empty step 2",""
"passed","Fri Dec 23 04:21:19 UTC 2022","Fri Dec 23 04:21:37 UTC 2022","17743","","[FNN-672] Change email address Negative","","[FNN-672] Change email address Negative","change email address with wrong password","change email address with wrong password",""
"passed","Fri Dec 23 04:05:14 UTC 2022","Fri Dec 23 04:05:36 UTC 2022","22096","","[FNN-648] LogIn from the page footer Positive","","[FNN-648] LogIn from the page footer Positive","login with valid credentials","login with valid credentials",""
"passed","Fri Dec 23 04:45:23 UTC 2022","Fri Dec 23 04:46:08 UTC 2022","45023","","[FNN-658] Upgrade account Positive","","[FNN-658] Upgrade account Positive","upgrade account to Premium 1 month","upgrade account to Premium 1 month",""
"passed","Fri Dec 23 04:31:22 UTC 2022","Fri Dec 23 04:31:25 UTC 2022","2782","","[FNN-620] Invite manually via email and sms Negative","","[FNN-620] Invite manually via email and sms Negative","invite manually via sms with invalid phone number","invite manually via sms with invalid phone number",""
"broken","Fri Dec 23 05:04:30 UTC 2022","Fri Dec 23 05:05:18 UTC 2022","47286","","[FNN-661] Send interest","","[FNN-661] Send interest","""after all"" hook for [FNN-661] Send interest","""after all"" hook for [FNN-661] Send interest",""
"passed","Fri Dec 23 04:05:01 UTC 2022","Fri Dec 23 04:05:03 UTC 2022","1212","","[FNN-574] LogIn from the page footer Negative","","[FNN-574] LogIn from the page footer Negative","login from the page footer without a password","login from the page footer without a password",""
"passed","Fri Dec 23 04:16:16 UTC 2022","Fri Dec 23 04:16:20 UTC 2022","4028","","[FNN-588] Post project without account Negative","","[FNN-588] Post project without account Negative","post project without an account first name","post project without an account first name",""
"passed","Fri Dec 23 04:22:39 UTC 2022","Fri Dec 23 04:22:59 UTC 2022","19944","","[FNN-675] Change password Negative","","[FNN-675] Change password Negative","change password without new and repeat new password","change password without new and repeat new password",""
"skipped","Fri Dec 23 04:30:44 UTC 2022","Fri Dec 23 04:30:55 UTC 2022","10408","","[FNN-619] Invite manually via email and sms Positive","","[FNN-619] Invite manually via email and sms Positive","invite manually via email with valid recipient data and without message","invite manually via email with valid recipient data and without message",""
"passed","Fri Dec 23 04:21:39 UTC 2022","Fri Dec 23 04:22:07 UTC 2022","28666","","[FNN-673] Confirm email address","","[FNN-673] Confirm email address","confirm email address","confirm email address",""
"broken","Fri Dec 23 04:54:07 UTC 2022","Fri Dec 23 04:55:25 UTC 2022","77688","","[FNN-568] Search projects","","[FNN-568] Search projects","""after all"" hook for [FNN-568] Search projects","""after all"" hook for [FNN-568] Search projects",""
"broken","Fri Dec 23 04:07:23 UTC 2022","Fri Dec 23 04:08:24 UTC 2022","60777","","[FNN-658] Upgrade account Positive","","[FNN-658] Upgrade account Positive","""after each"" hook for [FNN-658] Upgrade account Positive","""after each"" hook for [FNN-658] Upgrade account Positive",""
"passed","Fri Dec 23 04:05:00 UTC 2022","Fri Dec 23 04:05:01 UTC 2022","1187","","[FNN-574] LogIn from the page footer Negative","","[FNN-574] LogIn from the page footer Negative","login from the page footer with a wrong email format","login from the page footer with a wrong email format",""
"passed","Fri Dec 23 04:16:41 UTC 2022","Fri Dec 23 04:16:45 UTC 2022","4390","","[FNN-588] Post project without account Negative","","[FNN-588] Post project without account Negative","post project with a wrong account email","post project with a wrong account email",""
"passed","Fri Dec 23 04:31:20 UTC 2022","Fri Dec 23 04:31:22 UTC 2022","2653","","[FNN-620] Invite manually via email and sms Negative","","[FNN-620] Invite manually via email and sms Negative","invite manually via sms without phone number","invite manually via sms without phone number",""
"broken","Fri Dec 23 04:58:14 UTC 2022","Fri Dec 23 05:01:46 UTC 2022","211721","","[FNN-625] Search Freelancers","","[FNN-625] Search Freelancers","search freelancers by Location","search freelancers by Location",""
"passed","Fri Dec 23 04:23:09 UTC 2022","Fri Dec 23 04:23:19 UTC 2022","9625","","[FNN-675] Change password Negative","","[FNN-675] Change password Negative","change password with invalid repeat new password","change password with invalid repeat new password",""
"passed","Fri Dec 23 04:25:59 UTC 2022","Fri Dec 23 04:26:29 UTC 2022","29904","","[FNN-679] Delete account with subscription","","[FNN-679] Delete account with subscription","delete account with subscription","delete account with subscription",""
"passed","Fri Dec 23 05:01:53 UTC 2022","Fri Dec 23 05:02:23 UTC 2022","30870","","[FNN-625] Search Freelancers","","[FNN-625] Search Freelancers","search freelancers by Skills","search freelancers by Skills",""
"passed","Fri Dec 23 04:04:14 UTC 2022","Fri Dec 23 04:04:19 UTC 2022","4702","","[FNN-577] Subscribe Negative","","[FNN-577] Subscribe Negative","subscribe without an agreeing to the Terms and Conditions","subscribe without an agreeing to the Terms and Conditions",""
"passed","Fri Dec 23 04:08:54 UTC 2022","Fri Dec 23 04:09:09 UTC 2022","14309","","[FNN-659] Upgrade account Negative","","[FNN-659] Upgrade account Negative","upgrade account to Standard 1 month. Cancelled","upgrade account to Standard 1 month. Cancelled",""
"passed","Fri Dec 23 04:16:10 UTC 2022","Fri Dec 23 04:16:16 UTC 2022","5859","","[FNN-588] Post project without account Negative","","[FNN-588] Post project without account Negative","post project with an empty account data","post project with an empty account data",""
"passed","Fri Dec 23 04:21:13 UTC 2022","Fri Dec 23 04:21:19 UTC 2022","5677","","[FNN-672] Change email address Negative","","[FNN-672] Change email address Negative","change email address with invalid email format","change email address with invalid email format",""
"passed","Fri Dec 23 04:13:29 UTC 2022","Fri Dec 23 04:13:35 UTC 2022","6201","","[FNN-690] Edit my resume Positive","","[FNN-690] Edit my resume Positive","add Language","add Language",""
"skipped","Fri Dec 23 04:06:50 UTC 2022","Fri Dec 23 04:07:21 UTC 2022","30738","","[FNN-686] Keep me logged in","","[FNN-686] Keep me logged in","keep me logged in","keep me logged in",""
"passed","Fri Dec 23 04:12:49 UTC 2022","Fri Dec 23 04:12:58 UTC 2022","8469","","[FNN-690] Edit my resume Positive","","[FNN-690] Edit my resume Positive","add Experience","add Experience",""
"passed","Fri Dec 23 04:04:10 UTC 2022","Fri Dec 23 04:04:14 UTC 2022","4718","","[FNN-577] Subscribe Negative","","[FNN-577] Subscribe Negative","subscribe with an invalid repeat password","subscribe with an invalid repeat password",""
"passed","Fri Dec 23 04:20:55 UTC 2022","Fri Dec 23 04:21:13 UTC 2022","18855","","[FNN-672] Change email address Negative","","[FNN-672] Change email address Negative","change email address without password","change email address without password",""
"passed","Fri Dec 23 04:31:06 UTC 2022","Fri Dec 23 04:31:18 UTC 2022","11876","","[FNN-620] Invite manually via email and sms Negative","","[FNN-620] Invite manually via email and sms Negative","invite manually via email without email","invite manually via email without email",""
"passed","Fri Dec 23 04:16:45 UTC 2022","Fri Dec 23 04:16:49 UTC 2022","4134","","[FNN-588] Post project without account Negative","","[FNN-588] Post project without account Negative","post project with a wrong account phone number","post project with a wrong account phone number",""
"passed","Fri Dec 23 04:12:58 UTC 2022","Fri Dec 23 04:13:06 UTC 2022","7841","","[FNN-690] Edit my resume Positive","","[FNN-690] Edit my resume Positive","add Education","add Education",""
"passed","Fri Dec 23 04:05:38 UTC 2022","Fri Dec 23 04:05:50 UTC 2022","11677","","[FNN-563] LogIn from the page header Negative","","[FNN-563] LogIn from the page header Negative","login from the page header with a valid email and an invalid password","login from the page header with a valid email and an invalid password",""
"passed","Fri Dec 23 04:48:29 UTC 2022","Fri Dec 23 04:48:43 UTC 2022","13541","","[FNN-649] Post project with account Negative","","[FNN-649] Post project with account Negative","post project with empty step 1","post project with empty step 1",""
"passed","Fri Dec 23 04:09:45 UTC 2022","Fri Dec 23 04:09:50 UTC 2022","4525","","[FNN-655] Reset password Negative","","[FNN-655] Reset password Negative","reset password with empty data","reset password with empty data",""
"passed","Fri Dec 23 04:23:19 UTC 2022","Fri Dec 23 04:23:39 UTC 2022","19605","","[FNN-675] Change password Negative","","[FNN-675] Change password Negative","change password with invalid old password","change password with invalid old password",""
"passed","Fri Dec 23 04:05:52 UTC 2022","Fri Dec 23 04:05:53 UTC 2022","848","","[FNN-563] LogIn from the page header Negative","","[FNN-563] LogIn from the page header Negative","login from the page header without a password","login from the page header without a password",""
"passed","Fri Dec 23 04:13:35 UTC 2022","Fri Dec 23 04:13:49 UTC 2022","13962","","[FNN-690] Edit my resume Positive","","[FNN-690] Edit my resume Positive","check CV on the Profile page","check CV on the Profile page",""
"passed","Fri Dec 23 04:42:55 UTC 2022","Fri Dec 23 04:44:29 UTC 2022","94016","","[FNN-667] Send contact","","[FNN-667] Send contact","one user should send a contact to another user","one user should send a contact to another user",""
"skipped","Fri Dec 23 04:30:55 UTC 2022","Fri Dec 23 04:31:04 UTC 2022","9145","","[FNN-619] Invite manually via email and sms Positive","","[FNN-619] Invite manually via email and sms Positive","invite manually via sms with valid recipient data","invite manually via sms with valid recipient data",""
"passed","Fri Dec 23 04:46:08 UTC 2022","Fri Dec 23 04:47:02 UTC 2022","54552","","[FNN-658] Upgrade account Positive","","[FNN-658] Upgrade account Positive","upgrade account to Business 1 month","upgrade account to Business 1 month",""
"passed","Fri Dec 23 04:12:23 UTC 2022","Fri Dec 23 04:12:49 UTC 2022","26449","","[FNN-690] Edit my resume Positive","","[FNN-690] Edit my resume Positive","add CV","add CV",""
"passed","Fri Dec 23 04:44:31 UTC 2022","Fri Dec 23 04:45:23 UTC 2022","51603","","[FNN-658] Upgrade account Positive","","[FNN-658] Upgrade account Positive","upgrade account to Standaard 1 month","upgrade account to Standaard 1 month",""
"passed","Fri Dec 23 04:20:25 UTC 2022","Fri Dec 23 04:20:53 UTC 2022","28279","","[FNN-671] Change email address Positive","","[FNN-671] Change email address Positive","change email address with the valid cred.","change email address with the valid cred.",""
"passed","Fri Dec 23 04:13:06 UTC 2022","Fri Dec 23 04:13:13 UTC 2022","7533","","[FNN-690] Edit my resume Positive","","[FNN-690] Edit my resume Positive","add Certificate","add Certificate",""
"passed","Fri Dec 23 04:15:09 UTC 2022","Fri Dec 23 04:16:08 UTC 2022","58977","","[FNN-587] Post project with account Positive","","[FNN-587] Post project with account Positive","post project with an account and a valid project information","post project with an account and a valid project information",""
"passed","Fri Dec 23 04:33:33 UTC 2022","Fri Dec 23 04:33:50 UTC 2022","16840","","[FNN-684] Create profile Negative","","[FNN-684] Create profile Negative","create profile with wrong website","create profile with wrong website",""
