"Status","Start Time","Stop Time","Duration in ms","Parent Suite","Suite","Sub Suite","Test Class","Test Method","Name","Description"
"passed","Fri Dec 23 04:04:19 UTC 2022","Fri Dec 23 04:04:21 UTC 2022","1712","","[FNN-577] Subscribe Negative","","[FNN-577] Subscribe Negative","subscribe with an empty data","subscribe with an empty data",""
"passed","Fri Dec 23 05:01:46 UTC 2022","Fri Dec 23 05:01:53 UTC 2022","7014","","[FNN-625] Search Freelancers","","[FNN-625] Search Freelancers","search freelancers by Hourly Rate","search freelancers by Hourly Rate",""
"passed","Fri Dec 23 04:04:46 UTC 2022","Fri Dec 23 04:04:58 UTC 2022","12580","","[FNN-574] LogIn from the page footer Negative","","[FNN-574] LogIn from the page footer Negative","login from the page footer with a valid email and an invalid password","login from the page footer with a valid email and an invalid password",""
"passed","Fri Dec 23 04:06:04 UTC 2022","Fri Dec 23 04:06:25 UTC 2022","20595","","[FNN-647] LogIn from the page header Positive","","[FNN-647] LogIn from the page header Positive","login page header page with valid credentials","login page header page with valid credentials",""
"passed","Fri Dec 23 04:22:09 UTC 2022","Fri Dec 23 04:22:38 UTC 2022","28569","","[FNN-674] Change password Positive","","[FNN-674] Change password Positive","change password with the valid cred.","change password with the valid cred.",""
"passed","Fri Dec 23 04:48:43 UTC 2022","Fri Dec 23 04:48:46 UTC 2022","2993","","[FNN-649] Post project with account Negative","","[FNN-649] Post project with account Negative","post project without Title","post project without Title",""
"failed","Fri Dec 23 04:55:27 UTC 2022","Fri Dec 23 04:56:23 UTC 2022","56249","","[FNN-664] Invite freelancer","","[FNN-664] Invite freelancer","invite freelancer","invite freelancer",""
"passed","Fri Dec 23 04:04:00 UTC 2022","Fri Dec 23 04:04:05 UTC 2022","4764","","[FNN-577] Subscribe Negative","","[FNN-577] Subscribe Negative","subscribe with wrong a phone number","subscribe with wrong a phone number",""
"passed","Fri Dec 23 04:13:13 UTC 2022","Fri Dec 23 04:13:18 UTC 2022","5184","","[FNN-690] Edit my resume Positive","","[FNN-690] Edit my resume Positive","add Motivation","add Motivation",""
"passed","Fri Dec 23 04:49:23 UTC 2022","Fri Dec 23 04:49:28 UTC 2022","5370","","[FNN-649] Post project with account Negative","","[FNN-649] Post project with account Negative","post project without Work on location","post project without Work on location",""
"passed","Fri Dec 23 04:13:18 UTC 2022","Fri Dec 23 04:13:24 UTC 2022","5159","","[FNN-690] Edit my resume Positive","","[FNN-690] Edit my resume Positive","add Qualities","add Qualities",""
