"Status","Start Time","Stop Time","Duration in ms","Parent Suite","Suite","Sub Suite","Test Class","Test Method","Name","Description"
"passed","Fri Dec 16 08:14:00 UTC 2022","Fri Dec 16 08:14:02 UTC 2022","2369","","[FNN-649] Post project with account Negative","","[FNN-649] Post project with account Negative","post project without Title","post project without Title",""
"passed","Fri Dec 16 07:37:58 UTC 2022","Fri Dec 16 07:38:07 UTC 2022","9257","","[FNN-574] LogIn from the page footer Negative","","[FNN-574] LogIn from the page footer Negative","login from the page footer with empty data","login from the page footer with empty data",""
"passed","Fri Dec 16 08:01:54 UTC 2022","Fri Dec 16 08:01:57 UTC 2022","3181","","[FNN-620] Invite manually via email and sms Negative","","[FNN-620] Invite manually via email and sms Negative","invite manually via sms with invalid phone number","invite manually via sms with invalid phone number",""
"passed","Fri Dec 16 07:59:28 UTC 2022","Fri Dec 16 07:59:31 UTC 2022","2602","","[FNN-568] Search projects","","[FNN-568] Search projects","should filter out the projects by Fixed price","should filter out the projects by Fixed price",""
"passed","Fri Dec 16 08:01:36 UTC 2022","Fri Dec 16 08:01:49 UTC 2022","12801","","[FNN-620] Invite manually via email and sms Negative","","[FNN-620] Invite manually via email and sms Negative","invite manually via email without email","invite manually via email without email",""
"passed","Fri Dec 16 07:52:10 UTC 2022","Fri Dec 16 07:52:35 UTC 2022","25875","","[FNN-671] Change email address Positive","","[FNN-671] Change email address Positive","change email address with the valid cred.","change email address with the valid cred.",""
"passed","Fri Dec 16 07:43:37 UTC 2022","Fri Dec 16 07:44:00 UTC 2022","22707","","[FNN-668] Edit account details Negative","","[FNN-668] Edit account details Negative","edit account details without required fields","edit account details without required fields",""
"failed","Fri Dec 16 08:11:30 UTC 2022","Fri Dec 16 08:12:04 UTC 2022","33698","","[FNN-656] Reset password Positive","","[FNN-656] Reset password Positive","reset password with valid cred.","reset password with valid cred.",""
"passed","Fri Dec 16 07:42:13 UTC 2022","Fri Dec 16 07:42:26 UTC 2022","12829","","[FNN-659] Upgrade account Negative","","[FNN-659] Upgrade account Negative","upgrade account to Standard 1 month. Cancelled","upgrade account to Standard 1 month. Cancelled",""
"passed","Fri Dec 16 07:42:26 UTC 2022","Fri Dec 16 07:42:37 UTC 2022","11600","","[FNN-659] Upgrade account Negative","","[FNN-659] Upgrade account Negative","upgrade account to Standard 1 month. Pending","upgrade account to Standard 1 month. Pending",""
"passed","Fri Dec 16 07:37:15 UTC 2022","Fri Dec 16 07:37:17 UTC 2022","1876","","[FNN-577] Subscribe Negative","","[FNN-577] Subscribe Negative","subscribe with empty data","subscribe with empty data",""
